tag,brand_No,product_No,us_price,brand_name_chn,brand_name_eng,product_name,img_url
免税独家,16435,10002306288,$13,伊蒂之屋,ETUDE,DRAWING EYE BROW SET 新款双头眉笔套装 免税店专售,http://static.lottedfs.cn/prod/prd-img/88/62/30/02/00/01/10002306288_07.jpg
,16435,20000597145,$17,伊蒂之屋,ETUDE,PLAY COLOR EYES BAKEHOUSE 眼影盘,http://static.lottedfs.cn/prod/prd-img/14/94/71/00/00/02/20000719414_1.png
,16435,20000600846,$16,伊蒂之屋,ETUDE,PLAY COLOR EYES MAPLE ROAD 眼影,http://static.lottedfs.cn/prod/prd-img/42/74/72/00/00/02/20000727442_2.jpg
,16435,10001938273,$5,伊蒂之屋,ETUDE,DR MASCARA FIXER 魔幻纤长 睫毛膏定型乳,http://static.lottedfs.cn/prod/prd-img/98/80/93/01/00/01/10001938098_01.jpg
,16435,10001452138,$7,伊蒂之屋,ETUDE,DRAWING SHOW BRUSH LINER 伊蒂之屋眼线液 BK801 BLACKHEART BLACK,http://static.lottedfs.cn/prod/prd-img/38/21/45/01/00/01/10001452138_6.jpg
,16435,20000525407,$2,伊蒂之屋,ETUDE,TROPICAL PINEAPPLE SHOWER BALL 浴花,http://static.lottedfs.cn/prod/prd-img/21/67/49/00/00/02/20000496721_1.jpg
,16435,10002318982,$5,伊蒂之屋,ETUDE,伊蒂之屋清纯自然染眉膏,http://static.lottedfs.cn/prod/prd-img/68/19/32/02/00/01/10002321968_1.png
,16435,20000166456,$9,伊蒂之屋,ETUDE,LASH PERM CURL FIX MASCARA  睫毛膏,http://static.lottedfs.cn/prod/prd-img/88/88/16/00/00/02/20000168888_1.jpg
,16435,20000466849,$5,伊蒂之屋,ETUDE,DRAWING EYEBROW PROOF GEL PENCIL 眉笔,http://static.lottedfs.cn/prod/prd-img/62/12/51/00/00/02/20000511262_2.jpg
,16435,20000475964,$10,伊蒂之屋,ETUDE,PLAY 101 STICK CONTOUR DUO NEW 美妆棒,http://static.lottedfs.cn/prod/prd-img/74/57/52/00/00/02/20000525774_4.jpg
,16435,20000588400,$3,伊蒂之屋,ETUDE,MY BEAUTY TOOL BRUSH 211 AUTO LIP 唇刷,http://static.lottedfs.cn/prod/prd-img/90/39/70/00/00/02/20000703990_1.png
,16435,20000625278,$16,伊蒂之屋,ETUDE,伊蒂之屋玩转色彩多色眼影盘 寒冷月夜,http://static.lottedfs.cn/prod/prd-img/31/00/77/00/00/02/20000770031_10.jpg
,16435,10002332561,$3,伊蒂之屋,ETUDE,LIP AND EYE REMOVER 眼唇卸妆液 100ml,http://static.lottedfs.cn/prod/prd-img/61/25/33/02/00/01/10002332561_3.jpg
,16435,20000542456,$13,伊蒂之屋,ETUDE,DR MASCARA FIXER FOR PERFECT LASH 3 PIECES DUTY FREE SET,http://static.lottedfs.cn/prod/prd-img/72/14/63/00/00/02/20000631472_1.jpg
,16435,20000542542,$3,伊蒂之屋,ETUDE,MY BEAUTY TOOL LOVELY ETTI HAIR BAND AD 束发带,http://static.lottedfs.cn/prod/prd-img/97/15/63/00/00/02/20000631597_2.jpg
,16435,10002361589,$9,伊蒂之屋,ETUDE,伊蒂之屋恋恋裸妆四色眼影,http://static.lottedfs.cn/prod/prd-img/89/15/36/02/00/01/10002361589_1.png
,16435,20000403132,$3,伊蒂之屋,ETUDE,MISSING YOU HANDCREAM PANDA 护手霜,http://static.lottedfs.cn/prod/prd-img/96/99/41/00/00/02/20000419996_1.png
,16435,10001815088,$7,伊蒂之屋,ETUDE,DRAWING SHOW BRUSH LINER 眼线液笔 BR401 GRUDGE BROWN,http://static.lottedfs.cn/prod/prd-img/88/50/81/01/00/01/10001815088_01.jpg
,16435,20000391753,$6,伊蒂之屋,ETUDE,COLOR MY BROWS JUMBO   眉毛膏大容量 4号 NATURAL BROWN,http://static.lottedfs.cn/prod/prd-img/29/71/40/00/00/02/20000407129_1.png
,16435,20000556447,$3,伊蒂之屋,ETUDE,LOOK AT MY EYES CAFE 眼影,http://static.lottedfs.cn/prod/prd-img/23/55/65/00/00/02/20000655523_3.png
,16435,20000557255,$3,伊蒂之屋,ETUDE,DEAR DARLING WATER GEL TINT NEW 染唇液,http://static.lottedfs.cn/prod/prd-img/57/70/65/00/00/02/20000657057_1.jpg
,16435,20000330918,$6,伊蒂之屋,ETUDE,LIP AND EYE REMOVER JUMBO SIZE  眼唇卸妆液 250ml,http://static.lottedfs.cn/prod/prd-img/30/95/33/00/00/02/20000339530_1.jpg
,16435,20000497481,$4,伊蒂之屋,ETUDE,PLAY 101 STICK CONTOUR DUO PUFF BOTTLE 粉扑,http://static.lottedfs.cn/prod/prd-img/97/10/56/00/00/02/20000561097_1.png
,16435,20000403141,$3,伊蒂之屋,ETUDE,MISSING YOU HANDCREAM  FAIRY PENGUIN 护手霜,http://static.lottedfs.cn/prod/prd-img/87/00/42/00/00/02/20000420087_1.png
,16435,10003135839,$6,伊蒂之屋,ETUDE,SUPER SLIM PROOF PENCIL LINER  防水眼线笔,http://static.lottedfs.cn/prod/prd-img/49/58/13/03/00/01/10003135849_01.jpg
畅销,16435,20000450234,$5,伊蒂之屋,ETUDE,LOVELY COOKIE BLUSHER NEW  甜美曲奇胭脂 新款,http://static.lottedfs.cn/prod/prd-img/30/92/48/00/00/02/20000489230_1.jpg
,16435,10003135857,$9,伊蒂之屋,ETUDE,SOON JUNG PH 6 5 WHIP CLEANSER   弱酸洁面泡沫 150ml,http://static.lottedfs.cn/prod/prd-img/57/58/13/03/00/01/10003135857_1.jpg
,16435,10002072021,$11,伊蒂之屋,ETUDE,REAL ART CLEANSING OIL MOISTURE NEW 卸妆油,http://static.lottedfs.cn/prod/prd-img/21/20/07/02/00/01/10002072021_01.jpg
,16435,20000403142,$3,伊蒂之屋,ETUDE,MISSING YOU HANDCREAM  HARP SEAL 护手霜,http://static.lottedfs.cn/prod/prd-img/88/00/42/00/00/02/20000420088_1.png
,16435,20000450214,$6,伊蒂之屋,ETUDE,BIG COVER MINI BLENDER KIT PRO  海绵粉扑套装,http://static.lottedfs.cn/prod/prd-img/70/91/48/00/00/02/20000489170_1.jpg
,16435,20000541558,$25,伊蒂之屋,ETUDE,LASH PERM CURL FIX MASCARA 睫毛膏3件套 1号 BLACK 免税店专售,http://static.lottedfs.cn/prod/prd-img/66/00/63/00/00/02/20000630066_1.jpg
畅销,16435,20000533044,$5,伊蒂之屋,ETUDE,BLOSSOM PICNIC AIR MOUSSE EYES 眼影,http://static.lottedfs.cn/prod/prd-img/62/39/61/00/00/02/20000613962_1.jpg
畅销,16435,10001938105,$7,伊蒂之屋,ETUDE,DEAR GIRLS CUTE EYES MAKER 卧蚕笔,http://static.lottedfs.cn/prod/prd-img/05/81/93/01/00/01/10001938105_01.jpg
,16435,20000433388,$5,伊蒂之屋,ETUDE,PROOF 10 GEL WATERPROOF PENCIL NEW  凝胶防水眼线笔  2号 DARK CACAO,http://static.lottedfs.cn/prod/prd-img/12/09/46/00/00/02/20000460912_2.png
,16435,20000391749,$6,伊蒂之屋,ETUDE,COLOR MY BROWS JUMBO  眉毛膏大容量 1号 RICH BROWN,http://static.lottedfs.cn/prod/prd-img/25/71/40/00/00/02/20000407125_1.png
畅销,16435,20000446531,$102,伊蒂之屋,ETUDE,PLAY COLOR EYES JUICE BAR  玩转色彩多色眼影盘 6+1,http://static.lottedfs.cn/prod/prd-img/66/37/48/00/00/02/20000483766_1.JPG
畅销,16435,20000374157,$9,伊蒂之屋,ETUDE,PLAY 101 CONTOR DUO  高光阴影笔,http://static.lottedfs.cn/prod/prd-img/81/56/38/00/00/02/20000385681_5.jpg
,16435,10002072017,$14,伊蒂之屋,ETUDE,OH HAPPY DAY HAND BOUQUET HAND CREAM COLLECTION  护手霜套装,http://static.lottedfs.cn/prod/prd-img/17/20/07/02/00/01/10002072017_8.jpg
,16435,20000615428,$15,伊蒂之屋,ETUDE,MOISTFULL COLLAGEN CREAM NEW 面霜,http://static.lottedfs.cn/prod/prd-img/42/55/75/00/00/02/20000755542_1.png
,16435,20000549148,$3,伊蒂之屋,ETUDE,DRAWING EYE BROW HB HARD PENCIL 眉笔,http://static.lottedfs.cn/prod/prd-img/56/25/64/00/00/02/20000642556_1.jpg
,16435,20000432929,$9,伊蒂之屋,ETUDE,UV DOUBLE CUT REFRESHING SUN GEL 防晒啫喱,http://static.lottedfs.cn/prod/prd-img/04/03/46/00/00/02/20000460304_1.jpg
,16435,10003135864,$10,伊蒂之屋,ETUDE,SOON JUNG PH 5 5 RELIEF TONE 弱酸性护肤水 180ml,http://static.lottedfs.cn/prod/prd-img/64/58/13/03/00/01/10003135864_1.jpg
,16435,10003095156,$12,伊蒂之屋,ETUDE,伊蒂之屋晶妍亮采修颜液,http://static.lottedfs.cn/prod/prd-img/68/51/09/03/00/01/10003095168_1.jpg
,16435,20000520985,$40,伊蒂之屋,ETUDE,PLAY 101 CONTOUR DUO 5 PIECES DUTY FREE SET 美妆棒 5件免税套装,http://static.lottedfs.cn/prod/prd-img/80/42/59/00/00/02/20000594280_1.jpg
,16435,20000433382,$5,伊蒂之屋,ETUDE,PROOF 10 GEL WATERPROOF PENCIL NEW   凝胶防水眼线笔  1号 WATERPROOF BLACK,http://static.lottedfs.cn/prod/prd-img/93/08/46/00/00/02/20000460893_2.png
,16435,20000403143,$3,伊蒂之屋,ETUDE,MISSING YOU HANDCREAM  PINK DOLPHIN 护手霜,http://static.lottedfs.cn/prod/prd-img/89/00/42/00/00/02/20000420089_1.png
,16435,20000625284,$16,伊蒂之屋,ETUDE,伊蒂之屋玩转色彩多色眼影盘 郁金香节,http://static.lottedfs.cn/prod/prd-img/37/00/77/00/00/02/20000770037_10.jpg
,16435,20000523697,$6,伊蒂之屋,ETUDE,BAKING POWDER B.B DEEP CLEANSING FOAM AD 苏打粉清透卸妆洁面膏,http://static.lottedfs.cn/prod/prd-img/12/87/59/00/00/02/20000598712_1.jpg
畅销,16435,20000488449,$17,伊蒂之屋,ETUDE,PLAY COLOR EYES CAFFEINE HOLIC 眼影彩盘,http://static.lottedfs.cn/prod/prd-img/71/53/54/00/00/02/20000545371_1.PNG
,16435,20000523708,$17,伊蒂之屋,ETUDE,BAKING POWDER B.B DEEP CLEANSING FOAM 3 PIECES DUTY FREE SET AD 苏打粉清透卸妆洁面膏3件套装 免税店专售,http://static.lottedfs.cn/prod/prd-img/40/87/59/00/00/02/20000598740_1.jpg
畅销,16435,20000433391,$14,伊蒂之屋,ETUDE,TWINKLE MINI BRUSH SET 迷你化妆刷套装,http://static.lottedfs.cn/prod/prd-img/19/09/46/00/00/02/20000460919_5.jpg
,16435,20000442690,$3,伊蒂之屋,ETUDE,LOOK AT MY EYES 眼影,http://static.lottedfs.cn/prod/prd-img/58/56/65/00/00/02/20000655658_2.png
,16435,10003137373,$17,伊蒂之屋,ETUDE,伊蒂之屋樱花眼影彩盘,http://static.lottedfs.cn/prod/prd-img/73/73/13/03/00/01/10003137373_2.jpg
,16435,20000622389,$14,伊蒂之屋,ETUDE,RUDOLPH COMING TO TOWN PLAY COLOR EYES MINI 眼影盘,http://static.lottedfs.cn/prod/prd-img/15/59/76/00/00/02/20000765915_2.jpg
,16435,20000502342,$102,伊蒂之屋,ETUDE,PLAY COLOR EYES CAFFEINE HOLIC 玩转色彩多色眼影盘 6+1,http://static.lottedfs.cn/prod/prd-img/34/85/56/00/00/02/20000568534_1.JPG
,16435,20000450219,$23,伊蒂之屋,ETUDE,PLAY COLOR EYE PALETTE 眼影盘,http://static.lottedfs.cn/prod/prd-img/58/46/66/00/00/02/20000664658_2.jpg
,16435,10003082243,$9,伊蒂之屋,ETUDE,伊蒂之屋珍珠晶透柔润修颜乳,http://static.lottedfs.cn/prod/prd-img/43/22/08/03/00/01/10003082243_1.jpg
,16435,20000542474,$9,伊蒂之屋,ETUDE,OH MEYE LINE NO 1 BLACK 3 PIECES DUTY FREE SET,http://static.lottedfs.cn/prod/prd-img/99/14/63/00/00/02/20000631499_1.jpg
,16435,20000456936,$13,伊蒂之屋,ETUDE,SOON JUNG 5 PANTHENSOSIDE CICA BALM 修护面霜 40ml,http://static.lottedfs.cn/prod/prd-img/52/82/49/00/00/02/20000498252_1.jpg
,16435,20000563481,$21,伊蒂之屋,ETUDE,DRAWING SHOW BRUSH LINER DUTY FREE 3 PIECE SET 眼线液笔3件套,http://static.lottedfs.cn/prod/prd-img/50/70/66/00/00/02/20000667050_1.jpg
,16435,20000509132,$3,伊蒂之屋,ETUDE,AD NEW OH M EYE LINE 眼线液笔 1 BLACK,http://static.lottedfs.cn/prod/prd-img/01/09/04/00/00/01/10000040901_01.jpg
,16435,20000554317,$9,伊蒂之屋,ETUDE,BETTER LIPS 伊蒂之屋娇魅樱唇丝绒唇膏 TALK VELVET,http://static.lottedfs.cn/prod/prd-img/15/15/65/00/00/02/20000651515_3.jpg
,16435,20000450217,$20,伊蒂之屋,ETUDE,SOON JUNG SKINCARE SET  纯晶舒缓水乳套装,http://static.lottedfs.cn/prod/prd-img/76/91/48/00/00/02/20000489176_1.jpg
,16435,20000446538,$102,伊蒂之屋,ETUDE,PLAY COLOR EYES PEACH FARM  玩转色彩多色眼影盘 6+1,http://static.lottedfs.cn/prod/prd-img/76/37/48/00/00/02/20000483776_1.jpg
,16435,20000588371,$4,伊蒂之屋,ETUDE,MY BEAUTY TOOL BRUSH 眼影刷 312 SHADOW POINT,http://static.lottedfs.cn/prod/prd-img/28/39/70/00/00/02/20000703928_1.png
,16435,20000376597,$5,伊蒂之屋,ETUDE,SWEET CHERRY COLOR LIP BALM   彩色唇膏,http://static.lottedfs.cn/prod/prd-img/56/87/38/00/00/02/20000388756_1.png
,16435,20000615401,$23,伊蒂之屋,ETUDE,MOISTFULL COLLAGEN 2 PIECES SET NEW 基础护肤套装,http://static.lottedfs.cn/prod/prd-img/82/54/75/00/00/02/20000755482_1.png
,16435,20000588397,$5,伊蒂之屋,ETUDE,MY BEAUTY TOOL BRUSH 眼影刷 315 SHADOW BASE LARGE,http://static.lottedfs.cn/prod/prd-img/87/39/70/00/00/02/20000703987_1.png
,16435,20000456981,$11,伊蒂之屋,ETUDE,CC霜 SPF30/PA++,http://static.lottedfs.cn/prod/prd-img/18/83/49/00/00/02/20000498318_1.png
,16435,20000403811,$7,伊蒂之屋,ETUDE,TINT MY 4TIP BROW  染眉膏  4号 GREY BROWN,http://static.lottedfs.cn/prod/prd-img/06/09/42/00/00/02/20000420906_2.jpg
,16435,20000483940,$9,伊蒂之屋,ETUDE,SUNPRISE MILD AIRY FINISH 防晒霜,http://static.lottedfs.cn/prod/prd-img/25/80/53/00/00/02/20000538025_1.jpg
,16435,20000446528,$102,伊蒂之屋,ETUDE,PLAY COLOR EYES IN THE CAFE 眼影盘 6+1,http://static.lottedfs.cn/prod/prd-img/59/37/48/00/00/02/20000483759_1.JPG
,16435,20000620969,$9,伊蒂之屋,ETUDE,POWDER ROUGE TINT 染唇液,http://static.lottedfs.cn/prod/prd-img/18/33/76/00/00/02/20000763318_1.jpg
,16435,20000403760,$7,伊蒂之屋,ETUDE,NEW清纯自然染眉凝胶 1号 BROWN,http://static.lottedfs.cn/prod/prd-img/52/08/42/00/00/02/20000420852_1.jpg
,16435,20000391751,$6,伊蒂之屋,ETUDE,COLOR MY BROWS JUMBO  眉毛膏大容量 2号 LIGHT BROWN,http://static.lottedfs.cn/prod/prd-img/27/71/40/00/00/02/20000407127_4.jpg
,16435,20000502303,$18,伊蒂之屋,ETUDE,PLAY 101 STICK CONTOUR DUO NEW 2 PIECES SET 美妆棒2件套 免税店专售,http://static.lottedfs.cn/prod/prd-img/91/84/56/00/00/02/20000568491_6.jpg
,16435,20000489243,$14,伊蒂之屋,ETUDE,DOUBLE LASTING SERUM FOUNDATION SPF25/PA++ 粉底液,http://static.lottedfs.cn/prod/prd-img/31/70/54/00/00/02/20000547031_1.png
,16435,20000446534,$102,伊蒂之屋,ETUDE,PLAY COLOR EYES CHERRY BLOSSOM 眼影盘 6+1,http://static.lottedfs.cn/prod/prd-img/69/37/48/00/00/02/20000483769_1.JPG
,16435,10003167428,$4,伊蒂之屋,ETUDE,ETUDE HOUSE DEAR DARLING WATER GEL TINT  唇彩  OR205 APRICOT RED,http://static.lottedfs.cn/prod/prd-img/28/74/16/03/00/01/10003167428_4.jpg
,16435,20000588389,$5,伊蒂之屋,ETUDE,MY BEAUTY TOOL SECRET BRUSH 化妆刷 130 CONTOUR,http://static.lottedfs.cn/prod/prd-img/76/39/70/00/00/02/20000703976_1.png
,16435,20000554278,$9,伊蒂之屋,ETUDE,BETTER LIPS TALK 伊蒂之屋娇魅樱唇丝绒唇膏,http://static.lottedfs.cn/prod/prd-img/47/14/65/00/00/02/20000651447_3.jpg
,16435,20000391745,$4,伊蒂之屋,ETUDE,DEAR DARLING WATER GEL TINT  小甜心透嫩唇蜜  OINK OINK RED,http://static.lottedfs.cn/prod/prd-img/21/71/40/00/00/02/20000407121_3.jpg
畅销,16435,10001982008,$19,伊蒂之屋,ETUDE,HAND BOUQUET RICH BUTTER HAND CREAM  护手霜5件套装,http://static.lottedfs.cn/prod/prd-img/08/20/98/01/00/01/10001982008_01.jpg
,16435,20000563412,$13,伊蒂之屋,ETUDE,WONDER PORE 2 PIECES DUTY FREE SET 毛孔净透2件套,http://static.lottedfs.cn/prod/prd-img/51/69/66/00/00/02/20000666951_2.jpg
,16435,20000403780,$7,伊蒂之屋,ETUDE,NEW清纯自然染眉凝胶 3号 GRAY BROWN,http://static.lottedfs.cn/prod/prd-img/72/08/42/00/00/02/20000420872_3.jpg
,16435,20000182978,$17,伊蒂之屋,ETUDE,PLAY COLOR EYES  WINE PARTY 眼影彩盘,http://static.lottedfs.cn/prod/prd-img/39/71/18/00/00/02/20000187139_4.jpg
,16435,20000542496,$6,伊蒂之屋,ETUDE,DOUBLE LASTING FOUNDATION BLENDER AD 粉扑,http://static.lottedfs.cn/prod/prd-img/29/15/63/00/00/02/20000631529_1.jpg
,16435,10003167420,$4,伊蒂之屋,ETUDE,ETUDE HOUSE DEAR DARLING WATER GEL TINT 唇彩 RD306 SHARK RED,http://static.lottedfs.cn/prod/prd-img/20/74/16/03/00/01/10003167420_4.jpg
,16435,10003167417,$4,伊蒂之屋,ETUDE,ETUDE HOUSE DEAR DARLING WATER GEL TINT 唇彩  RD307 WATERMELON RED,http://static.lottedfs.cn/prod/prd-img/17/74/16/03/00/01/10003167417_4.jpg
,16435,10002359518,$9,伊蒂之屋,ETUDE,伊蒂之屋光采肌净透蜜粉饼,http://static.lottedfs.cn/prod/prd-img/00/95/35/02/00/01/10002359500_01.jpg
,16435,20000622360,$9,伊蒂之屋,ETUDE,PLUMPING PEARL SYRUP 唇彩,http://static.lottedfs.cn/prod/prd-img/81/58/76/00/00/02/20000765881_3.jpg
,16435,20000533141,$6,伊蒂之屋,ETUDE,BLOSSOM PICNIC CHEEK 腮红,http://static.lottedfs.cn/prod/prd-img/99/40/61/00/00/02/20000614099_1.jpg
,16435,20000427915,$17,伊蒂之屋,ETUDE,PLAY COLOR EYES PEACH FARM  眼影盘,http://static.lottedfs.cn/prod/prd-img/65/20/45/00/00/02/20000452065_1.png
,16435,10000050764,$15,伊蒂之屋,ETUDE,伊蒂之屋 岁月修护皇家BB霜,http://static.lottedfs.cn/prod/prd-img/65/86/04/00/00/01/10000048665_01.jpg
,16435,20000442700,$4,伊蒂之屋,ETUDE,LOOK AT MY EYES JEWEL  眼影,http://static.lottedfs.cn/prod/prd-img/94/73/47/00/00/02/20000477394_2.png
,16435,20000588379,$5,伊蒂之屋,ETUDE,MY BEAUTY TOOL BRUSH 眼影刷 316 SHADOW DIAGONAL,http://static.lottedfs.cn/prod/prd-img/60/39/70/00/00/02/20000703960_1.png
,16435,20000586398,$12,伊蒂之屋,ETUDE,DOUBLE LASTING SKIN MASTER BRUSH 化妆刷,http://static.lottedfs.cn/prod/prd-img/16/07/70/00/00/02/20000700716_1.jpg
,16435,20000563451,$18,伊蒂之屋,ETUDE,AC CLEAN UP 2 PIECES DUTY FREE SET  AC净痘两件套,http://static.lottedfs.cn/prod/prd-img/99/69/66/00/00/02/20000666999_3.jpg
,16435,20000522054,$17,伊蒂之屋,ETUDE,PLAY COLOR EYES LAVENDER LAND 玩转色彩多色眼影,http://static.lottedfs.cn/prod/prd-img/69/63/59/00/00/02/20000596369_1.jpg
,16435,20000403804,$7,伊蒂之屋,ETUDE,TINT MY 4TIP BROW  染眉膏 2号 DARK BROWN,http://static.lottedfs.cn/prod/prd-img/98/08/42/00/00/02/20000420898_2.jpg
,16435,10003167425,$4,伊蒂之屋,ETUDE,ETUDE HOUSE DEAR DARLING WATER GEL TINT 唇彩  PK004 RED BEANS RED,http://static.lottedfs.cn/prod/prd-img/25/74/16/03/00/01/10003167425_4.jpg
,16435,10003151778,$11,伊蒂之屋,ETUDE,MY BEAUTY TOOL SECRET BRUSH 121 PERFECT GIRL    秘诀无暇刷,http://static.lottedfs.cn/prod/prd-img/78/17/15/03/00/01/10003151778_1.jpg
,16435,20000622330,$8,伊蒂之屋,ETUDE,COLOR BROWS DESIGNING DUO 双头眉笔,http://static.lottedfs.cn/prod/prd-img/15/58/76/00/00/02/20000765815_4.jpg
,16435,20000615426,$12,伊蒂之屋,ETUDE,MOISTFULL COLLAGEN EMULSION NEW 乳液,http://static.lottedfs.cn/prod/prd-img/40/55/75/00/00/02/20000755540_1.png
,16435,20000603039,$8,伊蒂之屋,ETUDE,BAKING POWDER CRUNCH PORE SCRUB TUBE 去角质磨砂膏,http://static.lottedfs.cn/prod/prd-img/19/25/73/00/00/02/20000732519_1.png
,16435,20000522142,$102,伊蒂之屋,ETUDE,PLAY COLOR EYES LAVENDER LAND 玩转色彩多色眼影 6+1,http://static.lottedfs.cn/prod/prd-img/13/65/59/00/00/02/20000596513_1.jpg
,16435,20000433343,$9,伊蒂之屋,ETUDE,UV DOUBLE CUT MOISTURE TON UP SUN FLUID  防晒霜,http://static.lottedfs.cn/prod/prd-img/21/08/46/00/00/02/20000460821_1.jpg
,16435,20000403808,$9,伊蒂之屋,ETUDE,SECRET BEAM POWDER PACT   粉饼  W24 HONEY PEARL BEIGE,http://static.lottedfs.cn/prod/prd-img/02/09/42/00/00/02/20000420902_1.png
,16435,10003104198,$9,伊蒂之屋,ETUDE,伊蒂之屋绘色润颜妆前乳,http://static.lottedfs.cn/prod/prd-img/97/41/10/03/00/01/10003104197_01.jpg
,16435,20000424315,$7,伊蒂之屋,ETUDE,MONSTER OIL IN CLEANSING WATER 卸妆水,http://static.lottedfs.cn/prod/prd-img/52/68/44/00/00/02/20000446852_1.jpg
,16435,20000403774,$7,伊蒂之屋,ETUDE,NEW清纯自然染眉凝胶 2号LIGHT BROWN,http://static.lottedfs.cn/prod/prd-img/66/08/42/00/00/02/20000420866_1.jpg
免税独家,16435,10002309232,$15,伊蒂之屋,ETUDE,0.2 THERAPY AIR MASK SNAIL 面膜 20片 免税店专售,http://static.lottedfs.cn/prod/prd-img/32/92/30/02/00/01/10002309232_01.jpg
免税独家,16435,10002309230,$15,伊蒂之屋,ETUDE,0.2 THERAPY AIR MASK ALOE 面膜 20片 免税店专售,http://static.lottedfs.cn/prod/prd-img/30/92/30/02/00/01/10002309230_01.jpg
,16435,20000588427,$23,伊蒂之屋,ETUDE,MY BEAUTY TOOL GELATO MINI BRUSH SET 梦幻美妆工具冰淇淋迷你刷套装,http://static.lottedfs.cn/prod/prd-img/37/40/70/00/00/02/20000704037_1.jpg
,16435,20000532985,$9,伊蒂之屋,ETUDE,BLOSSOM PICNIC MATTE CHIC LIP LACQUER 唇釉,http://static.lottedfs.cn/prod/prd-img/21/38/61/00/00/02/20000613821_1.jpg
,16435,20000494734,$5,伊蒂之屋,ETUDE,MY BEAUTY TOOL MONSTER HAIR BAND 束发带,http://static.lottedfs.cn/prod/prd-img/27/64/55/00/00/02/20000556427_1.jpg
,16435,20000432911,$18,伊蒂之屋,ETUDE,DOUBLE LASTING CUSHION SPF34/PA++  气垫霜,http://static.lottedfs.cn/prod/prd-img/76/02/46/00/00/02/20000460276_2.jpg
免税独家,16435,10002309231,$15,伊蒂之屋,ETUDE,0.2 THERAPY AIR MASK PEARL 面膜 20片 免税店专售,http://static.lottedfs.cn/prod/prd-img/31/92/30/02/00/01/10002309231_01.jpg
,16435,20000575066,$17,伊蒂之屋,ETUDE,SOON JUNG SUBACID 5.5 FEMININE WASH 女士私处洗液,http://static.lottedfs.cn/prod/prd-img/45/31/68/00/00/02/20000683145_1.jpg
,16435,20000566686,$22,伊蒂之屋,ETUDE,BETTER LIPS-TALK BEST 3 PIECES SET 伊蒂之屋娇魅樱唇丝绒唇膏3件套,http://static.lottedfs.cn/prod/prd-img/17/21/67/00/00/02/20000672117_1.jpg
,16435,20000504884,$18,伊蒂之屋,ETUDE,TINY TWINKLE MINI DROP PEARL BASE KIT 迷你套装,http://static.lottedfs.cn/prod/prd-img/94/28/57/00/00/02/20000572894_9.png
,16435,20000457252,$12,伊蒂之屋,ETUDE,DUAL WIDE EYES MASCARA  睫毛膏,http://static.lottedfs.cn/prod/prd-img/06/88/49/00/00/02/20000498806_1.png
,16435,20000457117,$15,伊蒂之屋,ETUDE,ANY CUSHION ALL DAY PERFECT NEW SPF50+/PA+++  气垫,http://static.lottedfs.cn/prod/prd-img/38/85/49/00/00/02/20000498538_1.jpg
,16435,20000450245,$9,伊蒂之屋,ETUDE,BROW CONTOURING KIT  多用途眉盒,http://static.lottedfs.cn/prod/prd-img/64/92/48/00/00/02/20000489264_1.jpg
,16435,20000374373,$23,伊蒂之屋,ETUDE,PLAY 101 STICK MINI SELF KIT 迷你彩妆套装,http://static.lottedfs.cn/prod/prd-img/78/59/38/00/00/02/20000385978_3.jpg
,16435,20000374160,$9,伊蒂之屋,ETUDE,PLAY 101 CONTOUR DUO  高光阴影笔   2号,http://static.lottedfs.cn/prod/prd-img/88/56/38/00/00/02/20000385688_1.jpg
,16435,20000166472,$3,伊蒂之屋,ETUDE,ET GLASS LIPS TALK CASE  口红外壳,http://static.lottedfs.cn/prod/prd-img/23/89/16/00/00/02/20000168923_3.jpg
,16435,20000615417,$12,伊蒂之屋,ETUDE,MOISTFULL COLLAGEN TONER NEW 爽肤水,http://static.lottedfs.cn/prod/prd-img/26/55/75/00/00/02/20000755526_1.png
,16435,20000534177,$6,伊蒂之屋,ETUDE,COLORFUL VIVID TINT 染唇液,http://static.lottedfs.cn/prod/prd-img/96/56/61/00/00/02/20000615696_1.jpg
,16435,20000509029,$4,伊蒂之屋,ETUDE,ET MY BEAUTY TOOL EXFOLIATING JELLYFISH SILICONE BRUSH 硅胶刷,http://static.lottedfs.cn/prod/prd-img/49/41/20/00/00/02/20000204149_1.jpg
,16435,20000504606,$15,伊蒂之屋,ETUDE,ONE DAY ONE DROP REAL AMPOULE 安瓶,http://static.lottedfs.cn/prod/prd-img/83/24/57/00/00/02/20000572483_1.jpg
,16435,20000487625,$3,伊蒂之屋,ETUDE,MY BEAUTY TOOL PEACH CLEANSING PUFF 洁面粉扑,http://static.lottedfs.cn/prod/prd-img/28/40/54/00/00/02/20000544028_1.png
,16435,20000459533,$6,伊蒂之屋,ETUDE,TWO TONE TREATMENT HAIR COLOR 染发剂,http://static.lottedfs.cn/prod/prd-img/18/19/50/00/00/02/20000501918_1.png
,16435,20000433349,$12,伊蒂之屋,ETUDE,UV DOUBLE CUT  透明防晒棒,http://static.lottedfs.cn/prod/prd-img/36/08/46/00/00/02/20000460836_1.jpg
,16435,20000430618,$24,伊蒂之屋,ETUDE,MINI TWO MATCH TIN SET 迷你口红套装 2号,http://static.lottedfs.cn/prod/prd-img/83/56/45/00/00/02/20000455683_1.png
,16435,20000615411,$19,伊蒂之屋,ETUDE,MOISTFULL COLLAGEN CREAM DUO SET NEW 面霜2件套,http://static.lottedfs.cn/prod/prd-img/13/55/75/00/00/02/20000755513_1.jpg
,16435,20000588413,$15,伊蒂之屋,ETUDE,AC CLEAN UP ALL IN ONE GEL 补水啫喱,http://static.lottedfs.cn/prod/prd-img/10/40/70/00/00/02/20000704010_1.png
,16435,20000555886,$9,伊蒂之屋,ETUDE,BLOSSOM PICNIC SHINE CHIC LIP LACQUER PROMOTION 染唇液企划套装,http://static.lottedfs.cn/prod/prd-img/53/43/65/00/00/02/20000654353_4.png
,16435,20000554645,$7,伊蒂之屋,ETUDE,BAKING POWDER CRUNCH PORE SCRUB NEW 苏打粉清透去角质磨砂膏,http://static.lottedfs.cn/prod/prd-img/48/20/65/00/00/02/20000652048_1.jpg
,16435,20000547203,$9,伊蒂之屋,ETUDE,OLAF SUNPRISE MILD AIRY FINISH 防晒乳,http://static.lottedfs.cn/prod/prd-img/67/87/63/00/00/02/20000638767_1.jpg
,16435,20000547201,$12,伊蒂之屋,ETUDE,OLAF UV DOUBLE CUT TRANSPARENT SUN STICK 伊蒂之屋倍护清爽透明防晒棒,http://static.lottedfs.cn/prod/prd-img/65/87/63/00/00/02/20000638765_1.jpg
,16435,20000547200,$9,伊蒂之屋,ETUDE,OLAF UV DOUBLE CUT MOISTURE TONE UP SUN FLUID 防晒乳,http://static.lottedfs.cn/prod/prd-img/64/87/63/00/00/02/20000638764_1.jpg
,16435,20000547196,$9,伊蒂之屋,ETUDE,OLAF UV DOUBLE CUT FRESH SUN GEL 伊蒂之屋倍护清爽透明防晒啫喱,http://static.lottedfs.cn/prod/prd-img/57/87/63/00/00/02/20000638757_1.jpg
,16435,20000542487,$12,伊蒂之屋,ETUDE,PLAY COLOR EYES KITKAT MINI 眼影盘,http://static.lottedfs.cn/prod/prd-img/18/15/63/00/00/02/20000631518_1.jpg
,16435,20000533190,$12,伊蒂之屋,ETUDE,BLOSSOM PICNIC GLOW ON BASE 隔离霜 30ml,http://static.lottedfs.cn/prod/prd-img/48/41/61/00/00/02/20000614148_1.jpg
,16435,20000523134,$15,伊蒂之屋,ETUDE,JEWEL BEAM GEL MASK 5 SHEETS SET 面膜 5片装,http://static.lottedfs.cn/prod/prd-img/74/77/59/00/00/02/20000597774_1.jpg
,16435,20000512435,$5,伊蒂之屋,ETUDE,HAPPY WITH PIGLET SOFT CREAM PUFF 粉扑,http://static.lottedfs.cn/prod/prd-img/53/31/58/00/00/02/20000583153_1.jpg
,16435,20000512398,$4,伊蒂之屋,ETUDE,HAPPY WITH PIGLET EYESHADOW BRUSH 眼影刷,http://static.lottedfs.cn/prod/prd-img/75/30/58/00/00/02/20000583075_1.jpg
,16435,20000512391,$20,伊蒂之屋,ETUDE,HAPPY WITH PIGLET MOISTFULL COLLAGEN 2 PIECES OF SKIN CARE SET 基础护肤2件套,http://static.lottedfs.cn/prod/prd-img/59/30/58/00/00/02/20000583059_1.jpg
,16435,20000512386,$6,伊蒂之屋,ETUDE,HAPPY WITH PIGLET BLUSHER BRUSH 腮红刷,http://static.lottedfs.cn/prod/prd-img/54/30/58/00/00/02/20000583054_1.jpg
,16435,20000512374,$4,伊蒂之屋,ETUDE,HAPPY WITH PIGLET LOOK AT MY EYES JEWEL 眼影,http://static.lottedfs.cn/prod/prd-img/27/30/58/00/00/02/20000583027_1.jpg
,16435,20000512324,$3,伊蒂之屋,ETUDE,HAPPY WITH PIGLET LOOK AT MY EYES 眼影,http://static.lottedfs.cn/prod/prd-img/08/30/58/00/00/02/20000583008_1.jpg
畅销,16435,20000511566,$14,伊蒂之屋,ETUDE,TWINKLE MINI BRUSH SET SNOW EDITION 迷你化妆刷套装,http://static.lottedfs.cn/prod/prd-img/26/18/58/00/00/02/20000581826_5.PNG
免税独家,16435,20000509065,$19,伊蒂之屋,ETUDE,FRESH CHERRY TINT 4 COLORS DUTYFREE EXCLUSIVE  染唇液（免税店专售）,http://static.lottedfs.cn/prod/prd-img/97/15/22/02/00/01/10002221597_01.jpg
,16435,20000509044,$7,伊蒂之屋,ETUDE,COLOR IN LIQUID LIPS 染唇液,http://static.lottedfs.cn/prod/prd-img/93/51/09/03/00/01/10003095193_01.jpg
