tag,brand_No,product_No,us_price,brand_name_chn,brand_name_eng,product_name,img_url
,1002029,20000514539,$8,UNNYCLUB,UNNYCLUB,UNNY FULL FIT SKINNY MASCARA 睫毛膏 BLACK,http://static.lottedfs.cn/prod/prd-img/13/68/58/00/00/02/20000586813_1.jpg
,1002029,20000514568,$7,UNNYCLUB,UNNYCLUB,UNNY SKINNY S SLIM PENCIL 眼线笔 S02 DEEP BROWN,http://static.lottedfs.cn/prod/prd-img/43/68/58/00/00/02/20000586843_1.jpg
,1002029,20000514962,$8,UNNYCLUB,UNNYCLUB,UNNY CLUB MILD CLEANSING WATER 卸妆水 500ml,http://static.lottedfs.cn/prod/prd-img/67/73/58/00/00/02/20000587367_1.jpg
,1002029,20000537143,$8,UNNYCLUB,UNNYCLUB,MILD FACE CLEANSING FOAM 洗面奶,http://static.lottedfs.cn/prod/prd-img/56/15/62/00/00/02/20000621556_1.jpg
,1002029,20000514899,$8,UNNYCLUB,UNNYCLUB,UNNY PLUS ACTIVE VOLUME MASCARA BLACK 睫毛膏,http://static.lottedfs.cn/prod/prd-img/03/73/58/00/00/02/20000587303_1.jpg
,1002029,20000514535,$8,UNNYCLUB,UNNYCLUB,UNNY SKINNY S ART LINER 眼线笔 A02 DEEP BROWN,http://static.lottedfs.cn/prod/prd-img/08/68/58/00/00/02/20000586808_2.jpg
,1002029,20000514531,$8,UNNYCLUB,UNNYCLUB,UNNY SKINNY S ART LINER 眼线笔 A01 KILL BLACK,http://static.lottedfs.cn/prod/prd-img/03/68/58/00/00/02/20000586803_2.jpg
,1002029,20000514957,$13,UNNYCLUB,UNNYCLUB,REFRESHING MAKEUP BASE 隔离霜 01 VIOLET,http://static.lottedfs.cn/prod/prd-img/62/73/58/00/00/02/20000587362_2.jpg
,1002029,20000514565,$7,UNNYCLUB,UNNYCLUB,UNNY SKINNY S SLIM PENCIL 眼线笔 S01 KILL BLACK,http://static.lottedfs.cn/prod/prd-img/40/68/58/00/00/02/20000586840_1.jpg
,1002029,20000514575,$8,UNNYCLUB,UNNYCLUB,UNNY CLUB FULL COVER PORE POWDER 散粉,http://static.lottedfs.cn/prod/prd-img/50/68/58/00/00/02/20000586850_1.jpg
,1002029,20000526315,$7,UNNYCLUB,UNNYCLUB,MILD LIP CARE 润唇膏,http://static.lottedfs.cn/prod/prd-img/76/28/60/00/00/02/20000602876_1.jpg
,1002029,20000514960,$13,UNNYCLUB,UNNYCLUB,REFRESHING MAKEUP BASE 隔离霜 02 ONDINE,http://static.lottedfs.cn/prod/prd-img/65/73/58/00/00/02/20000587365_2.jpg
,1002029,20000514571,$7,UNNYCLUB,UNNYCLUB,UNNY SKINNY S SLIM PENCIL 眼线笔 S03 MOCHA BROWN,http://static.lottedfs.cn/prod/prd-img/46/68/58/00/00/02/20000586846_1.jpg
,1002029,20000514577,$7,UNNYCLUB,UNNYCLUB,UNNY SKINNY S SLIM PENCIL 眼线笔 S05 AMBER BROWN,http://static.lottedfs.cn/prod/prd-img/52/68/58/00/00/02/20000586852_1.jpg
,1002029,20000514583,$16,UNNYCLUB,UNNYCLUB,UNNY CLUB AURORA MEETING CREAM 面霜 50g,http://static.lottedfs.cn/prod/prd-img/58/68/58/00/00/02/20000586858_1.jpg
,1002029,20000624057,$13,UNNYCLUB,UNNYCLUB,SETTING TIME FIXER MAKEUP MIST 喷雾,http://static.lottedfs.cn/prod/prd-img/67/79/76/00/00/02/20000767967_1.jpg
,1002029,20000514581,$7,UNNYCLUB,UNNYCLUB,UNNY SKINNY S SLIM PENCIL 眼线笔 S06 HONEY BROWN,http://static.lottedfs.cn/prod/prd-img/56/68/58/00/00/02/20000586856_1.jpg
,1002029,20000514574,$7,UNNYCLUB,UNNYCLUB,UNNY SKINNY S SLIM PENCIL 眼线笔 S04 RED BROWN,http://static.lottedfs.cn/prod/prd-img/49/68/58/00/00/02/20000586849_1.jpg
,1002029,20000514946,$13,UNNYCLUB,UNNYCLUB,UNNY CLUB CLOUDLET LIQUID FOUNDATION 粉底液 01 VERSATILE,http://static.lottedfs.cn/prod/prd-img/51/73/58/00/00/02/20000587351_1.jpg
,1002029,20000515006,$12,UNNYCLUB,UNNYCLUB,UNNY CLUB BLACK SQUARE LIPSTICK 口红 M03 LIBBY DREAM,http://static.lottedfs.cn/prod/prd-img/22/74/58/00/00/02/20000587422_1.jpg
,1002029,20000514589,$13,UNNYCLUB,UNNYCLUB,UNNY CLUB SATIN LOOSE POWDER 散粉 21号,http://static.lottedfs.cn/prod/prd-img/66/68/58/00/00/02/20000586866_1.jpg
,1002029,20000514587,$8,UNNYCLUB,UNNYCLUB,UNNY CLUB FULL COVER PORE PACT 粉饼,http://static.lottedfs.cn/prod/prd-img/64/68/58/00/00/02/20000586864_3.jpg
,1002029,20000624063,$9,UNNYCLUB,UNNYCLUB,SUPER SLIM EYELINER 眼线笔 S05 HONEY BROWN,http://static.lottedfs.cn/prod/prd-img/74/79/76/00/00/02/20000767974_1.jpg
,1002029,20000514949,$13,UNNYCLUB,UNNYCLUB,UNNY CLUB CLOUDLET LIQUID FOUNDATION 粉底液 P01,http://static.lottedfs.cn/prod/prd-img/54/73/58/00/00/02/20000587354_1.jpg
,1002029,20000514921,$10,UNNYCLUB,UNNYCLUB,UNNY CLUB TALK THAT TINT 染唇液 [T07 PENNY WHISTLE],http://static.lottedfs.cn/prod/prd-img/25/73/58/00/00/02/20000587325_1.jpg
,1002029,20000638886,$8,UNNYCLUB,UNNYCLUB,FULL COVER LIQUID CONCEALER 遮瑕液 1.5号 NATURAL BEIGE,http://static.lottedfs.cn/prod/prd-img/34/91/78/00/00/02/20000789134_2.jpg
,1002029,20000625311,$8,UNNYCLUB,UNNYCLUB,UNNY CLUB WONDERLAND LIP GLOSS 唇彩 202 PETRUS,http://static.lottedfs.cn/prod/prd-img/95/00/77/00/00/02/20000770095_1.jpg
,1002029,20000587380,$13,UNNYCLUB,UNNYCLUB,UNNY CLUB GENTLE CLEANSING GEL 卸妆啫喱,http://static.lottedfs.cn/prod/prd-img/07/23/70/00/00/02/20000702307_1.jpg
,1002029,20000514952,$13,UNNYCLUB,UNNYCLUB,UNNY CLUB CLOUDLET LIQUID FOUNDATION 粉底液 N01,http://static.lottedfs.cn/prod/prd-img/57/73/58/00/00/02/20000587357_1.jpg
,1002029,20000514954,$13,UNNYCLUB,UNNYCLUB,UNNY CLUB CLOUDLET LIQUID FOUNDATION 粉底液 Y01,http://static.lottedfs.cn/prod/prd-img/59/73/58/00/00/02/20000587359_1.jpg
,1002029,20000514904,$10,UNNYCLUB,UNNYCLUB,UNNY CLUB TALK THAT TINT 染唇液 [T03 NIGHT KISS],http://static.lottedfs.cn/prod/prd-img/08/73/58/00/00/02/20000587308_1.jpg
,1002029,20000514903,$10,UNNYCLUB,UNNYCLUB,UNNY CLUB TALK THAT TINT 染唇液 [T02 SIEMPRE CANTARE],http://static.lottedfs.cn/prod/prd-img/07/73/58/00/00/02/20000587307_1.jpg
,1002029,20000514541,$8,UNNYCLUB,UNNYCLUB,UNNY CLUB KISS LIP TATTOO 唇釉 M01 SILENT GUARDIAN,http://static.lottedfs.cn/prod/prd-img/16/68/58/00/00/02/20000586816_1.jpg
,1002029,20000624061,$9,UNNYCLUB,UNNYCLUB,SUPER SLIM EYELINER 眼线笔 S03 MOCHA BROWN,http://static.lottedfs.cn/prod/prd-img/72/79/76/00/00/02/20000767972_1.jpg
,1002029,20000520359,$8,UNNYCLUB,UNNYCLUB,WONDERLAND LIP GLOSS 唇彩 104 KILIG,http://static.lottedfs.cn/prod/prd-img/17/33/59/00/00/02/20000593317_1.jpg
,1002029,20000515002,$12,UNNYCLUB,UNNYCLUB,UNNY CLUB BLACK SQUARE LIPSTICK 口红 M02 SOONER,http://static.lottedfs.cn/prod/prd-img/18/74/58/00/00/02/20000587418_1.jpg
,1002029,20000514990,$20,UNNYCLUB,UNNYCLUB,UNNYCLUB GLAM EYE SHADOW PALETTE 眼影盘 [1号 SUNSET ROSE],http://static.lottedfs.cn/prod/prd-img/00/74/58/00/00/02/20000587400_1.jpg
,1002029,20000514965,$15,UNNYCLUB,UNNYCLUB,UNNY CLUB GENTLE CLEANSING BALM 卸妆膏 95ml,http://static.lottedfs.cn/prod/prd-img/74/73/58/00/00/02/20000587374_1.jpg
,1002029,20000514917,$10,UNNYCLUB,UNNYCLUB,UNNY CLUB TALK THAT TINT 染唇液 [T06 AFTERTASTE],http://static.lottedfs.cn/prod/prd-img/21/73/58/00/00/02/20000587321_1.jpg
,1002029,20000514579,$13,UNNYCLUB,UNNYCLUB,AURORA ESSENCE FLUID 精华 30g,http://static.lottedfs.cn/prod/prd-img/54/68/58/00/00/02/20000586854_1.jpg
,1002029,20000514544,$8,UNNYCLUB,UNNYCLUB,UNNY CLUB KISS LIP TATTOO 唇釉 M03 GONDOLA,http://static.lottedfs.cn/prod/prd-img/19/68/58/00/00/02/20000586819_1.jpg
,1002029,20000638887,$8,UNNYCLUB,UNNYCLUB,FULL COVER LIQUID CONCEALER 遮瑕液 2号 SAND BEIGE,http://static.lottedfs.cn/prod/prd-img/35/91/78/00/00/02/20000789135_2.jpg
,1002029,20000638882,$8,UNNYCLUB,UNNYCLUB,FULL COVER LIQUID CONCEALER 遮瑕液 1号 LIGHT BEIGE,http://static.lottedfs.cn/prod/prd-img/22/91/78/00/00/02/20000789122_2.jpg
,1002029,20000625302,$12,UNNYCLUB,UNNYCLUB,UNNY CLUB BLACK SQUARE LIPSTICK 口红 M07. SATIN,http://static.lottedfs.cn/prod/prd-img/80/00/77/00/00/02/20000770080_1.jpg
,1002029,20000624060,$9,UNNYCLUB,UNNYCLUB,SUPER SLIM EYELINER 眼线笔 S02 DEPP BROWN,http://static.lottedfs.cn/prod/prd-img/71/79/76/00/00/02/20000767971_1.jpg
,1002029,20000520558,$8,UNNYCLUB,UNNYCLUB,UNNY CLUB KISS LIP TATTOO 染唇液 M06 LIMERENCE,http://static.lottedfs.cn/prod/prd-img/91/35/59/00/00/02/20000593591_1.jpg
,1002029,20000520358,$8,UNNYCLUB,UNNYCLUB,WONDERLAND LIP GLOSS 唇彩 103 HEARTIELS,http://static.lottedfs.cn/prod/prd-img/16/33/59/00/00/02/20000593316_1.jpg
,1002029,20000520346,$8,UNNYCLUB,UNNYCLUB,WONDERLAND LIP GLOSS 唇彩 101 ETHEREAL,http://static.lottedfs.cn/prod/prd-img/87/32/59/00/00/02/20000593287_2.jpg
,1002029,20000520341,$27,UNNYCLUB,UNNYCLUB,UNNY CLUB FULL TIME ESSENCE CUSHION 气垫霜 01 PINK,http://static.lottedfs.cn/prod/prd-img/82/32/59/00/00/02/20000593282_2.jpg
,1002029,20000514944,$10,UNNYCLUB,UNNYCLUB,UNNY CLUB TALK THAT TINT 染唇液 [T10 DRAG CITY],http://static.lottedfs.cn/prod/prd-img/49/73/58/00/00/02/20000587349_1.jpg
,1002029,20000514906,$10,UNNYCLUB,UNNYCLUB,UNNY CLUB TALK THAT TINT 染唇液 [T04 C MAJOR],http://static.lottedfs.cn/prod/prd-img/10/73/58/00/00/02/20000587310_1.jpg
,1002029,20000625307,$8,UNNYCLUB,UNNYCLUB,UNNYCLUB WONDERLAND LIP GLOSS 唇彩 201 MELLIFLUOUS,http://static.lottedfs.cn/prod/prd-img/89/00/77/00/00/02/20000770089_1.jpg
,1002029,20000625296,$12,UNNYCLUB,UNNYCLUB,UNNY CLUB BLACK SQUARE LIPSTICK 口红 M06. MAGENTA,http://static.lottedfs.cn/prod/prd-img/69/00/77/00/00/02/20000770069_1.jpg
,1002029,20000624074,$19,UNNYCLUB,UNNYCLUB,TOTAL SHAPING PALETTE 高光修容粉饼 01 WARM SUN,http://static.lottedfs.cn/prod/prd-img/91/79/76/00/00/02/20000767991_1.jpg
,1002029,20000624066,$9,UNNYCLUB,UNNYCLUB,SUPER SLIM EYELINER 眼线笔 S08 NIGHT BLUE,http://static.lottedfs.cn/prod/prd-img/77/79/76/00/00/02/20000767977_1.jpg
,1002029,20000624065,$9,UNNYCLUB,UNNYCLUB,SUPER SLIM EYELINER 眼线笔 S07 DEEP GREEN,http://static.lottedfs.cn/prod/prd-img/76/79/76/00/00/02/20000767976_1.jpg
,1002029,20000624064,$9,UNNYCLUB,UNNYCLUB,SUPER SLIM EYELINER 眼线笔 S06 PLUM PURPLE,http://static.lottedfs.cn/prod/prd-img/75/79/76/00/00/02/20000767975_1.jpg
,1002029,20000624062,$9,UNNYCLUB,UNNYCLUB,SUPER SLIM EYELINER 眼线笔 S04 AMBER BROWN,http://static.lottedfs.cn/prod/prd-img/73/79/76/00/00/02/20000767973_1.jpg
,1002029,20000624059,$9,UNNYCLUB,UNNYCLUB,SUPER SLIM EYELINER 眼线笔 S01 KILL BLACK,http://static.lottedfs.cn/prod/prd-img/70/79/76/00/00/02/20000767970_1.jpg
,1002029,20000621065,$23,UNNYCLUB,UNNYCLUB,UNNY CLUB KISS LIP TATTOO COLLECTION 染唇液套装,http://static.lottedfs.cn/prod/prd-img/20/35/76/00/00/02/20000763520_1.jpg
,1002029,20000621017,$11,UNNYCLUB,UNNYCLUB,UNNY CLUB MILD CLEANSING WATER SPECIAL DUO SET 卸妆水特别套装,http://static.lottedfs.cn/prod/prd-img/31/34/76/00/00/02/20000763431_1.jpg
,1002029,20000601374,$6,UNNYCLUB,UNNYCLUB,UNNYCLUB MILD CLEANSING WATER 悠宜卸妆水,http://static.lottedfs.cn/prod/prd-img/01/87/72/00/00/02/20000728701_1.jpg
,1002029,20000593991,$14,UNNYCLUB,UNNYCLUB,LIMPID CLEANSING GEL 卸妆啫喱,http://static.lottedfs.cn/prod/prd-img/44/33/71/00/00/02/20000713344_1.jpg
,1002029,20000593979,$9,UNNYCLUB,UNNYCLUB,MILD PURIFYING FACE CLEANSING FOAM 洗面奶,http://static.lottedfs.cn/prod/prd-img/30/33/71/00/00/02/20000713330_1.jpg
,1002029,20000526300,$8,UNNYCLUB,UNNYCLUB,UNNYCLUB KISS LIP TATTOO 唇彩 M07 RESTRAINT,http://static.lottedfs.cn/prod/prd-img/26/28/60/00/00/02/20000602826_1.jpg
,1002029,20000520362,$8,UNNYCLUB,UNNYCLUB,SPA CLEANSING OIL TISSUE 卸妆湿巾,http://static.lottedfs.cn/prod/prd-img/20/33/59/00/00/02/20000593320_1.jpg
,1002029,20000520361,$8,UNNYCLUB,UNNYCLUB,WONDERLAND LIP GLOSS 唇彩 105 SERENDIPITY,http://static.lottedfs.cn/prod/prd-img/19/33/59/00/00/02/20000593319_1.jpg
,1002029,20000520356,$8,UNNYCLUB,UNNYCLUB,WONDERLAND LIP GLOSS 唇彩 102 CRUSH,http://static.lottedfs.cn/prod/prd-img/09/33/59/00/00/02/20000593309_1.jpg
,1002029,20000520344,$27,UNNYCLUB,UNNYCLUB,UNNY CLUB FULL TIME ESSENCE CUSHION 气垫霜 03 NATURE,http://static.lottedfs.cn/prod/prd-img/85/32/59/00/00/02/20000593285_2.jpg
,1002029,20000520343,$27,UNNYCLUB,UNNYCLUB,UNNY CLUB FULL TIME ESSENCE CUSHION 气垫霜 02 IVORY,http://static.lottedfs.cn/prod/prd-img/84/32/59/00/00/02/20000593284_2.jpg
,1002029,20000515019,$12,UNNYCLUB,UNNYCLUB,UNNY CLUB BLACK SQUARE LIPSTICK 口红 M05 SUBMERGE,http://static.lottedfs.cn/prod/prd-img/37/74/58/00/00/02/20000587437_1.jpg
,1002029,20000515017,$12,UNNYCLUB,UNNYCLUB,UNNY CLUB BLACK SQUARE LIPSTICK 口红 M04 BURNING,http://static.lottedfs.cn/prod/prd-img/35/74/58/00/00/02/20000587435_1.jpg
,1002029,20000514999,$12,UNNYCLUB,UNNYCLUB,UNNY CLUB BLACK SQUARE LIPSTICK 口红 M01 REMEDY,http://static.lottedfs.cn/prod/prd-img/15/74/58/00/00/02/20000587415_1.jpg
,1002029,20000514941,$10,UNNYCLUB,UNNYCLUB,UNNY CLUB TALK THAT TINT 染唇液 [T09 CONCERTO],http://static.lottedfs.cn/prod/prd-img/46/73/58/00/00/02/20000587346_1.jpg
,1002029,20000514940,$10,UNNYCLUB,UNNYCLUB,UNNY CLUB TALK THAT TINT 染唇液 [T08 MAESTRO],http://static.lottedfs.cn/prod/prd-img/45/73/58/00/00/02/20000587345_1.jpg
,1002029,20000514912,$10,UNNYCLUB,UNNYCLUB,UNNY CLUB TALK THAT TINT 染唇液 [T05 RHAPSODY],http://static.lottedfs.cn/prod/prd-img/16/73/58/00/00/02/20000587316_1.jpg
,1002029,20000514901,$10,UNNYCLUB,UNNYCLUB,UNNY CLUB TALK THAT TINT 染唇液 [T01 SECRET STORY],http://static.lottedfs.cn/prod/prd-img/05/73/58/00/00/02/20000587305_1.jpg
,1002029,20000514590,$13,UNNYCLUB,UNNYCLUB,UNNY CLUB SATIN LOOSE POWDER 散粉 23号,http://static.lottedfs.cn/prod/prd-img/67/68/58/00/00/02/20000586867_1.jpg
,1002029,20000514561,$8,UNNYCLUB,UNNYCLUB,UNNY CLUB FULL COVER TIP CONCEALER 遮瑕膏 2号,http://static.lottedfs.cn/prod/prd-img/36/68/58/00/00/02/20000586836_1.jpg
,1002029,20000514552,$8,UNNYCLUB,UNNYCLUB,UNNY CLUB KISS LIP TATTOO 唇釉 M05 HOHENZOLLERN,http://static.lottedfs.cn/prod/prd-img/27/68/58/00/00/02/20000586827_1.jpg
,1002029,20000514547,$8,UNNYCLUB,UNNYCLUB,UNNY CLUB KISS LIP TATTOO 唇釉 M04 KABRUMOST,http://static.lottedfs.cn/prod/prd-img/22/68/58/00/00/02/20000586822_1.jpg
,1002029,20000514542,$8,UNNYCLUB,UNNYCLUB,UNNY CLUB KISS LIP TATTOO 唇釉 M02 N SEOUL TOWER,http://static.lottedfs.cn/prod/prd-img/17/68/58/00/00/02/20000586817_1.jpg
