tag,brand_No,product_No,us_price,brand_name_chn,brand_name_eng,product_name,img_url
,16152,20000611969,$111,瑞克朵丝,LOUIS QUATORZE,WOMENS CARD WALLET SN3FM06FI1RE 女士卡包,http://static.lottedfs.cn/prod/prd-img/88/87/74/00/00/02/20000748788_1.JPG
,16152,20000611963,$88,瑞克朵丝,LOUIS QUATORZE,WOMENS ZIP AROUND HALF WALLET SN3DL36FG2GA 女士短款钱包,http://static.lottedfs.cn/prod/prd-img/79/87/74/00/00/02/20000748779_1.JPG
,16152,20000611961,$88,瑞克朵丝,LOUIS QUATORZE,WOMENS BUSINESS CARD WALLET SN3DL38FI0GA 女士名片包,http://static.lottedfs.cn/prod/prd-img/77/87/74/00/00/02/20000748777_1.JPG
,16152,20000611955,$96,瑞克朵丝,LOUIS QUATORZE,WOMENS COIN WALLET SN4DL06FI4GA 女士零钱包,http://static.lottedfs.cn/prod/prd-img/66/87/74/00/00/02/20000748766_1.JPG
,16152,20000611953,$96,瑞克朵丝,LOUIS QUATORZE,WOMENS COIN WALLET SN4DL06FI4BL 女士硬币包,http://static.lottedfs.cn/prod/prd-img/64/87/74/00/00/02/20000748764_1.JPG
,16152,20000611950,$186,瑞克朵丝,LOUIS QUATORZE,WOMENS TRIFOLD LONG WALLET SN4DL01FF0TA 女士长款钱包,http://static.lottedfs.cn/prod/prd-img/61/87/74/00/00/02/20000748761_1.JPG
畅销,16152,20000611948,$163,瑞克朵丝,LOUIS QUATORZE,WOMENS TRIFOLD MINI WALLET SN4DL07FF6GA 女士短款钱包,http://static.lottedfs.cn/prod/prd-img/57/87/74/00/00/02/20000748757_1.JPG
,16152,20000611942,$118,瑞克朵丝,LOUIS QUATORZE,WOMENS BIFOLD LONG WALLET SN3DL27FF1TP 女士长款钱包,http://static.lottedfs.cn/prod/prd-img/41/87/74/00/00/02/20000748741_1.JPG
,16152,20000611937,$133,瑞克朵丝,LOUIS QUATORZE,WOMENS BIFOLD LONG WALLET SN3DL26FF1TP 女士长款钱包,http://static.lottedfs.cn/prod/prd-img/29/87/74/00/00/02/20000748729_1.JPG
,16152,20000611928,$133,瑞克朵丝,LOUIS QUATORZE,WOMENS BIFOLD LONG WALLET SN3DL26FF1BL 女士长款钱包,http://static.lottedfs.cn/prod/prd-img/15/87/74/00/00/02/20000748715_1.JPG
,16152,20000611855,$126,瑞克朵丝,LOUIS QUATORZE,WOMENS BIFOLD LONG WALLET SN3DL21FF1TP 女士长款钱包,http://static.lottedfs.cn/prod/prd-img/10/86/74/00/00/02/20000748610_1.JPG
,16152,20000611851,$126,瑞克朵丝,LOUIS QUATORZE,WOMENS BIFOLD LONG WALLET 女士长款钱包 SN3DL21FF1BL,http://static.lottedfs.cn/prod/prd-img/03/86/74/00/00/02/20000748603_1.JPG
,16152,20000611848,$88,瑞克朵丝,LOUIS QUATORZE,WOMENS BIFOLD HALF WALLET 女士短款钱包 SN3DL28FF5TP,http://static.lottedfs.cn/prod/prd-img/97/85/74/00/00/02/20000748597_1.JPG
,16152,20000611843,$88,瑞克朵丝,LOUIS QUATORZE,WOMENS BIFOLD HALF WALLET SN3DL28FF5BL 女士短款钱包,http://static.lottedfs.cn/prod/prd-img/85/85/74/00/00/02/20000748585_1.JPG
,16152,20000611838,$96,瑞克朵丝,LOUIS QUATORZE,WOMENS BIFOLD HALF WALLET SN3DL22FF5TP 女士短款钱包,http://static.lottedfs.cn/prod/prd-img/76/85/74/00/00/02/20000748576_1.JPG
,16152,20000611835,$96,瑞克朵丝,LOUIS QUATORZE,WOMENS BIFOLD HALF WALLET SN3DL22FF5BL 女士短款钱包,http://static.lottedfs.cn/prod/prd-img/70/85/74/00/00/02/20000748570_1.JPG
,16152,20000611832,$118,瑞克朵丝,LOUIS QUATORZE,WOMENS BIFOLD MINI WALLET SN3DL16FF7RE 女士迷你钱包,http://static.lottedfs.cn/prod/prd-img/63/85/74/00/00/02/20000748563_1.JPG
,16152,20000611830,$85,瑞克朵丝,LOUIS QUATORZE,MENS CARD WALLET SN3DL25MI1NA 男士卡包,http://static.lottedfs.cn/prod/prd-img/58/85/74/00/00/02/20000748558_1.JPG
,16152,20000611810,$126,瑞克朵丝,LOUIS QUATORZE,MENS CARD WALLET  SN1AT03MI2BR 男士卡包,http://static.lottedfs.cn/prod/prd-img/00/85/74/00/00/02/20000748500_1.JPG
,16152,20000611803,$81,瑞克朵丝,LOUIS QUATORZE,MENS BUSINESS CARD WALLET SN3DL24MI0BL 名片夹,http://static.lottedfs.cn/prod/prd-img/81/84/74/00/00/02/20000748481_1.JPG
,16152,20000611795,$126,瑞克朵丝,LOUIS QUATORZE,MENS BIFOLD LONG WALLET SN3DL21MF1BL 男士长款钱包,http://static.lottedfs.cn/prod/prd-img/61/84/74/00/00/02/20000748461_1.JPG
,16152,20000611791,$111,瑞克朵丝,LOUIS QUATORZE,MENS BIFOLD HALF WALLET SN3DL22MF5NA 男士短款钱包,http://static.lottedfs.cn/prod/prd-img/53/84/74/00/00/02/20000748453_1.JPG
,16152,20000611788,$111,瑞克朵丝,LOUIS QUATORZE,MENS BIFOLD HALF WALLET SN3DL22MF5BL 男士短款钱包,http://static.lottedfs.cn/prod/prd-img/47/84/74/00/00/02/20000748447_1.JPG
,16152,20000611783,$111,瑞克朵丝,LOUIS QUATORZE,MENS BIFOLD HALF WALLET SN3DL13MF5BR 男士短款钱包,http://static.lottedfs.cn/prod/prd-img/37/84/74/00/00/02/20000748437_1.JPG
,16152,20000611777,$111,瑞克朵丝,LOUIS QUATORZE,MENS BIFOLD MINI WALLET SN3DL23MF7BL 男士迷你钱包,http://static.lottedfs.cn/prod/prd-img/31/84/74/00/00/02/20000748431_1.JPG
,16152,20000611776,$268,瑞克朵丝,LOUIS QUATORZE,MENS MANS BAG MN4DL02MD3BL 男士手包,http://static.lottedfs.cn/prod/prd-img/30/84/74/00/00/02/20000748430_1.JPG
,16152,20000611768,$332,瑞克朵丝,LOUIS QUATORZE,MENS BRIEFCASE MN3DL06MD0BL 男士公文包,http://static.lottedfs.cn/prod/prd-img/17/84/74/00/00/02/20000748417_1.JPG
,16152,20000611767,$321,瑞克朵丝,LOUIS QUATORZE,WOMENS SATCHEL HN4FM01FB3MT 女士手提包,http://static.lottedfs.cn/prod/prd-img/15/84/74/00/00/02/20000748415_1.JPG
,16152,20000611753,$380,瑞克朵丝,LOUIS QUATORZE,WOMENS SATCHEL HN4DL26FB3BL 女士手提包,http://static.lottedfs.cn/prod/prd-img/00/84/74/00/00/02/20000748400_1.JPG
,16152,20000611751,$321,瑞克朵丝,LOUIS QUATORZE,WOMENS ONE SHOULDER HN4DL17FA0BL 女士单肩包,http://static.lottedfs.cn/prod/prd-img/95/83/74/00/00/02/20000748395_1.JPG
,16152,20000611749,$358,瑞克朵丝,LOUIS QUATORZE,WOMENS BACKPACK HN4DL10FB2BL 女士背包,http://static.lottedfs.cn/prod/prd-img/93/83/74/00/00/02/20000748393_1.JPG
,16152,20000605253,$163,瑞克朵丝,LOUIS QUATORZE,WOMENS TRIFOLD HALF WALLET SN4DL02FF4RE 女士短款钱包,http://static.lottedfs.cn/prod/prd-img/29/67/73/00/00/02/20000736729_1.JPG
,16152,20000605252,$163,瑞克朵丝,LOUIS QUATORZE,WOMENS TRIFOLD HALF WALLET SN4DL02FF4BL 女士短款钱包,http://static.lottedfs.cn/prod/prd-img/28/67/73/00/00/02/20000736728_1.JPG
,16152,20000605251,$186,瑞克朵丝,LOUIS QUATORZE,WOMENS TRIFOLD LONG WALLET SN4DL01FF0BL 女士长款钱包,http://static.lottedfs.cn/prod/prd-img/27/67/73/00/00/02/20000736727_1.JPG
,16152,20000605249,$201,瑞克朵丝,LOUIS QUATORZE,WOMENS TRIFOLD LONG WALLET SN3FM02FF0BL 女士长款钱包,http://static.lottedfs.cn/prod/prd-img/25/67/73/00/00/02/20000736725_1.JPG
,16152,20000605247,$107,瑞克朵丝,LOUIS QUATORZE,MENS BIFOLD HALF WALLET SN3DL31MF5NA 男士短款钱包,http://static.lottedfs.cn/prod/prd-img/23/67/73/00/00/02/20000736723_1.JPG
,16152,20000605245,$107,瑞克朵丝,LOUIS QUATORZE,MENS BIFOLD HALF WALLET SN3DL31MF5BL 男士短款钱包,http://static.lottedfs.cn/prod/prd-img/14/67/73/00/00/02/20000736714_1.JPG
,16152,20000605242,$70,瑞克朵丝,LOUIS QUATORZE,MENS BUSINESS CARD WALLET SN3DL28MI0BL 男士名片包,http://static.lottedfs.cn/prod/prd-img/11/67/73/00/00/02/20000736711_1.JPG
,16152,20000605239,$111,瑞克朵丝,LOUIS QUATORZE,MENS BIFOLD HALF WALLET SN3DL27MF5BL 男士短款钱包,http://static.lottedfs.cn/prod/prd-img/08/67/73/00/00/02/20000736708_1.JPG
,16152,20000605232,$253,瑞克朵丝,LOUIS QUATORZE,WOMENS ONE SHOULDER HN3SD96FA0BL 女士单肩包,http://static.lottedfs.cn/prod/prd-img/01/67/73/00/00/02/20000736701_1.JPG
,16152,20000605229,$246,瑞克朵丝,LOUIS QUATORZE,WOMENS ONE SHOULDER HN3SD95FA0NA 女士单肩包,http://static.lottedfs.cn/prod/prd-img/98/66/73/00/00/02/20000736698_1.JPG
,16152,20000605228,$246,瑞克朵丝,LOUIS QUATORZE,WOMENS ONE SHOULDER HN3SD95FA0BL 女士单肩包,http://static.lottedfs.cn/prod/prd-img/97/66/73/00/00/02/20000736697_1.JPG
,16152,20000605223,$283,瑞克朵丝,LOUIS QUATORZE,WOMENS TOTE HN3SD92FA4IV 女士手提包,http://static.lottedfs.cn/prod/prd-img/91/66/73/00/00/02/20000736691_1.JPG
,16152,20000605217,$313,瑞克朵丝,LOUIS QUATORZE,WOMENS TOTE HN3SD91FA4IV 女士手提包,http://static.lottedfs.cn/prod/prd-img/80/66/73/00/00/02/20000736680_1.JPG
,16152,20000605216,$298,瑞克朵丝,LOUIS QUATORZE,WOMENS CROSSBODY HN3FM12FA9BL 女士斜挎包,http://static.lottedfs.cn/prod/prd-img/79/66/73/00/00/02/20000736679_1.JPG
,16152,20000605215,$388,瑞克朵丝,LOUIS QUATORZE,WOMENS ONE SHOULDER HN3FM11FA0BL 女士单肩包,http://static.lottedfs.cn/prod/prd-img/78/66/73/00/00/02/20000736678_1.JPG
,16152,20000605212,$358,瑞克朵丝,LOUIS QUATORZE,WOMENS SHOPPER(S) HN3DL37FA5BL 女士单肩包,http://static.lottedfs.cn/prod/prd-img/67/66/73/00/00/02/20000736667_1.JPG
畅销,16152,20000605210,$395,瑞克朵丝,LOUIS QUATORZE,WOMENS SHOPPER HN3DL36FA5BL 女士单肩包,http://static.lottedfs.cn/prod/prd-img/60/66/73/00/00/02/20000736660_1.JPG
,16152,20000605208,$373,瑞克朵丝,LOUIS QUATORZE,WOMENS SINGLE STRAP HOBO HN3DL16FA2BL 女士单肩包,http://static.lottedfs.cn/prod/prd-img/54/66/73/00/00/02/20000736654_1.JPG
,16152,20000605206,$328,瑞克朵丝,LOUIS QUATORZE,WOMENS ONE SHOULDER HN3DL07FA0BL 女士单肩包,http://static.lottedfs.cn/prod/prd-img/52/66/73/00/00/02/20000736652_1.JPG
,16152,20000605203,$373,瑞克朵丝,LOUIS QUATORZE,WOMENS TOTE HN3DL06FA4BL 女士手提包,http://static.lottedfs.cn/prod/prd-img/49/66/73/00/00/02/20000736649_1.JPG
畅销,16152,20000601685,$178,瑞克朵丝,LOUIS QUATORZE,WOMENS TRIFOLD HALF WALLET SN3FM04FF4BL 短款钱包,http://static.lottedfs.cn/prod/prd-img/08/95/72/00/00/02/20000729508_1.JPG
,16152,20000601684,$66,瑞克朵丝,LOUIS QUATORZE,MENS CARD CASE SN3DL16MI1BL 卡包,http://static.lottedfs.cn/prod/prd-img/07/95/72/00/00/02/20000729507_1.JPG
,16152,20000601681,$73,瑞克朵丝,LOUIS QUATORZE,MENS PASSPORT WALLET SM3SV01UI7STG 护照夹,http://static.lottedfs.cn/prod/prd-img/87/94/72/00/00/02/20000729487_1.JPG
,16152,20000601679,$73,瑞克朵丝,LOUIS QUATORZE,MENS PASSPORT WALLET SM3SV01UI7WI 护照夹,http://static.lottedfs.cn/prod/prd-img/88/94/72/00/00/02/20000729488_1.JPG
,16152,20000597193,$133,瑞克朵丝,LOUIS QUATORZE,WOMENS BIFOLD WALLET SN3FM05FF5RE 女士钱包,http://static.lottedfs.cn/prod/prd-img/84/94/71/00/00/02/20000719484_1.JPG
,16152,20000597188,$178,瑞克朵丝,LOUIS QUATORZE,WOMENS TRIFOLD WALLET SN3FM04FF4RE 女士钱包,http://static.lottedfs.cn/prod/prd-img/74/94/71/00/00/02/20000719474_1.JPG
畅销,16152,20000597182,$201,瑞克朵丝,LOUIS QUATORZE,WOMENS TRIFOLD WALLET SN3FM02FF0RE 长款钱包,http://static.lottedfs.cn/prod/prd-img/71/94/71/00/00/02/20000719471_1.JPG
,16152,20000597179,$85,瑞克朵丝,LOUIS QUATORZE,MENS BUSINESS WALLET SN3DL15MI0NA 男士名片包,http://static.lottedfs.cn/prod/prd-img/68/94/71/00/00/02/20000719468_1.JPG
,16152,20000597176,$85,瑞克朵丝,LOUIS QUATORZE,MENS BUSINESS WALLET SN3DL15MI0BR 男士名片包,http://static.lottedfs.cn/prod/prd-img/64/94/71/00/00/02/20000719464_1.JPG
,16152,20000597174,$85,瑞克朵丝,LOUIS QUATORZE,MENS BUSINESS WALLET SN3DL15MI0BL 名片包,http://static.lottedfs.cn/prod/prd-img/59/94/71/00/00/02/20000719459_1.JPG
,16152,20000597170,$103,瑞克朵丝,LOUIS QUATORZE,MENS MONEY CLIP SN3DL14MI2BR 男士钱夹,http://static.lottedfs.cn/prod/prd-img/54/94/71/00/00/02/20000719454_1.JPG
,16152,20000597167,$103,瑞克朵丝,LOUIS QUATORZE,MENS MONEY CLIP SN3DL14MI2BL 男士钱夹,http://static.lottedfs.cn/prod/prd-img/51/94/71/00/00/02/20000719451_1.JPG
,16152,20000597161,$133,瑞克朵丝,LOUIS QUATORZE,WOMENS BIFOLD HALF WALLET SN3DL13FF5YE 女士短款钱包,http://static.lottedfs.cn/prod/prd-img/34/94/71/00/00/02/20000719434_1.JPG
,16152,20000597157,$111,瑞克朵丝,LOUIS QUATORZE,MENS BIFOLD MEDIUM WALLET SN3DL12MF3BR 男士中款钱包,http://static.lottedfs.cn/prod/prd-img/29/94/71/00/00/02/20000719429_1.JPG
,16152,20000597156,$111,瑞克朵丝,LOUIS QUATORZE,MENS BIFOLD MEDIUM WALLET SN3DL12MF3BL 男士中款钱包,http://static.lottedfs.cn/prod/prd-img/28/94/71/00/00/02/20000719428_1.JPG
,16152,20000597141,$126,瑞克朵丝,LOUIS QUATORZE,MENS BIFOLD LONG WALLET SN3DL11MF1BR 男士长款钱包,http://static.lottedfs.cn/prod/prd-img/09/94/71/00/00/02/20000719409_1.JPG
,16152,20000597140,$126,瑞克朵丝,LOUIS QUATORZE,MENS BIFOLD LONG WALLET SN3DL11MF1BL 男士长款钱包,http://static.lottedfs.cn/prod/prd-img/08/94/71/00/00/02/20000719408_1.JPG
,16152,20000597136,$291,瑞克朵丝,LOUIS QUATORZE,WOMENS TRIFOLD MEDIUM WALLET SN1AT12FF2WI 女士中款钱包,http://static.lottedfs.cn/prod/prd-img/01/94/71/00/00/02/20000719401_1.JPG
畅销,16152,20000597135,$313,瑞克朵丝,LOUIS QUATORZE,WOMENS CROSSBODY(MLG) HN3FM01FA9RE 女士斜挎包,http://static.lottedfs.cn/prod/prd-img/00/94/71/00/00/02/20000719400_1.JPG
,16152,20000597133,$313,瑞克朵丝,LOUIS QUATORZE,WOMENS CROSSBODY(MLG) HN3FM01FA9BL 斜挎包,http://static.lottedfs.cn/prod/prd-img/98/93/71/00/00/02/20000719398_1.JPG
,16152,20000597131,$291,瑞克朵丝,LOUIS QUATORZE,WOMENS CROSSBODY HN3DL21FA9WI 斜挎包,http://static.lottedfs.cn/prod/prd-img/96/93/71/00/00/02/20000719396_1.JPG
畅销,16152,20000597106,$317,瑞克朵丝,LOUIS QUATORZE,WOMENS CROSSBODY HN3AT06FA9RE 斜挎包,http://static.lottedfs.cn/prod/prd-img/55/93/71/00/00/02/20000719355_1.JPG
,16152,20000592005,$186,瑞克朵丝,LOUIS QUATORZE,WOMENS TRIFOLD MEDIUM WALLET SN3FM03FF2BL 中款钱包,http://static.lottedfs.cn/prod/prd-img/79/99/70/00/00/02/20000709979_1.JPG
畅销,16152,20000592004,$171,瑞克朵丝,LOUIS QUATORZE,WOMENS SINGLE LONG WALLET SN3FM01FF9RE 长款钱包,http://static.lottedfs.cn/prod/prd-img/76/99/70/00/00/02/20000709976_1.JPG
,16152,20000591997,$171,瑞克朵丝,LOUIS QUATORZE,WOMENS SINGLE LONG WALLET SN3FM01FF9BL 长款钱包,http://static.lottedfs.cn/prod/prd-img/65/99/70/00/00/02/20000709965_1.JPG
,16152,20000591994,$77,瑞克朵丝,LOUIS QUATORZE,MENS BUSINESS CARD WALLET SN3DL05MI0BL 名片包,http://static.lottedfs.cn/prod/prd-img/57/99/70/00/00/02/20000709957_1.JPG
,16152,20000591989,$111,瑞克朵丝,LOUIS QUATORZE,MENS BIFOLD HALF WALLET SN3DL04MF5BL 短款钱包,http://static.lottedfs.cn/prod/prd-img/46/99/70/00/00/02/20000709946_1.JPG
,16152,20000591987,$111,瑞克朵丝,LOUIS QUATORZE,MENS BIFOLD MEDIUM WALLET SN3DL03MF3BL 中款钱包,http://static.lottedfs.cn/prod/prd-img/39/99/70/00/00/02/20000709939_1.JPG
,16152,20000591974,$126,瑞克朵丝,LOUIS QUATORZE,MENS BIFOLD LONG WALLET SN3DL02MF1BL 长款钱包,http://static.lottedfs.cn/prod/prd-img/22/99/70/00/00/02/20000709922_1.JPG
,16152,20000591973,$204,瑞克朵丝,LOUIS QUATORZE,MENS ZIP AROUND LONG WALLET SN3DL01MG0BL 长款钱包,http://static.lottedfs.cn/prod/prd-img/21/99/70/00/00/02/20000709921_1.JPG
,16152,20000591701,$223,瑞克朵丝,LOUIS QUATORZE,MENS BAG MN3DL04MD3BL 手拿包,http://static.lottedfs.cn/prod/prd-img/85/95/70/00/00/02/20000709585_1.JPG
,16152,20000591699,$212,瑞克朵丝,LOUIS QUATORZE,MENS CLUTCH MN3DL03MDABL 手拿包,http://static.lottedfs.cn/prod/prd-img/83/95/70/00/00/02/20000709583_1.JPG
,16152,20000591697,$268,瑞克朵丝,LOUIS QUATORZE,MENS MESSENGER MN3DL02MD2BL 男士斜挎包,http://static.lottedfs.cn/prod/prd-img/81/95/70/00/00/02/20000709581_1.JPG
,16152,20000591693,$343,瑞克朵丝,LOUIS QUATORZE,MENS BRIEFCASE MN3DL01MD0BL 公文包,http://static.lottedfs.cn/prod/prd-img/77/95/70/00/00/02/20000709577_1.JPG
,16152,20000591691,$317,瑞克朵丝,LOUIS QUATORZE,WOMENS CROSSBODY HN3AT06FA9BL 女士斜挎包,http://static.lottedfs.cn/prod/prd-img/75/95/70/00/00/02/20000709575_1.JPG
,16152,20000588362,$126,瑞克朵丝,LOUIS QUATORZE,WOMENS CARD WALLET SN3DL35FI1BL 女士卡包,http://static.lottedfs.cn/prod/prd-img/12/39/70/00/00/02/20000703912_1.JPG
畅销,16152,20000588341,$193,瑞克朵丝,LOUIS QUATORZE,WOMENS TRIFOLD LONG WALLET SN3DL32FF0BL 女士长款钱包,http://static.lottedfs.cn/prod/prd-img/83/38/70/00/00/02/20000703883_1.JPG
,16152,20000588334,$148,瑞克朵丝,LOUIS QUATORZE,WOMENS LONG WALLET SN3DL31FF9BL 女士长款钱包,http://static.lottedfs.cn/prod/prd-img/63/38/70/00/00/02/20000703863_1.JPG
,16152,20000588323,$55,瑞克朵丝,LOUIS QUATORZE,MENS CARD WALLET SN3DL08MI1BL 男士卡包,http://static.lottedfs.cn/prod/prd-img/25/38/70/00/00/02/20000703825_1.JPG
,16152,20000588319,$69,瑞克朵丝,LOUIS QUATORZE,MENS BUSINESS CARD WALLET SN3DL07MI0GA 男士名片包,http://static.lottedfs.cn/prod/prd-img/21/38/70/00/00/02/20000703821_1.JPG
,16152,20000588308,$69,瑞克朵丝,LOUIS QUATORZE,MENS BUSINESS CARD WALLET SN3DL07MI0BL 男士名片包,http://static.lottedfs.cn/prod/prd-img/10/38/70/00/00/02/20000703810_1.JPG
,16152,20000588303,$118,瑞克朵丝,LOUIS QUATORZE,MENS BIFOLD HALF WALLET SN3DL06MF5GA 男士短款钱包,http://static.lottedfs.cn/prod/prd-img/05/38/70/00/00/02/20000703805_1.JPG
,16152,20000588302,$118,瑞克朵丝,LOUIS QUATORZE,MENS BIFOLD HALF WALLET SN3DL06MF5BL 男士短款钱包,http://static.lottedfs.cn/prod/prd-img/04/38/70/00/00/02/20000703804_1.JPG
,16152,20000588299,$178,瑞克朵丝,LOUIS QUATORZE,WOMENS TRIFOLD HALF WALLET SN3DL04FF4RE 女士短款钱包,http://static.lottedfs.cn/prod/prd-img/01/38/70/00/00/02/20000703801_1.JPG
畅销,16152,20000588261,$201,瑞克朵丝,LOUIS QUATORZE,WOMENS TRIFOLD HALF WALLET SN3DL02FF0RE 女士短款钱包,http://static.lottedfs.cn/prod/prd-img/63/37/70/00/00/02/20000703763_1.JPG
畅销,16152,20000588241,$336,瑞克朵丝,LOUIS QUATORZE,WOMENS TRIFOLD LONG WALLET SN1AT11FF0WI 女士长款钱包,http://static.lottedfs.cn/prod/prd-img/30/37/70/00/00/02/20000703730_1.JPG
,16152,20000588225,$118,瑞克朵丝,LOUIS QUATORZE,MENS CARD WALLET SN1AT05MI1NA 男士卡包,http://static.lottedfs.cn/prod/prd-img/14/37/70/00/00/02/20000703714_1.JPG
,16152,20000588222,$118,瑞克朵丝,LOUIS QUATORZE,MENS CARD WALLET SN1AT05MI1BR 男士卡包,http://static.lottedfs.cn/prod/prd-img/11/37/70/00/00/02/20000703711_1.JPG
,16152,20000588220,$126,瑞克朵丝,LOUIS QUATORZE,MENS CARD WALLET SN1AT03MI1NA 男士卡包,http://static.lottedfs.cn/prod/prd-img/09/37/70/00/00/02/20000703709_1.JPG
,16152,20000588209,$253,瑞克朵丝,LOUIS QUATORZE,WOMENS DRAWSTRING HN3FM07FB8RE 女士水桶包,http://static.lottedfs.cn/prod/prd-img/98/36/70/00/00/02/20000703698_1.JPG
,16152,20000588207,$253,瑞克朵丝,LOUIS QUATORZE,WOMENS DRAWSTRING HN3FM07FB8IV 女士水桶包,http://static.lottedfs.cn/prod/prd-img/96/36/70/00/00/02/20000703696_1.JPG
,16152,20000588196,$253,瑞克朵丝,LOUIS QUATORZE,WOMENS DRAWSTRING HN3FM07FB8BL 女士水桶包,http://static.lottedfs.cn/prod/prd-img/85/36/70/00/00/02/20000703685_1.JPG
,16152,20000588192,$291,瑞克朵丝,LOUIS QUATORZE,WOMENS ONE SHOULDER HN3DL26FA0PI 女士单肩包,http://static.lottedfs.cn/prod/prd-img/81/36/70/00/00/02/20000703681_1.JPG
,16152,20000588190,$291,瑞克朵丝,LOUIS QUATORZE,WOMENS ONE SHOULDER HN3DL26FA0IV 女士单肩包,http://static.lottedfs.cn/prod/prd-img/79/36/70/00/00/02/20000703679_1.JPG
,16152,20000588187,$291,瑞克朵丝,LOUIS QUATORZE,WOMENS ONE SHOULDER HN3DL26FA0BL 女士单肩包,http://static.lottedfs.cn/prod/prd-img/76/36/70/00/00/02/20000703676_1.JPG
,16152,20000588184,$358,瑞克朵丝,LOUIS QUATORZE,WOMENS ONE SHOULDER HN3DL12FA0TP 女士单肩包,http://static.lottedfs.cn/prod/prd-img/73/36/70/00/00/02/20000703673_1.JPG
畅销,16152,20000588182,$358,瑞克朵丝,LOUIS QUATORZE,WOMENS ONE SHOULDER HN3DL12FA0BL 女士单肩包,http://static.lottedfs.cn/prod/prd-img/71/36/70/00/00/02/20000703671_1.JPG
,16152,20000588180,$373,瑞克朵丝,LOUIS QUATORZE,WOMENS ONE SHOULDER HN3DL11FA0TP 女士单肩包,http://static.lottedfs.cn/prod/prd-img/69/36/70/00/00/02/20000703669_1.JPG
,16152,20000588174,$373,瑞克朵丝,LOUIS QUATORZE,WOMENS ONE SHOULDER HN3DL11FA0BL 女士单肩包,http://static.lottedfs.cn/prod/prd-img/63/36/70/00/00/02/20000703663_1.JPG
,16152,20000581094,$103,瑞克朵丝,LOUIS QUATORZE,MENS CARD WALLET SN1AT04MI1BR 男士卡包,http://static.lottedfs.cn/prod/prd-img/30/17/69/00/00/02/20000691730_1.JPG
,16152,20000581092,$246,瑞克朵丝,LOUIS QUATORZE,WOMENS BACKPACK HN1SD05FB2BL 女士背包,http://static.lottedfs.cn/prod/prd-img/28/17/69/00/00/02/20000691728_1.JPG
畅销,16152,20000570691,$163,瑞克朵丝,LOUIS QUATORZE,WOMENS BIFOLD HALF WALLET SN1DL21FF5PI 短款钱包,http://static.lottedfs.cn/prod/prd-img/78/66/67/00/00/02/20000676678_1.JPG
畅销,16152,20000570687,$298,瑞克朵丝,LOUIS QUATORZE,WOMENS SINGLE STRAP HOBO HN1SD07FA2BL 单肩包,http://static.lottedfs.cn/prod/prd-img/74/66/67/00/00/02/20000676674_1.JPG
,16152,20000562835,$148,瑞克朵丝,LOUIS QUATORZE,WOMENS TRIFOLD LONG WALLET SN1SD05FF0TA 女士长款钱包,http://static.lottedfs.cn/prod/prd-img/10/59/66/00/00/02/20000665910_1.JPG
,16152,20000562834,$92,瑞克朵丝,LOUIS QUATORZE,MENS BIFOLD HALF WALLET SN1SD04MF5BL 男士短款钱包,http://static.lottedfs.cn/prod/prd-img/09/59/66/00/00/02/20000665909_1.JPG
,16152,20000562833,$148,瑞克朵丝,LOUIS QUATORZE,WOMENS ZIPPER ROUND LONG WALLET SN1SD04FG0TA 长款钱包,http://static.lottedfs.cn/prod/prd-img/08/59/66/00/00/02/20000665908_1.JPG
,16152,20000562832,$81,瑞克朵丝,LOUIS QUATORZE,WOMENS BUSINESS WALLET SN1SD03FI0GA 女士名片包,http://static.lottedfs.cn/prod/prd-img/07/59/66/00/00/02/20000665907_1.JPG
,16152,20000562829,$81,瑞克朵丝,LOUIS QUATORZE,WOMENS BUSINESS WALLET SN1SD03FI0BL 女士名片包,http://static.lottedfs.cn/prod/prd-img/04/59/66/00/00/02/20000665904_1.JPG
,16152,20000562828,$223,瑞克朵丝,LOUIS QUATORZE,WOMENS ONE SHOULDER HN1SD12FD6BL 单肩包,http://static.lottedfs.cn/prod/prd-img/03/59/66/00/00/02/20000665903_1.JPG
,16152,20000562827,$261,瑞克朵丝,LOUIS QUATORZE,WOMENS SATCHEL HN1SD11FB3BL 手提包,http://static.lottedfs.cn/prod/prd-img/02/59/66/00/00/02/20000665902_1.JPG
,16152,20000558216,$133,瑞克朵丝,LOUIS QUATORZE,WOMENS TRIFOLD MEDIUM WALLET SN1SD06FF2TA 女士中款钱包,http://static.lottedfs.cn/prod/prd-img/41/87/65/00/00/02/20000658741_1.JPG
,16152,20000558210,$115,瑞克朵丝,LOUIS QUATORZE,WOMENS TRIFOLD HALF WALLET SN1SD02FF4BL 女士短款钱包,http://static.lottedfs.cn/prod/prd-img/32/87/65/00/00/02/20000658732_1.JPG
,16152,20000558208,$122,瑞克朵丝,LOUIS QUATORZE,WOMENS BIFOLD LONG WALLET SN1SD01FF1GA 女士长款钱包,http://static.lottedfs.cn/prod/prd-img/30/87/65/00/00/02/20000658730_1.JPG
,16152,20000558204,$122,瑞克朵丝,LOUIS QUATORZE,WOMENS BIFOLD LONG WALLET SN1SD01FF1BL 女士长款钱包,http://static.lottedfs.cn/prod/prd-img/26/87/65/00/00/02/20000658726_1.JPG
畅销,16152,20000558157,$178,瑞克朵丝,LOUIS QUATORZE,WOMENS TRIFOLD HALF WALLET SN1DL18FF4BL 女士短款钱包,http://static.lottedfs.cn/prod/prd-img/62/86/65/00/00/02/20000658662_1.JPG
,16152,20000558153,$253,瑞克朵丝,LOUIS QUATORZE,WOMENS POUCH SN1AT03FJ0TA 收纳包,http://static.lottedfs.cn/prod/prd-img/58/86/65/00/00/02/20000658658_1.JPG
,16152,20000558150,$253,瑞克朵丝,LOUIS QUATORZE,WOMENS POUCH SN1AT03FJ0BL 收纳包,http://static.lottedfs.cn/prod/prd-img/55/86/65/00/00/02/20000658655_1.JPG
,16152,20000558147,$171,瑞克朵丝,LOUIS QUATORZE,WOMENS ZIPPER ROUND HALF WALLET SN1AT02FG2WI 女士短款钱包,http://static.lottedfs.cn/prod/prd-img/52/86/65/00/00/02/20000658652_1.JPG
,16152,20000558145,$171,瑞克朵丝,LOUIS QUATORZE,WOMENS ZIPPER ROUND HALF WALLET SN1AT02FG2TA 短款钱包,http://static.lottedfs.cn/prod/prd-img/50/86/65/00/00/02/20000658650_1.JPG
畅销,16152,20000558140,$223,瑞克朵丝,LOUIS QUATORZE,WOMENS BIFOLD LONG WALLET SN1AT01FF1TA 长款钱包,http://static.lottedfs.cn/prod/prd-img/45/86/65/00/00/02/20000658645_1.JPG
,16152,20000558137,$223,瑞克朵丝,LOUIS QUATORZE,WOMENS BIFOLD LONG WALLET SN1AT01FF1BL 女士长款钱包,http://static.lottedfs.cn/prod/prd-img/42/86/65/00/00/02/20000658642_1.JPG
,16152,20000558134,$298,瑞克朵丝,LOUIS QUATORZE,WOMENS ONE STRAP HOBO HN1SD08FA2TA 单肩包,http://static.lottedfs.cn/prod/prd-img/39/86/65/00/00/02/20000658639_10.JPG
,16152,20000557996,$92,瑞克朵丝,LOUIS QUATORZE,MENS BIFOLD HALF WALLET SN1SD05MF5BR 男士短款钱包,http://static.lottedfs.cn/prod/prd-img/53/84/65/00/00/02/20000658453_1.JPG
,16152,20000557991,$92,瑞克朵丝,LOUIS QUATORZE,MENS BIFOLD HALF WALLET SN1SD04MF5NA 男士短款钱包,http://static.lottedfs.cn/prod/prd-img/48/84/65/00/00/02/20000658448_1.JPG
,16152,20000557988,$96,瑞克朵丝,LOUIS QUATORZE,MENS BIFOLD HALF WALLET SN1SD03MF5BL 男士短款钱包,http://static.lottedfs.cn/prod/prd-img/45/84/65/00/00/02/20000658445_1.JPG
,16152,20000557986,$171,瑞克朵丝,LOUIS QUATORZE,WOMENS CLUTCH HN1AT16FA8WI 女士手拿包,http://static.lottedfs.cn/prod/prd-img/43/84/65/00/00/02/20000658443_1.JPG
,16152,20000557982,$58,瑞克朵丝,LOUIS QUATORZE,MENS BUSINESS WALLET SN1SD02MI0BR 男士名片夹,http://static.lottedfs.cn/prod/prd-img/39/84/65/00/00/02/20000658439_1.JPG
,16152,20000557979,$58,瑞克朵丝,LOUIS QUATORZE,MENS BUSINESS WALLET SN1SD02MI0BL 男士名片夹,http://static.lottedfs.cn/prod/prd-img/36/84/65/00/00/02/20000658436_1.JPG
,16152,20000557976,$77,瑞克朵丝,LOUIS QUATORZE,MENS HALF WALLET(SLIM) SN1SD01MFSBR 男士短款钱包,http://static.lottedfs.cn/prod/prd-img/30/84/65/00/00/02/20000658430_1.JPG
,16152,20000557972,$77,瑞克朵丝,LOUIS QUATORZE,MENS HALF WALLET(SLIM) SN1SD01MFSBL 男士短款钱包,http://static.lottedfs.cn/prod/prd-img/23/84/65/00/00/02/20000658423_1.JPG
,16152,20000557967,$171,瑞克朵丝,LOUIS QUATORZE,WOMENS CLUTCH HN1AT16FA8BL 女士手拿包,http://static.lottedfs.cn/prod/prd-img/18/84/65/00/00/02/20000658418_1.JPG
,16152,20000557961,$448,瑞克朵丝,LOUIS QUATORZE,WOMENS CROSSBODY BAG HN1AT07FA9WI 女士斜挎包,http://static.lottedfs.cn/prod/prd-img/12/84/65/00/00/02/20000658412_1.JPG
,16152,20000557959,$448,瑞克朵丝,LOUIS QUATORZE,WOMENS CROSSBODY BAG HN1AT07FA9WH 女士斜挎包,http://static.lottedfs.cn/prod/prd-img/10/84/65/00/00/02/20000658410_1.JPG
,16152,20000557956,$448,瑞克朵丝,LOUIS QUATORZE,WOMENS CROSSBODY BAG HN1AT07FA9BL 女士斜挎包,http://static.lottedfs.cn/prod/prd-img/07/84/65/00/00/02/20000658407_1.JPG
