tag,brand_No,product_No,us_price,brand_name_chn,brand_name_eng,product_name,img_url
畅销,17707,20000509692,$122,惠人,HUROM,HUROM TEA MASTER TM-B04FSS 电热水壶,http://static.lottedfs.cn/prod/prd-img/62/88/57/00/00/02/20000578862_5.jpg
畅销,17707,20000584617,$310,惠人,HUROM,HUROM JUICER H-100S-RBFA02 榨汁机,http://static.lottedfs.cn/prod/prd-img/03/72/69/00/00/02/20000697203_2.jpg
,17707,20000584614,$310,惠人,HUROM,HUROM JUICER H-100S-IBFA02 榨汁机,http://static.lottedfs.cn/prod/prd-img/00/72/69/00/00/02/20000697200_1.jpg
,17707,20000584610,$76,惠人,HUROM,HUROM QUICK SQUEEZER CJ-B02FSS 榨汁机,http://static.lottedfs.cn/prod/prd-img/96/71/69/00/00/02/20000697196_2.jpg
,17707,20000584607,$76,惠人,HUROM,HUROM QUICK SQUEEZER CJ-B02FPP 榨汁机,http://static.lottedfs.cn/prod/prd-img/93/71/69/00/00/02/20000697193_1.jpg
,17707,20000584603,$76,惠人,HUROM,HUROM QUICK SQUEEZER CJ-B02FPB 榨汁机,http://static.lottedfs.cn/prod/prd-img/89/71/69/00/00/02/20000697189_1.jpg
畅销,17707,20000458059,$339,惠人,HUROM,HUROM JUICER H-100-DBFA01 榨汁机,http://static.lottedfs.cn/prod/prd-img/32/98/49/00/00/02/20000499832_3.jpg
,17707,20000458051,$339,惠人,HUROM,HUROM JUICER H-100-EBFA01 榨汁机,http://static.lottedfs.cn/prod/prd-img/24/98/49/00/00/02/20000499824_2.jpg
