tag,brand_No,product_No,us_price,brand_name_chn,brand_name_eng,product_name,img_url
赠品,16085,20000478894,$30,蒂佳婷,Dr.Jart+,DERMAKEUP FIXISON FOUNDATION  粉底液 30ml 02 PINK MEDIUM,http://static.lottedfs.cn/prod/prd-img/63/00/53/00/00/02/20000530063_1.jpg
赠品,16085,20000477013,$14,蒂佳婷,Dr.Jart+,DERMAKEUP POWER BALM CONCEALER 遮瑕膏 02 MEDIUM,http://static.lottedfs.cn/prod/prd-img/84/72/52/00/00/02/20000527284_1.jpg
赠品,16085,20000456037,$27,蒂佳婷,Dr.Jart+,FOCUSPOT PORE MELTING PATCH 5 SHEETS,http://static.lottedfs.cn/prod/prd-img/22/70/49/00/00/02/20000497022_1.jpg
赠品,16085,20000456027,$19,蒂佳婷,Dr.Jart+,FOCUSPOT DARK MELTING PATCH 5 SHEETS,http://static.lottedfs.cn/prod/prd-img/08/70/49/00/00/02/20000497008_1.jpg
免税独家 赠品,16085,20000439813,$64,蒂佳婷,Dr.Jart+,CERAMIDIN GLOSSY SET  基础护肤套装,http://static.lottedfs.cn/prod/prd-img/79/25/47/00/00/02/20000472579_1.jpg
赠品,16085,20000188823,$98,蒂佳婷,Dr.Jart+,DERMASK ULTRA JET PORECTING SOLUTION 面膜 50片,http://static.lottedfs.cn/prod/prd-img/71/57/19/00/00/02/20000195771_1.jpg
赠品,16085,10003198091,$18,蒂佳婷,Dr.Jart+,DERMASK WATER JET VITAL HYDRA SLEEPING MASK    睡眠面膜  120ml,http://static.lottedfs.cn/prod/prd-img/91/80/19/03/00/01/10003198091_01.jpg
赠品,16085,10002338676,$27,蒂佳婷,Dr.Jart+,DTRT SERUM BRIGHT IDEA   男士精华素 140ml,http://static.lottedfs.cn/prod/prd-img/76/86/33/02/00/01/10002338676_01.jpg
畅销 赠品,16085,10002245387,$27,蒂佳婷,Dr.Jart+,DTRT LOTION DEAR MATT  乳液 140ml,http://static.lottedfs.cn/prod/prd-img/87/53/24/02/00/01/10002245387_3.jpg
