tag,brand_No,product_No,us_price,brand_name_chn,brand_name_eng,product_name,img_url
,19870,20000387392,$895,布克兄弟,BROOKSBROTHERS,TECHNICAL WOOL DOWN FILLED TRENCH  男士外套,http://static.lottedfs.cn/prod/prd-img/26/23/40/00/00/02/20000402326_1.jpg
,19870,20000371303,$102,布克兄弟,BROOKSBROTHERS,INDIGO DYED TARTAN COTTON CORDUROY SPORT SHIRT 男士衬衫,http://static.lottedfs.cn/prod/prd-img/87/19/38/00/00/02/20000381987_1.jpg
,19870,20000194588,$49,布克兄弟,BROOKSBROTHERS,SILK POCKET SQUARE MEDIUM PINK OS,http://static.lottedfs.cn/prod/prd-img/33/29/20/00/00/02/20000202933_4.jpg
,19870,10003130427,$163,布克兄弟,BROOKSBROTHERS,DS ORIG OX PBD MIL SOLID WHT   衬衫,http://static.lottedfs.cn/prod/prd-img/64/65/60/00/00/02/20000606564_3.jpg
,19870,10003130235,$120,布克兄弟,BROOKSBROTHERS,BELT CLF DRESS GLD BLK 腰带,http://static.lottedfs.cn/prod/prd-img/42/02/13/03/00/01/10003130242_3.jpg
,19870,10003129953,$124,布克兄弟,BROOKSBROTHERS,REGENT FIT IRISH LINEN SPORT SHIRT 衬衫 DARK BLUE,http://static.lottedfs.cn/prod/prd-img/53/99/12/03/00/01/10003129953_1.jpg
,19870,10003129894,$124,布克兄弟,BROOKSBROTHERS,REGENT FIT IRISH LINEN SPORT SHIRT 衬衫 LIGHT/PASTEL BLUE,http://static.lottedfs.cn/prod/prd-img/94/98/12/03/00/01/10003129894_2.jpg
畅销,19870,20000613481,$241,布克兄弟,BROOKSBROTHERS,SWEATER REDFLEECE BOMBER 开衫,http://static.lottedfs.cn/prod/prd-img/67/16/75/00/00/02/20000751667_1.jpg
,19870,20000613405,$67,布克兄弟,BROOKSBROTHERS,GARMENT DYED COTTON BROADCLOTH SPORT SHIRT 衬衫,http://static.lottedfs.cn/prod/prd-img/54/14/75/00/00/02/20000751454_1.jpg
促销,19870,20000605582,$106,布克兄弟,BROOKSBROTHERS,MILANO SLIM-FIT DARTED DRESS SHIT NON-IRON SPREAD COLLAR 衬衫,http://static.lottedfs.cn/prod/prd-img/13/75/73/00/00/02/20000737513_4.jpg
,19870,20000603924,$176,布克兄弟,BROOKSBROTHERS,SWEATER RF HALFZIP 男士针织衫,http://static.lottedfs.cn/prod/prd-img/81/45/73/00/00/02/20000734581_1.jpg
,19870,20000596605,$84,布克兄弟,BROOKSBROTHERS,MERINO WOOL CREWNECK SWEATER 针织衫,http://static.lottedfs.cn/prod/prd-img/37/83/71/00/00/02/20000718337_1.jpg
促销,19870,20000534488,$131,布克兄弟,BROOKSBROTHERS,CANVAS WITH LEATHER BELT 腰带,http://static.lottedfs.cn/prod/prd-img/23/63/61/00/00/02/20000616323_1.jpg
,19870,20000534485,$92,布克兄弟,BROOKSBROTHERS,HERRINGBONE FIVE-POCKET PANTS 男士裤子,http://static.lottedfs.cn/prod/prd-img/12/63/61/00/00/02/20000616312_1.jpg
,19870,20000534484,$92,布克兄弟,BROOKSBROTHERS,HERRINGBONE FIVE-POCKET PANTS 男士裤子,http://static.lottedfs.cn/prod/prd-img/09/63/61/00/00/02/20000616309_1.jpg
促销,19870,20000534465,$533,布克兄弟,BROOKSBROTHERS,WATER-REPELLENT STRETCH HYBRID JACKET 男士外套,http://static.lottedfs.cn/prod/prd-img/18/62/61/00/00/02/20000616218_1.jpg
