tag,brand_No,product_No,us_price,brand_name_chn,brand_name_eng,product_name,img_url
,16435,20000508163,$7,伊蒂之屋,ETUDE,DEAR MY BLOOMING LIPS TALK 口红 TAKEOUT WITHOUT SYRUP,http://static.lottedfs.cn/prod/prd-img/93/65/57/00/00/02/20000576593_1.png
,16435,20000504907,$18,伊蒂之屋,ETUDE,TINY TWINKLE COLORFUL SCENT PERFUMED HAND CREAM 护手霜套装,http://static.lottedfs.cn/prod/prd-img/35/29/57/00/00/02/20000572935_4.jpg
,16435,20000504900,$20,伊蒂之屋,ETUDE,TINY TWINKLE MOISTFULL COLLAGEN 2 PIECES SET 基础护肤套装,http://static.lottedfs.cn/prod/prd-img/24/29/57/00/00/02/20000572924_2.png
,16435,20000498588,$17,伊蒂之屋,ETUDE,BUTTER PLOP HAND CREAM 护手霜4件套装,http://static.lottedfs.cn/prod/prd-img/27/29/56/00/00/02/20000562927_5.png
,16435,20000497856,$5,伊蒂之屋,ETUDE,MY BEAUTY TOOL ROOT VOLUME PIN 卷发筒 2P,http://static.lottedfs.cn/prod/prd-img/33/18/56/00/00/02/20000561833_1.jpg
,16435,20000497482,$9,伊蒂之屋,ETUDE,MY BEAUTY TOOL MACARON PUFF  粉扑 3个,http://static.lottedfs.cn/prod/prd-img/98/10/56/00/00/02/20000561098_1.png
,16435,20000497369,$12,伊蒂之屋,ETUDE,DEAR MY BLOOMING LIPS TALK BAD ROSE MINI KIT 口红迷你套装,http://static.lottedfs.cn/prod/prd-img/06/08/56/00/00/02/20000560806_1.jpg
赠品,16435,20000490803,$40,伊蒂之屋,ETUDE,PLAY 101 STICK CONTOUR DUO NEW 美妆棒套装 4SET,http://static.lottedfs.cn/prod/prd-img/11/97/54/00/00/02/20000549711_1.JPG
,16435,20000489424,$5,伊蒂之屋,ETUDE,DOUBLE LASTING SERUM FOUNDATION MINI SPF25/PA++ 粉底液,http://static.lottedfs.cn/prod/prd-img/03/73/54/00/00/02/20000547303_1.png
,16435,20000489250,$6,伊蒂之屋,ETUDE,MY BEAUTY TOOL MICROFIBER CLEANSING PAD 超细纤维洁面扑 （2个）,http://static.lottedfs.cn/prod/prd-img/42/70/54/00/00/02/20000547042_1.png
,16435,20000488726,$51,伊蒂之屋,ETUDE,PLAY COLOR EYES CAFFEINE HOLIC 3SET 眼影盘 3件套,http://static.lottedfs.cn/prod/prd-img/48/59/54/00/00/02/20000545948_1.png
,16435,20000487612,$12,伊蒂之屋,ETUDE,DOUBLE LASTING GLOW MASTER BRUSH 化妆刷,http://static.lottedfs.cn/prod/prd-img/09/40/54/00/00/02/20000544009_1.jpg
,16435,20000487602,$7,伊蒂之屋,ETUDE,BROW VOLUMIZER,http://static.lottedfs.cn/prod/prd-img/92/39/54/00/00/02/20000543992_1.png
,16435,20000484063,$14,伊蒂之屋,ETUDE,DOUBLE LASTING SERUM FOUNDATION  SPF25/PA++ 粉底液,http://static.lottedfs.cn/prod/prd-img/96/81/53/00/00/02/20000538196_1.png
,16435,20000476204,$6,伊蒂之屋,ETUDE,SUGAR PAW BRUSH CLEANING PAD 化妆刷清洗垫,http://static.lottedfs.cn/prod/prd-img/76/60/52/00/00/02/20000526076_1.jpg
,16435,20000474650,$6,伊蒂之屋,ETUDE,MY BEAUTY TOOL ACORN PUFF 海绵粉扑,http://static.lottedfs.cn/prod/prd-img/86/38/52/00/00/02/20000523886_1.jpg
畅销,16435,20000474609,$46,伊蒂之屋,ETUDE,PLAY COLOR EYES SS SET 眼影套装,http://static.lottedfs.cn/prod/prd-img/21/38/52/00/00/02/20000523821_1.JPG
,16435,20000467509,$11,伊蒂之屋,ETUDE,3 MINUTES CARE IN MORNING MASK  抽取式面膜,http://static.lottedfs.cn/prod/prd-img/79/23/51/00/00/02/20000512379_1.jpg
,16435,20000466535,$8,伊蒂之屋,ETUDE,3 MINUTES CARE MASK PACK BLACK BEAN  3分保养面膜(黑豆) 5+5,http://static.lottedfs.cn/prod/prd-img/30/06/51/00/00/02/20000510630_1.JPG
,16435,20000466526,$8,伊蒂之屋,ETUDE,3 MINUTES CARE MASK PACK TURMERIC  3分保养面膜(姜黄) 5+5,http://static.lottedfs.cn/prod/prd-img/20/06/51/00/00/02/20000510620_1.JPG
,16435,20000464648,$6,伊蒂之屋,ETUDE,SOFT DRINK TINT  染唇液,http://static.lottedfs.cn/prod/prd-img/86/85/50/00/00/02/20000508586_2.jpg
,16435,20000464237,$23,伊蒂之屋,ETUDE,SOFT DRINK TINT VENDING MACHINE 4 PIECES SET 染唇液套装,http://static.lottedfs.cn/prod/prd-img/28/80/50/00/00/02/20000508028_1.jpg
,16435,20000458672,$7,伊蒂之屋,ETUDE,HAIR SECRET DRY SHAMPOO SHEETS,http://static.lottedfs.cn/prod/prd-img/40/09/50/00/00/02/20000500940_1.png
,16435,20000458665,$19,伊蒂之屋,ETUDE,DRY SKIN T.A.P.A SILK BLANKET MOISTURIZING MASK 面膜套装,http://static.lottedfs.cn/prod/prd-img/25/09/50/00/00/02/20000500925_1.JPG
,16435,20000457275,$6,伊蒂之屋,ETUDE,DOUBLE LASTING FOUNDATION BLENDER  恒妆匀净海绵粉扑,http://static.lottedfs.cn/prod/prd-img/31/88/49/00/00/02/20000498831_1.jpg
,16435,20000457241,$10,伊蒂之屋,ETUDE,ICING COOLER,http://static.lottedfs.cn/prod/prd-img/73/87/49/00/00/02/20000498773_1.png
,16435,20000456941,$12,伊蒂之屋,ETUDE,SOON JUNG 2X BARRIER INTENSIVE CREAM 保湿面霜 60ml,http://static.lottedfs.cn/prod/prd-img/57/82/49/00/00/02/20000498257_1.jpg
,16435,20000454389,$39,伊蒂之屋,ETUDE,DEAR MY BLOOMING LIPS - TALK ROSE KISS EDITION  口红套装,http://static.lottedfs.cn/prod/prd-img/08/47/49/00/00/02/20000494708_1.png
,16435,20000450203,$6,伊蒂之屋,ETUDE,BIG COVER SKIN FIT CONCEALER PRO  遮瑕液,http://static.lottedfs.cn/prod/prd-img/51/91/48/00/00/02/20000489151_1.jpg
,16435,20000441441,$18,伊蒂之屋,ETUDE,SOONJUNG PH 5.5 RELIEF TONER JUMBO PROMOTION SET 护肤水套装,http://static.lottedfs.cn/prod/prd-img/13/49/47/00/00/02/20000474913_1.jpg
,16435,20000441438,$9,伊蒂之屋,ETUDE,CHERRY BLOSSOM BLEND FOR EYES 眼影,http://static.lottedfs.cn/prod/prd-img/07/49/47/00/00/02/20000474907_1.jpg
,16435,20000441434,$12,伊蒂之屋,ETUDE,FACE LIQUID BLUR [CHERRY BLOSSOM EDITION] SPF50+/PA++++  妆前乳,http://static.lottedfs.cn/prod/prd-img/03/49/47/00/00/02/20000474903_3.jpg
,16435,20000441423,$9,伊蒂之屋,ETUDE,MATTE CHIC LIP LACQUER 染唇液,http://static.lottedfs.cn/prod/prd-img/89/48/47/00/00/02/20000474889_6.jpg
,16435,20000438441,$2,伊蒂之屋,ETUDE,MY BEAUTY TOOL COLOR HAIR PIECE,http://static.lottedfs.cn/prod/prd-img/99/99/46/00/00/02/20000469999_1.png
,16435,20000430612,$24,伊蒂之屋,ETUDE,MINI TWO MATCH TIN SET MINI TWO MATCH TIN SET 迷你口红套装 1号,http://static.lottedfs.cn/prod/prd-img/75/56/45/00/00/02/20000455675_1.png
赠品,16435,20000430609,$60,伊蒂之屋,ETUDE,MOISTFULL COLLAGEN 2 PIECES DUTY FREE SET 基础护肤套装 3+1,http://static.lottedfs.cn/prod/prd-img/67/56/45/00/00/02/20000455667_1.jpg
赠品,16435,20000430607,$35,伊蒂之屋,ETUDE,FACE BLUR  妆前乳套装 3+1,http://static.lottedfs.cn/prod/prd-img/65/56/45/00/00/02/20000455665_1.JPG
赠品,16435,20000430604,$100,伊蒂之屋,ETUDE,FACE BLUR DUTY FREE 3 PIECES SET 妆前乳 买3送1,http://static.lottedfs.cn/prod/prd-img/62/56/45/00/00/02/20000455662_1.JPG
,16435,20000424319,$7,伊蒂之屋,ETUDE,COLORFUL DRAWING EYESHADOW BRUSH 眼影刷,http://static.lottedfs.cn/prod/prd-img/56/68/44/00/00/02/20000446856_1.jpg
,16435,20000424318,$7,伊蒂之屋,ETUDE,COLORFUL DRAWING CREAM BLUSHER BRUSH 腮红刷,http://static.lottedfs.cn/prod/prd-img/55/68/44/00/00/02/20000446855_1.jpg
,16435,20000424254,$11,伊蒂之屋,ETUDE,COLORFUL DRAWING FANTASTIC COLOR EYES NO2  眼影 2号 VERMILION DRAWING,http://static.lottedfs.cn/prod/prd-img/45/67/44/00/00/02/20000446745_1.jpg
,16435,20000424206,$11,伊蒂之屋,ETUDE,COLORFUL DRAWING FANTASTIC COLOR EYES  眼影  1号 MAGENTA DRAWING,http://static.lottedfs.cn/prod/prd-img/89/66/44/00/00/02/20000446689_1.jpg
,16435,20000419287,$27,伊蒂之屋,ETUDE,DARK SPOT TAPA VITA FILM MASK 20PEA SET 面膜 20片套装,http://static.lottedfs.cn/prod/prd-img/17/99/43/00/00/02/20000439917_1.jpg
,16435,20000414487,$20,伊蒂之屋,ETUDE,LUCKY PUPPY MOISTFULL COLLAGEN SKINCARE SET 2 PIECES   基础护肤2件套装,http://static.lottedfs.cn/prod/prd-img/48/36/43/00/00/02/20000433648_2.jpg
,16435,20000413027,$8,伊蒂之屋,ETUDE,BAKING POWDER PORE CLEANSING FOAM NEW JUMBO SIZE   苏打粉深层毛孔洁面乳大容量 300ml,http://static.lottedfs.cn/prod/prd-img/62/17/43/00/00/02/20000431762_1.jpg
,16435,20000404429,$9,伊蒂之屋,ETUDE,LASH PERM CURL FIX MASCARA  明眸卷翘定型睫毛膏,http://static.lottedfs.cn/prod/prd-img/33/16/42/00/00/02/20000421633_1.jpg
,16435,20000403791,$7,伊蒂之屋,ETUDE,NEW清纯自然染眉凝胶 5号 RED BROWN,http://static.lottedfs.cn/prod/prd-img/83/08/42/00/00/02/20000420883_1.jpg
,16435,20000403788,$7,伊蒂之屋,ETUDE,NEW清纯自然染眉凝胶 4号 ORANGE BROWN,http://static.lottedfs.cn/prod/prd-img/80/08/42/00/00/02/20000420880_1.jpg
,16435,20000403144,$9,伊蒂之屋,ETUDE,PORE REFINE PINK TAPE PACK 面膜,http://static.lottedfs.cn/prod/prd-img/90/00/42/00/00/02/20000420090_1.png
,16435,20000391768,$14,伊蒂之屋,ETUDE,DOUBLE LASTING FOUNDATION NEW   粉底液 TAN,http://static.lottedfs.cn/prod/prd-img/44/71/40/00/00/02/20000407144_1.png
,16435,20000391767,$14,伊蒂之屋,ETUDE,DOUBLE LASTING FOUNDATION NEW   粉底液  SAND,http://static.lottedfs.cn/prod/prd-img/43/71/40/00/00/02/20000407143_1.png
,16435,20000391766,$14,伊蒂之屋,ETUDE,DOUBLE LASTING FOUNDATION NEW   粉底液  PETAL,http://static.lottedfs.cn/prod/prd-img/42/71/40/00/00/02/20000407142_4.jpg
,16435,20000391764,$14,伊蒂之屋,ETUDE,DOUBLE LASTING FOUNDATION NEW   粉底液 BEIGE,http://static.lottedfs.cn/prod/prd-img/40/71/40/00/00/02/20000407140_1.png
,16435,20000391760,$14,伊蒂之屋,ETUDE,DOUBLE LASTING FOUNDATION NEW   粉底液  LIGHT VANILLA,http://static.lottedfs.cn/prod/prd-img/36/71/40/00/00/02/20000407136_4.jpg
,16435,20000391747,$4,伊蒂之屋,ETUDE,DEAR DARLING WATER GEL TINT  小甜心透嫩唇蜜  CHOCO RED,http://static.lottedfs.cn/prod/prd-img/23/71/40/00/00/02/20000407123_3.jpg
,16435,20000391746,$4,伊蒂之屋,ETUDE,DEAR DARLING WATER GEL TINT  小甜心透嫩唇蜜  CHESTNUT RED,http://static.lottedfs.cn/prod/prd-img/22/71/40/00/00/02/20000407122_3.jpg
,16435,20000391742,$4,伊蒂之屋,ETUDE,DEAR DARLING WATER GEL TINT  小甜心透嫩唇蜜  RIPE PERSIMMON RED,http://static.lottedfs.cn/prod/prd-img/18/71/40/00/00/02/20000407118_3.jpg
,16435,20000387308,$25,伊蒂之屋,ETUDE,PRECIOUS MINERAL BEAUTIFYING BLOCK CREAM MOIST SET BB霜 3支  PETAL,http://static.lottedfs.cn/prod/prd-img/70/21/40/00/00/02/20000402170_5.png
,16435,20000387304,$25,伊蒂之屋,ETUDE,PRECIOUS MINERAL BB MATTE SET BB霜3支 BEIGE,http://static.lottedfs.cn/prod/prd-img/64/21/40/00/00/02/20000402164_5.png
,16435,20000386301,$42,伊蒂之屋,ETUDE,TOTAL AGE REPAIR 发酵BB霜 2号 3支装,http://static.lottedfs.cn/prod/prd-img/00/09/40/00/00/02/20000400900_4.PNG
,16435,20000386298,$42,伊蒂之屋,ETUDE,TOTAL AGE REPAIR  发酵BB霜 1号 3支装,http://static.lottedfs.cn/prod/prd-img/89/08/40/00/00/02/20000400889_4.png
,16435,20000386296,$25,伊蒂之屋,ETUDE,PRECIOUS MENERAL BB MOIST BB霜套装 BEIGE 3支装,http://static.lottedfs.cn/prod/prd-img/87/08/40/00/00/02/20000400887_5.png
,16435,20000386291,$25,伊蒂之屋,ETUDE,PRECIOUS MENERAL BB MOIST BB霜套装 VANILLA 3支装,http://static.lottedfs.cn/prod/prd-img/80/08/40/00/00/02/20000400880_1.png
,16435,20000386231,$25,伊蒂之屋,ETUDE,PRECIOUS MENERAL BB MATT BB霜套装 PETAL 3支装,http://static.lottedfs.cn/prod/prd-img/97/07/40/00/00/02/20000400797_1.png
,16435,20000386221,$25,伊蒂之屋,ETUDE,PRECIOUS MENERAL MATT BB霜套装 VANILLA 3支装,http://static.lottedfs.cn/prod/prd-img/72/07/40/00/00/02/20000400772_2.png
,16435,20000383133,$3,伊蒂之屋,ETUDE,ET MY BEAUTY TOOL LOVELY ETTI HAIR BAND  甜心猫咪束发带,http://static.lottedfs.cn/prod/prd-img/94/96/18/03/00/01/10003189694_01.jpg
畅销,16435,20000377193,$12,伊蒂之屋,ETUDE,TECHNIC FIT SLIM LAYER FOUNDATION BRUSH 粉底刷,http://static.lottedfs.cn/prod/prd-img/96/95/38/00/00/02/20000389596_1.png
,16435,20000373573,$9,伊蒂之屋,ETUDE,PLAY 101 STICK MULTI COLOR  多功能美妆棒,http://static.lottedfs.cn/prod/prd-img/31/50/38/00/00/02/20000385031_1.jpg
,16435,20000373567,$9,伊蒂之屋,ETUDE,PLAY 101 STICK  多功能美妆棒,http://static.lottedfs.cn/prod/prd-img/25/07/07/03/00/01/10003070725_01.jpg
,16435,20000370499,$17,伊蒂之屋,ETUDE,ET BAKING POWDER BB DEEP CLEANSING FOAM 洁面乳3件套 免税店专售,http://static.lottedfs.cn/prod/prd-img/00/10/38/00/00/02/20000381000_4.jpg
,16435,20000166480,$9,伊蒂之屋,ETUDE,PRECIOUS MINERAL BB CREAM MATTE  BB霜,http://static.lottedfs.cn/prod/prd-img/50/89/16/00/00/02/20000168950_1.jpg
,16435,20000166468,$6,伊蒂之屋,ETUDE,ET GLASS TINTING LIPS TALK 口红,http://static.lottedfs.cn/prod/prd-img/13/89/16/00/00/02/20000168913_2.jpg
畅销,16435,20000166460,$12,伊蒂之屋,ETUDE,ET NEW MOISTFULL COLLAGEN ESSENCE IN PACT  粉饼,http://static.lottedfs.cn/prod/prd-img/94/88/16/00/00/02/20000168894_1.jpg
,16435,10003167424,$9,伊蒂之屋,ETUDE,ET COLOR FIX LIP TOP COAT,http://static.lottedfs.cn/prod/prd-img/24/74/16/03/00/01/10003167424_01.jpg
,16435,10003167423,$4,伊蒂之屋,ETUDE,ETUDE HOUSE DEAR DARLING WATER GEL TINT 唇彩  PK005 OH PEACH RED,http://static.lottedfs.cn/prod/prd-img/23/74/16/03/00/01/10003167423_4.jpg
,16435,10003167410,$4,伊蒂之屋,ETUDE,ETUDE HOUSE DEAR DARLING WATER GEL TINT 唇彩 PK006  JEWELRY RED,http://static.lottedfs.cn/prod/prd-img/10/74/16/03/00/01/10003167410_5.jpg
,16435,10003158788,$4,伊蒂之屋,ETUDE,ET BAKING POWDER PORE CLEANSING TISSUE 30 片 2016AD,http://static.lottedfs.cn/prod/prd-img/88/87/15/03/00/01/10003158788_2.jpg
,16435,10003151785,$9,伊蒂之屋,ETUDE,PLAY 101 EASY CONTOUR BRUSH 化妆刷,http://static.lottedfs.cn/prod/prd-img/85/17/15/03/00/01/10003151785_01.jpg
,16435,10003151780,$3,伊蒂之屋,ETUDE,MY BEAUTY TOOL BRUSH 312 SHADOW POINT   眼部重点刷,http://static.lottedfs.cn/prod/prd-img/80/17/15/03/00/01/10003151780_01.jpg
,16435,10003151777,$4,伊蒂之屋,ETUDE,MY BEAUTY TOOL BRUSH 310 SHADOW BASE   眼部打底刷,http://static.lottedfs.cn/prod/prd-img/77/17/15/03/00/01/10003151777_01.jpg
,16435,10003135863,$7,伊蒂之屋,ETUDE,ETUDE HOUSE TINT MY BROWS GEL 伊蒂之屋清纯自然染眉凝胶 1号 BROWN,http://static.lottedfs.cn/prod/prd-img/63/58/13/03/00/01/10003135863_03.jpg
,16435,10003135859,$7,伊蒂之屋,ETUDE,ETUDE HOUSE TINT MY BROWS GEL 伊蒂之屋清纯自然染眉凝胶 2号 LIGHT BROWN,http://static.lottedfs.cn/prod/prd-img/59/58/13/03/00/01/10003135859_01.jpg
,16435,10003135855,$7,伊蒂之屋,ETUDE,ETUDE HOUSE TINT MY 4 TIP BROW 染色液体眉笔 4 GRAY BROWN,http://static.lottedfs.cn/prod/prd-img/55/58/13/03/00/01/10003135855_01.jpg
,16435,10003135853,$7,伊蒂之屋,ETUDE,ETUDE HOUSE TINT MY 4 TIP BROW 染色液体眉笔 1 NATURAL BROWN,http://static.lottedfs.cn/prod/prd-img/53/58/13/03/00/01/10003135853_01.jpg
,16435,10003135852,$7,伊蒂之屋,ETUDE,ETUDE HOUSE TINT MY 4 TIP BROW 染色液体眉笔 2 DARK BROWN,http://static.lottedfs.cn/prod/prd-img/52/58/13/03/00/01/10003135852_01.jpg
,16435,10003135845,$7,伊蒂之屋,ETUDE,ETUDE HOUSE TINT MY BROWS GEL 染色眉膏 NO5 RED BROWN,http://static.lottedfs.cn/prod/prd-img/45/58/13/03/00/01/10003135845_01.jpg
,16435,10003135842,$7,伊蒂之屋,ETUDE,ETUDE HOUSE TINT MY BROWS GEL 染色眉膏  NO3 GRAY BROWN,http://static.lottedfs.cn/prod/prd-img/42/58/13/03/00/01/10003135842_03.jpg
,16435,10003135840,$13,伊蒂之屋,ETUDE,SOON JUNG PANTHENSOSIDE 5 CICA BALM  40ml,http://static.lottedfs.cn/prod/prd-img/40/58/13/03/00/01/10003135840_01.jpg
,16435,10003135838,$9,伊蒂之屋,ETUDE,ANY CUSHION ALL DAY PERFECT REFILL SPF50+ PA+++气垫粉底霜替换装,http://static.lottedfs.cn/prod/prd-img/58/58/13/03/00/01/10003135858_01.jpg
,16435,10003135836,$7,伊蒂之屋,ETUDE,SUPER SLIM PROOF BRUSH LINER  眼线液笔,http://static.lottedfs.cn/prod/prd-img/36/58/13/03/00/01/10003135836_01.jpg
,16435,10003135835,$7,伊蒂之屋,ETUDE,ETUDE HOUSE TINT MY 4 TIP BROW 液体染色眉笔 3 REDDISH BROWN,http://static.lottedfs.cn/prod/prd-img/35/58/13/03/00/01/10003135835_01.jpg
,16435,10003128706,$8,伊蒂之屋,ETUDE,ETUDE HOUSE DEAR MY ENAMEL LIPS TALK 口红 RD307 SUNSET ROAD,http://static.lottedfs.cn/prod/prd-img/06/87/12/03/00/01/10003128706_3.jpg
,16435,10003070719,$14,伊蒂之屋,ETUDE,伊蒂之屋娇颜饰色气垫隔离霜,http://static.lottedfs.cn/prod/prd-img/24/07/07/03/00/01/10003070724_2.jpg
,16435,10002344716,$32,伊蒂之屋,ETUDE,MOISTFUL COLLAGEN SUPER CARE SET 基础护肤套装,http://static.lottedfs.cn/prod/prd-img/16/47/34/02/00/01/10002344716_01.jpg
,16435,10002333628,$3,伊蒂之屋,ETUDE,DEAR DARLING WATER GEL TINT 唇彩,http://static.lottedfs.cn/prod/prd-img/21/36/33/02/00/01/10002333621_01.jpg
,16435,10002333622,$6,伊蒂之屋,ETUDE,伊蒂之屋玩转101多功能柔彩笔,http://static.lottedfs.cn/prod/prd-img/23/36/33/02/00/01/10002333623_01.jpg
免税独家,16435,10002326216,$33,伊蒂之屋,ETUDE,FACE BLUR  SPF33 PA 3SET    妆前乳3件套装,http://static.lottedfs.cn/prod/prd-img/16/62/32/02/00/01/10002326216_01.jpg
,16435,10002324756,$14,伊蒂之屋,ETUDE,滤光美颜奶油气垫霜,http://static.lottedfs.cn/prod/prd-img/56/47/32/02/00/01/10002324756_6.jpg
,16435,10002321978,$14,伊蒂之屋,ETUDE,SUNBLIND CUSHION SPF50    防晒气垫霜 14g,http://static.lottedfs.cn/prod/prd-img/78/19/32/02/00/01/10002321978_4.jpg
,16435,10002321977,$6,伊蒂之屋,ETUDE,AD BAKING POWDER BB DEEP CLEANSING FOAM   洁面乳 160ml,http://static.lottedfs.cn/prod/prd-img/77/19/32/02/00/01/10002321977_01.jpg
,16435,10002321975,$14,伊蒂之屋,ETUDE,伊蒂之屋珍珠母幻彩防晒气垫隔离霜,http://static.lottedfs.cn/prod/prd-img/75/19/32/02/00/01/10002321975_5.jpg
,16435,10002321963,$8,伊蒂之屋,ETUDE,SUNPRISE BYE SEBUM SUN STICK  防晒棒 SPF50,http://static.lottedfs.cn/prod/prd-img/63/19/32/02/00/01/10002321963_6.jpg
,16435,10002293203,$14,伊蒂之屋,ETUDE,ET.DOUBLE LASTING FOUNDATION 恒妆匀净粉底液,http://static.lottedfs.cn/prod/prd-img/12/15/46/00/00/02/20000461512_1.png
,16435,10002227478,$9,伊蒂之屋,ETUDE,玩美无瑕气垫遮瑕笔,http://static.lottedfs.cn/prod/prd-img/78/74/22/02/00/01/10002227478_01.jpg
,16435,10002227467,$5,伊蒂之屋,ETUDE,伊蒂之屋玩美无瑕修颜乳,http://static.lottedfs.cn/prod/prd-img/67/74/22/02/00/01/10002227467_01.jpg
,16435,10002215914,$15,伊蒂之屋,ETUDE,MOISTFULL COLLAGEN FACIAL MASK SHEET 面膜 10片,http://static.lottedfs.cn/prod/prd-img/14/59/21/02/00/01/10002215914_7.jpg
免税独家,16435,10002197360,$20,伊蒂之屋,ETUDE,MOISTFULL COLLAGEN 2PC SET  护肤套装  免税专售,http://static.lottedfs.cn/prod/prd-img/60/73/19/02/00/01/10002197360_01.jpg
,16435,10002197359,$14,伊蒂之屋,ETUDE,24K GOLD THRAPY COLLAGEN EYE PATCH  60片,http://static.lottedfs.cn/prod/prd-img/59/73/19/02/00/01/10002197359_5.jpg
,16435,10002197193,$6,伊蒂之屋,ETUDE,伊蒂之屋睛彩双头眉笔,http://static.lottedfs.cn/prod/prd-img/98/71/19/02/00/01/10002197198_01.jpg
,16435,10002193639,$27,伊蒂之屋,ETUDE,Dr AMPOULE DUAL MASK BRIGHTENING  面膜  10SET,http://static.lottedfs.cn/prod/prd-img/39/36/19/02/00/01/10002193639_01.jpg
,16435,10002192120,$3,伊蒂之屋,ETUDE,KISSFUL LIP CARE  LIP CONCEALER,http://static.lottedfs.cn/prod/prd-img/20/21/19/02/00/01/10002192120_01.jpg
,16435,10002191651,$27,伊蒂之屋,ETUDE,Dr.AMPOULE DAUL MASK MOISTURE 10SET 面膜10片,http://static.lottedfs.cn/prod/prd-img/51/16/19/02/00/01/10002191651_01.jpg
,16435,10002179046,$13,伊蒂之屋,ETUDE,MOISTFULL COLLAGEN ESSENCE 精华素,http://static.lottedfs.cn/prod/prd-img/46/90/17/02/00/01/10002179046_1.jpg
,16435,10002179045,$10,伊蒂之屋,ETUDE,MOISTFULL COLLAGEN EMULSION 乳液 180ml,http://static.lottedfs.cn/prod/prd-img/45/90/17/02/00/01/10002179045_2.jpg
,16435,10002179044,$10,伊蒂之屋,ETUDE,MOISTFULL COLLAGEN SKIN 化妆水 200ml,http://static.lottedfs.cn/prod/prd-img/44/90/17/02/00/01/10002179044_1.jpg
,16435,10002179043,$13,伊蒂之屋,ETUDE,MOISTFULL COLLAGEN CREAM 面霜 75ml,http://static.lottedfs.cn/prod/prd-img/43/90/17/02/00/01/10002179043_2.jpg
,16435,10002179042,$12,伊蒂之屋,ETUDE,MOISTFULL COLLAGEN EYE CREAM  眼霜 28ml,http://static.lottedfs.cn/prod/prd-img/42/90/17/02/00/01/10002179042_2.jpg
,16435,10002179041,$13,伊蒂之屋,ETUDE,MOISTFULL COLLAGEN DEEP CREAM  深层护理面霜 75ml,http://static.lottedfs.cn/prod/prd-img/41/90/17/02/00/01/10002179041_2.jpg
,16435,10002136691,$9,伊蒂之屋,ETUDE,LASH PERM CURL FIX MASCARS 睫毛膏 黑色,http://static.lottedfs.cn/prod/prd-img/91/66/13/02/00/01/10002136691_01.jpg
,16435,10002088160,$20,伊蒂之屋,ETUDE,CUTE EYES MAKER 3件眼影棒套装,http://static.lottedfs.cn/prod/prd-img/60/81/08/02/00/01/10002088160_3.jpg
,16435,10002088159,$21,伊蒂之屋,ETUDE,DRAWING SHOW BRUSH LINER 3件眼线液套装,http://static.lottedfs.cn/prod/prd-img/59/81/08/02/00/01/10002088159_5.jpg
,16435,10002052883,$11,伊蒂之屋,ETUDE,V LINE SLIM MAKER   高光粉,http://static.lottedfs.cn/prod/prd-img/83/28/05/02/00/01/10002052883_6.jpg
,16435,10002012731,$32,伊蒂之屋,ETUDE,GOLD DARLING PLUS REPAIRING RICH CREAM 润肤霜(免税限量) 50ml,http://static.lottedfs.cn/prod/prd-img/31/27/01/02/00/01/10002012731_4.jpg
,16435,10001872440,$5,伊蒂之屋,ETUDE,ET.PROOF 10 AUTO PENCIL 爱丽小屋防水眼线笔,http://static.lottedfs.cn/prod/prd-img/39/24/87/01/00/01/10001872439_01.jpg
,16435,10001871106,$8,伊蒂之屋,ETUDE,LASH PERM MASCARA  防水睫毛膏 (易卸),http://static.lottedfs.cn/prod/prd-img/06/11/87/01/00/01/10001871106_1.jpg
,16435,10001815087,$9,伊蒂之屋,ETUDE,Lasj Perm All Shockcara  BLACK 睫毛膏,http://static.lottedfs.cn/prod/prd-img/87/50/81/01/00/01/10001815087_02.jpg
,16435,10001403772,$7,伊蒂之屋,ETUDE,PERFECT BROW KIT 眉粉,http://static.lottedfs.cn/prod/prd-img/72/37/40/01/00/01/10001403772_5.jpg
,16435,20000446537,$102,伊蒂之屋,ETUDE,PLAY COLOR EYES WINE PARTY  玩转色彩多色眼影盘 6+1,http://static.lottedfs.cn/prod/prd-img/75/37/48/00/00/02/20000483775_1.JPG
