tag,brand_No,product_No,us_price,brand_name_chn,brand_name_eng,product_name,img_url
乐天专售,1001308,20000457949,$417,Electricianz,Electricianz,ELECTRICIANZ WATCH THE SNOW WHITE  手表,http://static.lottedfs.cn/prod/prd-img/66/96/49/00/00/02/20000499666_1.jpg
乐天专售,1001308,20000434805,$442,Electricianz,Electricianz,ELECTRICIANZ WATCH THE CABLE Z 手表,http://static.lottedfs.cn/prod/prd-img/38/33/46/00/00/02/20000463338_1.png
乐天专售,1001308,20000434480,$417,Electricianz,Electricianz,ELECTRICIANZ WATCH THE AMMETER 手表,http://static.lottedfs.cn/prod/prd-img/06/29/46/00/00/02/20000462906_1.png
乐天专售,1001308,20000434478,$442,Electricianz,Electricianz,ELECTRICIANZ WATCH THE BLACKOUT 手表,http://static.lottedfs.cn/prod/prd-img/04/29/46/00/00/02/20000462904_1.png
乐天专售,1001308,20000434475,$417,Electricianz,Electricianz,ELECTRICIANZ WATCH THE MOKAZ 手表,http://static.lottedfs.cn/prod/prd-img/01/29/46/00/00/02/20000462901_1.png
乐天专售,1001308,20000434474,$417,Electricianz,Electricianz,ELECTRICIANZ WATCH THE DRESSCODE 手表,http://static.lottedfs.cn/prod/prd-img/00/29/46/00/00/02/20000462900_1.png
