tag,brand_No,product_No,us_price,brand_name_chn,brand_name_eng,product_name,img_url
促销 赠品,1002616,20000584818,$37,OGI,OGI,MANUKA HONEY DEEP CARE AMPOULE 安瓶,http://static.lottedfs.cn/prod/prd-img/12/79/69/00/00/02/20000697912_3.jpg
赠品,1002616,20000598103,$23,OGI,OGI,WATER BOMB MOISTURE SLEEPING PACK 睡眠面膜,http://static.lottedfs.cn/prod/prd-img/60/12/72/00/00/02/20000721260_1.jpg
赠品,1002616,20000587064,$25,OGI,OGI,MANUKA HONEY DEEP CARE MASK 面膜,http://static.lottedfs.cn/prod/prd-img/10/17/70/00/00/02/20000701710_1.jpg
赠品,1002616,20000584822,$21,OGI,OGI,WATER BOMB MOISTURE SKIN ESSENCE 精华,http://static.lottedfs.cn/prod/prd-img/23/79/69/00/00/02/20000697923_3.jpg
赠品,1002616,20000584820,$25,OGI,OGI,WATER BOMB MOISTURE CREAM 面霜,http://static.lottedfs.cn/prod/prd-img/21/79/69/00/00/02/20000697921_3.jpg
赠品,1002616,20000584814,$40,OGI,OGI,MANUKA HONEY DEEP CARE CREAM 面霜,http://static.lottedfs.cn/prod/prd-img/05/79/69/00/00/02/20000697905_3.jpg
