tag,brand_No,product_No,us_price,brand_name_chn,brand_name_eng,product_name,img_url
赠品,17357,20000494149,$19,伊思,ITS SKIN,PRESTIGE GINSENG BB DESCARGOT BB霜 21 LIGHT BEIGE,http://static.lottedfs.cn/prod/prd-img/09/55/55/00/00/02/20000555509_1.jpg
赠品,17357,20000494138,$17,伊思,ITS SKIN,ITS SKIN PRESTIGE CREME BB DESCARGOT BB霜 21 LIGHT BEIGE,http://static.lottedfs.cn/prod/prd-img/92/54/55/00/00/02/20000555492_1.jpg
赠品,17357,20000494134,$14,伊思,ITS SKIN,ITS SKIN PRESTIGE FOAM EX GINSENG DESCARGOT 洁面乳,http://static.lottedfs.cn/prod/prd-img/85/54/55/00/00/02/20000555485_1.jpg
赠品,17357,20000494127,$50,伊思,ITS SKIN,ITS SKIN PRESTIGE CREME EX GINSENG DESCARGOT 面霜,http://static.lottedfs.cn/prod/prd-img/69/54/55/00/00/02/20000555469_1.jpg
赠品,17357,20000494124,$37,伊思,ITS SKIN,ITS SKIN PRESTIGE YEUX EX GINSENG DESCARGOT 眼霜,http://static.lottedfs.cn/prod/prd-img/66/54/55/00/00/02/20000555466_1.jpg
赠品,17357,20000494117,$32,伊思,ITS SKIN,ITS SKIN PRESTIGE SERUM EX GINSENG DESCARGOT 精华,http://static.lottedfs.cn/prod/prd-img/49/54/55/00/00/02/20000555449_1.jpg
赠品,17357,20000494113,$28,伊思,ITS SKIN,ITS SKIN PRESTIGE TONIQUE EX GINSENG DESCARGOT 护肤水,http://static.lottedfs.cn/prod/prd-img/42/54/55/00/00/02/20000555442_1.jpg
赠品,17357,20000494109,$12,伊思,ITS SKIN,ITS SKIN PRESTIGE FOAM EX DESCARGOT 洁面乳,http://static.lottedfs.cn/prod/prd-img/38/54/55/00/00/02/20000555438_1.jpg
赠品,17357,20000493931,$46,伊思,ITS SKIN,PRESTIGE CREME EX DESCARGOT 面霜,http://static.lottedfs.cn/prod/prd-img/28/48/55/00/00/02/20000554828_1.jpg
赠品,17357,20000493924,$31,伊思,ITS SKIN,ITS SKIN PRESTIGE YEUX EX DESCARGOT 眼霜,http://static.lottedfs.cn/prod/prd-img/21/48/55/00/00/02/20000554821_1.jpg
赠品,17357,20000493911,$25,伊思,ITS SKIN,ITS SKIN PRESTIGE TONIQUE EX DESCARGOT 护肤水,http://static.lottedfs.cn/prod/prd-img/03/48/55/00/00/02/20000554803_1.jpg
赠品,17357,20000482905,$9,伊思,ITS SKIN,ITS SKIN POWER 10 FORMULA LI SOOTHING MIST 面部喷雾,http://static.lottedfs.cn/prod/prd-img/00/64/53/00/00/02/20000536400_1.jpg
赠品,17357,20000482903,$9,伊思,ITS SKIN,ITS SKIN POWER 10 FORMULA VB SEBUM MIST 面部喷雾,http://static.lottedfs.cn/prod/prd-img/97/63/53/00/00/02/20000536397_1.jpg
赠品,17357,20000482881,$9,伊思,ITS SKIN,ITS SKIN POWER 10 FORMULA VE NUTRITION MIST 面部喷雾,http://static.lottedfs.cn/prod/prd-img/64/63/53/00/00/02/20000536364_1.jpg
赠品,17357,20000450493,$19,伊思,ITS SKIN,HYDRA ROUTINE RAIN DROP SERUM PROMOTION SET  精华液企划套装,http://static.lottedfs.cn/prod/prd-img/30/95/48/00/00/02/20000489530_1.jpg
赠品,17357,20000450475,$29,伊思,ITS SKIN,HYDRA ROUTINE SPECIAL SET 基础护理套装,http://static.lottedfs.cn/prod/prd-img/09/95/48/00/00/02/20000489509_1.jpg
赠品,17357,20000450471,$29,伊思,ITS SKIN,CERA ROUTINE SPECIAL SET 基础护肤套装,http://static.lottedfs.cn/prod/prd-img/05/95/48/00/00/02/20000489505_1.jpg
赠品,17357,20000450440,$29,伊思,ITS SKIN,ITS SKIN GLOW ROUTINE SPECIAL SET 基础护肤特别套装,http://static.lottedfs.cn/prod/prd-img/62/94/48/00/00/02/20000489462_1.jpg
赠品,17357,20000450434,$27,伊思,ITS SKIN,ITS SKIN SIGNATURE COMFORTING CREAM 面霜,http://static.lottedfs.cn/prod/prd-img/56/94/48/00/00/02/20000489456_1.jpg
赠品,17357,20000450432,$27,伊思,ITS SKIN,ITS SKIN SIGNATURE UNWRINKLE CREAM 面霜,http://static.lottedfs.cn/prod/prd-img/54/94/48/00/00/02/20000489454_1.jpg
赠品,17357,20000450429,$27,伊思,ITS SKIN,ITS SKIN SIGNATURE REVIVE CREAM 面霜,http://static.lottedfs.cn/prod/prd-img/51/94/48/00/00/02/20000489451_1.jpg
免税独家 赠品,17357,20000404597,$12,伊思,ITS SKIN,ITS SKIN PURE MOISTURE 2in1 CREAM 面霜,http://static.lottedfs.cn/prod/prd-img/17/18/42/00/00/02/20000421817_1.jpg
畅销 赠品,17357,10003135467,$15,伊思,ITS SKIN,LIFE COLOR PALETTE EYE 眼影彩盘 NO02,http://static.lottedfs.cn/prod/prd-img/67/54/13/03/00/01/10003135467_01.jpg
赠品,17357,10003135464,$15,伊思,ITS SKIN,LIFE COLOR PALETTE EYE 眼影彩盘 NO01,http://static.lottedfs.cn/prod/prd-img/64/54/13/03/00/01/10003135464_01.jpg
赠品,17357,10003132033,$43,伊思,ITS SKIN,URBAN CLASSIC 3 PIECE SPECIAL SET  男士护肤套装,http://static.lottedfs.cn/prod/prd-img/33/20/13/03/00/01/10003132033_01.jpg
畅销 赠品,17357,10002344711,$13,伊思,ITS SKIN,PRESTIGE PEELING SOFT DESCARGOT 120ml,http://static.lottedfs.cn/prod/prd-img/11/47/34/02/00/01/10002344711_01.jpg
赠品,17357,10002245553,$5,伊思,ITS SKIN,IT S TOP PROFESSIONAL VIVID GEL EYELINER 眼线膏,http://static.lottedfs.cn/prod/prd-img/53/55/24/02/00/01/10002245553_01.jpg
赠品,17357,10002123032,$17,伊思,ITS SKIN,ITS SKIN PRESTIGE CLEANSING OIL DESCARGOT 卸妆油 155ml,http://static.lottedfs.cn/prod/prd-img/32/30/12/02/00/01/10002123032_02.jpg
赠品,17357,10002122503,$17,伊思,ITS SKIN,ITS SKIN PRESTIGE SUN D ESCARGOT  防晒霜 50ml,http://static.lottedfs.cn/prod/prd-img/03/25/12/02/00/01/10002122503_01.jpg
赠品,17357,10002090254,$11,伊思,ITS SKIN,SMART SOLUTION 365 SILKY SUN BLOCK 防晒霜 50ml,http://static.lottedfs.cn/prod/prd-img/54/02/09/02/00/01/10002090254_01.jpg
赠品,17357,10002025333,$6,伊思,ITS SKIN,MANGOWHITE BODY LOTION  身体润肤乳 250ml,http://static.lottedfs.cn/prod/prd-img/33/53/02/02/00/01/10002025333_01.jpg
赠品,17357,10001917438,$11,伊思,ITS SKIN,ITS SKIN THE HOMME WHITENING TREATMENT TONER 男士化妆水 150ml,http://static.lottedfs.cn/prod/prd-img/38/74/91/01/00/01/10001917438_01.jpg
赠品,17357,10001917437,$11,伊思,ITS SKIN,ITS SKIN THE HOMME WHITENING TREATMENT EMULSION 男士乳液 150ml,http://static.lottedfs.cn/prod/prd-img/37/74/91/01/00/01/10001917437_01.jpg
赠品,17357,10001451069,$6,伊思,ITS SKIN,ITS SKIN MANGO WHITE CLEANSING CREAM 卸妆膏 200ml,http://static.lottedfs.cn/prod/prd-img/69/10/45/01/00/01/10001451069_04.jpg
赠品,17357,10001417946,$4,伊思,ITS SKIN,ITS SKIN MACARON LIP BALM 03 GRAPE 润唇膏 9g,http://static.lottedfs.cn/prod/prd-img/46/79/41/01/00/01/10001417946_01.jpg
赠品,17357,10001417940,$5,伊思,ITS SKIN,ITS SKIN BABYFACE PETIT BLUSHER  腮红,http://static.lottedfs.cn/prod/prd-img/43/79/41/01/00/01/10001417943_01.jpg
赠品,17357,10001406170,$5,伊思,ITS SKIN,ITS SKIN SELF CARE FOOT PEELING 20ml 2片,http://static.lottedfs.cn/prod/prd-img/70/61/40/01/00/01/10001406170_03.jpg
赠品,17357,10001406168,$11,伊思,ITS SKIN,能量10蛇毒精华原液 30ml,http://static.lottedfs.cn/prod/prd-img/68/61/40/01/00/01/10001406168_01.jpg
赠品,17357,10001406167,$9,伊思,ITS SKIN,ITS SKIN MANGO HAND LOTION 3ea 护手霜 75ml*3,http://static.lottedfs.cn/prod/prd-img/67/61/40/01/00/01/10001406167_02.jpg
赠品,17357,10001406151,$10,伊思,ITS SKIN,COLOR PLAY PRISMA DIAMOND PACT 炫色璀璨凝彩粉饼,http://static.lottedfs.cn/prod/prd-img/51/61/40/01/00/01/10001406151_01.jpg
赠品,17357,10001406149,$5,伊思,ITS SKIN,MANGOWHITE CLEANSING FOAM 洗面奶 150ml,http://static.lottedfs.cn/prod/prd-img/49/61/40/01/00/01/10001406149_03.jpg
赠品,17357,10001406136,$9,伊思,ITS SKIN,能量10 VE精华原液 30ml,http://static.lottedfs.cn/prod/prd-img/36/61/40/01/00/01/10001406136_01.jpg
赠品,17357,10001406133,$9,伊思,ITS SKIN,伊思能量10 Q10精华原液 30ml,http://static.lottedfs.cn/prod/prd-img/33/61/40/01/00/01/10001406133_01.jpg
赠品,17357,10001406128,$10,伊思,ITS SKIN,PREMIUM HAND SHEET 手膜,http://static.lottedfs.cn/prod/prd-img/28/61/40/01/00/01/10001406128_01.jpg
赠品,17357,20000531604,$28,伊思,ITS SKIN,FLAMEL MD YOUTH BARRIER DERMAL HYDRO AMPOULE SET 锁水滋润安瓶,http://static.lottedfs.cn/prod/prd-img/59/09/61/00/00/02/20000610959_2.jpg
赠品,17357,20000501336,$23,伊思,ITS SKIN,ITS SKIN SECRET SOLUTION WEDDING DRESS PINK MASK SET 面膜套装 20片,http://static.lottedfs.cn/prod/prd-img/70/68/56/00/00/02/20000566870_1.jpg
免税独家 赠品,17357,20000500528,$15,伊思,ITS SKIN,ITS SKIN HYALURONIC ACID MOISTURE CLEANSING FOAM SPECIAL SET 洁面乳套装,http://static.lottedfs.cn/prod/prd-img/10/56/56/00/00/02/20000565610_1.jpg
赠品,17357,10002358447,$15,伊思,ITS SKIN,ALOE MASK SET 面膜 30片,http://static.lottedfs.cn/prod/prd-img/47/84/35/02/00/01/10002358447_1.jpg
赠品,17357,10001738302,$5,伊思,ITS SKIN,ITS SKIN SNAIL MOISTURE MASK SHEET 蜗牛面膜 22g*5,http://static.lottedfs.cn/prod/prd-img/02/83/73/01/00/01/10001738302_01.jpg
