tag,brand_No,product_No,us_price,brand_name_chn,brand_name_eng,product_name,img_url
畅销 赠品,1002612,20000585373,$25,Chunho Ncare,Chunho Ncare,KOREAN PEAR AND BALLOON FLOWER FOR FRUSTRATING DAYS 桔梗新高梨糖稀 (10ml 30包 2盒),http://static.lottedfs.cn/prod/prd-img/14/90/69/00/00/02/20000699014_1.jpg
赠品,1002612,20000585399,$57,Chunho Ncare,Chunho Ncare,KIDS RED GINSENG MY KIDS IMMUNITY AND FITNESS 儿童红参饮品 (40ml 30包),http://static.lottedfs.cn/prod/prd-img/40/90/69/00/00/02/20000699040_1.jpg
赠品,1002612,20000585394,$64,Chunho Ncare,Chunho Ncare,6 YEAR OLD RED GINSENG AND GINSENG FRUIT IN WHOLE WHOLE RED GINSENG 红参浓缩液 (10ml 30包),http://static.lottedfs.cn/prod/prd-img/35/90/69/00/00/02/20000699035_1.jpg
赠品,1002612,20000585368,$25,Chunho Ncare,Chunho Ncare,EQUIP BEAUTY POMEGRANATE LIQUID STICK 石榴浓缩液 (12ml 7包 6盒),http://static.lottedfs.cn/prod/prd-img/11/90/69/00/00/02/20000699011_1.jpg
畅销 赠品,1002612,20000607918,$46,Chunho Ncare,Chunho Ncare,KOREAN RED GINSENG CHUNG 高丽红参膏口服液 (10ml 30包 2盒),http://static.lottedfs.cn/prod/prd-img/28/17/74/00/00/02/20000741728_1.jpg
畅销 赠品,1002612,20000589753,$70,Chunho Ncare,Chunho Ncare,WOMENS HEALTH POMEGRANATE CONCENTRATE JELLY TYEP STICK WOMEN SOLUTION STICK石榴浓缩液 (30g 20包 3盒),http://static.lottedfs.cn/prod/prd-img/40/64/70/00/00/02/20000706440_3.JPG
赠品,1002612,20000586137,$23,Chunho Ncare,Chunho Ncare,POMEGRANATE CONCENTRATE JELLY TYPE STICK WOMEN SOLUTION STICK 石榴浓缩液 (30g 20包),http://static.lottedfs.cn/prod/prd-img/34/02/70/00/00/02/20000700234_1.jpg
畅销 赠品,1002612,20000585400,$91,Chunho Ncare,Chunho Ncare,DEER ANTLERS FOR OUR PRECIOUS KIDS  儿童鹿茸营养液 (40ml 30 包),http://static.lottedfs.cn/prod/prd-img/41/90/69/00/00/02/20000699041_1.jpg
畅销 赠品,1002612,20000591960,$30,Chunho Ncare,Chunho Ncare,GOODNIGHT PILL FOR COMFORTABLE NIGHT 舒适睡眠丸（3g 10包 2盒）,http://static.lottedfs.cn/prod/prd-img/03/99/70/00/00/02/20000709903_1.jpg
赠品,1002612,20000585405,$81,Chunho Ncare,Chunho Ncare,10 BILLION LACTOBACILLUS IN 1 PACKET ONLY DAILY LACTO 乳酸菌  (2g X 30包 3个入）,http://static.lottedfs.cn/prod/prd-img/50/90/69/00/00/02/20000699050_3.jpg
畅销 赠品,1002612,20000585397,$135,Chunho Ncare,Chunho Ncare,CHEONOGGO ENERGY SUPPLEMENT 活力补充剂 （10ml 30包 3个入）,http://static.lottedfs.cn/prod/prd-img/38/90/69/00/00/02/20000699038_3.jpg
赠品,1002612,20000585390,$21,Chunho Ncare,Chunho Ncare,BB STICK FISH COLLAGEN LIQUID STICK EAT DELICIOUS AND BE BEAUTIFUL 胶原蛋白液 (120ml 30包),http://static.lottedfs.cn/prod/prd-img/31/90/69/00/00/02/20000699031_1.jpg
赠品,1002612,20000585372,$25,Chunho Ncare,Chunho Ncare,GOOD NIGHT 舒适睡眠解压浓缩液 (12ml 7包 6盒),http://static.lottedfs.cn/prod/prd-img/13/90/69/00/00/02/20000699013_1.jpg
赠品,1002612,20000622114,$35,Chunho Ncare,Chunho Ncare,GOOD NIGHT PREMIUM FOR A COMFORTABLE EVENING (4g 60包),http://static.lottedfs.cn/prod/prd-img/70/54/76/00/00/02/20000765470_1.png
赠品,1002612,20000622093,$498,Chunho Ncare,Chunho Ncare,CHUNSAMBORYEOK NOBLE POWER GIVEN BY HEAVEN 天参宝力红参饮品 30瓶,http://static.lottedfs.cn/prod/prd-img/34/54/76/00/00/02/20000765434_1.jpg
赠品,1002612,20000622046,$92,Chunho Ncare,Chunho Ncare,CHUNSAMBORYEOK NOBLE POWER GIVEN BY HEAVEN 天参宝力红参饮品 5瓶,http://static.lottedfs.cn/prod/prd-img/44/53/76/00/00/02/20000765344_1.jpg
畅销 赠品,1002612,20000607877,$69,Chunho Ncare,Chunho Ncare,WOMEN SOLUTION FOR MENOPAUSE PREMIUM 女性更年期保健品 20ml 30包,http://static.lottedfs.cn/prod/prd-img/76/16/74/00/00/02/20000741676_1.jpg
赠品,1002612,20000602825,$54,Chunho Ncare,Chunho Ncare,CORNUS FRUIT PILL PREMIUM TRULY GOOD FOR MEN 山茱萸条包 4g 60包,http://static.lottedfs.cn/prod/prd-img/63/20/73/00/00/02/20000732063_1.jpg
赠品,1002612,20000585398,$51,Chunho Ncare,Chunho Ncare,HWANGHOOBONMI FUNDAMENTAL BEAUTY OF EMPRESS 人参果石榴胶原蛋白浓缩液 (12ml 60包),http://static.lottedfs.cn/prod/prd-img/39/90/69/00/00/02/20000699039_1.jpg
赠品,1002612,20000585396,$123,Chunho Ncare,Chunho Ncare,CHEONJINDAN THE POWER THAT RULES THE WORLD 天辰丹 控制世界的力量(4g 30丸),http://static.lottedfs.cn/prod/prd-img/37/90/69/00/00/02/20000699037_1.jpg
赠品,1002612,20000585395,$47,Chunho Ncare,Chunho Ncare,CHEONOKGO REPLENISHING LACK OF ENERGY BOOSTING VITALITY 能量补充剂 (10ml 30包),http://static.lottedfs.cn/prod/prd-img/36/90/69/00/00/02/20000699036_1.jpg
赠品,1002612,20000585393,$46,Chunho Ncare,Chunho Ncare,3 DAYS PROMISE PLUS GOOD FOR BOWEL HEALTH 肠道健康粉 (4.5g 30包),http://static.lottedfs.cn/prod/prd-img/34/90/69/00/00/02/20000699034_1.jpg
赠品,1002612,20000585386,$40,Chunho Ncare,Chunho Ncare,SUPPORTING ANTIOXIDANT ACTIVITY PROPOLIS 抗氧化蜂胶胶囊 (350mg 60粒 2个入),http://static.lottedfs.cn/prod/prd-img/27/90/69/00/00/02/20000699027_1.jpg
赠品,1002612,20000585384,$50,Chunho Ncare,Chunho Ncare,"CALORIE OUT HELPING TO REDUCE BODY FAT 瘦身片 (1,050mg 120粒)",http://static.lottedfs.cn/prod/prd-img/25/90/69/00/00/02/20000699025_1.jpg
赠品,1002612,20000585371,$25,Chunho Ncare,Chunho Ncare,FOGGY DAY BELLFLOWER AND PEAR JUICE LIQUID STICK 桔梗梨新高梨浓缩液 (12ml 7包 6盒),http://static.lottedfs.cn/prod/prd-img/12/90/69/00/00/02/20000699012_1.jpg
赠品,1002612,20000602823,$136,Chunho Ncare,Chunho Ncare,KOREAN RED GINSENG EXTRACT 6-YEAR OLD RED GINSENG CONCENTRATE 100% 红参精 240g,http://static.lottedfs.cn/prod/prd-img/50/20/73/00/00/02/20000732050_1.jpg
