tag,brand_No,product_No,us_price,brand_name_chn,brand_name_eng,product_name,img_url
畅销 免税独家,19870,20000613928,$60,布克兄弟,BROOKSBROTHERS,PERFORMANCE SERIES POPLIN SHIRT 衬衣,http://static.lottedfs.cn/prod/prd-img/68/25/75/00/00/02/20000752568_1.jpg
促销 畅销,19870,20000613870,$106,布克兄弟,BROOKSBROTHERS,STRIPED PINPOINT YARNDYES SPORT SHIRT 衬衣,http://static.lottedfs.cn/prod/prd-img/06/24/75/00/00/02/20000752406_1.jpg
免税独家,19870,20000613755,$48,布克兄弟,BROOKSBROTHERS,GARMENT-DYED COTTON JERSEY LONG-SLEEVE T-SHIRT 长袖T恤,http://static.lottedfs.cn/prod/prd-img/11/22/75/00/00/02/20000752211_1.jpg
,19870,20000613413,$60,布克兄弟,BROOKSBROTHERS,PLAID COTTON OXFORD SPORT SHIRT 衬衫,http://static.lottedfs.cn/prod/prd-img/69/14/75/00/00/02/20000751469_1.jpg
免税独家,19870,20000596500,$42,布克兄弟,BROOKSBROTHERS,RED FLEECE NYC GRAPHIC T-SHIRT 短袖T恤,http://static.lottedfs.cn/prod/prd-img/21/81/71/00/00/02/20000718121_1.jpg
畅销,19870,20000534381,$28,布克兄弟,BROOKSBROTHERS,GARMENT DYED T SHIRT 男士T恤衫,http://static.lottedfs.cn/prod/prd-img/18/60/61/00/00/02/20000616018_1.jpg
新品,19870,20000637351,$70,布克兄弟,BROOKSBROTHERS,PERFORMANCE SERIES COOLMAX CREWNECK SWEATER 针织衫,http://static.lottedfs.cn/prod/prd-img/08/69/78/00/00/02/20000786908_1.jpg
促销 免税独家,19870,20000615360,$135,布克兄弟,BROOKSBROTHERS,LAMBSWOOL CABLE CREWNECK SWEATER 针织衫,http://static.lottedfs.cn/prod/prd-img/86/53/75/00/00/02/20000755386_1.JPG
促销 免税独家,19870,20000615351,$135,布克兄弟,BROOKSBROTHERS,LAMBSWOOL CABLE CREWNECK SWEATER 针织衫,http://static.lottedfs.cn/prod/prd-img/65/53/75/00/00/02/20000755365_1.JPG
,19870,20000613902,$60,布克兄弟,BROOKSBROTHERS,MULTI PLAID FLANNEL SHIRT 衬衣,http://static.lottedfs.cn/prod/prd-img/76/24/75/00/00/02/20000752476_1.jpg
,19870,20000613533,$48,布克兄弟,BROOKSBROTHERS,GARMENT DYED COTTON JERSEY LONG SLEEVE T SHIRT 长袖T恤,http://static.lottedfs.cn/prod/prd-img/12/18/75/00/00/02/20000751812_1.jpg
,19870,20000603915,$70,布克兄弟,BROOKSBROTHERS,COTTON JERSEY LONG SLEEVE HENLEY 男士上衣,http://static.lottedfs.cn/prod/prd-img/56/45/73/00/00/02/20000734556_1.jpg
,19870,20000603909,$176,布克兄弟,BROOKSBROTHERS,ZIP-UP FLEECE COLOR BLOCK SWEATER JACKET 开衫,http://static.lottedfs.cn/prod/prd-img/26/45/73/00/00/02/20000734526_1.jpg
免税独家,19870,20000603905,$120,布克兄弟,BROOKSBROTHERS,ZIP-UP FLEECE SWEATER JACKET 男士外套,http://static.lottedfs.cn/prod/prd-img/11/45/73/00/00/02/20000734511_1.jpg
促销 畅销,19870,20000601438,$241,布克兄弟,BROOKSBROTHERS,SWEATER ARCHIVE TENNIS VNECK 男士针织衫,http://static.lottedfs.cn/prod/prd-img/23/89/72/00/00/02/20000728923_1.jpg
促销,19870,20000601423,$131,布克兄弟,BROOKSBROTHERS,SOHO FIT BRUSHED TWILL STRETCH CHINOS 男士裤子,http://static.lottedfs.cn/prod/prd-img/84/88/72/00/00/02/20000728884_1.jpg
,19870,20000596578,$120,布克兄弟,BROOKSBROTHERS,COTTON-CASHMERE 1818 SWEATER 针织衫,http://static.lottedfs.cn/prod/prd-img/83/82/71/00/00/02/20000718283_1.jpg
,19870,20000596561,$96,布克兄弟,BROOKSBROTHERS,DONEGAL TWILL STRETCH CHINOS 裤子,http://static.lottedfs.cn/prod/prd-img/47/82/71/00/00/02/20000718247_1.jpg
,19870,20000596530,$48,布克兄弟,BROOKSBROTHERS,RED FLEECE NYC GRAPHIC LONG-SLEEVE T-SHIRT 男士T恤,http://static.lottedfs.cn/prod/prd-img/63/81/71/00/00/02/20000718163_5.jpg
免税独家,19870,20000596496,$42,布克兄弟,BROOKSBROTHERS,RED FLEECE NYC GRAPHIC T-SHIRT 短袖T恤,http://static.lottedfs.cn/prod/prd-img/14/81/71/00/00/02/20000718114_1.jpg
,19870,20000596467,$60,布克兄弟,BROOKSBROTHERS,GINGHAM BROADCLOTH SPORT SHIRT 衬衫,http://static.lottedfs.cn/prod/prd-img/54/80/71/00/00/02/20000718054_1.jpg
促销,19870,20000596340,$106,布克兄弟,BROOKSBROTHERS,"MILANO SLIM-FIT DRESS SHIRT, NON-IRON MICRO-CHECK 衬衫",http://static.lottedfs.cn/prod/prd-img/00/77/71/00/00/02/20000717700_1.jpg
畅销,19870,20000550896,$84,布克兄弟,BROOKSBROTHERS,RED FLEECE SHORT SEERSUCKER MULTI WHITE 短裤,http://static.lottedfs.cn/prod/prd-img/35/52/64/00/00/02/20000645235_1.jpg
促销,19870,20000550814,$123,布克兄弟,BROOKSBROTHERS,TEXTURED DOT TIE 领带,http://static.lottedfs.cn/prod/prd-img/06/50/64/00/00/02/20000645006_1.jpg
,19870,20000534457,$66,布克兄弟,BROOKSBROTHERS,STRIPED COTTON HENLEY 男士T恤,http://static.lottedfs.cn/prod/prd-img/91/61/61/00/00/02/20000616191_1.jpg
新品,19870,20000637359,$120,布克兄弟,BROOKSBROTHERS,SUPIMA COTTON CABLE CREWNECK SWEATER 针织衫,http://static.lottedfs.cn/prod/prd-img/34/69/78/00/00/02/20000786934_1.jpg
新品,19870,20000637349,$70,布克兄弟,BROOKSBROTHERS,PERFORMANCE SERIES COOLMAX CREWNECK SWEATER 针织衫,http://static.lottedfs.cn/prod/prd-img/02/69/78/00/00/02/20000786902_1.jpg
促销 免税独家,19870,20000615392,$135,布克兄弟,BROOKSBROTHERS,LAMBSWOOL CABLE CREWNECK SWEATER 针织衫,http://static.lottedfs.cn/prod/prd-img/66/54/75/00/00/02/20000755466_1.JPG
促销 免税独家,19870,20000615364,$135,布克兄弟,BROOKSBROTHERS,LAMBSWOOL CABLE CREWNECK SWEATER 针织衫,http://static.lottedfs.cn/prod/prd-img/95/53/75/00/00/02/20000755395_1.JPG
免税独家,19870,20000613915,$60,布克兄弟,BROOKSBROTHERS,PERFORMANCE SERIES POPLIN SHIRT 衬衣,http://static.lottedfs.cn/prod/prd-img/26/25/75/00/00/02/20000752526_1.jpg
,19870,20000613865,$60,布克兄弟,BROOKSBROTHERS,SUPIMA COTTON OXFORD SPORT SHIRT 衬衣,http://static.lottedfs.cn/prod/prd-img/92/23/75/00/00/02/20000752392_1.jpg
,19870,20000613759,$48,布克兄弟,BROOKSBROTHERS,GARMENT-DYED COTTON JERSEY LONG-SLEEVE T-SHIRT 长袖T恤,http://static.lottedfs.cn/prod/prd-img/18/22/75/00/00/02/20000752218_1.jpg
,19870,20000613487,$241,布克兄弟,BROOKSBROTHERS,SWEATER REDFLEECE BOMBER 开衫,http://static.lottedfs.cn/prod/prd-img/87/16/75/00/00/02/20000751687_1.jpg
,19870,20000613444,$60,布克兄弟,BROOKSBROTHERS,RED FLEECE EMBROIDERED COTTON OXFORD SHIRT 衬衫,http://static.lottedfs.cn/prod/prd-img/60/15/75/00/00/02/20000751560_1.jpg
免税独家,19870,20000613411,$67,布克兄弟,BROOKSBROTHERS,GARMENT DYED COTTON BROADCLOTH SPORT SHIRT 衬衫,http://static.lottedfs.cn/prod/prd-img/64/14/75/00/00/02/20000751464_1.jpg
促销,19870,20000605513,$106,布克兄弟,BROOKSBROTHERS,MILANO SLIM-FIT DARTED DRESS SHIT NON-IRON SPREAD COLLAR 衬衫,http://static.lottedfs.cn/prod/prd-img/28/73/73/00/00/02/20000737328_6.jpg
促销,19870,20000603874,$106,布克兄弟,BROOKSBROTHERS,REGENT FIT CHECK BRUSHED FLANNEL SPORT SHIRT 男士衬衫,http://static.lottedfs.cn/prod/prd-img/48/44/73/00/00/02/20000734448_1.jpg
促销 免税独家,19870,20000603867,$98,布克兄弟,BROOKSBROTHERS,DUCK PRINT TIE 领带,http://static.lottedfs.cn/prod/prd-img/32/44/73/00/00/02/20000734432_1.jpg
,19870,20000601512,$106,布克兄弟,BROOKSBROTHERS,WOOL-BLEND V-NECK FAIR ISLE SWEATER 男士针织衫,http://static.lottedfs.cn/prod/prd-img/39/91/72/00/00/02/20000729139_1.jpg
,19870,20000601474,$106,布克兄弟,BROOKSBROTHERS,LAMBSWOOL RAGLAN CREWNECK SWEATER 男士针织衫,http://static.lottedfs.cn/prod/prd-img/44/90/72/00/00/02/20000729044_1.jpg
,19870,20000601461,$106,布克兄弟,BROOKSBROTHERS,LAMBSWOOL RAGLAN CREWNECK SWEATER 男士针织衫,http://static.lottedfs.cn/prod/prd-img/07/90/72/00/00/02/20000729007_1.jpg
促销 畅销,19870,20000601435,$205,布克兄弟,BROOKSBROTHERS,SWEATER COLOR BLOCK CREW 男士针织衫,http://static.lottedfs.cn/prod/prd-img/13/89/72/00/00/02/20000728913_1.jpg
促销,19870,20000601428,$131,布克兄弟,BROOKSBROTHERS,SOHO FIT BRUSHED TWILL STRETCH CHINOS 男士裤子,http://static.lottedfs.cn/prod/prd-img/95/88/72/00/00/02/20000728895_1.jpg
促销,19870,20000601376,$120,布克兄弟,BROOKSBROTHERS,NON-IRON REGENT FIT SIGNATURE TARTAN SPORT SHIRT 衬衫,http://static.lottedfs.cn/prod/prd-img/04/87/72/00/00/02/20000728704_3.jpg
,19870,20000596621,$120,布克兄弟,BROOKSBROTHERS,RED FLEECE NYC LARGE CANVAS TOTE BAG 手提包,http://static.lottedfs.cn/prod/prd-img/81/83/71/00/00/02/20000718381_3.jpg
免税独家,19870,20000596614,$39,布克兄弟,BROOKSBROTHERS,COTTON PAISLEY POCKET SQUARE 手绢,http://static.lottedfs.cn/prod/prd-img/58/83/71/00/00/02/20000718358_2.jpg
,19870,20000596584,$145,布克兄弟,BROOKSBROTHERS,WOOL-BLEND PATCH CARDIGAN 开衫,http://static.lottedfs.cn/prod/prd-img/06/83/71/00/00/02/20000718306_1.jpg
,19870,20000596582,$169,布克兄弟,BROOKSBROTHERS,MERINO WOOL ZIP-UP SWEATER 开衫,http://static.lottedfs.cn/prod/prd-img/98/82/71/00/00/02/20000718298_4.jpg
,19870,20000596581,$169,布克兄弟,BROOKSBROTHERS,MERINO WOOL ZIP-UP SWEATER 开衫,http://static.lottedfs.cn/prod/prd-img/94/82/71/00/00/02/20000718294_1.jpg
,19870,20000596575,$120,布克兄弟,BROOKSBROTHERS,COLOR-BLOCK SHAWL COLLAR CARDIGAN SWEATER 开衫,http://static.lottedfs.cn/prod/prd-img/74/82/71/00/00/02/20000718274_1.jpg
,19870,20000596572,$131,布克兄弟,BROOKSBROTHERS,COTTON-CASHMERE RUGBY SWEATER 针织衫,http://static.lottedfs.cn/prod/prd-img/68/82/71/00/00/02/20000718268_1.jpg
,19870,20000596565,$106,布克兄弟,BROOKSBROTHERS,LAMBSWOOL RAGLAN CREWNECK SWEATER 针织衫,http://static.lottedfs.cn/prod/prd-img/54/82/71/00/00/02/20000718254_7.jpg
,19870,20000596538,$70,布克兄弟,BROOKSBROTHERS,SLIM-FIT GARMENT-DYED STRETCH CHINOS 裤子,http://static.lottedfs.cn/prod/prd-img/95/81/71/00/00/02/20000718195_1.jpg
畅销,19870,20000596535,$70,布克兄弟,BROOKSBROTHERS,SLIM-FIT GARMENT-DYED STRETCH CHINOS 裤子,http://static.lottedfs.cn/prod/prd-img/83/81/71/00/00/02/20000718183_1.jpg
,19870,20000596526,$48,布克兄弟,BROOKSBROTHERS,RED FLEECE NYC GRAPHIC LONG-SLEEVE T-SHIRT 男士T恤,http://static.lottedfs.cn/prod/prd-img/56/81/71/00/00/02/20000718156_4.jpg
,19870,20000596508,$42,布克兄弟,BROOKSBROTHERS,COTTON JERSEY LOGO T-SHIRT 男士短袖T恤,http://static.lottedfs.cn/prod/prd-img/32/81/71/00/00/02/20000718132_1.jpg
,19870,20000596495,$135,布克兄弟,BROOKSBROTHERS,FRENCH TERRY BOMBER SWEATER JACKET 开衫,http://static.lottedfs.cn/prod/prd-img/11/81/71/00/00/02/20000718111_1.jpg
,19870,20000596480,$42,布克兄弟,BROOKSBROTHERS,RED FLEECE BICYCLE GRAPHIC T-SHIRT 短袖T恤,http://static.lottedfs.cn/prod/prd-img/92/80/71/00/00/02/20000718092_1.jpg
,19870,20000596477,$67,布克兄弟,BROOKSBROTHERS,COTTON OXFORD LOGO SPORT SHIRT 衬衫,http://static.lottedfs.cn/prod/prd-img/84/80/71/00/00/02/20000718084_8.jpg
,19870,20000596471,$60,布克兄弟,BROOKSBROTHERS,GINGHAM BROADCLOTH SPORT SHIRT 衬衫,http://static.lottedfs.cn/prod/prd-img/64/80/71/00/00/02/20000718064_1.jpg
促销 免税独家,19870,20000596328,$113,布克兄弟,BROOKSBROTHERS,FLYING DUCKS TIE 领带,http://static.lottedfs.cn/prod/prd-img/55/76/71/00/00/02/20000717655_2.jpg
,19870,20000550997,$89,布克兄弟,BROOKSBROTHERS,PALM LEAF LINEN-BLEND SPORT SHIRT 衬衫,http://static.lottedfs.cn/prod/prd-img/67/54/64/00/00/02/20000645467_1.jpg
,19870,20000550915,$46,布克兄弟,BROOKSBROTHERS,MULTI-STRIPE SLUB COTTON JERSEY T-SHIRT 男士短袖T恤,http://static.lottedfs.cn/prod/prd-img/18/53/64/00/00/02/20000645318_1.jpg
,19870,20000550907,$66,布克兄弟,BROOKSBROTHERS,STRIPE POLO SHIRT 翻领T恤衫,http://static.lottedfs.cn/prod/prd-img/81/52/64/00/00/02/20000645281_1.jpg
,19870,20000550847,$66,布克兄弟,BROOKSBROTHERS,HENLEY DOT JAQ T恤衫,http://static.lottedfs.cn/prod/prd-img/70/50/64/00/00/02/20000645070_1.jpg
促销,19870,20000550839,$58,布克兄弟,BROOKSBROTHERS,GINGHAM POCKET SQUARE 方巾,http://static.lottedfs.cn/prod/prd-img/43/50/64/00/00/02/20000645043_1.jpg
促销,19870,20000534430,$112,布克兄弟,BROOKSBROTHERS,SLIM FIT COTTON JERSEY LONG SLEEVE POLO SHIRT 男士上衣,http://static.lottedfs.cn/prod/prd-img/21/61/61/00/00/02/20000616121_1.jpg
促销,19870,20000534373,$131,布克兄弟,BROOKSBROTHERS,LINEN AND COTTON POLO SWEATER 男士上衣,http://static.lottedfs.cn/prod/prd-img/99/59/61/00/00/02/20000615999_1.jpg
新品,19870,20000637357,$120,布克兄弟,BROOKSBROTHERS,TEXTURED SHAWL COLLAR CARDIGAN SWEATER 针织开襟衫,http://static.lottedfs.cn/prod/prd-img/30/69/78/00/00/02/20000786930_1.jpg
新品,19870,20000637354,$120,布克兄弟,BROOKSBROTHERS,SUPIMA COTTON CABLE CREWNECK SWEATER 针织衫,http://static.lottedfs.cn/prod/prd-img/21/69/78/00/00/02/20000786921_2.jpg
新品,19870,20000637353,$96,布克兄弟,BROOKSBROTHERS,COLOR CONTRAST LOGO HOODIE 连帽针织衫,http://static.lottedfs.cn/prod/prd-img/18/69/78/00/00/02/20000786918_1.jpg
新品,19870,20000637352,$120,布克兄弟,BROOKSBROTHERS,TIPPED COTTON CARDIGAN SWEATER 开襟针织衫,http://static.lottedfs.cn/prod/prd-img/13/69/78/00/00/02/20000786913_1.jpg
新品,19870,20000637348,$70,布克兄弟,BROOKSBROTHERS,PERFORMANCE SERIES COOLMAX CREWNECK SWEATER 针织衫,http://static.lottedfs.cn/prod/prd-img/96/68/78/00/00/02/20000786896_2.jpg
新品,19870,20000637346,$120,布克兄弟,BROOKSBROTHERS,SUPIMA COTTON CABLE CREWNECK SWEATER 针织衫,http://static.lottedfs.cn/prod/prd-img/89/68/78/00/00/02/20000786889_1.jpg
,19870,20000613911,$81,布克兄弟,BROOKSBROTHERS,PLAID HEAVY FLANNEL SHIRT 衬衣,http://static.lottedfs.cn/prod/prd-img/10/25/75/00/00/02/20000752510_2.jpg
促销,19870,20000613908,$120,布克兄弟,BROOKSBROTHERS,REGENT FIT GARMENT DYED CORDUROY SPORT SHIRT 衬衣,http://static.lottedfs.cn/prod/prd-img/99/24/75/00/00/02/20000752499_2.jpg
促销,19870,20000613905,$120,布克兄弟,BROOKSBROTHERS,REGENT FIT GARMENT DYED CORDUROY SPORT SHIRT 衬衣,http://static.lottedfs.cn/prod/prd-img/86/24/75/00/00/02/20000752486_1.jpg
畅销,19870,20000613879,$60,布克兄弟,BROOKSBROTHERS,SUPIMA COTTON OXFORD SPORT SHIRT 衬衣,http://static.lottedfs.cn/prod/prd-img/26/24/75/00/00/02/20000752426_1.jpg
促销,19870,20000613873,$106,布克兄弟,BROOKSBROTHERS,STRIPED PINPOINT YARNDYES SPORT SHIRT 衬衣,http://static.lottedfs.cn/prod/prd-img/15/24/75/00/00/02/20000752415_1.jpg
促销,19870,20000613869,$106,布克兄弟,BROOKSBROTHERS,STRIPED PINPOINT YARNDYES SPORT SHIRT 衬衣,http://static.lottedfs.cn/prod/prd-img/02/24/75/00/00/02/20000752402_1.jpg
免税独家,19870,20000613514,$70,布克兄弟,BROOKSBROTHERS,PERFORMANCE SERIES LONG SLEEVE HENLEY 长袖T恤,http://static.lottedfs.cn/prod/prd-img/66/17/75/00/00/02/20000751766_1.jpg
免税独家,19870,20000613504,$70,布克兄弟,BROOKSBROTHERS,PERFORMANCE SERIES LONG SLEEVE HENLEY 长袖T恤,http://static.lottedfs.cn/prod/prd-img/38/17/75/00/00/02/20000751738_1.jpg
,19870,20000613500,$70,布克兄弟,BROOKSBROTHERS,COTTON JERSEY LONG SLEEVE HENLEY 长袖T恤,http://static.lottedfs.cn/prod/prd-img/29/17/75/00/00/02/20000751729_1.jpg
促销,19870,20000613477,$84,布克兄弟,BROOKSBROTHERS,WATER RESISTANT PUFFER VEST 马甲,http://static.lottedfs.cn/prod/prd-img/57/16/75/00/00/02/20000751657_1.jpg
促销,19870,20000613473,$84,布克兄弟,BROOKSBROTHERS,WATER RESISTANT PUFFER VEST 马甲,http://static.lottedfs.cn/prod/prd-img/46/16/75/00/00/02/20000751646_1.jpg
促销,19870,20000613468,$106,布克兄弟,BROOKSBROTHERS,WATER RESISTANT PUFFER JACKET 外套,http://static.lottedfs.cn/prod/prd-img/33/16/75/00/00/02/20000751633_1.jpg
促销,19870,20000613462,$106,布克兄弟,BROOKSBROTHERS,WATER RESISTANT PUFFER JACKET 外套,http://static.lottedfs.cn/prod/prd-img/17/16/75/00/00/02/20000751617_1.jpg
促销,19870,20000613458,$106,布克兄弟,BROOKSBROTHERS,WATER RESISTANT PUFFER JACKET 外套,http://static.lottedfs.cn/prod/prd-img/04/16/75/00/00/02/20000751604_1.jpg
,19870,20000613448,$60,布克兄弟,BROOKSBROTHERS,RED FLEECE EMBROIDERED COTTON OXFORD SHIRT 衬衫,http://static.lottedfs.cn/prod/prd-img/71/15/75/00/00/02/20000751571_3.jpg
免税独家,19870,20000613421,$81,布克兄弟,BROOKSBROTHERS,INDIGO DAISY PRINT POPLIN SHIRT 衬衫,http://static.lottedfs.cn/prod/prd-img/03/15/75/00/00/02/20000751503_1.jpg
,19870,20000603981,$135,布克兄弟,BROOKSBROTHERS,SWEATER RF CREW SKIER ALPINE 针织衫,http://static.lottedfs.cn/prod/prd-img/05/48/73/00/00/02/20000734805_1.jpg
,19870,20000603980,$120,布克兄弟,BROOKSBROTHERS,SWEATER RF CREW OVERSIZED 针织衫,http://static.lottedfs.cn/prod/prd-img/00/48/73/00/00/02/20000734800_2.jpg
,19870,20000603978,$176,布克兄弟,BROOKSBROTHERS,SWEATER RF HALFZIP 针织衫,http://static.lottedfs.cn/prod/prd-img/95/47/73/00/00/02/20000734795_1.jpg
,19870,20000603977,$176,布克兄弟,BROOKSBROTHERS,SWEATER RF HALFZIP 针织衫,http://static.lottedfs.cn/prod/prd-img/91/47/73/00/00/02/20000734791_1.jpg
免税独家,19870,20000603974,$176,布克兄弟,BROOKSBROTHERS,SWEATER RF HALFZIP 针织衫,http://static.lottedfs.cn/prod/prd-img/69/47/73/00/00/02/20000734769_1.jpg
免税独家,19870,20000603951,$57,布克兄弟,BROOKSBROTHERS,RF GLOVES RED BUFFALO 手套,http://static.lottedfs.cn/prod/prd-img/84/46/73/00/00/02/20000734684_1.jpg
,19870,20000603948,$84,布克兄弟,BROOKSBROTHERS,RF SCARF RED BUFFALO 围巾,http://static.lottedfs.cn/prod/prd-img/81/46/73/00/00/02/20000734681_1.jpg
免税独家,19870,20000603947,$57,布克兄弟,BROOKSBROTHERS,RF GLOVES NAVY CREAM NORDIC 手套,http://static.lottedfs.cn/prod/prd-img/75/46/73/00/00/02/20000734675_1.jpg
,19870,20000603944,$84,布克兄弟,BROOKSBROTHERS,RF SCARF NAVY CREAM NORDIC 围巾,http://static.lottedfs.cn/prod/prd-img/65/46/73/00/00/02/20000734665_1.jpg
,19870,20000603942,$70,布克兄弟,BROOKSBROTHERS,DEER SUEDE GLOVES 手套,http://static.lottedfs.cn/prod/prd-img/59/46/73/00/00/02/20000734659_1.jpg
,19870,20000603940,$70,布克兄弟,BROOKSBROTHERS,DEER SUEDE GLOVES 手套,http://static.lottedfs.cn/prod/prd-img/53/46/73/00/00/02/20000734653_1.jpg
,19870,20000603919,$135,布克兄弟,BROOKSBROTHERS,SWEATER RF CARDI NORDIC 男士开襟针织衫,http://static.lottedfs.cn/prod/prd-img/65/45/73/00/00/02/20000734565_1.jpg
促销,19870,20000603910,$347,布克兄弟,BROOKSBROTHERS,OUTER RF PARKA 男士外套,http://static.lottedfs.cn/prod/prd-img/29/45/73/00/00/02/20000734529_1.jpg
畅销 免税独家,19870,20000603899,$120,布克兄弟,BROOKSBROTHERS,ZIP-UP FLEECE SWEATER JACKET 男士外套,http://static.lottedfs.cn/prod/prd-img/02/45/73/00/00/02/20000734502_1.jpg
,19870,20000603893,$67,布克兄弟,BROOKSBROTHERS,FLANNEL FUN FUN SHIRT 男士衬衫,http://static.lottedfs.cn/prod/prd-img/90/44/73/00/00/02/20000734490_1.jpg
,19870,20000603885,$60,布克兄弟,BROOKSBROTHERS,BLACK STEWART SHIRT 男士衬衫,http://static.lottedfs.cn/prod/prd-img/73/44/73/00/00/02/20000734473_1.jpg
,19870,20000603883,$96,布克兄弟,BROOKSBROTHERS,HOUND PRINT POPLIN SHIRT 男士衬衫,http://static.lottedfs.cn/prod/prd-img/68/44/73/00/00/02/20000734468_1.jpg
促销,19870,20000603882,$347,布克兄弟,BROOKSBROTHERS,FUN SHAWL CARDIGAN SWEATER 男士开襟衫,http://static.lottedfs.cn/prod/prd-img/64/44/73/00/00/02/20000734464_1.jpg
促销,19870,20000603879,$120,布克兄弟,BROOKSBROTHERS,REGENT FIT TWILL TARTAN FUN SPORT SHIRT 男士衬衫,http://static.lottedfs.cn/prod/prd-img/58/44/73/00/00/02/20000734458_1.jpg
促销,19870,20000603877,$120,布克兄弟,BROOKSBROTHERS,REGENT FIT TWILL HOLIDAY TARTAN SPORT SHIRT 男士衬衫,http://static.lottedfs.cn/prod/prd-img/52/44/73/00/00/02/20000734452_1.jpg
促销,19870,20000603876,$98,布克兄弟,BROOKSBROTHERS,SANTA IN TOWN TIE 领带,http://static.lottedfs.cn/prod/prd-img/50/44/73/00/00/02/20000734450_1.jpg
促销 免税独家,19870,20000603872,$98,布克兄弟,BROOKSBROTHERS,REINDEER TIE 领带,http://static.lottedfs.cn/prod/prd-img/41/44/73/00/00/02/20000734441_1.jpg
促销,19870,20000603871,$98,布克兄弟,BROOKSBROTHERS,MEDALLION TIE 领带,http://static.lottedfs.cn/prod/prd-img/40/44/73/00/00/02/20000734440_1.jpg
,19870,20000601524,$57,布克兄弟,BROOKSBROTHERS,REDFLEECE BELT 腰带,http://static.lottedfs.cn/prod/prd-img/85/91/72/00/00/02/20000729185_1.jpg
,19870,20000601518,$106,布克兄弟,BROOKSBROTHERS,WOOL-BLEND CABLE LOGO SWEATER 男士针织衫,http://static.lottedfs.cn/prod/prd-img/62/91/72/00/00/02/20000729162_1.jpg
,19870,20000601515,$120,布克兄弟,BROOKSBROTHERS,PATCHWORK WOOL BLEND CREWNECK SWEATER 男士针织衫,http://static.lottedfs.cn/prod/prd-img/47/91/72/00/00/02/20000729147_2.jpg
,19870,20000601491,$106,布克兄弟,BROOKSBROTHERS,LAMBSWOOL RAGLAN CREWNECK SWEATER 男士针织衫,http://static.lottedfs.cn/prod/prd-img/72/90/72/00/00/02/20000729072_1.jpg
,19870,20000601483,$106,布克兄弟,BROOKSBROTHERS,LAMBSWOOL RAGLAN CREWNECK SWEATER 男士针织衫,http://static.lottedfs.cn/prod/prd-img/59/90/72/00/00/02/20000729059_1.jpg
,19870,20000601443,$60,布克兄弟,BROOKSBROTHERS,FAIR WOOL KNIT TIE 领带,http://static.lottedfs.cn/prod/prd-img/37/89/72/00/00/02/20000728937_1.jpg
促销,19870,20000601408,$131,布克兄弟,BROOKSBROTHERS,SOHO FIT BRUSHED TWILL STRETCH CHINOS 裤子,http://static.lottedfs.cn/prod/prd-img/28/88/72/00/00/02/20000728828_1.jpg
促销 畅销 免税独家,19870,20000601371,$106,布克兄弟,BROOKSBROTHERS,REGENT FIT CHECK BRUSHED FLANNEL SPORT SHIRT 衬衫,http://static.lottedfs.cn/prod/prd-img/88/86/72/00/00/02/20000728688_1.jpg
,19870,20000601195,$106,布克兄弟,BROOKSBROTHERS,WOOL-BLEND FAIR ISLE CREWNECK SWEATER 男士针织衫,http://static.lottedfs.cn/prod/prd-img/42/82/72/00/00/02/20000728242_3.jpg
免税独家,19870,20000596620,$81,布克兄弟,BROOKSBROTHERS,BRAIDED LEATHER BELT 腰带,http://static.lottedfs.cn/prod/prd-img/78/83/71/00/00/02/20000718378_1.jpg
免税独家,19870,20000596618,$81,布克兄弟,BROOKSBROTHERS,BRAIDED LEATHER BELT 腰带,http://static.lottedfs.cn/prod/prd-img/70/83/71/00/00/02/20000718370_1.jpg
,19870,20000596617,$81,布克兄弟,BROOKSBROTHERS,LEATHER BELT 腰带,http://static.lottedfs.cn/prod/prd-img/66/83/71/00/00/02/20000718366_1.jpg
,19870,20000596616,$81,布克兄弟,BROOKSBROTHERS,LEATHER BELT 腰带,http://static.lottedfs.cn/prod/prd-img/61/83/71/00/00/02/20000718361_1.jpg
,19870,20000596613,$84,布克兄弟,BROOKSBROTHERS,MERINO WOOL CREWNECK SWEATER 针织衫,http://static.lottedfs.cn/prod/prd-img/55/83/71/00/00/02/20000718355_2.jpg
,19870,20000596608,$84,布克兄弟,BROOKSBROTHERS,MERINO WOOL CREWNECK SWEATER 针织衫,http://static.lottedfs.cn/prod/prd-img/47/83/71/00/00/02/20000718347_3.jpg
,19870,20000596586,$120,布克兄弟,BROOKSBROTHERS,MERINO WOOL CARDIGAN 开衫,http://static.lottedfs.cn/prod/prd-img/14/83/71/00/00/02/20000718314_1.jpg
畅销,19870,20000596585,$120,布克兄弟,BROOKSBROTHERS,MERINO WOOL CARDIGAN 开衫,http://static.lottedfs.cn/prod/prd-img/09/83/71/00/00/02/20000718309_1.jpg
,19870,20000596583,$145,布克兄弟,BROOKSBROTHERS,WOOL-BLEND LETTERMAN CARDIGAN 开衫,http://static.lottedfs.cn/prod/prd-img/03/83/71/00/00/02/20000718303_1.jpg
促销,19870,20000596580,$169,布克兄弟,BROOKSBROTHERS,MERINO WOOL ZIP-UP SWEATER 开衫,http://static.lottedfs.cn/prod/prd-img/90/82/71/00/00/02/20000718290_4.jpg
,19870,20000596579,$145,布克兄弟,BROOKSBROTHERS,MERINO WOOL BOXER SWEATER 针织衫,http://static.lottedfs.cn/prod/prd-img/86/82/71/00/00/02/20000718286_1.jpg
,19870,20000596577,$138,布克兄弟,BROOKSBROTHERS,MERINO WOOL RED FLEECE NY SWEATER 针织衫,http://static.lottedfs.cn/prod/prd-img/78/82/71/00/00/02/20000718278_3.jpg
,19870,20000596568,$131,布克兄弟,BROOKSBROTHERS,COTTON-CASHMERE RUGBY SWEATER 针织衫,http://static.lottedfs.cn/prod/prd-img/61/82/71/00/00/02/20000718261_3.jpg
,19870,20000596549,$96,布克兄弟,BROOKSBROTHERS,DONEGAL TWILL STRETCH CHINOS 裤子,http://static.lottedfs.cn/prod/prd-img/21/82/71/00/00/02/20000718221_1.jpg
,19870,20000596542,$96,布克兄弟,BROOKSBROTHERS,BICYCLE-PRINT COTTON TWILL CHINOS 裤子,http://static.lottedfs.cn/prod/prd-img/06/82/71/00/00/02/20000718206_1.jpg
,19870,20000596534,$60,布克兄弟,BROOKSBROTHERS,STRIPED DOUBLE-KNIT LONG-SLEEVE HENLEY 男士T恤,http://static.lottedfs.cn/prod/prd-img/73/81/71/00/00/02/20000718173_1.jpg
,19870,20000596532,$60,布克兄弟,BROOKSBROTHERS,STRIPED DOUBLE-KNIT LONG-SLEEVE HENLEY 男士T恤,http://static.lottedfs.cn/prod/prd-img/68/81/71/00/00/02/20000718168_1.jpg
,19870,20000596521,$48,布克兄弟,BROOKSBROTHERS,RED FLEECE NYC GRAPHIC LONG-SLEEVE T-SHIRT 男士T恤,http://static.lottedfs.cn/prod/prd-img/48/81/71/00/00/02/20000718148_1.jpg
畅销,19870,20000596476,$81,布克兄弟,BROOKSBROTHERS,STRIPED PINPOINT OXFORD EMBROIDERED SPORT SHIRT 衬衫,http://static.lottedfs.cn/prod/prd-img/80/80/71/00/00/02/20000718080_1.jpg
,19870,20000596475,$96,布克兄弟,BROOKSBROTHERS,FOULARD-PRINT POPLIN SPORT SHIRT 衬衫,http://static.lottedfs.cn/prod/prd-img/76/80/71/00/00/02/20000718076_3.jpg
畅销 免税独家,19870,20000596474,$60,布克兄弟,BROOKSBROTHERS,STRIPED YARN-DYED BROADCLOTH SPORT SHIRT 衬衫,http://static.lottedfs.cn/prod/prd-img/73/80/71/00/00/02/20000718073_4.jpg
,19870,20000596472,$60,布克兄弟,BROOKSBROTHERS,PLAID COTTON OXFORD SPORT SHIRT 衬衫,http://static.lottedfs.cn/prod/prd-img/69/80/71/00/00/02/20000718069_1.jpg
,19870,20000596469,$60,布克兄弟,BROOKSBROTHERS,GINGHAM BROADCLOTH SPORT SHIRT 衬衫,http://static.lottedfs.cn/prod/prd-img/59/80/71/00/00/02/20000718059_4.jpg
,19870,20000596466,$60,布克兄弟,BROOKSBROTHERS,GINGHAM BROADCLOTH SPORT SHIRT 衬衫,http://static.lottedfs.cn/prod/prd-img/50/80/71/00/00/02/20000718050_4.jpg
促销,19870,20000596465,$156,布克兄弟,BROOKSBROTHERS,DOUBLE-FACED WOOL SCARF 围巾,http://static.lottedfs.cn/prod/prd-img/48/80/71/00/00/02/20000718048_3.jpg
促销,19870,20000596463,$120,布克兄弟,BROOKSBROTHERS,WOOL BLEND SCARF 围巾,http://static.lottedfs.cn/prod/prd-img/46/80/71/00/00/02/20000718046_1.jpg
促销,19870,20000596461,$184,布克兄弟,BROOKSBROTHERS,WASHABLE MERINO WOOL PLAID BACK WAISTCOAT 马甲,http://static.lottedfs.cn/prod/prd-img/41/80/71/00/00/02/20000718041_4.jpg
促销,19870,20000596456,$184,布克兄弟,BROOKSBROTHERS,SILK AND COTTON POLO SWEATER 针织衫,http://static.lottedfs.cn/prod/prd-img/35/80/71/00/00/02/20000718035_1.jpg
