tag,brand_No,product_No,us_price,brand_name_chn,brand_name_eng,product_name,img_url
,1002470,20000610423,$53,NATIONAL GEOGRAPHIC,NATIONAL GEOGRAPHIC,SOPHI SLIP ONS N194AFW080 男士鞋 IVORY,http://static.lottedfs.cn/prod/prd-img/38/59/74/00/00/02/20000745938_1.jpg
畅销,1002470,20000610411,$84,NATIONAL GEOGRAPHIC,NATIONAL GEOGRAPHIC,CAMEL WOVEN INCISION COLORING MTM N193MSW240 卫衣 CARBON BLACK,http://static.lottedfs.cn/prod/prd-img/99/58/74/00/00/02/20000745899_1.jpg
,1002470,20000610404,$22,NATIONAL GEOGRAPHIC,NATIONAL GEOGRAPHIC,KIDS MEGA LOGO BEANIE N194KHA060 儿童帽子 NAVY,http://static.lottedfs.cn/prod/prd-img/73/58/74/00/00/02/20000745873_1.jpg
畅销,1002470,20000610397,$38,NATIONAL GEOGRAPHIC,NATIONAL GEOGRAPHIC,KIDS TRAPPER HAT N194KHA020 L/PINK 儿童帽子,http://static.lottedfs.cn/prod/prd-img/55/58/74/00/00/02/20000745855_1.jpg
,1002470,20000610388,$30,NATIONAL GEOGRAPHIC,NATIONAL GEOGRAPHIC,KIDS FlEECE BUCKLE NECK WARMER N194KMS020 儿童围巾 BLACK,http://static.lottedfs.cn/prod/prd-img/10/58/74/00/00/02/20000745810_1.jpg
,1002470,20000610383,$30,NATIONAL GEOGRAPHIC,NATIONAL GEOGRAPHIC,KIDS FlEECE BUCKLE NECK WARMER N194KMS020 儿童围巾 IVORY,http://static.lottedfs.cn/prod/prd-img/99/57/74/00/00/02/20000745799_1.jpg
,1002470,20000610364,$37,NATIONAL GEOGRAPHIC,NATIONAL GEOGRAPHIC,POINT LABEL BEANIE N194UHA260 帽子 BLACK,http://static.lottedfs.cn/prod/prd-img/23/57/74/00/00/02/20000745723_1.jpg
,1002470,20000610363,$37,NATIONAL GEOGRAPHIC,NATIONAL GEOGRAPHIC,POINT LABEL BEANIE N194UHA260 帽子 MUSTARD,http://static.lottedfs.cn/prod/prd-img/18/57/74/00/00/02/20000745718_1.jpg
,1002470,20000610359,$37,NATIONAL GEOGRAPHIC,NATIONAL GEOGRAPHIC,POINT LABEL BEANIE N194UHA260 帽子 TURQUOISE,http://static.lottedfs.cn/prod/prd-img/08/57/74/00/00/02/20000745708_1.jpg
,1002470,20000610353,$46,NATIONAL GEOGRAPHIC,NATIONAL GEOGRAPHIC,FLEECE BUKEUL CROSS BAG N194ACR010 斜挎包 IVORY,http://static.lottedfs.cn/prod/prd-img/93/56/74/00/00/02/20000745693_1.jpg
畅销,1002470,20000608084,$123,NATIONAL GEOGRAPHIC,NATIONAL GEOGRAPHIC,KIDS LIGHT GOOSE DOWN JP N194KDW010 羽绒服 BEIGE,http://static.lottedfs.cn/prod/prd-img/34/20/74/00/00/02/20000742034_1.jpg
,1002470,20000608080,$46,NATIONAL GEOGRAPHIC,NATIONAL GEOGRAPHIC,KIDS BASIC TRAINING PANTS N193KPT010 儿童运动裤 CARBON BLACK,http://static.lottedfs.cn/prod/prd-img/25/20/74/00/00/02/20000742025_1.jpg
,1002470,20000608078,$46,NATIONAL GEOGRAPHIC,NATIONAL GEOGRAPHIC,KIDS BASIC TRAINING PANTS N193KPT010 儿童运动裤 DEEP SEA NAVY,http://static.lottedfs.cn/prod/prd-img/20/20/74/00/00/02/20000742020_1.jpg
,1002470,20000608053,$46,NATIONAL GEOGRAPHIC,NATIONAL GEOGRAPHIC,KIDS BASIC TRAINING PANTS N193KPT010 儿童运动裤 MUSTARD,http://static.lottedfs.cn/prod/prd-img/61/19/74/00/00/02/20000741961_1.jpg
,1002470,20000607893,$61,NATIONAL GEOGRAPHIC,NATIONAL GEOGRAPHIC,（UNISEX）POLARTEC MICRO FLEECE SMALL LOGO MTM N194USW070 男女同款卫衣 SUGAR SWIZZLE IVORY,http://static.lottedfs.cn/prod/prd-img/99/16/74/00/00/02/20000741699_1.jpg
,1002470,20000607873,$61,NATIONAL GEOGRAPHIC,NATIONAL GEOGRAPHIC,(UNISEX)POLARTEC MICRO FLEECE SMALL LOGO MTM N194USW070 男女同款卫衣 HAVANA KHAKI,http://static.lottedfs.cn/prod/prd-img/71/16/74/00/00/02/20000741671_1.jpg
,1002470,20000607860,$418,NATIONAL GEOGRAPHIC,NATIONAL GEOGRAPHIC,(UNISEX) RDS GOOSE DOWN JP N194UDW060 羽绒服 CARBON BLACK,http://static.lottedfs.cn/prod/prd-img/51/16/74/00/00/02/20000741651_1.jpg
畅销,1002470,20000607853,$418,NATIONAL GEOGRAPHIC,NATIONAL GEOGRAPHIC,(UNISEX) RDS GOOSE DOWN JP N194UDW060 男女同款羽绒服 PLAZA TAUPE BEIGE,http://static.lottedfs.cn/prod/prd-img/42/16/74/00/00/02/20000741642_1.jpg
,1002470,20000607837,$69,NATIONAL GEOGRAPHIC,NATIONAL GEOGRAPHIC,FLEECE BIG LOGO MTM N193USW100 男士卫衣 CARBON BLACK,http://static.lottedfs.cn/prod/prd-img/13/16/74/00/00/02/20000741613_1.jpg
,1002470,20000607835,$69,NATIONAL GEOGRAPHIC,NATIONAL GEOGRAPHIC,FLEECE BIG LOGO MTM N193USW100 男士卫衣 HAVANA KHAKI,http://static.lottedfs.cn/prod/prd-img/10/16/74/00/00/02/20000741610_1.jpg
,1002470,20000607831,$69,NATIONAL GEOGRAPHIC,NATIONAL GEOGRAPHIC,FLEECE BIG LOGO MTM N193USW100 男士卫衣 SUGAR SWIZZLE IVORY,http://static.lottedfs.cn/prod/prd-img/97/15/74/00/00/02/20000741597_1.jpg
,1002470,20000607741,$77,NATIONAL GEOGRAPHIC,NATIONAL GEOGRAPHIC,（MENS）LIGHT GOOSE DOWN JKT N194MDW210 男款羽绒服 CARBON BLACK,http://static.lottedfs.cn/prod/prd-img/27/14/74/00/00/02/20000741427_1.jpg
,1002470,20000607732,$123,NATIONAL GEOGRAPHIC,NATIONAL GEOGRAPHIC,NAPPED LINING JKT N193MJP220 男士外套 BLACK 2,http://static.lottedfs.cn/prod/prd-img/13/14/74/00/00/02/20000741413_1.jpg
,1002470,20000607702,$154,NATIONAL GEOGRAPHIC,NATIONAL GEOGRAPHIC,(MENS) LIGHT GOOSE DOWN JKT N194MDW220 羽绒服 OBSIDIAN CHARCOAL,http://static.lottedfs.cn/prod/prd-img/57/13/74/00/00/02/20000741357_1.jpg
,1002470,20000607678,$154,NATIONAL GEOGRAPHIC,NATIONAL GEOGRAPHIC,(MENS) LIGHT GOOSE DOWN JP N194MDW010 羽绒服 INCENSE BEIGE,http://static.lottedfs.cn/prod/prd-img/11/13/74/00/00/02/20000741311_1.jpg
,1002470,20000607668,$216,NATIONAL GEOGRAPHIC,NATIONAL GEOGRAPHIC,FISH TAIL LONG JP N193MJP010 男士外套 HAVANA KHAKI,http://static.lottedfs.cn/prod/prd-img/99/12/74/00/00/02/20000741299_1.jpg
,1002470,20000607396,$69,NATIONAL GEOGRAPHIC,NATIONAL GEOGRAPHIC,POLLYCARTER BIG LOGO MTM (FULLY NAPPED) N194USW060 男士卫衣 M/GREY,http://static.lottedfs.cn/prod/prd-img/28/09/74/00/00/02/20000740928_1.jpg
,1002470,20000607382,$69,NATIONAL GEOGRAPHIC,NATIONAL GEOGRAPHIC,(UNISEX)POLLYCARTER BIG LOGO MTM (FULLY NAPPED) N194USW060 男士卫衣 INCENSE BEIGE,http://static.lottedfs.cn/prod/prd-img/09/09/74/00/00/02/20000740909_1.jpg
,1002470,20000607329,$46,NATIONAL GEOGRAPHIC,NATIONAL GEOGRAPHIC,PINEOSEU BIG LOGO LONG SLEEVE ROUND T SHIRT N193UTS020 男士T恤 CARBON BLACK,http://static.lottedfs.cn/prod/prd-img/43/08/74/00/00/02/20000740843_1.jpg
,1002470,20000607318,$46,NATIONAL GEOGRAPHIC,NATIONAL GEOGRAPHIC,PINEOSEU BIG LOGO LONG SLEEVE ROUND T SHIRT N193UTS020 男士T恤 M/GREY,http://static.lottedfs.cn/prod/prd-img/29/08/74/00/00/02/20000740829_1.jpg
,1002470,20000607305,$46,NATIONAL GEOGRAPHIC,NATIONAL GEOGRAPHIC,PINEOSEU BIG LOGO LONG SLEEVE ROUND T SHIRT N193UTS020 男士T恤 DEEP SEA NAVY,http://static.lottedfs.cn/prod/prd-img/12/08/74/00/00/02/20000740812_1.jpg
,1002470,20000607271,$46,NATIONAL GEOGRAPHIC,NATIONAL GEOGRAPHIC,BASIC ROUND LONG SLEEVE T SHIRT N193UTS210 男士T恤 BLACK 2,http://static.lottedfs.cn/prod/prd-img/72/07/74/00/00/02/20000740772_1.jpg
,1002470,20000605785,$92,NATIONAL GEOGRAPHIC,NATIONAL GEOGRAPHIC,KIDS FLEECE BUBBLING VEST N194KFV010 儿童马甲 BROWN,http://static.lottedfs.cn/prod/prd-img/93/79/73/00/00/02/20000737993_1.jpg
,1002470,20000605756,$115,NATIONAL GEOGRAPHIC,NATIONAL GEOGRAPHIC,KIDS BISON RDS DUCK DOWN JP N194KDW080 儿童羽绒服 PEONY PINK,http://static.lottedfs.cn/prod/prd-img/47/79/73/00/00/02/20000737947_1.jpg
畅销,1002470,20000605752,$115,NATIONAL GEOGRAPHIC,NATIONAL GEOGRAPHIC,KIDS BISON RDS DUCK DOWN JP N194KDW080 儿童羽绒服 CARBON BLACK,http://static.lottedfs.cn/prod/prd-img/42/79/73/00/00/02/20000737942_1.jpg
,1002470,20000605750,$115,NATIONAL GEOGRAPHIC,NATIONAL GEOGRAPHIC,KIDS BISON RDS DUCK DOWN JP N194KDW080 儿童羽绒服 ARCTIC MINT,http://static.lottedfs.cn/prod/prd-img/36/79/73/00/00/02/20000737936_1.jpg
,1002470,20000605748,$115,NATIONAL GEOGRAPHIC,NATIONAL GEOGRAPHIC,KIDS BISON RDS DUCK DOWN JP N194KDW080-3 儿童羽绒服 MUSTARD,http://static.lottedfs.cn/prod/prd-img/29/79/73/00/00/02/20000737929_1.jpg
,1002470,20000605435,$108,NATIONAL GEOGRAPHIC,NATIONAL GEOGRAPHIC,KIDS RDS DUCK DOWN VEST N194KDV020 儿童羽绒马甲 PEONY PINK,http://static.lottedfs.cn/prod/prd-img/82/70/73/00/00/02/20000737082_1.jpg
,1002470,20000605431,$108,NATIONAL GEOGRAPHIC,NATIONAL GEOGRAPHIC,KIDS RDS DUCK DOWN VEST N194KDV020 儿童羽绒马甲 CARBON BLACK,http://static.lottedfs.cn/prod/prd-img/61/70/73/00/00/02/20000737061_1.jpg
,1002470,20000605427,$108,NATIONAL GEOGRAPHIC,NATIONAL GEOGRAPHIC,KIDS RDS DUCK DOWN VEST N194KDV020 儿童羽绒马甲 ARCTIC MINT,http://static.lottedfs.cn/prod/prd-img/45/70/73/00/00/02/20000737045_1.jpg
,1002470,20000605422,$108,NATIONAL GEOGRAPHIC,NATIONAL GEOGRAPHIC,KIDS RDS DUCK DOWN VEST N194KDV020 儿童羽绒马甲 MUSTARD,http://static.lottedfs.cn/prod/prd-img/27/70/73/00/00/02/20000737027_1.jpg
,1002470,20000605386,$61,NATIONAL GEOGRAPHIC,NATIONAL GEOGRAPHIC,KIDS POCKET TRAINING PANTS N193KPT080 儿童裤子 CAPULET OLIVE,http://static.lottedfs.cn/prod/prd-img/27/69/73/00/00/02/20000736927_1.jpg
,1002470,20000605380,$84,NATIONAL GEOGRAPHIC,NATIONAL GEOGRAPHIC,KIDS NAPPED LINING JKT N193KJP220 儿童外套 MUSTARD,http://static.lottedfs.cn/prod/prd-img/10/69/73/00/00/02/20000736910_1.jpg
,1002470,20000605363,$77,NATIONAL GEOGRAPHIC,NATIONAL GEOGRAPHIC,KIDS SCHULIEN TRAINING HOODY F-ZIP N193KFT080 儿童外套 CAPULET OLIVE,http://static.lottedfs.cn/prod/prd-img/82/68/73/00/00/02/20000736882_1.jpg
畅销,1002470,20000605165,$69,NATIONAL GEOGRAPHIC,NATIONAL GEOGRAPHIC,HETERO BIG LOGO MTM (FULL NAPPING) N194USW030 拉绒卫衣 OBSIDIAN CHARCOAL,http://static.lottedfs.cn/prod/prd-img/69/65/73/00/00/02/20000736569_1.jpg
,1002470,20000605157,$69,NATIONAL GEOGRAPHIC,NATIONAL GEOGRAPHIC,BIG LOGO MTM (FULLY NAPPED) N194USW030 拉绒卫衣 CARBON BLACK,http://static.lottedfs.cn/prod/prd-img/60/65/73/00/00/02/20000736560_1.jpg
,1002470,20000605151,$69,NATIONAL GEOGRAPHIC,NATIONAL GEOGRAPHIC,BIG LOGO MTM (FULLY NAPPED) N194USW030 拉绒卫衣 WHITE,http://static.lottedfs.cn/prod/prd-img/47/65/73/00/00/02/20000736547_1.jpg
,1002470,20000605140,$100,NATIONAL GEOGRAPHIC,NATIONAL GEOGRAPHIC,LIGHT DUCK U NECK DOWN JP N194UDW020 羽绒服 OBSIDIAN CHARCOAL,http://static.lottedfs.cn/prod/prd-img/33/65/73/00/00/02/20000736533_1.jpg
畅销,1002470,20000605132,$100,NATIONAL GEOGRAPHIC,NATIONAL GEOGRAPHIC,LIGHT DUCK U NECK DOWN JP N194UDW020 羽绒服 CARBON BLACK,http://static.lottedfs.cn/prod/prd-img/19/65/73/00/00/02/20000736519_1.jpg
,1002470,20000602920,$123,NATIONAL GEOGRAPHIC,NATIONAL GEOGRAPHIC,ERIS COACH NAPPING LINING JKT N193MJP220 外套 CARBON BLACK,http://static.lottedfs.cn/prod/prd-img/63/22/73/00/00/02/20000732263_1.jpg
畅销,1002470,20000602871,$53,NATIONAL GEOGRAPHIC,NATIONAL GEOGRAPHIC,TAGUS CROSS BAG N195ACR100 斜挎包 BLACK,http://static.lottedfs.cn/prod/prd-img/62/21/73/00/00/02/20000732162_1.jpg
,1002470,20000601904,$37,NATIONAL GEOGRAPHIC,NATIONAL GEOGRAPHIC,WONNIE FLEECE SNAPBACK  N195UHA200 帽子 WHITE,http://static.lottedfs.cn/prod/prd-img/90/99/72/00/00/02/20000729990_1.jpg
,1002470,20000601676,$92,NATIONAL GEOGRAPHIC,NATIONAL GEOGRAPHIC,(UNISEX)RUCOS BIG LOGO HOODY (FULL NAPPING ) N194UHD020 加绒连帽卫衣 DEEP SEA NAVY,http://static.lottedfs.cn/prod/prd-img/85/94/72/00/00/02/20000729485_1.jpg
,1002470,20000601649,$92,NATIONAL GEOGRAPHIC,NATIONAL GEOGRAPHIC,（UNISEX）RUCOS BIG LOGO HOODY (FULL NAPPING ) N194UHD020 加绒连帽卫衣 WHITE,http://static.lottedfs.cn/prod/prd-img/43/94/72/00/00/02/20000729443_1.jpg
,1002470,20000601645,$69,NATIONAL GEOGRAPHIC,NATIONAL GEOGRAPHIC,MURRAY SMALL LOGO LIGHTLY NAPPED MTM N193USW220 卫衣 CARBON BLACK,http://static.lottedfs.cn/prod/prd-img/29/94/72/00/00/02/20000729429_1.jpg
,1002470,20000601640,$69,NATIONAL GEOGRAPHIC,NATIONAL GEOGRAPHIC,MURRAY SMALL LOGO LIGHTLY NAPPED MTM N193USW220 卫衣 DEEP SEA NAVY,http://static.lottedfs.cn/prod/prd-img/17/94/72/00/00/02/20000729417_1.jpg
畅销,1002470,20000601632,$69,NATIONAL GEOGRAPHIC,NATIONAL GEOGRAPHIC,MURRAY SMALL LOGO LIGHTLY NAPPED MTM N193USW220 卫衣 HAVANA KHAKI,http://static.lottedfs.cn/prod/prd-img/06/94/72/00/00/02/20000729406_1.jpg
,1002470,20000601628,$69,NATIONAL GEOGRAPHIC,NATIONAL GEOGRAPHIC,MONTANA UNI KNIT F-ZIP N194UFT010 外套 OBSIDIAN CHARCOAL,http://static.lottedfs.cn/prod/prd-img/00/94/72/00/00/02/20000729400_1.jpg
,1002470,20000601537,$92,NATIONAL GEOGRAPHIC,NATIONAL GEOGRAPHIC,(UNISEX)BASIC BIG LOGO HOODY (FULLY NAPPED) N194UHD210 卫衣 M/GREY,http://static.lottedfs.cn/prod/prd-img/18/92/72/00/00/02/20000729218_1.jpg
,1002470,20000601517,$92,NATIONAL GEOGRAPHIC,NATIONAL GEOGRAPHIC,(UNISEX)BASIC BIG LOGO HOODY (FULLY NAPPED) N194UHD210 男女同款拉绒卫衣 WHITE,http://static.lottedfs.cn/prod/prd-img/59/91/72/00/00/02/20000729159_1.jpg
,1002470,20000601513,$61,NATIONAL GEOGRAPHIC,NATIONAL GEOGRAPHIC,（同款）SMALL LOGO MTM (FULLY NAPPED) N194USW050 拉绒卫衣 GRAY BLUE,http://static.lottedfs.cn/prod/prd-img/47/64/74/00/00/02/20000746447_1.jpg
,1002470,20000601507,$61,NATIONAL GEOGRAPHIC,NATIONAL GEOGRAPHIC,（同款）SMALL LOGO MTM (FULLY NAPPED) N194USW050 拉绒卫衣 CARBON BLACK,http://static.lottedfs.cn/prod/prd-img/25/91/72/00/00/02/20000729125_1.jpg
,1002470,20000601502,$61,NATIONAL GEOGRAPHIC,NATIONAL GEOGRAPHIC,POLY CARTER SMALL LOGO MTM (FULLY NAPPED) N194USW050 男士拉绒卫衣 DEEP SEA NAVY,http://static.lottedfs.cn/prod/prd-img/92/90/72/00/00/02/20000729092_1.jpg
,1002470,20000601464,$100,NATIONAL GEOGRAPHIC,NATIONAL GEOGRAPHIC,PINTAIL BASIC TRAINING HOODY F-ZIP N193UFT010 男士外套 DEEP SEA NAVY,http://static.lottedfs.cn/prod/prd-img/21/90/72/00/00/02/20000729021_1.jpg
,1002470,20000601453,$100,NATIONAL GEOGRAPHIC,NATIONAL GEOGRAPHIC,PINTAIL BASIC TRAINING HOODY F-ZIP N193UFT010 男士外套 OBSIDIAN CHARCOAL,http://static.lottedfs.cn/prod/prd-img/70/89/72/00/00/02/20000728970_1.jpg
,1002470,20000601409,$20,NATIONAL GEOGRAPHIC,NATIONAL GEOGRAPHIC,CARD WALLET N195ACR060 SAFARI TAN 卡包,http://static.lottedfs.cn/prod/prd-img/33/88/72/00/00/02/20000728833_1.jpg
,1002470,20000601122,$100,NATIONAL GEOGRAPHIC,NATIONAL GEOGRAPHIC,OTUS LIGHT FLEECE VEST N193MFV110 男士马甲 INCENSE BEIGE,http://static.lottedfs.cn/prod/prd-img/98/80/72/00/00/02/20000728098_1.jpg
,1002470,20000601117,$100,NATIONAL GEOGRAPHIC,NATIONAL GEOGRAPHIC,OTUS LIGHT FLEECE VEST N193MFV110 男士马甲 CARBON BLACK,http://static.lottedfs.cn/prod/prd-img/77/80/72/00/00/02/20000728077_1.jpg
,1002470,20000601018,$30,NATIONAL GEOGRAPHIC,NATIONAL GEOGRAPHIC,BASIC LOGO BALL CAP N181UHA010 帽子 RED,http://static.lottedfs.cn/prod/prd-img/01/78/72/00/00/02/20000727801_1.jpg
,1002470,20000600825,$30,NATIONAL GEOGRAPHIC,NATIONAL GEOGRAPHIC,BASIC LOGO BALL CAP N181UHA010 帽子 YELLOW,http://static.lottedfs.cn/prod/prd-img/64/73/72/00/00/02/20000727364_1.jpg
,1002470,20000600821,$30,NATIONAL GEOGRAPHIC,NATIONAL GEOGRAPHIC,BASIC LOGO BALL CAP N181UHA010 帽子 ORANGE,http://static.lottedfs.cn/prod/prd-img/53/73/72/00/00/02/20000727353_1.jpg
,1002470,20000600815,$30,NATIONAL GEOGRAPHIC,NATIONAL GEOGRAPHIC,BASIC LOGO BALL CAP N181UHA010 帽子 TAN,http://static.lottedfs.cn/prod/prd-img/35/73/72/00/00/02/20000727335_1.jpg
,1002470,20000600811,$30,NATIONAL GEOGRAPHIC,NATIONAL GEOGRAPHIC,BASIC LOGO BALL CAP N181UHA010 帽子 KHAKI,http://static.lottedfs.cn/prod/prd-img/31/73/72/00/00/02/20000727331_1.jpg
畅销,1002470,20000600807,$30,NATIONAL GEOGRAPHIC,NATIONAL GEOGRAPHIC,BASIC LOGO BALL CAP N181UHA010 帽子 D/GREY,http://static.lottedfs.cn/prod/prd-img/22/73/72/00/00/02/20000727322_1.jpg
,1002470,20000599519,$77,NATIONAL GEOGRAPHIC,NATIONAL GEOGRAPHIC,PINTAIL BASIC TRAINING PANTS N193UPT010 运动裤 CARBON BLACK,http://static.lottedfs.cn/prod/prd-img/19/48/72/00/00/02/20000724819_1.jpg
,1002470,20000599514,$77,NATIONAL GEOGRAPHIC,NATIONAL GEOGRAPHIC,PINTAIL BASIC TRAINING PANTS N193UPT010 运动裤 DEEP SEA NAVY,http://static.lottedfs.cn/prod/prd-img/02/48/72/00/00/02/20000724802_1.jpg
,1002470,20000599428,$61,NATIONAL GEOGRAPHIC,NATIONAL GEOGRAPHIC,FOLHAS SMALL LOGO MTM (MICRO BRUSHED) N193USW010 上衣 CARBON BLACK,http://static.lottedfs.cn/prod/prd-img/66/45/72/00/00/02/20000724566_1.jpg
,1002470,20000599400,$61,NATIONAL GEOGRAPHIC,NATIONAL GEOGRAPHIC,FOLHAS SMALL LOGO MTM (MICRO BRUSHED) N193USW010 上衣 HAVANA KHAKI,http://static.lottedfs.cn/prod/prd-img/60/44/72/00/00/02/20000724460_1.jpg
,1002470,20000599388,$61,NATIONAL GEOGRAPHIC,NATIONAL GEOGRAPHIC,FOLHAS SMALL LOGO MTM (MICRO BRUSHED) N193USW010 上衣 MUSTARD,http://static.lottedfs.cn/prod/prd-img/94/43/72/00/00/02/20000724394_1.jpg
,1002470,20000599339,$69,NATIONAL GEOGRAPHIC,NATIONAL GEOGRAPHIC,FOLHAS BIG LOGO MTM (LIGHTLY NAPPED) N193USW020 卫衣 WHITE,http://static.lottedfs.cn/prod/prd-img/46/95/72/00/00/02/20000729546_1.jpg
,1002470,20000599336,$69,NATIONAL GEOGRAPHIC,NATIONAL GEOGRAPHIC,FOLHAS BIG LOGO MTM (LIGHTLY NAPPED) N193USW020 男士卫衣 M/GREY,http://static.lottedfs.cn/prod/prd-img/14/41/72/00/00/02/20000724114_1.jpg
,1002470,20000599334,$69,NATIONAL GEOGRAPHIC,NATIONAL GEOGRAPHIC,FOLHAS BIG LOGO MTM (LIGHTLY NAPPED) N193USW020 卫衣 MUSTARD,http://static.lottedfs.cn/prod/prd-img/11/41/72/00/00/02/20000724111_1.jpg
,1002470,20000599332,$69,NATIONAL GEOGRAPHIC,NATIONAL GEOGRAPHIC,FOLHAS BIG LOGO MTM (LIGHTLY NAPPED) N193USW020 卫衣 DUSTY ROSE PINK,http://static.lottedfs.cn/prod/prd-img/07/41/72/00/00/02/20000724107_1.jpg
,1002470,20000599329,$69,NATIONAL GEOGRAPHIC,NATIONAL GEOGRAPHIC,FOLHAS BIG LOGO MTM (LIGHTLY NAPPED) N193USW020 男士卫衣 CARBON BLACK,http://static.lottedfs.cn/prod/prd-img/96/40/72/00/00/02/20000724096_1.jpg
,1002470,20000599169,$185,NATIONAL GEOGRAPHIC,NATIONAL GEOGRAPHIC,LAPUS FLEECE OUTDOOR JP N193UJP140 外套 HAVANA KHAKI,http://static.lottedfs.cn/prod/prd-img/44/36/72/00/00/02/20000723644_1.jpg
,1002470,20000599155,$185,NATIONAL GEOGRAPHIC,NATIONAL GEOGRAPHIC,LAPUS FLEECE OUTDOOR JP N193UJP140 外套 BROWN,http://static.lottedfs.cn/prod/prd-img/09/36/72/00/00/02/20000723609_1.jpg
,1002470,20000599123,$46,NATIONAL GEOGRAPHIC,NATIONAL GEOGRAPHIC,FALCO SMALL LOGO LONG SLEEVE ROUND TEE N193UTS010 长袖T恤 CARBON BLACK,http://static.lottedfs.cn/prod/prd-img/69/34/72/00/00/02/20000723469_1.jpg
,1002470,20000599115,$46,NATIONAL GEOGRAPHIC,NATIONAL GEOGRAPHIC,FALCO SMALL LOGO LONG SLEEVE ROUND TEE N193UTS010 长袖T恤 WHITE,http://static.lottedfs.cn/prod/prd-img/40/34/72/00/00/02/20000723440_1.jpg
,1002470,20000599112,$46,NATIONAL GEOGRAPHIC,NATIONAL GEOGRAPHIC,FALCO SMALL LOGO LONG SLEEVE ROUND TEE N193UTS010 长袖T恤 M/GREY,http://static.lottedfs.cn/prod/prd-img/12/34/72/00/00/02/20000723412_1.jpg
,1002470,20000599079,$77,NATIONAL GEOGRAPHIC,NATIONAL GEOGRAPHIC,BIG LOGO MESSENGER BAG N195ACR230 单肩包 OMAHA BEIGE,http://static.lottedfs.cn/prod/prd-img/05/33/72/00/00/02/20000723305_1.jpg
畅销,1002470,20000599068,$69,NATIONAL GEOGRAPHIC,NATIONAL GEOGRAPHIC,URBAN CITY SLING BAG N195ACR240 男士包 BLACK,http://static.lottedfs.cn/prod/prd-img/82/32/72/00/00/02/20000723282_1.jpg
,1002470,20000599059,$8,NATIONAL GEOGRAPHIC,NATIONAL GEOGRAPHIC,COOLMAX TWO LINE SOCKS N195ASO020 袜子 BLACK,http://static.lottedfs.cn/prod/prd-img/49/32/72/00/00/02/20000723249_1.jpg
,1002470,20000598992,$138,NATIONAL GEOGRAPHIC,NATIONAL GEOGRAPHIC,（UNISEX）GOOSE DOWN VEST N194UDV010 羽绒马甲 HAVANA KHAKI,http://static.lottedfs.cn/prod/prd-img/24/30/72/00/00/02/20000723024_1.jpg
,1002470,20000598887,$61,NATIONAL GEOGRAPHIC,NATIONAL GEOGRAPHIC,W CALLICE LIGHT GOOSE DOWN VEST N194WDV210 羽绒马甲 CARBON BLACK,http://static.lottedfs.cn/prod/prd-img/29/27/72/00/00/02/20000722729_1.jpg
,1002470,20000598883,$61,NATIONAL GEOGRAPHIC,NATIONAL GEOGRAPHIC,(WOMEN) CALLICE LIGHT GOOSE DOWN VEST N194WDV210 羽绒马甲 DEEP SEA NAVY,http://static.lottedfs.cn/prod/prd-img/24/27/72/00/00/02/20000722724_1.jpg
,1002470,20000598882,$61,NATIONAL GEOGRAPHIC,NATIONAL GEOGRAPHIC,（W） CALLICE LIGHT GOOSE DOWN VEST N194WDV210 羽绒马甲 OBSIDIAN CHARCOAL,http://static.lottedfs.cn/prod/prd-img/78/58/75/00/00/02/20000755878_1.jpg
,1002470,20000598879,$61,NATIONAL GEOGRAPHIC,NATIONAL GEOGRAPHIC,W CALLICE LIGHT GOOSE DOWN VEST N194WDV210 羽绒马甲 WHITE,http://static.lottedfs.cn/prod/prd-img/00/27/72/00/00/02/20000722700_1.jpg
,1002470,20000596744,$49,NATIONAL GEOGRAPHIC,NATIONAL GEOGRAPHIC,ENGINEERED MODULAR HAT N195UHA220 帽子 CHARCOAL,http://static.lottedfs.cn/prod/prd-img/76/85/71/00/00/02/20000718576_1.jpg
,1002470,20000596740,$46,NATIONAL GEOGRAPHIC,NATIONAL GEOGRAPHIC,ENGINEERED MODULAR BALL CAP N195UHA210 帽子 CHARCOAL,http://static.lottedfs.cn/prod/prd-img/72/85/71/00/00/02/20000718572_1.jpg
畅销,1002470,20000596717,$138,NATIONAL GEOGRAPHIC,NATIONAL GEOGRAPHIC,COSTONI FLEECE F-ZIP N194UFT030 外套 CARBON BLACK,http://static.lottedfs.cn/prod/prd-img/45/85/71/00/00/02/20000718545_1.jpg
畅销,1002470,20000596705,$138,NATIONAL GEOGRAPHIC,NATIONAL GEOGRAPHIC,COSTONI FLEECE F-ZIP N194UFT030 外套 INCENSE BEIGE,http://static.lottedfs.cn/prod/prd-img/29/93/72/00/00/02/20000729329_1.jpg
,1002470,20000596691,$138,NATIONAL GEOGRAPHIC,NATIONAL GEOGRAPHIC,COSTONI FLEECE F-ZIP N194UFT030 外套 HAVANA KHAKI,http://static.lottedfs.cn/prod/prd-img/10/85/71/00/00/02/20000718510_1.jpg
畅销,1002470,20000596681,$138,NATIONAL GEOGRAPHIC,NATIONAL GEOGRAPHIC,COSTONI FLEECE F-ZIP N194UFT030 外套 SUGAR SWIZZLE IVORY,http://static.lottedfs.cn/prod/prd-img/96/84/71/00/00/02/20000718496_1.jpg
,1002470,20000596672,$30,NATIONAL GEOGRAPHIC,NATIONAL GEOGRAPHIC,BASIC LOGO ECO BAG N195ATO020 单肩包 WHITE,http://static.lottedfs.cn/prod/prd-img/82/84/71/00/00/02/20000718482_1.jpg
,1002470,20000594759,$69,NATIONAL GEOGRAPHIC,NATIONAL GEOGRAPHIC,RICH SLING BAG N195ACR220 男士包 BLACK,http://static.lottedfs.cn/prod/prd-img/44/46/71/00/00/02/20000714644_1.jpg
,1002470,20000594755,$30,NATIONAL GEOGRAPHIC,NATIONAL GEOGRAPHIC,BASIC LOGO BALL CAP N181UHA010 帽子 PURPLE,http://static.lottedfs.cn/prod/prd-img/40/46/71/00/00/02/20000714640_1.jpg
,1002470,20000594752,$61,NATIONAL GEOGRAPHIC,NATIONAL GEOGRAPHIC,MASSIVE BAG N183ACR070 斜挎包 BAOBAB KHAKI,http://static.lottedfs.cn/prod/prd-img/37/46/71/00/00/02/20000714637_1.jpg
畅销,1002470,20000594743,$61,NATIONAL GEOGRAPHIC,NATIONAL GEOGRAPHIC,MCKINLEY SLING BAG N195ACR200 男士包 BLACK,http://static.lottedfs.cn/prod/prd-img/02/46/71/00/00/02/20000714602_1.jpg
,1002470,20000594740,$38,NATIONAL GEOGRAPHIC,NATIONAL GEOGRAPHIC,EXTENSION SHAKOSHU BAG N195ACR210 斜挎包 RED ORANGE,http://static.lottedfs.cn/prod/prd-img/01/46/71/00/00/02/20000714601_1.jpg
,1002470,20000594739,$38,NATIONAL GEOGRAPHIC,NATIONAL GEOGRAPHIC,EXTENSION SHAKOSHU BAG N195ACR210 斜挎包 TURQUOISE,http://static.lottedfs.cn/prod/prd-img/00/46/71/00/00/02/20000714600_1.jpg
畅销,1002470,20000594359,$77,NATIONAL GEOGRAPHIC,NATIONAL GEOGRAPHIC,BIG LOGO MESSENGER BAG N195ACR230 斜挎包 BLACK,http://static.lottedfs.cn/prod/prd-img/86/38/71/00/00/02/20000713886_1.jpg
,1002470,20000593270,$38,NATIONAL GEOGRAPHIC,NATIONAL GEOGRAPHIC,EXTENSION SHAKOSHU BAG N195ACR210 斜挎包 BLACK,http://static.lottedfs.cn/prod/prd-img/78/19/71/00/00/02/20000711978_1.jpg
,1002470,20000593264,$247,NATIONAL GEOGRAPHIC,NATIONAL GEOGRAPHIC,NG N6501FSF (FRAME) N195ASU070 旅行箱 GOLD,http://static.lottedfs.cn/prod/prd-img/64/19/71/00/00/02/20000711964_1.jpg
,1002470,20000593255,$146,NATIONAL GEOGRAPHIC,NATIONAL GEOGRAPHIC,URBAN CITY BACKPACK N195ABG260 双肩包 BLACK,http://static.lottedfs.cn/prod/prd-img/45/19/71/00/00/02/20000711945_1.jpg
畅销,1002470,20000593243,$201,NATIONAL GEOGRAPHIC,NATIONAL GEOGRAPHIC,KELUT MULTI BAG V2 N195ABG070 双肩包 BLACK,http://static.lottedfs.cn/prod/prd-img/84/18/71/00/00/02/20000711884_1.jpg
,1002470,20000592285,$46,NATIONAL GEOGRAPHIC,NATIONAL GEOGRAPHIC,ENGINEERED MODULAR BALL CAP N195UHA210 帽子 BLACK,http://static.lottedfs.cn/prod/prd-img/17/05/71/00/00/02/20000710517_1.jpg
,1002470,20000591443,$123,NATIONAL GEOGRAPHIC,NATIONAL GEOGRAPHIC,BIG LOGO STANDARD BACKPACK V2 N195ABG250 背包 D/NAVY,http://static.lottedfs.cn/prod/prd-img/29/91/70/00/00/02/20000709129_1.jpg
,1002470,20000591441,$123,NATIONAL GEOGRAPHIC,NATIONAL GEOGRAPHIC,BIG LOGO STANDARD BACKPACK V2 N195ABG250 背包 CHARCOAL,http://static.lottedfs.cn/prod/prd-img/27/91/70/00/00/02/20000709127_1.jpg
畅销,1002470,20000591429,$278,NATIONAL GEOGRAPHIC,NATIONAL GEOGRAPHIC,CAIMAN 3 GOOSE DOWN JP N194UDW290-3 羽绒服 CARBON BLACK,http://static.lottedfs.cn/prod/prd-img/08/91/70/00/00/02/20000709108_1.jpg
畅销,1002470,20000591384,$278,NATIONAL GEOGRAPHIC,NATIONAL GEOGRAPHIC,CAIMAN 3 GOOSE DOWN JP N194UDW290-3 羽绒服 BLACK,http://static.lottedfs.cn/prod/prd-img/58/90/70/00/00/02/20000709058_1.jpg
畅销,1002470,20000591367,$46,NATIONAL GEOGRAPHIC,NATIONAL GEOGRAPHIC,BIG LOGO MIGHTY HIP SACK N195AHI220 腰包 D/NAVY,http://static.lottedfs.cn/prod/prd-img/41/90/70/00/00/02/20000709041_1.jpg
,1002470,20000591355,$20,NATIONAL GEOGRAPHIC,NATIONAL GEOGRAPHIC,CARD WALLET N195ACR060 卡包 BLACK,http://static.lottedfs.cn/prod/prd-img/18/90/70/00/00/02/20000709018_1.jpg
畅销,1002470,20000591347,$30,NATIONAL GEOGRAPHIC,NATIONAL GEOGRAPHIC,BASIC LOGO ECO BAG N195ATO020 单肩包 BLACK,http://static.lottedfs.cn/prod/prd-img/99/89/70/00/00/02/20000708999_1.jpg
,1002470,20000591332,$30,NATIONAL GEOGRAPHIC,NATIONAL GEOGRAPHIC,BASIC LOGO BALL CAP N195UHA030 帽子 D/NAVY,http://static.lottedfs.cn/prod/prd-img/76/89/70/00/00/02/20000708976_1.jpg
,1002470,20000589216,$193,NATIONAL GEOGRAPHIC,NATIONAL GEOGRAPHIC,MCKINLEY MODULAR BAG N195ABG200 背包 BLACK,http://static.lottedfs.cn/prod/prd-img/06/53/70/00/00/02/20000705306_1.jpg
畅销,1002470,20000589212,$193,NATIONAL GEOGRAPHIC,NATIONAL GEOGRAPHIC,MCKINLEY MODULAR BAG N195ABG200 背包 SAFARI TAN,http://static.lottedfs.cn/prod/prd-img/96/52/70/00/00/02/20000705296_1.jpg
,1002470,20000589206,$35,NATIONAL GEOGRAPHIC,NATIONAL GEOGRAPHIC,SANDWICH LOGO BALL CAP N195UHA150 帽子 BLACK,http://static.lottedfs.cn/prod/prd-img/84/52/70/00/00/02/20000705284_1.jpg
,1002470,20000589201,$35,NATIONAL GEOGRAPHIC,NATIONAL GEOGRAPHIC,SANDWICH LOGO BALL CAP N195UHA150 帽子 CHARCOAL,http://static.lottedfs.cn/prod/prd-img/79/52/70/00/00/02/20000705279_1.jpg
