tag,brand_No,product_No,us_price,brand_name_chn,brand_name_eng,product_name,img_url
畅销,1002470,20000589187,$92,NATIONAL GEOGRAPHIC,NATIONAL GEOGRAPHIC,(UNISEX)TRIPPIN RHINO N995AFW090 男士运动鞋 IVORY,http://static.lottedfs.cn/prod/prd-img/54/80/76/00/00/02/20000768054_1.jpg
,1002470,20000601618,$69,NATIONAL GEOGRAPHIC,NATIONAL GEOGRAPHIC,MONTANA NUI KNIT F-ZIP N194UFT010 外套 CARBON BLACK,http://static.lottedfs.cn/prod/prd-img/88/93/72/00/00/02/20000729388_1.jpg
畅销,1002470,20000589197,$92,NATIONAL GEOGRAPHIC,NATIONAL GEOGRAPHIC,（UNISEX）TRIPPIN RHINO N995AFW090 男士运动鞋 BLACK,http://static.lottedfs.cn/prod/prd-img/66/52/70/00/00/02/20000705266_1.jpg
,1002470,20000636291,$53,NATIONAL GEOGRAPHIC,NATIONAL GEOGRAPHIC,KIDS BIG LOGO SWEATSHIRT (FULLY NAPPED) N194KSW030 L/GREEN 儿童卫衣,http://static.lottedfs.cn/prod/prd-img/78/55/78/00/00/02/20000785578_1.jpg
畅销,1002470,20000620783,$185,NATIONAL GEOGRAPHIC,NATIONAL GEOGRAPHIC,KIDS BISON RDS LONG DUCK DOWN JP N194KDW180 儿童羽绒服 CARBON BLACK,http://static.lottedfs.cn/prod/prd-img/04/30/76/00/00/02/20000763004_1.jpg
畅销,1002470,20000605450,$46,NATIONAL GEOGRAPHIC,NATIONAL GEOGRAPHIC,KIDS LIGHT GOOSE DOWN VEST N194KDV210 儿童羽绒马甲 CARBON BLACK,http://static.lottedfs.cn/prod/prd-img/32/71/73/00/00/02/20000737132_1.jpg
畅销,1002470,20000589194,$92,NATIONAL GEOGRAPHIC,NATIONAL GEOGRAPHIC,TRIPPIN RHINO N995AFW090 男士运动鞋 GREY,http://static.lottedfs.cn/prod/prd-img/54/52/70/00/00/02/20000705254_1.jpg
,1002470,20000601612,$69,NATIONAL GEOGRAPHIC,NATIONAL GEOGRAPHIC,MONTANA NUI KNIT F-ZIP N194UFT010 外套 M/GREY,http://static.lottedfs.cn/prod/prd-img/76/93/72/00/00/02/20000729376_1.jpg
畅销,1002470,20000601066,$69,NATIONAL GEOGRAPHIC,NATIONAL GEOGRAPHIC,DOUBLE SIDED PIQUE MTM N193USW230 男士卫衣 CARBON BLACK,http://static.lottedfs.cn/prod/prd-img/37/79/72/00/00/02/20000727937_1.jpg
畅销,1002470,20000586602,$201,NATIONAL GEOGRAPHIC,NATIONAL GEOGRAPHIC,BISON RDS DUCK DOWN JP N194UDW080-3 羽绒服 CARBON BLACK,http://static.lottedfs.cn/prod/prd-img/38/10/70/00/00/02/20000701038_1.jpg
畅销,1002470,20000573728,$38,NATIONAL GEOGRAPHIC,NATIONAL GEOGRAPHIC,NEODY SMALL LOGO H/TEE N195UTS010 男士短袖T恤 M/GREY,http://static.lottedfs.cn/prod/prd-img/83/07/68/00/00/02/20000680783_1.jpg
畅销,1002470,20000614958,$108,NATIONAL GEOGRAPHIC,NATIONAL GEOGRAPHIC,KIDS TWO POCKET BACKPACK N195KBG030 儿童双肩包 NAVY,http://static.lottedfs.cn/prod/prd-img/52/45/75/00/00/02/20000754552_1.jpg
,1002470,20000613967,$77,NATIONAL GEOGRAPHIC,NATIONAL GEOGRAPHIC,(KIDS) WATER DEER PACKAGE SET N194KPB010 儿童套装 CARBON BLACK,http://static.lottedfs.cn/prod/prd-img/53/26/75/00/00/02/20000752653_1.jpg
,1002470,20000598893,$278,NATIONAL GEOGRAPHIC,NATIONAL GEOGRAPHIC,CAIMAN 3 GOOSE DOWN JP N194UDW290-3 羽绒服 DEEP SEA NAVY,http://static.lottedfs.cn/prod/prd-img/84/73/72/00/00/02/20000727384_1.jpg
,1002470,20000630732,$131,NATIONAL GEOGRAPHIC,NATIONAL GEOGRAPHIC,（UNISEX）BISON RDS DUCK DOWN VEST N194UDV020 男女同款羽绒马甲 CARBON BLACK,http://static.lottedfs.cn/prod/prd-img/26/75/77/00/00/02/20000777526_1.jpg
畅销,1002470,20000624831,$154,NATIONAL GEOGRAPHIC,NATIONAL GEOGRAPHIC,(UNISEX) FLEECE LONG LENGTH F-ZIP N193UFT130 男女同款长款外套 SUGAR SWIZZLE IVORY,http://static.lottedfs.cn/prod/prd-img/12/92/76/00/00/02/20000769212_1.JPG
畅销,1002470,20000599194,$100,NATIONAL GEOGRAPHIC,NATIONAL GEOGRAPHIC,PINTAIL BASIC TRAINING HOODY F ZIP N193UFT010 外套 CARBON BLACK,http://static.lottedfs.cn/prod/prd-img/91/36/72/00/00/02/20000723691_1.jpg
畅销,1002470,20000599030,$61,NATIONAL GEOGRAPHIC,NATIONAL GEOGRAPHIC,CALLICE MENS LIGHT GOOSE DOWN VEST N194MDV210 羽绒马甲 WHITE,http://static.lottedfs.cn/prod/prd-img/73/64/74/00/00/02/20000746473_1.jpg
新品,1002470,20000638841,$77,NATIONAL GEOGRAPHIC,NATIONAL GEOGRAPHIC,(UNISEX) GRAPHIC SWEATSHIRT (FULLY NAPPED) N194USW220 男女同款卫衣 CARBON BLACK,http://static.lottedfs.cn/prod/prd-img/53/90/78/00/00/02/20000789053_2.jpg
,1002470,20000630011,$278,NATIONAL GEOGRAPHIC,NATIONAL GEOGRAPHIC,WOMEN TARUGA RDS DUCK DOWN JP N194WDW030 女士羽绒服 O/WHITE,http://static.lottedfs.cn/prod/prd-img/11/65/77/00/00/02/20000776511_1.jpg
畅销,1002470,20000629993,$278,NATIONAL GEOGRAPHIC,NATIONAL GEOGRAPHIC,TARUGA MENS RDS DUCK DOWN JP N194MDW030 羽绒服 PLAZA TAUPE BEIGE,http://static.lottedfs.cn/prod/prd-img/80/64/77/00/00/02/20000776480_1.jpg
,1002470,20000624154,$46,NATIONAL GEOGRAPHIC,NATIONAL GEOGRAPHIC,KIDS RUKOSEU CROSSBODY BAG N195KCR050 NAVY 儿童斜挎包,http://static.lottedfs.cn/prod/prd-img/17/81/76/00/00/02/20000768117_1.jpg
畅销,1002470,20000618959,$46,NATIONAL GEOGRAPHIC,NATIONAL GEOGRAPHIC,KIDS KAKAPO LOGO GRAPHIC MTM N194KSW060 CAPULET OLIVE 儿童上衣,http://static.lottedfs.cn/prod/prd-img/27/07/76/00/00/02/20000760727_1.JPG
畅销,1002470,20000616130,$108,NATIONAL GEOGRAPHIC,NATIONAL GEOGRAPHIC,KIDS CORDUROY CONTRAST FABRIC LIGHT PADDING SHIRT TYPE JP N194KPD030 儿童外套 DEEP SEA NAVY,http://static.lottedfs.cn/prod/prd-img/82/67/75/00/00/02/20000756782_1.jpg
,1002470,20000615337,$69,NATIONAL GEOGRAPHIC,NATIONAL GEOGRAPHIC,(UNISEX) MONTANA UNI KNIT F-ZIP N194UFT010 男女同款外套 DEEP SEA NAVY,http://static.lottedfs.cn/prod/prd-img/45/53/75/00/00/02/20000755345_1.JPG
畅销,1002470,20000615084,$108,NATIONAL GEOGRAPHIC,NATIONAL GEOGRAPHIC,(UNISEX)BASIC LOGO HOODY (FULLY NAPPED) N194UFT210 CARBON BLACK 男女同款外套,http://static.lottedfs.cn/prod/prd-img/74/47/75/00/00/02/20000754774_1.jpg
畅销,1002470,20000614942,$30,NATIONAL GEOGRAPHIC,NATIONAL GEOGRAPHIC,KIDS TWO POCKET CROSSBODY BAG N195KCR020 儿童斜挎包 NAVY,http://static.lottedfs.cn/prod/prd-img/26/45/75/00/00/02/20000754526_1.jpg
畅销,1002470,20000611748,$61,NATIONAL GEOGRAPHIC,NATIONAL GEOGRAPHIC,KIDS LIGHT GOOSE DOWN JKT N194KDW210 儿童羽绒服 DEEP SEA NAVY,http://static.lottedfs.cn/prod/prd-img/91/83/74/00/00/02/20000748391_1.jpg
,1002470,20000610751,$38,NATIONAL GEOGRAPHIC,NATIONAL GEOGRAPHIC,KIDS BIG LOGO LONG SLEEVE ROUND T SHIRT N193KTS020 儿童卫衣 MUSTARD,http://static.lottedfs.cn/prod/prd-img/72/65/74/00/00/02/20000746572_1.jpg
,1002470,20000605418,$46,NATIONAL GEOGRAPHIC,NATIONAL GEOGRAPHIC,KIDS BIG LOGO MTM N193KSW020 儿童卫衣 DEEP SEA NAVY,http://static.lottedfs.cn/prod/prd-img/21/70/73/00/00/02/20000737021_1.jpg
畅销,1002470,20000605387,$46,NATIONAL GEOGRAPHIC,NATIONAL GEOGRAPHIC,KIDS BIG LOGO MTM N193KSW020 儿童卫衣 MUSTARD,http://static.lottedfs.cn/prod/prd-img/30/69/73/00/00/02/20000736930_1.jpg
畅销,1002470,20000605384,$61,NATIONAL GEOGRAPHIC,NATIONAL GEOGRAPHIC,KIDS POCKET TRAINING PANTS N193KPT080 儿童裤子 BLUE,http://static.lottedfs.cn/prod/prd-img/20/69/73/00/00/02/20000736920_1.jpg
,1002470,20000605383,$84,NATIONAL GEOGRAPHIC,NATIONAL GEOGRAPHIC,KIDS NAPPED LINING JKT N193KJP220 儿童外套 CARBON BLACK,http://static.lottedfs.cn/prod/prd-img/17/69/73/00/00/02/20000736917_1.jpg
畅销,1002470,20000601689,$92,NATIONAL GEOGRAPHIC,NATIONAL GEOGRAPHIC,（UNISEX）RUCOS BIG LOGO HOODY (FULL NAPPING ) N194UHD020 加绒连帽卫衣 OBSIDIAN CHARCOAL,http://static.lottedfs.cn/prod/prd-img/18/95/72/00/00/02/20000729518_1.jpg
,1002470,20000598891,$278,NATIONAL GEOGRAPHIC,NATIONAL GEOGRAPHIC,(UNISEX) CAIMAN 3 GOOSE DOWN JP N194UDW290-3 男女同款羽绒服 OBSIDIAN CHARCOAL,http://static.lottedfs.cn/prod/prd-img/67/10/75/00/00/02/20000751067_1.jpg
畅销,1002470,20000638904,$84,NATIONAL GEOGRAPHIC,NATIONAL GEOGRAPHIC,(UNISEX) BIG LOGO BACKPACK N205ABG020 男女同款双肩包 BLACK,http://static.lottedfs.cn/prod/prd-img/07/92/78/00/00/02/20000789207_2.jpg
畅销,1002470,20000638898,$131,NATIONAL GEOGRAPHIC,NATIONAL GEOGRAPHIC,(UNISEX) BIG LOGO BACKPACK N205ABG020 男女同款双肩包 BLACK,http://static.lottedfs.cn/prod/prd-img/97/91/78/00/00/02/20000789197_2.jpg
,1002470,20000628277,$123,NATIONAL GEOGRAPHIC,NATIONAL GEOGRAPHIC,(MEN) STRING BAGGY WINTER PANTS N194MPT030 男士裤子 CARBON BLACK,http://static.lottedfs.cn/prod/prd-img/02/42/77/00/00/02/20000774202_1.jpg
,1002470,20000618530,$61,NATIONAL GEOGRAPHIC,NATIONAL GEOGRAPHIC,(UNISEX) PADDED SHOES N194AFW050 男女同款鞋 BLACK,http://static.lottedfs.cn/prod/prd-img/56/98/75/00/00/02/20000759856_1.jpg
,1002470,20000613894,$200,NATIONAL GEOGRAPHIC,NATIONAL GEOGRAPHIC,(MENS) WINDBREAKER HOODED JACKET N193MJP210 男士带帽防风衣 CARBON BLACK,http://static.lottedfs.cn/prod/prd-img/61/24/75/00/00/02/20000752461_1.jpg
,1002470,20000607888,$61,NATIONAL GEOGRAPHIC,NATIONAL GEOGRAPHIC,（UNISEX）POLARTEC MICRO FLEECE SMALL LOGO MTM N194USW070 男士卫衣 CARBON BLACK,http://static.lottedfs.cn/prod/prd-img/90/16/74/00/00/02/20000741690_1.jpg
畅销,1002470,20000607374,$69,NATIONAL GEOGRAPHIC,NATIONAL GEOGRAPHIC,POLLYCARTER BIG LOGO MTM (FULLY NAPPED) N194USW060 男士卫衣 CARBON BLACK,http://static.lottedfs.cn/prod/prd-img/99/08/74/00/00/02/20000740899_1.jpg
畅销,1002470,20000601420,$69,NATIONAL GEOGRAPHIC,NATIONAL GEOGRAPHIC,REVERSIBLE PK MTM N193USW230 男士卫衣 DEEP SEA NAVY,http://static.lottedfs.cn/prod/prd-img/76/88/72/00/00/02/20000728876_1.jpg
,1002470,20000599517,$77,NATIONAL GEOGRAPHIC,NATIONAL GEOGRAPHIC,PINTAIL BASIC TRAINING PANTS N193UPT010 运动裤  M/GREY,http://static.lottedfs.cn/prod/prd-img/09/48/72/00/00/02/20000724809_1.jpg
,1002470,20000599205,$100,NATIONAL GEOGRAPHIC,NATIONAL GEOGRAPHIC,PINTAIL BASIC TRAINING HOODY F ZIP N193UFT010 外套 M/GREY,http://static.lottedfs.cn/prod/prd-img/35/37/72/00/00/02/20000723735_1.jpg
畅销,1002470,20000598895,$247,NATIONAL GEOGRAPHIC,NATIONAL GEOGRAPHIC,（UNISEX）BELUGA DUCK DOWN JP N194UDW040-3 男女同款羽绒服 CARBON BLACK,http://static.lottedfs.cn/prod/prd-img/26/74/72/00/00/02/20000727426_1.jpg
新品,1002470,20000639454,$84,NATIONAL GEOGRAPHIC,NATIONAL GEOGRAPHIC,KIDS KEA PACKAGE SET N194KPB020 儿童运动服套装 D/GREY,http://static.lottedfs.cn/prod/prd-img/70/00/79/00/00/02/20000790070_1.jpg
新品,1002470,20000638899,$84,NATIONAL GEOGRAPHIC,NATIONAL GEOGRAPHIC,(UNISEX) BIG LOGO BACKPACK N205ABG020 男女同款双肩包 D/NAVY,http://static.lottedfs.cn/prod/prd-img/99/91/78/00/00/02/20000789199_2.jpg
新品,1002470,20000638862,$17,NATIONAL GEOGRAPHIC,NATIONAL GEOGRAPHIC,(MENS) FROM NATURE ALL IN ONE ESSENCE FOR MEN 男士精华液 N195MSA010,http://static.lottedfs.cn/prod/prd-img/91/90/78/00/00/02/20000789091_1.jpg
新品,1002470,20000638842,$77,NATIONAL GEOGRAPHIC,NATIONAL GEOGRAPHIC,(UNISEX) GRAPHIC SWEATSHIRT (FULLY NAPPED) N194USW220 男女同款卫衣 BLACK 2,http://static.lottedfs.cn/prod/prd-img/58/90/78/00/00/02/20000789058_2.jpg
,1002470,20000631429,$123,NATIONAL GEOGRAPHIC,NATIONAL GEOGRAPHIC,KIDS FLEECE LONG LENGTH FLEECE F-ZIP N193KFT130 儿童外套 BEIGE,http://static.lottedfs.cn/prod/prd-img/66/85/77/00/00/02/20000778566_1.JPG
,1002470,20000627956,$123,NATIONAL GEOGRAPHIC,NATIONAL GEOGRAPHIC,KIDS ROYAL ANTELOPE DUCK DOWN JP N194KDW240 儿童羽绒服 CARBON BLACK,http://static.lottedfs.cn/prod/prd-img/72/36/77/00/00/02/20000773672_1.jpg
,1002470,20000627954,$123,NATIONAL GEOGRAPHIC,NATIONAL GEOGRAPHIC,KIDS ROYAL ANTELOPE DUCK DOWN JP N194KDW240 儿童羽绒服 HAVANA KHAKI,http://static.lottedfs.cn/prod/prd-img/69/36/77/00/00/02/20000773669_1.jpg
,1002470,20000627625,$231,NATIONAL GEOGRAPHIC,NATIONAL GEOGRAPHIC,(MENS) POCKET AVIATOR PADDING JACKET N194MJP010 男士外套 PLAZA TAUPE BEIGE,http://static.lottedfs.cn/prod/prd-img/71/30/77/00/00/02/20000773071_1.jpg
,1002470,20000625324,$84,NATIONAL GEOGRAPHIC,NATIONAL GEOGRAPHIC,(MEN) OVER FIT PIGMENT DYEING MTM N194MSW050 卫衣 MUSTARD,http://static.lottedfs.cn/prod/prd-img/38/01/77/00/00/02/20000770138_1.jpg
畅销,1002470,20000620952,$69,NATIONAL GEOGRAPHIC,NATIONAL GEOGRAPHIC,KIDS BASIC POCKET PANTS N193KPT020 儿童裤子 BEIGE,http://static.lottedfs.cn/prod/prd-img/82/32/76/00/00/02/20000763282_1.jpg
畅销,1002470,20000620748,$108,NATIONAL GEOGRAPHIC,NATIONAL GEOGRAPHIC,(MENS) WOVEN TRAINING SWEATSHIRT N193MFT090 男士卫衣 CARBON BLACK,http://static.lottedfs.cn/prod/prd-img/00/29/76/00/00/02/20000762900_1.jpg
,1002470,20000620742,$185,NATIONAL GEOGRAPHIC,NATIONAL GEOGRAPHIC,(MENS) PADDED SHIRKET N193MPD210 男士外套 CARBON BLACK,http://static.lottedfs.cn/prod/prd-img/88/28/76/00/00/02/20000762888_1.jpg
,1002470,20000618769,$77,NATIONAL GEOGRAPHIC,NATIONAL GEOGRAPHIC,KIDS PACKAGE SET N194KPB010 D/GREEN 儿童运动服套装,http://static.lottedfs.cn/prod/prd-img/05/03/76/00/00/02/20000760305_1.jpg
,1002470,20000618764,$107,NATIONAL GEOGRAPHIC,NATIONAL GEOGRAPHIC,(MEN) POCKET PANTS N193MPT020 OBSIDIAN CHARCOAL 男士裤子,http://static.lottedfs.cn/prod/prd-img/96/02/76/00/00/02/20000760296_1.jpg
,1002470,20000618658,$46,NATIONAL GEOGRAPHIC,NATIONAL GEOGRAPHIC,KIDS LOGO GRAPHIC SWEATSHIRT N194KSW060 DEEP SEA NAVY 儿童上衣,http://static.lottedfs.cn/prod/prd-img/78/00/76/00/00/02/20000760078_1.jpg
,1002470,20000618656,$46,NATIONAL GEOGRAPHIC,NATIONAL GEOGRAPHIC,KIDS LOGO GRAPHIC SWEATSHIRT N194KSW060 D/BEIGE 儿童上衣,http://static.lottedfs.cn/prod/prd-img/73/00/76/00/00/02/20000760073_1.jpg
,1002470,20000618649,$53,NATIONAL GEOGRAPHIC,NATIONAL GEOGRAPHIC,KIDS SMALL LOGO SWEATSHIRT (FULLY NAPPED) N194KSW050 CARBON BLACK 儿童上衣,http://static.lottedfs.cn/prod/prd-img/57/00/76/00/00/02/20000760057_1.jpg
,1002470,20000616128,$108,NATIONAL GEOGRAPHIC,NATIONAL GEOGRAPHIC,KIDS CORDUROY CONTRAST FABRIC LIGHT PADDING SHIRT TYPE JP N194KPD030 儿童外套 PLAZA TAUPE BEIGE,http://static.lottedfs.cn/prod/prd-img/75/67/75/00/00/02/20000756775_1.jpg
,1002470,20000615666,$69,NATIONAL GEOGRAPHIC,NATIONAL GEOGRAPHIC,KIDS BIG LOGO HOODY (FULLY NAPPED) N194KHD020 儿童连帽卫衣 MUSTARD,http://static.lottedfs.cn/prod/prd-img/74/59/75/00/00/02/20000755974_1.jpg
,1002470,20000615637,$61,NATIONAL GEOGRAPHIC,NATIONAL GEOGRAPHIC,KIDS BASIC TRAINING HOODY F-ZIP N193KFT010 儿童拉链连帽外套 M/GREY,http://static.lottedfs.cn/prod/prd-img/29/59/75/00/00/02/20000755929_1.jpg
,1002470,20000615539,$84,NATIONAL GEOGRAPHIC,NATIONAL GEOGRAPHIC,(UNISEX) SMALL LOGO HOODY (FULLY NAPPED) N194UHD010 男女同款连帽卫衣 CARBON BLACK,http://static.lottedfs.cn/prod/prd-img/56/57/75/00/00/02/20000755756_1.jpg
,1002470,20000615385,$92,NATIONAL GEOGRAPHIC,NATIONAL GEOGRAPHIC,KIDS COSTONI FLEECE F-ZIP N194KFT030 儿童毛绒外套 CARBON BLACK,http://static.lottedfs.cn/prod/prd-img/37/54/75/00/00/02/20000755437_1.JPG
,1002470,20000615378,$92,NATIONAL GEOGRAPHIC,NATIONAL GEOGRAPHIC,KIDS COSTONI FLEECE F-ZIP N194KFT030 儿童毛绒外套 MUSTARD,http://static.lottedfs.cn/prod/prd-img/25/54/75/00/00/02/20000755425_1.JPG
畅销,1002470,20000615016,$100,NATIONAL GEOGRAPHIC,NATIONAL GEOGRAPHIC,KIDS MIGHTY BACKPACK N195KBG020 儿童双肩包 NAVY,http://static.lottedfs.cn/prod/prd-img/19/46/75/00/00/02/20000754619_1.jpg
畅销,1002470,20000614999,$30,NATIONAL GEOGRAPHIC,NATIONAL GEOGRAPHIC,KIDS MIGHTY CROSSBODY BAG N195KCR010 儿童斜挎包 BLACK,http://static.lottedfs.cn/prod/prd-img/02/46/75/00/00/02/20000754602_1.jpg
,1002470,20000614993,$30,NATIONAL GEOGRAPHIC,NATIONAL GEOGRAPHIC,KIDS MIGHTY CROSSBODY BAG N195KCR010 儿童斜挎包 NAVY,http://static.lottedfs.cn/prod/prd-img/95/45/75/00/00/02/20000754595_1.jpg
,1002470,20000613492,$38,NATIONAL GEOGRAPHIC,NATIONAL GEOGRAPHIC,KIDS PINEOSEU BIG LOGO LONG SLEEVE ROUND T SHIRT N193KTS020 儿童T恤 PURPLE,http://static.lottedfs.cn/prod/prd-img/03/17/75/00/00/02/20000751703_1.jpg
,1002470,20000612443,$46,NATIONAL GEOGRAPHIC,NATIONAL GEOGRAPHIC,(KIDS) CALLICE LIGHT GOOSE DOWN VEST N194KDV210 儿童羽绒马甲 DEEP SEA NAVY,http://static.lottedfs.cn/prod/prd-img/92/95/74/00/00/02/20000749592_1.jpg
,1002470,20000612352,$115,NATIONAL GEOGRAPHIC,NATIONAL GEOGRAPHIC,(KIDS) LINEAR TWO IN ONE BACKPACK N195KBG040 儿童双肩包 L/PINK,http://static.lottedfs.cn/prod/prd-img/10/94/74/00/00/02/20000749410_1.jpg
,1002470,20000611764,$38,NATIONAL GEOGRAPHIC,NATIONAL GEOGRAPHIC,KIDS SPEAR HIP SACK N195KHI010 儿童斜挎包 L/PINK,http://static.lottedfs.cn/prod/prd-img/12/84/74/00/00/02/20000748412_1.jpg
,1002470,20000611758,$28,NATIONAL GEOGRAPHIC,NATIONAL GEOGRAPHIC,KIDS TWO TONE EMBROIDERY BALL CAP N195KHA080 儿童帽子 MINT,http://static.lottedfs.cn/prod/prd-img/05/84/74/00/00/02/20000748405_1.jpg
畅销,1002470,20000611752,$61,NATIONAL GEOGRAPHIC,NATIONAL GEOGRAPHIC,KIDS LIGHT GOOSE DOWN JKT N194KDW210 儿童羽绒服 CARBON BLACK,http://static.lottedfs.cn/prod/prd-img/99/83/74/00/00/02/20000748399_1.jpg
,1002470,20000610756,$61,NATIONAL GEOGRAPHIC,NATIONAL GEOGRAPHIC,KIDS EARNER FLEECE MTM N194KSW040 儿童卫衣 WHITE,http://static.lottedfs.cn/prod/prd-img/87/65/74/00/00/02/20000746587_1.jpg
,1002470,20000610755,$61,NATIONAL GEOGRAPHIC,NATIONAL GEOGRAPHIC,KIDS EARNER FLEECE MTM N194KSW040 儿童卫衣 L/KHAKI,http://static.lottedfs.cn/prod/prd-img/83/65/74/00/00/02/20000746583_1.jpg
,1002470,20000610394,$38,NATIONAL GEOGRAPHIC,NATIONAL GEOGRAPHIC,KIDS TRAPPER HAT N194KHA020 儿童帽子 NAVY,http://static.lottedfs.cn/prod/prd-img/47/58/74/00/00/02/20000745847_1.jpg
,1002470,20000610372,$37,NATIONAL GEOGRAPHIC,NATIONAL GEOGRAPHIC,POINT LABEL BEANIE N194UHA260 帽子 NAVY,http://static.lottedfs.cn/prod/prd-img/59/57/74/00/00/02/20000745759_1.jpg
畅销,1002470,20000610357,$46,NATIONAL GEOGRAPHIC,NATIONAL GEOGRAPHIC,FLEECE BUKEUL CROSS BAG N194ACR010 斜挎包 BLACK,http://static.lottedfs.cn/prod/prd-img/06/57/74/00/00/02/20000745706_1.jpg
畅销,1002470,20000608093,$123,NATIONAL GEOGRAPHIC,NATIONAL GEOGRAPHIC,KIDS LIGHT GOOSE DOWN JP N194KDW010 羽绒服 SKY GREY,http://static.lottedfs.cn/prod/prd-img/51/20/74/00/00/02/20000742051_1.jpg
,1002470,20000608063,$46,NATIONAL GEOGRAPHIC,NATIONAL GEOGRAPHIC,KIDS BASIC TRAINING PANTS N193KPT010 儿童运动裤 M/GREY,http://static.lottedfs.cn/prod/prd-img/91/19/74/00/00/02/20000741991_1.jpg
,1002470,20000607866,$61,NATIONAL GEOGRAPHIC,NATIONAL GEOGRAPHIC,（UNISEX）POLARTEC MICRO FLEECE SMALL LOGO MTM N194USW070 男女同款卫衣 OBSIDIAN CHARCOAL,http://static.lottedfs.cn/prod/prd-img/64/16/74/00/00/02/20000741664_1.jpg
畅销,1002470,20000607819,$100,NATIONAL GEOGRAPHIC,NATIONAL GEOGRAPHIC,MENS KNIT AND DOWN MIX F-ZIP N194MFT020 男士外套 CARBON BLACK,http://static.lottedfs.cn/prod/prd-img/67/15/74/00/00/02/20000741567_1.jpg
,1002470,20000607752,$77,NATIONAL GEOGRAPHIC,NATIONAL GEOGRAPHIC,LIGHT GOOSE DOWN JKT N194MDW210 羽绒服 OBSIDIAN CHARCOAL,http://static.lottedfs.cn/prod/prd-img/44/14/74/00/00/02/20000741444_1.jpg
畅销,1002470,20000607691,$154,NATIONAL GEOGRAPHIC,NATIONAL GEOGRAPHIC,LIGHT GOOSE DOWN JKT N194MDW220 羽绒服 CARBON BLACK,http://static.lottedfs.cn/prod/prd-img/39/13/74/00/00/02/20000741339_1.jpg
,1002470,20000605781,$92,NATIONAL GEOGRAPHIC,NATIONAL GEOGRAPHIC,KIDS FLEECE BUBBLING VEST N194KFV010 儿童马甲 IVORY,http://static.lottedfs.cn/prod/prd-img/85/79/73/00/00/02/20000737985_1.jpg
,1002470,20000605444,$46,NATIONAL GEOGRAPHIC,NATIONAL GEOGRAPHIC,KIDS LIGHT GOOSE DOWN VEST N194KDV210 儿童羽绒马甲 WHITE,http://static.lottedfs.cn/prod/prd-img/09/71/73/00/00/02/20000737109_1.jpg
,1002470,20000605411,$46,NATIONAL GEOGRAPHIC,NATIONAL GEOGRAPHIC,KIDS FOLHAS BIG LOGO MTM N193KSW020 儿童卫衣 QUIET HARBOR BLUE,http://static.lottedfs.cn/prod/prd-img/08/70/73/00/00/02/20000737008_1.jpg
畅销,1002470,20000605402,$46,NATIONAL GEOGRAPHIC,NATIONAL GEOGRAPHIC,KIDS FOLHAS BIG LOGO MTM N193KSW020 儿童卫衣 HAVANA KHAKI,http://static.lottedfs.cn/prod/prd-img/73/69/73/00/00/02/20000736973_1.jpg
,1002470,20000605356,$77,NATIONAL GEOGRAPHIC,NATIONAL GEOGRAPHIC,KIDS SCHULIEN TRAINING HOODY F-ZIP N193KFT080 儿童外套 M/GREY,http://static.lottedfs.cn/prod/prd-img/73/68/73/00/00/02/20000736873_1.jpg
,1002470,20000605337,$77,NATIONAL GEOGRAPHIC,NATIONAL GEOGRAPHIC,KIDS SCHULIEN TRAINING HOODY F-ZIP N193KFT080 儿童外套 BLUE,http://static.lottedfs.cn/prod/prd-img/49/68/73/00/00/02/20000736849_1.jpg
,1002470,20000601549,$92,NATIONAL GEOGRAPHIC,NATIONAL GEOGRAPHIC,(UNISEX) BASIC BIG LOGO HOODY (FULLY NAPPED) N194UHD210 拉绒卫衣 CARBON BLACK,http://static.lottedfs.cn/prod/prd-img/53/92/72/00/00/02/20000729253_1.jpg
,1002470,20000601495,$61,NATIONAL GEOGRAPHIC,NATIONAL GEOGRAPHIC,（同款）POLY CARTER SMALL LOGO MTM (FULLY NAPPED) N194USW050 男士拉绒卫衣 WHITE,http://static.lottedfs.cn/prod/prd-img/80/90/72/00/00/02/20000729080_1.jpg
畅销,1002470,20000599041,$61,NATIONAL GEOGRAPHIC,NATIONAL GEOGRAPHIC,CALLICE MENS LIGHT GOOSE DOWN VEST N194MDV210 羽绒马甲 DEEP SEA NAVY,http://static.lottedfs.cn/prod/prd-img/72/31/72/00/00/02/20000723172_1.jpg
,1002470,20000596376,$201,NATIONAL GEOGRAPHIC,NATIONAL GEOGRAPHIC,BISON RDS DUCK DOWN JP N194UDW080-3 羽绒服 HAVANA KHAKI,http://static.lottedfs.cn/prod/prd-img/11/78/71/00/00/02/20000717811_1.jpg
畅销,1002470,20000594747,$61,NATIONAL GEOGRAPHIC,NATIONAL GEOGRAPHIC,MCKINLEY SLING BAG N195ACR200 男士包 SAFARI TAN,http://static.lottedfs.cn/prod/prd-img/32/46/71/00/00/02/20000714632_1.jpg
畅销,1002470,20000591436,$201,NATIONAL GEOGRAPHIC,NATIONAL GEOGRAPHIC,BISON RDS DUCK DOWN JP N194UDW080-3 羽绒服 VIBRANT YELLOW,http://static.lottedfs.cn/prod/prd-img/22/91/70/00/00/02/20000709122_1.jpg
畅销,1002470,20000577155,$38,NATIONAL GEOGRAPHIC,NATIONAL GEOGRAPHIC,NEODI BIG LOGO H/TEE N195UTS020 短袖T恤 DEEP SEA NAVY,http://static.lottedfs.cn/prod/prd-img/77/60/68/00/00/02/20000686077_1.jpg
新品,1002470,20000639438,$309,NATIONAL GEOGRAPHIC,NATIONAL GEOGRAPHIC,(WOMEN) SABLE WAISTSTRING HIGH NECK DUCK DOWN JP N194WDW050 女士羽绒服 CARBON BLACK,http://static.lottedfs.cn/prod/prd-img/86/99/78/00/00/02/20000789986_1.jpg
新品,1002470,20000638902,$84,NATIONAL GEOGRAPHIC,NATIONAL GEOGRAPHIC,(UNISEX) BIG LOGO BACKPACK N205ABG020 男女同款双肩包 L/GREY,http://static.lottedfs.cn/prod/prd-img/05/92/78/00/00/02/20000789205_2.jpg
新品,1002470,20000638892,$293,NATIONAL GEOGRAPHIC,NATIONAL GEOGRAPHIC,(MENS) DUCK DOWN JACKET N194MDW320 男士羽绒外套 OBSIDIAN CHARCOAL,http://static.lottedfs.cn/prod/prd-img/62/91/78/00/00/02/20000789162_2.jpg
新品,1002470,20000638870,$14,NATIONAL GEOGRAPHIC,NATIONAL GEOGRAPHIC,(MENS) FROM NATURE DAILY SUN CREAM FOR MEN 男士防晒霜 N195MSS010,http://static.lottedfs.cn/prod/prd-img/03/91/78/00/00/02/20000789103_2.jpg
新品,1002470,20000638852,$14,NATIONAL GEOGRAPHIC,NATIONAL GEOGRAPHIC,(MENS) FROM NATURE FOAMING SCRUB FOR MEN 男士洗面奶 N195MCW010,http://static.lottedfs.cn/prod/prd-img/74/90/78/00/00/02/20000789074_2.jpg
畅销,1002470,20000633812,$123,NATIONAL GEOGRAPHIC,NATIONAL GEOGRAPHIC,(MENS) OUT POCKET WINTER PANTS N194MPT010 男士裤子 CARBON BLACK,http://static.lottedfs.cn/prod/prd-img/43/18/78/00/00/02/20000781843_1.jpg
,1002470,20000633720,$123,NATIONAL GEOGRAPHIC,NATIONAL GEOGRAPHIC,(UNISEX) (SPOT) FLEECE F-ZIP N194UFT050 男女同款外套 CARBON BLACK,http://static.lottedfs.cn/prod/prd-img/03/17/78/00/00/02/20000781703_1.JPG
,1002470,20000630716,$131,NATIONAL GEOGRAPHIC,NATIONAL GEOGRAPHIC,（UNISEX）BISON RDS DUCK DOWN VEST N194UDV020 男女同款羽绒马甲 STEEL GREY,http://static.lottedfs.cn/prod/prd-img/84/74/77/00/00/02/20000777484_1.jpg
畅销,1002470,20000630709,$262,NATIONAL GEOGRAPHIC,NATIONAL GEOGRAPHIC,（UNISEX）BISON RDS DUCK LONG DOWN JP N194UDW180 男女同款羽绒服 ARBON BLACK,http://static.lottedfs.cn/prod/prd-img/62/74/77/00/00/02/20000777462_1.jpg
,1002470,20000630014,$278,NATIONAL GEOGRAPHIC,NATIONAL GEOGRAPHIC,W TARUGA RDS DUCK DOWN JP N194WDW030 羽绒服 CARBON BLACK,http://static.lottedfs.cn/prod/prd-img/19/65/77/00/00/02/20000776519_1.jpg
,1002470,20000628411,$154,NATIONAL GEOGRAPHIC,NATIONAL GEOGRAPHIC,(MEN) HIDDEN POCKET DESIGN PANTS N194MPT270 男士裤子 CARBON BLACK,http://static.lottedfs.cn/prod/prd-img/25/44/77/00/00/02/20000774425_1.jpg
,1002470,20000628405,$108,NATIONAL GEOGRAPHIC,NATIONAL GEOGRAPHIC,(MEN) TAPERED NAPPING PANTS N194MPT260 男士裤子 CARBON BLACK,http://static.lottedfs.cn/prod/prd-img/11/44/77/00/00/02/20000774411_1.jpg
畅销,1002470,20000628009,$169,NATIONAL GEOGRAPHIC,NATIONAL GEOGRAPHIC,(MENS) DOUBLE HOOD DUCK DOWN VEST N194MDV230 马甲 CARBON BLACK,http://static.lottedfs.cn/prod/prd-img/47/37/77/00/00/02/20000773747_1.jpg
,1002470,20000627934,$138,NATIONAL GEOGRAPHIC,NATIONAL GEOGRAPHIC,(MENS) RUBBER SNAP POCKET PANTS N193MPT230 裤子 CARBON BLACK,http://static.lottedfs.cn/prod/prd-img/31/36/77/00/00/02/20000773631_1.jpg
,1002470,20000627913,$138,NATIONAL GEOGRAPHIC,NATIONAL GEOGRAPHIC,(MENS) CIRCULAR KNITTED CONTRAST COLOR PANTS N193MPT050 裤子 CARBON BLACK,http://static.lottedfs.cn/prod/prd-img/83/35/77/00/00/02/20000773583_1.jpg
,1002470,20000627645,$77,NATIONAL GEOGRAPHIC,NATIONAL GEOGRAPHIC,SPACE ARTWORK SWEATSHIRT (FULLY NAPPED) N194USW230 卫衣 WHITE 2,http://static.lottedfs.cn/prod/prd-img/35/31/77/00/00/02/20000773135_1.jpg
,1002470,20000625699,$247,NATIONAL GEOGRAPHIC,NATIONAL GEOGRAPHIC,(MENS) COLLAR COLOR MIX AVIATOR PADDED JUMPER N194MJP020 男士外套 HAVANA KHAKI,http://static.lottedfs.cn/prod/prd-img/55/08/77/00/00/02/20000770855_1.jpg
,1002470,20000625328,$92,NATIONAL GEOGRAPHIC,NATIONAL GEOGRAPHIC,(MEN) CUSHION NAPPED HOODY F-ZIP N194MFT230 男士外套 DEEP SEA NAVY,http://static.lottedfs.cn/prod/prd-img/47/01/77/00/00/02/20000770147_1.jpg
,1002470,20000625327,$84,NATIONAL GEOGRAPHIC,NATIONAL GEOGRAPHIC,(MEN) OVER FIT PIGMENT DYEING MTM N194MSW050 卫衣 OBSIDIAN CHARCOAL,http://static.lottedfs.cn/prod/prd-img/45/01/77/00/00/02/20000770145_1.jpg
畅销,1002470,20000625319,$123,NATIONAL GEOGRAPHIC,NATIONAL GEOGRAPHIC,(MEN) WOVEN TRAINING HOODED ANORAK N193MFT100 连帽上衣 CARBON BLACK,http://static.lottedfs.cn/prod/prd-img/12/01/77/00/00/02/20000770112_1.jpg
,1002470,20000625306,$77,NATIONAL GEOGRAPHIC,NATIONAL GEOGRAPHIC,(MEN) LOGO GRAPHIC MTM N194MSW040 男士卫衣 CARBON BLACK,http://static.lottedfs.cn/prod/prd-img/84/00/77/00/00/02/20000770084_1.jpg
