tag,brand_No,product_No,us_price,brand_name_chn,brand_name_eng,product_name,img_url
赠品,17357,10001426680,$37,伊思,ITS SKIN,ITS SKIN PRESTIGE YEUX GINSENG DESCARGOT 红参蜗牛滚珠眼霜 15ml*2,http://static.lottedfs.cn/prod/prd-img/80/66/42/01/00/01/10001426680_01.jpg
赠品,17357,10001426679,$13,伊思,ITS SKIN,ITS SKIN PRESTIGE FOAM DESCARGOT 晶钻美肌蜗牛修复洗面奶 150ML,http://static.lottedfs.cn/prod/prd-img/79/66/42/01/00/01/10001426679_4.jpg
畅销 赠品,17357,20000557742,$50,伊思,ITS SKIN,ITS SKIN PRESTIGE TONIQUE EX GINSENG DESCARGOT SPECIAL 2 PIECE SET 晶钻红参蜗牛系列特别两件套,http://static.lottedfs.cn/prod/prd-img/80/79/65/00/00/02/20000657980_1.jpg
赠品,17357,10001406181,$51,伊思,ITS SKIN,ITS SKIN CREAM GINSENG DESCARGOT 晶钻红参蜗牛面霜 60ml,http://static.lottedfs.cn/prod/prd-img/81/61/40/01/00/01/10001406181_2.jpg
赠品,17357,10002189093,$14,伊思,ITS SKIN,ITS SKIN PRESTIGE FOAM GINSENG D ESCARGOT 洗面奶 150ml,http://static.lottedfs.cn/prod/prd-img/93/90/18/02/00/01/10002189093_01.jpg
赠品,17357,10001406153,$17,伊思,ITS SKIN,ITS SKIN CREAM DESCARGOT BB 晶钻蜗牛全效BB霜,http://static.lottedfs.cn/prod/prd-img/53/61/40/01/00/01/10001406153_01.jpg
畅销 赠品,17357,20000614377,$105,伊思,ITS SKIN,ITS SKIN PRESTIGE GINSENG 3 PIECES SPECIAL SET + PRESTIGE FOAM GINSENG DESCARGOT 护肤套装,http://static.lottedfs.cn/prod/prd-img/98/34/75/00/00/02/20000753498_1.png
赠品,17357,10001869481,$18,伊思,ITS SKIN,ITS SKIN PRESTIGE CREAM GINSENG DESCARGOT BB 晶钻美肌红参蜗牛BB霜 50ml,http://static.lottedfs.cn/prod/prd-img/81/94/86/01/00/01/10001869481_01.jpg
赠品,17357,20000466576,$19,伊思,ITS SKIN,PRESTIGE MASQUE DESCARGOT 面膜,http://static.lottedfs.cn/prod/prd-img/74/06/51/00/00/02/20000510674_1.jpg
赠品,17357,10000049487,$47,伊思,ITS SKIN,ITS SKIN PRESTIGE CREAM DESCARGOT 伊思蜗牛面霜 60ml,http://static.lottedfs.cn/prod/prd-img/87/94/04/00/00/01/10000049487_2.jpg
赠品,17357,10001925654,$28,伊思,ITS SKIN,PRESTIGE TONIQUE GINSENG DESCARGOT 红参蜗牛修复水 140ML,http://static.lottedfs.cn/prod/prd-img/54/56/92/01/00/01/10001925654_01.jpg
赠品,17357,10001948859,$8,伊思,ITS SKIN,ITS SKIN COLLAGEN VOLUMING EYE CREAM Ⅱ  眼霜,http://static.lottedfs.cn/prod/prd-img/59/88/94/01/00/01/10001948859_01.jpg
赠品,17357,10001948853,$8,伊思,ITS SKIN,ITS SKIN COLLAGEN VOLUMING EMULSION II  乳液,http://static.lottedfs.cn/prod/prd-img/53/88/94/01/00/01/10001948853_01.jpg
赠品,17357,10001958048,$8,伊思,ITS SKIN,ITS SKIN HYALURONIC ACID MOISTURE TONER  化妆水  150ml,http://static.lottedfs.cn/prod/prd-img/48/80/95/01/00/01/10001958048_01.jpg
赠品,17357,10001406161,$24,伊思,ITS SKIN,晶钻美肤蜗牛再生爽肤水 II号 140ml,http://static.lottedfs.cn/prod/prd-img/61/61/40/01/00/01/10001406161_01.jpg
赠品,17357,10002193457,$15,伊思,ITS SKIN,ITS SKIN POWER 10 FORMULA GF EFFECTOR SUPER SIZE 精华 60ml,http://static.lottedfs.cn/prod/prd-img/57/34/19/02/00/01/10002193457_01.jpg
赠品,17357,10001417939,$6,伊思,ITS SKIN,MANGOWHITE PEELING GEL 伊思山竹净白去角质啫喱,http://static.lottedfs.cn/prod/prd-img/39/79/41/01/00/01/10001417939_06.jpg
赠品,17357,10001925652,$28,伊思,ITS SKIN,PRESTIGE LOTION GINSENG DESCARGOT  红参蜗牛修复乳液  140ML,http://static.lottedfs.cn/prod/prd-img/52/56/92/01/00/01/10001925652_01.jpg
赠品,17357,10002331199,$6,伊思,ITS SKIN,ITS SKIN WEDDING DRESS WHITE CREAM 100ml,http://static.lottedfs.cn/prod/prd-img/99/11/33/02/00/01/10002331199_3.jpg
赠品,17357,10001958055,$8,伊思,ITS SKIN,ITS SKIN HYALURONIC ACID MOISTURE EMULSION  乳液 150ml,http://static.lottedfs.cn/prod/prd-img/55/80/95/01/00/01/10001958055_01.jpg
赠品,17357,10002344712,$11,伊思,ITS SKIN,PRESTIGE FOAM DESCARGOT HOMME 男士洁面乳 150ml,http://static.lottedfs.cn/prod/prd-img/12/47/34/02/00/01/10002344712_01.jpg
赠品,17357,20000614357,$95,伊思,ITS SKIN,ITS SKIN PRESTIGE DESCARGOT 3 PIECES SET + PRETIAGE FOAM DESCARGOT 护肤套装,http://static.lottedfs.cn/prod/prd-img/66/34/75/00/00/02/20000753466_1.png
赠品,17357,10002219013,$105,伊思,ITS SKIN,ITS SKIN PRESTIGE DESCARGOT SPECIAL SET  护肤3件套,http://static.lottedfs.cn/prod/prd-img/13/90/21/02/00/01/10002219013_2.jpg
赠品,17357,10001406162,$24,伊思,ITS SKIN,晶钻美肤蜗牛再生乳液 II号 140ml,http://static.lottedfs.cn/prod/prd-img/62/61/40/01/00/01/10001406162_01.jpg
赠品,17357,10002193456,$15,伊思,ITS SKIN,ITS SKIN POWER 10 FORMULA VC EFFECTOR SUPER SIZE 精华 60ml,http://static.lottedfs.cn/prod/prd-img/56/34/19/02/00/01/10002193456_01.jpg
赠品,17357,10001948858,$8,伊思,ITS SKIN,ITS SKIN COLLAGEN VOLUMING CREAM II  面霜,http://static.lottedfs.cn/prod/prd-img/58/88/94/01/00/01/10001948858_01.jpg
畅销 赠品,17357,20000472192,$21,伊思,ITS SKIN,PRESTIGE MASQUE GINSENG DESCARGOT 面膜,http://static.lottedfs.cn/prod/prd-img/92/97/51/00/00/02/20000519792_1.jpg
赠品,17357,10001800019,$15,伊思,ITS SKIN,ITS SKIN POWER 10 FORMULA YE EFFECTOR 能量10精华原液(大容量) 60ml,http://static.lottedfs.cn/prod/prd-img/19/00/80/01/00/01/10001800019_01.jpg
赠品,17357,20000557691,$45,伊思,ITS SKIN,ITS SKIN PRESTIGE TONIQUE DESCARGOTⅠ[LEGERE] SPECIAL 2 PIECE SET 晶钻蜗牛系列Ⅰ特别两件套,http://static.lottedfs.cn/prod/prd-img/90/78/65/00/00/02/20000657890_1.jpg
赠品,17357,20000596947,$9,伊思,ITS SKIN,ITS SKIN POWER 10 FORMULA PO EFFECTOR 安瓶精华,http://static.lottedfs.cn/prod/prd-img/50/91/71/00/00/02/20000719150_1.jpg
赠品,17357,10001958050,$8,伊思,ITS SKIN,ITS SKIN HYALURONIC ACID MOISTURE CREAM  面霜 50ml,http://static.lottedfs.cn/prod/prd-img/50/80/95/01/00/01/10001958050_01.jpg
赠品,17357,20000493894,$96,伊思,ITS SKIN,ITS SKIN PRESTIGE GINSENG DESCARGOT 4 PIECES SPECIAL SET 基础护肤套装,http://static.lottedfs.cn/prod/prd-img/71/47/55/00/00/02/20000554771_1.jpg
赠品,17357,10001948854,$8,伊思,ITS SKIN,ITS SKIN COLLAGEN VOLUMING TONER Ⅱ 化妆水,http://static.lottedfs.cn/prod/prd-img/54/88/94/01/00/01/10001948854_01.jpg
赠品,17357,10002358449,$15,伊思,ITS SKIN,COLLAGEN MASK SET 面膜 30片,http://static.lottedfs.cn/prod/prd-img/49/84/35/02/00/01/10002358449_1.jpg
赠品,17357,10002358446,$15,伊思,ITS SKIN,HYALURONIC MASK SET 面膜 30片,http://static.lottedfs.cn/prod/prd-img/46/84/35/02/00/01/10002358446_1.jpg
赠品,17357,20000596954,$9,伊思,ITS SKIN,ITS SKIN POWER 10 FORMULA LI EFFECTOR 安瓶精华,http://static.lottedfs.cn/prod/prd-img/66/91/71/00/00/02/20000719166_1.jpg
赠品,17357,20000448498,$43,伊思,ITS SKIN,COLLAGEN NUTRITION 6 PIECES SPECIAL SET 胶原蛋白弹力6种特别套装,http://static.lottedfs.cn/prod/prd-img/09/69/48/00/00/02/20000486909_2.jpg
赠品,17357,20000596958,$9,伊思,ITS SKIN,ITS SKIN POWER 10 FORMULA WH EFFECTOR 安瓶精华,http://static.lottedfs.cn/prod/prd-img/76/91/71/00/00/02/20000719176_1.jpg
赠品,17357,10003149870,$15,伊思,ITS SKIN,ITS SKIN SECRET SOLUTION WEDDING DRESS WHITE CREAM SET,http://static.lottedfs.cn/prod/prd-img/70/98/14/03/00/01/10003149870_01.jpg
赠品,17357,20000631559,$12,伊思,ITS SKIN,ITS SKIN PRESTIGE ECLOGEMME PINK HAND CREAM SET 护手霜套装,http://static.lottedfs.cn/prod/prd-img/48/87/77/00/00/02/20000778748_1.jpg
赠品,17357,20000520991,$13,伊思,ITS SKIN,ITS SKIN PRESTIGE GOLD FOIL MASQUE DESCARGOT 面膜,http://static.lottedfs.cn/prod/prd-img/86/42/59/00/00/02/20000594286_1.jpg
赠品,17357,10001409646,$24,伊思,ITS SKIN,ITS SKIN PRESTIGE TONIQUE DESCARGOTⅠ 晶钻美肤蜗牛再生水 140ml,http://static.lottedfs.cn/prod/prd-img/46/96/40/01/00/01/10001409646_01.jpg
畅销 赠品,17357,10001406177,$22,伊思,ITS SKIN,ITS SKIN PRESTIGE LOTION DESCARGOT HOMME 男士乳液 118ml,http://static.lottedfs.cn/prod/prd-img/77/61/40/01/00/01/10001406177_04.jpg
赠品,17357,20000565549,$46,伊思,ITS SKIN,ITS SKIN PRESTIGE YEUX DESCARGOT SPECIAL GIFT SET 眼霜3件企划套装,http://static.lottedfs.cn/prod/prd-img/48/07/67/00/00/02/20000670748_1.jpg
赠品,17357,10001958057,$8,伊思,ITS SKIN,ITS SKIN HYALURONIC ACID MOISTURE SERUM  精华 40ml,http://static.lottedfs.cn/prod/prd-img/57/80/95/01/00/01/10001958057_01.jpg
赠品,17357,10001406134,$9,伊思,ITS SKIN,伊思能量10VB精华原液 30ml,http://static.lottedfs.cn/prod/prd-img/34/61/40/01/00/01/10001406134_01.jpg
赠品,17357,20000596941,$9,伊思,ITS SKIN,ITS SKIN POWER 10 FORMULA VB EFFECTOR 安瓶精华,http://static.lottedfs.cn/prod/prd-img/26/91/71/00/00/02/20000719126_1.jpg
赠品,17357,20000597550,$15,伊思,ITS SKIN,ITS SKIN POWER 10 FORMULA GF EFFECTOR SUPER SIZE 大容量精华,http://static.lottedfs.cn/prod/prd-img/09/02/72/00/00/02/20000720209_1.jpg
赠品,17357,20000597220,$11,伊思,ITS SKIN,ITS SKIN POWER 10 FORMULA SNAKE,http://static.lottedfs.cn/prod/prd-img/21/95/71/00/00/02/20000719521_1.jpg
赠品,17357,20000523992,$25,伊思,ITS SKIN,ITS SKIN WRINKLE CUT NECK FOCUS ESSENCE SET 颈部紧致精华套装,http://static.lottedfs.cn/prod/prd-img/71/91/59/00/00/02/20000599171_1.jpg
赠品,17357,10001421891,$9,伊思,ITS SKIN,WRINKLE CUT NECK FOCUS  ESSENCE  颈部精华素  80ml,http://static.lottedfs.cn/prod/prd-img/91/18/42/01/00/01/10001421891_01.jpg
赠品,17357,10001406171,$29,伊思,ITS SKIN,ITS SKIN PRESTIGE SERUM DESCARGOT + SERUM EYE DESCARGOT 40ml+15ml,http://static.lottedfs.cn/prod/prd-img/71/61/40/01/00/01/10001406171_01.jpg
赠品,17357,20000596935,$9,伊思,ITS SKIN,ITS SKIN POWER 10 FORMULA VC EFFECTOR 安瓶精华,http://static.lottedfs.cn/prod/prd-img/99/90/71/00/00/02/20000719099_1.jpg
赠品,17357,20000410142,$8,伊思,ITS SKIN,ITS SKIN PRESTIGE CREME GINSENG DESCARGOT MINI COLLECTION 面霜(迷你装),http://static.lottedfs.cn/prod/prd-img/26/79/42/00/00/02/20000427926_2.jpg
赠品,17357,10002223384,$95,伊思,ITS SKIN,ITS SKIN PRESTIGE DESCARGOT 3-PIECE SET 1 护肤3件套,http://static.lottedfs.cn/prod/prd-img/84/33/22/02/00/01/10002223384_01.jpg
赠品,17357,10002139932,$16,伊思,ITS SKIN,ITS SKIN PRESTIGE CIRCULER D ESCARGOT 精华 100ml,http://static.lottedfs.cn/prod/prd-img/32/99/13/02/00/01/10002139932_01.jpg
赠品,17357,10001948857,$8,伊思,ITS SKIN,ITS SKIN COLLAGEN VOLUMING SERUM Ⅱ 精华,http://static.lottedfs.cn/prod/prd-img/57/88/94/01/00/01/10001948857_01.jpg
赠品,17357,20000597547,$15,伊思,ITS SKIN,ITS SKIN POWER 10 FORMULA VC EFFECTOR SUPER SIZE 大容量精华,http://static.lottedfs.cn/prod/prd-img/97/01/72/00/00/02/20000720197_1.jpg
赠品,17357,20000596952,$9,伊思,ITS SKIN,ITS SKIN POWER 10 FORMULA GF EFFECTOR 安瓶精华,http://static.lottedfs.cn/prod/prd-img/64/91/71/00/00/02/20000719164_1.jpg
赠品,17357,20000555852,$19,伊思,ITS SKIN,PRESTIGE YEUX MASQUE GINSENG DESCARGOT 眼膜,http://static.lottedfs.cn/prod/prd-img/76/42/65/00/00/02/20000654276_2.jpg
赠品,17357,20000494140,$17,伊思,ITS SKIN,ITS SKIN PRESTIGE CREME BB DESCARGOT BB霜 23 NATURAL BEIGE,http://static.lottedfs.cn/prod/prd-img/94/54/55/00/00/02/20000555494_1.jpg
赠品,17357,20000410210,$8,伊思,ITS SKIN,ITS SKIN PRESTIGE CREME PROPOLIS DESCARGOT  面霜 迷你装,http://static.lottedfs.cn/prod/prd-img/27/80/42/00/00/02/20000428027_1.jpg
赠品,17357,20000410128,$8,伊思,ITS SKIN,PRESTIGE CREME DESCARGOT MINI COLLECTION 迷你面霜,http://static.lottedfs.cn/prod/prd-img/09/79/42/00/00/02/20000427909_1.jpg
赠品,17357,10002189095,$32,伊思,ITS SKIN,ITS SKIN PRESTIGE SERUM GINSENG D ESCARGOT 精华 40ml,http://static.lottedfs.cn/prod/prd-img/95/90/18/02/00/01/10002189095_01.jpg
免税独家 赠品,17357,20000603154,$51,伊思,ITS SKIN,IT S SKIN PRESTIGE ECLOGEMME CREME BLACK D ESCARGOT 面霜,http://static.lottedfs.cn/prod/prd-img/69/29/73/00/00/02/20000732969_1.jpg
赠品,17357,20000596931,$9,伊思,ITS SKIN,ITS SKIN POWER 10 FORMULA WR EFFECTOR 精华,http://static.lottedfs.cn/prod/prd-img/91/90/71/00/00/02/20000719091_1.jpg
赠品,17357,20000596922,$9,伊思,ITS SKIN,ITS SKIN POWER 10 FORMULA VE EFFECTOR 安瓶精华,http://static.lottedfs.cn/prod/prd-img/78/90/71/00/00/02/20000719078_1.jpg
畅销 赠品,17357,20000593040,$11,伊思,ITS SKIN,ITS SKIN 2 O CLOCK SUN BLOCK 防晒霜,http://static.lottedfs.cn/prod/prd-img/75/15/71/00/00/02/20000711575_1.jpg
畅销 赠品,17357,20000521763,$54,伊思,ITS SKIN,ITS SKIN PRESTIGE DESCARGOT HOMME SPECIAL SET 男士护肤套装,http://static.lottedfs.cn/prod/prd-img/48/56/59/00/00/02/20000595648_1.jpg
免税独家 赠品,17357,20000476604,$62,伊思,ITS SKIN,ITS SKIN PRESTIGE CAVIAR BLACK AMPOULE DESCARGOT 安瓶精华,http://static.lottedfs.cn/prod/prd-img/51/67/52/00/00/02/20000526751_3.jpg
赠品,17357,10002358448,$15,伊思,ITS SKIN,GREEN TEA MASK SET 面膜 30片,http://static.lottedfs.cn/prod/prd-img/48/84/35/02/00/01/10002358448_1.jpg
赠品,17357,10001406154,$24,伊思,ITS SKIN,ITS SKIN PRESTIGE LOTION DESCARGOTⅠ 晶钻美肤蜗牛再生乳液 140ml,http://static.lottedfs.cn/prod/prd-img/54/61/40/01/00/01/10001406154_01.jpg
赠品,17357,20000597544,$15,伊思,ITS SKIN,ITS SKIN POWER 10 FORMULA YE EFFECTOR SUPER SIZE 大容量精华,http://static.lottedfs.cn/prod/prd-img/90/01/72/00/00/02/20000720190_1.jpg
赠品,17357,20000576420,$15,伊思,ITS SKIN,ITS SKIN SNAIL BLANC BRIGHTENING GEL CREAM 面霜,http://static.lottedfs.cn/prod/prd-img/24/49/68/00/00/02/20000684924_4.jpg
免税独家 赠品,17357,20000481731,$62,伊思,ITS SKIN,PRESTIGE 24K GOLD AMPOULE DESCARGOT 安瓶,http://static.lottedfs.cn/prod/prd-img/97/40/53/00/00/02/20000534097_3.jpg
赠品,17357,10001406169,$11,伊思,ITS SKIN,ITS SKIN POWER 10 FORMULA PROPOLIS 精华 30ml,http://static.lottedfs.cn/prod/prd-img/69/61/40/01/00/01/10001406169_03.jpg
赠品,17357,20000631534,$15,伊思,ITS SKIN,ITS SKIN PRESTIGE ECLOGEMME MASQUE BLACK DESCARGOT 面膜 (10+10),http://static.lottedfs.cn/prod/prd-img/16/87/77/00/00/02/20000778716_1.jpg
赠品,17357,20000631532,$45,伊思,ITS SKIN,ITS SKIN PRESTIGE ECLOGEMME MASQUE PINK DESCARGOT 面膜 (30+30),http://static.lottedfs.cn/prod/prd-img/13/87/77/00/00/02/20000778713_1.jpg
赠品,17357,20000628069,$15,伊思,ITS SKIN,ITS SKIN PRESTIGE ECLOGEMME MASQUE PINK DESCARGOT 面膜 10+10,http://static.lottedfs.cn/prod/prd-img/19/38/77/00/00/02/20000773819_1.jpg
免税独家 赠品,17357,20000607254,$30,伊思,ITS SKIN,IT S SKIN PRESTIGE ECLOGEMME BLACK PACT 气垫粉底 23号 NATURAL BEIGE,http://static.lottedfs.cn/prod/prd-img/38/07/74/00/00/02/20000740738_1.jpg
免税独家 赠品,17357,20000603152,$28,伊思,ITS SKIN,IT S SKIN PRESTIGE ECLOGEMME LOTION BLACK D ESCARGOT 乳液,http://static.lottedfs.cn/prod/prd-img/67/29/73/00/00/02/20000732967_1.jpg
免税独家 赠品,17357,20000603147,$28,伊思,ITS SKIN,IT S SKIN PRESTIGE ECLOGEMME TONIQUE BLACK D ESCARGOT 化妆水,http://static.lottedfs.cn/prod/prd-img/62/29/73/00/00/02/20000732962_1.jpg
免税独家 赠品,17357,20000603142,$47,伊思,ITS SKIN,IT S SKIN PRESTIGE ECLOGEMME CREME PINK D ESCARGOT 面霜,http://static.lottedfs.cn/prod/prd-img/46/29/73/00/00/02/20000732946_5.jpg
赠品,17357,20000586251,$8,伊思,ITS SKIN,ITS SKIN COLORABLE DRAW TINT 染唇液 06号 LAST MOOD,http://static.lottedfs.cn/prod/prd-img/48/04/70/00/00/02/20000700448_1.jpg
赠品,17357,20000586249,$8,伊思,ITS SKIN,ITS SKIN COLORABLE DRAW TINT 染唇液 05号 ICNING CORAL,http://static.lottedfs.cn/prod/prd-img/41/04/70/00/00/02/20000700441_1.jpg
赠品,17357,20000586223,$8,伊思,ITS SKIN,ITS SKIN COLORABLE DRAW TINT 染唇液 01号 CHILI PEPPER,http://static.lottedfs.cn/prod/prd-img/81/03/70/00/00/02/20000700381_1.jpg
赠品,17357,20000494116,$28,伊思,ITS SKIN,ITS SKIN PRESTIGE LOTION EX GINSENG DESCARGOT 乳液,http://static.lottedfs.cn/prod/prd-img/48/54/55/00/00/02/20000555448_1.jpg
赠品,17357,20000493596,$84,伊思,ITS SKIN,ITS SKIN PRESTIGE DESCARGOT 4 PIECES SPECIAL SET I 基础护肤4件特别套装,http://static.lottedfs.cn/prod/prd-img/21/42/55/00/00/02/20000554221_1.jpg
赠品,17357,20000450575,$38,伊思,ITS SKIN,PURE MOISTURE SPECIAL SET 纯净保湿特别套装,http://static.lottedfs.cn/prod/prd-img/54/96/48/00/00/02/20000489654_1.jpg
赠品,17357,10003101058,$15,伊思,ITS SKIN,BIRD S NEST RADIANCE MASK SET 面膜 （20+10）,http://static.lottedfs.cn/prod/prd-img/58/10/10/03/00/01/10003101058_1.jpg
赠品,17357,10001406138,$9,伊思,ITS SKIN,能量10 YE精华原液 30ml,http://static.lottedfs.cn/prod/prd-img/38/61/40/01/00/01/10001406138_01.jpg
赠品,17357,10001406135,$9,伊思,ITS SKIN,伊思能量10 VC精华原液 30ml,http://static.lottedfs.cn/prod/prd-img/35/61/40/01/00/01/10001406135_01.jpg
赠品,17357,10001406130,$9,伊思,ITS SKIN,伊思能量10 GF精华原液 30ml,http://static.lottedfs.cn/prod/prd-img/30/61/40/01/00/01/10001406130_01.jpg
赠品,17357,20000616233,$46,伊思,ITS SKIN,ITS SKIN POWER 10 FORMULA YE CREAM CAPSULE ONE A DAY BOX,http://static.lottedfs.cn/prod/prd-img/70/69/75/00/00/02/20000756970_5.jpg
赠品,17357,20000616230,$46,伊思,ITS SKIN,ITS SKIN POWER 10 FORMULA VC CREAM CAPSULE ONE A DAY BOX,http://static.lottedfs.cn/prod/prd-img/67/69/75/00/00/02/20000756967_1.jpg
促销 免税独家 赠品,17357,20000603156,$105,伊思,ITS SKIN,IT S SKIN PRESTIGE ECLOGEMME BLACK D ESCARGOT 3 SPECIAL SET  护肤3件套,http://static.lottedfs.cn/prod/prd-img/71/29/73/00/00/02/20000732971_1.jpg
免税独家 赠品,17357,20000603145,$95,伊思,ITS SKIN,IT S SKIN PRESTIGE ECLOGEMME PINK D ESCARGOT 3 SPECIAL SET 护肤3件套,http://static.lottedfs.cn/prod/prd-img/59/29/73/00/00/02/20000732959_1.jpg
免税独家 赠品,17357,20000603140,$24,伊思,ITS SKIN,IT S SKIN PRESTIGE ECLOGEMME LOTION PINK D ESCARGOT 乳液,http://static.lottedfs.cn/prod/prd-img/44/29/73/00/00/02/20000732944_2.jpg
免税独家 赠品,17357,20000603134,$24,伊思,ITS SKIN,IT S SKIN PRESTIGE ECLOGEMME TONIQUE PINK D ESCARGOT 化妆水,http://static.lottedfs.cn/prod/prd-img/23/29/73/00/00/02/20000732923_1.jpg
赠品,17357,20000596929,$9,伊思,ITS SKIN,ITS SKIN POWER 10 FORMULA CO EFFECTOR 安瓶精华,http://static.lottedfs.cn/prod/prd-img/86/90/71/00/00/02/20000719086_1.jpg
赠品,17357,20000596914,$9,伊思,ITS SKIN,ITS SKIN POWER 10 FORMULA YE EFFECTOR 精华,http://static.lottedfs.cn/prod/prd-img/66/90/71/00/00/02/20000719066_1.jpg
赠品,17357,20000586271,$8,伊思,ITS SKIN,ITS SKIN COLORABLE DRAW TINT 染唇液 10号 HOT HIPPIE,http://static.lottedfs.cn/prod/prd-img/81/04/70/00/00/02/20000700481_1.jpg
赠品,17357,20000586261,$8,伊思,ITS SKIN,ITS SKIN COLORABLE DRAW TINT 染唇液 08号 ROSY MOCHA,http://static.lottedfs.cn/prod/prd-img/58/04/70/00/00/02/20000700458_1.jpg
赠品,17357,20000586258,$8,伊思,ITS SKIN,ITS SKIN COLORABLE DRAW TINT 染唇液 07号 RETRO NUDE,http://static.lottedfs.cn/prod/prd-img/55/04/70/00/00/02/20000700455_1.jpg
赠品,17357,20000565532,$23,伊思,ITS SKIN,FLAMEL MD WTX PEEL EFFECTIVE MASK 面膜 20片 (10+10),http://static.lottedfs.cn/prod/prd-img/02/07/67/00/00/02/20000670702_1.jpg
免税独家 赠品,17357,20000500518,$15,伊思,ITS SKIN,ITS SKIN COLLAGEN NUTRITION CLEANSING FOAM SPECIAL SET 洁面乳套装,http://static.lottedfs.cn/prod/prd-img/90/55/56/00/00/02/20000565590_1.jpg
畅销 赠品,17357,20000493922,$29,伊思,ITS SKIN,ITS SKIN PRESTIGE SERUM EX DESCARGOT 精华,http://static.lottedfs.cn/prod/prd-img/17/48/55/00/00/02/20000554817_1.jpg
赠品,17357,20000493918,$25,伊思,ITS SKIN,ITS SKIN PRESTIGE LOTION EX DESCARGOT 乳液,http://static.lottedfs.cn/prod/prd-img/13/48/55/00/00/02/20000554813_1.jpg
赠品,17357,20000482861,$9,伊思,ITS SKIN,POWER 10 FORMULA VC VITAFUL MIST 保湿喷雾,http://static.lottedfs.cn/prod/prd-img/24/63/53/00/00/02/20000536324_1.jpg
赠品,17357,20000482145,$9,伊思,ITS SKIN,POWER 10 FORMULA GF MOISTURE MIST 保湿喷雾,http://static.lottedfs.cn/prod/prd-img/69/48/53/00/00/02/20000534869_1.jpg
赠品,17357,20000448525,$43,伊思,ITS SKIN,HYALURONIC ACID MOISTURE 6 PIECES SPECIAL SET 玻尿酸保湿6种特别套装,http://static.lottedfs.cn/prod/prd-img/40/69/48/00/00/02/20000486940_1.jpg
赠品,17357,10003175977,$50,伊思,ITS SKIN,CREME PROPOLIS DESCARGOT 面霜 60ml,http://static.lottedfs.cn/prod/prd-img/77/59/17/03/00/01/10003175977_01.jpg
畅销 赠品,17357,10003101059,$15,伊思,ITS SKIN,HONEYBEE NUTRITION MASK SET 面膜 （20+10）,http://static.lottedfs.cn/prod/prd-img/59/10/10/03/00/01/10003101059_1.jpg
赠品,17357,10003101057,$15,伊思,ITS SKIN,SYN AKE VITAL MASK SET  面膜 (20+10),http://static.lottedfs.cn/prod/prd-img/57/10/10/03/00/01/10003101057_1.jpg
赠品,17357,10001406172,$22,伊思,ITS SKIN,ITS SKIN PRESTIGE TONIQUE D ESCARGOT HOMME 男士化妆水 120ml,http://static.lottedfs.cn/prod/prd-img/72/61/40/01/00/01/10001406172_03.jpg
赠品,17357,10001406129,$9,伊思,ITS SKIN,伊思能量10 CO精华原液 30ml,http://static.lottedfs.cn/prod/prd-img/29/61/40/01/00/01/10001406129_01.jpg
赠品,17357,20000631554,$45,伊思,ITS SKIN,ITS SKIN PRESTIGE ECLOGEMME MASQUE BLACK DESCARGOT 面膜 (30+30),http://static.lottedfs.cn/prod/prd-img/41/87/77/00/00/02/20000778741_1.jpg
赠品,17357,20000616232,$46,伊思,ITS SKIN,ITS SKIN POWER 10 FORMULA GF CREAM CAPSULE ONE A DAY BOX,http://static.lottedfs.cn/prod/prd-img/69/69/75/00/00/02/20000756969_5.jpg
免税独家 赠品,17357,20000607242,$30,伊思,ITS SKIN,IT S SKIN PRESTIGE ECLOGEMME PINK PACT 气垫粉底 23号 NATURAL BEIGE,http://static.lottedfs.cn/prod/prd-img/13/07/74/00/00/02/20000740713_1.jpg
免税独家 赠品,17357,20000603161,$30,伊思,ITS SKIN,IT S SKIN PRESTIGE ECLOGEMME BLACK PACT 气垫霜 21号 LIGHT BEIGE,http://static.lottedfs.cn/prod/prd-img/76/29/73/00/00/02/20000732976_1.jpg
免税独家 赠品,17357,20000603157,$30,伊思,ITS SKIN,IT S SKIN PRESTIGE ECLOGEMME PINK PACT 气垫霜 21号 LIGHT BEIGE,http://static.lottedfs.cn/prod/prd-img/72/29/73/00/00/02/20000732972_1.jpg
赠品,17357,20000597230,$9,伊思,ITS SKIN,ITS SKIN POWER 10 FORMULA Q10 EFFECTOR 安瓶精华,http://static.lottedfs.cn/prod/prd-img/38/95/71/00/00/02/20000719538_1.jpg
赠品,17357,20000596970,$11,伊思,ITS SKIN,ITS SKIN POWER 10 FORMULA PROPOLIS 安瓶精华,http://static.lottedfs.cn/prod/prd-img/00/92/71/00/00/02/20000719200_1.jpg
赠品,17357,20000586265,$8,伊思,ITS SKIN,ITS SKIN COLORABLE DRAW TINT 染唇液 09号 BIG RED,http://static.lottedfs.cn/prod/prd-img/62/04/70/00/00/02/20000700462_1.jpg
赠品,17357,20000586245,$8,伊思,ITS SKIN,ITS SKIN COLORABLE DRAW TINT 染唇液 04号 STOLEN PINK,http://static.lottedfs.cn/prod/prd-img/35/04/70/00/00/02/20000700435_1.jpg
赠品,17357,20000586241,$8,伊思,ITS SKIN,ITS SKIN COLORABLE DRAW TINT 染唇液 03号 VIVID TANGERINE,http://static.lottedfs.cn/prod/prd-img/14/04/70/00/00/02/20000700414_1.jpg
赠品,17357,20000586236,$8,伊思,ITS SKIN,ITS SKIN COLORABLE DRAW TINT 染唇液 02号 APPLE SQUEEZE,http://static.lottedfs.cn/prod/prd-img/05/04/70/00/00/02/20000700405_1.jpg
赠品,17357,20000576425,$15,伊思,ITS SKIN,ITS SKIN SNAIL BLANC BRIGHTENING ESSENCE 精华,http://static.lottedfs.cn/prod/prd-img/37/49/68/00/00/02/20000684937_2.jpg
赠品,17357,20000576416,$23,伊思,ITS SKIN,PRESTIGE DUAL MASQUE DESCARGOT 面膜 (1+1),http://static.lottedfs.cn/prod/prd-img/19/49/68/00/00/02/20000684919_1.jpg
畅销 赠品,17357,20000551576,$12,伊思,ITS SKIN,ITS SKIN DUST DEFENSE SUN PROTECTOR 防晒霜,http://static.lottedfs.cn/prod/prd-img/73/69/64/00/00/02/20000646973_1.jpg
赠品,17357,20000535665,$19,伊思,ITS SKIN,ITS SKIN PRESTIGE CAVIAR BLACK AMPOULE MASQUE DESCARGOT 面膜,http://static.lottedfs.cn/prod/prd-img/62/82/61/00/00/02/20000618262_3.jpg
赠品,17357,20000531615,$12,伊思,ITS SKIN,FLAMEL MD YOUTH BARRIER DERMAL HYDRO FOAM CLEANSER 锁水泡沫洁面乳,http://static.lottedfs.cn/prod/prd-img/70/09/61/00/00/02/20000610970_1.jpg
赠品,17357,20000531597,$5,伊思,ITS SKIN,FLAMEL MD YOUTH BARRIER DERMAL HYDRO AMPOULE 锁水滋润安瓶,http://static.lottedfs.cn/prod/prd-img/52/09/61/00/00/02/20000610952_1.jpg
赠品,17357,20000531561,$23,伊思,ITS SKIN,FLAMEL MD YOUTH BARRIER DERMAL HYDRO MASK 锁水滋润面膜 20片(10+10),http://static.lottedfs.cn/prod/prd-img/05/09/61/00/00/02/20000610905_1.jpg
赠品,17357,20000531555,$22,伊思,ITS SKIN,FLAMEL MD MILK LUST FEELS MILD AMPOULE WASH OFF 亮润温和水洗安瓶 2支,http://static.lottedfs.cn/prod/prd-img/99/08/61/00/00/02/20000610899_1.jpg
赠品,17357,20000531551,$29,伊思,ITS SKIN,FLAMEL MD PLAMELTA ALL COVERY POTENCY CREAM 岁月修护面霜,http://static.lottedfs.cn/prod/prd-img/95/08/61/00/00/02/20000610895_1.jpg
赠品,17357,20000531538,$32,伊思,ITS SKIN,FLAMEL MD PLAMELTA ALL COVERY TREATMENT ESSENCE 岁月修护肌底液,http://static.lottedfs.cn/prod/prd-img/82/08/61/00/00/02/20000610882_1.jpg
赠品,17357,20000531531,$28,伊思,ITS SKIN,FLAMEL MD WTX PEEL EFFECTIVE AMPOULE SET 水语焕肤精华安瓶套装,http://static.lottedfs.cn/prod/prd-img/75/08/61/00/00/02/20000610875_3.jpg
赠品,17357,20000531520,$5,伊思,ITS SKIN,FLAMEL MD WTX PEEL EFFECTIVE AMPOULE 水语焕肤精华安瓶,http://static.lottedfs.cn/prod/prd-img/64/08/61/00/00/02/20000610864_1.jpg
赠品,17357,20000509449,$15,伊思,ITS SKIN,ITS SKIN POWER 10 FORMULA WR OIL AMPOULE 安瓶,http://static.lottedfs.cn/prod/prd-img/21/85/57/00/00/02/20000578521_1.jpg
赠品,17357,20000509432,$15,伊思,ITS SKIN,ITS SKIN POWER 10 FORMULA GF OIL AMPOULE 安瓶,http://static.lottedfs.cn/prod/prd-img/96/84/57/00/00/02/20000578496_1.jpg
赠品,17357,20000508860,$6,伊思,ITS SKIN,ITS SKIN PURITIER MICELLAR LIP AND EYE REMOVER 眼唇卸妆液,http://static.lottedfs.cn/prod/prd-img/19/76/57/00/00/02/20000577619_1.jpg
免税独家 赠品,17357,20000500536,$13,伊思,ITS SKIN,ITS SKIN PURE MOISTURE LINE CLEANSING FOAM SPECIAL SET 洁面乳套装,http://static.lottedfs.cn/prod/prd-img/39/56/56/00/00/02/20000565639_1.jpg
赠品,17357,20000494155,$19,伊思,ITS SKIN,ITS SKIN PRESTIGE GINSENG BB DESCARGOT BB霜 23 NATURAL BEIGE,http://static.lottedfs.cn/prod/prd-img/15/55/55/00/00/02/20000555515_1.jpg
