tag,brand_No,product_No,us_price,brand_name_chn,brand_name_eng,product_name,img_url
,17449,20000501976,$90,潘多拉,PANDORA,BEADED SILVER Y-NECKLACE 项链,http://static.lottedfs.cn/prod/prd-img/82/80/56/00/00/02/20000568082_1.jpg
,17449,20000501972,$75,潘多拉,PANDORA,CROSS SILVER PENDANT WITH CLEAR CUBIC ZIRCONIA 吊坠,http://static.lottedfs.cn/prod/prd-img/77/80/56/00/00/02/20000568077_1.jpg
,17449,20000501967,$75,潘多拉,PANDORA,ICE CUBE SILVER PENDANT WITH CLEAR CUBIC ZIRCONIA 吊坠,http://static.lottedfs.cn/prod/prd-img/72/80/56/00/00/02/20000568072_1.jpg
,17449,20000501954,$90,潘多拉,PANDORA,ICE CUBE PANDORA ROSE PENDANT WITH CLEAR CUBIC ZIRCONIA 吊坠,http://static.lottedfs.cn/prod/prd-img/56/80/56/00/00/02/20000568056_1.jpg
,17449,20000501950,$75,潘多拉,PANDORA,ICE CUBE SILVER STUD EARRINGS WITH CLEAR CUBIC ZIRCONIA 耳饰,http://static.lottedfs.cn/prod/prd-img/50/80/56/00/00/02/20000568050_1.jpg
,17449,20000501945,$75,潘多拉,PANDORA,BEAD SILVER EARRINGS 耳饰,http://static.lottedfs.cn/prod/prd-img/39/80/56/00/00/02/20000568039_1.jpg
,17449,20000501934,$90,潘多拉,PANDORA,ICE CUBE PANDORA ROSE STUD EARRINGS WITH CLEAR CUBIC ZIRCONIA 耳饰,http://static.lottedfs.cn/prod/prd-img/24/80/56/00/00/02/20000568024_1.jpg
,17449,20000501926,$90,潘多拉,PANDORA,ICE CUBE SILVER RING WITH CLEAR CUBIC ZIRCONIA 戒指,http://static.lottedfs.cn/prod/prd-img/06/80/56/00/00/02/20000568006_1.jpg
,17449,20000501922,$60,潘多拉,PANDORA,BEADED SILVER RING 戒指,http://static.lottedfs.cn/prod/prd-img/98/79/56/00/00/02/20000567998_1.jpg
,17449,20000501915,$90,潘多拉,PANDORA,OPEN ICE CUBE SILVER RING WITH CLEAR CUBIC ZIRCONIA 戒指,http://static.lottedfs.cn/prod/prd-img/87/79/56/00/00/02/20000567987_1.jpg
,17449,20000495836,$75,潘多拉,PANDORA,PANDORA REFLEXIONS LOCKET SILVER CLIP CHARM 固定夹,http://static.lottedfs.cn/prod/prd-img/89/81/55/00/00/02/20000558189_1.jpg
,17449,20000495833,$45,潘多拉,PANDORA,PANDORA REFLEXIONS SILVER CLIP CHARM WITH CLEAR CUBIC ZIRCONIA 固定夹,http://static.lottedfs.cn/prod/prd-img/86/81/55/00/00/02/20000558186_1.jpg
,17449,20000495832,$45,潘多拉,PANDORA,PANDORA REFLEXIONS HEART SILVER CLIP CHARM 固定夹,http://static.lottedfs.cn/prod/prd-img/85/81/55/00/00/02/20000558185_1.jpg
,17449,20000495826,$45,潘多拉,PANDORA,PANDORA REFLEXIONS CROWN SILVER CLIP CHARM WITH CLEAR CUBIC ZIRCONIA 固定夹,http://static.lottedfs.cn/prod/prd-img/79/81/55/00/00/02/20000558179_1.jpg
,17449,20000495823,$75,潘多拉,PANDORA,PANDORA REFLEXIONS SILVER CLIP CHARM WITH CLEAR CUBIC ZIRCONIA 固定夹,http://static.lottedfs.cn/prod/prd-img/76/81/55/00/00/02/20000558176_1.jpg
,17449,20000495820,$45,潘多拉,PANDORA,PANDORA REFLEXIONS INFINITY SILVER CLIP CHARM WITH CLEAR CUBIC ZIRCONIA 固定夹,http://static.lottedfs.cn/prod/prd-img/73/81/55/00/00/02/20000558173_1.jpg
,17449,20000495818,$45,潘多拉,PANDORA,PANDORA REFLEXIONS LOVE SCRIPT SILVER CLIP CHARM 固定夹,http://static.lottedfs.cn/prod/prd-img/71/81/55/00/00/02/20000558171_1.jpg
,17449,20000495810,$60,潘多拉,PANDORA,PANDORA REFLEXIONS CLIP CHARM IN PANDORA ROSE WITH CLEAR CUBIC ZIRCONIA 固定夹,http://static.lottedfs.cn/prod/prd-img/60/81/55/00/00/02/20000558160_1.jpg
,17449,20000495806,$60,潘多拉,PANDORA,PANDORA REFLEXIONS CROWN CLIP CHARM IN PANDORA ROSE 固定夹,http://static.lottedfs.cn/prod/prd-img/54/81/55/00/00/02/20000558154_1.jpg
,17449,20000495803,$60,潘多拉,PANDORA,PANDORA REFLEXIONS BOW CLIP CHARM IN PANDORA ROSE 固定夹,http://static.lottedfs.cn/prod/prd-img/49/81/55/00/00/02/20000558149_1.jpg
,17449,20000495801,$75,潘多拉,PANDORA,PANDORA REFLEXIONS DANGLING HEART CLIP CHARM IN PANDORA SHINE 吊饰,http://static.lottedfs.cn/prod/prd-img/47/81/55/00/00/02/20000558147_1.jpg
,17449,20000495789,$75,潘多拉,PANDORA,PANDORA REFLEXIONS CLIP CHARM IN PANDORA SHINE WITH CLEAR CUBIC ZIRCONIA 固定夹,http://static.lottedfs.cn/prod/prd-img/16/81/55/00/00/02/20000558116_1.jpg
,17449,20000495783,$75,潘多拉,PANDORA,PANDORA REFLEXIONS CROWN CLIP CHARM IN PANDORA SHINE WITH CLEAR CUBIC ZIRCONIA 固定夹,http://static.lottedfs.cn/prod/prd-img/10/81/55/00/00/02/20000558110_1.jpg
,17449,20000495779,$75,潘多拉,PANDORA,PANDORA REFLEXIONS LOGO CLIP CHARM IN PANDORA SHINE 固定夹,http://static.lottedfs.cn/prod/prd-img/05/81/55/00/00/02/20000558105_1.jpg
,17449,20000495776,$105,潘多拉,PANDORA,PANDORA REFLEXIONS CLIP CHARM IN PANDORA SHINE WITH CLEAR CUBIC ZIRCONIA 固定夹,http://static.lottedfs.cn/prod/prd-img/00/81/55/00/00/02/20000558100_1.jpg
畅销,17449,20000495768,$200,潘多拉,PANDORA,PANDORA REFLEXIONS BRACELET IN PANDORA ROSE 手链,http://static.lottedfs.cn/prod/prd-img/77/80/55/00/00/02/20000558077_1.jpg
,17449,20000495734,$230,潘多拉,PANDORA,PANDORA REFLEXIONS BRACELET IN PANDORA SHINE 手链,http://static.lottedfs.cn/prod/prd-img/26/80/55/00/00/02/20000558026_1.jpg
,17449,20000493572,$155,潘多拉,PANDORA,PANDORA ROSE BRACELET WITH CLEAR CUBIC ZIRCONIA 手链,http://static.lottedfs.cn/prod/prd-img/86/41/55/00/00/02/20000554186_1.jpg
,17449,20000493565,$155,潘多拉,PANDORA,PANDORA ROSE COLLIER WITH CLEAR CUBIC ZIRCONIA 项链,http://static.lottedfs.cn/prod/prd-img/70/41/55/00/00/02/20000554170_1.jpg
,17449,20000490793,$120,潘多拉,PANDORA,ABSTRACT PANDORA SHINE CHARM WITH FACETED GOLDEN COLOURED CUBIC ZIRCONIA 串饰,http://static.lottedfs.cn/prod/prd-img/86/96/54/00/00/02/20000549686_1.jpg
,17449,20000490780,$105,潘多拉,PANDORA,SNAKE CHAIN SILVER BRACELET AND REGAL PATTERN HEART PADLOCK CLASP 手链,http://static.lottedfs.cn/prod/prd-img/52/96/54/00/00/02/20000549652_1.jpg
,17449,20000490772,$255,潘多拉,PANDORA,PANDORA ROSE SNAKE CHAIN BRACELET AND PADLOCK CLASP WITH PINK MIST AND ROYAL PURPLE CRYSTAL 手链,http://static.lottedfs.cn/prod/prd-img/35/96/54/00/00/02/20000549635_1.jpg
,17449,20000490765,$75,潘多拉,PANDORA,PANDORA ROSE STUD EARRINGS WITH CLEAR CUBIC ZIRCONIA 耳饰,http://static.lottedfs.cn/prod/prd-img/24/96/54/00/00/02/20000549624_1.jpg
,17449,20000490708,$120,潘多拉,PANDORA,PANDORA ROSE RING WITH CLEAR CUBIC ZIRCONIA 戒指,http://static.lottedfs.cn/prod/prd-img/05/95/54/00/00/02/20000549505_1.jpg
,17449,20000489498,$60,潘多拉,PANDORA,"WHEATFIELD BIRD AND MOUSE SILVER DANGLE WITH PURPLE ENAMEL, RED AND CLEAR CUBIC ZIRCONIA 串饰",http://static.lottedfs.cn/prod/prd-img/61/74/54/00/00/02/20000547461_1.jpg
,17449,20000489497,$60,潘多拉,PANDORA,INTERLOCKED CROWNED HEARTS SILVER CHARM 串饰,http://static.lottedfs.cn/prod/prd-img/60/74/54/00/00/02/20000547460_1.jpg
,17449,20000489492,$75,潘多拉,PANDORA,"LOVE KEYS SILVER DANGLE WITH PINK MIST, ROYAL PURPLE, ROYAL BLUE CRYSTAL AND RED CUBIC ZIRCONIA 串饰",http://static.lottedfs.cn/prod/prd-img/55/74/54/00/00/02/20000547455_1.jpg
,17449,20000489487,$105,潘多拉,PANDORA,SEEDS SILVER CHARM WITH GOLDEN COLOURED AND CLEAR CUBIC ZIRCONIA 串饰,http://static.lottedfs.cn/prod/prd-img/44/74/54/00/00/02/20000547444_1.jpg
,17449,20000489482,$60,潘多拉,PANDORA,CROWN SILVER CLIP WITH CLEAR CUBIC ZIRCONIA 串饰,http://static.lottedfs.cn/prod/prd-img/38/74/54/00/00/02/20000547438_1.jpg
,17449,20000489477,$45,潘多拉,PANDORA,HEART SEEDS SILVER CHARM 串饰,http://static.lottedfs.cn/prod/prd-img/32/74/54/00/00/02/20000547432_1.jpg
,17449,20000489471,$45,潘多拉,PANDORA,UNICORN SILVER CHARM 串饰,http://static.lottedfs.cn/prod/prd-img/19/74/54/00/00/02/20000547419_1.jpg
畅销,17449,20000489468,$90,潘多拉,PANDORA,HEART SILVER CHARM WITH CLEAR CUBIC ZIRCONIA 串饰,http://static.lottedfs.cn/prod/prd-img/11/74/54/00/00/02/20000547411_1.jpg
,17449,20000489466,$60,潘多拉,PANDORA,SEEDS SILVER CHARM WITH CLEAR CUBIC ZIRCONIA 串饰,http://static.lottedfs.cn/prod/prd-img/09/74/54/00/00/02/20000547409_1.jpg
,17449,20000489461,$60,潘多拉,PANDORA,SEEDS SILVER CLIP WITH CLEAR CUBIC ZIRCONIA AND PURPLE ENAMEL 串饰,http://static.lottedfs.cn/prod/prd-img/92/73/54/00/00/02/20000547392_1.jpg
,17449,20000489459,$45,潘多拉,PANDORA,FAMILY TREE SILVER CHARM 串饰,http://static.lottedfs.cn/prod/prd-img/90/73/54/00/00/02/20000547390_1.jpg
,17449,20000489457,$75,潘多拉,PANDORA,SEEDS SILVER SAFETY CHAIN CLIP AND SILICONE GRIP 安全链,http://static.lottedfs.cn/prod/prd-img/80/73/54/00/00/02/20000547380_1.jpg
,17449,20000489449,$75,潘多拉,PANDORA,BIRDCAGE OPENABLE SILVER DANGLE WITH CLEAR CUBIC ZIRCONIA 串饰,http://static.lottedfs.cn/prod/prd-img/57/73/54/00/00/02/20000547357_1.jpg
,17449,20000489423,$75,潘多拉,PANDORA,INTERLOCKED CROWNED HEARTS PANDORA ROSE CHARM 串饰,http://static.lottedfs.cn/prod/prd-img/99/72/54/00/00/02/20000547299_1.jpg
,17449,20000489391,$140,潘多拉,PANDORA,PANDORA ROSE CHARM WITH PINK MIST AND ROYAL PURPLE CRYSTAL 串饰,http://static.lottedfs.cn/prod/prd-img/01/72/54/00/00/02/20000547201_1.jpg
,17449,20000489385,$75,潘多拉,PANDORA,PANDORA ROSE CHARM WITH IRIDESCENT AND TRANSPARENT MURANO GLASS 串饰,http://static.lottedfs.cn/prod/prd-img/95/71/54/00/00/02/20000547195_1.jpg
,17449,20000489382,$105,潘多拉,PANDORA,FAMILY TREE OPENABLE PANDORA ROSE DANGLE WITH CLEAR CUBIC ZIRCONIA 串饰,http://static.lottedfs.cn/prod/prd-img/92/71/54/00/00/02/20000547192_1.jpg
,17449,20000489376,$90,潘多拉,PANDORA,SEEDS PANDORA SHINE CHARM WITH CLEAR CUBIC ZIRCONIA 串饰,http://static.lottedfs.cn/prod/prd-img/86/71/54/00/00/02/20000547186_1.jpg
,17449,20000489358,$90,潘多拉,PANDORA,SEED PANDORA SHINE DANGLE WITH CLEAR CUBIC ZIRCONIA 串饰,http://static.lottedfs.cn/prod/prd-img/68/71/54/00/00/02/20000547168_1.jpg
,17449,20000489355,$75,潘多拉,PANDORA,PANDORA SHINE CLIP AND SILICONE GRIP 串饰,http://static.lottedfs.cn/prod/prd-img/65/71/54/00/00/02/20000547165_1.jpg
,17449,20000489353,$170,潘多拉,PANDORA,ABSTRACT PANDORA SHINE CHARM WITH CLEAR AND LIGHT GOLDEN COLOURED CUBIC ZIRCONIA 串饰,http://static.lottedfs.cn/prod/prd-img/63/71/54/00/00/02/20000547163_1.jpg
,17449,20000489352,$105,潘多拉,PANDORA,SNAKE CHAIN SILVER BRACELET AND REGAL PATTERN HEART PADLOCK CLASP 手链,http://static.lottedfs.cn/prod/prd-img/62/71/54/00/00/02/20000547162_1.jpg
,17449,20000489346,$255,潘多拉,PANDORA,PANDORA ROSE SNAKE CHAIN BRACELET AND PADLOCK CLASP WITH PINK MIST AND ROYAL PURPLE CRYSTAL 手链,http://static.lottedfs.cn/prod/prd-img/56/71/54/00/00/02/20000547156_1.jpg
,17449,20000489343,$230,潘多拉,PANDORA,PANDORA ROSE OPEN BANGLE WITH SILICONE STOPPERS AND INTERCHANGEABLE END CAPS 手镯,http://static.lottedfs.cn/prod/prd-img/53/71/54/00/00/02/20000547153_1.jpg
,17449,20000489336,$230,潘多拉,PANDORA,PANDORA SHINE MESH BRACELET 手链,http://static.lottedfs.cn/prod/prd-img/43/71/54/00/00/02/20000547143_1.jpg
,17449,20000489334,$120,潘多拉,PANDORA,SEED SILVER PENDANT WITH CLEAR CUBIC ZIRCONIA AND NECKLACE 项链,http://static.lottedfs.cn/prod/prd-img/41/71/54/00/00/02/20000547141_1.jpg
,17449,20000489327,$60,潘多拉,PANDORA,REGAL PATTERN KEY SILVER PENDANT 吊坠,http://static.lottedfs.cn/prod/prd-img/34/71/54/00/00/02/20000547134_1.jpg
,17449,20000489325,$105,潘多拉,PANDORA,INTERLOCKED CROWNED HEARTS SILVER PENDANT AND NECKLACE 项链,http://static.lottedfs.cn/prod/prd-img/32/71/54/00/00/02/20000547132_1.jpg
,17449,20000489320,$120,潘多拉,PANDORA,REGAL PATTERN KEY SILVER PENDANT AND NECKLACE 项链,http://static.lottedfs.cn/prod/prd-img/27/71/54/00/00/02/20000547127_1.jpg
,17449,20000489313,$75,潘多拉,PANDORA,REGAL PATTERN KEY PANDORA ROSE PENDANT 吊坠,http://static.lottedfs.cn/prod/prd-img/20/71/54/00/00/02/20000547120_1.jpg
,17449,20000489302,$230,潘多拉,PANDORA,REGAL PATTERN KEY PANDORA ROSE PENDANT AND NECKLACE 项链,http://static.lottedfs.cn/prod/prd-img/03/71/54/00/00/02/20000547103_1.jpg
,17449,20000489294,$60,潘多拉,PANDORA,SEEDS SILVER EARRINGS 耳饰,http://static.lottedfs.cn/prod/prd-img/91/70/54/00/00/02/20000547091_1.jpg
,17449,20000489291,$75,潘多拉,PANDORA,HEART SILVER STUD EARRINGS WITH DETACHABLE EARRING JACKETS AND CLEAR CUBIC ZIRCONIA 耳饰,http://static.lottedfs.cn/prod/prd-img/85/70/54/00/00/02/20000547085_1.jpg
,17449,20000489288,$60,潘多拉,PANDORA,REGAL PATTERN HEART SILVER STUD EARRINGS 耳饰,http://static.lottedfs.cn/prod/prd-img/80/70/54/00/00/02/20000547080_1.jpg
,17449,20000489287,$90,潘多拉,PANDORA,SILVER OVAL HOOP EARRINGS WITH CLEAR CUBIC ZIRCONIA 耳饰,http://static.lottedfs.cn/prod/prd-img/79/70/54/00/00/02/20000547079_1.jpg
,17449,20000489285,$75,潘多拉,PANDORA,HEART SILVER HOOP EARRINGS WITH CLEAR CUBIC ZIRCONIA 耳饰,http://static.lottedfs.cn/prod/prd-img/77/70/54/00/00/02/20000547077_1.jpg
,17449,20000489185,$90,潘多拉,PANDORA,HEARTS PANDORA ROSE HOOP EARRINGS 耳饰,http://static.lottedfs.cn/prod/prd-img/31/69/54/00/00/02/20000546931_1.jpg
,17449,20000489182,$120,潘多拉,PANDORA,PANDORA ROSE STUD EARRINGS WITH DETACHABLE EARRING JACKETS AND CLEAR CUBIC ZIRCONIA 耳饰,http://static.lottedfs.cn/prod/prd-img/26/69/54/00/00/02/20000546926_1.jpg
,17449,20000489170,$90,潘多拉,PANDORA,TIARA WISHBONE SILVER RING WITH CLEAR CUBIC ZIRCONIA 戒指,http://static.lottedfs.cn/prod/prd-img/01/69/54/00/00/02/20000546901_1.jpg
,17449,20000489019,$90,潘多拉,PANDORA,HEARTS SILVER RING WITH CLEAR CUBIC ZIRCONIA 戒指,http://static.lottedfs.cn/prod/prd-img/25/65/54/00/00/02/20000546525_1.jpg
,17449,20000489013,$60,潘多拉,PANDORA,REGAL PATTERN SILVER RING 戒指,http://static.lottedfs.cn/prod/prd-img/05/65/54/00/00/02/20000546505_1.jpg
,17449,20000489002,$90,潘多拉,PANDORA,CROWN SILVER RING WITH CLEAR CUBIC ZIRCONIA AND BLACK CRYSTAL 戒指,http://static.lottedfs.cn/prod/prd-img/90/64/54/00/00/02/20000546490_1.jpg
,17449,20000488995,$75,潘多拉,PANDORA,ZIGZAG PANDORA ROSE RING 戒指,http://static.lottedfs.cn/prod/prd-img/77/64/54/00/00/02/20000546477_1.jpg
,17449,20000488974,$75,潘多拉,PANDORA,INTERLOCKED CROWNED HEARTS PANDORA ROSE RING 戒指,http://static.lottedfs.cn/prod/prd-img/43/64/54/00/00/02/20000546443_1.jpg
,17449,20000488906,$120,潘多拉,PANDORA,PANDORA SHINE TIARA RING WITH CLEAR CUBIC ZIRCONIA 戒指,http://static.lottedfs.cn/prod/prd-img/29/63/54/00/00/02/20000546329_1.jpg
,17449,20000475261,$165,潘多拉,PANDORA,SILVER LEATHER BRACELET WITH SILVER DANGLE 手链,http://static.lottedfs.cn/prod/prd-img/68/47/52/00/00/02/20000524768_1.jpg
,17449,20000474726,$45,潘多拉,PANDORA,LETTER Z SILVER CHARM 串饰,http://static.lottedfs.cn/prod/prd-img/95/39/52/00/00/02/20000523995_1.jpg
,17449,20000474722,$45,潘多拉,PANDORA,LETTER X SILVER CHARM 串饰,http://static.lottedfs.cn/prod/prd-img/87/39/52/00/00/02/20000523987_1.jpg
,17449,20000474721,$45,潘多拉,PANDORA,LETTER W SILVER CHARM 串饰,http://static.lottedfs.cn/prod/prd-img/86/39/52/00/00/02/20000523986_1.jpg
,17449,20000474720,$45,潘多拉,PANDORA,LETTER V SILVER CHARM 串饰,http://static.lottedfs.cn/prod/prd-img/85/39/52/00/00/02/20000523985_1.jpg
,17449,20000474717,$45,潘多拉,PANDORA,LETTER U SILVER CHARM 串饰,http://static.lottedfs.cn/prod/prd-img/78/39/52/00/00/02/20000523978_1.jpg
,17449,20000474714,$45,潘多拉,PANDORA,LETTER S SILVER CHARM 串饰,http://static.lottedfs.cn/prod/prd-img/75/39/52/00/00/02/20000523975_1.jpg
,17449,20000474711,$45,潘多拉,PANDORA,LETTER R SILVER CHARM 串饰,http://static.lottedfs.cn/prod/prd-img/72/39/52/00/00/02/20000523972_1.jpg
,17449,20000474709,$45,潘多拉,PANDORA,LETTER Q SILVER CHARM 串饰,http://static.lottedfs.cn/prod/prd-img/68/39/52/00/00/02/20000523968_1.jpg
,17449,20000474704,$45,潘多拉,PANDORA,LETTER N SILVER CHARM 串饰,http://static.lottedfs.cn/prod/prd-img/61/39/52/00/00/02/20000523961_1.jpg
,17449,20000474701,$45,潘多拉,PANDORA,LETTER M SILVER CHARM 串饰,http://static.lottedfs.cn/prod/prd-img/57/39/52/00/00/02/20000523957_1.jpg
,17449,20000474699,$45,潘多拉,PANDORA,LETTER L SILVER CHARM 串饰,http://static.lottedfs.cn/prod/prd-img/52/39/52/00/00/02/20000523952_1.jpg
,17449,20000474696,$45,潘多拉,PANDORA,LETTER J SILVER CHARM  串饰,http://static.lottedfs.cn/prod/prd-img/49/39/52/00/00/02/20000523949_1.jpg
,17449,20000474694,$45,潘多拉,PANDORA,LETTER I SILVER CHARM 串饰,http://static.lottedfs.cn/prod/prd-img/47/39/52/00/00/02/20000523947_1.jpg
,17449,20000474682,$45,潘多拉,PANDORA,LETTER G SILVER CHARM 串饰,http://static.lottedfs.cn/prod/prd-img/32/39/52/00/00/02/20000523932_1.jpg
,17449,20000474676,$45,潘多拉,PANDORA,LETTER F SILVER CHARM 串饰,http://static.lottedfs.cn/prod/prd-img/23/39/52/00/00/02/20000523923_1.jpg
,17449,20000474674,$45,潘多拉,PANDORA,LETTER E SILVER CHARM 串饰,http://static.lottedfs.cn/prod/prd-img/21/39/52/00/00/02/20000523921_1.jpg
,17449,20000474671,$45,潘多拉,PANDORA,LETTER D SILVER CHARM 串饰,http://static.lottedfs.cn/prod/prd-img/18/39/52/00/00/02/20000523918_1.jpg
,17449,20000474658,$45,潘多拉,PANDORA,LETTER A SILVER CHARM 串饰,http://static.lottedfs.cn/prod/prd-img/94/38/52/00/00/02/20000523894_1.jpg
,17449,20000474647,$75,潘多拉,PANDORA,PANDORA LOGO SILVER SPINNING DANGLE WITH CLEAR CUBIC ZIRCONIA 串饰,http://static.lottedfs.cn/prod/prd-img/83/38/52/00/00/02/20000523883_2.jpg
,17449,20000474646,$75,潘多拉,PANDORA,HEARTS SILVER SPACER WITH CLEAR CUBIC ZIRCONIA 串饰,http://static.lottedfs.cn/prod/prd-img/82/38/52/00/00/02/20000523882_1.jpg
,17449,20000474573,$105,潘多拉,PANDORA,PANDORA SHINE LOGO CLIP WITH CLEAR CUBIC ZIRCONIA AND SILICONE GRIP 串饰,http://static.lottedfs.cn/prod/prd-img/74/37/52/00/00/02/20000523774_1.jpg
,17449,20000474572,$105,潘多拉,PANDORA,HEARTS PANDORA SHINE SPACER WITH CLEAR CUBIC ZIRCONIA  串饰,http://static.lottedfs.cn/prod/prd-img/73/37/52/00/00/02/20000523773_1.jpg
,17449,20000474570,$90,潘多拉,PANDORA,PANDORA SHINE CROWN O CHARM 串饰,http://static.lottedfs.cn/prod/prd-img/71/37/52/00/00/02/20000523771_1.jpg
,17449,20000474565,$105,潘多拉,PANDORA,PANDORA SHINE LOGO HEART CHARM WITH CLEAR CUBIC ZIRCONIA 串饰,http://static.lottedfs.cn/prod/prd-img/64/37/52/00/00/02/20000523764_1.jpg
,17449,20000474563,$140,潘多拉,PANDORA,PANDORA LOGO SPINNING SILVER PENDANT WITH CLEAR CUBIC ZIRCONIA AND CHAIN 项链,http://static.lottedfs.cn/prod/prd-img/62/37/52/00/00/02/20000523762_1.jpg
,17449,20000474562,$60,潘多拉,PANDORA,PANDORA LOGO SILVER HEART PENDANT WITH CLEAR CUBIC ZIRCONIA 吊坠,http://static.lottedfs.cn/prod/prd-img/61/37/52/00/00/02/20000523761_1.jpg
,17449,20000474560,$75,潘多拉,PANDORA,PANDORA ROSE LOGO HEART PENDANT WITH CLEAR CUBIC ZIRCONIA 吊坠,http://static.lottedfs.cn/prod/prd-img/56/37/52/00/00/02/20000523756_1.jpg
,17449,20000474559,$90,潘多拉,PANDORA,PANDORA SHINE LOGO HEART PENDANT WITH CLEAR CUBIC ZIRCONIA 吊坠,http://static.lottedfs.cn/prod/prd-img/54/37/52/00/00/02/20000523754_1.jpg
,17449,20000474556,$75,潘多拉,PANDORA,PANDORA LOGO HEART SILVER STUD EARRINGS WITH CLEAR CUBIC ZIRCONIA 耳饰,http://static.lottedfs.cn/prod/prd-img/51/37/52/00/00/02/20000523751_1.jpg
,17449,20000474554,$105,潘多拉,PANDORA,PANDORA SHINE LOGO HEART STUD EARRINGS WITH CLEAR CUBIC ZIRCONIA 耳饰,http://static.lottedfs.cn/prod/prd-img/47/37/52/00/00/02/20000523747_1.jpg
,17449,20000474553,$105,潘多拉,PANDORA,PANDORA SHINE LOGO STUD EARRINGS WITH CLEAR CUBIC ZIRCONIA 耳饰,http://static.lottedfs.cn/prod/prd-img/46/37/52/00/00/02/20000523746_1.jpg
,17449,20000474552,$45,潘多拉,PANDORA,MODERN LOVEPODS SILVER SPACER WITH CLEAR CUBIC ZIRCONIA 串饰,http://static.lottedfs.cn/prod/prd-img/45/37/52/00/00/02/20000523745_1.jpg
,17449,20000474551,$50,潘多拉,PANDORA,MODERN LOVEPODS PANDORA ROSE SPACER WITH CLEAR CUBIC ZIRCONIA 串饰,http://static.lottedfs.cn/prod/prd-img/44/37/52/00/00/02/20000523744_1.jpg
,17449,20000474550,$60,潘多拉,PANDORA,MODERN LOVEPODS PANDORA SHINE SPACER WITH CLEAR CUBIC ZIRCONIA 串饰,http://static.lottedfs.cn/prod/prd-img/43/37/52/00/00/02/20000523743_1.jpg
,17449,20000474549,$60,潘多拉,PANDORA,MODERN LOVEPOD SILVER PENDANT WITH CLEAR CUBIC ZIRCONIA 吊坠,http://static.lottedfs.cn/prod/prd-img/42/37/52/00/00/02/20000523742_1.jpg
,17449,20000474548,$75,潘多拉,PANDORA,MODERN LOVEPOD PANDORA ROSE PENDANT WITH CLEAR CUBIC ZIRCONIA 吊坠,http://static.lottedfs.cn/prod/prd-img/41/37/52/00/00/02/20000523741_1.jpg
,17449,20000474547,$90,潘多拉,PANDORA,MODERN LOVEPOD PANDORA SHINE PENDANT WITH CLEAR CUBIC ZIRCONIA 吊坠,http://static.lottedfs.cn/prod/prd-img/40/37/52/00/00/02/20000523740_1.jpg
,17449,20000474334,$140,潘多拉,PANDORA,PANDORA LOGO SILVER Y NECKLACE WITH CLEAR CUBIC ZIRCONIA 项链,http://static.lottedfs.cn/prod/prd-img/62/34/52/00/00/02/20000523462_1.jpg
,17449,20000474324,$120,潘多拉,PANDORA,PANDORA LOGO REVERSIBLE SILVER COLLIER WITH CLEAR CUBIC ZIRCONIA 项链,http://static.lottedfs.cn/prod/prd-img/23/34/52/00/00/02/20000523423_1.jpg
,17449,20000474312,$105,潘多拉,PANDORA,MODERN LOVEPODS PANDORA ROSE RING WITH CLEAR CUBIC ZIRCONIA 戒指,http://static.lottedfs.cn/prod/prd-img/80/33/52/00/00/02/20000523380_1.jpg
畅销,17449,20000474305,$200,潘多拉,PANDORA,PANDORA ROSE MESH BRACELET 手链,http://static.lottedfs.cn/prod/prd-img/51/33/52/00/00/02/20000523351_1.jpg
,17449,20000474301,$105,潘多拉,PANDORA,PANDORA LOGO SILVER RING WITH CLEAR CUBIC ZIRCONIA 戒指,http://static.lottedfs.cn/prod/prd-img/34/33/52/00/00/02/20000523334_1.jpg
畅销,17449,20000474281,$75,潘多拉,PANDORA,PANDORA LOGO PADLOCK SILVER RING WITH CLEAR CUBIC ZIRCONIA 戒指,http://static.lottedfs.cn/prod/prd-img/90/32/52/00/00/02/20000523290_1.jpg
,17449,20000474277,$55,潘多拉,PANDORA,PANDORA LOGO HEART SILVER RING 戒指,http://static.lottedfs.cn/prod/prd-img/73/32/52/00/00/02/20000523273_1.jpg
,17449,20000474271,$75,潘多拉,PANDORA,PANDORA SHINE LOGO HEART RING 戒指,http://static.lottedfs.cn/prod/prd-img/46/32/52/00/00/02/20000523246_1.jpg
,17449,20000474258,$90,潘多拉,PANDORA,MODERN LOVEPODS SILVER RING WITH CLEAR CUBIC ZIRCONIA 戒指,http://static.lottedfs.cn/prod/prd-img/97/31/52/00/00/02/20000523197_1.jpg
,17449,20000474239,$120,潘多拉,PANDORA,MODERN LOVEPODS PANDORA SHINE RING WITH CLEAR CUBIC ZIRCONIA 戒指,http://static.lottedfs.cn/prod/prd-img/40/31/52/00/00/02/20000523140_1.jpg
,17449,20000460553,$90,潘多拉,PANDORA,HEART SILVER CLIP WITH MIXED COLOURS OF CRYSTALS AND CUBIC ZIRCONIA  串饰,http://static.lottedfs.cn/prod/prd-img/62/35/50/00/00/02/20000503562_1.jpg
,17449,20000460537,$60,潘多拉,PANDORA,SAN FRANCISCO SILVER DANGLE WITH RED ENAMEL 吊坠,http://static.lottedfs.cn/prod/prd-img/43/35/50/00/00/02/20000503543_1.jpg
,17449,20000460536,$75,潘多拉,PANDORA,POPCORN SILVER CHARM WITH WHITE CRYSTAL PEARL AND PINK ENAMEL 串饰,http://static.lottedfs.cn/prod/prd-img/42/35/50/00/00/02/20000503542_1.jpg
,17449,20000460528,$45,潘多拉,PANDORA,SILVER DANGLE WITH PINK TASSEL 串饰,http://static.lottedfs.cn/prod/prd-img/30/35/50/00/00/02/20000503530_1.jpg
,17449,20000460512,$60,潘多拉,PANDORA,ANCHOR SILVER DANGLE WITH SILVER AND RED ENAMEL AND WHITE CRYSTAL PEARL  串饰,http://static.lottedfs.cn/prod/prd-img/08/35/50/00/00/02/20000503508_1.jpg
,17449,20000460478,$60,潘多拉,PANDORA,COMPASS ROSE SILVER ANGLE WITH SILVER ENAMEL AND CYAN BLUE CRYSTAL 串饰,http://static.lottedfs.cn/prod/prd-img/77/34/50/00/00/02/20000503477_1.jpg
,17449,20000460476,$60,潘多拉,PANDORA,PLAYING CARDS SILVER CHARM WITH RED ENAMEL 串饰,http://static.lottedfs.cn/prod/prd-img/75/34/50/00/00/02/20000503475_1.jpg
,17449,20000460462,$75,潘多拉,PANDORA,"SILVER CHARM WITH MOTHER OF PEARL MOSAIC IN PURPLE, PINK, YELLOW, GREEN AND BLUE 串饰",http://static.lottedfs.cn/prod/prd-img/61/34/50/00/00/02/20000503461_1.jpg
,17449,20000460429,$60,潘多拉,PANDORA,HEART SILVER CHARM WITH ORANGE CUBIC ZIRCONIA  串饰,http://static.lottedfs.cn/prod/prd-img/25/34/50/00/00/02/20000503425_1.jpg
,17449,20000460423,$60,潘多拉,PANDORA,HEART SILVER CHARM WITH SCUBA BLUE CRYSTAL  串饰,http://static.lottedfs.cn/prod/prd-img/19/34/50/00/00/02/20000503419_1.jpg
,17449,20000460420,$90,潘多拉,PANDORA,ABSTRACT SILVER CHARM WITH MIXED OF COLOURS OF CRYSTALS AND CUBIC ZIRCONIA  串饰,http://static.lottedfs.cn/prod/prd-img/16/34/50/00/00/02/20000503416_1.jpg
,17449,20000460415,$90,潘多拉,PANDORA,HEART PANDORA SHINE CHARM WITH CLEAR CUBIC ZIRCONIA  串饰,http://static.lottedfs.cn/prod/prd-img/09/34/50/00/00/02/20000503409_1.jpg
,17449,20000460408,$75,潘多拉,PANDORA,LOVE YOU MORE PANDORA SHINE AND SILVER SPLIT DANGLE WITH CLEAR CUBIC ZIRCONIA  串饰,http://static.lottedfs.cn/prod/prd-img/02/34/50/00/00/02/20000503402_1.jpg
,17449,20000460405,$90,潘多拉,PANDORA,PANDORA SHINE CLIP WITH SUNSHINE YELLOW AND CLEAR CUBIC ZIRCONIA 固定夹,http://static.lottedfs.cn/prod/prd-img/99/33/50/00/00/02/20000503399_1.jpg
,17449,20000460395,$120,潘多拉,PANDORA,BEEHIVE PANDORA SHINE DANGLE WITH TIGER EYE AND CLEAR CUBIC ZIRCONIA  串饰,http://static.lottedfs.cn/prod/prd-img/89/33/50/00/00/02/20000503389_1.jpg
,17449,20000460342,$75,潘多拉,PANDORA,"SILVER LEATHER BRACELET, DOUBLE, TURQUOISE AND CLEAR CUBIC ZIRCONIA 手链",http://static.lottedfs.cn/prod/prd-img/23/33/50/00/00/02/20000503323_1.jpg
,17449,20000460329,$230,潘多拉,PANDORA,SNAKE CHAIN PANDORA SHINE BRACELET 手链,http://static.lottedfs.cn/prod/prd-img/09/33/50/00/00/02/20000503309_1.jpg
,17449,20000460325,$60,潘多拉,PANDORA,HEART SILVER PENDANT WITH CLEAR CUBIC ZIRCONIA  吊坠,http://static.lottedfs.cn/prod/prd-img/04/33/50/00/00/02/20000503304_1.jpg
,17449,20000460321,$75,潘多拉,PANDORA,FEATHER PENDANT AND CHOKER WITH GOLDEN TAN LEATHER AND PINK CUBIC ZIRCONIA  颈链,http://static.lottedfs.cn/prod/prd-img/99/32/50/00/00/02/20000503299_1.jpg
,17449,20000460316,$75,潘多拉,PANDORA,HEART PANDORA ROSE PENDANT WITH CLEAR CUBIC ZIRCONIA 吊坠,http://static.lottedfs.cn/prod/prd-img/94/32/50/00/00/02/20000503294_1.jpg
,17449,20000460313,$55,潘多拉,PANDORA,HEART SILVER STUD EARRINGS WITH CLEAR CUBIC ZIRCONIA 耳饰,http://static.lottedfs.cn/prod/prd-img/90/32/50/00/00/02/20000503290_1.jpg
