tag,brand_No,product_No,us_price,brand_name_chn,brand_name_eng,product_name,img_url
畅销,16152,20000448603,$107,瑞克朵丝,LOUIS QUATORZE,MENS BIFOLD HALF WALLET SM2NH18MF5STG  短款钱包,http://static.lottedfs.cn/prod/prd-img/49/71/48/00/00/02/20000487149_1.JPG
畅销,16152,10001630213,$102,瑞克朵丝,LOUIS QUATORZE,BH1AH01MH0BL 男士自动正装腰带,http://static.lottedfs.cn/prod/prd-img/13/02/63/01/00/01/10001630213_5.jpg
,16152,10000187488,$95,瑞克朵丝,LOUIS QUATORZE,MENS BELT  BG1TH02MH0BL 男士自动正装腰带,http://static.lottedfs.cn/prod/prd-img/88/74/18/00/00/01/10000187488_6.jpg
,16152,20000194813,$148,瑞克朵丝,LOUIS QUATORZE,WOMENS HALF WALLET  3折短款钱包,http://static.lottedfs.cn/prod/prd-img/77/32/20/00/00/02/20000203277_8.jpg
畅销,16152,20000444411,$122,瑞克朵丝,LOUIS QUATORZE,MENS BIFOLD HALF WALLET SM2NH02MF5NA   男士短款钱包,http://static.lottedfs.cn/prod/prd-img/00/06/48/00/00/02/20000480600_1.JPG
畅销,16152,20000611947,$163,瑞克朵丝,LOUIS QUATORZE,WOMENS TRIFOLD MINI WALLET SN4DL07FF6BL 女士迷你钱包,http://static.lottedfs.cn/prod/prd-img/56/87/74/00/00/02/20000748756_1.JPG
畅销,16152,20000194767,$120,瑞克朵丝,LOUIS QUATORZE,MENS BIFOLD HALF WALLET 男士短款钱包  (GRAY),http://static.lottedfs.cn/prod/prd-img/31/32/20/00/00/02/20000203231_9.jpg
畅销,16152,10001630191,$98,瑞克朵丝,LOUIS QUATORZE,Money Clip 钱夹,http://static.lottedfs.cn/prod/prd-img/91/01/63/01/00/01/10001630191_6.jpg
,16152,20000616008,$111,瑞克朵丝,LOUIS QUATORZE,MENS BIFOLD HALF WALLET SN3DL13MF5NA 男士短款钱包,http://static.lottedfs.cn/prod/prd-img/13/65/75/00/00/02/20000756513_1.JPG
,16152,20000611778,$111,瑞克朵丝,LOUIS QUATORZE,MENS BIFOLD MINI WALLET SN3DL23MF7NA 男士迷你钱包,http://static.lottedfs.cn/prod/prd-img/32/84/74/00/00/02/20000748432_1.JPG
畅销,16152,20000605226,$388,瑞克朵丝,LOUIS QUATORZE,WOMENS ONE SHOULDER HN3SD94FA0BL 女士单肩包,http://static.lottedfs.cn/prod/prd-img/95/66/73/00/00/02/20000736695_1.JPG
畅销,16152,20000588343,$171,瑞克朵丝,LOUIS QUATORZE,WOMENS TRIFOLD HALF WALLET SN3DL33FF4BL 女士短款钱包,http://static.lottedfs.cn/prod/prd-img/85/38/70/00/00/02/20000703885_1.JPG
,16152,20000588193,$171,瑞克朵丝,LOUIS QUATORZE,WOMENS CLUTCH HN3FM06FA8BL 女士手拿包,http://static.lottedfs.cn/prod/prd-img/82/36/70/00/00/02/20000703682_1.JPG
畅销,16152,20000558212,$115,瑞克朵丝,LOUIS QUATORZE,WOMENS TRIFOLD HALF WALLET SN1SD02FF4GA 女士短款钱包,http://static.lottedfs.cn/prod/prd-img/34/87/65/00/00/02/20000658734_1.JPG
,16152,20000557476,$96,瑞克朵丝,LOUIS QUATORZE,WOMENS BUSINESS CARD WALLET SN1DL15FI0BL 女士名片夹,http://static.lottedfs.cn/prod/prd-img/52/74/65/00/00/02/20000657452_1.JPG
,16152,20000426475,$122,瑞克朵丝,LOUIS QUATORZE,MENS BIFOLD HALF WALLET SM1TH17MF5STG 2折短款钱包,http://static.lottedfs.cn/prod/prd-img/58/98/44/00/00/02/20000449858_1.JPG
畅销,16152,20000194725,$201,瑞克朵丝,LOUIS QUATORZE,WOMANS TRIFOLD HALF WALLET SI4AL08FF4BL 女士短款钱包,http://static.lottedfs.cn/prod/prd-img/89/31/20/00/00/02/20000203189_8.jpg
畅销,16152,20000192980,$120,瑞克朵丝,LOUIS QUATORZE,WOMENS BIFOLD HALF WALLET SK3AL07FF5BL 短款钱包,http://static.lottedfs.cn/prod/prd-img/36/10/20/00/00/02/20000201036_7.JPG
,16152,10002330716,$370,瑞克朵丝,LOUIS QUATORZE,WOMANS BAG HK3CB02FA1BL 女士包,http://static.lottedfs.cn/prod/prd-img/16/07/33/02/00/01/10002330716_1.JPG
,16152,10002221822,$108,瑞克朵丝,LOUIS QUATORZE,MEN'S BELT  男士腰带,http://static.lottedfs.cn/prod/prd-img/22/18/22/02/00/01/10002221822_5.jpg
,16152,10001441684,$80,瑞克朵丝,LOUIS QUATORZE,名片包（BLACK),http://static.lottedfs.cn/prod/prd-img/84/16/44/01/00/01/10001441684_5.jpg
畅销,16152,20000635320,$208,瑞克朵丝,LOUIS QUATORZE,WOMENS TRIFOLD LONG WALLET SN4FM11FF0BL 3折长款钱包,http://static.lottedfs.cn/prod/prd-img/74/40/78/00/00/02/20000784074_1.JPG
,16152,20000635315,$111,瑞克朵丝,LOUIS QUATORZE,MENS BIFOLD HALF WALLET SN4DL18MF5BR 男士短款钱包,http://static.lottedfs.cn/prod/prd-img/61/40/78/00/00/02/20000784061_1.JPG
,16152,20000635306,$118,瑞克朵丝,LOUIS QUATORZE,MENS BIFOLD HALF WALLET SN4DL13MF5BR 男士短款钱包,http://static.lottedfs.cn/prod/prd-img/52/40/78/00/00/02/20000784052_1.JPG
,16152,20000635300,$70,瑞克朵丝,LOUIS QUATORZE,MENS BUSINESS CARD WALLET SN4DL07MI0NA 男士名片包,http://static.lottedfs.cn/prod/prd-img/46/40/78/00/00/02/20000784046_1.JPG
,16152,20000635299,$118,瑞克朵丝,LOUIS QUATORZE,MENS BIFOLD HALF WALLET SN4DL06MF5NA 男士短款钱包,http://static.lottedfs.cn/prod/prd-img/45/40/78/00/00/02/20000784045_1.JPG
,16152,20000635289,$212,瑞克朵丝,LOUIS QUATORZE,MENS CLUTCH MN3DL07MDABL 男式手拿包,http://static.lottedfs.cn/prod/prd-img/19/40/78/00/00/02/20000784019_1.JPG
,16152,20000635285,$336,瑞克朵丝,LOUIS QUATORZE,WOMENS CROSSBODY HN4PM24FA9BL 女士斜挎包,http://static.lottedfs.cn/prod/prd-img/15/40/78/00/00/02/20000784015_1.JPG
畅销,16152,20000635278,$448,瑞克朵丝,LOUIS QUATORZE,WOMENS TOTE HN4PM21FA4BL 女士手提包,http://static.lottedfs.cn/prod/prd-img/00/40/78/00/00/02/20000784000_1.JPG
,16152,20000635276,$257,瑞克朵丝,LOUIS QUATORZE,WOMENS TOTE HN4PM16FA4BL 女士手提包,http://static.lottedfs.cn/prod/prd-img/98/39/78/00/00/02/20000783998_1.JPG
畅销,16152,20000635272,$448,瑞克朵丝,LOUIS QUATORZE,WOMENS TWO SHOULDER HN4PM11FA1TP 女士双背带单肩包,http://static.lottedfs.cn/prod/prd-img/86/39/78/00/00/02/20000783986_1.JPG
,16152,20000621975,$88,瑞克朵丝,LOUIS QUATORZE,WOMENS ZIP AROUND HALF WALLET SN3DL36FG2PI 女士拉链短款钱包,http://static.lottedfs.cn/prod/prd-img/35/52/76/00/00/02/20000765235_1.JPG
,16152,20000611939,$118,瑞克朵丝,LOUIS QUATORZE,WOMENS BIFOLD LONG WALLET SN3DL27FF1BL 女士长款钱包,http://static.lottedfs.cn/prod/prd-img/35/87/74/00/00/02/20000748735_1.JPG
,16152,20000611819,$85,瑞克朵丝,LOUIS QUATORZE,MENS CARD WALLET SN3DL25MI1BL 男士卡包,http://static.lottedfs.cn/prod/prd-img/26/85/74/00/00/02/20000748526_1.JPG
,16152,20000611814,$66,瑞克朵丝,LOUIS QUATORZE,MENS CARD WALLET SN3DL16MI1BR 男士卡包,http://static.lottedfs.cn/prod/prd-img/09/85/74/00/00/02/20000748509_1.JPG
,16152,20000611801,$126,瑞克朵丝,LOUIS QUATORZE,MENS BIFOLD LONG WALLET SN3DL21MF1NA 男士长款钱包,http://static.lottedfs.cn/prod/prd-img/77/84/74/00/00/02/20000748477_1.JPG
,16152,20000611782,$111,瑞克朵丝,LOUIS QUATORZE,MENS BIFOLD HALF WALLET SN3DL13MF5BL 男士短款钱包,http://static.lottedfs.cn/prod/prd-img/36/84/74/00/00/02/20000748436_1.JPG
,16152,20000611773,$298,瑞克朵丝,LOUIS QUATORZE,MENS MESSENGER MN4DL01MD2BL 男士斜挎包,http://static.lottedfs.cn/prod/prd-img/27/84/74/00/00/02/20000748427_1.JPG
,16152,20000611765,$321,瑞克朵丝,LOUIS QUATORZE,WOMENS SATCHEL HN4FM01FB3BL 女士手提包,http://static.lottedfs.cn/prod/prd-img/13/84/74/00/00/02/20000748413_1.JPG
畅销,16152,20000611763,$380,瑞克朵丝,LOUIS QUATORZE,WOMENS SATCHEL HN4DL26FB3GA 女士手提包,http://static.lottedfs.cn/prod/prd-img/11/84/74/00/00/02/20000748411_1.JPG
,16152,20000605235,$126,瑞克朵丝,LOUIS QUATORZE,MENS BIFOLD LONG WALLET SN3DL26MF1BL 男士长款钱包,http://static.lottedfs.cn/prod/prd-img/04/67/73/00/00/02/20000736704_1.JPG
,16152,20000605225,$328,瑞克朵丝,LOUIS QUATORZE,WOMENS TOTE HN3SD93FA4BL 女士手提包,http://static.lottedfs.cn/prod/prd-img/94/66/73/00/00/02/20000736694_1.JPG
,16152,20000597190,$133,瑞克朵丝,LOUIS QUATORZE,WOMENS BIFOLD WALLET SN3FM05FF5BL 女士钱包,http://static.lottedfs.cn/prod/prd-img/79/94/71/00/00/02/20000719479_1.JPG
,16152,20000597119,$291,瑞克朵丝,LOUIS QUATORZE,WOMENS CROSSBODY HN3DL21FA9BL 斜挎包,http://static.lottedfs.cn/prod/prd-img/77/93/71/00/00/02/20000719377_1.JPG
,16152,20000592006,$186,瑞克朵丝,LOUIS QUATORZE,WOMENS TRIFOLD MEDIUM WALLET SN3FM03FF2RE 中款钱包,http://static.lottedfs.cn/prod/prd-img/80/99/70/00/00/02/20000709980_1.JPG
,16152,20000588346,$133,瑞克朵丝,LOUIS QUATORZE,WOMENS BIFOLD HALF WALLET SN3DL34FF5BL 女士短款钱包,http://static.lottedfs.cn/prod/prd-img/88/38/70/00/00/02/20000703888_1.JPG
,16152,20000588326,$55,瑞克朵丝,LOUIS QUATORZE,MENS CARD WALLET SN3DL08MI1GA 男士卡包,http://static.lottedfs.cn/prod/prd-img/28/38/70/00/00/02/20000703828_1.JPG
畅销,16152,20000581095,$103,瑞克朵丝,LOUIS QUATORZE,MENS CARD WALLET SN1AT04MI1NA 男士卡包,http://static.lottedfs.cn/prod/prd-img/31/17/69/00/00/02/20000691731_1.JPG
,16152,20000558128,$163,瑞克朵丝,LOUIS QUATORZE,WOMENS LUCKY BUCKET BAG HN1SD06FB8BL 单肩包,http://static.lottedfs.cn/prod/prd-img/31/86/65/00/00/02/20000658631_1.JPG
畅销,16152,20000557486,$186,瑞克朵丝,LOUIS QUATORZE,WOMENS TRIFOLD MEDIUM WALLET SN1DL17FF2BL 女士中款钱包,http://static.lottedfs.cn/prod/prd-img/80/74/65/00/00/02/20000657480_1.JPG
,16152,20000546320,$223,瑞克朵丝,LOUIS QUATORZE,WOMENS SHOPPER HN1SD93FA5BL 单肩包,http://static.lottedfs.cn/prod/prd-img/53/72/63/00/00/02/20000637253_1.JPG
畅销,16152,20000545861,$133,瑞克朵丝,LOUIS QUATORZE,WOMENS BIFOLD HALF WALLET SN1DL14FF5BL 短款钱包,http://static.lottedfs.cn/prod/prd-img/22/61/63/00/00/02/20000636122_1.JPG
,16152,20000545847,$156,瑞克朵丝,LOUIS QUATORZE,WOMENS BIFOLD MEDIUM WALLET SN1DL12FF3RE 中款钱包,http://static.lottedfs.cn/prod/prd-img/07/61/63/00/00/02/20000636107_1.JPG
畅销,16152,20000545812,$171,瑞克朵丝,LOUIS QUATORZE,WOMENS BIFOLD LONG WALLET SN1DL11FF1BL 长款钱包,http://static.lottedfs.cn/prod/prd-img/54/60/63/00/00/02/20000636054_1.JPG
,16152,20000535872,$103,瑞克朵丝,LOUIS QUATORZE,MENS AUTOMATIC DRESS BELT BN1FM10MH0BL 腰带,http://static.lottedfs.cn/prod/prd-img/93/87/61/00/00/02/20000618793_1.JPG
,16152,20000532871,$66,瑞克朵丝,LOUIS QUATORZE,WOMENS CARD WALLET SN1DL07FI1BU 卡包,http://static.lottedfs.cn/prod/prd-img/84/35/61/00/00/02/20000613584_1.JPG
,16152,20000532287,$111,瑞克朵丝,LOUIS QUATORZE,MENS BIFOLD MEDIUM WALLET SN1DL17MF3BL 男士短款钱包,http://static.lottedfs.cn/prod/prd-img/06/24/61/00/00/02/20000612406_1.JPG
,16152,20000531515,$223,瑞克朵丝,LOUIS QUATORZE,WOMENS ONE SHOULDER HN1AT12FA0BL 单肩包,http://static.lottedfs.cn/prod/prd-img/58/08/61/00/00/02/20000610858_1.JPG
畅销,16152,20000529241,$193,瑞克朵丝,LOUIS QUATORZE,MENS BRIEFCASE MN1FM03MD0BL 男士公文包,http://static.lottedfs.cn/prod/prd-img/81/71/60/00/00/02/20000607181_1.JPG
,16152,20000529200,$107,瑞克朵丝,LOUIS QUATORZE,MENS DRESS BELT（VISIO） BN1DL03MH2BL 男士腰带 手动调节,http://static.lottedfs.cn/prod/prd-img/25/71/60/00/00/02/20000607125_1.JPG
,16152,20000529172,$103,瑞克朵丝,LOUIS QUATORZE,MENS DRESS BELT (VISIO) BN1DL01MH2BR 男款腰带 手动调节,http://static.lottedfs.cn/prod/prd-img/31/70/60/00/00/02/20000607031_6.JPG
,16152,20000529170,$103,瑞克朵丝,LOUIS QUATORZE,MENS DRESS BELT（VISIO）BN1DL01MH2BL 男士腰带 手动调节,http://static.lottedfs.cn/prod/prd-img/29/70/60/00/00/02/20000607029_1.JPG
畅销,16152,20000510279,$178,瑞克朵丝,LOUIS QUATORZE,WOMENS TRIFOLD HALF WALLET SM4JR11FF4PU 短款钱包,http://static.lottedfs.cn/prod/prd-img/76/97/57/00/00/02/20000579776_1.JPG
,16152,20000510270,$186,瑞克朵丝,LOUIS QUATORZE,WOMENS TRIFOLD MEDIUM WALLET SM4JR07FF2PU 中款钱包,http://static.lottedfs.cn/prod/prd-img/67/97/57/00/00/02/20000579767_1.JPG
,16152,20000510268,$186,瑞克朵丝,LOUIS QUATORZE,WOMENS TRIFOLD MEDIUM WALLET SM4JR07FF2BL 中款钱包,http://static.lottedfs.cn/prod/prd-img/65/97/57/00/00/02/20000579765_1.JPG
畅销,16152,20000476113,$298,瑞克朵丝,LOUIS QUATORZE,MENS MESSENGER MM3JR02MD2BL 斜挎包,http://static.lottedfs.cn/prod/prd-img/64/59/52/00/00/02/20000525964_1.JPG
畅销,16152,20000475860,$306,瑞克朵丝,LOUIS QUATORZE,WOMENS SINGLE STRAP HOBO HM3JR15FA2BL 手提包,http://static.lottedfs.cn/prod/prd-img/39/56/52/00/00/02/20000525639_1.JPG
,16152,20000448599,$122,瑞克朵丝,LOUIS QUATORZE,MENS BIFOLD LONG WALLET SM2NH16MF1STG  长款钱包,http://static.lottedfs.cn/prod/prd-img/40/71/48/00/00/02/20000487140_1.JPG
畅销,16152,20000444387,$343,瑞克朵丝,LOUIS QUATORZE,WOMENS TOTE HM2AL05FA4BLP  女士手提包,http://static.lottedfs.cn/prod/prd-img/69/05/48/00/00/02/20000480569_1.JPG
,16152,20000439204,$351,瑞克朵丝,LOUIS QUATORZE,WOMENS BACKPACK HM2LO01FB2BL  背包,http://static.lottedfs.cn/prod/prd-img/57/15/47/00/00/02/20000471557_1.JPG
,16152,20000435567,$238,瑞克朵丝,LOUIS QUATORZE,WOMENS CROSSBODY HM2LO16FA9BL  斜挎包,http://static.lottedfs.cn/prod/prd-img/36/50/46/00/00/02/20000465036_1.JPG
畅销,16152,20000422034,$366,瑞克朵丝,LOUIS QUATORZE,女士背包,http://static.lottedfs.cn/prod/prd-img/37/34/44/00/00/02/20000443437_1.JPG
,16152,20000422029,$313,瑞克朵丝,LOUIS QUATORZE,女士斜挎包,http://static.lottedfs.cn/prod/prd-img/32/34/44/00/00/02/20000443432_1.JPG
畅销,16152,20000417310,$193,瑞克朵丝,LOUIS QUATORZE,WOMENS TRIFOLD MEDIUM WALLET 3折中款钱包,http://static.lottedfs.cn/prod/prd-img/93/68/43/00/00/02/20000436893_1.JPG
,16152,20000417236,$209,瑞克朵丝,LOUIS QUATORZE,WOMENS TRIFOLD LONG WALLET  长款钱包,http://static.lottedfs.cn/prod/prd-img/04/68/43/00/00/02/20000436804_1.JPG
畅销,16152,20000416989,$373,瑞克朵丝,LOUIS QUATORZE,WOMENS TOTE  女士手提包,http://static.lottedfs.cn/prod/prd-img/29/65/43/00/00/02/20000436529_1.JPG
畅销,16152,20000194811,$171,瑞克朵丝,LOUIS QUATORZE,WOMENS MEDIUM WALLET  3折中款钱包,http://static.lottedfs.cn/prod/prd-img/75/32/20/00/00/02/20000203275_9.jpg
,16152,20000194809,$186,瑞克朵丝,LOUIS QUATORZE,WOMENS LONG WALLET  3折长款钱包,http://static.lottedfs.cn/prod/prd-img/73/32/20/00/00/02/20000203273_8.JPG
畅销,16152,20000194782,$164,瑞克朵丝,LOUIS QUATORZE,WOMENS BIFOLD LONG WALLET SL1AL07FF1BL 女士长款钱包,http://static.lottedfs.cn/prod/prd-img/46/32/20/00/00/02/20000203246_10.jpg
畅销,16152,20000194766,$120,瑞克朵丝,LOUIS QUATORZE,MENS BIFOLD HALF WALLET  SK4AH17MF5NA 男士短款钱包,http://static.lottedfs.cn/prod/prd-img/30/32/20/00/00/02/20000203230_9.jpg
畅销,16152,20000194716,$216,瑞克朵丝,LOUIS QUATORZE,WOMANS TRIFOLD MEDIUM WALLET   女士中款钱包   (BLACK),http://static.lottedfs.cn/prod/prd-img/72/31/20/00/00/02/20000203172_9.jpg
,16152,20000194557,$298,瑞克朵丝,LOUIS QUATORZE,WOMENS ONE SHOULDER 单肩包,http://static.lottedfs.cn/prod/prd-img/85/28/20/00/00/02/20000202885_1.JPG
畅销,16152,20000192984,$120,瑞克朵丝,LOUIS QUATORZE,WOMENS BIFOLD HALF WALLET  SK3AL07FF5GA 短款钱包,http://static.lottedfs.cn/prod/prd-img/40/10/20/00/00/02/20000201040_8.jpg
畅销,16152,10003209599,$178,瑞克朵丝,LOUIS QUATORZE,WOMENS ZIP AROUND LONG WALLET 女士拉链式长款钱包,http://static.lottedfs.cn/prod/prd-img/99/95/20/03/00/01/10003209599_9.JPG
畅销,16152,10003134021,$81,瑞克朵丝,LOUIS QUATORZE,MENS WALLET(BLACK)   男士卡包,http://static.lottedfs.cn/prod/prd-img/21/40/13/03/00/01/10003134021_8.JPG
,16152,10003133976,$111,瑞克朵丝,LOUIS QUATORZE,MENS WALLET(BLACK)  男士钱包,http://static.lottedfs.cn/prod/prd-img/76/39/13/03/00/01/10003133976_1.JPG
,16152,10003066599,$107,瑞克朵丝,LOUIS QUATORZE,MENS BELT 男士腰带,http://static.lottedfs.cn/prod/prd-img/99/65/06/03/00/01/10003066599_6.JPG
畅销,16152,10002330801,$301,瑞克朵丝,LOUIS QUATORZE,WOMAN'S BAG  女士单肩包,http://static.lottedfs.cn/prod/prd-img/01/08/33/02/00/01/10002330801_2.JPG
,16152,10001630190,$106,瑞克朵丝,LOUIS QUATORZE,MENS WALLET SH1NH18MF5BL 男士短款钱包,http://static.lottedfs.cn/prod/prd-img/90/01/63/01/00/01/10001630190_9.jpg
畅销,16152,10000162288,$95,瑞克朵丝,LOUIS QUATORZE,男性自动腰带(BLACK),http://static.lottedfs.cn/prod/prd-img/88/22/16/00/00/01/10000162288_12.jpg
新品,16152,20000639432,$208,瑞克朵丝,LOUIS QUATORZE,MENS CLUTCH BAG MN3DL11MDABL 手包,http://static.lottedfs.cn/prod/prd-img/64/99/78/00/00/02/20000789964_1.JPG
新品,16152,20000639431,$276,瑞克朵丝,LOUIS QUATORZE,WOMENS TOTE BAG HN3DL02FA4NA 手提包,http://static.lottedfs.cn/prod/prd-img/63/99/78/00/00/02/20000789963_1.JPG
新品,16152,20000639429,$276,瑞克朵丝,LOUIS QUATORZE,WOMENS TOTE BAG HN3DL02FA4GA 手提包,http://static.lottedfs.cn/prod/prd-img/56/99/78/00/00/02/20000789956_1.JPG
新品,16152,20000639427,$298,瑞克朵丝,LOUIS QUATORZE,WOMENS TOTE BAG HN3DL01FA4NA 手提包,http://static.lottedfs.cn/prod/prd-img/51/99/78/00/00/02/20000789951_1.JPG
新品,16152,20000639424,$298,瑞克朵丝,LOUIS QUATORZE,WOMENS TOTE BAG HN3DL01FA4GA 手提包,http://static.lottedfs.cn/prod/prd-img/43/99/78/00/00/02/20000789943_1.JPG
,16152,20000635383,$358,瑞克朵丝,LOUIS QUATORZE,WOMENS ONE STRAP HOBO HN4DL22FA2BL 单肩包,http://static.lottedfs.cn/prod/prd-img/38/42/78/00/00/02/20000784238_1.JPG
,16152,20000635345,$70,瑞克朵丝,LOUIS QUATORZE,WOMENS CARD WALLET SN4FM15FI1BL 卡包,http://static.lottedfs.cn/prod/prd-img/41/41/78/00/00/02/20000784141_1.JPG
,16152,20000635344,$133,瑞克朵丝,LOUIS QUATORZE,WOMENS BIFOLD HALF WALLET SN4FM13FF5PI 短款钱包,http://static.lottedfs.cn/prod/prd-img/40/41/78/00/00/02/20000784140_1.JPG
,16152,20000635343,$133,瑞克朵丝,LOUIS QUATORZE,WOMENS BIFOLD HALF WALLET SN4FM13FF5BL 短款钱包,http://static.lottedfs.cn/prod/prd-img/39/41/78/00/00/02/20000784139_1.JPG
,16152,20000635329,$178,瑞克朵丝,LOUIS QUATORZE,WOMENS TRIFOLD MINI WALLET SN4FM12FF6MT 3折迷你钱包,http://static.lottedfs.cn/prod/prd-img/96/40/78/00/00/02/20000784096_1.JPG
,16152,20000635327,$178,瑞克朵丝,LOUIS QUATORZE,WOMENS TRIFOLD MINI WALLET SN4FM12FF6BL 3折迷你钱包,http://static.lottedfs.cn/prod/prd-img/89/40/78/00/00/02/20000784089_1.JPG
畅销,16152,20000635321,$208,瑞克朵丝,LOUIS QUATORZE,WOMENS TRIFOLD LONG WALLET SN4FM11FF0PI 3折长款钱包,http://static.lottedfs.cn/prod/prd-img/75/40/78/00/00/02/20000784075_1.JPG
,16152,20000635318,$85,瑞克朵丝,LOUIS QUATORZE,MENS BUSINESS CARD WALLET SN4DL19MI0BR 男士名片夹,http://static.lottedfs.cn/prod/prd-img/72/40/78/00/00/02/20000784072_1.JPG
,16152,20000635317,$85,瑞克朵丝,LOUIS QUATORZE,MENS BUSINESS CARD WALLET SN4DL19MI0BL 男士名片夹,http://static.lottedfs.cn/prod/prd-img/71/40/78/00/00/02/20000784071_1.JPG
,16152,20000635313,$111,瑞克朵丝,LOUIS QUATORZE,MENS BIFOLD HALF WALLET SN4DL18MF5BL 男士短款钱包,http://static.lottedfs.cn/prod/prd-img/59/40/78/00/00/02/20000784059_1.JPG
,16152,20000635310,$111,瑞克朵丝,LOUIS QUATORZE,MENS BIFOLD MEDIUM WALLET SN4DL17MF3BR 男士中款钱包,http://static.lottedfs.cn/prod/prd-img/56/40/78/00/00/02/20000784056_1.JPG
,16152,20000635309,$111,瑞克朵丝,LOUIS QUATORZE,MENS BIFOLD MEDIUM WALLET SN4DL17MF3BL 男士中款钱包,http://static.lottedfs.cn/prod/prd-img/55/40/78/00/00/02/20000784055_1.JPG
,16152,20000635308,$126,瑞克朵丝,LOUIS QUATORZE,MENS BIFOLD LONG WALLET SN4DL16MF1BR 男士长款钱包,http://static.lottedfs.cn/prod/prd-img/54/40/78/00/00/02/20000784054_1.JPG
,16152,20000635307,$126,瑞克朵丝,LOUIS QUATORZE,MENS BIFOLD LONG WALLET SN4DL16MF1BL 男士长款钱包,http://static.lottedfs.cn/prod/prd-img/53/40/78/00/00/02/20000784053_1.JPG
,16152,20000635304,$118,瑞克朵丝,LOUIS QUATORZE,MENS BIFOLD MEDIUM WALLET SN4DL12MF3BR 男士中款钱包,http://static.lottedfs.cn/prod/prd-img/50/40/78/00/00/02/20000784050_1.JPG
,16152,20000635303,$85,瑞克朵丝,LOUIS QUATORZE,WOMENS SINGLE MEDIUM WALLET SN4DL11FG4MT 女士中款钱包,http://static.lottedfs.cn/prod/prd-img/49/40/78/00/00/02/20000784049_1.JPG
,16152,20000635302,$85,瑞克朵丝,LOUIS QUATORZE,WOMENS SINGLE MEDIUM WALLET SN4DL11FG4BL 女士中款钱包,http://static.lottedfs.cn/prod/prd-img/48/40/78/00/00/02/20000784048_1.JPG
,16152,20000635296,$88,瑞克朵丝,LOUIS QUATORZE,MENS BUSINESS CARD WALLET SN4AT03MI0KH 男士名片夹,http://static.lottedfs.cn/prod/prd-img/34/40/78/00/00/02/20000784034_1.JPG
,16152,20000635295,$118,瑞克朵丝,LOUIS QUATORZE,MENS BIFOLD HALF WALLET SN4AT02MF5KH 男士短款钱包,http://static.lottedfs.cn/prod/prd-img/33/40/78/00/00/02/20000784033_1.JPG
,16152,20000635293,$118,瑞克朵丝,LOUIS QUATORZE,MENS BIFOLD MEDIUM WALLET SN4AT01MF3KH 男士中款钱包,http://static.lottedfs.cn/prod/prd-img/31/40/78/00/00/02/20000784031_1.JPG
,16152,20000635292,$55,瑞克朵丝,LOUIS QUATORZE,WOMENS CARD WALLET SN3SO18FI1BL 女士卡包,http://static.lottedfs.cn/prod/prd-img/30/40/78/00/00/02/20000784030_1.JPG
,16152,20000635287,$336,瑞克朵丝,LOUIS QUATORZE,WOMENS CROSSBODY HN4PM24FA9GM 女士斜挎包,http://static.lottedfs.cn/prod/prd-img/17/40/78/00/00/02/20000784017_1.JPG
,16152,20000635286,$336,瑞克朵丝,LOUIS QUATORZE,WOMENS CROSSBODY HN4PM24FA9GA 女士斜挎包,http://static.lottedfs.cn/prod/prd-img/16/40/78/00/00/02/20000784016_1.JPG
,16152,20000635281,$418,瑞克朵丝,LOUIS QUATORZE,WOMENS ONE SHOULDER HN4PM22FA0GA 女士单肩包,http://static.lottedfs.cn/prod/prd-img/03/40/78/00/00/02/20000784003_1.JPG
,16152,20000635280,$418,瑞克朵丝,LOUIS QUATORZE,WOMENS ONE SHOULDER HN4PM22FA0BL 女士单肩包,http://static.lottedfs.cn/prod/prd-img/02/40/78/00/00/02/20000784002_1.JPG
,16152,20000635277,$257,瑞克朵丝,LOUIS QUATORZE,WOMENS TOTE HN4PM16FA4PI 女士手提包,http://static.lottedfs.cn/prod/prd-img/99/39/78/00/00/02/20000783999_1.JPG
,16152,20000635270,$448,瑞克朵丝,LOUIS QUATORZE,WOMENS TWO SHOULDER HN4PM11FA1BL 女士双背带单肩包,http://static.lottedfs.cn/prod/prd-img/84/39/78/00/00/02/20000783984_1.JPG
,16152,20000635269,$298,瑞克朵丝,LOUIS QUATORZE,WOMENS TWO SHOULDER HN4DL23FA0BL 女士双背带单肩包,http://static.lottedfs.cn/prod/prd-img/83/39/78/00/00/02/20000783983_1.JPG
,16152,20000635264,$373,瑞克朵丝,LOUIS QUATORZE,WOMENS TOTE HN4DL21FA4BL 女士手提包,http://static.lottedfs.cn/prod/prd-img/78/39/78/00/00/02/20000783978_1.JPG
,16152,20000621979,$103,瑞克朵丝,LOUIS QUATORZE,MENS MONEY CLIP SN4DL02MI2GA 男士钱夹,http://static.lottedfs.cn/prod/prd-img/42/52/76/00/00/02/20000765242_1.JPG
,16152,20000621978,$111,瑞克朵丝,LOUIS QUATORZE,WOMENS TRIFOLD MINI WALLET SN3DL37FF6PI 女士3折迷你钱包,http://static.lottedfs.cn/prod/prd-img/41/52/76/00/00/02/20000765241_1.JPG
,16152,20000621977,$111,瑞克朵丝,LOUIS QUATORZE,WOMENS TRIFOLD MINI WALLET SN3DL37FF6GA 女士3折迷你钱包,http://static.lottedfs.cn/prod/prd-img/40/52/76/00/00/02/20000765240_1.JPG
,16152,20000621974,$81,瑞克朵丝,LOUIS QUATORZE,MENS BUSINESS CARD WALLET SN3DL24MI0NA 男士名片夹,http://static.lottedfs.cn/prod/prd-img/34/52/76/00/00/02/20000765234_1.JPG
,16152,20000621973,$365,瑞克朵丝,LOUIS QUATORZE,WOMENS BOSTON HN4DL16FA6TP 女士手提包,http://static.lottedfs.cn/prod/prd-img/33/52/76/00/00/02/20000765233_1.JPG
,16152,20000616032,$58,瑞克朵丝,LOUIS QUATORZE,MENS CARD WALLET SN4DL05MI1BL 男士卡包,http://static.lottedfs.cn/prod/prd-img/56/65/75/00/00/02/20000756556_1.JPG
,16152,20000616028,$77,瑞克朵丝,LOUIS QUATORZE,MENS BUSINESS CARD WALLET SN4DL04MI0BL 男士名片包,http://static.lottedfs.cn/prod/prd-img/47/65/75/00/00/02/20000756547_1.JPG
,16152,20000616025,$96,瑞克朵丝,LOUIS QUATORZE,MENS BIFOLD MINI WALLET SN4DL03MF7BL 男士迷你钱包,http://static.lottedfs.cn/prod/prd-img/42/65/75/00/00/02/20000756542_1.JPG
,16152,20000616020,$111,瑞克朵丝,LOUIS QUATORZE,MENS BIFOLD HALF WALLET SN4DL01MF5GA 男士短款钱包,http://static.lottedfs.cn/prod/prd-img/36/65/75/00/00/02/20000756536_1.JPG
,16152,20000616019,$111,瑞克朵丝,LOUIS QUATORZE,MENS BIFOLD HALF WALLET SN4DL01MF5BL 男士短款钱包,http://static.lottedfs.cn/prod/prd-img/33/65/75/00/00/02/20000756533_1.JPG
,16152,20000616016,$111,瑞克朵丝,LOUIS QUATORZE,WOMENS CARD WALLET SN3FM06FI1BL 女士卡包,http://static.lottedfs.cn/prod/prd-img/27/65/75/00/00/02/20000756527_1.JPG
,16152,20000616012,$118,瑞克朵丝,LOUIS QUATORZE,WOMENS BIFOLD MINI WALLET SN3DL16FF7BL 女士短款钱包,http://static.lottedfs.cn/prod/prd-img/21/65/75/00/00/02/20000756521_1.JPG
,16152,20000616006,$321,瑞克朵丝,LOUIS QUATORZE,WOMENS ONE SHOULDER HN4DL17FA0GA 女士单肩包,http://static.lottedfs.cn/prod/prd-img/08/65/75/00/00/02/20000756508_1.JPG
,16152,20000616003,$246,瑞克朵丝,LOUIS QUATORZE,WOMENS CROSSBODY HN3DL32FA9BL 女士斜挎包,http://static.lottedfs.cn/prod/prd-img/02/65/75/00/00/02/20000756502_1.JPG
,16152,20000612028,$365,瑞克朵丝,LOUIS QUATORZE,WOMENS BOSTON HN4DL16FA6BL 女士手提包,http://static.lottedfs.cn/prod/prd-img/81/88/74/00/00/02/20000748881_1.JPG
,16152,20000612024,$32,瑞克朵丝,LOUIS QUATORZE,WOMENS CHARM DECOR FN3DL07FXBWH 箱包挂饰,http://static.lottedfs.cn/prod/prd-img/72/88/74/00/00/02/20000748872_1.JPG
,16152,20000612020,$32,瑞克朵丝,LOUIS QUATORZE,WOMENS CHARM DECOR FN3DL07FXBTA 箱包挂饰,http://static.lottedfs.cn/prod/prd-img/67/88/74/00/00/02/20000748867_1.JPG
,16152,20000612016,$32,瑞克朵丝,LOUIS QUATORZE,WOMENS CHARM DECOR FN3DL07FXBRE 箱包挂饰,http://static.lottedfs.cn/prod/prd-img/60/88/74/00/00/02/20000748860_1.JPG
,16152,20000612012,$32,瑞克朵丝,LOUIS QUATORZE,WOMENS CHARM DECOR FN3DL07FXBBL 箱包挂饰,http://static.lottedfs.cn/prod/prd-img/53/88/74/00/00/02/20000748853_1.JPG
,16152,20000612007,$73,瑞克朵丝,LOUIS QUATORZE,WOMENS MANUAL CASUAL BELT (PUSH PIN CLOSURE BELT) BN3DL01FH3WI 女士腰带,http://static.lottedfs.cn/prod/prd-img/46/88/74/00/00/02/20000748846_1.JPG
,16152,20000612001,$73,瑞克朵丝,LOUIS QUATORZE,WOMENS MANUAL CASUAL BELT (PUSH PIN CLOSURE BELT) BN3DL01FH3BR 女士腰带,http://static.lottedfs.cn/prod/prd-img/38/88/74/00/00/02/20000748838_1.JPG
畅销,16152,20000611997,$73,瑞克朵丝,LOUIS QUATORZE,WOMENS MANUAL CASUAL BELT (PUSH PIN CLOSURE BELT) BN3DL01FH3BL 女士腰带,http://static.lottedfs.cn/prod/prd-img/28/88/74/00/00/02/20000748828_1.JPG
