tag,brand_No,product_No,us_price,brand_name_chn,brand_name_eng,product_name,img_url
畅销 赠品,1001242,20000479860,$39,FromBIO,FromBIO,BOSWELLIA FOR JOINTS AND CARTILAGE,http://static.lottedfs.cn/prod/prd-img/62/16/53/00/00/02/20000531662_1.jpg
畅销 赠品,1001242,20000554136,$53,FromBIO,FromBIO,MASTIC GUM FOR STOMACH HEALTH 胃健康,http://static.lottedfs.cn/prod/prd-img/52/12/65/00/00/02/20000651252_2.jpg
赠品,1001242,20000585044,$16,FromBIO,FromBIO,CHEWABLE CALCIUM MAGNESIUM AND VITAMIN D FOR BONE HEALTH 钙镁片,http://static.lottedfs.cn/prod/prd-img/00/84/69/00/00/02/20000698400_1.jpg
赠品,1001242,20000597208,$32,FromBIO,FromBIO,HONGS DIET STORY 瘦身营养片 (3周服用量),http://static.lottedfs.cn/prod/prd-img/07/95/71/00/00/02/20000719507_1.jpg
赠品,1001242,20000450436,$45,FromBIO,FromBIO,DIET AND WILD MANGO IGOB131 瘦身纤体果冻,http://static.lottedfs.cn/prod/prd-img/58/94/48/00/00/02/20000489458_2.jpg
