tag,brand_No,product_No,us_price,brand_name_chn,brand_name_eng,product_name,img_url
,19762,20000605691,$253,KOLON SPORT,KOLON SPORT,WOMENS LONG LENGTH PADDED JACKET(KEEPER LONG REVERSIBLE) 女士外套,http://static.lottedfs.cn/prod/prd-img/65/78/74/00/00/02/20000747865_1.jpg
,19762,20000605698,$253,KOLON SPORT,KOLON SPORT,WOMENS LONG LENGTH PADDED JACKET(KEEPER LONG REVERSIBLE) 女士外套,http://static.lottedfs.cn/prod/prd-img/37/78/73/00/00/02/20000737837_1.jpg
,19762,20000614936,$354,KOLON SPORT,KOLON SPORT,WOMENS DOWN 女士羽绒服,http://static.lottedfs.cn/prod/prd-img/09/45/75/00/00/02/20000754509_1.JPG
,19762,20000624269,$304,KOLON SPORT,KOLON SPORT,MENS TERRANOVA DOWN 男士羽绒服,http://static.lottedfs.cn/prod/prd-img/18/83/76/00/00/02/20000768318_1.jpg
,19762,20000624267,$499,KOLON SPORT,KOLON SPORT,WOMENS HIGH LINE DOWN 女士羽绒服,http://static.lottedfs.cn/prod/prd-img/08/83/76/00/00/02/20000768308_1.jpg
,19762,20000630718,$143,KOLON SPORT,KOLON SPORT,WINTER WOMENS SWEATER FACE PRINT FULL ZIP 女士针织衫,http://static.lottedfs.cn/prod/prd-img/91/74/77/00/00/02/20000777491_1.jpg
,19762,20000614939,$210,KOLON SPORT,KOLON SPORT,MENS LIGHTWEIGHT DOWN (VALKYRIE) 男士短款羽绒服,http://static.lottedfs.cn/prod/prd-img/15/45/75/00/00/02/20000754515_1.JPG
,19762,20000614917,$231,KOLON SPORT,KOLON SPORT,WOMENS DOWN 女士羽绒服,http://static.lottedfs.cn/prod/prd-img/78/44/75/00/00/02/20000754478_1.JPG
,19762,20000611462,$93,KOLON SPORT,KOLON SPORT,MENS QUILTED JQD ZIP UP T SHIRT 男士上衣,http://static.lottedfs.cn/prod/prd-img/80/79/74/00/00/02/20000747980_6.jpg
,19762,20000611443,$85,KOLON SPORT,KOLON SPORT,MENS HYBRID SPECIAL ZIP UP T SHIRT 男士上衣,http://static.lottedfs.cn/prod/prd-img/43/79/74/00/00/02/20000747943_7.jpg
,19762,20000611436,$85,KOLON SPORT,KOLON SPORT,MENS HYBRID SPECIAL ZIP UP T SHIRT 男士上衣,http://static.lottedfs.cn/prod/prd-img/32/79/74/00/00/02/20000747932_7.jpg
,19762,20000611425,$85,KOLON SPORT,KOLON SPORT,WOMENS QUILTED JQD ZIP UP T SHIRT 女士上衣,http://static.lottedfs.cn/prod/prd-img/14/79/74/00/00/02/20000747914_7.jpg
,19762,20000611406,$253,KOLON SPORT,KOLON SPORT,WOMENS LONG PADDING JACKET（KEEPER LONG REVERSIBLE）女士长外套,http://static.lottedfs.cn/prod/prd-img/81/78/74/00/00/02/20000747881_10.jpg
,19762,20000605708,$268,KOLON SPORT,KOLON SPORT,WOMENS LONG LENGTH PRINT PADDED JACKET(KEEPER LONG REVERSIBLE) 女士外套,http://static.lottedfs.cn/prod/prd-img/55/78/73/00/00/02/20000737855_1.jpg
,19762,20000592082,$282,KOLON SPORT,KOLON SPORT,19 NEW MENS HESTIA LONG DOWN JACKET 男士长款羽绒服,http://static.lottedfs.cn/prod/prd-img/44/01/71/00/00/02/20000710144_1.jpg
,19762,20000592075,$282,KOLON SPORT,KOLON SPORT,19 NEW WOMENS HESTIA LONG DOWN JACKET 女士长款羽绒服,http://static.lottedfs.cn/prod/prd-img/22/01/71/00/00/02/20000710122_1.jpg
,19762,20000630711,$282,KOLON SPORT,KOLON SPORT,MENS HESTIA LONG DOWN 男士羽绒服,http://static.lottedfs.cn/prod/prd-img/65/74/77/00/00/02/20000777465_1.jpg
,19762,20000630697,$470,KOLON SPORT,KOLON SPORT,MENS HOOD FUR MEDIUM LENGTH DOWN 男士中款羽绒服,http://static.lottedfs.cn/prod/prd-img/33/74/77/00/00/02/20000777433_1.jpg
,19762,20000630688,$470,KOLON SPORT,KOLON SPORT,MENS HOOD FUR MEDIUM LENGTH DOWN 男士中款羽绒服,http://static.lottedfs.cn/prod/prd-img/21/74/77/00/00/02/20000777421_1.jpg
,19762,20000624270,$304,KOLON SPORT,KOLON SPORT,MENS TERRANOVA DOWN 男士羽绒服,http://static.lottedfs.cn/prod/prd-img/21/83/76/00/00/02/20000768321_1.jpg
,19762,20000624268,$499,KOLON SPORT,KOLON SPORT,WOMENS HIGH LINE DOWN 女士羽绒服,http://static.lottedfs.cn/prod/prd-img/14/83/76/00/00/02/20000768314_1.jpg
,19762,20000624266,$268,KOLON SPORT,KOLON SPORT,WOMENS A LINE MEDIUM LENGTH DOWN 女士羽绒服,http://static.lottedfs.cn/prod/prd-img/06/83/76/00/00/02/20000768306_1.jpg
,19762,20000624051,$268,KOLON SPORT,KOLON SPORT,WOMENS A LINE MEDIUM LENGTH DOWN 中款羽绒服,http://static.lottedfs.cn/prod/prd-img/51/79/76/00/00/02/20000767951_1.jpg
,19762,20000614949,$253,KOLON SPORT,KOLON SPORT,MENS MID LENGTH LIGHTWEIGHT HOODIE DOWN 羽绒服,http://static.lottedfs.cn/prod/prd-img/39/45/75/00/00/02/20000754539_7.JPG
,19762,20000614944,$253,KOLON SPORT,KOLON SPORT,MENS MID LENGTH LIGHTWEIGHT HOODIE DOWN 男士中款羽绒服,http://static.lottedfs.cn/prod/prd-img/31/45/75/00/00/02/20000754531_1.JPG
,19762,20000614930,$231,KOLON SPORT,KOLON SPORT,WOMENS DOWN 女士羽绒服,http://static.lottedfs.cn/prod/prd-img/99/44/75/00/00/02/20000754499_1.JPG
,19762,20000614904,$210,KOLON SPORT,KOLON SPORT,WOMENS LIGHTWEIGHT DOWN(VALKYRIE) 女士羽绒外套,http://static.lottedfs.cn/prod/prd-img/59/44/75/00/00/02/20000754459_1.JPG
,19762,20000611456,$93,KOLON SPORT,KOLON SPORT,MENS QUILTED JQD ZIP UP T SHIRT 男士上衣,http://static.lottedfs.cn/prod/prd-img/70/79/74/00/00/02/20000747970_6.jpg
,19762,20000611454,$143,KOLON SPORT,KOLON SPORT,MENS SWEATER PRINT FULL ZIP UP 男士针织衫,http://static.lottedfs.cn/prod/prd-img/67/79/74/00/00/02/20000747967_1.gif
,19762,20000611450,$143,KOLON SPORT,KOLON SPORT,MENS SWEATER PRINT FULL ZIP UP 男士针织衫,http://static.lottedfs.cn/prod/prd-img/60/79/74/00/00/02/20000747960_1.gif
,19762,20000611446,$85,KOLON SPORT,KOLON SPORT,MENS HYBRID PROFESSIONAL ZIP UP T SHIRT 男士上衣,http://static.lottedfs.cn/prod/prd-img/52/79/74/00/00/02/20000747952_7.jpg
,19762,20000611432,$85,KOLON SPORT,KOLON SPORT,WOMENS QUILTED JQD ZIP UP T SHIRT 女士上衣 100,http://static.lottedfs.cn/prod/prd-img/22/79/74/00/00/02/20000747922_7.jpg
,19762,20000611418,$85,KOLON SPORT,KOLON SPORT,WOMENS QUILTED JQD ZIP UP T SHIRT 女士上衣,http://static.lottedfs.cn/prod/prd-img/02/79/74/00/00/02/20000747902_7.jpg
,19762,20000605704,$268,KOLON SPORT,KOLON SPORT,WOMENS LONG LENGTH PRINT PADDED JACKET (KEEPER LONG REVERSIBLE) 女士长外套,http://static.lottedfs.cn/prod/prd-img/47/78/73/00/00/02/20000737847_1.jpg
,19762,20000592318,$253,KOLON SPORT,KOLON SPORT,19 NEW MENS LONG DOWN JACKET NUSTAR 男士长款羽绒服,http://static.lottedfs.cn/prod/prd-img/63/05/71/00/00/02/20000710563_1.jpg
,19762,20000592089,$282,KOLON SPORT,KOLON SPORT,19 NEW MENS HESTIA LONG DOWN JACKET 男士长款羽绒服,http://static.lottedfs.cn/prod/prd-img/55/01/71/00/00/02/20000710155_1.jpg
,19762,20000592076,$253,KOLON SPORT,KOLON SPORT,19 NEW WOMENS LONG DOWN JACKET NUSTAR 女士长款羽绒服,http://static.lottedfs.cn/prod/prd-img/25/01/71/00/00/02/20000710125_1.jpg
,19762,20000592074,$282,KOLON SPORT,KOLON SPORT,19 NEW WOMENS HESTIA LONG DOWN JACKET 女士长款羽绒服,http://static.lottedfs.cn/prod/prd-img/18/01/71/00/00/02/20000710118_1.jpg
,19762,20000556998,$64,KOLON SPORT,KOLON SPORT,MENS LONG SLEEVE STRIPE POLO T-SHIRT 女士上衣,http://static.lottedfs.cn/prod/prd-img/48/65/65/00/00/02/20000656548_6.jpg
,19762,20000556993,$86,KOLON SPORT,KOLON SPORT,MENS LONG SLEEVED COLOR PROFESSIONAL BUSINESS T-SHIRT T恤衫,http://static.lottedfs.cn/prod/prd-img/27/65/65/00/00/02/20000656527_6.jpg
,19762,20000556990,$86,KOLON SPORT,KOLON SPORT,MENS EXPERT LONG SLEEVE CONTRAST FABRIC ZIP UP T SHIRT 男士上衣,http://static.lottedfs.cn/prod/prd-img/13/65/65/00/00/02/20000656513_6.jpg
,19762,20000556985,$152,KOLON SPORT,KOLON SPORT,MENS SAFARI JACKET 男士外套,http://static.lottedfs.cn/prod/prd-img/85/64/65/00/00/02/20000656485_8.jpg
,19762,20000556980,$71,KOLON SPORT,KOLON SPORT,WOMENS LONG SLEEVE STRIPE ZIP UP T SHIRT 女士上衣,http://static.lottedfs.cn/prod/prd-img/76/64/65/00/00/02/20000656476_6.jpg
,19762,20000556976,$71,KOLON SPORT,KOLON SPORT,WOMENS LONG SLEEVE STRIPE ZIP UP T SHIRT 女士上衣,http://static.lottedfs.cn/prod/prd-img/59/64/65/00/00/02/20000656459_6.jpg
,19762,20000553225,$152,KOLON SPORT,KOLON SPORT,WOMENS SAFARI JACKET 女士外套,http://static.lottedfs.cn/prod/prd-img/75/95/64/00/00/02/20000649575_1.jpg
,19762,20000614941,$210,KOLON SPORT,KOLON SPORT,MENS LIGHTWEIGHT DOWN (VALKYRIE) 男士短款羽绒服,http://static.lottedfs.cn/prod/prd-img/25/45/75/00/00/02/20000754525_1.JPG
,19762,20000614923,$231,KOLON SPORT,KOLON SPORT,WOMENS DOWN 女士羽绒服,http://static.lottedfs.cn/prod/prd-img/88/44/75/00/00/02/20000754488_1.JPG
