tag,brand_No,product_No,us_price,brand_name_chn,brand_name_eng,product_name,img_url
赠品,1002966,20000633738,$63,DEMEDICOTEM,DEMEDICOTEM,ILLUMINATING WHITE CELL AMPOULE 安瓶精华,http://static.lottedfs.cn/prod/prd-img/27/17/78/00/00/02/20000781727_1.png
免税独家 赠品,1002966,20000633742,$184,DEMEDICOTEM,DEMEDICOTEM,ILLUMINATING WHITE CELL AMPOULE SET 安瓶精华3盒套装,http://static.lottedfs.cn/prod/prd-img/32/17/78/00/00/02/20000781732_2.jpg
免税独家 赠品,1002966,20000633751,$78,DEMEDICOTEM,DEMEDICOTEM,SE7EN HYDRO ZENITH MASK SET 面膜套装 4+1,http://static.lottedfs.cn/prod/prd-img/43/17/78/00/00/02/20000781743_1.jpg
免税独家 赠品,1002966,20000633746,$48,DEMEDICOTEM,DEMEDICOTEM,SE7EN HYDRO ZENITH MASK SET 面膜套装 3盒入,http://static.lottedfs.cn/prod/prd-img/37/17/78/00/00/02/20000781737_1.jpg
赠品,1002966,20000633734,$20,DEMEDICOTEM,DEMEDICOTEM,5IVE ANTI-PORE SOLUTION MASK 面膜,http://static.lottedfs.cn/prod/prd-img/22/17/78/00/00/02/20000781722_1.jpg
