tag,brand_No,product_No,us_price,brand_name_chn,brand_name_eng,product_name,img_url
畅销,10411,20000502925,$36,派克,PARKER,PK IM BLK GT FP F+CV TB COO  钢笔,http://static.lottedfs.cn/prod/prd-img/31/95/56/00/00/02/20000569531_1.jpg
畅销,10411,20000502900,$25,派克,PARKER,JOT BND STREET BLK CT FP F BLU TB 钢笔,http://static.lottedfs.cn/prod/prd-img/66/94/56/00/00/02/20000569466_1.jpg
,10411,20000633639,$17,派克,PARKER,JOTTER FOUNTAIN PEN 钢笔 YELLOW,http://static.lottedfs.cn/prod/prd-img/90/15/78/00/00/02/20000781590_1.jpg
,10411,20000633634,$17,派克,PARKER,JOTTER FOUNTAIN PEN 钢笔 ORANGE,http://static.lottedfs.cn/prod/prd-img/83/15/78/00/00/02/20000781583_1.jpg
,10411,20000633620,$17,派克,PARKER,JOTTER FOUNTAIN PEN 钢笔 BLACK,http://static.lottedfs.cn/prod/prd-img/66/15/78/00/00/02/20000781566_1.jpg
畅销,10411,20000503061,$78,派克,PARKER,PK URB PR SLV PWD CT FP F GB 钢笔,http://static.lottedfs.cn/prod/prd-img/29/97/56/00/00/02/20000569729_6.jpg
,10411,20000503040,$65,派克,PARKER,PK SON SS GT BP M BLK GB 圆珠笔,http://static.lottedfs.cn/prod/prd-img/82/96/56/00/00/02/20000569682_1.jpg
畅销,10411,20000503024,$162,派克,PARKER,PK SON MBLK GT FP F GB 钢笔,http://static.lottedfs.cn/prod/prd-img/66/96/56/00/00/02/20000569666_1.jpg
,10411,20000502966,$103,派克,PARKER,PK SON BLK GT BP M BLK GB 圆珠笔,http://static.lottedfs.cn/prod/prd-img/93/95/56/00/00/02/20000569593_1.jpg
畅销,10411,20000502962,$226,派克,PARKER,PK SON BLK GT FP 18K F GB 钢笔,http://static.lottedfs.cn/prod/prd-img/87/95/56/00/00/02/20000569587_1.jpg
畅销,10411,20000502912,$25,派克,PARKER,JOT SS CT FP F BLU TB 钢笔,http://static.lottedfs.cn/prod/prd-img/95/94/56/00/00/02/20000569495_1.jpg
,10411,20000502854,$69,派克,PARKER,KOREA MULTIPACK IM BP 5PC 笔具套装,http://static.lottedfs.cn/prod/prd-img/94/93/56/00/00/02/20000569394_1.jpg
,10411,20000633647,$14,派克,PARKER,JOTTER WATER BASED PEN 水性笔 BLUE,http://static.lottedfs.cn/prod/prd-img/01/16/78/00/00/02/20000781601_1.jpg
,10411,20000633630,$17,派克,PARKER,JOTTER FOUNTAIN PEN 钢笔 BLUE,http://static.lottedfs.cn/prod/prd-img/77/15/78/00/00/02/20000781577_1.jpg
,10411,20000633622,$17,派克,PARKER,JOTTER FOUNTAIN PEN 钢笔 RED,http://static.lottedfs.cn/prod/prd-img/69/15/78/00/00/02/20000781569_1.jpg
畅销,10411,20000618796,$45,派克,PARKER,IM N-SE C IGNITE RED CT-F 钢笔,http://static.lottedfs.cn/prod/prd-img/46/03/76/00/00/02/20000760346_1.jpg
畅销,10411,20000618791,$45,派克,PARKER,IM N-SE C ORIGIN BLUE CT-F 钢笔,http://static.lottedfs.cn/prod/prd-img/41/03/76/00/00/02/20000760341_1.jpg
,10411,20000503139,$52,派克,PARKER,PK URB PRM EBN BP M.BLK GB 圆珠笔,http://static.lottedfs.cn/prod/prd-img/38/98/56/00/00/02/20000569838_1.jpg
,10411,20000503049,$78,派克,PARKER,PK URB PRM EBN FP F GB 钢笔,http://static.lottedfs.cn/prod/prd-img/03/97/56/00/00/02/20000569703_1.jpg
畅销,10411,20000503036,$110,派克,PARKER,PK SON SS GT FP F GB 钢笔,http://static.lottedfs.cn/prod/prd-img/78/96/56/00/00/02/20000569678_1.jpg
,10411,20000502953,$226,派克,PARKER,PK SON BLK CT FP 18K F GB 钢笔,http://static.lottedfs.cn/prod/prd-img/76/95/56/00/00/02/20000569576_1.jpg
畅销,10411,20000502918,$36,派克,PARKER,PK IM WHITE CT FP F+CV TB COO 钢笔,http://static.lottedfs.cn/prod/prd-img/09/95/56/00/00/02/20000569509_1.jpg
畅销,10411,20000502907,$25,派克,PARKER,JOT SS GT FP F BLU TB 钢笔,http://static.lottedfs.cn/prod/prd-img/87/94/56/00/00/02/20000569487_1.jpg
畅销,10411,20000502897,$25,派克,PARKER,JOT ROYAL BLUE CT FP F BLU TB 钢笔,http://static.lottedfs.cn/prod/prd-img/56/94/56/00/00/02/20000569456_1.jpg
,10411,20000502887,$29,派克,PARKER,JOT PRM BND STR BLK GT BP M BLK TB 圆珠笔,http://static.lottedfs.cn/prod/prd-img/41/94/56/00/00/02/20000569441_1.jpg
畅销,10411,20000502875,$29,派克,PARKER,JOT PRM WEST END GOLD BP M BLK TB 圆珠笔,http://static.lottedfs.cn/prod/prd-img/20/94/56/00/00/02/20000569420_1.jpg
,10411,20000502851,$48,派克,PARKER,KOREA MULTIPACK VECTOR RB 6PC 笔具套装,http://static.lottedfs.cn/prod/prd-img/91/93/56/00/00/02/20000569391_1.jpg
,10411,20000502845,$36,派克,PARKER,KOREA MULTIPACK JOTTER BP 3PC V2 笔具套装,http://static.lottedfs.cn/prod/prd-img/77/93/56/00/00/02/20000569377_1.jpg
,10411,20000502831,$36,派克,PARKER,KOREA MULTIPACK JOTTER SS BP+MP 3PC 笔具套装,http://static.lottedfs.cn/prod/prd-img/50/93/56/00/00/02/20000569350_1.jpg
畅销,10411,20000502830,$59,派克,PARKER,KOREA MULTIPACK JOTTER BP 5PC 笔具套装,http://static.lottedfs.cn/prod/prd-img/49/93/56/00/00/02/20000569349_1.jpg
,10411,20000502829,$59,派克,PARKER,KOREA MULTIPACK JOTTER BP+MP 5PC 笔具套装,http://static.lottedfs.cn/prod/prd-img/48/93/56/00/00/02/20000569348_1.jpg
畅销,10411,20000633653,$14,派克,PARKER,JOTTER WATER BASED PEN 水性笔 YELLOW,http://static.lottedfs.cn/prod/prd-img/10/16/78/00/00/02/20000781610_1.jpg
,10411,20000633651,$14,派克,PARKER,JOTTER WATER BASED PEN 水性笔 MAGENTA,http://static.lottedfs.cn/prod/prd-img/08/16/78/00/00/02/20000781608_1.jpg
,10411,20000633649,$14,派克,PARKER,JOTTER WATER BASED PEN 水性笔 ORANGE,http://static.lottedfs.cn/prod/prd-img/03/16/78/00/00/02/20000781603_1.jpg
,10411,20000633645,$14,派克,PARKER,JOTTER WATER BASED PEN 水性笔 WHITE,http://static.lottedfs.cn/prod/prd-img/96/15/78/00/00/02/20000781596_1.jpg
,10411,20000633643,$14,派克,PARKER,JOTTER WATER BASED PEN 水性笔 RED,http://static.lottedfs.cn/prod/prd-img/94/15/78/00/00/02/20000781594_1.jpg
,10411,20000633641,$14,派克,PARKER,JOTTER WATER BASED PEN 水性笔 BLACK,http://static.lottedfs.cn/prod/prd-img/92/15/78/00/00/02/20000781592_1.jpg
,10411,20000633637,$17,派克,PARKER,JOTTER FOUNTAIN PEN 钢笔 MAGENTA,http://static.lottedfs.cn/prod/prd-img/88/15/78/00/00/02/20000781588_1.jpg
,10411,20000633623,$17,派克,PARKER,JOTTER FOUNTAIN PEN 钢笔 WHITE,http://static.lottedfs.cn/prod/prd-img/70/15/78/00/00/02/20000781570_1.jpg
,10411,20000618798,$24,派克,PARKER,IM N-SE C IGNITE RED CT-B 圆珠笔,http://static.lottedfs.cn/prod/prd-img/48/03/76/00/00/02/20000760348_1.jpg
,10411,20000618793,$24,派克,PARKER,IM N-SE C ORIGIN BLUE CT-B 圆珠笔,http://static.lottedfs.cn/prod/prd-img/43/03/76/00/00/02/20000760343_1.jpg
,10411,20000618786,$45,派克,PARKER,IM N-SE P MIDNIGHT BLUE CT-B 圆珠笔,http://static.lottedfs.cn/prod/prd-img/36/03/76/00/00/02/20000760336_1.jpg
畅销,10411,20000618784,$77,派克,PARKER,IM N-SE P MIDNIGHT BLUE CT-F 钢笔,http://static.lottedfs.cn/prod/prd-img/29/03/76/00/00/02/20000760329_1.jpg
,10411,20000618778,$45,派克,PARKER,IM N-SE P METALLIC SILVER CT-B 圆珠笔,http://static.lottedfs.cn/prod/prd-img/15/03/76/00/00/02/20000760315_1.jpg
畅销,10411,20000618776,$77,派克,PARKER,IM N-SE P METALLIC SILVER CT-F 钢笔,http://static.lottedfs.cn/prod/prd-img/13/03/76/00/00/02/20000760313_1.jpg
,10411,20000564822,$26,派克,PARKER,JOT XL MGRN CT BP M BLK 圆珠笔,http://static.lottedfs.cn/prod/prd-img/36/91/66/00/00/02/20000669136_1.jpg
,10411,20000564820,$26,派克,PARKER,JOT XL MGREY CT BP M BLK 圆珠笔,http://static.lottedfs.cn/prod/prd-img/34/91/66/00/00/02/20000669134_1.jpg
,10411,20000564819,$26,派克,PARKER,JOT XL MBLUE CT BP M BLK 圆珠笔,http://static.lottedfs.cn/prod/prd-img/33/91/66/00/00/02/20000669133_1.jpg
,10411,20000564808,$26,派克,PARKER,JOT XL MBLK CT BP M BLK 圆珠笔,http://static.lottedfs.cn/prod/prd-img/14/91/66/00/00/02/20000669114_1.jpg
畅销,10411,20000530159,$12,派克,PARKER,JOT PLASTIC GREEN BP 圆珠笔,http://static.lottedfs.cn/prod/prd-img/02/89/60/00/00/02/20000608902_1.jpg
,10411,20000530157,$12,派克,PARKER,JOT PLASTIC YELLOW BP 圆珠笔,http://static.lottedfs.cn/prod/prd-img/00/89/60/00/00/02/20000608900_1.jpg
,10411,20000530154,$12,派克,PARKER,JOT PLASTIC ORANGE BP 圆珠笔,http://static.lottedfs.cn/prod/prd-img/97/88/60/00/00/02/20000608897_1.jpg
,10411,20000530149,$12,派克,PARKER,JOT PLASTIC BLUE BP 圆珠笔,http://static.lottedfs.cn/prod/prd-img/91/88/60/00/00/02/20000608891_1.jpg
,10411,20000530144,$12,派克,PARKER,JOT PLASTIC PINK BP 圆珠笔,http://static.lottedfs.cn/prod/prd-img/86/88/60/00/00/02/20000608886_1.jpg
,10411,20000530140,$155,派克,PARKER,SON SE18 BLK GT BP 圆珠笔,http://static.lottedfs.cn/prod/prd-img/82/88/60/00/00/02/20000608882_1.jpg
,10411,20000530135,$278,派克,PARKER,SON SE18 BLK GT FP 钢笔,http://static.lottedfs.cn/prod/prd-img/77/88/60/00/00/02/20000608877_1.jpg
,10411,20000530132,$155,派克,PARKER,SON SE18 GREY PGT BP 圆珠笔,http://static.lottedfs.cn/prod/prd-img/74/88/60/00/00/02/20000608874_1.jpg
,10411,20000530127,$278,派克,PARKER,SON SE18 GREY PGT FP 钢笔,http://static.lottedfs.cn/prod/prd-img/69/88/60/00/00/02/20000608869_1.jpg
,10411,20000530121,$155,派克,PARKER,SON SE18 BLK+BL CT BP 圆珠笔,http://static.lottedfs.cn/prod/prd-img/63/88/60/00/00/02/20000608863_1.jpg
,10411,20000530115,$278,派克,PARKER,SON SE18 BLK+BL CT FP 钢笔,http://static.lottedfs.cn/prod/prd-img/57/88/60/00/00/02/20000608857_1.jpg
,10411,20000530108,$247,派克,PARKER,SON SE18 BLU SLV CT BP 圆珠笔,http://static.lottedfs.cn/prod/prd-img/50/88/60/00/00/02/20000608850_1.jpg
,10411,20000530024,$386,派克,PARKER,SON SE18 BLU SLV CT FP 钢笔,http://static.lottedfs.cn/prod/prd-img/52/87/60/00/00/02/20000608752_1.jpg
,10411,20000512051,$52,派克,PARKER,PK URB PRM DK BLU BP M.BLK GB 圆珠笔,http://static.lottedfs.cn/prod/prd-img/21/25/58/00/00/02/20000582521_1.jpg
,10411,20000512047,$52,派克,PARKER,PK URB PRM PRL BP M.BLK GB 圆珠笔,http://static.lottedfs.cn/prod/prd-img/14/25/58/00/00/02/20000582514_1.jpg
,10411,20000503033,$65,派克,PARKER,PK SON SS CT BP M BLK GB 圆珠笔,http://static.lottedfs.cn/prod/prd-img/75/96/56/00/00/02/20000569675_1.jpg
,10411,20000503029,$110,派克,PARKER,PK SON SS CT FP F GB 钢笔,http://static.lottedfs.cn/prod/prd-img/71/96/56/00/00/02/20000569671_1.jpg
,10411,20000503027,$103,派克,PARKER,PK SON MBLK GT BP M BLK GB 圆珠笔,http://static.lottedfs.cn/prod/prd-img/69/96/56/00/00/02/20000569669_1.jpg
,10411,20000503002,$103,派克,PARKER,PK SON MBLK CT BP M BLK GB 圆珠笔,http://static.lottedfs.cn/prod/prd-img/41/96/56/00/00/02/20000569641_1.jpg
,10411,20000502979,$162,派克,PARKER,PK SON MBLK CT FP F GB 钢笔,http://static.lottedfs.cn/prod/prd-img/11/96/56/00/00/02/20000569611_1.jpg
,10411,20000502977,$103,派克,PARKER,PK SON RED GT BP M BLK GB 圆珠笔,http://static.lottedfs.cn/prod/prd-img/08/96/56/00/00/02/20000569608_1.jpg
,10411,20000502973,$226,派克,PARKER,PK SON RED GT FP 18K F GB 钢笔,http://static.lottedfs.cn/prod/prd-img/00/96/56/00/00/02/20000569600_1.jpg
,10411,20000502971,$103,派克,PARKER,PK SON BLU CT BP M BLK GB 圆珠笔,http://static.lottedfs.cn/prod/prd-img/98/95/56/00/00/02/20000569598_1.jpg
,10411,20000502968,$226,派克,PARKER,PK SON BLU CT FP 18K F GB 钢笔,http://static.lottedfs.cn/prod/prd-img/95/95/56/00/00/02/20000569595_1.jpg
,10411,20000502960,$103,派克,PARKER,PK SON BLK CT BP M BLK GB 圆珠笔,http://static.lottedfs.cn/prod/prd-img/85/95/56/00/00/02/20000569585_1.jpg
,10411,20000502959,$52,派克,PARKER,PK URB PR SLV PWD CT BP M.BLK GB 圆珠笔,http://static.lottedfs.cn/prod/prd-img/84/95/56/00/00/02/20000569584_1.jpg
,10411,20000502956,$78,派克,PARKER,PK URB PR AUR PWD GT FP F GB 钢笔,http://static.lottedfs.cn/prod/prd-img/81/95/56/00/00/02/20000569581_1.jpg
,10411,20000502951,$52,派克,PARKER,PK URB PR AUR PWD GT BP M.BLK GB 圆珠笔,http://static.lottedfs.cn/prod/prd-img/74/95/56/00/00/02/20000569574_1.jpg
,10411,20000502948,$129,派克,PARKER,PK SON BLK SLV GT BP M BLK GB 圆珠笔,http://static.lottedfs.cn/prod/prd-img/71/95/56/00/00/02/20000569571_1.jpg
,10411,20000502946,$65,派克,PARKER,PK IM PRM DK ESPRM CT FP F GB 钢笔,http://static.lottedfs.cn/prod/prd-img/69/95/56/00/00/02/20000569569_1.jpg
,10411,20000502944,$39,派克,PARKER,PK IM PRM DK ESPRM CT BP M.BLK GB 圆珠笔,http://static.lottedfs.cn/prod/prd-img/67/95/56/00/00/02/20000569567_1.jpg
,10411,20000502941,$246,派克,PARKER,PK SON BLK SLV GT FP 18K F GB 钢笔,http://static.lottedfs.cn/prod/prd-img/61/95/56/00/00/02/20000569561_1.jpg
,10411,20000502940,$65,派克,PARKER,PK IM PRM BLUE CT FP F GB 钢笔,http://static.lottedfs.cn/prod/prd-img/60/95/56/00/00/02/20000569560_1.jpg
,10411,20000502938,$207,派克,PARKER,PK SON SILV PGT BP M BLK GB 圆珠笔,http://static.lottedfs.cn/prod/prd-img/58/95/56/00/00/02/20000569558_1.jpg
,10411,20000502937,$39,派克,PARKER,PK IM PRM BLUE CT BP M.BLK GB 圆珠笔,http://static.lottedfs.cn/prod/prd-img/57/95/56/00/00/02/20000569557_1.jpg
,10411,20000502935,$323,派克,PARKER,PK SON SILV PGT FP F GB 钢笔,http://static.lottedfs.cn/prod/prd-img/55/95/56/00/00/02/20000569555_1.jpg
,10411,20000502931,$207,派克,PARKER,PK SON PRPL CHISL PGT BP M BLK GB 圆珠笔,http://static.lottedfs.cn/prod/prd-img/48/95/56/00/00/02/20000569548_2.jpg
,10411,20000502930,$36,派克,PARKER,PK IM BLK CT FP F+CV TB COO 钢笔,http://static.lottedfs.cn/prod/prd-img/47/95/56/00/00/02/20000569547_1.jpg
,10411,20000502926,$323,派克,PARKER,PK SON PRPL CHISL PGT FP 18K F GB 钢笔,http://static.lottedfs.cn/prod/prd-img/32/95/56/00/00/02/20000569532_1.jpg
,10411,20000502921,$207,派克,PARKER,PK SON CISEL GT BP M BLK GB 圆珠笔,http://static.lottedfs.cn/prod/prd-img/19/95/56/00/00/02/20000569519_1.jpg
,10411,20000502917,$323,派克,PARKER,PK SON CISEL GT FP 18K F GB 钢笔,http://static.lottedfs.cn/prod/prd-img/08/95/56/00/00/02/20000569508_1.jpg
,10411,20000502915,$36,派克,PARKER,PK IM BLUE CT FP F+CV TB COO 钢笔,http://static.lottedfs.cn/prod/prd-img/01/95/56/00/00/02/20000569501_1.jpg
,10411,20000502914,$207,派克,PARKER,PK PREMR SFT BRN PGT BP M BLK GB 圆珠笔,http://static.lottedfs.cn/prod/prd-img/00/95/56/00/00/02/20000569500_1.jpg
,10411,20000502911,$336,派克,PARKER,PK PREMR SFT BRN PGT FP F GB 钢笔,http://static.lottedfs.cn/prod/prd-img/94/94/56/00/00/02/20000569494_1.jpg
,10411,20000502908,$207,派克,PARKER,PK PREMR BLK GT BP M BLKGB 圆珠笔,http://static.lottedfs.cn/prod/prd-img/88/94/56/00/00/02/20000569488_1.jpg
,10411,20000502903,$336,派克,PARKER,PK PREMR BLK GT FP F GB 钢笔,http://static.lottedfs.cn/prod/prd-img/69/94/56/00/00/02/20000569469_1.jpg
,10411,20000502893,$25,派克,PARKER,JOT KENSINGTON RED CT FP F BLU TB 钢笔,http://static.lottedfs.cn/prod/prd-img/50/94/56/00/00/02/20000569450_1.jpg
,10411,20000502890,$207,派克,PARKER,PK PREMR BLK ST BP M BLK GB 圆珠笔,http://static.lottedfs.cn/prod/prd-img/46/94/56/00/00/02/20000569446_1.jpg
,10411,20000502872,$336,派克,PARKER,PK PREMR BLK ST FP F GB 钢笔,http://static.lottedfs.cn/prod/prd-img/14/94/56/00/00/02/20000569414_1.jpg
,10411,20000502871,$23,派克,PARKER,JOT PRM OXF GRY PIN CT BP M BLK TB 圆珠笔,http://static.lottedfs.cn/prod/prd-img/13/94/56/00/00/02/20000569413_1.jpg
,10411,20000502870,$23,派克,PARKER,JOT PRM SS DIAGL CT BP M BLK TB 圆珠笔,http://static.lottedfs.cn/prod/prd-img/12/94/56/00/00/02/20000569412_1.jpg
,10411,20000502869,$271,派克,PARKER,PK PREMR CUST STRM GRY BP M BLK GB 圆珠笔,http://static.lottedfs.cn/prod/prd-img/11/94/56/00/00/02/20000569411_1.jpg
,10411,20000502865,$420,派克,PARKER,PK PREMR CUST STRM GRY FP F GB 钢笔,http://static.lottedfs.cn/prod/prd-img/06/94/56/00/00/02/20000569406_1.jpg
,10411,20000502864,$23,派克,PARKER,JOT PRM BND STR BLK CT BP M BLK TB 圆珠笔,http://static.lottedfs.cn/prod/prd-img/05/94/56/00/00/02/20000569405_1.jpg
,10411,20000502860,$271,派克,PARKER,PK PREMR CUST ST BP M BLK GB 圆珠笔,http://static.lottedfs.cn/prod/prd-img/00/94/56/00/00/02/20000569400_1.jpg
,10411,20000502859,$23,派克,PARKER,JOT PRM TOW GR DIAG CT BP M BLK TB 圆珠笔,http://static.lottedfs.cn/prod/prd-img/99/93/56/00/00/02/20000569399_1.jpg
,10411,20000502856,$43,派克,PARKER,KOREA MULTIPACK IM BP 3PC 笔具套装,http://static.lottedfs.cn/prod/prd-img/96/93/56/00/00/02/20000569396_1.jpg
,10411,20000502848,$36,派克,PARKER,KOREA MULTIPACK JOTTER BP 3PC V1 笔具套装,http://static.lottedfs.cn/prod/prd-img/84/93/56/00/00/02/20000569384_1.jpg
,10411,20000502844,$420,派克,PARKER,PK PREMR CUST ST FP F GB 钢笔,http://static.lottedfs.cn/prod/prd-img/76/93/56/00/00/02/20000569376_1.jpg
,10411,20000502838,$304,派克,PARKER,PK PREMR LX BRN PGT BP M BLK GB 圆珠笔,http://static.lottedfs.cn/prod/prd-img/61/93/56/00/00/02/20000569361_1.jpg
,10411,20000502834,$36,派克,PARKER,KOREA MULTIPACK JOTTER MP 3PC 笔具套装,http://static.lottedfs.cn/prod/prd-img/53/93/56/00/00/02/20000569353_1.jpg
,10411,20000502832,$472,派克,PARKER,PK PREMR LX BRN PGT FP F GB 钢笔,http://static.lottedfs.cn/prod/prd-img/51/93/56/00/00/02/20000569351_1.jpg
