tag,brand_No,product_No,us_price,brand_name_chn,brand_name_eng,product_name,img_url
,17449,20000400549,$60,潘多拉,PANDORA,SILVER CHARM WITH BLUE AND TRANSPARENT MURANO GLASS AND BLUE CUBIC ZIRCONIA 吊坠,http://static.lottedfs.cn/prod/prd-img/12/72/41/00/00/02/20000417212_1.jpg
,17449,20000400542,$105,潘多拉,PANDORA,SNOWFLAKE SILVER CHARM WITH CLEAR CUBIC ZIRCONIA 坠,http://static.lottedfs.cn/prod/prd-img/05/72/41/00/00/02/20000417205_1.jpg
,17449,20000400541,$60,潘多拉,PANDORA,SNOWFLAKE SILVER CHARM WITH BLUE ENAMEL 坠,http://static.lottedfs.cn/prod/prd-img/04/72/41/00/00/02/20000417204_1.jpg
,17449,20000400540,$90,潘多拉,PANDORA,ABSTRACT SILVER CHARM WITH FACETED SYNTHETIC RUBY AND CLEAR CUBIC ZIRCONIA 坠,http://static.lottedfs.cn/prod/prd-img/03/72/41/00/00/02/20000417203_1.jpg
,17449,20000400537,$105,潘多拉,PANDORA,PANDORA ROSE CHRISTMAS TREE CHARM WITH CLEAR CUBIC ZIRCONIA 坠,http://static.lottedfs.cn/prod/prd-img/00/72/41/00/00/02/20000417200_1.jpg
,17449,20000400536,$105,潘多拉,PANDORA,PANDORA ROSE GIFT CHARM WITH CLEAR CUBIC ZIRCONIA 坠,http://static.lottedfs.cn/prod/prd-img/99/71/41/00/00/02/20000417199_1.jpg
,17449,20000400529,$75,潘多拉,PANDORA,ICE CRYSTAL HEART SILVER NECKLACE WITH CLEAR CUBIC ZIRCONIA 项链,http://static.lottedfs.cn/prod/prd-img/92/71/41/00/00/02/20000417192_1.jpg
,17449,20000400528,$120,潘多拉,PANDORA,SILVER PENDANT WITH CLEAR CUBIC ZIRCONIA AND NECKLACE 项链,http://static.lottedfs.cn/prod/prd-img/91/71/41/00/00/02/20000417191_1.jpg
,17449,20000400527,$120,潘多拉,PANDORA,PANDORA ROSE SNOWFLAKE PENDANT WITH CLEAR CUBIC ZIRCONIA 坠,http://static.lottedfs.cn/prod/prd-img/90/71/41/00/00/02/20000417190_1.jpg
,17449,20000400523,$120,潘多拉,PANDORA,PANDORA ROSE STUD EARRINGS WITH CLEAR CUBIC ZIRCONIA 耳饰,http://static.lottedfs.cn/prod/prd-img/86/71/41/00/00/02/20000417186_1.jpg
,17449,20000400486,$75,潘多拉,PANDORA,STAR AND MOON SILVER CHARM WITH WHITE MOTHER OF PEARL MOSAIC AND BLACK ACRYLIC 坠,http://static.lottedfs.cn/prod/prd-img/49/71/41/00/00/02/20000417149_1.jpg
,17449,20000400378,$120,潘多拉,PANDORA,PANDORA ROSE LOGO RING WITH CLEAR CUBIC ZIRCONIA  戒指,http://static.lottedfs.cn/prod/prd-img/57/68/41/00/00/02/20000416857_1.jpg
,17449,20000389190,$100,潘多拉,PANDORA,SILVER NECKLACE 项链,http://static.lottedfs.cn/prod/prd-img/52/45/40/00/00/02/20000404552_1.jpg
,17449,20000380772,$120,潘多拉,PANDORA,PANDORA LOGO HEART SILVER CHARM WITH 14K AND CLEAR CUBIC ZIRCONIA 吊坠,http://static.lottedfs.cn/prod/prd-img/15/42/39/00/00/02/20000394215_1.jpg
,17449,20000380766,$75,潘多拉,PANDORA,PANDORA LOGO HEART SILVER DANGLE WITH 14K AND CLEAR CUBIC ZIRCONIA 吊坠,http://static.lottedfs.cn/prod/prd-img/04/42/39/00/00/02/20000394204_1.jpg
,17449,20000380761,$120,潘多拉,PANDORA,PANDORA LOGO SILVER CLIP WITH 14K AND CLEAR CUBIC ZIRCONIA 吊坠,http://static.lottedfs.cn/prod/prd-img/98/41/39/00/00/02/20000394198_1.jpg
,17449,20000380760,$105,潘多拉,PANDORA,PANDORA LOGO SILVER CLIP WITH 14K 吊坠,http://static.lottedfs.cn/prod/prd-img/97/41/39/00/00/02/20000394197_1.jpg
,17449,20000380752,$200,潘多拉,PANDORA,PANDORA LOGO SILVER SAFETY CHAIN WITH 14K AND CLEAR CUBIC ZIRCONIA 吊坠,http://static.lottedfs.cn/prod/prd-img/81/41/39/00/00/02/20000394181_1.jpg
,17449,20000380749,$45,潘多拉,PANDORA,HEART SILVER CHARM WITH PANDORA LOGO SCRIPT 吊坠,http://static.lottedfs.cn/prod/prd-img/73/41/39/00/00/02/20000394173_1.jpg
,17449,20000380745,$75,潘多拉,PANDORA,PANDORA LOGO SILVER CHARM WITH CLEAR CUBIC ZIRCONIA 串饰,http://static.lottedfs.cn/prod/prd-img/66/41/39/00/00/02/20000394166_1.jpg
,17449,20000380740,$90,潘多拉,PANDORA,SILVER MESH BRACELET 手镯,http://static.lottedfs.cn/prod/prd-img/62/41/39/00/00/02/20000394162_1.jpg
,17449,20000380739,$105,潘多拉,PANDORA,PANDORA LOGO SILVER NECKLACE WITH CLEAR CUBIC ZIRCONIA 项链,http://static.lottedfs.cn/prod/prd-img/56/41/39/00/00/02/20000394156_1.jpg
,17449,20000380738,$55,潘多拉,PANDORA,PANDORA LOGO SILVER PENDANT WITH CLEAR CUBIC ZIRCONIA 吊坠,http://static.lottedfs.cn/prod/prd-img/55/41/39/00/00/02/20000394155_1.jpg
,17449,20000380733,$75,潘多拉,PANDORA,PANDORA LOGO SILVER EARRINGS WITH CLEAR CUBIC ZIRCONIA 耳饰,http://static.lottedfs.cn/prod/prd-img/43/41/39/00/00/02/20000394143_1.jpg
,17449,20000380718,$120,潘多拉,PANDORA,PANDORA LOGO SILVER RING WITH 14K AND CLEAR CUBIC ZIRCONIA  戒指,http://static.lottedfs.cn/prod/prd-img/93/40/39/00/00/02/20000394093_1.jpg
,17449,20000376604,$160,潘多拉,PANDORA,SILVER NECKLACE WITH ROUND CLASP   项链,http://static.lottedfs.cn/prod/prd-img/66/87/38/00/00/02/20000388766_1.jpg
,17449,20000376560,$90,潘多拉,PANDORA,SILVER OPEN BANGLE WITH SILICONE STOPPERS AND INTERCHANGEABLE END CAPS 17.5cm   手镯,http://static.lottedfs.cn/prod/prd-img/60/86/38/00/00/02/20000388660_2.jpg
,17449,20000376559,$155,潘多拉,PANDORA,SILVER OPEN BANGLE WITH SILICONE STOPPERS AND INTERCHANGEABLE END CAPS WITH CLEAR CUBIZ ZICONIA 17.5cm  手镯,http://static.lottedfs.cn/prod/prd-img/45/54/21/03/00/01/10003215445_01.jpg
,17449,20000376558,$155,潘多拉,PANDORA,SILVER OPEN BANGLE WITH SILICONE STOPPERS AND INTERCHANGEABLE END CAPS WITH CLEAR CUBIZ ZICONIA 16cm   手镯,http://static.lottedfs.cn/prod/prd-img/43/54/21/03/00/01/10003215443_01.jpg
,17449,20000368130,$60,潘多拉,PANDORA,HEARTS SILVER SAFETY CHAIN WITH CLEAR CUBIC ZIRCONIA,http://static.lottedfs.cn/prod/prd-img/98/70/37/00/00/02/20000377098_1.jpg
,17449,20000367099,$75,潘多拉,PANDORA,TEARDROP SILVER CHARM WITH CLEAR CUBIC ZIRCONIA  串饰,http://static.lottedfs.cn/prod/prd-img/15/60/37/00/00/02/20000376015_1.jpg
,17449,20000367094,$45,潘多拉,PANDORA,TEARDROP SILVER SPACER WITH CLEAR CUBIC ZIRCONIA  串饰,http://static.lottedfs.cn/prod/prd-img/10/60/37/00/00/02/20000376010_1.jpg
,17449,20000367085,$60,潘多拉,PANDORA,"PANDA BEAR SILVER CHARM WITH WHITE, BLACK AND GREEN ENAMEL  串饰",http://static.lottedfs.cn/prod/prd-img/01/60/37/00/00/02/20000376001_1.jpg
,17449,20000367083,$50,潘多拉,PANDORA,"SILVER CHARM WITH IRIDESCENT, GOLDEN FRITT AND TRANSPARENT MURANO GLASS  串饰",http://static.lottedfs.cn/prod/prd-img/99/59/37/00/00/02/20000375999_1.jpg
,17449,20000367081,$90,潘多拉,PANDORA,SILVER CHARM WITH CLEAR CUBIC ZIRCONIA  串饰,http://static.lottedfs.cn/prod/prd-img/97/59/37/00/00/02/20000375997_1.jpg
,17449,20000367078,$105,潘多拉,PANDORA,SILVER CLIP WITH CLEAR CUBIC ZIRCONIA  固定夹,http://static.lottedfs.cn/prod/prd-img/94/59/37/00/00/02/20000375994_1.jpg
,17449,20000367076,$75,潘多拉,PANDORA,SILVER CHARM WITH CLEAR CUBIC ZIRCONIA  串饰,http://static.lottedfs.cn/prod/prd-img/92/59/37/00/00/02/20000375992_1.jpg
,17449,20000367067,$60,潘多拉,PANDORA,FAMILY HEART SILVER DANGLE WITH PINK ENAMEL AND CLEAR CUBIC ZIRCONIA  串饰,http://static.lottedfs.cn/prod/prd-img/76/59/37/00/00/02/20000375976_1.jpg
,17449,20000195862,$105,潘多拉,PANDORA,SILVER CHARM WITH CLEAR CUBIC ZIRCONIA 吊坠,http://static.lottedfs.cn/prod/prd-img/62/44/20/00/00/02/20000204462_1.jpg
,17449,20000195860,$90,潘多拉,PANDORA,SILVER CHARM WITH CLEAR CUBIC ZIRCONIA 吊坠,http://static.lottedfs.cn/prod/prd-img/60/44/20/00/00/02/20000204460_1.jpg
,17449,20000195854,$90,潘多拉,PANDORA,PANDORA ROSE CHARM WITH PINK CUBIC ZIRCONIA 吊坠,http://static.lottedfs.cn/prod/prd-img/54/44/20/00/00/02/20000204454_1.jpg
畅销,17449,20000195851,$105,潘多拉,PANDORA,PANDORA ROSE CHARM WITH CLEAR CUBIC ZIRCONIA 吊坠,http://static.lottedfs.cn/prod/prd-img/51/44/20/00/00/02/20000204451_1.jpg
,17449,20000195849,$90,潘多拉,PANDORA,PANDORA ROSE CHARM WITH PINK MIST CRYSTAL 吊坠,http://static.lottedfs.cn/prod/prd-img/49/44/20/00/00/02/20000204449_1.jpg
,17449,20000195840,$90,潘多拉,PANDORA,PANDORA ROSE HEART CHARM WITH CLEAR CUBIC ZIRCONIA 吊坠,http://static.lottedfs.cn/prod/prd-img/37/44/20/00/00/02/20000204437_1.jpg
,17449,20000195833,$105,潘多拉,PANDORA,PANDORA ROSE FAMILY TREE DANGLE WITH CLEAR CUBIC ZIRCONIA,http://static.lottedfs.cn/prod/prd-img/23/44/20/00/00/02/20000204423_1.jpg
,17449,20000195821,$105,潘多拉,PANDORA,PANDORA ROSE HEART CLIP WITH CLEAR CUBIC ZIRCONIA,http://static.lottedfs.cn/prod/prd-img/01/44/20/00/00/02/20000204401_1.jpg
,17449,20000195787,$200,潘多拉,PANDORA,TEARDROP SILVER PENDANT WITH CLEAR CUBIC ZIRCONIA AND NECKLACE 银项链,http://static.lottedfs.cn/prod/prd-img/52/43/20/00/00/02/20000204352_1.jpg
,17449,20000195766,$105,潘多拉,PANDORA,TIARA SILVER NECKLACE WITH CLEAR CUBIC ZIRCONIA 项链,http://static.lottedfs.cn/prod/prd-img/19/43/20/00/00/02/20000204319_1.jpg
,17449,20000195589,$105,潘多拉,PANDORA,SILVER PENDANT WITH CLEAR CUBIC ZIRCONIA AND NECKLACE 项链,http://static.lottedfs.cn/prod/prd-img/08/41/20/00/00/02/20000204108_1.jpg
,17449,20000195560,$90,潘多拉,PANDORA,PANDORA ROSE PENDANT WITH CLEAR CUBIC ZIRCONIA 吊坠,http://static.lottedfs.cn/prod/prd-img/71/40/20/00/00/02/20000204071_1.jpg
,17449,20000195554,$90,潘多拉,PANDORA,TIARA SILVER STUD EARRINGS WITH CLEAR CUBIC ZIRCONIA 耳饰,http://static.lottedfs.cn/prod/prd-img/59/40/20/00/00/02/20000204059_1.jpg
,17449,20000195551,$90,潘多拉,PANDORA,SILVER EARRINGS WITH CLEAR CUBIC ZIRCONIA 耳饰,http://static.lottedfs.cn/prod/prd-img/55/40/20/00/00/02/20000204055_1.jpg
,17449,20000195537,$155,潘多拉,PANDORA,TEARDROP SILVER EARRINGS WITH CLEAR CUBIC ZIRCONIA 耳饰,http://static.lottedfs.cn/prod/prd-img/37/40/20/00/00/02/20000204037_1.jpg
,17449,20000195531,$75,潘多拉,PANDORA,PANDORA ROSE STUD EARRINGS WITH CLEAR CUBIC ZIRCONIA 耳饰,http://static.lottedfs.cn/prod/prd-img/27/40/20/00/00/02/20000204027_1.jpg
,17449,20000195474,$55,潘多拉,PANDORA,WISHBONE SILVER RING  戒指,http://static.lottedfs.cn/prod/prd-img/40/39/20/00/00/02/20000203940_1.jpg
,17449,20000194719,$155,潘多拉,PANDORA,SILVER RING WITH CLEAR CUBIC ZIRCONIA 戒指,http://static.lottedfs.cn/prod/prd-img/75/31/20/00/00/02/20000203175_1.jpg
,17449,20000194679,$120,潘多拉,PANDORA,SILVER RING WITH CLEAR CUBIC ZIRCONIA 戒指,http://static.lottedfs.cn/prod/prd-img/08/31/20/00/00/02/20000203108_1.jpg
,17449,20000194645,$90,潘多拉,PANDORA,TIARA SILVER RING WITH CLEAR CUBIC ZIRCONIA 戒指,http://static.lottedfs.cn/prod/prd-img/33/30/20/00/00/02/20000203033_1.jpg
,17449,20000194641,$60,潘多拉,PANDORA,PANDORA ROSE RING 戒指,http://static.lottedfs.cn/prod/prd-img/25/30/20/00/00/02/20000203025_1.jpg
畅销,17449,20000194634,$105,潘多拉,PANDORA,PANDORA ROSE RING WITH CLEAR CUBIC ZIRCONIA 戒指,http://static.lottedfs.cn/prod/prd-img/06/30/20/00/00/02/20000203006_1.jpg
,17449,20000194618,$60,潘多拉,PANDORA,SUNNY DOLL SILVER DANGLE WITH BLACK AND RED ENAMEL,http://static.lottedfs.cn/prod/prd-img/74/29/20/00/00/02/20000202974_1.jpg
畅销,17449,20000190624,$75,潘多拉,PANDORA,RHODIUM PLATED SILVER BRACELET WITH CLEAR CUBIC ZIRCONIA   手链,http://static.lottedfs.cn/prod/prd-img/15/80/19/00/00/02/20000198015_1.jpg
,17449,10003215452,$60,潘多拉,PANDORA,SHOE DRESS AND LIPSTICK SILVER DANGLE WITH CLEAR CUBIC ZIRCONIA RED AND BLACK ENAMEL   吊坠,http://static.lottedfs.cn/prod/prd-img/52/54/21/03/00/01/10003215452_01.jpg
,17449,10003215450,$60,潘多拉,PANDORA,SPARKLING WINE SILVER DANGLE WITH CLEAR CUBIC ZIRCONIA AND RED ENAMEL   吊坠,http://static.lottedfs.cn/prod/prd-img/50/54/21/03/00/01/10003215450_01.jpg
,17449,10003215447,$75,潘多拉,PANDORA,HEART SILVER CHARM WITH CLEAR CUBIC ZIRCONIA   吊坠,http://static.lottedfs.cn/prod/prd-img/47/54/21/03/00/01/10003215447_01.jpg
,17449,10003215446,$60,潘多拉,PANDORA,INTERLOCKED HEARTS SILVER CLIP WITH CLEAR CUBIC ZIRCONIA    吊坠,http://static.lottedfs.cn/prod/prd-img/46/54/21/03/00/01/10003215446_01.jpg
,17449,10003215440,$75,潘多拉,PANDORA,STAR SILVER DANGLE WITH CLEAR CUBIC ZIRCONIA AND SILVER ENAMEL    吊坠,http://static.lottedfs.cn/prod/prd-img/40/54/21/03/00/01/10003215440_01.jpg
,17449,10003215438,$45,潘多拉,PANDORA,TEDDY BEARS SILVER CHARM     吊坠,http://static.lottedfs.cn/prod/prd-img/38/54/21/03/00/01/10003215438_01.jpg
,17449,10003215433,$50,潘多拉,PANDORA,STILETTO SILVER DANGLE WITH RED ENAMEL    吊坠,http://static.lottedfs.cn/prod/prd-img/33/54/21/03/00/01/10003215433_01.jpg
,17449,10003191675,$90,潘多拉,PANDORA,OCEAN LIFE SILVER CHARM WITH FROSTY MINT CLEAR CUBIC ZIRCONIA AND BLUE ENAMEL 坠,http://static.lottedfs.cn/prod/prd-img/75/16/19/03/00/01/10003191675_01.jpg
,17449,10003191674,$60,潘多拉,PANDORA,SILVER CLIP WITH FANCY PINK PINK AND FANCY PURPLE CUBIC ZIRCONIA AND SILICONE GRIP 坠,http://static.lottedfs.cn/prod/prd-img/74/16/19/03/00/01/10003191674_01.jpg
畅销,17449,10003191672,$60,潘多拉,PANDORA,STARFISH SILVER PENDANT WITH CLEAR CUBIC ZIRCONIA 坠,http://static.lottedfs.cn/prod/prd-img/72/16/19/03/00/01/10003191672_01.jpg
,17449,10003191670,$60,潘多拉,PANDORA,ORCHID SILVER DANGLE WITH ORCHID CUBIC ZIRCONIA AND CLEAR CUBIC ZIRCONIA AND WHITE ENAMEL 坠,http://static.lottedfs.cn/prod/prd-img/70/16/19/03/00/01/10003191670_01.jpg
,17449,10003191666,$90,潘多拉,PANDORA,ABSTRACT SILVER CHARM WITH GLACIER CRYSTAL AND CLEAR CUBIC ZIRCONIA 坠,http://static.lottedfs.cn/prod/prd-img/66/16/19/03/00/01/10003191666_01.jpg
,17449,10003191664,$60,潘多拉,PANDORA,ORCHID SILVER CHARM WITH PURPLE CUBIC ZIRCONIA AND ORCHID ENAMEL 坠,http://static.lottedfs.cn/prod/prd-img/64/16/19/03/00/01/10003191664_01.jpg
,17449,10003191661,$50,潘多拉,PANDORA,SILVER CHARM WITH GOLDEN FRIT MINT AND TRANSPARENT MURANO GLASS 坠,http://static.lottedfs.cn/prod/prd-img/61/16/19/03/00/01/10003191661_01.jpg
,17449,10003191660,$60,潘多拉,PANDORA,SILVER CLIP WITH TEAL CUBIC ZIRCONIA GREEN CRYSTAL AND BLUISH GREEN CRYSTAL AND SILICONE GRIP 坠,http://static.lottedfs.cn/prod/prd-img/60/16/19/03/00/01/10003191660_01.jpg
,17449,10003191657,$105,潘多拉,PANDORA,SILVER CLIP WITH TEAL CUBIC ZIRCONIA GREEN CRYSTAL AND BLUISH GREEN CRYSTAL 坠,http://static.lottedfs.cn/prod/prd-img/57/16/19/03/00/01/10003191657_01.jpg
,17449,10003164000,$60,潘多拉,PANDORA,HEART SILVER EARRINGS WITH CLEAR CUBIC ZIRCONIA AND SILVER ENAMEL   耳饰,http://static.lottedfs.cn/prod/prd-img/00/40/16/03/00/01/10003164000_2.jpg
,17449,10003148878,$75,潘多拉,PANDORA,DAISY PANDORA ROSE DANGLE WITH CLEAR CUBIC ZIRCONIA,http://static.lottedfs.cn/prod/prd-img/78/88/14/03/00/01/10003148878_1.jpg
,17449,10003148875,$120,潘多拉,PANDORA,PANDORA ROSE STUD EARRINGS WITH CLEAR CUBIC ZIRCONIA  耳饰,http://static.lottedfs.cn/prod/prd-img/75/88/14/03/00/01/10003148875_01.jpg
,17449,10003148873,$60,潘多拉,PANDORA,DRESS SILVER DANGLE WITH CLEAR CUBIC ZIRCONIA,http://static.lottedfs.cn/prod/prd-img/73/88/14/03/00/01/10003148873_1.jpg
,17449,10003148869,$120,潘多拉,PANDORA,PANDORA ROSE LOGO SAFETY CHAIN WITH CLEAR CUBIC ZIRCONIA SILICONE GRIP AND SILVER CHAIN,http://static.lottedfs.cn/prod/prd-img/69/88/14/03/00/01/10003148869_01.jpg
,17449,10003148863,$75,潘多拉,PANDORA,HEART SILVER CHARM WITH CLEAR CUBIC ZIRCONIA AND SILVER ENAMEL,http://static.lottedfs.cn/prod/prd-img/63/88/14/03/00/01/10003148863_01.jpg
,17449,10003148862,$90,潘多拉,PANDORA,TREE OF LIFE SILVER CHARM WITH 14K AND SILVER ENAMEL,http://static.lottedfs.cn/prod/prd-img/62/88/14/03/00/01/10003148862_01.jpg
,17449,10003148841,$75,潘多拉,PANDORA,OPENWORK DAISY PANDORA ROSE CHARM WITH WHITE ENAMEL   坠,http://static.lottedfs.cn/prod/prd-img/41/88/14/03/00/01/10003148841_01.jpg
,17449,10003148833,$60,潘多拉,PANDORA,SILVER DANGLE WITH CLEAR CUBIC ZIRCONIA AND SILVER ENAMEL    坠,http://static.lottedfs.cn/prod/prd-img/33/88/14/03/00/01/10003148833_1.jpg
,17449,10003148830,$105,潘多拉,PANDORA,PANDORA ROSE LOVE KNOT CHARM WITH CLEAR CUBIC ZIRCONIA,http://static.lottedfs.cn/prod/prd-img/30/88/14/03/00/01/10003148830_01.jpg
,17449,10003148821,$90,潘多拉,PANDORA,SILVER RING WITH CLEAR CUBIC ZIRCONIA   戒指,http://static.lottedfs.cn/prod/prd-img/19/88/14/03/00/01/10003148819_01.jpg
,17449,10003148817,$45,潘多拉,PANDORA,INFINITY SILVER SPACER WITH CLEAR CUBIC ZIRCONIA    坠,http://static.lottedfs.cn/prod/prd-img/17/88/14/03/00/01/10003148817_01.jpg
,17449,10003148816,$100,潘多拉,PANDORA,SILVER RING WITH 14K AND CLEAR CUBIC ZIRCONIA   戒指,http://static.lottedfs.cn/prod/prd-img/16/88/14/03/00/01/10003148816_01.jpg
,17449,10003148800,$90,潘多拉,PANDORA,MOTHER AND DAUGHTER SPLIT HEART SILVER DANGLE WITH CLEAR CUBIC ZIRCONIA AND PINK ENAMEL   坠,http://static.lottedfs.cn/prod/prd-img/00/88/14/03/00/01/10003148800_1.jpg
,17449,10003148799,$120,潘多拉,PANDORA,HEART SILVER PENDANT WITH CLEAR CUBIC ZIRCONIA AND SILVER ENAMEL AND NECKLACE   项链,http://static.lottedfs.cn/prod/prd-img/99/87/14/03/00/01/10003148799_01.jpg
,17449,10003125370,$105,潘多拉,PANDORA,SILVER BRACELET WITH FANCY PINK CUBIC ZIRCONIA  手链,http://static.lottedfs.cn/prod/prd-img/70/53/12/03/00/01/10003125370_01.jpg
,17449,10003125369,$75,潘多拉,PANDORA,SILVER RING WITH ROYAL GREEN CRYSTAL AND MINT ENAMEL 戒指,http://static.lottedfs.cn/prod/prd-img/67/53/12/03/00/01/10003125367_01.jpg
,17449,10003125359,$75,潘多拉,PANDORA,SILVER CHARM WITH AQUA BLUE CRYSTAL  坠,http://static.lottedfs.cn/prod/prd-img/59/53/12/03/00/01/10003125359_02.jpg
,17449,10003125358,$90,潘多拉,PANDORA,DAISY SILVER CHARM WITH PINK CUBIC ZIRCONIA AND CLEAR CUBIC ZIRCONIA  坠,http://static.lottedfs.cn/prod/prd-img/58/53/12/03/00/01/10003125358_01.jpg
,17449,10003125356,$105,潘多拉,PANDORA,SILVER BRACELET WITH FANCY PINK CUBIC ZIRCONIA  手链,http://static.lottedfs.cn/prod/prd-img/56/53/12/03/00/01/10003125356_01.jpg
,17449,10003125355,$75,潘多拉,PANDORA,PANDORA SILVER STUD EARRINGS WITH CUBIC ZIRCONIA  耳饰,http://static.lottedfs.cn/prod/prd-img/55/53/12/03/00/01/10003125355_01.jpg
,17449,10003125350,$60,潘多拉,PANDORA,MAGNOLIA SILVER CLIP WITH PINK CUBIC ZIRCONIA WHITE AND SHADED PINK ENAMEL 吊坠,http://static.lottedfs.cn/prod/prd-img/50/53/12/03/00/01/10003125350_01.jpg
,17449,10003125347,$60,潘多拉,PANDORA,MAGNOLIA SILVER CHARM WITH PINK CUBIC ZIRCONIA WHITE AND SHADED PINK ENAMEL 吊坠,http://static.lottedfs.cn/prod/prd-img/47/53/12/03/00/01/10003125347_01.jpg
,17449,10003125346,$75,潘多拉,PANDORA,SILVER CHARM WITH ICY GREEN CRYSTAL 吊坠,http://static.lottedfs.cn/prod/prd-img/46/53/12/03/00/01/10003125346_01.jpg
,17449,10003125344,$105,潘多拉,PANDORA,SILVER BRACELET WITH CLEAR CUBIC ZIRCONIA WHITE AND PINK ENAMEL ON FLORAL CLASP 手链,http://static.lottedfs.cn/prod/prd-img/44/53/12/03/00/01/10003125344_01.jpg
,17449,10003125339,$75,潘多拉,PANDORA,SILVER CHARM WITH PINK CUBIC ZIRCONIA 吊坠,http://static.lottedfs.cn/prod/prd-img/39/53/12/03/00/01/10003125339_01.jpg
,17449,10003125334,$105,潘多拉,PANDORA,SILVER BRACELET WITH CLEAR CUBIC ZIRCONIA WHITE AND PINK ENAMEL ON FLORAL CLASP 手链,http://static.lottedfs.cn/prod/prd-img/34/53/12/03/00/01/10003125334_01.jpg
,17449,10003125331,$60,潘多拉,PANDORA,MAGNOLIA SILVER SPACER WITH PINK CUBIC ZIRCONIA WHITE AND SHADED PINK ENAMEL 吊坠,http://static.lottedfs.cn/prod/prd-img/31/53/12/03/00/01/10003125331_01.jpg
,17449,10003125328,$105,潘多拉,PANDORA,SILVER BRACELET WITH CLEAR CUBIC ZIRCONIA WHITE AND PINK ENAMEL ON FLORAL CLASP 手链,http://static.lottedfs.cn/prod/prd-img/28/53/12/03/00/01/10003125328_01.jpg
,17449,10003125327,$105,潘多拉,PANDORA,SILVER BRACELET WITH FANCY PINK CUBIC ZIRCONIA 手链,http://static.lottedfs.cn/prod/prd-img/27/53/12/03/00/01/10003125327_01.jpg
,17449,10003125325,$105,潘多拉,PANDORA,SILVER BRACELET WITH CLEAR CUBIC ZIRCONIA WHITE AND PINK ENAMEL ON FLORAL CLASP 手链,http://static.lottedfs.cn/prod/prd-img/25/53/12/03/00/01/10003125325_01.jpg
,17449,10003125324,$75,潘多拉,PANDORA,MAGNOLIA SILVER CHARM WITH PINK CUBIC ZIRCONIA CLEAR CUBIC ZIRCONIA WHITE AND SHADED PINK ENAMEL 吊坠,http://static.lottedfs.cn/prod/prd-img/24/53/12/03/00/01/10003125324_01.jpg
,17449,10003125316,$75,潘多拉,PANDORA,DAISY SILVER STUD EARRINGS WITH CLEAR CUBIC ZIRCONIA 耳饰,http://static.lottedfs.cn/prod/prd-img/16/53/12/03/00/01/10003125316_01.jpg
,17449,10003125312,$90,潘多拉,PANDORA,ABSTRACT SILVER CHARM WITH CLEAR CUBIC ZIRCONIA 吊坠,http://static.lottedfs.cn/prod/prd-img/12/53/12/03/00/01/10003125312_01.jpg
,17449,10003125310,$75,潘多拉,PANDORA,SILVER RING WITH CLEAR CUBIC ZIRCONIA  戒指,http://static.lottedfs.cn/prod/prd-img/35/53/12/03/00/01/10003125335_01.jpg
,17449,10003125309,$90,潘多拉,PANDORA,FLORAL SILVER CLIP WITH CLEAR CUBIC ZIRCONIA WHITE AND PINK ENAMEL 吊坠,http://static.lottedfs.cn/prod/prd-img/09/53/12/03/00/01/10003125309_01.jpg
,17449,10003125307,$60,潘多拉,PANDORA,MAGNOLIA SILVER DANGLE WITH PINK CUBIC ZIRCONIA WHITE AND SHADED PINK ENAMEL 吊坠,http://static.lottedfs.cn/prod/prd-img/07/53/12/03/00/01/10003125307_01.jpg
,17449,10003125303,$105,潘多拉,PANDORA,PANDORA LOGO SILVER DANGLE WITH 14K AND CLEAR CUBIC ZIRCONIA 吊坠,http://static.lottedfs.cn/prod/prd-img/03/53/12/03/00/01/10003125303_01.jpg
畅销,17449,10003125301,$90,潘多拉,PANDORA,HEART SILVER CHARM WITH CLEAR CUBIC ZIRCONIA AND FANCY GOLDEN COLOURED CUBIC ZIRCONIA 吊坠,http://static.lottedfs.cn/prod/prd-img/01/53/12/03/00/01/10003125301_01.jpg
,17449,10003125294,$75,潘多拉,PANDORA,MAGNOLIA SILVER CHARM WITH PINK CUBIC ZIRCONIA CLEAR CUBIC ZIRCONIA WHITE AND SHADED PINK ENAMEL 吊坠,http://static.lottedfs.cn/prod/prd-img/94/52/12/03/00/01/10003125294_01.jpg
,17449,10003125290,$105,潘多拉,PANDORA,SILVER BRACELET WITH FANCY PINK CUBIC ZIRCONIA 手链,http://static.lottedfs.cn/prod/prd-img/90/52/12/03/00/01/10003125290_01.jpg
,17449,10003125288,$105,潘多拉,PANDORA,SILVER BRACELET WITH FANCY PINK CUBIC ZIRCONIA 手链,http://static.lottedfs.cn/prod/prd-img/88/52/12/03/00/01/10003125288_01.jpg
,17449,10003125285,$75,潘多拉,PANDORA,SILVER CHARM WITH LAVENDER CUBIC ZIRCONIA 吊坠,http://static.lottedfs.cn/prod/prd-img/85/52/12/03/00/01/10003125285_01.jpg
,17449,10003125284,$55,潘多拉,PANDORA,DAISY SILVER RING 戒指,http://static.lottedfs.cn/prod/prd-img/53/53/12/03/00/01/10003125353_01.jpg
,17449,10003095198,$105,潘多拉,PANDORA,SILVER BRACELET WITH CLEAR CUBIC ZIRCONIA  手链,http://static.lottedfs.cn/prod/prd-img/98/51/09/03/00/01/10003095198_01.jpg
,17449,10003095196,$60,潘多拉,PANDORA,NOVEMBER BIRTHSTONE SILVER STUD EARRINGS WITH CITRINE 耳饰,http://static.lottedfs.cn/prod/prd-img/96/51/09/03/00/01/10003095196_01.jpg
,17449,10003080622,$90,潘多拉,PANDORA,HEART PAVE SILVER CLIP WITH PINK CUBIC ZIRCONIA 吊坠,http://static.lottedfs.cn/prod/prd-img/22/06/08/03/00/01/10003080622_01.jpg
,17449,10003080621,$45,潘多拉,PANDORA,PENDANT IN STERLING SILVER WITH LONDON BLUE CRYSTAL 吊坠,http://static.lottedfs.cn/prod/prd-img/21/06/08/03/00/01/10003080621_01.jpg
,17449,10003080620,$60,潘多拉,PANDORA,ABSTRACT SILVER CHARM WITH CERISE AND TRANSPARENT MURANO GLASS AND PINK CUBIC ZIRCONIA 吊坠,http://static.lottedfs.cn/prod/prd-img/20/06/08/03/00/01/10003080620_01.jpg
,17449,10003080619,$75,潘多拉,PANDORA,LION DANCE SILVER CHARM WITH CLEAR CUBIC ZIRCONIA WHITE BLACK AND RED ENAMEL 吊坠,http://static.lottedfs.cn/prod/prd-img/19/06/08/03/00/01/10003080619_01.jpg
,17449,10003080618,$75,潘多拉,PANDORA,HEART SILVER CHARM WITH FACETED CERISE CRYSTAL 吊坠,http://static.lottedfs.cn/prod/prd-img/18/06/08/03/00/01/10003080618_01.jpg
,17449,10003080617,$60,潘多拉,PANDORA,FEBRUARY BIRTHSTONE SILVER STUD EARRINGS WITH SYNTHETIC AMETHYST  耳饰,http://static.lottedfs.cn/prod/prd-img/17/06/08/03/00/01/10003080617_01.jpg
,17449,10003080616,$60,潘多拉,PANDORA,JANUARY BIRTHSTONE SILVER STUD EARRINGS WITH GARNET  耳饰,http://static.lottedfs.cn/prod/prd-img/16/06/08/03/00/01/10003080616_01.jpg
,17449,10003080615,$105,潘多拉,PANDORA,SILVER BRACELET WITH CLEAR CUBIC ZIRCONIA 手链,http://static.lottedfs.cn/prod/prd-img/15/06/08/03/00/01/10003080615_01.jpg
,17449,10003080614,$45,潘多拉,PANDORA,AUGUST BIRTHSTONE SILVER PENDANT WITH PERIDOT   项链吊坠,http://static.lottedfs.cn/prod/prd-img/14/06/08/03/00/01/10003080614_01.jpg
,17449,10003080611,$60,潘多拉,PANDORA,JUNE BIRTHSTONE SILVER STUD EARRINGS WITH GREY MOONSTONE  耳饰,http://static.lottedfs.cn/prod/prd-img/11/06/08/03/00/01/10003080611_01.jpg
,17449,10003080610,$60,潘多拉,PANDORA,SEPTEMBER BIRTHSTONE SILVER STUD EARRINGS WITH SYNTHETIC SAPPHIRE  耳饰,http://static.lottedfs.cn/prod/prd-img/10/06/08/03/00/01/10003080610_01.jpg
,17449,10003080608,$45,潘多拉,PANDORA,JANUARY BIRTHSTONE SILVER PENDANT WITH GARNET 吊坠,http://static.lottedfs.cn/prod/prd-img/08/06/08/03/00/01/10003080608_01.jpg
,17449,10003080606,$60,潘多拉,PANDORA,OCTOBER BIRTHSTONE SILVER STUD EARRINGS WITH OPALESCENT PINK CRYSTAL   耳饰,http://static.lottedfs.cn/prod/prd-img/06/06/08/03/00/01/10003080606_01.jpg
,17449,10003080605,$60,潘多拉,PANDORA,AUGUST BIRTHSTONE SILVER STUD EARRINGS WITH PERIDOT   耳饰,http://static.lottedfs.cn/prod/prd-img/05/06/08/03/00/01/10003080605_01.jpg
,17449,10003080604,$60,潘多拉,PANDORA,RIBBON HEART SILVER CHARM WITH CLEAR CUBIC ZIRCONIA 吊坠,http://static.lottedfs.cn/prod/prd-img/04/06/08/03/00/01/10003080604_01.jpg
,17449,10003080603,$45,潘多拉,PANDORA,JUNE BIRTHSTONE SILVER PENDENT WITH GREY MOONSTONE  项链吊坠,http://static.lottedfs.cn/prod/prd-img/03/06/08/03/00/01/10003080603_01.jpg
,17449,10003080602,$45,潘多拉,PANDORA,OCTOBER BIRTHSTONE SILVER PENDANT WITH OPALESCENT PINK CRYSTAL  项链吊坠,http://static.lottedfs.cn/prod/prd-img/02/06/08/03/00/01/10003080602_01.jpg
,17449,10003080601,$60,潘多拉,PANDORA,APRIL BIRTHSTONE SILVER STUD EARRINGS WITH ROCK CRYSTAL  耳饰,http://static.lottedfs.cn/prod/prd-img/01/06/08/03/00/01/10003080601_01.jpg
,17449,10003080600,$60,潘多拉,PANDORA,JULY BIRTHSTONE SILVER STUD EARRINGS WITH SYNTHETIC RUBY  耳饰,http://static.lottedfs.cn/prod/prd-img/00/06/08/03/00/01/10003080600_01.jpg
