tag,brand_No,product_No,us_price,brand_name_chn,brand_name_eng,product_name,img_url
免税独家,19795,20000470392,$19,RED SEAL,RED SEAL,RED SEAL HERB TOOTHPASTE 110g*3 SET 牙膏3件套装,http://static.lottedfs.cn/prod/prd-img/40/70/51/00/00/02/20000517040_1.jpg
免税独家,19795,20000470386,$19,RED SEAL,RED SEAL,RED SEAL LEMON TOOTHPASTE 100g*3 SET 牙膏3件套装,http://static.lottedfs.cn/prod/prd-img/30/70/51/00/00/02/20000517030_1.jpg
,19795,10002364697,$19,RED SEAL,RED SEAL,RED SEAL SMOKERS TOOTHPASTE SET 牙膏3件套,http://static.lottedfs.cn/prod/prd-img/97/46/36/02/00/01/10002364697_01.jpg
,19795,10002364696,$17,RED SEAL,RED SEAL,RED SEAL PROPOLIS TOOTHPASTE SET 牙膏3件套装 (100gX3),http://static.lottedfs.cn/prod/prd-img/96/46/36/02/00/01/10002364696_3.png
,19795,10002364695,$19,RED SEAL,RED SEAL,RED SEAL NATURAL TOOTHPASTE SET  牙膏3件入套装 (110gX3),http://static.lottedfs.cn/prod/prd-img/95/46/36/02/00/01/10002364695_01.jpg
,19795,10002364694,$19,RED SEAL,RED SEAL,RED SEAL KIDS TOOTHPASTE SET  儿童牙膏套装 75g*3,http://static.lottedfs.cn/prod/prd-img/94/46/36/02/00/01/10002364694_01.jpg
,19795,10002364693,$19,RED SEAL,RED SEAL,RED SEAL BAKING SODA TOOTHPASTE SET 牙膏套装,http://static.lottedfs.cn/prod/prd-img/93/46/36/02/00/01/10002364693_01.jpg
