tag,brand_No,product_No,us_price,brand_name_chn,brand_name_eng,product_name,img_url
促销,19870,20000596454,$184,布克兄弟,BROOKSBROTHERS,SILK AND COTTON POLO SWEATER 针织衫,http://static.lottedfs.cn/prod/prd-img/30/80/71/00/00/02/20000718030_3.jpg
促销,19870,20000596451,$184,布克兄弟,BROOKSBROTHERS,BROOKSTECH MERINO WOOL TURTLENECK 针织衫,http://static.lottedfs.cn/prod/prd-img/26/80/71/00/00/02/20000718026_1.jpg
促销 畅销,19870,20000596447,$184,布克兄弟,BROOKSBROTHERS,BROOKSTECH MERINO WOOL TURTLENECK 针织衫,http://static.lottedfs.cn/prod/prd-img/15/80/71/00/00/02/20000718015_3.jpg
促销 免税独家,19870,20000596442,"$1,410",布克兄弟,BROOKSBROTHERS,SUEDE FIELD JACKET 男士外套,http://static.lottedfs.cn/prod/prd-img/95/79/71/00/00/02/20000717995_1.jpg
促销,19870,20000596438,$489,布克兄弟,BROOKSBROTHERS,DIAMOND QUILTED JACKET 男士外套,http://static.lottedfs.cn/prod/prd-img/76/79/71/00/00/02/20000717976_5.jpg
促销 免税独家,19870,20000596434,$489,布克兄弟,BROOKSBROTHERS,DIAMOND QUILTED JACKET 男士外套,http://static.lottedfs.cn/prod/prd-img/62/79/71/00/00/02/20000717962_1.jpg
促销,19870,20000596429,$106,布克兄弟,BROOKSBROTHERS,NON IRON REGENT FIT HEATHERED GINGHAM SPORT SHIRT 男士衬衫,http://static.lottedfs.cn/prod/prd-img/42/79/71/00/00/02/20000717942_1.jpg
促销 免税独家,19870,20000596425,$106,布克兄弟,BROOKSBROTHERS,NON IRON REGENT FIT HEATHERED GINGHAM SPORT SHIRT 男士衬衫,http://static.lottedfs.cn/prod/prd-img/31/79/71/00/00/02/20000717931_1.jpg
促销 免税独家,19870,20000596421,$106,布克兄弟,BROOKSBROTHERS,NON IRON REGENT FIT HEATHERED STRIPE SPORT SHIRT 男士衬衫,http://static.lottedfs.cn/prod/prd-img/18/79/71/00/00/02/20000717918_1.jpg
促销 免税独家,19870,20000596406,$106,布克兄弟,BROOKSBROTHERS,NON IRON REGENT FIT HEATHERED STRIPE SPORT SHIRT 男士衬衫,http://static.lottedfs.cn/prod/prd-img/89/78/71/00/00/02/20000717889_1.jpg
促销,19870,20000596380,$106,布克兄弟,BROOKSBROTHERS,NON-IRON REGENT FIT HEATHERED SPORT SHIRT 衬衫,http://static.lottedfs.cn/prod/prd-img/24/78/71/00/00/02/20000717824_1.jpg
促销,19870,20000596355,$106,布克兄弟,BROOKSBROTHERS,MILANO SLIM FIT DRESS SHIRT NON IRON STRIPE 男士衬衫,http://static.lottedfs.cn/prod/prd-img/48/77/71/00/00/02/20000717748_1.jpg
促销 免税独家,19870,20000596336,$98,布克兄弟,BROOKSBROTHERS,TEXTURED BB1 STRIPE TIE 领带,http://static.lottedfs.cn/prod/prd-img/80/76/71/00/00/02/20000717680_1.jpg
促销 免税独家,19870,20000596333,$113,布克兄弟,BROOKSBROTHERS,GLEN PLAID WITH FLEECE TIE 领带,http://static.lottedfs.cn/prod/prd-img/66/76/71/00/00/02/20000717666_2.jpg
促销 畅销,19870,20000596326,$113,布克兄弟,BROOKSBROTHERS,HOUND DOG TIE 领带,http://static.lottedfs.cn/prod/prd-img/51/76/71/00/00/02/20000717651_2.jpg
促销 畅销,19870,20000596308,$98,布克兄弟,BROOKSBROTHERS,MELANGE TIE 领带,http://static.lottedfs.cn/prod/prd-img/87/75/71/00/00/02/20000717587_3.jpg
促销 免税独家,19870,20000596297,$98,布克兄弟,BROOKSBROTHERS,TEXTURED NEAT TIE 领带,http://static.lottedfs.cn/prod/prd-img/66/75/71/00/00/02/20000717566_2.jpg
促销,19870,20000593478,$131,布克兄弟,BROOKSBROTHERS,TENNIS V-NECK SWEATER 男士上衣,http://static.lottedfs.cn/prod/prd-img/12/24/71/00/00/02/20000712412_1.jpg
,19870,20000557412,$128,布克兄弟,BROOKSBROTHERS,PATCHWORK MADRAS SHORTS 男士短裤,http://static.lottedfs.cn/prod/prd-img/42/73/65/00/00/02/20000657342_1.jpg
,19870,20000557408,$69,布克兄弟,BROOKSBROTHERS,STRETCH COTTON TWILL SHORTS 男士短裤,http://static.lottedfs.cn/prod/prd-img/30/73/65/00/00/02/20000657330_2.jpg
,19870,20000557403,$84,布克兄弟,BROOKSBROTHERS,SLIM-FIT GARMENT-DYED COTTON-LINEN STRETCH CHINOS 男士裤子,http://static.lottedfs.cn/prod/prd-img/24/73/65/00/00/02/20000657324_1.jpg
,19870,20000557397,$131,布克兄弟,BROOKSBROTHERS,REGENT FIT IRISH LINEN SPORT SHIRT 衬衫,http://static.lottedfs.cn/prod/prd-img/03/73/65/00/00/02/20000657303_1.jpg
,19870,20000557392,$131,布克兄弟,BROOKSBROTHERS,REGENT FIT PATCHWORK MADRAS SPORT SHIRT 衬衫,http://static.lottedfs.cn/prod/prd-img/90/72/65/00/00/02/20000657290_1.jpg
,19870,20000557389,$104,布克兄弟,BROOKSBROTHERS,RF PATCHWORK MADRAS SPORT SHIRT 衬衫,http://static.lottedfs.cn/prod/prd-img/80/72/65/00/00/02/20000657280_1.jpg
,19870,20000557385,$131,布克兄弟,BROOKSBROTHERS,REGENT FIT IRISH LINEN SPORT SHIRT 衬衫,http://static.lottedfs.cn/prod/prd-img/67/72/65/00/00/02/20000657267_1.jpg
促销,19870,20000557382,$100,布克兄弟,BROOKSBROTHERS,TENNIS RACKET AND STRIPE TIE 领带,http://static.lottedfs.cn/prod/prd-img/63/72/65/00/00/02/20000657263_1.jpg
促销,19870,20000557380,$100,布克兄弟,BROOKSBROTHERS,FLEECE AND ANCHOR TIE 领带,http://static.lottedfs.cn/prod/prd-img/57/72/65/00/00/02/20000657257_1.jpg
,19870,20000551005,$50,布克兄弟,BROOKSBROTHERS,SEERSUCKER LEATHER BELT 腰带,http://static.lottedfs.cn/prod/prd-img/91/54/64/00/00/02/20000645491_1.jpg
,19870,20000551004,$50,布克兄弟,BROOKSBROTHERS,MADRAS LEATHER BELT 腰带,http://static.lottedfs.cn/prod/prd-img/86/54/64/00/00/02/20000645486_1.jpg
,19870,20000551003,$46,布克兄弟,BROOKSBROTHERS,SEERSUCKER BASEBALL HAT 帽子,http://static.lottedfs.cn/prod/prd-img/85/54/64/00/00/02/20000645485_1.jpg
,19870,20000551001,$77,布克兄弟,BROOKSBROTHERS,MAGIC PRINT 6 SWIM TRUNKS 裤子,http://static.lottedfs.cn/prod/prd-img/81/54/64/00/00/02/20000645481_1.jpg
,19870,20000550999,$77,布克兄弟,BROOKSBROTHERS,FLORAL 6 SWIM TRUNKS 裤子,http://static.lottedfs.cn/prod/prd-img/69/54/64/00/00/02/20000645469_1.jpg
,19870,20000550996,$131,布克兄弟,BROOKSBROTHERS,REGENT FIT GINGHAM IRISH LINEN SPORT SHIRT 衬衫,http://static.lottedfs.cn/prod/prd-img/63/54/64/00/00/02/20000645463_1.jpg
,19870,20000550995,$89,布克兄弟,BROOKSBROTHERS,FLORAL LINEN-BLEND SPORT SHIRT 衬衫,http://static.lottedfs.cn/prod/prd-img/62/54/64/00/00/02/20000645462_1.jpg
,19870,20000550993,$73,布克兄弟,BROOKSBROTHERS,STRIPED LINEN-BLEND SPORT SHIRT 男士衬衫,http://static.lottedfs.cn/prod/prd-img/57/54/64/00/00/02/20000645457_1.jpg
,19870,20000550992,$73,布克兄弟,BROOKSBROTHERS,PLAID LINEN-BLEND SPORT SHIRT 衬衫,http://static.lottedfs.cn/prod/prd-img/53/54/64/00/00/02/20000645453_1.jpg
,19870,20000550919,$46,布克兄弟,BROOKSBROTHERS,SLUB COTTON JERSEY CONTRAST T-SHIRT T恤衫,http://static.lottedfs.cn/prod/prd-img/37/53/64/00/00/02/20000645337_1.jpg
,19870,20000550918,$53,布克兄弟,BROOKSBROTHERS,TROPICAL PRINT SLUB COTTON JERSEY T-SHIRT T恤衫,http://static.lottedfs.cn/prod/prd-img/32/53/64/00/00/02/20000645332_1.jpg
,19870,20000550917,$46,布克兄弟,BROOKSBROTHERS,SLUB COTTON JERSEY POCKET T-SHIRT T恤衫,http://static.lottedfs.cn/prod/prd-img/26/53/64/00/00/02/20000645326_1.jpg
,19870,20000550916,$46,布克兄弟,BROOKSBROTHERS,SLUB COTTON JERSEY POCKET T-SHIRT T恤衫,http://static.lottedfs.cn/prod/prd-img/23/53/64/00/00/02/20000645323_1.jpg
,19870,20000550914,$46,布克兄弟,BROOKSBROTHERS,STRIPED SLUB COTTON JERSEY T-SHIRT 男士短袖T恤,http://static.lottedfs.cn/prod/prd-img/13/53/64/00/00/02/20000645313_1.jpg
,19870,20000550913,$46,布克兄弟,BROOKSBROTHERS,STRIPED SLUB COTTON JERSEY T-SHIRT T恤衫,http://static.lottedfs.cn/prod/prd-img/08/53/64/00/00/02/20000645308_1.jpg
,19870,20000550912,$77,布克兄弟,BROOKSBROTHERS,TROPICAL PRINT SLUB COTTON JERSEY POLO SHIRT T恤衫,http://static.lottedfs.cn/prod/prd-img/03/53/64/00/00/02/20000645303_1.jpg
,19870,20000550911,$66,布克兄弟,BROOKSBROTHERS,STRIPED SLUB COTTON JERSEY POLO SHIRT 男士短袖T恤,http://static.lottedfs.cn/prod/prd-img/99/52/64/00/00/02/20000645299_1.jpg
,19870,20000550910,$66,布克兄弟,BROOKSBROTHERS,STRIPED SLUB COTTON JERSEY POLO SHIRT T恤衫,http://static.lottedfs.cn/prod/prd-img/95/52/64/00/00/02/20000645295_1.jpg
,19870,20000550909,$46,布克兄弟,BROOKSBROTHERS,STRIPE T-SHIRT T恤衫,http://static.lottedfs.cn/prod/prd-img/91/52/64/00/00/02/20000645291_1.jpg
,19870,20000550908,$46,布克兄弟,BROOKSBROTHERS,STRIPE T-SHIRT T恤衫,http://static.lottedfs.cn/prod/prd-img/86/52/64/00/00/02/20000645286_1.jpg
,19870,20000550906,$66,布克兄弟,BROOKSBROTHERS,STRIPE POLO SHIRT 翻领T恤衫,http://static.lottedfs.cn/prod/prd-img/77/52/64/00/00/02/20000645277_1.jpg
,19870,20000550905,$66,布克兄弟,BROOKSBROTHERS,TIPPING POLO SHIRT 翻领短袖POLO衫,http://static.lottedfs.cn/prod/prd-img/73/52/64/00/00/02/20000645273_1.jpg
,19870,20000550904,$66,布克兄弟,BROOKSBROTHERS,TIPPING POLO SHIRT 翻领T恤衫,http://static.lottedfs.cn/prod/prd-img/68/52/64/00/00/02/20000645268_1.jpg
,19870,20000550903,$66,布克兄弟,BROOKSBROTHERS,TIPPING POLO SHIRT 翻领T恤,http://static.lottedfs.cn/prod/prd-img/63/52/64/00/00/02/20000645263_1.jpg
,19870,20000550899,$128,布克兄弟,BROOKSBROTHERS,MILANO FIT STRIPE SEERSUCKER PANTS 男士裤子,http://static.lottedfs.cn/prod/prd-img/51/52/64/00/00/02/20000645251_1.jpg
,19870,20000550894,$84,布克兄弟,BROOKSBROTHERS,RED FLEECE SHORT SEERSUCKER EMB KHAKI 男士短裤,http://static.lottedfs.cn/prod/prd-img/27/52/64/00/00/02/20000645227_1.jpg
,19870,20000550893,$84,布克兄弟,BROOKSBROTHERS,RED FLEECE SHORT SEERSUCKER EMB NAVY 男士短裤,http://static.lottedfs.cn/prod/prd-img/24/52/64/00/00/02/20000645224_1.jpg
,19870,20000550892,$69,布克兄弟,BROOKSBROTHERS,RED FLEECE SHORT SEERSUCKER EMB BRIGHT WHITE 男士短裤,http://static.lottedfs.cn/prod/prd-img/17/52/64/00/00/02/20000645217_1.jpg
,19870,20000550891,$84,布克兄弟,BROOKSBROTHERS,COTTON RIPSTOP CARGO SHORTS 男士短裤,http://static.lottedfs.cn/prod/prd-img/13/52/64/00/00/02/20000645213_1.jpg
,19870,20000550890,$69,布克兄弟,BROOKSBROTHERS,STRETCH COTTON TWILL SHORTS 男士短裤,http://static.lottedfs.cn/prod/prd-img/09/52/64/00/00/02/20000645209_1.jpg
促销,19870,20000550889,$131,布克兄弟,BROOKSBROTHERS,LINEN YARNDYES REGENT GRAND CHECK NAVY  男士衬衫,http://static.lottedfs.cn/prod/prd-img/07/52/64/00/00/02/20000645207_1.jpg
,19870,20000550888,$104,布克兄弟,BROOKSBROTHERS,SEERSUCKER NOVELTY REGENT 男士衬衫,http://static.lottedfs.cn/prod/prd-img/03/52/64/00/00/02/20000645203_1.jpg
促销,19870,20000550887,$131,布克兄弟,BROOKSBROTHERS,REGENT FIT GINGHAM IRISH LINEN SPORT SHIRT 男士衬衫,http://static.lottedfs.cn/prod/prd-img/99/51/64/00/00/02/20000645199_1.jpg
促销,19870,20000550886,$131,布克兄弟,BROOKSBROTHERS,REGENT FIT GINGHAM IRISH LINEN SPORT SHIRT 男士衬衫,http://static.lottedfs.cn/prod/prd-img/96/51/64/00/00/02/20000645196_1.jpg
,19870,20000550879,$123,布克兄弟,BROOKSBROTHERS,REGENT FIT GARMENT DYED SEERSUCKER SPORT SHIRT 男士衬衫,http://static.lottedfs.cn/prod/prd-img/80/51/64/00/00/02/20000645180_1.jpg
,19870,20000550878,$104,布克兄弟,BROOKSBROTHERS,REGENT FIT STRIPE SEERSUCKER SPORT SHIRT 男士衬衫,http://static.lottedfs.cn/prod/prd-img/77/51/64/00/00/02/20000645177_1.jpg
,19870,20000550877,$66,布克兄弟,BROOKSBROTHERS,GINGHAM SEERSUCKER SPORT SHIRT 男士衬衫,http://static.lottedfs.cn/prod/prd-img/72/51/64/00/00/02/20000645172_1.jpg
,19870,20000550873,$66,布克兄弟,BROOKSBROTHERS,GINGHAM SEERSUCKER SPORT SHIRT 男士衬衫,http://static.lottedfs.cn/prod/prd-img/64/51/64/00/00/02/20000645164_1.jpg
,19870,20000550871,$53,布克兄弟,BROOKSBROTHERS,GARMENT DYED COTTON PIQUE POLO SHIRT BORDEAUX 男士短袖T恤衫,http://static.lottedfs.cn/prod/prd-img/52/51/64/00/00/02/20000645152_1.jpg
,19870,20000550868,$53,布克兄弟,BROOKSBROTHERS,GARMENT DYED COTTON PIQUE POLO SHIRT BLUE 男士短袖T恤衫,http://static.lottedfs.cn/prod/prd-img/42/51/64/00/00/02/20000645142_1.jpg
,19870,20000550866,$53,布克兄弟,BROOKSBROTHERS,GARMENT DYED COTTON PIQUE POLO SHIRT DARK GREY 男士短袖T恤衫,http://static.lottedfs.cn/prod/prd-img/34/51/64/00/00/02/20000645134_1.jpg
,19870,20000550864,$66,布克兄弟,BROOKSBROTHERS,FRENCH TERRY SHORT SLEEVE CONTRAST SWEATSHIRT 男士短袖T恤衫,http://static.lottedfs.cn/prod/prd-img/28/51/64/00/00/02/20000645128_1.jpg
,19870,20000550861,$66,布克兄弟,BROOKSBROTHERS,FRENCH TERRY SHORT SLEEVE CONTRAST SWEATSHIRT 男士短袖T恤衫,http://static.lottedfs.cn/prod/prd-img/19/51/64/00/00/02/20000645119_1.jpg
,19870,20000550859,$66,布克兄弟,BROOKSBROTHERS,POLO NVLTY MEDIUM BLUE 男士短袖T恤衫,http://static.lottedfs.cn/prod/prd-img/15/51/64/00/00/02/20000645115_1.jpg
,19870,20000550855,$66,布克兄弟,BROOKSBROTHERS,POLO NVLTY MULTI STRIPE 男士短袖T恤衫,http://static.lottedfs.cn/prod/prd-img/04/51/64/00/00/02/20000645104_1.jpg
,19870,20000550852,$38,布克兄弟,BROOKSBROTHERS,RED FLEECE GRAPHIC PRINT T SHIRT 男士短袖T恤衫,http://static.lottedfs.cn/prod/prd-img/94/50/64/00/00/02/20000645094_1.jpg
,19870,20000550850,$38,布克兄弟,BROOKSBROTHERS,SCRN PRINT T SHIRT 男士短袖T恤衫,http://static.lottedfs.cn/prod/prd-img/84/50/64/00/00/02/20000645084_1.jpg
畅销,19870,20000550849,$53,布克兄弟,BROOKSBROTHERS,HAWAIIAN PRINT T SHIRT 短袖T恤,http://static.lottedfs.cn/prod/prd-img/80/50/64/00/00/02/20000645080_1.jpg
,19870,20000550844,$77,布克兄弟,BROOKSBROTHERS,STRIPED COTTON SWEATER POLO 针织衫,http://static.lottedfs.cn/prod/prd-img/63/50/64/00/00/02/20000645063_1.jpg
促销,19870,20000550835,$123,布克兄弟,BROOKSBROTHERS,DOUBLE DOT TIE 领带,http://static.lottedfs.cn/prod/prd-img/35/50/64/00/00/02/20000645035_1.jpg
促销,19870,20000550833,$100,布克兄弟,BROOKSBROTHERS,SQUARE GOLDEN FLEECE TIE 领带,http://static.lottedfs.cn/prod/prd-img/32/50/64/00/00/02/20000645032_1.jpg
促销,19870,20000550825,$100,布克兄弟,BROOKSBROTHERS,MEDALLION PRINT TIE 领带,http://static.lottedfs.cn/prod/prd-img/20/50/64/00/00/02/20000645020_1.jpg
促销,19870,20000550818,$100,布克兄弟,BROOKSBROTHERS,STRIPE TIE 领带,http://static.lottedfs.cn/prod/prd-img/12/50/64/00/00/02/20000645012_1.jpg
,19870,20000550801,$115,布克兄弟,BROOKSBROTHERS,STRETCH MILANO SLIM-FIT DRESS SHIRT NON-IRON STRIPE 男士衬衫,http://static.lottedfs.cn/prod/prd-img/91/49/64/00/00/02/20000644991_1.jpg
,19870,20000550791,$66,布克兄弟,BROOKSBROTHERS,FEEDER STRIPE POLO SHIRT 短袖T恤,http://static.lottedfs.cn/prod/prd-img/71/49/64/00/00/02/20000644971_1.jpg
,19870,20000534494,$66,布克兄弟,BROOKSBROTHERS,STRIPE OXFORD SPORT SHIRT 男士衬衫,http://static.lottedfs.cn/prod/prd-img/49/63/61/00/00/02/20000616349_1.jpg
,19870,20000534493,$66,布克兄弟,BROOKSBROTHERS,SOLID OXFORD POLO BUTTON-DOWN SHIRT 男士衬衫,http://static.lottedfs.cn/prod/prd-img/46/63/61/00/00/02/20000616346_1.jpg
,19870,20000534492,$62,布克兄弟,BROOKSBROTHERS,BRAIDED LEATHER-TRIM BELT 腰带,http://static.lottedfs.cn/prod/prd-img/43/63/61/00/00/02/20000616343_1.jpg
,19870,20000534491,$62,布克兄弟,BROOKSBROTHERS,BRAIDED LEATHER-TRIM BELT 腰带,http://static.lottedfs.cn/prod/prd-img/38/63/61/00/00/02/20000616338_1.jpg
促销,19870,20000534490,$224,布克兄弟,BROOKSBROTHERS,LEATHER BRAIDED BELT 腰带,http://static.lottedfs.cn/prod/prd-img/35/63/61/00/00/02/20000616335_1.jpg
促销,19870,20000534489,$131,布克兄弟,BROOKSBROTHERS,CANVAS WITH LEATHER BELT 腰带,http://static.lottedfs.cn/prod/prd-img/30/63/61/00/00/02/20000616330_1.jpg
,19870,20000534487,$128,布克兄弟,BROOKSBROTHERS,MILANO FIT MULTI-CHECK STRETCH ADVANTAGE CHINOS 男士裤子,http://static.lottedfs.cn/prod/prd-img/20/63/61/00/00/02/20000616320_1.jpg
,19870,20000534486,$84,布克兄弟,BROOKSBROTHERS,SAILBOAT-PRINT COTTON TWILL SHORTS 男士短裤,http://static.lottedfs.cn/prod/prd-img/19/63/61/00/00/02/20000616319_1.jpg
,19870,20000534483,$92,布克兄弟,BROOKSBROTHERS,HERRINGBONE FIVE-POCKET PANTS 男士裤子,http://static.lottedfs.cn/prod/prd-img/06/63/61/00/00/02/20000616306_1.jpg
促销,19870,20000534482,$143,布克兄弟,BROOKSBROTHERS,MILANO FIT SUPIMA COTTON POPLIN STRETCH CHINOS 男士裤子,http://static.lottedfs.cn/prod/prd-img/01/63/61/00/00/02/20000616301_1.jpg
促销,19870,20000534481,$143,布克兄弟,BROOKSBROTHERS,MILANO FIT SUPIMA COTTON POPLIN PANTS 男士裤子,http://static.lottedfs.cn/prod/prd-img/93/62/61/00/00/02/20000616293_1.jpg
,19870,20000534480,$77,布克兄弟,BROOKSBROTHERS,SLIM-FIT GARMENT-DYED STRETCH CHINOS 男士裤子,http://static.lottedfs.cn/prod/prd-img/79/62/61/00/00/02/20000616279_2.jpg
,19870,20000534479,$77,布克兄弟,BROOKSBROTHERS,SLIM FIT GARMENT-DYED CHINOS 男士裤子,http://static.lottedfs.cn/prod/prd-img/76/62/61/00/00/02/20000616276_2.jpg
,19870,20000534478,$115,布克兄弟,BROOKSBROTHERS,NON-IRON REGENT FIT HEATHERED OXFORD SPORT SHIRT 男士衬衫,http://static.lottedfs.cn/prod/prd-img/66/62/61/00/00/02/20000616266_1.jpg
,19870,20000534477,$115,布克兄弟,BROOKSBROTHERS,NON-IRON REGENT FIT HEATHERED OXFORD SPORT SHIRT 男士衬衫,http://static.lottedfs.cn/prod/prd-img/64/62/61/00/00/02/20000616264_1.jpg
,19870,20000534476,$66,布克兄弟,BROOKSBROTHERS,SOLID COTTON OXFORD SPORT SHIRT 男士衬衫,http://static.lottedfs.cn/prod/prd-img/60/62/61/00/00/02/20000616260_1.jpg
,19870,20000534475,$66,布克兄弟,BROOKSBROTHERS,SOLID COTTON OXFORD SPORT SHIRT 男士衬衫,http://static.lottedfs.cn/prod/prd-img/56/62/61/00/00/02/20000616256_1.jpg
,19870,20000534474,$73,布克兄弟,BROOKSBROTHERS,STRIPE NINE-TO-NINE COTTON BROADCLOTH SPORT SHIRT 男士衬衫,http://static.lottedfs.cn/prod/prd-img/52/62/61/00/00/02/20000616252_1.jpg
畅销,19870,20000534473,$73,布克兄弟,BROOKSBROTHERS,COTTON OXFORD FUN SHIRT 男士衬衫,http://static.lottedfs.cn/prod/prd-img/48/62/61/00/00/02/20000616248_1.jpg
,19870,20000534472,$73,布克兄弟,BROOKSBROTHERS,COTTON OXFORTD FUN SHIRT 男士衬衫,http://static.lottedfs.cn/prod/prd-img/44/62/61/00/00/02/20000616244_1.jpg
,19870,20000534471,$66,布克兄弟,BROOKSBROTHERS,WINDOWPANE COTTON OXFORD SPORT SHIRT 男士衬衫,http://static.lottedfs.cn/prod/prd-img/40/62/61/00/00/02/20000616240_1.jpg
,19870,20000534470,$66,布克兄弟,BROOKSBROTHERS,MULTI-STRIPE COTTON OXFORD SPORT SHIRT 男士衬衫,http://static.lottedfs.cn/prod/prd-img/36/62/61/00/00/02/20000616236_1.jpg
,19870,20000534468,$66,布克兄弟,BROOKSBROTHERS,GINGHAM PATTERNED COTTON OXFORD SPORT SHIRT 男士衬衫,http://static.lottedfs.cn/prod/prd-img/30/62/61/00/00/02/20000616230_1.jpg
,19870,20000534467,$60,布克兄弟,BROOKSBROTHERS,NINE-TO-NINE POLO BUTTON-DOWN COLLAR SHIRT 男士衬衫,http://static.lottedfs.cn/prod/prd-img/26/62/61/00/00/02/20000616226_1.jpg
促销,19870,20000534466,$533,布克兄弟,BROOKSBROTHERS,WATER-REPELLENT FIELD JACKET 男士外套,http://static.lottedfs.cn/prod/prd-img/20/62/61/00/00/02/20000616220_1.jpg
促销,19870,20000534464,$340,布克兄弟,BROOKSBROTHERS,DIAMOND QUILTED VEST 男士马夹,http://static.lottedfs.cn/prod/prd-img/13/62/61/00/00/02/20000616213_1.jpg
促销,19870,20000534462,$340,布克兄弟,BROOKSBROTHERS,DIAMOND QUILTED VEST 男士马夹,http://static.lottedfs.cn/prod/prd-img/08/62/61/00/00/02/20000616208_1.jpg
,19870,20000534460,$66,布克兄弟,BROOKSBROTHERS,STRIPED COTTON HENLEY 男士T恤,http://static.lottedfs.cn/prod/prd-img/05/62/61/00/00/02/20000616205_1.jpg
,19870,20000534450,$66,布克兄弟,BROOKSBROTHERS,JERSEY PERFORMANCE POLO SHIRT 男士上衣,http://static.lottedfs.cn/prod/prd-img/70/61/61/00/00/02/20000616170_1.jpg
,19870,20000534446,$66,布克兄弟,BROOKSBROTHERS,JERSEY PERFORMANCE POLO SHIRT 男士上衣,http://static.lottedfs.cn/prod/prd-img/59/61/61/00/00/02/20000616159_1.jpg
促销,19870,20000534440,$93,布克兄弟,BROOKSBROTHERS,PERFORMANCE SERIES BIRDS EYE STRIPE POLO SHIRT 男士上衣,http://static.lottedfs.cn/prod/prd-img/50/61/61/00/00/02/20000616150_1.jpg
促销,19870,20000534435,$93,布克兄弟,BROOKSBROTHERS,PERFORMANCE SERIES BIRDS EYE STRIPE POLO SHIRT 男士上衣,http://static.lottedfs.cn/prod/prd-img/40/61/61/00/00/02/20000616140_1.jpg
促销,19870,20000534432,$112,布克兄弟,BROOKSBROTHERS,SLIM FIT COTTON JERSEY LONG SLEEVE POLO SHIRT 男士上衣,http://static.lottedfs.cn/prod/prd-img/26/61/61/00/00/02/20000616126_1.jpg
促销,19870,20000534426,$112,布克兄弟,BROOKSBROTHERS,SLIM FIT COTTON JERSEY LONG SLEEVE POLO SHIRT 男士上衣,http://static.lottedfs.cn/prod/prd-img/14/61/61/00/00/02/20000616114_1.jpg
,19870,20000534412,$28,布克兄弟,BROOKSBROTHERS,GARMENT DYED T SHIRT 男士T恤衫,http://static.lottedfs.cn/prod/prd-img/92/60/61/00/00/02/20000616092_1.jpg
,19870,20000534402,$48,布克兄弟,BROOKSBROTHERS,GARMENT DYED COTTON PIQUE POLO SHIRT 男士上衣,http://static.lottedfs.cn/prod/prd-img/57/60/61/00/00/02/20000616057_1.jpg
,19870,20000534386,$28,布克兄弟,BROOKSBROTHERS,GARMENT DYED T SHIRT 男士T恤衫,http://static.lottedfs.cn/prod/prd-img/26/60/61/00/00/02/20000616026_1.jpg
促销,19870,20000534374,$131,布克兄弟,BROOKSBROTHERS,LINEN AND COTTON POLO SWEATER 男士上衣,http://static.lottedfs.cn/prod/prd-img/03/60/61/00/00/02/20000616003_1.jpg
促销,19870,20000534365,$131,布克兄弟,BROOKSBROTHERS,LINEN AND COTTON POLO SWEATER 男士上衣,http://static.lottedfs.cn/prod/prd-img/81/59/61/00/00/02/20000615981_1.jpg
,19870,20000534360,$66,布克兄弟,BROOKSBROTHERS,COTTON-CASHMERE CREWNECK SWEATER 男士上衣,http://static.lottedfs.cn/prod/prd-img/68/59/61/00/00/02/20000615968_1.jpg
,19870,20000534353,$66,布克兄弟,BROOKSBROTHERS,COTTON-CASHMERE CREWNECK SWEATER 男士上衣,http://static.lottedfs.cn/prod/prd-img/56/59/61/00/00/02/20000615956_1.jpg
,19870,20000534324,$66,布克兄弟,BROOKSBROTHERS,COTTON CASHMERE CREWNECK SWEATER 男士上衣,http://static.lottedfs.cn/prod/prd-img/99/58/61/00/00/02/20000615899_1.jpg
,19870,20000534320,$66,布克兄弟,BROOKSBROTHERS,COTTON CASHMERE CREWNECK SWEATER 男士上衣,http://static.lottedfs.cn/prod/prd-img/82/58/61/00/00/02/20000615882_1.jpg
,19870,20000534317,$66,布克兄弟,BROOKSBROTHERS,COTTON CASHMERE CREWNECK SWEATER 男士上衣,http://static.lottedfs.cn/prod/prd-img/76/58/61/00/00/02/20000615876_1.jpg
促销,19870,20000534312,$170,布克兄弟,BROOKSBROTHERS,SUPIMA COTTON FULL ZIP CARDIGAN 男士开衫,http://static.lottedfs.cn/prod/prd-img/64/58/61/00/00/02/20000615864_1.jpg
促销,19870,20000534307,$170,布克兄弟,BROOKSBROTHERS,SUPIMA COTTON FULL ZIP CARDIGAN 男士开衫,http://static.lottedfs.cn/prod/prd-img/47/58/61/00/00/02/20000615847_1.jpg
促销,19870,20000534290,$115,布克兄弟,BROOKSBROTHERS,"MILANO SLIM FIT DRESS SHIRT, NON IRON DOBBY DIAMOND 男士衬衫",http://static.lottedfs.cn/prod/prd-img/24/58/61/00/00/02/20000615824_1.jpg
,19870,20000494981,$104,布克兄弟,BROOKSBROTHERS,FLANNEL-LINED CHINOS 男士裤子,http://static.lottedfs.cn/prod/prd-img/77/68/55/00/00/02/20000556877_1.jpg
,19870,20000446816,$84,布克兄弟,BROOKSBROTHERS,EMBROIDERED PINEAPPLE COTTON TWILL SHORTS   短裤,http://static.lottedfs.cn/prod/prd-img/45/42/48/00/00/02/20000484245_1.jpg
,19870,20000446804,$97,布克兄弟,BROOKSBROTHERS,CHAMBRAY PATCHWORK MADRAS SPORT SHIRT LIGHT/PASTEL BLUE 衬衫,http://static.lottedfs.cn/prod/prd-img/19/42/48/00/00/02/20000484219_1.jpg
,19870,20000446798,$28,布克兄弟,BROOKSBROTHERS,GARMENT-DYED T-SHIRT WHITE T恤,http://static.lottedfs.cn/prod/prd-img/92/41/48/00/00/02/20000484192_1.jpg
,19870,20000446768,$48,布克兄弟,BROOKSBROTHERS,GARMENT-DYED COTTON PIQUE POLO SHIRT NAVY 男士短袖T恤,http://static.lottedfs.cn/prod/prd-img/30/41/48/00/00/02/20000484130_1.jpg
,19870,20000446756,$48,布克兄弟,BROOKSBROTHERS,GARMENT-DYED COTTON PIQUE POLO SHIRT  T恤 DARK GREEN,http://static.lottedfs.cn/prod/prd-img/04/41/48/00/00/02/20000484104_1.jpg
,19870,20000446750,$151,布克兄弟,BROOKSBROTHERS,MILANO SLIM-FIT DRESS SHIRT NON-IRON TEXTURED CIRCLES  衬衫 BLUE,http://static.lottedfs.cn/prod/prd-img/67/40/48/00/00/02/20000484067_1.jpg
,19870,20000446735,$117,布克兄弟,BROOKSBROTHERS,STRETCH MILANO SLIM-FIT DRESS SHIRT NON-IRON MINI BB ALTERNATING STRIPE 衬衫,http://static.lottedfs.cn/prod/prd-img/31/40/48/00/00/02/20000484031_1.jpg
,19870,20000446717,$48,布克兄弟,BROOKSBROTHERS,GARMENT-DYED COTTON PIQUE POLO SHIRT  T恤 WHITE,http://static.lottedfs.cn/prod/prd-img/71/39/48/00/00/02/20000483971_1.jpg
,19870,20000439287,$104,布克兄弟,BROOKSBROTHERS,GARMENT DYED 10 BERMUDA SHORTS OATMEAL 短裤,http://static.lottedfs.cn/prod/prd-img/45/17/47/00/00/02/20000471745_1.jpg
乐天专售 免税独家,19870,20000439249,$135,布克兄弟,BROOKSBROTHERS,MILANO FIT PIECE DYED SUPIMA COTTON STRETCH CHINOS  男士裤子  NAVY,http://static.lottedfs.cn/prod/prd-img/81/16/47/00/00/02/20000471681_1.jpg
,19870,20000433421,$182,布克兄弟,BROOKSBROTHERS,RF MADRAS NEEDLEPOINT WALLET  短款钱包,http://static.lottedfs.cn/prod/prd-img/08/10/46/00/00/02/20000461008_6.jpg
,19870,20000433414,$77,布克兄弟,BROOKSBROTHERS,RF SHOE ESPADRILLE PTCHWRK 休闲鞋,http://static.lottedfs.cn/prod/prd-img/92/09/46/00/00/02/20000460992_1.jpg
,19870,20000433405,$115,布克兄弟,BROOKSBROTHERS,ML HAT IVY LB SEERSUCKER 帽子,http://static.lottedfs.cn/prod/prd-img/77/09/46/00/00/02/20000460977_1.jpg
,19870,20000425916,$66,布克兄弟,BROOKSBROTHERS,COTTON CASHMERE V NECK SWEATER   男士毛衣,http://static.lottedfs.cn/prod/prd-img/58/91/44/00/00/02/20000449158_1.jpg
,19870,20000425908,$120,布克兄弟,BROOKSBROTHERS,SMALL ALTERNATING FLOWER TIE  领带,http://static.lottedfs.cn/prod/prd-img/45/91/44/00/00/02/20000449145_3.jpg
,19870,20000425870,$106,布克兄弟,BROOKSBROTHERS,PINWHEEL TIE 领带,http://static.lottedfs.cn/prod/prd-img/84/90/44/00/00/02/20000449084_3.jpg
,19870,20000425852,$106,布克兄弟,BROOKSBROTHERS,TIE CORE CTN PCOAT NAVY 领带,http://static.lottedfs.cn/prod/prd-img/66/90/44/00/00/02/20000449066_1.jpg
,19870,20000425826,$106,布克兄弟,BROOKSBROTHERS,SPACED FRAMED STRIPE TIE  领带,http://static.lottedfs.cn/prod/prd-img/30/90/44/00/00/02/20000449030_1.jpg
,19870,20000425822,$106,布克兄弟,BROOKSBROTHERS,FRAMED POLKA DOT TIE  领带,http://static.lottedfs.cn/prod/prd-img/26/90/44/00/00/02/20000449026_1.jpg
