tag,brand_No,product_No,us_price,brand_name_chn,brand_name_eng,product_name,img_url
,19800,20000507208,$39,LINDSAY,LINDSAY,LINDSAY CHARCOAL MAGIC GEL MODELING PACK 面膜 1kg,http://static.lottedfs.cn/prod/prd-img/85/53/57/00/00/02/20000575385_1.jpg
,19800,20000507202,$39,LINDSAY,LINDSAY,LINDSAY COCOON MAGIC GEL MODELING PACK 面膜 1kg,http://static.lottedfs.cn/prod/prd-img/79/53/57/00/00/02/20000575379_1.jpg
,19800,20000507184,$39,LINDSAY,LINDSAY,LINDSAY PROPOLIS MAGIC GEL MODELING PACK 面膜 1kg,http://static.lottedfs.cn/prod/prd-img/60/53/57/00/00/02/20000575360_1.jpg
,19800,20000507182,$39,LINDSAY,LINDSAY,LINDSAY ROSE MAGIC GEL MODELING PACK 面膜 1kg,http://static.lottedfs.cn/prod/prd-img/58/53/57/00/00/02/20000575358_1.jpg
,19800,20000507180,$39,LINDSAY,LINDSAY,LINDSAY GOLD MAGIC GEL MODELING PACK 面膜 1kg,http://static.lottedfs.cn/prod/prd-img/56/53/57/00/00/02/20000575356_1.jpg
,19800,20000507175,$44,LINDSAY,LINDSAY,LINDSAY PERFECT SOLUTION CHARCOAL MASK SET 面膜 (20ea+10ea),http://static.lottedfs.cn/prod/prd-img/51/53/57/00/00/02/20000575351_1.jpg
,19800,20000507171,$44,LINDSAY,LINDSAY,LINDSAY PERFECT SOLUTION PROPOLIS MASK SET 面膜 (20ea+10ea),http://static.lottedfs.cn/prod/prd-img/47/53/57/00/00/02/20000575347_1.jpg
,19800,20000507164,$44,LINDSAY,LINDSAY,LINDSAY PERFECT SOLUTION BRIGHTENING MASK PACK SET 面膜 (20ea+10ea),http://static.lottedfs.cn/prod/prd-img/37/53/57/00/00/02/20000575337_1.jpg
,19800,20000507159,$44,LINDSAY,LINDSAY,LINDSAY PERFECT SOLUTION MOISTURE MASK PACK SET 面膜 (20ea+10ea),http://static.lottedfs.cn/prod/prd-img/32/53/57/00/00/02/20000575332_1.jpg
,19800,20000486111,$33,LINDSAY,LINDSAY,LINDSAY GOLD MAGIC MODELING PACK TRAY 面膜 5个入套装 *2,http://static.lottedfs.cn/prod/prd-img/60/16/54/00/00/02/20000541660_1.jpg
,19800,20000486106,$12,LINDSAY,LINDSAY,LINDSAY LAVENDER MODELING MASK 面膜 6ea 28g,http://static.lottedfs.cn/prod/prd-img/54/16/54/00/00/02/20000541654_1.jpg
,19800,20000486101,$12,LINDSAY,LINDSAY,LINDSAY VITAMIN MODELING MASK 面膜 6ea 28g,http://static.lottedfs.cn/prod/prd-img/48/16/54/00/00/02/20000541648_1.jpg
,19800,20000486091,$12,LINDSAY,LINDSAY,LINDSAY COOL MODELING MASK 面膜 6ea 28g,http://static.lottedfs.cn/prod/prd-img/31/16/54/00/00/02/20000541631_1.jpg
,19800,20000384703,$12,LINDSAY,LINDSAY,LINDSAY  COLLAGEN DISPOSABLE  MODELING MASK CUP PACK 杯装面膜粉 6EA 1SET,http://static.lottedfs.cn/prod/prd-img/05/69/39/00/00/02/20000396905_1.jpg
,19800,20000384699,$18,LINDSAY,LINDSAY,LINSAY CHARCOAL PREMIUM MODELING MASK LARGE CAPACITY 1kg AND 3 PACK TOOLS,http://static.lottedfs.cn/prod/prd-img/81/89/39/00/00/02/20000398981_1.jpg
,19800,20000384688,$18,LINDSAY,LINDSAY,LINSAY PEARL PREMIUM MODELING MASK LARGE CAPACITY 1kg AND 3 PACK TOOLS,http://static.lottedfs.cn/prod/prd-img/61/89/39/00/00/02/20000398961_1.jpg
,19800,20000383076,$18,LINDSAY,LINDSAY,LINDSAY TEA TREE PREMIUM MODELING MASK 面膜 大容量 1kg & 面膜工具 3件,http://static.lottedfs.cn/prod/prd-img/17/69/39/00/00/02/20000396917_1.jpg
,19800,20000383075,$18,LINDSAY,LINDSAY,LINDSAY GOLD PREMIUM MODELING MASK  橡胶面膜 大容量1kg & 面膜工具3件,http://static.lottedfs.cn/prod/prd-img/16/69/39/00/00/02/20000396916_1.jpg
,19800,20000383073,$18,LINDSAY,LINDSAY,LINDSAY VITAMIN PREMIUM MODELING MASK 橡胶面膜 大容量1kg & 面膜工具3件,http://static.lottedfs.cn/prod/prd-img/14/69/39/00/00/02/20000396914_1.jpg
,19800,20000383072,$18,LINDSAY,LINDSAY,LINDSAY COLLAGEN PREMIUM MODELING MASK 橡胶面膜 大容量 1kg & 面膜工具3件,http://static.lottedfs.cn/prod/prd-img/13/69/39/00/00/02/20000396913_1.jpg
,19800,20000383071,$12,LINDSAY,LINDSAY,LINDSAY LAVENDER DISPOSABLE MODELING MASK CUP PACK 杯装面膜粉 6EA 1SET,http://static.lottedfs.cn/prod/prd-img/12/69/39/00/00/02/20000396912_1.jpg
,19800,20000383070,$12,LINDSAY,LINDSAY,LINDSAY CALENDULA DISPOSABLE MODELING MASK CUP PACK 杯装面膜粉 6EA 1SET,http://static.lottedfs.cn/prod/prd-img/11/69/39/00/00/02/20000396911_1.jpg
,19800,20000383069,$12,LINDSAY,LINDSAY,LINDSAY TEA TREE DISPOSABLE MODELING MASK CUP PACK 杯装面膜粉 6EA 1SET,http://static.lottedfs.cn/prod/prd-img/10/69/39/00/00/02/20000396910_1.jpg
,19800,20000383068,$12,LINDSAY,LINDSAY,LINDSAY CHARCOAL DISPOSABLE MODELING MASK CUP PACK 杯装面膜粉 6EA 1SET,http://static.lottedfs.cn/prod/prd-img/09/69/39/00/00/02/20000396909_1.jpg
,19800,20000383067,$12,LINDSAY,LINDSAY,LINDSAY GOLD DISPOSABLE MODELING MASK CUP PACK 杯装面膜粉 6EA 1SET,http://static.lottedfs.cn/prod/prd-img/08/69/39/00/00/02/20000396908_1.jpg
,19800,20000383066,$12,LINDSAY,LINDSAY,LINDSAY PEARL DISPOSABLE MODELING MASK CUP PACK 杯装面膜粉 6EA 1SET,http://static.lottedfs.cn/prod/prd-img/07/69/39/00/00/02/20000396907_1.jpg
,19800,20000383065,$12,LINDSAY,LINDSAY,LINDSAY VITAMIN DISPOSABLE MODELING MASK CUP PACK 杯装面膜粉 6EA 1SET,http://static.lottedfs.cn/prod/prd-img/06/69/39/00/00/02/20000396906_1.jpg
,19800,10002367147,$20,LINDSAY,LINDSAY,LINDSAY VITAMIN MOISTURE FOAM CLEANSER 洗面奶 200ml,http://static.lottedfs.cn/prod/prd-img/47/71/36/02/00/01/10002367147_01.jpg
,19800,10002367145,$12,LINDSAY,LINDSAY,LINDSAY BRIGHTENING PEARL ALL IN ONE MODELING MASK 面膜 6个,http://static.lottedfs.cn/prod/prd-img/45/71/36/02/00/01/10002367145_1.jpg
,19800,10002367144,$18,LINDSAY,LINDSAY,LINDSAY PEARL ESSENCE MASK 面膜10片,http://static.lottedfs.cn/prod/prd-img/44/71/36/02/00/01/10002367144_1.jpg
,19800,10002367143,$22,LINDSAY,LINDSAY,LINDSAY VITAMIN MOISTURE TONER  化妆水 250ml,http://static.lottedfs.cn/prod/prd-img/43/71/36/02/00/01/10002367143_1.jpg
,19800,10002367140,$12,LINDSAY,LINDSAY,LINDSAY PURIFYING CHARCOAL ALL IN ONE MODELING MASK 面膜 6个,http://static.lottedfs.cn/prod/prd-img/40/71/36/02/00/01/10002367140_1.jpg
,19800,10002367138,$18,LINDSAY,LINDSAY,LINDSAY LUXURY AQUA TEA TREE MAGIC MASK SET 面膜 80g 5个,http://static.lottedfs.cn/prod/prd-img/38/71/36/02/00/01/10002367138_1.jpg
,19800,10002367137,$18,LINDSAY,LINDSAY,LINDSAY LUXURY CHARCOAL MAGIC MASK SET 面膜 80g 5ea,http://static.lottedfs.cn/prod/prd-img/37/71/36/02/00/01/10002367137_1.jpg
,19800,10002367134,$21,LINDSAY,LINDSAY,LINDSAY WATER BALANCE GEL MASK 面膜 10片,http://static.lottedfs.cn/prod/prd-img/34/71/36/02/00/01/10002367134_1.jpg
,19800,10002367130,$25,LINDSAY,LINDSAY,LINDSAY COLLAGEN HOLIC 85 SERUM    精华素  30g,http://static.lottedfs.cn/prod/prd-img/30/71/36/02/00/01/10002367130_01.jpg
,19800,10002367129,$12,LINDSAY,LINDSAY,LINDSAY ICE HYALURONIC ACID ALL IN ONE MODELING MASK   面膜  6个,http://static.lottedfs.cn/prod/prd-img/29/71/36/02/00/01/10002367129_1.jpg
,19800,10002367125,$22,LINDSAY,LINDSAY,SUN MILK   防晒霜  50g,http://static.lottedfs.cn/prod/prd-img/25/71/36/02/00/01/10002367125_01.jpg
,19800,10002367120,$12,LINDSAY,LINDSAY,LINDSAY ENERGIZING GOLD ALL IN ONE MODELING MASK    面膜 6个,http://static.lottedfs.cn/prod/prd-img/20/71/36/02/00/01/10002367120_1.jpg
,19800,10002367118,$12,LINDSAY,LINDSAY,LINDSAY MOISTURE SPIRULINA ALL IN ONE MODELING MASK   面膜  6个,http://static.lottedfs.cn/prod/prd-img/18/71/36/02/00/01/10002367118_1.jpg
,19800,10002367111,$19,LINDSAY,LINDSAY,LINDSAY GOLD SEOK GO CONTOURING MASK   面膜  85g 5个,http://static.lottedfs.cn/prod/prd-img/11/71/36/02/00/01/10002367111_1.jpg
,19800,10002367109,$22,LINDSAY,LINDSAY,LINDSAY VITAMIN MOISTURE LOTION    乳液  100g,http://static.lottedfs.cn/prod/prd-img/09/71/36/02/00/01/10002367109_01.jpg
,19800,10002367107,$23,LINDSAY,LINDSAY,LINDSAY ICE COOLER   按摩器  200g,http://static.lottedfs.cn/prod/prd-img/07/71/36/02/00/01/10002367107_01.jpg
,19800,10002367103,$22,LINDSAY,LINDSAY,LINDSAY VITAMIN MOISTURE EYE CREAM    眼霜  30g,http://static.lottedfs.cn/prod/prd-img/03/71/36/02/00/01/10002367103_01.jpg
,19800,10002367102,$18,LINDSAY,LINDSAY,LINDSAY GOLD MAGIC MASK SET 面膜 80g 5ea,http://static.lottedfs.cn/prod/prd-img/02/71/36/02/00/01/10002367102_1.jpg
