tag,brand_No,product_No,us_price,brand_name_chn,brand_name_eng,product_name,img_url
,16152,20000557954,$523,瑞克朵丝,LOUIS QUATORZE,WOMENS TOTE BAG HN1AT06FA4WH 女士手提包,http://static.lottedfs.cn/prod/prd-img/05/84/65/00/00/02/20000658405_1.JPG
,16152,20000557952,$523,瑞克朵丝,LOUIS QUATORZE,WOMENS TOTE BAG HN1AT06FA4BL 女士手提包,http://static.lottedfs.cn/prod/prd-img/03/84/65/00/00/02/20000658403_1.JPG
,16152,20000557507,$163,瑞克朵丝,LOUIS QUATORZE,WOMENS BIFOLD HALF WALLET SN1DL21FF5BL 短款钱包,http://static.lottedfs.cn/prod/prd-img/44/75/65/00/00/02/20000657544_1.JPG
,16152,20000557502,$163,瑞克朵丝,LOUIS QUATORZE,WOMENS BIFOLD MEDIUM WALLET SN1DL20FF3PI 2折中款钱包,http://static.lottedfs.cn/prod/prd-img/33/75/65/00/00/02/20000657533_1.JPG
,16152,20000557499,$163,瑞克朵丝,LOUIS QUATORZE,WOMENS BIFOLD MEDIUM WALLET SN1DL20FF3BL 女士中款钱包,http://static.lottedfs.cn/prod/prd-img/21/75/65/00/00/02/20000657521_1.JPG
,16152,20000557496,$171,瑞克朵丝,LOUIS QUATORZE,WOMENS BIFOLD LONG WALLET SN1DL19FF1PI 女士长款钱包,http://static.lottedfs.cn/prod/prd-img/06/75/65/00/00/02/20000657506_1.JPG
,16152,20000557490,$186,瑞克朵丝,LOUIS QUATORZE,WOMENS TRIFOLD MEDIUM WALLET SN1DL17FF2PI 女士中款钱包,http://static.lottedfs.cn/prod/prd-img/97/74/65/00/00/02/20000657497_1.JPG
,16152,20000557483,$201,瑞克朵丝,LOUIS QUATORZE,WOMENS TRIFOLD LONG WALLET SN1DL16FF0PI 女士长款钱包,http://static.lottedfs.cn/prod/prd-img/74/74/65/00/00/02/20000657474_1.JPG
,16152,20000557480,$201,瑞克朵丝,LOUIS QUATORZE,WOMENS TRIFOLD LONG WALLET SN1DL16FF0BL 女士长款钱包,http://static.lottedfs.cn/prod/prd-img/62/74/65/00/00/02/20000657462_1.JPG
,16152,20000548748,$133,瑞克朵丝,LOUIS QUATORZE,WOMENS BIFOLD HALF WALLET SN1DL14FF5RE 短款钱包,http://static.lottedfs.cn/prod/prd-img/76/17/64/00/00/02/20000641776_1.jpg
,16152,20000546327,$234,瑞克朵丝,LOUIS QUATORZE,MENS CLUTCH MN1DL03MDATA 手包,http://static.lottedfs.cn/prod/prd-img/60/72/63/00/00/02/20000637260_1.JPG
,16152,20000546325,$234,瑞克朵丝,LOUIS QUATORZE,MENS CLUTCH MN1DL03MDANA 手包,http://static.lottedfs.cn/prod/prd-img/58/72/63/00/00/02/20000637258_1.JPG
,16152,20000546323,$242,瑞克朵丝,LOUIS QUATORZE,WOMENS CROSS HN1SD94FA9NA 斜挎包,http://static.lottedfs.cn/prod/prd-img/56/72/63/00/00/02/20000637256_1.JPG
,16152,20000546321,$242,瑞克朵丝,LOUIS QUATORZE,WOMENS CROSS HN1SD94FA9BL 斜挎包,http://static.lottedfs.cn/prod/prd-img/54/72/63/00/00/02/20000637254_1.JPG
,16152,20000546319,$223,瑞克朵丝,LOUIS QUATORZE,WOMENS TOTE HN1SD92FA4BL 手提包,http://static.lottedfs.cn/prod/prd-img/52/72/63/00/00/02/20000637252_1.JPG
,16152,20000546318,$328,瑞克朵丝,LOUIS QUATORZE,WOMENS TOTE HN1SD91FA4TP 手提包,http://static.lottedfs.cn/prod/prd-img/51/72/63/00/00/02/20000637251_1.JPG
,16152,20000546317,$328,瑞克朵丝,LOUIS QUATORZE,WOMENS TOTE HN1SD91FA4IV 手提包,http://static.lottedfs.cn/prod/prd-img/50/72/63/00/00/02/20000637250_1.JPG
,16152,20000546316,$328,瑞克朵丝,LOUIS QUATORZE,WOMENS TOTE HN1SD91FA4BL 手提包,http://static.lottedfs.cn/prod/prd-img/49/72/63/00/00/02/20000637249_1.JPG
,16152,20000546313,$306,瑞克朵丝,LOUIS QUATORZE,WOMENS CROSS HN1FM23FA9MT 斜挎包,http://static.lottedfs.cn/prod/prd-img/46/72/63/00/00/02/20000637246_1.JPG
,16152,20000546310,$306,瑞克朵丝,LOUIS QUATORZE,WOMENS CROSS HN1FM23FA9BL 斜挎包,http://static.lottedfs.cn/prod/prd-img/41/72/63/00/00/02/20000637241_1.JPG
,16152,20000545863,$96,瑞克朵丝,LOUIS QUATORZE,WOMENS BUSINESS CARD WALLET SN1DL15FI0RE 名片包,http://static.lottedfs.cn/prod/prd-img/26/61/63/00/00/02/20000636126_1.JPG
,16152,20000545859,$133,瑞克朵丝,LOUIS QUATORZE,WOMENS BIFOLD HALF WALLET SN1DL13FF5RE 短款钱包,http://static.lottedfs.cn/prod/prd-img/19/61/63/00/00/02/20000636119_1.JPG
,16152,20000545848,$133,瑞克朵丝,LOUIS QUATORZE,WOMENS BIFOLD HALF WALLET SN1DL13FF5BL 短款钱包,http://static.lottedfs.cn/prod/prd-img/08/61/63/00/00/02/20000636108_1.JPG
,16152,20000545841,$156,瑞克朵丝,LOUIS QUATORZE,WOMENS BIFOLD MEDIUM WALLET SN1DL12FF3BL 中款钱包,http://static.lottedfs.cn/prod/prd-img/97/60/63/00/00/02/20000636097_1.JPG
,16152,20000545815,$171,瑞克朵丝,LOUIS QUATORZE,WOMENS BIFOLD LONG WALLET SN1DL11FF1RE 长款钱包,http://static.lottedfs.cn/prod/prd-img/57/60/63/00/00/02/20000636057_1.JPG
,16152,20000541684,$163,瑞克朵丝,LOUIS QUATORZE,WOMENS BIFOLD MINI WALLET SN1DL05FF7BU 女士短款钱包,http://static.lottedfs.cn/prod/prd-img/92/02/63/00/00/02/20000630292_1.JPG
,16152,20000541681,$163,瑞克朵丝,LOUIS QUATORZE,WOMENS BIFOLD MINI WALLET SN1DL05FF7BL 女士短款钱包,http://static.lottedfs.cn/prod/prd-img/86/02/63/00/00/02/20000630286_1.JPG
,16152,20000541677,$133,瑞克朵丝,LOUIS QUATORZE,MENS BIFOLD LONG WALLET SN1DL01MF1BL 男士长款钱包,http://static.lottedfs.cn/prod/prd-img/79/02/63/00/00/02/20000630279_1.JPG
,16152,20000541670,$118,瑞克朵丝,LOUIS QUATORZE,MENS BIFOLD HALF WALLET SM4JR03MF5NA 男士短款钱包,http://static.lottedfs.cn/prod/prd-img/65/02/63/00/00/02/20000630265_1.JPG
,16152,20000538915,$321,瑞克朵丝,LOUIS QUATORZE,WOMENS SHOPPER HN1FM31FA5BU 单肩包,http://static.lottedfs.cn/prod/prd-img/71/71/60/00/00/02/20000607171_1.JPG
,16152,20000535890,$133,瑞克朵丝,LOUIS QUATORZE,MENS BIFOLD LONG WALLET SN1DL01MF1BR 长款钱包,http://static.lottedfs.cn/prod/prd-img/29/88/61/00/00/02/20000618829_1.JPG
,16152,20000535889,$291,瑞克朵丝,LOUIS QUATORZE,WOMENS CROSSBODY HN1FM08FA9IV 斜挎包,http://static.lottedfs.cn/prod/prd-img/28/88/61/00/00/02/20000618828_1.JPG
,16152,20000535878,$107,瑞克朵丝,LOUIS QUATORZE,MENS AUTOMATIC DRESS BELT BN1FM12MH0BL 腰带,http://static.lottedfs.cn/prod/prd-img/01/88/61/00/00/02/20000618801_1.JPG
,16152,20000535877,$96,瑞克朵丝,LOUIS QUATORZE,MENS AUTOMATIC DRESS BELT BN1FM11MH0BL 腰带,http://static.lottedfs.cn/prod/prd-img/95/87/61/00/00/02/20000618795_1.JPG
,16152,20000534873,$388,瑞克朵丝,LOUIS QUATORZE,WOMENS TWO SHOULDER  女士单肩包,http://static.lottedfs.cn/prod/prd-img/54/92/37/00/00/02/20000379254_1.JPG
,16152,20000534872,$410,瑞克朵丝,LOUIS QUATORZE,WOMENS TOTE  女士手提包,http://static.lottedfs.cn/prod/prd-img/56/92/37/00/00/02/20000379256_1.JPG
,16152,20000534870,$321,瑞克朵丝,LOUIS QUATORZE,WOMENS ONE SHOULDER  女士单肩包,http://static.lottedfs.cn/prod/prd-img/60/92/37/00/00/02/20000379260_1.JPG
,16152,20000534834,$448,瑞克朵丝,LOUIS QUATORZE,WOMENS TOTE  女士手提包,http://static.lottedfs.cn/prod/prd-img/63/92/37/00/00/02/20000379263_1.JPG
,16152,20000534833,$343,瑞克朵丝,LOUIS QUATORZE,WOMENS ONE SHOULDER  女士单肩包,http://static.lottedfs.cn/prod/prd-img/65/92/37/00/00/02/20000379265_1.JPG
,16152,20000532909,$111,瑞克朵丝,LOUIS QUATORZE,MENS BIFOLD HALF WALLET SN1DL28MF5NA 短款钱包,http://static.lottedfs.cn/prod/prd-img/62/36/61/00/00/02/20000613662_1.jpg
,16152,20000532874,$66,瑞克朵丝,LOUIS QUATORZE,WOMENS CARD WALLET SN1DL07FI1PI 卡包,http://static.lottedfs.cn/prod/prd-img/87/35/61/00/00/02/20000613587_1.jpg
,16152,20000532860,$66,瑞克朵丝,LOUIS QUATORZE,WOMENS CARD WALLET SN1DL07FI1BL 卡包,http://static.lottedfs.cn/prod/prd-img/73/35/61/00/00/02/20000613573_1.JPG
,16152,20000532858,$103,瑞克朵丝,LOUIS QUATORZE,WOMENS CARD WALLET SN1DL06FI0PI 名片包,http://static.lottedfs.cn/prod/prd-img/71/35/61/00/00/02/20000613571_1.jpg
,16152,20000532857,$103,瑞克朵丝,LOUIS QUATORZE,WOMENS CARD WALLET SN1DL06FI0BL 名片包,http://static.lottedfs.cn/prod/prd-img/70/35/61/00/00/02/20000613570_1.JPG
,16152,20000532854,$178,瑞克朵丝,LOUIS QUATORZE,WOMENS TRIFOLD HALF WALLET SN1DL04FF4PI 短款钱包,http://static.lottedfs.cn/prod/prd-img/67/35/61/00/00/02/20000613567_1.jpg
,16152,20000532852,$178,瑞克朵丝,LOUIS QUATORZE,WOMENS TRIFOLD HALF WALLET SN1DL04FF4BL 短款钱包,http://static.lottedfs.cn/prod/prd-img/65/35/61/00/00/02/20000613565_1.JPG
,16152,20000532848,$186,瑞克朵丝,LOUIS QUATORZE,WOMENS TRIFOLD HALF WALLET SN1DL03FF2BU 中款钱包,http://static.lottedfs.cn/prod/prd-img/56/35/61/00/00/02/20000613556_1.JPG
,16152,20000532846,$186,瑞克朵丝,LOUIS QUATORZE,WOMENS TRIFOLD MEDIUM WALLET SN1DL03FF2BL 中款钱包,http://static.lottedfs.cn/prod/prd-img/54/35/61/00/00/02/20000613554_1.jpg
,16152,20000532577,$201,瑞克朵丝,LOUIS QUATORZE,WOMENS TRIFOLD LONG WALLET SN1DL02FF0PI 长款钱包,http://static.lottedfs.cn/prod/prd-img/84/30/61/00/00/02/20000613084_1.JPG
,16152,20000532571,$201,瑞克朵丝,LOUIS QUATORZE,WOMENS TRIFOLD LONG WALLET SN1DL02FF0BL 长款钱包,http://static.lottedfs.cn/prod/prd-img/64/30/61/00/00/02/20000613064_1.JPG
畅销,16152,20000532565,$73,瑞克朵丝,LOUIS QUATORZE,WOMENS CARD WALLET SN1AT18FI1BL 卡包,http://static.lottedfs.cn/prod/prd-img/43/30/61/00/00/02/20000613043_1.JPG
,16152,20000532559,$119,瑞克朵丝,LOUIS QUATORZE,WOMENS ZIPPER ROUNDED HALF WALLET SN1AT17FG2BL 短款钱包,http://static.lottedfs.cn/prod/prd-img/32/30/61/00/00/02/20000613032_1.JPG
畅销,16152,20000532530,$119,瑞克朵丝,LOUIS QUATORZE,WOMENS BIFOLD HALF WALLET SN1AT16FF5BL 短款钱包,http://static.lottedfs.cn/prod/prd-img/66/29/61/00/00/02/20000612966_1.jpg
,16152,20000532317,$111,瑞克朵丝,LOUIS QUATORZE,MENS BIFOLD HALF WALLET SN1DL28MF5GA 男士短款钱包,http://static.lottedfs.cn/prod/prd-img/76/24/61/00/00/02/20000612476_1.JPG
,16152,20000532309,$111,瑞克朵丝,LOUIS QUATORZE,MENS BIFOLD MEDIUM WALLET SN1DL27MF3NA 男士短款钱包,http://static.lottedfs.cn/prod/prd-img/49/24/61/00/00/02/20000612449_1.JPG
,16152,20000532308,$111,瑞克朵丝,LOUIS QUATORZE,MENS BIFOLD MEDIUM WALLET SN1DL27MF3GA 短款钱包,http://static.lottedfs.cn/prod/prd-img/48/24/61/00/00/02/20000612448_1.JPG
,16152,20000532305,$133,瑞克朵丝,LOUIS QUATORZE,MENS BIFOLD LONG WALLET SN1DL26MF1NA 男士长款钱包,http://static.lottedfs.cn/prod/prd-img/41/24/61/00/00/02/20000612441_1.JPG
,16152,20000532303,$88,瑞克朵丝,LOUIS QUATORZE,MENS BUSINESS CARD WALLET SN1DL20MI0BL 名片夹,http://static.lottedfs.cn/prod/prd-img/39/24/61/00/00/02/20000612439_1.JPG
,16152,20000532300,$103,瑞克朵丝,LOUIS QUATORZE,MENS MONEY CLIP SN1DL19MI2BL 钱夹,http://static.lottedfs.cn/prod/prd-img/31/24/61/00/00/02/20000612431_1.JPG
,16152,20000532295,$111,瑞克朵丝,LOUIS QUATORZE,MENS BIFOLD HALF WALLET SN1DL18MF5BL 男士短款钱包,http://static.lottedfs.cn/prod/prd-img/20/24/61/00/00/02/20000612420_1.JPG
,16152,20000532285,$119,瑞克朵丝,LOUIS QUATORZE,MENS BIFOLD LONG WALLET SN1DL16MF1BL 男士长款钱包,http://static.lottedfs.cn/prod/prd-img/02/24/61/00/00/02/20000612402_1.JPG
,16152,20000532260,$298,瑞克朵丝,LOUIS QUATORZE,WOMENS MULTI WALLET SN1DL01FI9IV 钱包,http://static.lottedfs.cn/prod/prd-img/41/23/61/00/00/02/20000612341_1.JPG
,16152,20000532251,$298,瑞克朵丝,LOUIS QUATORZE,WOMENS MULTI WALLET SN1DL01FI9BU 钱包,http://static.lottedfs.cn/prod/prd-img/17/23/61/00/00/02/20000612317_1.JPG
,16152,20000532248,$298,瑞克朵丝,LOUIS QUATORZE,WOMENS MULTI WALLET SN1DL01FI9BL 钱包,http://static.lottedfs.cn/prod/prd-img/05/23/61/00/00/02/20000612305_1.JPG
,16152,20000531540,$119,瑞克朵丝,LOUIS QUATORZE,MENS BIFOLD HALF WALLET SN1DL02MF5BR 男士短款钱包,http://static.lottedfs.cn/prod/prd-img/84/08/61/00/00/02/20000610884_1.JPG
,16152,20000531536,$119,瑞克朵丝,LOUIS QUATORZE,MENS BIFOLD HALF WALLET SN1DL02MF5BL 男士短款钱包,http://static.lottedfs.cn/prod/prd-img/80/08/61/00/00/02/20000610880_1.JPG
,16152,20000531522,$238,瑞克朵丝,LOUIS QUATORZE,WOMENS CLUTCH HN1AT14FA8BL 手拿包,http://static.lottedfs.cn/prod/prd-img/66/08/61/00/00/02/20000610866_1.JPG
,16152,20000531517,$268,瑞克朵丝,LOUIS QUATORZE,WOMENS CROSSBODY HN1AT13FA9BL 斜挎包,http://static.lottedfs.cn/prod/prd-img/60/08/61/00/00/02/20000610860_1.JPG
,16152,20000531511,$381,瑞克朵丝,LOUIS QUATORZE,WOMENS ONE SHOULDER HN1AT11FA0BL 单肩包,http://static.lottedfs.cn/prod/prd-img/54/08/61/00/00/02/20000610854_1.JPG
,16152,20000529314,$122,瑞克朵丝,LOUIS QUATORZE,MENS SLING BAG MN1FM04MT9BL 胸包,http://static.lottedfs.cn/prod/prd-img/91/72/60/00/00/02/20000607291_1.JPG
,16152,20000529312,$107,瑞克朵丝,LOUIS QUATORZE,MENS AUTOMATIC DRESS BELT BN1FM09MH0BL 男士腰带,http://static.lottedfs.cn/prod/prd-img/89/72/60/00/00/02/20000607289_1.JPG
,16152,20000529248,$119,瑞克朵丝,LOUIS QUATORZE,MENS MESSENGER MN1FM05MD2BR 男士邮差包,http://static.lottedfs.cn/prod/prd-img/88/71/60/00/00/02/20000607188_1.JPG
,16152,20000529246,$119,瑞克朵丝,LOUIS QUATORZE,MENS MESSENGER MN1FM05MD2BL 男士邮差包,http://static.lottedfs.cn/prod/prd-img/86/71/60/00/00/02/20000607186_1.JPG
,16152,20000529244,$122,瑞克朵丝,LOUIS QUATORZE,MENS SLING BAG MN1FM04MT9BR 男士胸包,http://static.lottedfs.cn/prod/prd-img/84/71/60/00/00/02/20000607184_1.JPG
,16152,20000529240,$197,瑞克朵丝,LOUIS QUATORZE,MENS BACKPACK MN1FM02MD5BL 男士双肩包,http://static.lottedfs.cn/prod/prd-img/80/71/60/00/00/02/20000607180_1.JPG
,16152,20000529234,$321,瑞克朵丝,LOUIS QUATORZE,WOMENS SHOPPER HN1FM31FA5GR 女士单肩包,http://static.lottedfs.cn/prod/prd-img/74/71/60/00/00/02/20000607174_1.JPG
,16152,20000529229,$321,瑞克朵丝,LOUIS QUATORZE,WOMENS SHOPPER HN1FM31FA5BL 女士单肩包,http://static.lottedfs.cn/prod/prd-img/69/71/60/00/00/02/20000607169_1.JPG
,16152,20000529218,$100,瑞克朵丝,LOUIS QUATORZE,MENS AUTOMATIC DRESS BELT BN1FM13MH0NA 男士腰带,http://static.lottedfs.cn/prod/prd-img/50/71/60/00/00/02/20000607150_1.JPG
,16152,20000529215,$107,瑞克朵丝,LOUIS QUATORZE,MENS AUTOMATIC DRESS BELT BN1FM09MH0NA 男士腰带,http://static.lottedfs.cn/prod/prd-img/46/71/60/00/00/02/20000607146_1.JPG
,16152,20000529212,$111,瑞克朵丝,LOUIS QUATORZE,MENS AUTOMATIC DRESS BELT BN1FM08MH0BL 男士腰带,http://static.lottedfs.cn/prod/prd-img/40/71/60/00/00/02/20000607140_1.JPG
,16152,20000529210,$111,瑞克朵丝,LOUIS QUATORZE,MENS AUTOMATIC DRESS BELT BN1FM07MH0BL 男士腰带,http://static.lottedfs.cn/prod/prd-img/38/71/60/00/00/02/20000607138_1.JPG
,16152,20000529208,$107,瑞克朵丝,LOUIS QUATORZE,MENS AUTOMATIC DRESS BELT BN1FM06MH0BL 男士腰带,http://static.lottedfs.cn/prod/prd-img/35/71/60/00/00/02/20000607135_1.JPG
,16152,20000529206,$107,瑞克朵丝,LOUIS QUATORZE,MENS DRESS BELT (VISIO) BN1DL03MH2NA 男士腰带 手动调节,http://static.lottedfs.cn/prod/prd-img/33/71/60/00/00/02/20000607133_1.JPG
,16152,20000529192,$96,瑞克朵丝,LOUIS QUATORZE,MENS DRESS BELT（VISIO）BN1DL02MH2BR 男士腰带 手动调节,http://static.lottedfs.cn/prod/prd-img/98/70/60/00/00/02/20000607098_1.JPG
,16152,20000529175,$96,瑞克朵丝,LOUIS QUATORZE,MENS DRESS BELT（VISIO） BN1DL02MH2BL 男士腰带 手动调节,http://static.lottedfs.cn/prod/prd-img/45/70/60/00/00/02/20000607045_1.JPG
,16152,20000510727,$201,瑞克朵丝,LOUIS QUATORZE,WOMENS TRIFOLD LONG WALLET SM4JR06FF0GA 女士长款钱包,http://static.lottedfs.cn/prod/prd-img/23/06/58/00/00/02/20000580623_1.JPG
,16152,20000510724,$201,瑞克朵丝,LOUIS QUATORZE,WOMENS TRIFOLD LONG WALLET SM4JR06FF0BL 女士长款钱包,http://static.lottedfs.cn/prod/prd-img/17/06/58/00/00/02/20000580617_1.JPG
,16152,20000510698,$122,瑞克朵丝,LOUIS QUATORZE,MENS MANUAL CASUAL BELT(TAB) BM1AH11MH3BL 男士腰带,http://static.lottedfs.cn/prod/prd-img/74/05/58/00/00/02/20000580574_1.JPG
,16152,20000510283,$122,瑞克朵丝,LOUIS QUATORZE,MENS BIFOLD HALF WALLET SM4JR11MF5KH 短款钱包,http://static.lottedfs.cn/prod/prd-img/80/97/57/00/00/02/20000579780_1.JPG
,16152,20000510280,$122,瑞克朵丝,LOUIS QUATORZE,MENS BIFOLD HALF WALLET SM4JR11MF5BL 短款钱包,http://static.lottedfs.cn/prod/prd-img/77/97/57/00/00/02/20000579777_1.JPG
,16152,20000510278,$178,瑞克朵丝,LOUIS QUATORZE,WOMENS TRIFOLD HALF WALLET SM4JR11FF4GA 短款钱包,http://static.lottedfs.cn/prod/prd-img/75/97/57/00/00/02/20000579775_1.JPG
,16152,20000510277,$178,瑞克朵丝,LOUIS QUATORZE,WOMENS TRIFOLD HALF WALLET SM4JR11FF4BL 短款钱包,http://static.lottedfs.cn/prod/prd-img/74/97/57/00/00/02/20000579774_1.JPG
,16152,20000510263,$111,瑞克朵丝,LOUIS QUATORZE,MENS BIFOLD HALF WALLET SM4JR06MF5NA 短款钱包,http://static.lottedfs.cn/prod/prd-img/60/97/57/00/00/02/20000579760_1.JPG
,16152,20000510249,$111,瑞克朵丝,LOUIS QUATORZE,MENS BIFOLD HALF WALLET SM4JR06MF5BL 短款钱包,http://static.lottedfs.cn/prod/prd-img/46/97/57/00/00/02/20000579746_1.JPG
,16152,20000504762,$103,瑞克朵丝,LOUIS QUATORZE,WOMENS MONEY CLIP SM4JR13FI2GA 钱夹,http://static.lottedfs.cn/prod/prd-img/15/27/57/00/00/02/20000572715_1.JPG
,16152,20000504748,$103,瑞克朵丝,LOUIS QUATORZE,WOMENS MONEY CLIP SM4JR13FI2BL 钱夹,http://static.lottedfs.cn/prod/prd-img/99/26/57/00/00/02/20000572699_1.JPG
,16152,20000504637,$373,瑞克朵丝,LOUIS QUATORZE,WOMENS BACKPACK HM4JR01FB2BL 背包,http://static.lottedfs.cn/prod/prd-img/50/25/57/00/00/02/20000572550_1.JPG
,16152,20000496479,$59,瑞克朵丝,LOUIS QUATORZE,MENS CARD WALLET SM3JR03UI1NA 卡包,http://static.lottedfs.cn/prod/prd-img/45/91/55/00/00/02/20000559145_1.JPG
,16152,20000496453,$298,瑞克朵丝,LOUIS QUATORZE,WOMENS ONE SHOULDER HM2LO12FA0BL 单肩包,http://static.lottedfs.cn/prod/prd-img/15/91/55/00/00/02/20000559115_1.JPG
,16152,20000486337,$66,瑞克朵丝,LOUIS QUATORZE,WOMENS NECKLACE CARD WALLET SM4JR27FJ7BL 女士颈挂式卡包,http://static.lottedfs.cn/prod/prd-img/27/19/54/00/00/02/20000541927_1.JPG
,16152,20000486333,$96,瑞克朵丝,LOUIS QUATORZE,MENS BIFOLD MINI WALLET SM4JR04MF7NA 短款钱包,http://static.lottedfs.cn/prod/prd-img/23/19/54/00/00/02/20000541923_1.JPG
,16152,20000486331,$96,瑞克朵丝,LOUIS QUATORZE,MENS BIFOLD MINI WALLET SM4JR04MF7BL 短款钱包,http://static.lottedfs.cn/prod/prd-img/21/19/54/00/00/02/20000541921_1.JPG
,16152,20000486326,$118,瑞克朵丝,LOUIS QUATORZE,MENS BIFOLD MEDIUM WALLET SM4JR02MF3BL 男士短款钱包,http://static.lottedfs.cn/prod/prd-img/13/19/54/00/00/02/20000541913_1.JPG
,16152,20000486313,$59,瑞克朵丝,LOUIS QUATORZE,MENS CARD WALLET SM3JR09MI1BL 男士卡包,http://static.lottedfs.cn/prod/prd-img/98/18/54/00/00/02/20000541898_1.JPG
,16152,20000485276,$66,瑞克朵丝,LOUIS QUATORZE,WOMENS NECKLACE CARD WALLET SM4JR27FJ7PI 女士颈挂式卡包,http://static.lottedfs.cn/prod/prd-img/14/06/54/00/00/02/20000540614_1.JPG
,16152,20000485266,$118,瑞克朵丝,LOUIS QUATORZE,MENS BIFOLD HALF WALLET SM4JR03MF5BL 男士短款钱包,http://static.lottedfs.cn/prod/prd-img/04/06/54/00/00/02/20000540604_1.JPG
,16152,20000485264,$133,瑞克朵丝,LOUIS QUATORZE,MENS BIFOLD LONG WALLET SM4JR01MF1BL 男士长款钱包,http://static.lottedfs.cn/prod/prd-img/02/06/54/00/00/02/20000540602_1.JPG
畅销,16152,20000477535,$201,瑞克朵丝,LOUIS QUATORZE,MENS CLUTCH MM3JR03MDABL 男士手包,http://static.lottedfs.cn/prod/prd-img/25/80/52/00/00/02/20000528025_1.JPG
,16152,20000477527,$306,瑞克朵丝,LOUIS QUATORZE,WOMENS SINGLE STRAP HOBO HM3JR16FA2NA 女士手提包,http://static.lottedfs.cn/prod/prd-img/13/80/52/00/00/02/20000528013_1.JPG
,16152,20000476109,$425,瑞克朵丝,LOUIS QUATORZE,MENS BRIEFCASE MM3JR01MD0BL 公文包,http://static.lottedfs.cn/prod/prd-img/60/59/52/00/00/02/20000525960_1.JPG
,16152,20000476098,$212,瑞克朵丝,LOUIS QUATORZE,WOMENS CROSSBODY HM3JR26FA9BE 斜挎包,http://static.lottedfs.cn/prod/prd-img/48/59/52/00/00/02/20000525948_1.JPG
,16152,20000475872,$59,瑞克朵丝,LOUIS QUATORZE,UNISEX CARD WALLET SM3JR03UI1STG 卡包(男女同款),http://static.lottedfs.cn/prod/prd-img/53/56/52/00/00/02/20000525653_1.JPG
畅销,16152,20000475863,$234,瑞克朵丝,LOUIS QUATORZE,MENS BAG MM3JR04MD3BL 男士手包,http://static.lottedfs.cn/prod/prd-img/42/56/52/00/00/02/20000525642_1.JPG
,16152,20000475020,$212,瑞克朵丝,LOUIS QUATORZE,WOMENS CROSSBODY HM3JR26FA9BL 斜挎包,http://static.lottedfs.cn/prod/prd-img/69/44/52/00/00/02/20000524469_1.JPG
畅销,16152,20000475017,$306,瑞克朵丝,LOUIS QUATORZE,WOMENS ONE STRAP HOBO HM3JR17FA2TP 手提包,http://static.lottedfs.cn/prod/prd-img/62/44/52/00/00/02/20000524462_1.JPG
,16152,20000475015,$306,瑞克朵丝,LOUIS QUATORZE,WOMENS ONE STRAP HOBO HM3JR17FA2GR 手提包,http://static.lottedfs.cn/prod/prd-img/60/44/52/00/00/02/20000524460_1.JPG
,16152,20000466222,$298,瑞克朵丝,LOUIS QUATORZE,WOMENS ONE SHOULDER HM2LO12FA0TA  女士单肩包,http://static.lottedfs.cn/prod/prd-img/60/02/51/00/00/02/20000510260_1.JPG
,16152,20000460214,$111,瑞克朵丝,LOUIS QUATORZE,MENS AUTOMATIC DRESS BELT BM1AH07MH0BL  腰带,http://static.lottedfs.cn/prod/prd-img/50/31/50/00/00/02/20000503150_1.JPG
,16152,20000456447,$111,瑞克朵丝,LOUIS QUATORZE,MENS AUTOMATIC DRESS BELT BM1AH09MH0BL 腰带,http://static.lottedfs.cn/prod/prd-img/90/75/49/00/00/02/20000497590_1.JPG
,16152,20000454111,$847,瑞克朵丝,LOUIS QUATORZE,WOMENS ONE SHOULDER HM1TL16FA0BL  女士单肩包,http://static.lottedfs.cn/prod/prd-img/74/41/49/00/00/02/20000494174_1.JPG
,16152,20000448585,$321,瑞克朵丝,LOUIS QUATORZE,WOMENS ONE SHOULDER HM2AL03FA0STG  单肩包,http://static.lottedfs.cn/prod/prd-img/15/71/48/00/00/02/20000487115_1.JPG
,16152,20000444990,$100,瑞克朵丝,LOUIS QUATORZE,MENS MONEY CLIP SM2NH19MI2STG  男士钱夹,http://static.lottedfs.cn/prod/prd-img/03/16/48/00/00/02/20000481603_1.JPG
,16152,20000444954,$373,瑞克朵丝,LOUIS QUATORZE,WOMENS TOTE HM2AL02FA4STG  女士手提包,http://static.lottedfs.cn/prod/prd-img/30/15/48/00/00/02/20000481530_1.JPG
,16152,20000444422,$122,瑞克朵丝,LOUIS QUATORZE,MENS BIFOLD LONG WALLET SM2NH09MF1BL  男士长款钱包,http://static.lottedfs.cn/prod/prd-img/20/06/48/00/00/02/20000480620_1.JPG
,16152,20000444416,$107,瑞克朵丝,LOUIS QUATORZE,MENS BIFOLD HALF WALLET SM2NH07MF5BL  男士短款钱包,http://static.lottedfs.cn/prod/prd-img/07/06/48/00/00/02/20000480607_1.JPG
,16152,20000444409,$122,瑞克朵丝,LOUIS QUATORZE,MENS BIFOLD MEDIUM WALLET SM2NH01MF3NA  男士中款钱包,http://static.lottedfs.cn/prod/prd-img/98/05/48/00/00/02/20000480598_1.JPG
,16152,20000444384,$343,瑞克朵丝,LOUIS QUATORZE,WOMENS TOTE HM2AL05FA4BL  女士手提包,http://static.lottedfs.cn/prod/prd-img/66/05/48/00/00/02/20000480566_1.JPG
,16152,20000444372,$111,瑞克朵丝,LOUIS QUATORZE,MENS AUTOMATIC SUIT BELT BM1AH08MH0BL  男士腰带,http://static.lottedfs.cn/prod/prd-img/46/05/48/00/00/02/20000480546_5.jpg
,16152,20000441612,$171,瑞克朵丝,LOUIS QUATORZE,WOMENS CLUTCH HM2TL17FA8STG 女士手拿包,http://static.lottedfs.cn/prod/prd-img/30/52/47/00/00/02/20000475230_1.JPG
,16152,20000439192,$459,瑞克朵丝,LOUIS QUATORZE,WOMENS ONE SHOULDER HM1TL17FA0BL  单肩包,http://static.lottedfs.cn/prod/prd-img/37/15/47/00/00/02/20000471537_1.JPG
,16152,20000436610,$141,瑞克朵丝,LOUIS QUATORZE,MENS BIFOLD HALF WALLET SM1BH02MF5CN 2折短款钱包,http://static.lottedfs.cn/prod/prd-img/00/71/46/00/00/02/20000467100_1.JPG
,16152,20000436588,$249,瑞克朵丝,LOUIS QUATORZE,WOMENS SHOPPER HM2LO06FA5STG 女士单肩包,http://static.lottedfs.cn/prod/prd-img/71/70/46/00/00/02/20000467071_1.JPG
,16152,20000436577,$122,瑞克朵丝,LOUIS QUATORZE,MENS MANUAL FORMAL BELT BIJO BM1AH15MH2BR 男士腰带,http://static.lottedfs.cn/prod/prd-img/53/70/46/00/00/02/20000467053_1.JPG
,16152,20000436573,$122,瑞克朵丝,LOUIS QUATORZE,MENS MANUAL FORMAL BELT BIJO BM1AH15MH2BL 男士腰带,http://static.lottedfs.cn/prod/prd-img/48/70/46/00/00/02/20000467048_1.JPG
,16152,20000436567,$107,瑞克朵丝,LOUIS QUATORZE,MENS AUTOMATIC FORMAL BELT  BM1AH10MH0BL 男士腰带,http://static.lottedfs.cn/prod/prd-img/41/70/46/00/00/02/20000467041_1.JPG
,16152,20000436565,$122,瑞克朵丝,LOUIS QUATORZE,MENS DOUBLE SIDED BELT PIN BELT BM1AH06MH6BL  腰带,http://static.lottedfs.cn/prod/prd-img/22/70/46/00/00/02/20000467022_1.JPG
,16152,20000436559,$107,瑞克朵丝,LOUIS QUATORZE,MENS AUTOMATIC FORMAL BELT BM1AH01MH0BL  腰带,http://static.lottedfs.cn/prod/prd-img/13/70/46/00/00/02/20000467013_1.JPG
,16152,20000435586,$283,瑞克朵丝,LOUIS QUATORZE,MEN S MESSENGER MM1TH02MD2BL  单肩包,http://static.lottedfs.cn/prod/prd-img/89/50/46/00/00/02/20000465089_1.JPG
,16152,20000435585,$328,瑞克朵丝,LOUIS QUATORZE,MEN S MESSENGER MM1TH01MD2BL  单肩包,http://static.lottedfs.cn/prod/prd-img/88/50/46/00/00/02/20000465088_1.JPG
,16152,20000435581,$253,瑞克朵丝,LOUIS QUATORZE,MEN S BAG MM1LH01MD3BL  手拿包,http://static.lottedfs.cn/prod/prd-img/84/50/46/00/00/02/20000465084_1.JPG
,16152,20000435571,$268,瑞克朵丝,LOUIS QUATORZE,MEN S BAG MM1AH11MD3BL  手拿包,http://static.lottedfs.cn/prod/prd-img/51/50/46/00/00/02/20000465051_1.JPG
,16152,20000435564,$351,瑞克朵丝,LOUIS QUATORZE,WOMEN S SINGLE STRAP HOBO HM2LO11FA2TA  单肩包,http://static.lottedfs.cn/prod/prd-img/28/50/46/00/00/02/20000465028_1.JPG
,16152,20000435563,$351,瑞克朵丝,LOUIS QUATORZE,WOMEN S SINGLE STRAP HOBO HM2LO11FA2BL  单肩包,http://static.lottedfs.cn/prod/prd-img/27/50/46/00/00/02/20000465027_1.JPG
,16152,20000435561,$249,瑞克朵丝,LOUIS QUATORZE,WOMEN S SHOPPER HM2LO06FA5BL  单肩包,http://static.lottedfs.cn/prod/prd-img/20/50/46/00/00/02/20000465020_1.JPG
,16152,20000431111,$66,瑞克朵丝,LOUIS QUATORZE,MENS CARD WALLET  男士颈挂式卡包,http://static.lottedfs.cn/prod/prd-img/59/68/45/00/00/02/20000456859_1.JPG
,16152,20000430599,$205,瑞克朵丝,LOUIS QUATORZE,WOMENS BACKPACK 女士背包,http://static.lottedfs.cn/prod/prd-img/57/56/45/00/00/02/20000455657_1.JPG
畅销,16152,20000429309,$251,瑞克朵丝,LOUIS QUATORZE,WOMENS CROSSBODY 斜挎包,http://static.lottedfs.cn/prod/prd-img/06/37/45/00/00/02/20000453706_1.JPG
,16152,20000429306,$290,瑞克朵丝,LOUIS QUATORZE,WOMENS ONE SHOULDER 女士单肩包,http://static.lottedfs.cn/prod/prd-img/03/37/45/00/00/02/20000453703_1.JPG
