tag,brand_No,product_No,us_price,brand_name_chn,brand_name_eng,product_name,img_url
畅销 赠品,1001237,20000424509,$28,WONDER BATH ,WONDER BATH,WONDER BATH SUPER VEGITOKS CLEANSER MAIN PRODUCT 洁面乳 300ml,http://static.lottedfs.cn/prod/prd-img/42/71/44/00/00/02/20000447142_2.jpg
畅销 赠品,1001237,20000559082,$19,WONDER BATH ,WONDER BATH,WONDER BATH SUPER VEGITOCKS CLEANSER GREEN 洗面奶 200ml 1+1,http://static.lottedfs.cn/prod/prd-img/76/04/66/00/00/02/20000660476_1.jpg
畅销 赠品,1001237,20000604444,$28,WONDER BATH ,WONDER BATH,SUPER VEGITOKS CLEANSER 洁面乳 300ml 1+1,http://static.lottedfs.cn/prod/prd-img/86/53/73/00/00/02/20000735386_1.jpg
畅销 赠品,1001237,20000559087,$19,WONDER BATH ,WONDER BATH,SUPER VEGITOCKS CLEANSER RED 洗面奶 200ml 1+1,http://static.lottedfs.cn/prod/prd-img/82/04/66/00/00/02/20000660482_1.jpg
赠品,1001237,20000559085,$19,WONDER BATH ,WONDER BATH,WONDER BATH SUPER VEGITOCKS CLEANSER PURPLE 洗面奶 200ml 1+1,http://static.lottedfs.cn/prod/prd-img/80/04/66/00/00/02/20000660480_1.jpg
赠品,1001237,20000603137,$14,WONDER BATH ,WONDER BATH,SUPER VEGITOKS MASK PACK GREEN 面膜 (6片装) 1+1,http://static.lottedfs.cn/prod/prd-img/32/29/73/00/00/02/20000732932_1.jpg
赠品,1001237,20000603133,$14,WONDER BATH ,WONDER BATH,SUPER VEGITOKS MASK PACK PURPLE 面膜 (6片装) 1+1,http://static.lottedfs.cn/prod/prd-img/22/29/73/00/00/02/20000732922_1.jpg
赠品,1001237,20000603131,$14,WONDER BATH ,WONDER BATH,SUPER VEGITOKS MASK PACK RED 面膜 (6片装) 1+1,http://static.lottedfs.cn/prod/prd-img/08/29/73/00/00/02/20000732908_1.jpg
赠品,1001237,20000469113,$15,WONDER BATH ,WONDER BATH,SALON DE TTE SEASON 3 去角质垫 10个入 1+1,http://static.lottedfs.cn/prod/prd-img/05/49/51/00/00/02/20000514905_1.jpg
