tag,brand_No,product_No,us_price,brand_name_chn,brand_name_eng,product_name,img_url
畅销,18084,20000580960,$202,rouge&lounge,rouge&lounge,ATHENA AMARE MINI CROSSBODY BAG 斜挎包,http://static.lottedfs.cn/prod/prd-img/31/15/69/00/00/02/20000691531_1.png
,18084,20000548006,$121,rouge&lounge,rouge&lounge,FIGO BLUE LONG WALLET 长款钱包,http://static.lottedfs.cn/prod/prd-img/96/00/64/00/00/02/20000640096_1.png
,18084,20000513109,$404,rouge&lounge,rouge&lounge,MIO MEDIUM HANDBAG 手提包,http://static.lottedfs.cn/prod/prd-img/25/43/58/00/00/02/20000584325_1.jpg
,18084,20000616665,$265,rouge&lounge,rouge&lounge,ORMA COCO SPORTS LUX BRIEFCASE 公文包,http://static.lottedfs.cn/prod/prd-img/79/76/75/00/00/02/20000757679_1.png
,18084,20000613934,$334,rouge&lounge,rouge&lounge,EDITH MESH LEATHER MEDIUM TOTE BAG 手提包,http://static.lottedfs.cn/prod/prd-img/84/25/75/00/00/02/20000752584_1.png
畅销,18084,20000613833,$509,rouge&lounge,rouge&lounge,FLORENCE GOAT VINTAGE LARGE TOTE BAG 手提包,http://static.lottedfs.cn/prod/prd-img/27/23/75/00/00/02/20000752327_1.png
,18084,20000613231,$48,rouge&lounge,rouge&lounge,STAR ROAD SNOWFLAKE CHARM DECORATION 包饰,http://static.lottedfs.cn/prod/prd-img/92/10/75/00/00/02/20000751092_1.png
,18084,20000613213,$324,rouge&lounge,rouge&lounge,TIRAMISU WRINKLE GOAT MEDIUM TOTE BAG 手提包,http://static.lottedfs.cn/prod/prd-img/74/10/75/00/00/02/20000751074_1.png
,18084,20000612229,$146,rouge&lounge,rouge&lounge,ATENA MULTI MEDIUM WALLET 中款钱包,http://static.lottedfs.cn/prod/prd-img/32/92/74/00/00/02/20000749232_1.png
,18084,20000610120,$244,rouge&lounge,rouge&lounge,TUTO MILETOSRAM SMALL CROSS BAG 斜挎包,http://static.lottedfs.cn/prod/prd-img/65/52/74/00/00/02/20000745265_1.png
,18084,20000605746,$358,rouge&lounge,rouge&lounge,CAMILA RAMBLA SMALL SHOULDER BAG 单肩包,http://static.lottedfs.cn/prod/prd-img/25/79/73/00/00/02/20000737925_1.png
,18084,20000602955,$358,rouge&lounge,rouge&lounge,CAMILA RAMBLA SMALL SHOULDER BAG 单肩包,http://static.lottedfs.cn/prod/prd-img/27/23/73/00/00/02/20000732327_1.png
畅销,18084,20000602263,$353,rouge&lounge,rouge&lounge,INICIO FIGO MEDIUM TOTE BAG 手提包,http://static.lottedfs.cn/prod/prd-img/97/06/73/00/00/02/20000730697_1.png
,18084,20000602259,$353,rouge&lounge,rouge&lounge,INICIO FIGO MEDIUM TOTE BAG 手提包,http://static.lottedfs.cn/prod/prd-img/91/06/73/00/00/02/20000730691_1.png
,18084,20000598349,$284,rouge&lounge,rouge&lounge,PEONY ATHENA SMALL TOTE BAG 手提包,http://static.lottedfs.cn/prod/prd-img/14/17/72/00/00/02/20000721714_1.png
,18084,20000591243,$319,rouge&lounge,rouge&lounge,LUNA CASH SMALL HANDBAG 手提包,http://static.lottedfs.cn/prod/prd-img/62/88/70/00/00/02/20000708862_1.png
,18084,20000590722,$367,rouge&lounge,rouge&lounge,LUNA CASH BEIGE MEDIUM TOTE BAG 手提包,http://static.lottedfs.cn/prod/prd-img/14/77/70/00/00/02/20000707714_1.png
,18084,20000571957,$399,rouge&lounge,rouge&lounge,DIO SQUARE REAL SNAKE MEDIUM HAND BAG 手提包,http://static.lottedfs.cn/prod/prd-img/39/81/67/00/00/02/20000678139_1.png
畅销,18084,20000566376,$465,rouge&lounge,rouge&lounge,BIANCO SALVATORE STRETCH LAMB MEDIUM TOTE BAG 手提包,http://static.lottedfs.cn/prod/prd-img/76/16/67/00/00/02/20000671676_1.png
,18084,20000561849,$202,rouge&lounge,rouge&lounge,AMARE ATENA MULTI MINI CROSSBODY BAG 迷你斜挎包,http://static.lottedfs.cn/prod/prd-img/69/41/66/00/00/02/20000664169_1.png
,18084,20000547743,$101,rouge&lounge,rouge&lounge,COCO SPORTS LUX LARGE WALLET 长款钱包,http://static.lottedfs.cn/prod/prd-img/95/96/63/00/00/02/20000639695_1.png
畅销,18084,20000541493,$300,rouge&lounge,rouge&lounge,RICORDO DEEP CROCO SMALL TOTE BAG 手提包,http://static.lottedfs.cn/prod/prd-img/58/99/62/00/00/02/20000629958_1.png
,18084,20000535016,$85,rouge&lounge,rouge&lounge,EPI SMALL WALLET 短款钱包,http://static.lottedfs.cn/prod/prd-img/42/72/61/00/00/02/20000617242_1.png
,18084,20000535008,$104,rouge&lounge,rouge&lounge,CASPIER SMALL WALLET 短款钱包,http://static.lottedfs.cn/prod/prd-img/34/72/61/00/00/02/20000617234_1.jpg
,18084,20000534992,$101,rouge&lounge,rouge&lounge,COCO LUX LARGE WALLET 长款钱包,http://static.lottedfs.cn/prod/prd-img/15/72/61/00/00/02/20000617215_1.png
畅销,18084,20000529909,$303,rouge&lounge,rouge&lounge,DIO SQUARE CROCO MINI CROSSBODY BAG 斜挎包,http://static.lottedfs.cn/prod/prd-img/84/84/60/00/00/02/20000608484_1.png
畅销,18084,20000514677,$303,rouge&lounge,rouge&lounge,DIO SQUARE DOT MINI CROSSBODY BAG 斜挎包,http://static.lottedfs.cn/prod/prd-img/86/69/58/00/00/02/20000586986_1.png
畅销,18084,20000511638,$91,rouge&lounge,rouge&lounge,ATENA DOT CARD WALLET 卡包,http://static.lottedfs.cn/prod/prd-img/75/19/58/00/00/02/20000581975_1.jpg
,18084,20000501475,$422,rouge&lounge,rouge&lounge,ATTIVO WAXY PERFORATING MEDIUM BACKPACK 背包,http://static.lottedfs.cn/prod/prd-img/47/70/56/00/00/02/20000567047_1.jpg
新品,18084,20000638949,$101,rouge&lounge,rouge&lounge,LOPEZ LONG WALLET 长款钱包,http://static.lottedfs.cn/prod/prd-img/88/92/78/00/00/02/20000789288_1.png
,18084,20000630889,$334,rouge&lounge,rouge&lounge,NEOEVA IKARO MEDIUM BACKPACK 双肩包,http://static.lottedfs.cn/prod/prd-img/18/77/77/00/00/02/20000777718_1.png
畅销,18084,20000630888,$303,rouge&lounge,rouge&lounge,NEOEVA FIGO MEDIUM BACKPACK 双肩包,http://static.lottedfs.cn/prod/prd-img/17/77/77/00/00/02/20000777717_1.png
,18084,20000629066,$353,rouge&lounge,rouge&lounge,PURO 18 CASPIER LARGE TOTE BAG 手提包,http://static.lottedfs.cn/prod/prd-img/25/55/77/00/00/02/20000775525_1.png
,18084,20000625439,$110,rouge&lounge,rouge&lounge,ATHENA CARD WALLET 卡包,http://static.lottedfs.cn/prod/prd-img/87/03/77/00/00/02/20000770387_1.png
,18084,20000625436,$426,rouge&lounge,rouge&lounge,EVA ATHENA MEDIUM BACKPACK 双肩包,http://static.lottedfs.cn/prod/prd-img/80/03/77/00/00/02/20000770380_1.png
,18084,20000624488,$192,rouge&lounge,rouge&lounge,BAGUETTE CACHE SHOULDER BAG 单肩包,http://static.lottedfs.cn/prod/prd-img/44/86/76/00/00/02/20000768644_1.png
,18084,20000624484,$219,rouge&lounge,rouge&lounge,BAGUETTE ATENA SHOULDER BAG 单肩包,http://static.lottedfs.cn/prod/prd-img/40/86/76/00/00/02/20000768640_1.png
,18084,20000624477,$219,rouge&lounge,rouge&lounge,BAGUETTE DRESDA SHOULDER BAG 单肩包,http://static.lottedfs.cn/prod/prd-img/33/86/76/00/00/02/20000768633_1.png
,18084,20000624471,$294,rouge&lounge,rouge&lounge,AERIS NEW JAY LAMB MEDIUM TOTE BAG 手提包,http://static.lottedfs.cn/prod/prd-img/26/86/76/00/00/02/20000768626_1.png
,18084,20000624461,$202,rouge&lounge,rouge&lounge,MAGIA REPOSO MEDIUM TOTE BAG 手提包,http://static.lottedfs.cn/prod/prd-img/12/86/76/00/00/02/20000768612_1.png
,18084,20000618700,$91,rouge&lounge,rouge&lounge,DETACHABLE HALF WALLET 短款钱包,http://static.lottedfs.cn/prod/prd-img/52/01/76/00/00/02/20000760152_1.png
,18084,20000618698,$183,rouge&lounge,rouge&lounge,SMARTPHONE CASE 手机壳,http://static.lottedfs.cn/prod/prd-img/50/01/76/00/00/02/20000760150_1.png
,18084,20000618694,$183,rouge&lounge,rouge&lounge,ATENA SMARTPHONE CASE 手机壳,http://static.lottedfs.cn/prod/prd-img/46/01/76/00/00/02/20000760146_1.png
,18084,20000618680,$183,rouge&lounge,rouge&lounge,ATENA SMARTPHONE CASE 手机壳,http://static.lottedfs.cn/prod/prd-img/18/01/76/00/00/02/20000760118_1.png
,18084,20000616666,$165,rouge&lounge,rouge&lounge,ATENA PHONE CASE 手机壳,http://static.lottedfs.cn/prod/prd-img/82/76/75/00/00/02/20000757682_1.png
,18084,20000616664,$353,rouge&lounge,rouge&lounge,VILORDO ATENA MEDIUM TRAVEL BAG 手提包,http://static.lottedfs.cn/prod/prd-img/78/76/75/00/00/02/20000757678_1.png
,18084,20000616663,$509,rouge&lounge,rouge&lounge,VILORDO REAL SNAKE MEDIUM TRAVEL BAG 手提包,http://static.lottedfs.cn/prod/prd-img/77/76/75/00/00/02/20000757677_1.png
,18084,20000616660,$128,rouge&lounge,rouge&lounge,BRIOSO PLEATED VELVET MINI SHOULDER BAG 单肩包,http://static.lottedfs.cn/prod/prd-img/64/76/75/00/00/02/20000757664_1.png
,18084,20000616659,$128,rouge&lounge,rouge&lounge,BRIOSO PLEATED VELVET MINI SHOULDER BAG 单肩包,http://static.lottedfs.cn/prod/prd-img/63/76/75/00/00/02/20000757663_1.png
,18084,20000615037,$395,rouge&lounge,rouge&lounge,DIO COCOLUX MEDIUM SATCHEL BAG 手提包,http://static.lottedfs.cn/prod/prd-img/53/46/75/00/00/02/20000754653_1.png
,18084,20000615034,$324,rouge&lounge,rouge&lounge,TIRAMISU GOAT MEDIUM TOTE BAG 手提包,http://static.lottedfs.cn/prod/prd-img/46/46/75/00/00/02/20000754646_1.png
,18084,20000613940,$273,rouge&lounge,rouge&lounge,EDITH MESH LEATHER SMALL CLUTCH 手拿包,http://static.lottedfs.cn/prod/prd-img/96/25/75/00/00/02/20000752596_1.png
,18084,20000613840,$389,rouge&lounge,rouge&lounge,EDITH MESH LEATHER LARGE TOTE BAG 手提包,http://static.lottedfs.cn/prod/prd-img/36/23/75/00/00/02/20000752336_1.png
,18084,20000613230,$48,rouge&lounge,rouge&lounge,TRENZ SNOWFLAKE CHARM DECORATION 包饰,http://static.lottedfs.cn/prod/prd-img/91/10/75/00/00/02/20000751091_1.png
,18084,20000613229,$48,rouge&lounge,rouge&lounge,TRENZ CACTUS CHARM DECORATION 包饰,http://static.lottedfs.cn/prod/prd-img/90/10/75/00/00/02/20000751090_1.png
,18084,20000613228,$48,rouge&lounge,rouge&lounge,DEEP CROCO CACTUS CHARM DECORATION 包饰,http://static.lottedfs.cn/prod/prd-img/89/10/75/00/00/02/20000751089_1.png
,18084,20000613227,$48,rouge&lounge,rouge&lounge,DEEP CROCO CACTUS CHARM DECORATION 包饰,http://static.lottedfs.cn/prod/prd-img/88/10/75/00/00/02/20000751088_1.png
,18084,20000613226,$55,rouge&lounge,rouge&lounge,DEEP CROCO CHRISTMAS TREE CHARM DECORATION 包饰,http://static.lottedfs.cn/prod/prd-img/87/10/75/00/00/02/20000751087_1.png
,18084,20000613225,$55,rouge&lounge,rouge&lounge,KIGALI CHRISTMAS TREE CHARM DECORATION 包饰,http://static.lottedfs.cn/prod/prd-img/86/10/75/00/00/02/20000751086_1.png
,18084,20000613224,$58,rouge&lounge,rouge&lounge,LAMINATTO STAR CHARM DECORATION 包饰,http://static.lottedfs.cn/prod/prd-img/85/10/75/00/00/02/20000751085_1.png
,18084,20000613223,$58,rouge&lounge,rouge&lounge,STAR ROAD STAR CHARM DECORATION 包饰,http://static.lottedfs.cn/prod/prd-img/84/10/75/00/00/02/20000751084_1.png
,18084,20000613222,$58,rouge&lounge,rouge&lounge,CACHE STAR CHARM DECORATION 包饰,http://static.lottedfs.cn/prod/prd-img/83/10/75/00/00/02/20000751083_1.png
,18084,20000613221,$58,rouge&lounge,rouge&lounge,CACHE STAR CHARM DECORATION 包饰,http://static.lottedfs.cn/prod/prd-img/82/10/75/00/00/02/20000751082_1.png
,18084,20000613220,$55,rouge&lounge,rouge&lounge,GOAT EMBO CHRISTMAS TREE CHARM DECORATION 包饰,http://static.lottedfs.cn/prod/prd-img/81/10/75/00/00/02/20000751081_1.png
,18084,20000613183,$292,rouge&lounge,rouge&lounge,ORMA LAMINATTO LARGE TOTE BAG 手提包,http://static.lottedfs.cn/prod/prd-img/14/10/75/00/00/02/20000751014_1.png
,18084,20000613180,$389,rouge&lounge,rouge&lounge,CAPRI GOAT VINTAGE LARGE SHOULDER BAG LARGE 单肩包,http://static.lottedfs.cn/prod/prd-img/11/10/75/00/00/02/20000751011_1.png
,18084,20000612327,$211,rouge&lounge,rouge&lounge,POLYNESIA X LARGE SIMPLE CLUTCH 手包,http://static.lottedfs.cn/prod/prd-img/77/93/74/00/00/02/20000749377_6.png
,18084,20000612325,$211,rouge&lounge,rouge&lounge,COCO SPORTSLUX X LARGE SIMPLE CLUTCH 手包,http://static.lottedfs.cn/prod/prd-img/75/93/74/00/00/02/20000749375_6.png
,18084,20000612322,$61,rouge&lounge,rouge&lounge,REAL SNAKE CARD CASE 卡包,http://static.lottedfs.cn/prod/prd-img/71/93/74/00/00/02/20000749371_5.png
,18084,20000612320,$55,rouge&lounge,rouge&lounge,CATHY CARD CASE 卡包,http://static.lottedfs.cn/prod/prd-img/69/93/74/00/00/02/20000749369_5.png
,18084,20000612316,$61,rouge&lounge,rouge&lounge,REAL WATER SNAKE CARD CASE 卡包,http://static.lottedfs.cn/prod/prd-img/64/93/74/00/00/02/20000749364_5.png
,18084,20000611981,$91,rouge&lounge,rouge&lounge,GRANADA HALF WALLET 短款钱包,http://static.lottedfs.cn/prod/prd-img/05/88/74/00/00/02/20000748805_1.png
,18084,20000611977,$91,rouge&lounge,rouge&lounge,SIRTE HALF WALLET 短款钱包,http://static.lottedfs.cn/prod/prd-img/01/88/74/00/00/02/20000748801_1.png
,18084,20000611974,$97,rouge&lounge,rouge&lounge,CATHY SIMPLE CARD CASE 卡包,http://static.lottedfs.cn/prod/prd-img/96/87/74/00/00/02/20000748796_6.png
,18084,20000611971,$96,rouge&lounge,rouge&lounge,ATENA NEO SIMPLE O RING HALF WALLET 短款钱包,http://static.lottedfs.cn/prod/prd-img/90/87/74/00/00/02/20000748790_1.png
,18084,20000611970,$146,rouge&lounge,rouge&lounge,ATENA NEW SLIM FLAP HALF WALLET 短款钱包,http://static.lottedfs.cn/prod/prd-img/89/87/74/00/00/02/20000748789_6.png
,18084,20000611966,$165,rouge&lounge,rouge&lounge,ATENA NEW SLIM FLAP LONG WALLET 长款钱包,http://static.lottedfs.cn/prod/prd-img/82/87/74/00/00/02/20000748782_6.png
,18084,20000611588,$183,rouge&lounge,rouge&lounge,CASH SECRET LARGE POUCH 手拿包,http://static.lottedfs.cn/prod/prd-img/63/81/74/00/00/02/20000748163_1.png
,18084,20000611549,$214,rouge&lounge,rouge&lounge,BRIOSO ATENA TERRA GRAY MINI SHOULDER BAG 迷你单肩包,http://static.lottedfs.cn/prod/prd-img/10/81/74/00/00/02/20000748110_1.png
,18084,20000611539,$96,rouge&lounge,rouge&lounge,LOPEZ HALF WALLET 短款钱包,http://static.lottedfs.cn/prod/prd-img/94/80/74/00/00/02/20000748094_1.png
,18084,20000611530,$97,rouge&lounge,rouge&lounge,DEEP CROCO HALF WALLET 短款钱包,http://static.lottedfs.cn/prod/prd-img/80/80/74/00/00/02/20000748080_1.png
,18084,20000611525,$85,rouge&lounge,rouge&lounge,DEEP CROCO HALF WALLET 短款钱包,http://static.lottedfs.cn/prod/prd-img/75/80/74/00/00/02/20000748075_1.png
,18084,20000611521,$123,rouge&lounge,rouge&lounge,SNAKE HALF WALLET 短款钱包,http://static.lottedfs.cn/prod/prd-img/65/80/74/00/00/02/20000748065_1.png
,18084,20000611510,$101,rouge&lounge,rouge&lounge,GRANADA LONG WALLET 长款钱包,http://static.lottedfs.cn/prod/prd-img/52/80/74/00/00/02/20000748052_1.png
,18084,20000611504,$122,rouge&lounge,rouge&lounge,JEFFREY LONG WALLET 长款钱包,http://static.lottedfs.cn/prod/prd-img/46/80/74/00/00/02/20000748046_1.png
,18084,20000611499,$73,rouge&lounge,rouge&lounge,CASH CHAIN SMART KEY HOLDER 钥匙包,http://static.lottedfs.cn/prod/prd-img/40/80/74/00/00/02/20000748040_1.png
,18084,20000611486,$122,rouge&lounge,rouge&lounge,ATENA NEO SLIM HALF WALLET 短款钱包,http://static.lottedfs.cn/prod/prd-img/19/80/74/00/00/02/20000748019_1.png
,18084,20000611483,$140,rouge&lounge,rouge&lounge,CASH NEO SLIM MEDIUM WALLET 中款钱包,http://static.lottedfs.cn/prod/prd-img/15/80/74/00/00/02/20000748015_1.png
,18084,20000611476,$140,rouge&lounge,rouge&lounge,CASH NEO SLIM MEDIUM WALLET 中款钱包,http://static.lottedfs.cn/prod/prd-img/97/79/74/00/00/02/20000747997_1.png
,18084,20000611458,$153,rouge&lounge,rouge&lounge,CASH NEO SLIM LONG WALLET 长款钱包,http://static.lottedfs.cn/prod/prd-img/74/79/74/00/00/02/20000747974_1.png
,18084,20000611453,$153,rouge&lounge,rouge&lounge,CASH NEO SLIM LONG WALLET 长款钱包,http://static.lottedfs.cn/prod/prd-img/64/79/74/00/00/02/20000747964_1.png
,18084,20000610603,$361,rouge&lounge,rouge&lounge,RICORDO ATENA LARGE SATCHEL BAG 手提包,http://static.lottedfs.cn/prod/prd-img/22/63/74/00/00/02/20000746322_1.png
,18084,20000610600,$336,rouge&lounge,rouge&lounge,RICORDO DEEP CROCO LARGE SATCHEL BAG 手提包,http://static.lottedfs.cn/prod/prd-img/19/63/74/00/00/02/20000746319_1.png
,18084,20000610584,$150,rouge&lounge,rouge&lounge,SKOPERTA WRINKLED VELVET CHAIN BAG 单肩包,http://static.lottedfs.cn/prod/prd-img/90/62/74/00/00/02/20000746290_1.png
,18084,20000610581,$150,rouge&lounge,rouge&lounge,SKOPERTA WRINKLED VELVET CHAIN BAG 单肩包,http://static.lottedfs.cn/prod/prd-img/79/62/74/00/00/02/20000746279_1.png
,18084,20000610577,$332,rouge&lounge,rouge&lounge,MARE RAMBLA MILETUS LAMB MEDIUM TOTE BAG 手提包,http://static.lottedfs.cn/prod/prd-img/68/62/74/00/00/02/20000746268_1.png
,18084,20000610434,$110,rouge&lounge,rouge&lounge,LOGO SMALL WALLET 短款钱包,http://static.lottedfs.cn/prod/prd-img/78/59/74/00/00/02/20000745978_1.jpg
,18084,20000610119,$244,rouge&lounge,rouge&lounge,TUTO CASH SMALL CROSS BAG 斜挎包,http://static.lottedfs.cn/prod/prd-img/64/52/74/00/00/02/20000745264_1.png
,18084,20000610118,$265,rouge&lounge,rouge&lounge,ORMA POLYNESIA BRIEFCASE 公文包,http://static.lottedfs.cn/prod/prd-img/63/52/74/00/00/02/20000745263_1.png
,18084,20000609382,$396,rouge&lounge,rouge&lounge,CHARIS REAL SNAKE MEDIUM TOTE BAG 手提包,http://static.lottedfs.cn/prod/prd-img/45/35/74/00/00/02/20000743545_1.png
,18084,20000606977,$365,rouge&lounge,rouge&lounge,CHARIS ATENA MEDIUM TOTE BAG 手提包,http://static.lottedfs.cn/prod/prd-img/62/02/74/00/00/02/20000740262_1.png
,18084,20000606976,$265,rouge&lounge,rouge&lounge,AERIS PIGO MEDIUM BACKPACK 双肩包,http://static.lottedfs.cn/prod/prd-img/61/02/74/00/00/02/20000740261_1.png
,18084,20000603522,$262,rouge&lounge,rouge&lounge,DONO CAPRE SMALL SATCHEL BAG 手提包,http://static.lottedfs.cn/prod/prd-img/26/34/73/00/00/02/20000733426_1.png
,18084,20000603521,$369,rouge&lounge,rouge&lounge,ALLAH MILETOSRAM MEDIUM SHOULDER BAG 单肩包,http://static.lottedfs.cn/prod/prd-img/25/34/73/00/00/02/20000733425_1.png
,18084,20000603511,$426,rouge&lounge,rouge&lounge,ALLA REAL SNAKE MEDIUM SHOULDER BAG 单肩包,http://static.lottedfs.cn/prod/prd-img/04/34/73/00/00/02/20000733404_1.png
,18084,20000603509,$407,rouge&lounge,rouge&lounge,ALLA MILETUS LAMB LARGE SHOULDER BAG 单肩包,http://static.lottedfs.cn/prod/prd-img/01/34/73/00/00/02/20000733401_1.png
,18084,20000603501,$480,rouge&lounge,rouge&lounge,ALLA REAL SNAKE LARGE SHOULDER BAG 单肩包,http://static.lottedfs.cn/prod/prd-img/87/33/73/00/00/02/20000733387_1.png
,18084,20000602960,$104,rouge&lounge,rouge&lounge,FLAT LARGE CARD CASE 卡包,http://static.lottedfs.cn/prod/prd-img/33/23/73/00/00/02/20000732333_1.png
,18084,20000602956,$426,rouge&lounge,rouge&lounge,CAMILA RAMBLA LARGE SHOULDER BAG 单肩包,http://static.lottedfs.cn/prod/prd-img/28/23/73/00/00/02/20000732328_1.png
,18084,20000602954,$426,rouge&lounge,rouge&lounge,CAMILA RAMBLA LARGE SHOULDER BAG 单肩包,http://static.lottedfs.cn/prod/prd-img/26/23/73/00/00/02/20000732326_1.png
,18084,20000602953,$310,rouge&lounge,rouge&lounge,DONO CAPRE MEDIUM TOTE BAG 手提包,http://static.lottedfs.cn/prod/prd-img/25/23/73/00/00/02/20000732325_1.png
,18084,20000602254,$353,rouge&lounge,rouge&lounge,PURO GRANADA LARGE SHOPPER BAG 单肩包,http://static.lottedfs.cn/prod/prd-img/84/06/73/00/00/02/20000730684_1.png
,18084,20000602251,$353,rouge&lounge,rouge&lounge,VILORDO REAL WATER SNAKE SMALL SHOULDER BAG 单肩包,http://static.lottedfs.cn/prod/prd-img/74/06/73/00/00/02/20000730674_1.png
,18084,20000601837,$214,rouge&lounge,rouge&lounge,SPACE COCOLUX MINI SADDLE BAG 斜挎包,http://static.lottedfs.cn/prod/prd-img/70/98/72/00/00/02/20000729870_1.png
,18084,20000601836,$214,rouge&lounge,rouge&lounge,SPACE CACHE MINI SADDLE BAG 斜挎包,http://static.lottedfs.cn/prod/prd-img/69/98/72/00/00/02/20000729869_1.png
,18084,20000601835,$214,rouge&lounge,rouge&lounge,SPES ATHENA MINI SADDLE BAG 斜挎包,http://static.lottedfs.cn/prod/prd-img/68/98/72/00/00/02/20000729868_1.png
,18084,20000601834,$394,rouge&lounge,rouge&lounge,SPACE REAL SNAKE LARGE SATCHEL BAG 手提包,http://static.lottedfs.cn/prod/prd-img/67/98/72/00/00/02/20000729867_1.png
,18084,20000601833,$420,rouge&lounge,rouge&lounge,UMBERTO COCOLUX LARGE TOTE BAG 手提包,http://static.lottedfs.cn/prod/prd-img/66/98/72/00/00/02/20000729866_1.png
,18084,20000601755,$389,rouge&lounge,rouge&lounge,CHARIS REAL SNAKE MEDIUM SATCHEL BAG 手提包,http://static.lottedfs.cn/prod/prd-img/98/96/72/00/00/02/20000729698_1.png
,18084,20000601753,$420,rouge&lounge,rouge&lounge,UMBERTO COCOLUX LARGE TOTE BAG 手提包,http://static.lottedfs.cn/prod/prd-img/95/96/72/00/00/02/20000729695_1.png
,18084,20000601361,$353,rouge&lounge,rouge&lounge,VILORDO REAL WATER SNAKE SMALL SHOULDER BAG 单肩包,http://static.lottedfs.cn/prod/prd-img/45/86/72/00/00/02/20000728645_1.png
,18084,20000601360,$353,rouge&lounge,rouge&lounge,VILORDO REAL WATER SNAKE SMALL SHOULDER BAG 单肩包,http://static.lottedfs.cn/prod/prd-img/44/86/72/00/00/02/20000728644_1.png
,18084,20000601359,$353,rouge&lounge,rouge&lounge,VILORDO REAL WATER SNAKE SMALL SHOULDER BAG 单肩包,http://static.lottedfs.cn/prod/prd-img/43/86/72/00/00/02/20000728643_1.png
,18084,20000600591,$506,rouge&lounge,rouge&lounge,INTERVALLO SNAKE MEDIUM TOTE BAG 手提包,http://static.lottedfs.cn/prod/prd-img/60/69/72/00/00/02/20000726960_1.png
,18084,20000599951,$101,rouge&lounge,rouge&lounge,CORONA LARGE WALLET 长款钱包,http://static.lottedfs.cn/prod/prd-img/09/60/72/00/00/02/20000726009_1.jpg
,18084,20000599603,$367,rouge&lounge,rouge&lounge,FLORENCE FIGO MEDIUM TOTE BAG 手提包,http://static.lottedfs.cn/prod/prd-img/88/49/72/00/00/02/20000724988_1.png
,18084,20000599602,$176,rouge&lounge,rouge&lounge,TRAMONTO SPLIT LARGE SHOPPER BAG 单肩包,http://static.lottedfs.cn/prod/prd-img/87/49/72/00/00/02/20000724987_1.png
,18084,20000599601,$367,rouge&lounge,rouge&lounge,LUNA COCOLUX MEDIUM TOTE BAG 手提包,http://static.lottedfs.cn/prod/prd-img/86/49/72/00/00/02/20000724986_1.png
,18084,20000599542,$287,rouge&lounge,rouge&lounge,COCOLUX UMBERTO MEDIUM HANDBAG 手提包,http://static.lottedfs.cn/prod/prd-img/55/48/72/00/00/02/20000724855_1.png
,18084,20000598340,$465,rouge&lounge,rouge&lounge,BIANCO SALVATORE PATCH WORK LAMB MEDIUM TOTE BAG 手提包,http://static.lottedfs.cn/prod/prd-img/05/17/72/00/00/02/20000721705_1.png
,18084,20000598199,$58,rouge&lounge,rouge&lounge,SPANGLE STAR CHARM 挂饰,http://static.lottedfs.cn/prod/prd-img/31/14/72/00/00/02/20000721431_1.png
,18084,20000598197,$300,rouge&lounge,rouge&lounge,RICORDO DEEP CROCO SMALL CROSSBODY BAG 斜挎包,http://static.lottedfs.cn/prod/prd-img/27/14/72/00/00/02/20000721427_1.png
,18084,20000598193,$373,rouge&lounge,rouge&lounge,LINEA COCORODRIC LARGE TOTE BAG 手提包,http://static.lottedfs.cn/prod/prd-img/20/14/72/00/00/02/20000721420_1.png
,18084,20000598191,$383,rouge&lounge,rouge&lounge,BACHIO CROCO SMALL CROSSBODY BAG 斜挎包,http://static.lottedfs.cn/prod/prd-img/18/14/72/00/00/02/20000721418_1.png
,18084,20000598175,$340,rouge&lounge,rouge&lounge,FLORENCE FIGO SMALL TOTE BAG 手提包,http://static.lottedfs.cn/prod/prd-img/96/13/72/00/00/02/20000721396_1.png
,18084,20000598172,$340,rouge&lounge,rouge&lounge,FLORENCE FIGO SMALL TOTE BAG 手提包,http://static.lottedfs.cn/prod/prd-img/91/13/72/00/00/02/20000721391_1.png
,18084,20000598170,$263,rouge&lounge,rouge&lounge,BRIOSO ATHENA SMALL CHAIN BAG 单肩包,http://static.lottedfs.cn/prod/prd-img/89/13/72/00/00/02/20000721389_1.png
,18084,20000598168,$139,rouge&lounge,rouge&lounge,ORA METAL ARTIFICIAL LEATHER SMALL CROSSBODY BAG 斜挎包,http://static.lottedfs.cn/prod/prd-img/85/13/72/00/00/02/20000721385_1.png
,18084,20000598166,$185,rouge&lounge,rouge&lounge,ORA METAL ARTIFICIAL LEATHER LARGE TOTE BAG 手提包,http://static.lottedfs.cn/prod/prd-img/81/13/72/00/00/02/20000721381_1.png
,18084,20000598164,$292,rouge&lounge,rouge&lounge,MAGIA FIGO LARGE BACKPACK 双肩包,http://static.lottedfs.cn/prod/prd-img/79/13/72/00/00/02/20000721379_1.png
,18084,20000598161,$192,rouge&lounge,rouge&lounge,ORA METAL ARTIFICIAL LEATHER LARGE BACKPACK 双肩包,http://static.lottedfs.cn/prod/prd-img/70/13/72/00/00/02/20000721370_1.png
,18084,20000598159,$263,rouge&lounge,rouge&lounge,TRAMONTO CASH MEDIUM DRAW STRING BAG 斜挎包,http://static.lottedfs.cn/prod/prd-img/64/13/72/00/00/02/20000721364_1.png
,18084,20000598154,$146,rouge&lounge,rouge&lounge,TRAMONTO SPLIT MINI HAND BAG 单肩包,http://static.lottedfs.cn/prod/prd-img/53/13/72/00/00/02/20000721353_1.png
,18084,20000598151,$281,rouge&lounge,rouge&lounge,BILORDO ATHENA MINI BOSTON BAG 波士顿包,http://static.lottedfs.cn/prod/prd-img/46/13/72/00/00/02/20000721346_1.png
,18084,20000598148,$322,rouge&lounge,rouge&lounge,BILORDO ATHENA MINI BOSTON BAG 波士顿包,http://static.lottedfs.cn/prod/prd-img/41/13/72/00/00/02/20000721341_1.png
,18084,20000598147,$265,rouge&lounge,rouge&lounge,CHAO CASH SMALL HAND BAG 手提包,http://static.lottedfs.cn/prod/prd-img/40/13/72/00/00/02/20000721340_1.png
,18084,20000598145,$395,rouge&lounge,rouge&lounge,CHAO CASH LARGE TOTE BAG 手提包,http://static.lottedfs.cn/prod/prd-img/38/13/72/00/00/02/20000721338_1.png
,18084,20000598142,$383,rouge&lounge,rouge&lounge,CHAO COCOLUX MEDIUM SHOULDER BAG 单肩包,http://static.lottedfs.cn/prod/prd-img/31/13/72/00/00/02/20000721331_1.png
,18084,20000598140,$281,rouge&lounge,rouge&lounge,LUNA BUFFALO EMBO SMALL TOTE BAG 手提包,http://static.lottedfs.cn/prod/prd-img/26/13/72/00/00/02/20000721326_1.png
,18084,20000598137,$303,rouge&lounge,rouge&lounge,LUNA BUFFALO EMBO MEDIUM TOTE BAG 手提包,http://static.lottedfs.cn/prod/prd-img/19/13/72/00/00/02/20000721319_1.png
,18084,20000598135,$319,rouge&lounge,rouge&lounge,LUNA BUFFALO EMBO MEDIUM TOTE BAG 手提包,http://static.lottedfs.cn/prod/prd-img/16/13/72/00/00/02/20000721316_1.png
,18084,20000597263,$358,rouge&lounge,rouge&lounge,CHAO CASH MEDIUM CHAIN BAG 单肩包,http://static.lottedfs.cn/prod/prd-img/97/95/71/00/00/02/20000719597_1.png
,18084,20000596610,$336,rouge&lounge,rouge&lounge,PIENO ATENA SMALL TRAVEL BAG 手提包,http://static.lottedfs.cn/prod/prd-img/51/83/71/00/00/02/20000718351_1.png
,18084,20000596607,$265,rouge&lounge,rouge&lounge,DIO ATENA MINI SHOULDER BAG 单肩包,http://static.lottedfs.cn/prod/prd-img/45/83/71/00/00/02/20000718345_1.png
,18084,20000596603,$265,rouge&lounge,rouge&lounge,DIO SNAKE MINI SHOULDER BAG 单肩包,http://static.lottedfs.cn/prod/prd-img/33/83/71/00/00/02/20000718333_1.png
,18084,20000596599,$346,rouge&lounge,rouge&lounge,DIO SIRTE CROCO MEDIUM SHOULDER BAG 单肩包,http://static.lottedfs.cn/prod/prd-img/29/83/71/00/00/02/20000718329_1.png
