tag,brand_No,product_No,us_price,brand_name_chn,brand_name_eng,product_name,img_url
,10290,20000523666,$95,蔻驰,COACH,METAL AND RESIN TEA ROSE BAG CHARM B4/BRIGHT CORAL 挂饰,http://static.lottedfs.cn/prod/prd-img/73/86/59/00/00/02/20000598673_2.JPG
,10290,20000523664,$465,蔻驰,COACH,KENNEDY POUCH IN SIGNATURE LEATHER 收纳包 BLACK,http://static.lottedfs.cn/prod/prd-img/71/86/59/00/00/02/20000598671_1.JPG
促销,10290,20000523662,$290,蔻驰,COACH,TRAVEL MAP POUCH IN GLOVETAN MIDNIGHT 长款钱包,http://static.lottedfs.cn/prod/prd-img/69/86/59/00/00/02/20000598669_1.jpg
促销,10290,20000523660,$110,蔻驰,COACH,SMALL CARD CASE IN CAVIAR LEATHER LIGHT DENIM 卡包,http://static.lottedfs.cn/prod/prd-img/67/86/59/00/00/02/20000598667_1.JPG
,10290,20000523658,$165,蔻驰,COACH,SWIVEL CARD CASE IN CAVIAR LEATHER LIGHT DENIM 卡包,http://static.lottedfs.cn/prod/prd-img/65/86/59/00/00/02/20000598665_1.jpg
促销,10290,20000523656,$465,蔻驰,COACH,KENNEDY POUCH IN CAVIAR LEATHER BLACK 收纳包,http://static.lottedfs.cn/prod/prd-img/63/86/59/00/00/02/20000598663_1.jpg
促销,10290,20000523655,$290,蔻驰,COACH,SIGNATURE LEATHER WITH NOVELTY MARLOW B4/BLACK 斜挎包,http://static.lottedfs.cn/prod/prd-img/62/86/59/00/00/02/20000598662_1.jpg
促销,10290,20000523652,$465,蔻驰,COACH,OMBRE QUILTING CALLIE GM/BLACK 斜挎包,http://static.lottedfs.cn/prod/prd-img/59/86/59/00/00/02/20000598659_1.jpg
促销,10290,20000523651,$465,蔻驰,COACH,OMBRE QUILTING CALLIE B4/CHALK 斜挎包,http://static.lottedfs.cn/prod/prd-img/58/86/59/00/00/02/20000598658_1.jpg
促销,10290,20000523650,$200,蔻驰,COACH,SMALL FOLDOVER WALLET V5/BLOSSOM 短款钱包,http://static.lottedfs.cn/prod/prd-img/57/86/59/00/00/02/20000598657_3.JPG
促销,10290,20000523648,$200,蔻驰,COACH,SMALL FOLDOVER WALLET B4/BEECHWOOD 短款钱包,http://static.lottedfs.cn/prod/prd-img/55/86/59/00/00/02/20000598655_3.JPG
促销 畅销,10290,20000523647,$200,蔻驰,COACH,SMALL FOLDOVER WALLET B4/BLACK 短款钱包,http://static.lottedfs.cn/prod/prd-img/54/86/59/00/00/02/20000598654_3.JPG
,10290,20000523646,$220,蔻驰,COACH,30mm CHARCOAL/BLACK 腰带,http://static.lottedfs.cn/prod/prd-img/53/86/59/00/00/02/20000598653_1.jpg
,10290,20000523645,$35,蔻驰,COACH,DINKY CHAIN STRAP LIGHT GOLD 包链,http://static.lottedfs.cn/prod/prd-img/52/86/59/00/00/02/20000598652_1.jpg
畅销,10290,20000523644,$35,蔻驰,COACH,DINKY CHAIN STRAP DARK GUNMETAL 包链,http://static.lottedfs.cn/prod/prd-img/51/86/59/00/00/02/20000598651_1.jpg
畅销,10290,20000523643,$590,蔻驰,COACH,METROPOLITAN PORTFOLIO IN REFINED PEBBLE BLACK 公文包,http://static.lottedfs.cn/prod/prd-img/50/86/59/00/00/02/20000598650_1.jpg
,10290,20000523638,$550,蔻驰,COACH,KENNEDY BRIEF IN CROSSGRAIN SV/MIDNIGHT NAVY 公文包,http://static.lottedfs.cn/prod/prd-img/45/86/59/00/00/02/20000598645_4.JPG
促销,10290,20000523636,$550,蔻驰,COACH,OMBRE QUILTING PARKER SHOULDER BAG GM/BLACK MULTI 单肩包,http://static.lottedfs.cn/prod/prd-img/43/86/59/00/00/02/20000598643_1.jpg
促销,10290,20000523635,$550,蔻驰,COACH,OMBRE QUILTING PARKER SHOULDER BAG B4/CHALK MULTI 单肩包,http://static.lottedfs.cn/prod/prd-img/42/86/59/00/00/02/20000598642_1.jpg
,10290,20000523634,$290,蔻驰,COACH,COATED CANVAS SIGNATURES SUTTON CROSSBODY B4/TAN CHALK 斜挎包,http://static.lottedfs.cn/prod/prd-img/41/86/59/00/00/02/20000598641_1.jpg
,10290,20000523632,$290,蔻驰,COACH,POLISHED PEBBLE LEATHER SUTTON CROSSBODY GD/CHALK 斜挎包,http://static.lottedfs.cn/prod/prd-img/39/86/59/00/00/02/20000598639_1.jpg
促销,10290,20000523630,$465,蔻驰,COACH,SIGNATURE LEATHER CHARLIE CARRYALL GD/OXBLOOD 手提包,http://static.lottedfs.cn/prod/prd-img/37/86/59/00/00/02/20000598637_1.jpg
,10290,20000523629,$465,蔻驰,COACH,SIGNATURE LEATHER CHARLIE CARRYALL GD/BLACK 手提包,http://static.lottedfs.cn/prod/prd-img/36/86/59/00/00/02/20000598636_1.jpg
,10290,20000523627,$350,蔻驰,COACH,SIGNATURE LEATHER CHARLIE 28 CARRYALL 手提包 GD/BLACK,http://static.lottedfs.cn/prod/prd-img/34/86/59/00/00/02/20000598634_1.JPG
促销,10290,20000523625,$350,蔻驰,COACH,OMBRE PRINT MULTI SIGNATURE LEATHER CAMERA BAG GD/PINK MULTICOLOR 斜挎包,http://static.lottedfs.cn/prod/prd-img/32/86/59/00/00/02/20000598632_1.jpg
促销,10290,20000523621,$650,蔻驰,COACH,OMBRE SNAKE CHARLIE 28 CARRYALL GM/MULTICOLOR 手提包,http://static.lottedfs.cn/prod/prd-img/28/86/59/00/00/02/20000598628_1.jpg
,10290,20000523606,$95,蔻驰,COACH,COLORBLOCK COATED CANVAS SIGNATURE SMALL WRISTLET B4/TAN BLOSSOM 手拿包,http://static.lottedfs.cn/prod/prd-img/13/86/59/00/00/02/20000598613_1.jpg
促销,10290,20000523604,$410,蔻驰,COACH,ACADEMY POUCH IN PEBBLE LEATHER DENIM 收纳包,http://static.lottedfs.cn/prod/prd-img/11/86/59/00/00/02/20000598611_1.jpg
,10290,20000523599,$110,蔻驰,COACH,COLORBLOCK COATED CANVAS SIGNATURE SMALL WALLET B4/TAN BLOSSOM 短款钱包,http://static.lottedfs.cn/prod/prd-img/06/86/59/00/00/02/20000598606_1.jpg
,10290,20000523595,$315,蔻驰,COACH,POLISHED PEBBLE LEATHER CAMERA BAG 斜挎包 SV/MIDNIGHT NAVY,http://static.lottedfs.cn/prod/prd-img/02/86/59/00/00/02/20000598602_1.jpg
,10290,20000523592,$215,蔻驰,COACH,MEDIUM CORNER ZIP WALLET LI/NAVY 中款钱包,http://static.lottedfs.cn/prod/prd-img/99/85/59/00/00/02/20000598599_1.jpg
,10290,20000523591,$215,蔻驰,COACH,MEDIUM CORNER ZIP WALLET LI/BLACK 中款钱包,http://static.lottedfs.cn/prod/prd-img/98/85/59/00/00/02/20000598598_1.jpg
,10290,20000523588,$590,蔻驰,COACH,HARNESS METROPOLITAN PORTFOLIO BK MIDNIGHT BLACK 公文包,http://static.lottedfs.cn/prod/prd-img/95/85/59/00/00/02/20000598595_1.jpg
,10290,20000521679,$315,蔻驰,COACH,BREAST POCKET IN SIGNATURE CROSSGRAIN 长款钱包,http://static.lottedfs.cn/prod/prd-img/96/54/59/00/00/02/20000595496_1.jpg
促销,10290,20000521611,$105,蔻驰,COACH,GRAINED LEATHER CARD HOLDER 卡包 B4/BEECHWOOD,http://static.lottedfs.cn/prod/prd-img/65/53/59/00/00/02/20000595365_1.jpg
促销,10290,20000521610,$105,蔻驰,COACH,GRAINED LEATHER CARD HOLDER 卡包 B4/BLACK,http://static.lottedfs.cn/prod/prd-img/64/53/59/00/00/02/20000595364_1.jpg
,10290,20000521609,$315,蔻驰,COACH,SIGNATURE LEATHER CAMERA BAG 斜挎包 GD/BLACK,http://static.lottedfs.cn/prod/prd-img/63/53/59/00/00/02/20000595363_5.JPG
,10290,20000521608,$465,蔻驰,COACH,RIVINGTON BIKE BAG IN SIGNATURE JACQUARD 斜挎包 JI/BLACK,http://static.lottedfs.cn/prod/prd-img/62/53/59/00/00/02/20000595362_1.jpg
促销,10290,20000521605,"$1,100",蔻驰,COACH,CRYSTAL TEA ROSE APPLIQUE ROGUE BAG 25 单肩包 V5/NUDE PINK,http://static.lottedfs.cn/prod/prd-img/59/53/59/00/00/02/20000595359_1.jpg
,10290,20000520967,$165,蔻驰,COACH,25mm SCULPTED C REVERSIBLE BELT B4/BLACK 1941 SADDLE 腰带,http://static.lottedfs.cn/prod/prd-img/54/42/59/00/00/02/20000594254_1.jpg
,10290,20000520966,$410,蔻驰,COACH,REFINED PEBBLED POUCHETTE 收纳包 BLACK,http://static.lottedfs.cn/prod/prd-img/53/42/59/00/00/02/20000594253_1.jpg
促销,10290,20000520965,$250,蔻驰,COACH,38MM JEANS BUCKLE CUT TO SIZE REVERSIBLE BURNISHED LEATHER BELT GRAPHITE BLACK 腰带,http://static.lottedfs.cn/prod/prd-img/52/42/59/00/00/02/20000594252_1.jpg
促销,10290,20000520963,$250,蔻驰,COACH,38MM JEANS BUCKLE CTS REV BURNISHED LEATHER BELT DENIM/CHESTNUT 腰带,http://static.lottedfs.cn/prod/prd-img/50/42/59/00/00/02/20000594250_1.jpg
,10290,20000520960,$215,蔻驰,COACH,SIGNATURE C COIN WALLET 零钱包,http://static.lottedfs.cn/prod/prd-img/47/42/59/00/00/02/20000594247_1.jpg
,10290,20000520959,$240,蔻驰,COACH,SIGNATURE C COMPACT ID WALLET CHARCOAL 短款钱包,http://static.lottedfs.cn/prod/prd-img/46/42/59/00/00/02/20000594246_3.JPG
,10290,20000520958,$240,蔻驰,COACH,SPORT CALF COMPACT ID WALLET MIDNIGHT 短款钱包,http://static.lottedfs.cn/prod/prd-img/45/42/59/00/00/02/20000594245_1.jpg
,10290,20000520957,$240,蔻驰,COACH,SPORT CALF COMPACT ID WALLET DARK SADDLE 短款钱包,http://static.lottedfs.cn/prod/prd-img/44/42/59/00/00/02/20000594244_1.jpg
,10290,20000520956,$240,蔻驰,COACH,SPORT CALF COMPACT ID WALLET BLACK 短款钱包,http://static.lottedfs.cn/prod/prd-img/43/42/59/00/00/02/20000594243_1.jpg
,10290,20000520955,$465,蔻驰,COACH,METROPOLITAN SLIM MESSENGER IN SIGNATURE 斜挎包 QB/CHARCOAL,http://static.lottedfs.cn/prod/prd-img/42/42/59/00/00/02/20000594242_1.jpg
促销 畅销,10290,20000520954,$500,蔻驰,COACH,GRAIN LEATHER DREW SATCHEL 手提包 SV/BLOSSOM,http://static.lottedfs.cn/prod/prd-img/41/42/59/00/00/02/20000594241_1.jpg
畅销,10290,20000520952,$90,蔻驰,COACH,COLORBLOCK COATED CANVAS SIGNATURE MINI ID SKINNY 卡包 B4/TAN RUST,http://static.lottedfs.cn/prod/prd-img/39/42/59/00/00/02/20000594239_1.jpg
促销,10290,20000520950,$465,蔻驰,COACH,KENNEDY POUCH IN SIGNATURE COATED CANVAS 收纳包 CHARCOAL,http://static.lottedfs.cn/prod/prd-img/37/42/59/00/00/02/20000594237_1.jpg
促销,10290,20000520949,$290,蔻驰,COACH,TRAVEL MAP POUCH IN GLOVETAN 公文包 BLACK,http://static.lottedfs.cn/prod/prd-img/36/42/59/00/00/02/20000594236_1.JPG
促销,10290,20000520948,$110,蔻驰,COACH,SMALL CARD CASE IN CAVIAR LEATHER 卡包 BLACK,http://static.lottedfs.cn/prod/prd-img/35/42/59/00/00/02/20000594235_1.JPG
,10290,20000520947,$165,蔻驰,COACH,SWIVEL CARD CASE IN CAVIAR LEATHER 卡包 BLACK,http://static.lottedfs.cn/prod/prd-img/34/42/59/00/00/02/20000594234_1.jpg
促销,10290,20000520943,$315,蔻驰,COACH,TEA ROSE STONES DETAIL HAYDEN 斜挎包 B4/BLOSSOM,http://static.lottedfs.cn/prod/prd-img/30/42/59/00/00/02/20000594230_1.jpg
,10290,20000520942,$165,蔻驰,COACH,FLORAL PRINTED LEATHER SMALL WALLET 短款钱包 GD/BEECHWOOD FLORAL BUNDLE,http://static.lottedfs.cn/prod/prd-img/29/42/59/00/00/02/20000594229_1.jpg
,10290,20000520941,$220,蔻驰,COACH,HARNESS CTG CTR BELT 腰带,http://static.lottedfs.cn/prod/prd-img/28/42/59/00/00/02/20000594228_1.jpg
,10290,20000520938,$220,蔻驰,COACH,MODERN HARNESS CTS REV SMOOTH LEATHER BELT 男士腰带,http://static.lottedfs.cn/prod/prd-img/25/42/59/00/00/02/20000594225_1.jpg
,10290,20000520934,$250,蔻驰,COACH,WIDE HARNESS CTS REV SIGNATURE BELT 腰带,http://static.lottedfs.cn/prod/prd-img/21/42/59/00/00/02/20000594221_1.jpg
促销,10290,20000520933,$410,蔻驰,COACH,POLISHED PEBBLED LTHR PRAIRIE SATCHEL 手提包 SV/BLOSSOM,http://static.lottedfs.cn/prod/prd-img/20/42/59/00/00/02/20000594220_1.jpg
促销,10290,20000520928,$250,蔻驰,COACH,38MM PLAQUE CUT TO SIZE REVERSIBLE PEBBLED BELT BLACK MAHOGANY 腰带,http://static.lottedfs.cn/prod/prd-img/15/42/59/00/00/02/20000594215_1.jpg
促销,10290,20000520925,$185,蔻驰,COACH,CROSSGRAIN LEATHER MEDIUM ZIP AROUND WALLET 中款钱包 GD/BLOSSOM,http://static.lottedfs.cn/prod/prd-img/12/42/59/00/00/02/20000594212_1.jpg
,10290,20000520917,$550,蔻驰,COACH,KENNEDY BRIEF IN SIGNATURE 公文包 QB/CHARCOAL,http://static.lottedfs.cn/prod/prd-img/04/42/59/00/00/02/20000594204_1.jpg
,10290,20000520916,$550,蔻驰,COACH,KENNEDY BRIEF IN CROSSGRAIN 公文包 SV/BLACK,http://static.lottedfs.cn/prod/prd-img/03/42/59/00/00/02/20000594203_1.jpg
,10290,20000520915,$700,蔻驰,COACH,METROPOLITAN SLIM BRIEF 公文包 OL/SADDLE,http://static.lottedfs.cn/prod/prd-img/02/42/59/00/00/02/20000594202_1.jpg
促销,10290,20000520914,$700,蔻驰,COACH,METROPOLITAN SLIM BRIEF 公文包 OL/PINE,http://static.lottedfs.cn/prod/prd-img/01/42/59/00/00/02/20000594201_1.jpg
,10290,20000520913,$700,蔻驰,COACH,METROPOLITAN SLIM BRIEF 公文包 OL/MARINA,http://static.lottedfs.cn/prod/prd-img/00/42/59/00/00/02/20000594200_1.jpg
促销,10290,20000520911,$700,蔻驰,COACH,METROPOLITAN SLIM BRIEF 公文包 JI/MIDNIGHT NAVY,http://static.lottedfs.cn/prod/prd-img/98/41/59/00/00/02/20000594198_1.jpg
促销,10290,20000520910,$500,蔻驰,COACH,METEROPOLITAN SOFT MESSENGER IN SIGNATURE 斜挎包 QB/CHARCOAL,http://static.lottedfs.cn/prod/prd-img/97/41/59/00/00/02/20000594197_1.jpg
促销,10290,20000520909,$500,蔻驰,COACH,METEROPOLITAN SOFT MESSENGER IN REFINED PEBBLED LEATHER 斜挎包 QB/BLACK,http://static.lottedfs.cn/prod/prd-img/96/41/59/00/00/02/20000594196_1.jpg
,10290,20000520908,$290,蔻驰,COACH,BOXED WIDE PLAQUE CUT TO SIZE REVERSIBLE BELT BLACK MAHOGANY 腰带,http://static.lottedfs.cn/prod/prd-img/95/41/59/00/00/02/20000594195_1.jpg
促销,10290,20000520904,$105,蔻驰,COACH,ANODIZED TREX BAG CHARM S3/OIL SLICK 挂饰,http://static.lottedfs.cn/prod/prd-img/91/41/59/00/00/02/20000594191_1.jpg
,10290,20000520900,$550,蔻驰,COACH,SG_PARKER SHOULDER BAG B4/BLACK 单肩包,http://static.lottedfs.cn/prod/prd-img/87/41/59/00/00/02/20000594187_1.jpg
,10290,20000520895,$410,蔻驰,COACH,REFINED CALF LEATHER PARKER BACKPACK 16 B4/BLACK 背包,http://static.lottedfs.cn/prod/prd-img/82/41/59/00/00/02/20000594182_1.jpg
,10290,20000520894,$550,蔻驰,COACH,QUILTING PARKER TOP HANDLE B4/CHALK 手提包,http://static.lottedfs.cn/prod/prd-img/81/41/59/00/00/02/20000594181_1.jpg
促销,10290,20000520893,$550,蔻驰,COACH,QUILTING PARKER TOP HANDLE B4/BLACK 手提包,http://static.lottedfs.cn/prod/prd-img/80/41/59/00/00/02/20000594180_1.jpg
促销,10290,20000520890,$465,蔻驰,COACH,SIGNATURE LEATHER CHARLIE CARRYALL SV/BEECHWOOD 手提包,http://static.lottedfs.cn/prod/prd-img/77/41/59/00/00/02/20000594177_1.jpg
促销,10290,20000520888,$500,蔻驰,COACH,MIXED LEATHER DREW SATCHEL GM/BLACK 手提包,http://static.lottedfs.cn/prod/prd-img/75/41/59/00/00/02/20000594175_1.jpg
促销,10290,20000520887,$500,蔻驰,COACH,MIXED LEATHER DREW SATCHEL GD/OXBLOOD 手提包,http://static.lottedfs.cn/prod/prd-img/74/41/59/00/00/02/20000594174_1.jpg
,10290,20000520884,$110,蔻驰,COACH,SIGNATURE LEATHER SMALL ZIP AROUND GD/OXBLOOD  短款钱包,http://static.lottedfs.cn/prod/prd-img/71/41/59/00/00/02/20000594171_1.JPG
畅销,10290,20000520883,$110,蔻驰,COACH,SIGNATURE LEATHER SMALL ZIP AROUND 短款钱包 GD/BLACK,http://static.lottedfs.cn/prod/prd-img/70/41/59/00/00/02/20000594170_1.jpg
畅销,10290,20000520882,$110,蔻驰,COACH,SIGNATURE LEATHER SMALL ZIP AROUND B4/MIDNIGHT NAVY 短款钱包,http://static.lottedfs.cn/prod/prd-img/69/41/59/00/00/02/20000594169_1.JPG
,10290,20000520875,$465,蔻驰,COACH,RIVINGTON UTILITY PACK IN SIGNATURE LEATHER 斜挎包 JI/MIDNIGHT NAVY,http://static.lottedfs.cn/prod/prd-img/62/41/59/00/00/02/20000594162_1.jpg
,10290,20000520873,$650,蔻驰,COACH,RIVINGTON BACKPACK SIGNATURE JACQUARD JI/BLACK 背包,http://static.lottedfs.cn/prod/prd-img/60/41/59/00/00/02/20000594160_1.jpg
,10290,20000520871,$650,蔻驰,COACH,ACADEMY BACKPACK IN SOFT GRAIN LEATHER JI/BLACK 背包,http://static.lottedfs.cn/prod/prd-img/58/41/59/00/00/02/20000594158_1.jpg
,10290,20000520868,$700,蔻驰,COACH,RIVINGTON BACKPACK IN SOFT GRAIN LEATHER JI/BLACK 背包,http://static.lottedfs.cn/prod/prd-img/55/41/59/00/00/02/20000594155_1.jpg
促销,10290,20000520866,$465,蔻驰,COACH,POLISHED PEBBLE LEATHER SUTTON HOBO 单肩包 GD/BLACK,http://static.lottedfs.cn/prod/prd-img/53/41/59/00/00/02/20000594153_1.jpg
促销,10290,20000520860,$465,蔻驰,COACH,METROPOLITAN CAMERA BAG IN SIGNATURE LEATHER QB/BLACK 斜挎包,http://static.lottedfs.cn/prod/prd-img/47/41/59/00/00/02/20000594147_1.jpg
,10290,20000520858,$240,蔻驰,COACH,DOUBLE BILLFOLD IN SIGNATURE HARDWARE BLACK 短款钱包,http://static.lottedfs.cn/prod/prd-img/45/41/59/00/00/02/20000594145_1.jpg
,10290,20000520856,$315,蔻驰,COACH,ACCORDION IN EMBOSSED SIGNATURE 长款钱包 LEATHER/BLACK,http://static.lottedfs.cn/prod/prd-img/43/41/59/00/00/02/20000594143_1.jpg
,10290,20000520855,$110,蔻驰,COACH,CARD CASE IN EMBOSSED SIGNATURE LEATHER 卡包 BLACK,http://static.lottedfs.cn/prod/prd-img/42/41/59/00/00/02/20000594142_1.JPG
,10290,20000520846,$290,蔻驰,COACH,COLORBLOCK COATED CANVAS SIGNATURE ACCORDION ZIP 长款钱包 B4 TAN RUST,http://static.lottedfs.cn/prod/prd-img/33/41/59/00/00/02/20000594133_1.jpg
畅销,10290,20000520845,$70,蔻驰,COACH,COLORBLOCK COATED CANVAS SIGNATURE FLAT CARD CASE 卡包 B4 TAN RUST,http://static.lottedfs.cn/prod/prd-img/32/41/59/00/00/02/20000594132_1.jpg
,10290,20000520842,$465,蔻驰,COACH,COATED CANVAS SIGNATURE CHARLIE CARRYALL CHALK 单肩包,http://static.lottedfs.cn/prod/prd-img/29/41/59/00/00/02/20000594129_1.JPG
,10290,20000520835,$110,蔻驰,COACH,CROSSGRAIN LEATHER SMALL ZIP AROUND WALLET LI/NAVY 短款钱包,http://static.lottedfs.cn/prod/prd-img/22/41/59/00/00/02/20000594122_1.JPG
,10290,20000520834,$110,蔻驰,COACH,CROSSGRAIN LEATHER SMALL ZIP AROUND WALLET LI/BLACK 短款钱包,http://static.lottedfs.cn/prod/prd-img/21/41/59/00/00/02/20000594121_1.jpg
促销,10290,20000520827,$465,蔻驰,COACH,METROPOLITAN CAMERA BAG QB/BK 斜挎包,http://static.lottedfs.cn/prod/prd-img/14/41/59/00/00/02/20000594114_1.JPG
,10290,20000520822,$240,蔻驰,COACH,COIN WALLET IN SIGNATURE CROSSGRAIN 零钱包,http://static.lottedfs.cn/prod/prd-img/09/41/59/00/00/02/20000594109_1.jpg
,10290,20000520820,$290,蔻驰,COACH,ACCORDION IN CROSSGRAIN 长款钱包,http://static.lottedfs.cn/prod/prd-img/07/41/59/00/00/02/20000594107_1.jpg
促销,10290,20000520815,$95,蔻驰,COACH,POLISHED PEBBLE SMALL WRISTLET LI/BEECHWOOD 收纳包,http://static.lottedfs.cn/prod/prd-img/02/41/59/00/00/02/20000594102_1.jpg
,10290,20000520813,$105,蔻驰,COACH,SKELETAL UNI BAG CHARM 挂饰 OILSLICK,http://static.lottedfs.cn/prod/prd-img/00/41/59/00/00/02/20000594100_1.jpg
,10290,20000520812,$165,蔻驰,COACH,CARD WALLET IN SPORT CALF LEATHER MIDNIGHT 卡包,http://static.lottedfs.cn/prod/prd-img/99/40/59/00/00/02/20000594099_1.jpg
,10290,20000520811,$165,蔻驰,COACH,CARD WALLET IN SPORT CALF LEATHER DARK SADDLE 卡包,http://static.lottedfs.cn/prod/prd-img/98/40/59/00/00/02/20000594098_1.jpg
,10290,20000520810,$165,蔻驰,COACH,CARD WALLET IN SPORT CALF LEATHER BLACK 卡包,http://static.lottedfs.cn/prod/prd-img/97/40/59/00/00/02/20000594097_1.jpg
,10290,20000520809,$110,蔻驰,COACH,COLORBLOCK SMALL WALLET SV/LIGHT BLUSH MULTI 短款钱包,http://static.lottedfs.cn/prod/prd-img/96/40/59/00/00/02/20000594096_1.JPG
促销,10290,20000511499,$105,蔻驰,COACH,CROSSGRAIN BUSINESS CARD CASE GD/BLOSSOM 卡包,http://static.lottedfs.cn/prod/prd-img/42/17/58/00/00/02/20000581742_1.jpg
促销,10290,20000511498,$410,蔻驰,COACH,EXCL CNY REFINED CALF LEATHER PARKER 18 SHOULDER BAG 单肩包 GD/JASPER,http://static.lottedfs.cn/prod/prd-img/41/17/58/00/00/02/20000581741_1.JPG
,10290,20000511493,$110,蔻驰,COACH,CROSSGRAIN LEATHER SMALL WALLET GD/BLOSSOM 短款钱包,http://static.lottedfs.cn/prod/prd-img/36/17/58/00/00/02/20000581736_1.jpg
促销,10290,20000511492,$90,蔻驰,COACH,CROSSGRAIN MINI ID SKINNY LI/JASPER 卡包,http://static.lottedfs.cn/prod/prd-img/35/17/58/00/00/02/20000581735_1.jpg
促销,10290,20000511491,$90,蔻驰,COACH,CROSSGRAIN MINI ID SKINNY GD/BLOSSOM 卡包,http://static.lottedfs.cn/prod/prd-img/34/17/58/00/00/02/20000581734_1.jpg
促销,10290,20000511490,$200,蔻驰,COACH,EXCL CNY CANVAS TOTE WITH PIG MOTIF GD/JASPER 手提包,http://static.lottedfs.cn/prod/prd-img/33/17/58/00/00/02/20000581733_5.jpg
促销,10290,20000511489,$650,蔻驰,COACH,EXCL CNY SMOOTH GRAIN LEATHER DREAMER GD/JASPER 手提包,http://static.lottedfs.cn/prod/prd-img/32/17/58/00/00/02/20000581732_1.jpg
促销,10290,20000511488,$240,蔻驰,COACH,SIGNATURE JACQUARD BELT BAG B4/TAN SCARLET 收纳包,http://static.lottedfs.cn/prod/prd-img/31/17/58/00/00/02/20000581731_1.jpg
,10290,20000511479,$240,蔻驰,COACH,CRYSTAL TEA ROSE SMALL WALLET GM/NUDE PINK 短款钱包,http://static.lottedfs.cn/prod/prd-img/22/17/58/00/00/02/20000581722_1.jpg
促销 畅销,10290,20000511476,$465,蔻驰,COACH,GLOVETANNED LEATHER CANTEEN CROSSBODY B4/CHALK 斜挎包,http://static.lottedfs.cn/prod/prd-img/19/17/58/00/00/02/20000581719_1.jpg
促销 畅销,10290,20000511475,$465,蔻驰,COACH,GLOVETANNED LEATHER CANTEEN CROSSBODY B4/BLACK 斜挎包,http://static.lottedfs.cn/prod/prd-img/18/17/58/00/00/02/20000581718_1.jpg
,10290,20000511472,$410,蔻驰,COACH,COATED CANVAS SIGNATURE CAMPUS BACKPACK 23 B4 TAN RUST 背包,http://static.lottedfs.cn/prod/prd-img/15/17/58/00/00/02/20000581715_1.jpg
,10290,20000511471,$410,蔻驰,COACH,POUCH IN COATED CANVAS CHARCOAL 收纳包,http://static.lottedfs.cn/prod/prd-img/14/17/58/00/00/02/20000581714_1.jpg
促销,10290,20000511465,$110,蔻驰,COACH,CROSSGRAIN LEATHER SMALL ZIP AROUND WALLET GD/BLOSSOM 短款钱包,http://static.lottedfs.cn/prod/prd-img/08/17/58/00/00/02/20000581708_1.jpg
促销,10290,20000511464,$350,蔻驰,COACH,POLISHED PEBBLE LEATHER CHARLIE 28 CARRYALL GD/JASPER 手提包,http://static.lottedfs.cn/prod/prd-img/07/17/58/00/00/02/20000581707_1.jpg
促销,10290,20000511460,$95,蔻驰,COACH,POLISHED PEBBLE SMALL WRISTLET GD/BLOSSOM 收纳包,http://static.lottedfs.cn/prod/prd-img/03/17/58/00/00/02/20000581703_1.jpg
,10290,20000506281,$270,蔻驰,COACH,38mm CTS REXY PLAQUE BELT IN SIGNATURE KHAKI/BLACK 腰带,http://static.lottedfs.cn/prod/prd-img/09/43/57/00/00/02/20000574309_1.jpg
,10290,20000506280,$270,蔻驰,COACH,38mm CTS REXY PLAQUE BELT IN SIGNATURE CHARCOAL/BLACK 腰带,http://static.lottedfs.cn/prod/prd-img/08/43/57/00/00/02/20000574308_1.jpg
促销 畅销,10290,20000506279,$410,蔻驰,COACH,POUCH 30 WITH REXY ON SIGNATURE CHARCOAL 手拿包,http://static.lottedfs.cn/prod/prd-img/07/43/57/00/00/02/20000574307_2.jpg
促销,10290,20000506273,$90,蔻驰,COACH,VIPER ROOM CANVAS TURNLOCK POUCH 26 V5/BLACK 收纳包,http://static.lottedfs.cn/prod/prd-img/01/43/57/00/00/02/20000574301_3.jpg
促销,10290,20000506267,$200,蔻驰,COACH,VIPER ROOM CANVAS TOTE V5/BLACK 手提包,http://static.lottedfs.cn/prod/prd-img/95/42/57/00/00/02/20000574295_5.jpg
,10290,20000506258,$260,蔻驰,COACH,POLISHED PEBBLE DRESSY BELT BAG GD/BLACK 腰包,http://static.lottedfs.cn/prod/prd-img/86/42/57/00/00/02/20000574286_5.jpg
,10290,20000506257,$240,蔻驰,COACH,COATED CANVAS SIGNATURE BELT BAG GD/CHARCOAL MIDNIGHT NAVY 腰包,http://static.lottedfs.cn/prod/prd-img/85/42/57/00/00/02/20000574285_1.jpg
促销,10290,20000506254,$110,蔻驰,COACH,PARTY MOUSE BAG CHARM B4/DARK BERRY 挂饰,http://static.lottedfs.cn/prod/prd-img/82/42/57/00/00/02/20000574282_1.jpg
,10290,20000506253,$110,蔻驰,COACH,SIGNATURE LEATHER SMALL ZIP AROUND GD/BLACK 短款钱包,http://static.lottedfs.cn/prod/prd-img/81/42/57/00/00/02/20000574281_1.jpg
,10290,20000506243,$95,蔻驰,COACH,DECO QUILTING FLAT CARD CASE B4/BLACK 卡包,http://static.lottedfs.cn/prod/prd-img/71/42/57/00/00/02/20000574271_1.jpg
,10290,20000506242,$240,蔻驰,COACH,CRYSTAL TEA ROSE SMALL WALLET GM/SAGE 短款钱包,http://static.lottedfs.cn/prod/prd-img/70/42/57/00/00/02/20000574270_2.jpg
促销,10290,20000506239,$650,蔻驰,COACH,MIXED LEATHER WITH METALLIC DETAILS DREAMER GM/DARK BERRY MULTI 手提包,http://static.lottedfs.cn/prod/prd-img/67/42/57/00/00/02/20000574267_5.jpg
促销,10290,20000506231,$500,蔻驰,COACH,COATED CANVAS SIGNATURE PARKER BACKPACK B4/TAN RUST 背包,http://static.lottedfs.cn/prod/prd-img/59/42/57/00/00/02/20000574259_5.jpg
促销,10290,20000506229,$650,蔻驰,COACH,MIXED LEATHER WITH PEBBLE DREAMER GM/BLACK 手提包,http://static.lottedfs.cn/prod/prd-img/57/42/57/00/00/02/20000574257_4.jpg
促销,10290,20000506228,$700,蔻驰,COACH,MIXED LEATHER WITH PEBBLE DREAMER 36 GM/BLACK 手提包,http://static.lottedfs.cn/prod/prd-img/56/42/57/00/00/02/20000574256_6.jpg
促销,10290,20000506227,$650,蔻驰,COACH,METALLIC DREAMER GM/METALLIC GRAPHITE 手提包,http://static.lottedfs.cn/prod/prd-img/55/42/57/00/00/02/20000574255_5.jpg
促销,10290,20000506225,$410,蔻驰,COACH,GLOVETANNED LTHR DINKY CROSSBODY V5/DARK BERRY 斜挎包,http://static.lottedfs.cn/prod/prd-img/53/42/57/00/00/02/20000574253_1.jpg
促销,10290,20000506222,$700,蔻驰,COACH,RIVINGTON BACKPACK IN SOFT GRAIN LEATHER JI/CADET 背包,http://static.lottedfs.cn/prod/prd-img/50/42/57/00/00/02/20000574250_1.jpg
促销,10290,20000506221,"$1,100",蔻驰,COACH,CRYSTAL TEA ROSE APPLIQUE ROGUE BAG 25 V5/SAGE 单肩包,http://static.lottedfs.cn/prod/prd-img/49/42/57/00/00/02/20000574249_5.jpg
,10290,20000506213,$315,蔻驰,COACH,COATED CANVAS SIGNATURE CAMERA BAG GD/CHARCOAL MIDNIGHT NAVY 斜挎包,http://static.lottedfs.cn/prod/prd-img/41/42/57/00/00/02/20000574241_1.jpg
促销,10290,20000506212,$465,蔻驰,COACH,METALLIC LEATHER CHARLIE CARRYALL GM/PLATINUM 手提包,http://static.lottedfs.cn/prod/prd-img/40/42/57/00/00/02/20000574240_5.jpg
促销,10290,20000506209,$315,蔻驰,COACH,POLISHED PEBBLE LEATHER CAMERA BAG SV/SAGE 斜挎包,http://static.lottedfs.cn/prod/prd-img/37/42/57/00/00/02/20000574237_3.jpg
促销,10290,20000497532,$500,蔻驰,COACH,REFINED CALF LEATHER PARKER CARRYALL B4/BLACK 手提包,http://static.lottedfs.cn/prod/prd-img/48/11/56/00/00/02/20000561148_1.jpg
促销,10290,20000497527,$90,蔻驰,COACH,EMBELLISHED HEART BAG CHARM B4/NUDE PINK 钥匙链,http://static.lottedfs.cn/prod/prd-img/43/11/56/00/00/02/20000561143_1.jpg
促销,10290,20000497526,$700,蔻驰,COACH,MIXED LEATHER WITH SMOOTH GRAIN LEATHER DREAMER 36 GM/CYPRESS 手提包,http://static.lottedfs.cn/prod/prd-img/42/11/56/00/00/02/20000561142_1.jpg
促销,10290,20000497522,$500,蔻驰,COACH,SIGNATURE LEATHER QUINN SATCHEL GD/BLACK 手提包,http://static.lottedfs.cn/prod/prd-img/38/11/56/00/00/02/20000561138_1.jpg
促销,10290,20000497521,$110,蔻驰,COACH,PIGTINI BAG CHARM SV/CHALK 钥匙链,http://static.lottedfs.cn/prod/prd-img/37/11/56/00/00/02/20000561137_1.jpg
促销,10290,20000497508,$750,蔻驰,COACH,OTT COLORBLOCK DREAMER 36 V5/METALLIC GRAPHITE MULTI 手提包,http://static.lottedfs.cn/prod/prd-img/24/11/56/00/00/02/20000561124_1.jpg
促销,10290,20000497501,$410,蔻驰,COACH,RIVINGTON CROSSBODY IN SOFT GRAIN LEATHER JI/CADET 斜挎包,http://static.lottedfs.cn/prod/prd-img/17/11/56/00/00/02/20000561117_1.jpg
,10290,20000497500,$410,蔻驰,COACH,RIVINGTON UTILITY PACK IN SOFT GRAIN LEATHER JI/CADET 腰包,http://static.lottedfs.cn/prod/prd-img/16/11/56/00/00/02/20000561116_1.jpg
