tag,brand_No,product_No,us_price,brand_name_chn,brand_name_eng,product_name,img_url
,10290,20000589920,$350,蔻驰,COACH,DREAMER CONVERTIBLE CROSSBODY GD/TAN TRUE PINK 斜挎包,http://static.lottedfs.cn/prod/prd-img/52/67/70/00/00/02/20000706752_1.jpg
,10290,20000589919,$350,蔻驰,COACH,DREAMER CONVERTIBLE CROSSBODY GD/TAN RED APPLE 斜挎包,http://static.lottedfs.cn/prod/prd-img/51/67/70/00/00/02/20000706751_1.jpg
,10290,20000589918,$350,蔻驰,COACH,DREAMER CONVERTIBLE CROSSBODY B4/TAN BLACK 斜挎包,http://static.lottedfs.cn/prod/prd-img/50/67/70/00/00/02/20000706750_1.jpg
,10290,20000589917,$550,蔻驰,COACH,TABBY SHOULDER BAG/B4/STRAW MULTI 单肩包,http://static.lottedfs.cn/prod/prd-img/49/67/70/00/00/02/20000706749_1.jpg
促销,10290,20000589916,$750,蔻驰,COACH,TABBY SHOULDER BAG 26/V5/MULTICOLOR 单肩包,http://static.lottedfs.cn/prod/prd-img/48/67/70/00/00/02/20000706748_1.jpg
促销,10290,20000589915,$650,蔻驰,COACH,DREAMER SHOULDER BAG V5/TAN RED APPLE 单肩包,http://static.lottedfs.cn/prod/prd-img/47/67/70/00/00/02/20000706747_1.jpg
,10290,20000589914,$650,蔻驰,COACH,PARKER TOP HANDLE V5/RED APPLE 手提包,http://static.lottedfs.cn/prod/prd-img/46/67/70/00/00/02/20000706746_1.jpg
促销,10290,20000589913,$650,蔻驰,COACH,PARKER TOP HANDLE B4/CHALK 手提包,http://static.lottedfs.cn/prod/prd-img/45/67/70/00/00/02/20000706745_1.jpg
,10290,20000589912,$410,蔻驰,COACH,CENTRAL TOTE V5/TAN TRUE PINK 手提包,http://static.lottedfs.cn/prod/prd-img/44/67/70/00/00/02/20000706744_1.jpg
,10290,20000589911,$410,蔻驰,COACH,CENTRAL TOTE B4/TAN BLACK 手提包,http://static.lottedfs.cn/prod/prd-img/43/67/70/00/00/02/20000706743_1.jpg
促销,10290,20000589910,$465,蔻驰,COACH,CASSIE CROSSBODY V5/TAN BRIGHT PINK 斜挎包,http://static.lottedfs.cn/prod/prd-img/42/67/70/00/00/02/20000706742_1.jpg
促销,10290,20000589909,$465,蔻驰,COACH,CASSIE CROSSBODY V5/TAN RED APPLE 斜挎包,http://static.lottedfs.cn/prod/prd-img/41/67/70/00/00/02/20000706741_1.jpg
促销,10290,20000589908,$465,蔻驰,COACH,CASSIE CROSSBODY B4/TAN CHALK 斜挎包,http://static.lottedfs.cn/prod/prd-img/40/67/70/00/00/02/20000706740_1.jpg
促销,10290,20000589907,$500,蔻驰,COACH,KISSLOCK DREAMER 21 V5/TRUE PINK 手提包,http://static.lottedfs.cn/prod/prd-img/39/67/70/00/00/02/20000706739_2.JPG
促销,10290,20000589906,$500,蔻驰,COACH,KISSLOCK DREAMER 21 B4/MIST 手提包,http://static.lottedfs.cn/prod/prd-img/38/67/70/00/00/02/20000706738_2.JPG
,10290,20000589905,$165,蔻驰,COACH,LARGE CARD CASE IN SIGANTURE CHARCOAL 卡包,http://static.lottedfs.cn/prod/prd-img/37/67/70/00/00/02/20000706737_1.jpg
,10290,20000589904,$200,蔻驰,COACH,SLIM ACCORDION ZIP V5/TAN TRUE PINK 长款钱包,http://static.lottedfs.cn/prod/prd-img/36/67/70/00/00/02/20000706736_1.jpg
,10290,20000589900,$200,蔻驰,COACH,BIFOLD CARD CASE CHARCOAL 卡包,http://static.lottedfs.cn/prod/prd-img/32/67/70/00/00/02/20000706732_1.jpg
促销,10290,20000589898,$240,蔻驰,COACH,SLIM WALLET BLACK 短款钱包,http://static.lottedfs.cn/prod/prd-img/30/67/70/00/00/02/20000706730_1.jpg
新品,10290,20000589895,$500,蔻驰,COACH,SG_PARKER TOP HANDLE V5/TAN BEECHWOOD 手提包,http://static.lottedfs.cn/prod/prd-img/27/67/70/00/00/02/20000706727_3.JPG
促销,10290,20000589894,$290,蔻驰,COACH,SUTTON CROSSBODY/GD/PEACOCK 斜挎包,http://static.lottedfs.cn/prod/prd-img/26/67/70/00/00/02/20000706726_1.jpg
,10290,20000589893,$700,蔻驰,COACH,RIVINGTON BACKPACK QB/CHARCOAL 背包,http://static.lottedfs.cn/prod/prd-img/25/67/70/00/00/02/20000706725_1.jpg
,10290,20000589891,$95,蔻驰,COACH,CARD CASE IN SIGNATURE COATED CANVAS KHAKI 卡包,http://static.lottedfs.cn/prod/prd-img/23/67/70/00/00/02/20000706723_1.jpg
,10290,20000589890,$700,蔻驰,COACH,RIVINGTON BACKPACK JI/MOSS 背包,http://static.lottedfs.cn/prod/prd-img/22/67/70/00/00/02/20000706722_1.jpg
畅销,10290,20000589889,$270,蔻驰,COACH,CHARCOAL/BLACK 38mm 腰带,http://static.lottedfs.cn/prod/prd-img/21/67/70/00/00/02/20000706721_1.jpg
促销,10290,20000589887,$95,蔻驰,COACH,SMALL WRISTLET V5/TAN RED APPLE 手拿包,http://static.lottedfs.cn/prod/prd-img/19/67/70/00/00/02/20000706719_1.jpg
促销,10290,20000589885,$200,蔻驰,COACH,SOFT WALLET V5/TAN RED APPLE 长款钱包,http://static.lottedfs.cn/prod/prd-img/17/67/70/00/00/02/20000706717_1.jpg
,10290,20000589882,$290,蔻驰,COACH,HORSE AND CARRIAGE BICOLOR CASHMERE MUFFLER ROSE/PLUM 围巾,http://static.lottedfs.cn/prod/prd-img/14/67/70/00/00/02/20000706714_1.jpg
,10290,20000589881,$290,蔻驰,COACH,HORSE AND CARRIAGE BICOLOR CASHMERE MUFFLER CHALKGREY 围巾,http://static.lottedfs.cn/prod/prd-img/13/67/70/00/00/02/20000706713_1.jpg
,10290,20000589880,$465,蔻驰,COACH,OVERSIZED REVERSIBLE PLAID CASHMERE MUFFLER ROSE MULTI  围巾,http://static.lottedfs.cn/prod/prd-img/12/67/70/00/00/02/20000706712_1.jpg
,10290,20000589879,$465,蔻驰,COACH,OVERSIZED REVERSIBLE PLAID CASHMERE MUFFLER/LIGHT HEATHER GREY 围巾,http://static.lottedfs.cn/prod/prd-img/11/67/70/00/00/02/20000706711_1.jpg
,10290,20000589878,$465,蔻驰,COACH,OVERSIZED REVERSIBLE PLAID CASHMERE MUFFLER BK/MULTICOLOR 围巾,http://static.lottedfs.cn/prod/prd-img/10/67/70/00/00/02/20000706710_1.jpg
,10290,20000589877,$290,蔻驰,COACH,CASHMERE BICOLOR LOGO SCARF CHARCOALGREY 围巾,http://static.lottedfs.cn/prod/prd-img/09/67/70/00/00/02/20000706709_1.jpg
,10290,20000589876,$290,蔻驰,COACH,CASHMERE BICOLOR LOGO SCARF NAVYDENIM 围巾,http://static.lottedfs.cn/prod/prd-img/08/67/70/00/00/02/20000706708_1.jpg
促销,10290,20000589875,$110,蔻驰,COACH,SMALL WALLET GM/TRUE PINK MULTI 短款钱包,http://static.lottedfs.cn/prod/prd-img/07/67/70/00/00/02/20000706707_1.jpg
促销,10290,20000589874,$200,蔻驰,COACH,SOFT WALLET GM/TRUE PINK MULTI 卡包,http://static.lottedfs.cn/prod/prd-img/06/67/70/00/00/02/20000706706_1.jpg
促销,10290,20000589873,$70,蔻驰,COACH,FLAT CARD CASE GM/TRUE PINK MULTI 卡包,http://static.lottedfs.cn/prod/prd-img/05/67/70/00/00/02/20000706705_1.jpg
,10290,20000580959,$465,蔻驰,COACH,METROPOLITAN CAMERA BAG 斜挎包 QB/BLACK,http://static.lottedfs.cn/prod/prd-img/30/15/69/00/00/02/20000691530_1.jpg
促销,10290,20000580958,$750,蔻驰,COACH,DREAMER SHOULDER BAG 单肩包 V5/MULTICOLOR,http://static.lottedfs.cn/prod/prd-img/29/15/69/00/00/02/20000691529_1.jpg
,10290,20000580957,$465,蔻驰,COACH,METROPOLITAN CAMERA BAG 斜挎包 QB/BLACK,http://static.lottedfs.cn/prod/prd-img/28/15/69/00/00/02/20000691528_1.jpg
,10290,20000580956,$315,蔻驰,COACH,RIVINGTON BELT BAG 7 JI/BLACK 腰包,http://static.lottedfs.cn/prod/prd-img/27/15/69/00/00/02/20000691527_1.jpg
,10290,20000580955,$315,蔻驰,COACH,RIVINGTON BELT BAG 7 JI/KHAKI 腰包,http://static.lottedfs.cn/prod/prd-img/26/15/69/00/00/02/20000691526_5.JPG
,10290,20000580954,$500,蔻驰,COACH,RIVINGTON BIKE BAG JI/MIDNIGHT 斜挎包 NAVY/CHARCOAL,http://static.lottedfs.cn/prod/prd-img/25/15/69/00/00/02/20000691525_1.jpg
促销,10290,20000580953,$315,蔻驰,COACH,RIVINGTON BELT BAG 7 JI/TRUE BLUE MULTI 腰包,http://static.lottedfs.cn/prod/prd-img/24/15/69/00/00/02/20000691524_1.jpg
,10290,20000580952,$410,蔻驰,COACH,RIVINGTON UTILITY PACK JI/MIDNIGHT NAVY/CHARCOAL 腰包,http://static.lottedfs.cn/prod/prd-img/23/15/69/00/00/02/20000691523_1.jpg
,10290,20000580951,$315,蔻驰,COACH,RIVINGTON BELT BAG 7 JI/KHAKI 腰包,http://static.lottedfs.cn/prod/prd-img/22/15/69/00/00/02/20000691522_1.jpg
,10290,20000580950,$500,蔻驰,COACH,DALTON 31 SHOULDER BAG 单肩包 B4/TAN BLACK,http://static.lottedfs.cn/prod/prd-img/21/15/69/00/00/02/20000691521_1.jpg
,10290,20000580949,$500,蔻驰,COACH,DALTON 31 SHOULDER BAG 单肩包 B4/TAN RUST,http://static.lottedfs.cn/prod/prd-img/20/15/69/00/00/02/20000691520_1.jpg
促销,10290,20000580948,$650,蔻驰,COACH,DREAMER SHOULDER BAG 单肩包 B4/TAN CHALK,http://static.lottedfs.cn/prod/prd-img/19/15/69/00/00/02/20000691519_1.jpg
促销,10290,20000580947,$650,蔻驰,COACH,DREAMER SHOULDER BAG 单肩包 B4/TAN BLACK,http://static.lottedfs.cn/prod/prd-img/18/15/69/00/00/02/20000691518_1.jpg
促销,10290,20000580941,$500,蔻驰,COACH,DALTON 31 SHOULDER BAG 单肩包 V5/MIST,http://static.lottedfs.cn/prod/prd-img/12/15/69/00/00/02/20000691512_1.jpg
,10290,20000580940,$500,蔻驰,COACH,DALTON 31 SHOULDER BAG 单肩包 GD/OXBLOOD,http://static.lottedfs.cn/prod/prd-img/11/15/69/00/00/02/20000691511_1.jpg
,10290,20000580939,$500,蔻驰,COACH,DALTON 31 SHOULDER BAG 单肩包 GD/BLACK,http://static.lottedfs.cn/prod/prd-img/10/15/69/00/00/02/20000691510_1.jpg
促销,10290,20000580938,$410,蔻驰,COACH,PARKER 18 SHOULDER BAG 单肩包 V5/MIST,http://static.lottedfs.cn/prod/prd-img/09/15/69/00/00/02/20000691509_1.jpg
,10290,20000580937,$410,蔻驰,COACH,RIVINGTON UTILITY PACK JI/CHALK/BLACK 腰包,http://static.lottedfs.cn/prod/prd-img/08/15/69/00/00/02/20000691508_1.jpg
,10290,20000580936,$465,蔻驰,COACH,CASSIE CROSSBODY 斜挎包 B4/TAN RUST,http://static.lottedfs.cn/prod/prd-img/07/15/69/00/00/02/20000691507_1.jpg
,10290,20000580932,$200,蔻驰,COACH,SLIM ACCORDION ZIP GD/BLACK 长款钱包,http://static.lottedfs.cn/prod/prd-img/03/15/69/00/00/02/20000691503_1.jpg
,10290,20000580929,$465,蔻驰,COACH,DREAMER CONVERTIBLE CROSSBODY 斜挎包 V5/TRUE PINK MULTI,http://static.lottedfs.cn/prod/prd-img/00/15/69/00/00/02/20000691500_1.jpg
促销,10290,20000580928,$410,蔻驰,COACH,BELT BAG V5/TAN RED APPLE 腰包,http://static.lottedfs.cn/prod/prd-img/99/14/69/00/00/02/20000691499_1.jpg
促销,10290,20000580927,$95,蔻驰,COACH,REXY SKINNY SCARF WITH LEATHER TAB BLACK,http://static.lottedfs.cn/prod/prd-img/98/14/69/00/00/02/20000691498_1.jpg
促销,10290,20000580926,$110,蔻驰,COACH,L ZIP CARD CASE 卡包 TAN SIGNATURE MULTI,http://static.lottedfs.cn/prod/prd-img/97/14/69/00/00/02/20000691497_1.jpg
促销,10290,20000580925,$315,蔻驰,COACH,RIVINGTON CONVERTIBLE POUCH IN BLOCKED SIGNATURE 收纳包 TAN SIGNATURE MULTI,http://static.lottedfs.cn/prod/prd-img/96/14/69/00/00/02/20000691496_1.jpg
促销,10290,20000580924,$315,蔻驰,COACH,RIVINGTON CONVERTIBLE POUCH IN COLORBLOCKED LEATHER 收纳包 TRUE BLUE MULTI,http://static.lottedfs.cn/prod/prd-img/95/14/69/00/00/02/20000691495_1.jpg
畅销,10290,20000580923,$110,蔻驰,COACH,L ZIP CARD CASE 卡包 CHARCOAL SIGNATURE MULTI,http://static.lottedfs.cn/prod/prd-img/94/14/69/00/00/02/20000691494_1.jpg
,10290,20000580922,$110,蔻驰,COACH,SMALL WALLET 短款钱包 GD/TAN RED APPLE,http://static.lottedfs.cn/prod/prd-img/93/14/69/00/00/02/20000691493_1.jpg
,10290,20000580921,$70,蔻驰,COACH,FLAT CARD CASE 卡包 V5/TAN RED APPLE,http://static.lottedfs.cn/prod/prd-img/92/14/69/00/00/02/20000691492_1.jpg
,10290,20000580920,$350,蔻驰,COACH,DREAMER CONVERTIBLE CROSSBODY 斜挎包 B4/TAN CHALK,http://static.lottedfs.cn/prod/prd-img/91/14/69/00/00/02/20000691491_1.jpg
促销,10290,20000580919,$550,蔻驰,COACH,DREAMER 21 手提包 GD/TAN LIGHT RASPBERRY,http://static.lottedfs.cn/prod/prd-img/90/14/69/00/00/02/20000691490_2.JPG
促销,10290,20000580918,$550,蔻驰,COACH,DREAMER 21 手提包 GD/TAN RED APPLE,http://static.lottedfs.cn/prod/prd-img/89/14/69/00/00/02/20000691489_7.JPG
促销,10290,20000580917,$465,蔻驰,COACH,CHARLIE CARRYALL 手提包 V5/TAN TRUE PINK,http://static.lottedfs.cn/prod/prd-img/88/14/69/00/00/02/20000691488_1.jpg
促销,10290,20000580915,$465,蔻驰,COACH,CHARLIE CARRYALL 手提包 B4/TAN BLACK,http://static.lottedfs.cn/prod/prd-img/86/14/69/00/00/02/20000691486_1.jpg
,10290,20000580912,$410,蔻驰,COACH,CENTRAL TOTE 手提包 B4/TAN CHALK,http://static.lottedfs.cn/prod/prd-img/83/14/69/00/00/02/20000691483_1.jpg
促销,10290,20000580911,$500,蔻驰,COACH,KISSLOCK DREAMER 21 B4/TAN BLACK 手提包,http://static.lottedfs.cn/prod/prd-img/82/14/69/00/00/02/20000691482_6.JPG
促销,10290,20000580910,$500,蔻驰,COACH,KISSLOCK DREAMER 21 B4/TAN CHALK 手提包,http://static.lottedfs.cn/prod/prd-img/81/14/69/00/00/02/20000691481_6.JPG
,10290,20000580909,$650,蔻驰,COACH,SIGNATURE ACADEMY BACKPACK QB/CHARCOAL 双肩包,http://static.lottedfs.cn/prod/prd-img/80/14/69/00/00/02/20000691480_1.jpg
促销 新品,10290,20000580908,$240,蔻驰,COACH,POLISHED PEBBLE CHARLIE POUCH 收纳包 GD/BLACK,http://static.lottedfs.cn/prod/prd-img/79/14/69/00/00/02/20000691479_1.jpg
促销 畅销,10290,20000580905,$500,蔻驰,COACH,DREAMER 21 手提包 GD/CHALK,http://static.lottedfs.cn/prod/prd-img/76/14/69/00/00/02/20000691476_1.jpg
促销,10290,20000580904,$550,蔻驰,COACH,PARKER TOP HANDLE 手提包 B4/CHALK MULTI,http://static.lottedfs.cn/prod/prd-img/75/14/69/00/00/02/20000691475_1.jpg
促销,10290,20000580903,$410,蔻驰,COACH,CENTRAL TOTE WITH ZIP 手提包 SV/MIST,http://static.lottedfs.cn/prod/prd-img/74/14/69/00/00/02/20000691474_1.jpg
畅销,10290,20000580902,$410,蔻驰,COACH,ACADEMY CROSSBODY 斜挎包 QB/CHARCOAL,http://static.lottedfs.cn/prod/prd-img/73/14/69/00/00/02/20000691473_1.jpg
,10290,20000580895,$250,蔻驰,COACH,WIDE REGULAR CTS/REV LTHR BELT 腰带,http://static.lottedfs.cn/prod/prd-img/66/14/69/00/00/02/20000691466_1.jpg
,10290,20000580888,$290,蔻驰,COACH,SIGNATURE PVC ACCORDION WALLET 长款钱包 MIDNIGHT,http://static.lottedfs.cn/prod/prd-img/59/14/69/00/00/02/20000691459_1.jpg
,10290,20000580880,$650,蔻驰,COACH,KENNEDY BRIEF 公文包 QB/MIDNIGHT NAVY,http://static.lottedfs.cn/prod/prd-img/51/14/69/00/00/02/20000691451_1.jpg
,10290,20000580874,$250,蔻驰,COACH,WIDE HARNESS CUT TO SIZE REVERSIBLE SIGNATURE CROSSGRAIN BELT BLACK BLACK  腰带,http://static.lottedfs.cn/prod/prd-img/45/14/69/00/00/02/20000691445_1.jpg
,10290,20000580872,$500,蔻驰,COACH,SG_PARKER TOP HANDLE B4/TAN 女士包 BLACK,http://static.lottedfs.cn/prod/prd-img/43/14/69/00/00/02/20000691443_1.jpg
,10290,20000580866,$240,蔻驰,COACH,POLISHED PEBBLE BELT BAG 腰包 GD/BLACK,http://static.lottedfs.cn/prod/prd-img/37/14/69/00/00/02/20000691437_1.jpg
,10290,20000580865,$240,蔻驰,COACH,BELT BAG V5/TAN RED APPLE 腰包,http://static.lottedfs.cn/prod/prd-img/36/14/69/00/00/02/20000691436_1.jpg
畅销,10290,20000580862,$590,蔻驰,COACH,METROPOLITAN PORTFOLIO IN SIGNATURE 公文包 QB/CHARCOAL,http://static.lottedfs.cn/prod/prd-img/33/14/69/00/00/02/20000691433_1.jpg
,10290,20000580860,$500,蔻驰,COACH,RIVINGTON BIKE BAG IN SOFT GRAIN LEATHER 斜挎包 JI/BLACK,http://static.lottedfs.cn/prod/prd-img/31/14/69/00/00/02/20000691431_1.jpg
,10290,20000580859,$410,蔻驰,COACH,RIVINGTON UTILITY PACK IN SOFT GRAIN LEATHER 腰包 JI/BLACK,http://static.lottedfs.cn/prod/prd-img/30/14/69/00/00/02/20000691430_1.jpg
畅销,10290,20000580857,$315,蔻驰,COACH,PARKER 18 IN SIGNATURE CANVAS 单肩包 B4 CHALK,http://static.lottedfs.cn/prod/prd-img/28/14/69/00/00/02/20000691428_1.jpg
促销 畅销,10290,20000580849,$110,蔻驰,COACH,SMALL WALLET 短款钱包 V5/TAN RED APPLE,http://static.lottedfs.cn/prod/prd-img/20/14/69/00/00/02/20000691420_1.jpg
,10290,20000580845,$200,蔻驰,COACH,COLORBLOCK COATED CANVAS SIGNATURE SOFT WALLET B4 TAN RUST 长款钱包,http://static.lottedfs.cn/prod/prd-img/16/14/69/00/00/02/20000691416_1.jpg
畅销,10290,20000580841,$315,蔻驰,COACH,COATED CANVAS SIGNATURE CAMERA BAG 斜挎包 RUST,http://static.lottedfs.cn/prod/prd-img/12/14/69/00/00/02/20000691412_6.JPG
,10290,20000580838,$465,蔻驰,COACH,COLORBLOCK COATED CANVAS SIGNATURE PARKE SHOULDER BAG 单肩包 CHALK,http://static.lottedfs.cn/prod/prd-img/09/14/69/00/00/02/20000691409_1.jpg
促销,10290,20000580836,$350,蔻驰,COACH,CHARLIE 28 CARRYALL 手提包 GM/RED APPLE,http://static.lottedfs.cn/prod/prd-img/07/14/69/00/00/02/20000691407_1.jpg
,10290,20000580835,$350,蔻驰,COACH,POLISHED PEBBLE LEATHER CHARLIE 28 CARRYALL 手提包 GM/CHALK,http://static.lottedfs.cn/prod/prd-img/06/14/69/00/00/02/20000691406_1.jpg
,10290,20000574060,$465,蔻驰,COACH,TABBY SHOULDER BAG 26 单肩包 B4/OXBLOOD,http://static.lottedfs.cn/prod/prd-img/67/11/68/00/00/02/20000681167_1.jpg
,10290,20000574059,$465,蔻驰,COACH,PARKER SHOULDER BAG 单肩包 V5/TAN MIST INK,http://static.lottedfs.cn/prod/prd-img/66/11/68/00/00/02/20000681166_1.jpg
,10290,20000574057,$465,蔻驰,COACH,CHARLIE CARRYALL 斜挎包 V5/TAN MIST INK,http://static.lottedfs.cn/prod/prd-img/64/11/68/00/00/02/20000681164_1.jpg
促销,10290,20000574056,$650,蔻驰,COACH,PARKER TOP HANDLE 32 斜挎包 V5/MOSS,http://static.lottedfs.cn/prod/prd-img/63/11/68/00/00/02/20000681163_1.jpg
促销,10290,20000574055,$650,蔻驰,COACH,PARKER TOP HANDLE 32 斜挎包 B4/BEECHWOOD MULTI,http://static.lottedfs.cn/prod/prd-img/62/11/68/00/00/02/20000681162_1.jpg
促销,10290,20000574054,$550,蔻驰,COACH,CHARLIE CARRYALL 斜挎包 GD/BEECHWOOD MULTI,http://static.lottedfs.cn/prod/prd-img/61/11/68/00/00/02/20000681161_1.jpg
促销,10290,20000574053,$465,蔻驰,COACH,CHARLIE 28 CARRYALL 斜挎包 B4/MOSS,http://static.lottedfs.cn/prod/prd-img/60/11/68/00/00/02/20000681160_1.jpg
促销,10290,20000574052,$410,蔻驰,COACH,PRAIRIE SATCHEL 手提包 GD/MOSS,http://static.lottedfs.cn/prod/prd-img/59/11/68/00/00/02/20000681159_1.jpg
促销,10290,20000574051,$550,蔻驰,COACH,PARKER SHOULDER BAG 单肩包 V5/MIST MULTI,http://static.lottedfs.cn/prod/prd-img/58/11/68/00/00/02/20000681158_1.jpg
畅销,10290,20000574050,$465,蔻驰,COACH,GLOVETANNED LEATHER SADDLE BAG 20 单肩包 B4/BLACK,http://static.lottedfs.cn/prod/prd-img/57/11/68/00/00/02/20000681157_1.jpg
促销,10290,20000574049,$550,蔻驰,COACH,CHARLIE CARRYALL 斜挎包 GD/INK,http://static.lottedfs.cn/prod/prd-img/56/11/68/00/00/02/20000681156_7.JPG
促销,10290,20000574048,$465,蔻驰,COACH,PARKER SHOULDER BAG 单肩包 B4/MOSS,http://static.lottedfs.cn/prod/prd-img/55/11/68/00/00/02/20000681155_1.jpg
,10290,20000574047,$95,蔻驰,COACH,SMALL WRISTLET 收纳包 V5/TAN MIST INK,http://static.lottedfs.cn/prod/prd-img/54/11/68/00/00/02/20000681154_1.jpg
促销,10290,20000574046,$200,蔻驰,COACH,COACH FLORAL BOW OBLONG 丝巾 BLUSH 2,http://static.lottedfs.cn/prod/prd-img/53/11/68/00/00/02/20000681153_1.jpg
促销,10290,20000574045,$240,蔻驰,COACH,ALLOVER MEADOW PRAIRIE OVERSIZED SQUARE 54X54 MIST  大方巾,http://static.lottedfs.cn/prod/prd-img/52/11/68/00/00/02/20000681152_1.jpg
促销,10290,20000574044,$240,蔻驰,COACH,ALLOVER MEADOW PRAIRIE OVERSIZED SQUARE 54X54 CHALK 大方巾,http://static.lottedfs.cn/prod/prd-img/51/11/68/00/00/02/20000681151_1.jpg
促销,10290,20000574043,$260,蔻驰,COACH,CHARLIE POUCH 收纳包 V5/MIST,http://static.lottedfs.cn/prod/prd-img/50/11/68/00/00/02/20000681150_1.jpg
促销,10290,20000574042,$260,蔻驰,COACH,CHARLIE POUCH 收纳包 B4/MOSS,http://static.lottedfs.cn/prod/prd-img/49/11/68/00/00/02/20000681149_1.jpg
促销,10290,20000574041,$260,蔻驰,COACH,CHARLIE POUCH 收纳包 B4/CHALK,http://static.lottedfs.cn/prod/prd-img/48/11/68/00/00/02/20000681148_1.jpg
,10290,20000574040,$165,蔻驰,COACH,SMALL WALLET V5/MIST 短款钱包,http://static.lottedfs.cn/prod/prd-img/47/11/68/00/00/02/20000681147_1.JPG
,10290,20000574039,$165,蔻驰,COACH,SMALL WALLET B4/CHALK 短款钱包,http://static.lottedfs.cn/prod/prd-img/46/11/68/00/00/02/20000681146_1.JPG
促销,10290,20000574038,$110,蔻驰,COACH,SMALL WALLET 短款钱包 V5/TAN MIST INK,http://static.lottedfs.cn/prod/prd-img/45/11/68/00/00/02/20000681145_1.jpg
促销,10290,20000574036,$70,蔻驰,COACH,FLAT CARD CASE 卡包 GM/TAN MIST,http://static.lottedfs.cn/prod/prd-img/43/11/68/00/00/02/20000681143_1.jpg
促销,10290,20000574035,$110,蔻驰,COACH,SMALL ZIP AROUND 短款钱包 SV/MIST,http://static.lottedfs.cn/prod/prd-img/42/11/68/00/00/02/20000681142_1.jpg
促销,10290,20000574034,$465,蔻驰,COACH,CHARLIE CARRYALL 斜挎包 GD/MOSS,http://static.lottedfs.cn/prod/prd-img/41/11/68/00/00/02/20000681141_1.jpg
促销,10290,20000574033,$95,蔻驰,COACH,SMALL WRISTLET 收纳包 SV/MIST,http://static.lottedfs.cn/prod/prd-img/40/11/68/00/00/02/20000681140_1.jpg
促销,10290,20000571907,$410,蔻驰,COACH,POUCH IN PEBBLED LEATHER 信封包,http://static.lottedfs.cn/prod/prd-img/95/94/43/00/00/02/20000439495_1.jpg
,10290,20000565690,$465,蔻驰,COACH,SIGNATURE JACQUARD SADDLE BAG 20 B4/TAN SCARLET 单肩包,http://static.lottedfs.cn/prod/prd-img/42/09/67/00/00/02/20000670942_1.jpg
促销,10290,20000565688,$500,蔻驰,COACH,RILEY CROSSBODY B4/BRIGHT CHERRY MULTI 斜挎包,http://static.lottedfs.cn/prod/prd-img/40/09/67/00/00/02/20000670940_1.jpg
促销,10290,20000565687,$410,蔻驰,COACH,POUCH 30 COACH X GUANG YU CARNELIAN 收纳包,http://static.lottedfs.cn/prod/prd-img/39/09/67/00/00/02/20000670939_1.jpg
,10290,20000565685,$410,蔻驰,COACH,POUCH 30 COACH X GUANG YU KHAKI 收纳包,http://static.lottedfs.cn/prod/prd-img/37/09/67/00/00/02/20000670937_1.jpg
,10290,20000565684,$550,蔻驰,COACH,RILEY TOP HANDLE 18 B4/BRIGHT CHERRY 斜挎包,http://static.lottedfs.cn/prod/prd-img/36/09/67/00/00/02/20000670936_1.jpg
,10290,20000565680,$650,蔻驰,COACH,RILEY TOP HANDLE 22 B4/TAN BLACK 斜挎包,http://static.lottedfs.cn/prod/prd-img/32/09/67/00/00/02/20000670932_1.jpg
,10290,20000565679,$500,蔻驰,COACH,KISSLOCK DREAMER 21 B4/TAN BLACK 手提包,http://static.lottedfs.cn/prod/prd-img/31/09/67/00/00/02/20000670931_1.jpg
促销,10290,20000565678,$500,蔻驰,COACH,KISSLOCK DREAMER 21 B4/TAN CHALK 手提包,http://static.lottedfs.cn/prod/prd-img/30/09/67/00/00/02/20000670930_1.jpg
,10290,20000565677,$550,蔻驰,COACH,RILEY TOP HANDLE 18 B4/TAN CHALK 斜挎包,http://static.lottedfs.cn/prod/prd-img/29/09/67/00/00/02/20000670929_1.jpg
促销,10290,20000565676,$500,蔻驰,COACH,CASSIE CROSSBODY B4/LIGHT PEACH 斜挎包,http://static.lottedfs.cn/prod/prd-img/28/09/67/00/00/02/20000670928_1.jpg
促销,10290,20000565675,$260,蔻驰,COACH,MARLOW B4/TAN INK LIGHT PEACH 斜挎包,http://static.lottedfs.cn/prod/prd-img/27/09/67/00/00/02/20000670927_1.jpg
促销,10290,20000565674,$260,蔻驰,COACH,GLAM ROCK PATCHWORK OVERSIZED SQUARE 54X54 DUSTY LAVENDER 丝巾,http://static.lottedfs.cn/prod/prd-img/26/09/67/00/00/02/20000670926_1.jpg
促销,10290,20000565673,$95,蔻驰,COACH,FLAT CARD CASE GM/BRIGHT CHERRY 卡包,http://static.lottedfs.cn/prod/prd-img/25/09/67/00/00/02/20000670925_1.jpg
促销 畅销,10290,20000565672,$260,蔻驰,COACH,LARGE WRISTLET GM/BRIGHT CHERRY MULTI 收纳包,http://static.lottedfs.cn/prod/prd-img/24/09/67/00/00/02/20000670924_1.jpg
促销,10290,20000565671,$410,蔻驰,COACH,RILEY CROSSBODY V5/CHARCOAL MULTI 斜挎包,http://static.lottedfs.cn/prod/prd-img/23/09/67/00/00/02/20000670923_1.jpg
促销,10290,20000565670,$290,蔻驰,COACH,CONVERTIBLE BELT BAG B4/TAN RUST 腰包,http://static.lottedfs.cn/prod/prd-img/22/09/67/00/00/02/20000670922_1.jpg
促销,10290,20000565669,$290,蔻驰,COACH,BELT BAG GD/BRIGHT CHERRY MULTI 腰包,http://static.lottedfs.cn/prod/prd-img/21/09/67/00/00/02/20000670921_1.jpg
,10290,20000565667,$315,蔻驰,COACH,RIVINGTON CONVERTIBLE POUCH IN SIGNATURE KHAKI 收纳包,http://static.lottedfs.cn/prod/prd-img/19/09/67/00/00/02/20000670919_1.jpg
促销,10290,20000565666,$165,蔻驰,COACH,SMALL ZIP AROUND GM/MIDNIGHT NAVY 短款钱包,http://static.lottedfs.cn/prod/prd-img/18/09/67/00/00/02/20000670918_1.jpg
促销,10290,20000565665,$200,蔻驰,COACH,SMALL ZIP AROUND B4/TAN RUST 短款钱包,http://static.lottedfs.cn/prod/prd-img/17/09/67/00/00/02/20000670917_1.jpg
促销,10290,20000565664,$500,蔻驰,COACH,CAMPUS BACKPACK 23 B4/TAN RUST 背包,http://static.lottedfs.cn/prod/prd-img/16/09/67/00/00/02/20000670916_1.JPG
,10290,20000565663,$315,蔻驰,COACH,PARKER 18 SHOULDER BAG B4/TAN INK LIGHT PEACH 单肩包,http://static.lottedfs.cn/prod/prd-img/15/09/67/00/00/02/20000670915_1.jpg
促销,10290,20000565661,$465,蔻驰,COACH,CASSIE CROSSBODY B4/BRIGHT CHERRY MULTI 斜挎包,http://static.lottedfs.cn/prod/prd-img/13/09/67/00/00/02/20000670913_1.jpg
促销,10290,20000565660,$465,蔻驰,COACH,CAMPUS BACKPACK 23 GM/TAN BRIGHT CHERRY MULTI 背包,http://static.lottedfs.cn/prod/prd-img/12/09/67/00/00/02/20000670912_1.jpg
,10290,20000565659,$650,蔻驰,COACH,RILEY SHOULDER BAG B4/TAN RUST 单肩包,http://static.lottedfs.cn/prod/prd-img/11/09/67/00/00/02/20000670911_1.jpg
,10290,20000565658,$700,蔻驰,COACH,RILEY SHOULDER BAG V5/CHARCOAL MULTI 单肩包,http://static.lottedfs.cn/prod/prd-img/10/09/67/00/00/02/20000670910_1.jpg
促销,10290,20000565657,$500,蔻驰,COACH,RILEY CROSSBODY B4/BLACK 斜挎包,http://static.lottedfs.cn/prod/prd-img/09/09/67/00/00/02/20000670909_1.jpg
,10290,20000565656,$410,蔻驰,COACH,CENTRAL TOTE WITH ZIP SV/MIDNIGHT NAVY 手提包,http://static.lottedfs.cn/prod/prd-img/08/09/67/00/00/02/20000670908_1.jpg
促销,10290,20000565655,$410,蔻驰,COACH,CENTRAL TOTE WITH ZIP GD/BRIGHT CHERRY 手提包,http://static.lottedfs.cn/prod/prd-img/07/09/67/00/00/02/20000670907_1.jpg
,10290,20000565654,$410,蔻驰,COACH,CENTRAL TOTE WITH ZIP GD/BLACK 手提包,http://static.lottedfs.cn/prod/prd-img/06/09/67/00/00/02/20000670906_1.jpg
促销,10290,20000565653,$410,蔻驰,COACH,CENTRAL TOTE WITH ZIP GD/CHALK 手提包,http://static.lottedfs.cn/prod/prd-img/05/09/67/00/00/02/20000670905_1.jpg
,10290,20000565652,$410,蔻驰,COACH,CENTRAL TOTE WITH ZIP B4/TAN RUST 手提包,http://static.lottedfs.cn/prod/prd-img/04/09/67/00/00/02/20000670904_1.jpg
促销,10290,20000565651,$350,蔻驰,COACH,CAMERA BAG GM/BRIGHT CHERRY MULTI 斜挎包,http://static.lottedfs.cn/prod/prd-img/03/09/67/00/00/02/20000670903_1.jpg
促销,10290,20000565649,$500,蔻驰,COACH,EVIE BACKPACK B4/CHALK 背包,http://static.lottedfs.cn/prod/prd-img/01/09/67/00/00/02/20000670901_1.jpg
,10290,20000565648,$500,蔻驰,COACH,EVIE BACKPACK B4/BLACK 背包,http://static.lottedfs.cn/prod/prd-img/00/09/67/00/00/02/20000670900_1.jpg
,10290,20000565646,$465,蔻驰,COACH,CASSIE CROSSBODY B4/CHALK 斜挎包,http://static.lottedfs.cn/prod/prd-img/98/08/67/00/00/02/20000670898_1.jpg
,10290,20000565645,$465,蔻驰,COACH,CASSIE CROSSBODY B4/BLACK 斜挎包,http://static.lottedfs.cn/prod/prd-img/97/08/67/00/00/02/20000670897_1.jpg
