tag,brand_No,product_No,us_price,brand_name_chn,brand_name_eng,product_name,img_url
促销,10290,20000497495,$260,蔻驰,COACH,DOUBLE BILLFOLD RIVETS SADDLE 短款钱包,http://static.lottedfs.cn/prod/prd-img/11/11/56/00/00/02/20000561111_1.jpg
促销,10290,20000497487,$465,蔻驰,COACH,METALLIC LEATHER CHARLIE CARRYALL GM/METALLIC GRAPHITE 手提包,http://static.lottedfs.cn/prod/prd-img/03/11/56/00/00/02/20000561103_1.jpg
,10290,20000497484,$410,蔻驰,COACH,DOUBLE ZIP TRAVEL ORGANIZER IN CROSSGRAIN 长款钱包 BLACK,http://static.lottedfs.cn/prod/prd-img/00/11/56/00/00/02/20000561100_1.jpg
,10290,20000496048,$240,蔻驰,COACH,POLISHED PEBBLE CROSSBODY CLUTCH 斜挎包 BLACK,http://static.lottedfs.cn/prod/prd-img/73/18/51/00/00/02/20000511873_1.jpg
,10290,20000495076,$410,蔻驰,COACH,POUCH IN PEBBLED LEATHER 收纳包,http://static.lottedfs.cn/prod/prd-img/45/70/55/00/00/02/20000557045_1.jpg
畅销,10290,20000493748,$220,蔻驰,COACH,REGULAR HARNESS CUT TO SIZE REVERSIBLE BELT BLACK MAHOGANY 腰带,http://static.lottedfs.cn/prod/prd-img/26/44/55/00/00/02/20000554426_1.jpg
,10290,20000493739,$260,蔻驰,COACH,YEAR ROUND WINDOWPANE CHALLIS BLUSH 围巾,http://static.lottedfs.cn/prod/prd-img/17/44/55/00/00/02/20000554417_1.jpg
,10290,20000493737,$550,蔻驰,COACH,QUILTED LEATHER PARKER BACKPACK B4/BLACK 背包,http://static.lottedfs.cn/prod/prd-img/15/44/55/00/00/02/20000554415_5.jpg
,10290,20000493735,$165,蔻驰,COACH,SMALL FLAP WALLET GD/BLACK 短款钱包,http://static.lottedfs.cn/prod/prd-img/13/44/55/00/00/02/20000554413_1.jpg
促销,10290,20000493734,$290,蔻驰,COACH,DECO QUILTING DRESSY BELT BAG B4/BLACK 腰包,http://static.lottedfs.cn/prod/prd-img/12/44/55/00/00/02/20000554412_1.jpg
,10290,20000493729,$250,蔻驰,COACH,38MM CTS HARNESS CROSSGRAIN BELT CADET/BLACK 腰带,http://static.lottedfs.cn/prod/prd-img/07/44/55/00/00/02/20000554407_1.jpg
,10290,20000493728,$250,蔻驰,COACH,38MM CTS HARNESS BELT IN SIGNATURE LEATHER BLACK/BLACK 腰带,http://static.lottedfs.cn/prod/prd-img/06/44/55/00/00/02/20000554406_1.jpg
促销,10290,20000493727,$110,蔻驰,COACH,OWLTINI BAG CHARM LI/BLACK 钥匙链,http://static.lottedfs.cn/prod/prd-img/05/44/55/00/00/02/20000554405_1.jpg
畅销,10290,20000493726,$70,蔻驰,COACH,SIGNATURE LEATHER FLAT CARD CASE GD/BLACK 卡包,http://static.lottedfs.cn/prod/prd-img/04/44/55/00/00/02/20000554404_1.jpg
促销,10290,20000493721,$290,蔻驰,COACH,ROSE FOIL WINDOWPANE CHALLIS CHALK 方巾,http://static.lottedfs.cn/prod/prd-img/99/43/55/00/00/02/20000554399_1.jpg
,10290,20000493703,$750,蔻驰,COACH,COATED CANVAS SIGNATURE WITH EXOTIC DREAMER 36 B4/TAN BLACK MULTI 手提包,http://static.lottedfs.cn/prod/prd-img/81/43/55/00/00/02/20000554381_1.jpg
促销,10290,20000493692,$315,蔻驰,COACH,COATED CANVAS SIGNATURE CHAISE CROSSBODY GD/CHARCOAL MIDNIGHT NAVY 斜挎包,http://static.lottedfs.cn/prod/prd-img/70/43/55/00/00/02/20000554370_1.jpg
,10290,20000493691,$315,蔻驰,COACH,COATED CANVAS SIGNATURE CHAISE CROSSBODY B4/TAN RUST 斜挎包,http://static.lottedfs.cn/prod/prd-img/69/43/55/00/00/02/20000554369_1.jpg
促销,10290,20000493690,$465,蔻驰,COACH,METALLIC DREAMER 21 GM/METALLIC BERRY 手提包,http://static.lottedfs.cn/prod/prd-img/68/43/55/00/00/02/20000554368_1.jpg
,10290,20000493683,$410,蔻驰,COACH,MANHATTAN POUCH IN REFINED CALF BLACK 收纳包,http://static.lottedfs.cn/prod/prd-img/61/43/55/00/00/02/20000554361_1.jpg
,10290,20000493682,$110,蔻驰,COACH,SMALL TRAVEL CASE IN SIGNATURE COATED CANVAS 收纳包 CHARCOAL,http://static.lottedfs.cn/prod/prd-img/60/43/55/00/00/02/20000554360_1.jpg
,10290,20000493681,$410,蔻驰,COACH,KENT CROSSBODY IN SOFT GRAIN LEATHER JI/BLACK 斜挎包,http://static.lottedfs.cn/prod/prd-img/59/43/55/00/00/02/20000554359_1.jpg
,10290,20000493680,$240,蔻驰,COACH,SIGNATURE COATED CANVAS POP UP MESSENGER LI/CHARCOAL MIDNIGHT NAVY 斜挎包,http://static.lottedfs.cn/prod/prd-img/58/43/55/00/00/02/20000554358_1.jpg
,10290,20000493678,$240,蔻驰,COACH,SIGNATURE COATED CANVAS POP UP MESSENGER B4/TAN RUST 斜挎包,http://static.lottedfs.cn/prod/prd-img/56/43/55/00/00/02/20000554356_1.jpg
促销,10290,20000493669,$500,蔻驰,COACH,REFINED CALF LEATHER PARKER BACKPACK B4/BLACK 背包,http://static.lottedfs.cn/prod/prd-img/47/43/55/00/00/02/20000554347_1.jpg
,10290,20000493668,$315,蔻驰,COACH,POLISHED PEBBLE LEATHER CHAISE CROSSBODY GD/BLACK 斜挎包,http://static.lottedfs.cn/prod/prd-img/46/43/55/00/00/02/20000554346_1.jpg
促销,10290,20000493665,$200,蔻驰,COACH,CLUSTERED STARS BAG CHARM GD/MULTI  钥匙链,http://static.lottedfs.cn/prod/prd-img/43/43/55/00/00/02/20000554343_1.jpg
促销 畅销,10290,20000493661,$410,蔻驰,COACH,REFINED CALF LEATHER TRAIL BAG GD/BLACK 斜挎包,http://static.lottedfs.cn/prod/prd-img/39/43/55/00/00/02/20000554339_1.jpg
,10290,20000493660,$410,蔻驰,COACH,COATED CANVAS SIGNATURE TRAIL BAG B4/RUST 斜挎包,http://static.lottedfs.cn/prod/prd-img/38/43/55/00/00/02/20000554338_1.jpg
促销,10290,20000493659,$750,蔻驰,COACH,GLOVETAN LEATHER LAURAL FRAME BAG BP/HEATHER GREY 手提包,http://static.lottedfs.cn/prod/prd-img/37/43/55/00/00/02/20000554337_1.jpg
促销,10290,20000493657,$465,蔻驰,COACH,RAINBOW ROSE PRINT WITH LEATHER SEQUINS CAMERA BAG DK/BLACK MULTI 斜挎包,http://static.lottedfs.cn/prod/prd-img/35/43/55/00/00/02/20000554335_1.jpg
,10290,20000493654,$35,蔻驰,COACH,UNI CARABINER SV/OILSLICK 钥匙链,http://static.lottedfs.cn/prod/prd-img/32/43/55/00/00/02/20000554332_1.jpg
,10290,20000493653,$35,蔻驰,COACH,REXY CARABINER SV/OILSLICK 钥匙链,http://static.lottedfs.cn/prod/prd-img/31/43/55/00/00/02/20000554331_1.jpg
,10290,20000493652,$35,蔻驰,COACH,REXY CARABINER GD/SILVER 挂饰,http://static.lottedfs.cn/prod/prd-img/30/43/55/00/00/02/20000554330_1.jpg
,10290,20000493650,$270,蔻驰,COACH,38MM SCULPTED C REVERSIBLE LEATHER BELT OL CHESTNUT MIDNIGHT 腰带,http://static.lottedfs.cn/prod/prd-img/28/43/55/00/00/02/20000554328_1.jpg
促销,10290,20000493646,$650,蔻驰,COACH,QUILTING WITH RIVETS PARKER SHOULDER BAG 单肩包,http://static.lottedfs.cn/prod/prd-img/24/43/55/00/00/02/20000554324_1.jpg
,10290,20000493642,$240,蔻驰,COACH,3 IN 1 WALLET IN CROSSGRAIN CADET 短款钱包,http://static.lottedfs.cn/prod/prd-img/20/43/55/00/00/02/20000554320_1.jpg
促销,10290,20000487205,$90,蔻驰,COACH,BONNIE LONG BOOTS CANVAS TURNLOCK POUCH 26 手拿包 B4/ORANGE,http://static.lottedfs.cn/prod/prd-img/68/33/54/00/00/02/20000543368_1.JPG
促销,10290,20000487204,$90,蔻驰,COACH,BONNIE WALKING CANVAS TURNLOCK POUCH 26 手拿包 B4/PURPLE,http://static.lottedfs.cn/prod/prd-img/67/33/54/00/00/02/20000543367_1.JPG
促销 畅销,10290,20000487201,"$1,350",蔻驰,COACH,LEATHER SEQUINS ROGUE BAG 单肩包 BP/BLACK MULTI,http://static.lottedfs.cn/prod/prd-img/64/33/54/00/00/02/20000543364_1.JPG
促销,10290,20000487200,$500,蔻驰,COACH,CROSSGRAIN PATENT LEATHER QUINN SATCHEL 手提包 LI/BLACK,http://static.lottedfs.cn/prod/prd-img/63/33/54/00/00/02/20000543363_1.JPG
,10290,20000487179,$165,蔻驰,COACH,SIGNATURE C DOUBLE FACE SCARF CHARCOAL/BLACK 围巾,http://static.lottedfs.cn/prod/prd-img/42/33/54/00/00/02/20000543342_1.jpg
促销,10290,20000487174,$800,蔻驰,COACH,EMBOSSED CROC DETAIL LAURAL FRAME BAG 手提包 B4/MIDNIGHT NAVY,http://static.lottedfs.cn/prod/prd-img/37/33/54/00/00/02/20000543337_1.JPG
促销,10290,20000487171,$650,蔻驰,COACH,EMBOSSED CROC GRACE BAG LI/PLUM 手提包,http://static.lottedfs.cn/prod/prd-img/34/33/54/00/00/02/20000543334_1.jpg
,10290,20000487156,$165,蔻驰,COACH,VARSITY STRIPE SCARF 围巾  NAVY/MAIZE/CHALK,http://static.lottedfs.cn/prod/prd-img/19/33/54/00/00/02/20000543319_1.jpg
,10290,20000487152,$110,蔻驰,COACH,COLORBLOCK SMALL WALLET 短款钱包 LI/PLUM MULTI,http://static.lottedfs.cn/prod/prd-img/15/33/54/00/00/02/20000543315_1.jpg
促销 畅销,10290,20000483160,$200,蔻驰,COACH,CROSSGRAIN MESSENGER CROSSBODY GD/OXBLOOD  斜挎包,http://static.lottedfs.cn/prod/prd-img/56/68/53/00/00/02/20000536856_1.jpg
促销,10290,20000483142,$500,蔻驰,COACH,REFINED CALF LEATHER SELENA BOND BAG GD/PEONY 手提包,http://static.lottedfs.cn/prod/prd-img/38/68/53/00/00/02/20000536838_1.jpg
促销,10290,20000483141,$550,蔻驰,COACH,CRYSTAL EMBELLISHED SELENA BOND BAG GM/WINE 手提包,http://static.lottedfs.cn/prod/prd-img/37/68/53/00/00/02/20000536837_1.jpg
促销,10290,20000483133,"$1,050",蔻驰,COACH,LEATHER SEQUINS ROGUE BAG 25 BP/BLUE MULTI 手提包,http://static.lottedfs.cn/prod/prd-img/29/68/53/00/00/02/20000536829_1.jpg
促销,10290,20000483132,$70,蔻驰,COACH,LAS VEGAS BAG CHARM 挂饰 BK/MIDNIGHT NAVY,http://static.lottedfs.cn/prod/prd-img/28/68/53/00/00/02/20000536828_1.JPG
促销,10290,20000483131,$70,蔻驰,COACH,CALIFORNIA BAG CHARM 挂饰 BK/CORNFLOWER,http://static.lottedfs.cn/prod/prd-img/27/68/53/00/00/02/20000536827_1.JPG
促销 畅销,10290,20000483130,$70,蔻驰,COACH,NEW YORK BAG CHARM 挂饰 GD/WINE,http://static.lottedfs.cn/prod/prd-img/26/68/53/00/00/02/20000536826_1.JPG
促销,10290,20000483128,$70,蔻驰,COACH,ROSE FLORAL BAG CHARM BK/BLUE 挂饰,http://static.lottedfs.cn/prod/prd-img/24/68/53/00/00/02/20000536824_1.jpg
促销,10290,20000483127,$200,蔻驰,COACH,LEATHER SEQUIN TEA ROSE MULTI BAG CHARM GD/BEECHWOOD 挂饰,http://static.lottedfs.cn/prod/prd-img/23/68/53/00/00/02/20000536823_1.jpg
,10290,20000483122,$95,蔻驰,COACH,COLORBLOCK COATED CANVAS SIGNATURE SMALL WRISTLET LI/CHARCOAL MIDNIGHT NAVY 手拿包,http://static.lottedfs.cn/prod/prd-img/18/68/53/00/00/02/20000536818_1.jpg
促销,10290,20000483113,$410,蔻驰,COACH,OVERSIZED REVERSIBLE SOLID CASHMERE MUFFLER 围巾 BLACK,http://static.lottedfs.cn/prod/prd-img/09/68/53/00/00/02/20000536809_1.JPG
,10290,20000483109,$315,蔻驰,COACH,BREAST POCKET IN SIGNATURE HARDWARE BLACK  长款钱包,http://static.lottedfs.cn/prod/prd-img/05/68/53/00/00/02/20000536805_1.jpg
畅销,10290,20000483108,$240,蔻驰,COACH,DOUBLE BILLFOLD IN SIGNATURE HARDWARE DENIM 短款钱包,http://static.lottedfs.cn/prod/prd-img/04/68/53/00/00/02/20000536804_1.jpg
促销,10290,20000483105,$240,蔻驰,COACH,EMBOSSED CROC SOFT WALLET LI/MIDNIGHT NAVY 长款钱包,http://static.lottedfs.cn/prod/prd-img/01/68/53/00/00/02/20000536801_1.jpg
促销,10290,20000483104,$315,蔻驰,COACH,EMBOSSED CROC ACCORDION ZIP LI/MIDNIGHT NAVY 长款钱包,http://static.lottedfs.cn/prod/prd-img/00/68/53/00/00/02/20000536800_1.jpg
促销,10290,20000483102,$165,蔻驰,COACH,EMBOSSED CROC SMALL ZIP AROUND WALLET LI/MIDNIGHT NAVY 短款钱包,http://static.lottedfs.cn/prod/prd-img/98/67/53/00/00/02/20000536798_1.jpg
促销,10290,20000483092,$110,蔻驰,COACH,COATED CANVAS SIGNATURE STRAP LI/CHARCOAL MIDNIGHT NAVY 包带,http://static.lottedfs.cn/prod/prd-img/88/67/53/00/00/02/20000536788_1.jpg
促销 畅销,10290,20000483091,$110,蔻驰,COACH,ROSE PRINT LEATHER STRAP SV/SKY 包带,http://static.lottedfs.cn/prod/prd-img/87/67/53/00/00/02/20000536787_1.jpg
促销,10290,20000483089,$700,蔻驰,COACH,LEATHER SEQUINS DINKY CROSSBODY BP/BLUE MULTI 斜挎包,http://static.lottedfs.cn/prod/prd-img/85/67/53/00/00/02/20000536785_1.jpg
促销,10290,20000483088,$700,蔻驰,COACH,LEATHER SEQUINS DINKY CROSSBODY BP/BLACK MULTI 斜挎包,http://static.lottedfs.cn/prod/prd-img/84/67/53/00/00/02/20000536784_1.jpg
,10290,20000483085,$110,蔻驰,COACH,COLORBLOCK COATED CANVAS SIGNATURE SMALL WALLET 短款钱包 LI/CHARCOAL MIDNIGHT NAVY,http://static.lottedfs.cn/prod/prd-img/81/67/53/00/00/02/20000536781_1.JPG
,10290,20000483084,$200,蔻驰,COACH,COLORBLOCK COATED CANVAS SIGNATURE SOFT WALLET 长款钱包 LI/CHARCOAL MIDNIGHT NAVY,http://static.lottedfs.cn/prod/prd-img/80/67/53/00/00/02/20000536780_1.JPG
,10290,20000483083,$290,蔻驰,COACH,COLORBLOCK COATED CANVAS SIGNATURE ACCORDION ZIP LI/CHARCOAL MIDNIGHT NAVY 长款钱包,http://static.lottedfs.cn/prod/prd-img/79/67/53/00/00/02/20000536779_1.jpg
,10290,20000483082,$70,蔻驰,COACH,COLORBLOCK COATED CANVAS SIGNATURE FLAT CARD CASE LI/CHARCOAL MIDNIGHT NAVY 卡包,http://static.lottedfs.cn/prod/prd-img/78/67/53/00/00/02/20000536778_1.jpg
促销,10290,20000483073,$260,蔻驰,COACH,OVERSIZED PLAID BLANKET SCARF ROSE 围巾,http://static.lottedfs.cn/prod/prd-img/69/67/53/00/00/02/20000536769_3.JPG
,10290,20000476802,$250,蔻驰,COACH,30mm HARNESS BELT IN CROCODILE EMBOSSED LEATHER BLACK 腰带,http://static.lottedfs.cn/prod/prd-img/92/69/52/00/00/02/20000526992_1.jpg
促销,10290,20000476799,$290,蔻驰,COACH,POLISHED PEBBLE LEATHER ACCORDION ZIP OXBLOOD 长款钱包,http://static.lottedfs.cn/prod/prd-img/89/69/52/00/00/02/20000526989_1.jpg
,10290,20000476798,$290,蔻驰,COACH,POLISHED PEBBLE LEATHER ACCORDION ZIP HEATHER GREY 长款钱包,http://static.lottedfs.cn/prod/prd-img/88/69/52/00/00/02/20000526988_1.jpg
,10290,20000476797,$290,蔻驰,COACH,CROSSGRAIN LEATHER ACCORDION ZIP 长款钱包 LI/OXBLOOD,http://static.lottedfs.cn/prod/prd-img/87/69/52/00/00/02/20000526987_1.jpg
促销,10290,20000476781,$200,蔻驰,COACH,SMALL ZIP AROUND IN ZIP BILLFOLD IN SIGNATURE 短款钱包 KHAKI,http://static.lottedfs.cn/prod/prd-img/71/69/52/00/00/02/20000526971_1.JPG
促销,10290,20000476780,$200,蔻驰,COACH,SMALL ZIP AROUND IN ZIP BILLFOLD IN SIGNATURE 短款钱包 CHARCOAL,http://static.lottedfs.cn/prod/prd-img/70/69/52/00/00/02/20000526970_1.JPG
,10290,20000476773,$215,蔻驰,COACH,SIGNATURE C COIN WALLET MAHOGANY 短款钱包,http://static.lottedfs.cn/prod/prd-img/63/69/52/00/00/02/20000526963_1.jpg
促销,10290,20000476770,$240,蔻驰,COACH,POLISHED PEBBLE FOLDOVER CROSSBODY CLUTCH 斜挎包 LI NAVY,http://static.lottedfs.cn/prod/prd-img/60/69/52/00/00/02/20000526960_1.jpg
促销,10290,20000476769,$240,蔻驰,COACH,POLISHED PEBBLE FOLDOVER CROSSBODY CLUTCH 斜挎包 DK/HEATHER GREY,http://static.lottedfs.cn/prod/prd-img/59/69/52/00/00/02/20000526959_1.JPG
促销,10290,20000476759,$315,蔻驰,COACH,ACADEMY TRAVEL CASE IN PEBBLE LEATHER BLACK 包,http://static.lottedfs.cn/prod/prd-img/49/69/52/00/00/02/20000526949_1.jpg
,10290,20000476756,$650,蔻驰,COACH,BORDER RIVETS MIXED LEATHER DREAMER 手提包 B4/OXBLOOD,http://static.lottedfs.cn/prod/prd-img/46/69/52/00/00/02/20000526946_1.jpg
促销,10290,20000476750,$650,蔻驰,COACH,COLORBLOCK DREAMER 手提包 LI/ROSE MULTI,http://static.lottedfs.cn/prod/prd-img/40/69/52/00/00/02/20000526940_1.jpg
,10290,20000476749,$750,蔻驰,COACH,BORDER RIVETS MIXED LEATHER DREAMER 36 手提包 B4/OXBLOOD,http://static.lottedfs.cn/prod/prd-img/39/69/52/00/00/02/20000526939_1.jpg
促销,10290,20000476737,$410,蔻驰,COACH,SIGNATURE LEATHER DINKY CROSSBODY WITH LEATHER STRAP BLACK 单肩包,http://static.lottedfs.cn/prod/prd-img/27/69/52/00/00/02/20000526927_1.jpg
,10290,20000476736,$410,蔻驰,COACH,SIGNATURE LEATHER DINKY CROSSBODY IN FLORAL BOW PRINT AND LEATHER STRAP PEONY 单肩包,http://static.lottedfs.cn/prod/prd-img/26/69/52/00/00/02/20000526926_1.jpg
促销,10290,20000476733,$650,蔻驰,COACH,HUDSON 5 BAG IN SIGNATURE LEATHER 公文包 QB/BLACK,http://static.lottedfs.cn/prod/prd-img/23/69/52/00/00/02/20000526923_1.jpg
促销 畅销,10290,20000476731,$550,蔻驰,COACH,HUDSON 5 BAG IN SIGNATURE 公文包 LH/KHAKI,http://static.lottedfs.cn/prod/prd-img/21/69/52/00/00/02/20000526921_1.jpg
畅销,10290,20000476727,$500,蔻驰,COACH,COATED CANVAS SIGNATURE CAMPUS BACKPACK REFRESH 背包 B4/TAN RUST,http://static.lottedfs.cn/prod/prd-img/17/69/52/00/00/02/20000526917_1.jpg
,10290,20000476726,$465,蔻驰,COACH,ACADEMY PACK IN PEBBLED LEATHER 背包 JI/DENIM,http://static.lottedfs.cn/prod/prd-img/16/69/52/00/00/02/20000526916_1.jpg
,10290,20000476725,$465,蔻驰,COACH,ACADEMY PACK IN PEBBLED LEATHER 背包 JI/BLACK,http://static.lottedfs.cn/prod/prd-img/15/69/52/00/00/02/20000526915_1.jpg
促销,10290,20000476723,$650,蔻驰,COACH,ACADEMY BACKPACK IN PEBBLED LEATHER 背包 QB/HEATHER GREY,http://static.lottedfs.cn/prod/prd-img/13/69/52/00/00/02/20000526913_1.jpg
,10290,20000476720,$500,蔻驰,COACH,ACADEMY BACKPACK IN WILD BEAST CORDURA 背包 JI/DENIM,http://static.lottedfs.cn/prod/prd-img/10/69/52/00/00/02/20000526910_1.jpg
促销,10290,20000476718,$110,蔻驰,COACH,ROSE PRINT LEATHER STRAP 包带 LI/CHALK,http://static.lottedfs.cn/prod/prd-img/08/69/52/00/00/02/20000526908_1.jpg
,10290,20000476717,$200,蔻驰,COACH,COLORBLOCK COATED CANVAS SIGNATURE SOFT WALLET 长款钱包 B4 TAN BLACK,http://static.lottedfs.cn/prod/prd-img/07/69/52/00/00/02/20000526907_1.jpg
促销,10290,20000476713,$70,蔻驰,COACH,HAWAII BAG CHARM GD/CHALK 包包配饰,http://static.lottedfs.cn/prod/prd-img/03/69/52/00/00/02/20000526903_1.jpg
,10290,20000476709,$110,蔻驰,COACH,COATED CANVAS SIGNATURE STRAP 包带 B4/RUST,http://static.lottedfs.cn/prod/prd-img/99/68/52/00/00/02/20000526899_1.jpg
促销,10290,20000476708,$700,蔻驰,COACH,GLOVETANNED PEBBLE LEATHER ROGUE BAG 25 单肩包 BP/OXBLOOD,http://static.lottedfs.cn/prod/prd-img/98/68/52/00/00/02/20000526898_1.jpg
,10290,20000476706,$250,蔻驰,COACH,38MM CLASSIC PLAQUE CUT TO SIZE REVERSIBLE SIGNATURE CROSSGRAIN LEATHER BELT MAHOGANY 腰带,http://static.lottedfs.cn/prod/prd-img/96/68/52/00/00/02/20000526896_1.jpg
,10290,20000476705,$250,蔻驰,COACH,WIDE HARNESS CUT TO SIZE REVERSIBLE SIGNATURE CROSSGRAIN BELT MAHOGANY MAHOGANY 腰带,http://static.lottedfs.cn/prod/prd-img/95/68/52/00/00/02/20000526895_1.jpg
畅销,10290,20000476694,$110,蔻驰,COACH,CROSSGRAIN LEATHER SMALL WALLET 短款钱包 DK/HEATHER GREY,http://static.lottedfs.cn/prod/prd-img/84/68/52/00/00/02/20000526884_1.jpg
,10290,20000476693,$95,蔻驰,COACH,POLISHED PEBBLE SMALL WRISTLET 手包 DK/HEATHER GREY,http://static.lottedfs.cn/prod/prd-img/83/68/52/00/00/02/20000526883_1.JPG
,10290,20000476688,$250,蔻驰,COACH,WIDE HARNESS CUT TO SIZE REVERSIBLE SIGNATURE BELT 腰带 DARK DENIM MIDNIGHT,http://static.lottedfs.cn/prod/prd-img/78/68/52/00/00/02/20000526878_1.jpg
,10290,20000476687,$35,蔻驰,COACH,DINKY CHAIN STRAP BLACK COPPER 包链,http://static.lottedfs.cn/prod/prd-img/77/68/52/00/00/02/20000526877_1.JPG
,10290,20000476683,$250,蔻驰,COACH,30MM HARNESS BELT IN CROCODILE EMBOSSED LEATHER 腰带 SADDLE,http://static.lottedfs.cn/prod/prd-img/73/68/52/00/00/02/20000526873_1.jpg
促销,10290,20000476682,$110,蔻驰,COACH,MULTIFUNCTIONAL POUCH IN CORDURA 收纳包 BRIGHT NAVY,http://static.lottedfs.cn/prod/prd-img/72/68/52/00/00/02/20000526872_1.JPG
,10290,20000467463,$95,蔻驰,COACH,FLORAL BOW SMALL WRISTLET SV/ICE PINK FLORAL BOW 包,http://static.lottedfs.cn/prod/prd-img/59/22/51/00/00/02/20000512259_1.JPG
促销,10290,20000467343,$200,蔻驰,COACH,SMOOTH LEATHER SLIM PHONE CROSSBODY LI/BLACK 斜挎包,http://static.lottedfs.cn/prod/prd-img/87/20/51/00/00/02/20000512087_1.jpg
促销,10290,20000467338,$200,蔻驰,COACH,SIGNATURE C STOLE IVORY  围巾,http://static.lottedfs.cn/prod/prd-img/82/20/51/00/00/02/20000512082_1.jpg
促销,10290,20000467330,$215,蔻驰,COACH,SLIM COIN WALLET IN SPORT CALF LEATHER 短款钱包,http://static.lottedfs.cn/prod/prd-img/74/20/51/00/00/02/20000512074_1.jpg
促销,10290,20000467321,$465,蔻驰,COACH,POLISHED PEBBLE LEATHER EDIE 31 SHOULDER BAG 单肩包 LI 1941 SADDLE,http://static.lottedfs.cn/prod/prd-img/65/20/51/00/00/02/20000512065_1.JPG
促销,10290,20000467314,$290,蔻驰,COACH,SPORT CALF ACCORDION WALLET BLACK 长款钱包,http://static.lottedfs.cn/prod/prd-img/58/20/51/00/00/02/20000512058_1.jpg
,10290,20000467313,$250,蔻驰,COACH,38mm SCULPTED C PEBBLED LEATHER BELT  腰带 BLACK,http://static.lottedfs.cn/prod/prd-img/57/20/51/00/00/02/20000512057_1.jpg
促销,10290,20000467308,$105,蔻驰,COACH,ANODIZED TREX BAG CHARM S3 OIL SLICK  包包配饰,http://static.lottedfs.cn/prod/prd-img/52/20/51/00/00/02/20000512052_1.jpg
促销 畅销,10290,20000467298,$410,蔻驰,COACH,GLOVETANNED LEATHER DINKY CROSSBODY BORDEAUX 1941 RED 手提包兼斜挎包,http://static.lottedfs.cn/prod/prd-img/42/20/51/00/00/02/20000512042_1.jpg
促销,10290,20000467297,$500,蔻驰,COACH,POLISHED PBBL LTHR TURNLOCK EDIE SHLDR LI ROSE 单肩包,http://static.lottedfs.cn/prod/prd-img/41/20/51/00/00/02/20000512041_1.jpg
促销,10290,20000467294,$500,蔻驰,COACH,POLISHED PEBBLE LEATHER TURNLOCK EDIE SHOULDER BAG 单肩包 NAVY,http://static.lottedfs.cn/prod/prd-img/38/20/51/00/00/02/20000512038_1.jpg
促销,10290,20000467292,$105,蔻驰,COACH,COATED CANVAS SIGNATURE BUSINESS CARD CASE B4 TAN RUST 卡包,http://static.lottedfs.cn/prod/prd-img/36/20/51/00/00/02/20000512036_2.jpg
促销,10290,20000467288,$70,蔻驰,COACH,ROSE FLORAL BAG CHARM GD CHALK 挂饰,http://static.lottedfs.cn/prod/prd-img/32/20/51/00/00/02/20000512032_1.jpg
,10290,20000467281,$95,蔻驰,COACH,COLORBLOCK COATED CANVAS SIGNATURE SMALL WRISTLET B4 TAN CHALK 手拿包,http://static.lottedfs.cn/prod/prd-img/25/20/51/00/00/02/20000512025_1.jpg
促销,10290,20000467274,$650,蔻驰,COACH,ACADEMY HOLDALL 公文包 QB OXBLOOD,http://static.lottedfs.cn/prod/prd-img/18/20/51/00/00/02/20000512018_1.jpg
促销,10290,20000467272,$650,蔻驰,COACH,ACADEMY HOLDALL 公文包 JI BLACK,http://static.lottedfs.cn/prod/prd-img/16/20/51/00/00/02/20000512016_1.jpg
,10290,20000467258,$410,蔻驰,COACH,ACADEMY POUCH IN PEBBLE LEATHER BLACK 手包,http://static.lottedfs.cn/prod/prd-img/02/20/51/00/00/02/20000512002_1.jpg
,10290,20000467256,$465,蔻驰,COACH,DOUBLE ZIP TRAVEL ORGANIZER IN SIGNATURE LEATHER MIDNIGHT 长款钱包,http://static.lottedfs.cn/prod/prd-img/00/20/51/00/00/02/20000512000_1.JPG
,10290,20000467255,$465,蔻驰,COACH,DOUBLE ZIP TRAVEL ORGANIZER IN SIGNATURE LEATHER BLACK 长款钱包,http://static.lottedfs.cn/prod/prd-img/99/19/51/00/00/02/20000511999_1.JPG
,10290,20000467254,$410,蔻驰,COACH,TRAVEL WALLET IN SIGNATURE LEATHER MIDNIGHT 长款钱包,http://static.lottedfs.cn/prod/prd-img/98/19/51/00/00/02/20000511998_1.JPG
,10290,20000467253,$410,蔻驰,COACH,TRAVEL WALLET IN SIGNATURE LEATHER BLACK 长款钱包,http://static.lottedfs.cn/prod/prd-img/97/19/51/00/00/02/20000511997_1.JPG
促销,10290,20000467250,$240,蔻驰,COACH,DOUBLE BILLFOLD IN EMBOSSED SIGNATURE LEATHER 短款钱包 MIDNIGHT,http://static.lottedfs.cn/prod/prd-img/94/19/51/00/00/02/20000511994_1.jpg
促销,10290,20000467249,$240,蔻驰,COACH,DOUBLE BILLFOLD IN EMBOSSED SIGNATURE LEATHER HEATHER GREY 短款钱包,http://static.lottedfs.cn/prod/prd-img/93/19/51/00/00/02/20000511993_1.JPG
促销,10290,20000467248,$240,蔻驰,COACH,DOUBLE BILLFOLD IN EMBOSSED SIGNATURE LEATHER 短款钱包 BLACK,http://static.lottedfs.cn/prod/prd-img/92/19/51/00/00/02/20000511992_1.jpg
促销 畅销,10290,20000467247,$315,蔻驰,COACH,ACCORDION IN EMBOSSED SIGNATURE LEATHER MIDNIGHT 长款钱包,http://static.lottedfs.cn/prod/prd-img/91/19/51/00/00/02/20000511991_1.JPG
,10290,20000467246,$315,蔻驰,COACH,ACCORDION IN EMBOSSED SIGNATURE LEATHER HEATHER GREY 长款钱包,http://static.lottedfs.cn/prod/prd-img/90/19/51/00/00/02/20000511990_1.JPG
,10290,20000467245,$315,蔻驰,COACH,ACCORDION IN EMBOSSED SIGNATURE LEATHER BLACK 长款钱包,http://static.lottedfs.cn/prod/prd-img/89/19/51/00/00/02/20000511989_1.JPG
,10290,20000467244,$110,蔻驰,COACH,CARD CASE IN EMBOSSED SIGNATURE LEATHER MIDNIGHT 卡包,http://static.lottedfs.cn/prod/prd-img/88/19/51/00/00/02/20000511988_1.JPG
,10290,20000467243,$110,蔻驰,COACH,CARD CASE IN EMBOSSED SIGNATURE LEATHER HEATHER GREY 卡包,http://static.lottedfs.cn/prod/prd-img/87/19/51/00/00/02/20000511987_1.JPG
促销,10290,20000467241,$500,蔻驰,COACH,REFINED CALF LEATHER GRACE BAG DK HEATHER GREY 手提包,http://static.lottedfs.cn/prod/prd-img/85/19/51/00/00/02/20000511985_1.JPG
促销 畅销,10290,20000467240,$110,蔻驰,COACH,GLOVETAN FOLDOVER CARD CASE 卡包 BP BLACK,http://static.lottedfs.cn/prod/prd-img/84/19/51/00/00/02/20000511984_1.jpg
促销,10290,20000467227,$165,蔻驰,COACH,BORDER RIVETS SMALL ZIP AROUND WALLET B4/BLACK 短款钱包,http://static.lottedfs.cn/prod/prd-img/71/19/51/00/00/02/20000511971_1.JPG
促销,10290,20000467226,$200,蔻驰,COACH,QUILTED LEATHER STRAP 包带 LI ROSE,http://static.lottedfs.cn/prod/prd-img/70/19/51/00/00/02/20000511970_1.jpg
促销,10290,20000467216,$500,蔻驰,COACH,ACADEMY HOLDALL IN CORDURA 公文包 JI BLACK,http://static.lottedfs.cn/prod/prd-img/60/19/51/00/00/02/20000511960_1.jpg
,10290,20000467214,$290,蔻驰,COACH,COLORBLOCK COATED CANVAS SIGNATURE ACCORDION ZIP 长款钱包 B4 TAN CHALK,http://static.lottedfs.cn/prod/prd-img/58/19/51/00/00/02/20000511958_1.jpg
,10290,20000467213,$465,蔻驰,COACH,METROPOLITAN CAMERA BAG IN SIGNATURE 斜挎包 QB CHARCOAL,http://static.lottedfs.cn/prod/prd-img/57/19/51/00/00/02/20000511957_1.jpg
促销 畅销,10290,20000467209,$650,蔻驰,COACH,ACADMY BACKPACK IN SIGNATURE COATED CANVAS 双肩包 KHAKI,http://static.lottedfs.cn/prod/prd-img/53/19/51/00/00/02/20000511953_1.jpg
,10290,20000467205,$750,蔻驰,COACH,BORDER RIVETS MIXED LEATHER DREAMER 36 手提包 B4 BLACK,http://static.lottedfs.cn/prod/prd-img/49/19/51/00/00/02/20000511949_1.jpg
,10290,20000467195,$90,蔻驰,COACH,CROSSGRAIN ZIP CARD CASE 卡包 LI NAVY,http://static.lottedfs.cn/prod/prd-img/39/19/51/00/00/02/20000511939_1.JPG
促销 畅销,10290,20000467194,$90,蔻驰,COACH,CROSSGRAIN ZIP CARD CASE LI/BLACK 卡包,http://static.lottedfs.cn/prod/prd-img/38/19/51/00/00/02/20000511938_1.jpg
畅销,10290,20000467193,$110,蔻驰,COACH,CROSSGRAIN LEATHER SMALL ZIP AROUND WALLET 短款钱包 LI/NAVY,http://static.lottedfs.cn/prod/prd-img/37/19/51/00/00/02/20000511937_1.JPG
促销,10290,20000467180,$500,蔻驰,COACH,SIGNATURE LEATHER DINKY CROSSBODY  斜挎包 OL BEECHWOOD,http://static.lottedfs.cn/prod/prd-img/24/19/51/00/00/02/20000511924_1.jpg
,10290,20000467179,$410,蔻驰,COACH,METROPOLITAN CAMERA BAG IN CORDURA  斜挎包,http://static.lottedfs.cn/prod/prd-img/23/19/51/00/00/02/20000511923_1.jpg
,10290,20000467169,$240,蔻驰,COACH,3 IN 1 WALLET IN CROSSGRAIN BLACK  短款钱包,http://static.lottedfs.cn/prod/prd-img/13/19/51/00/00/02/20000511913_1.jpg
