tag,brand_No,product_No,us_price,brand_name_chn,brand_name_eng,product_name,img_url
乐天专售,1002832,20000603660,$80,MITTE,MITTE,MITTE_TWO TUCK BAGGY PANTS 裤子 BLACK,http://static.lottedfs.cn/prod/prd-img/30/38/73/00/00/02/20000733830_1.jpg
乐天专售,1002832,20000603643,$103,MITTE,MITTE,MITTE_BAGGY BANDING PANTS 裤子 WINE,http://static.lottedfs.cn/prod/prd-img/85/37/73/00/00/02/20000733785_5.jpg
乐天专售,1002832,20000603639,$103,MITTE,MITTE,MITTE_BAGGY BANDING PANTS 裤子 MINT,http://static.lottedfs.cn/prod/prd-img/79/37/73/00/00/02/20000733779_1.jpg
乐天专售,1002832,20000602375,$80,MITTE,MITTE,MITTE_TWO TUCK BAGGY PANTS KHAKI 裤子,http://static.lottedfs.cn/prod/prd-img/35/09/73/00/00/02/20000730935_1.jpg
乐天专售,1002832,20000602371,$58,MITTE,MITTE,MITTE_OVERFIT FLAUNCE T SHIRTS T恤 YELLOW,http://static.lottedfs.cn/prod/prd-img/20/09/73/00/00/02/20000730920_1.jpg
乐天专售,1002832,20000602368,$58,MITTE,MITTE,MITTE_OVERFIT FLAUNCE T SHIRTS T恤 GREEN,http://static.lottedfs.cn/prod/prd-img/14/09/73/00/00/02/20000730914_1.jpg
乐天专售,1002832,20000602367,$66,MITTE,MITTE,MITTE_PEPLUM PINTUCK T SHIRTS T恤 WHITE,http://static.lottedfs.cn/prod/prd-img/10/09/73/00/00/02/20000730910_5.jpg
乐天专售,1002832,20000602364,$66,MITTE,MITTE,MITTE_PEPLUM PINTUCK T SHIRTS T恤 BLACK,http://static.lottedfs.cn/prod/prd-img/01/09/73/00/00/02/20000730901_1.jpg
乐天专售,1002832,20000602360,$66,MITTE,MITTE,MITTE_PLEATS ROOSE FIT T SHIRTS T恤 WHITE,http://static.lottedfs.cn/prod/prd-img/94/08/73/00/00/02/20000730894_1.jpg
乐天专售,1002832,20000602356,$80,MITTE,MITTE,MITTE_SCARF SHIRRING BLOUSE 上衣 LAVENDER,http://static.lottedfs.cn/prod/prd-img/76/08/73/00/00/02/20000730876_1.jpg
乐天专售,1002832,20000602354,$80,MITTE,MITTE,MITTE_SCARF SHIRRING BLOUSE 上衣 BLUE,http://static.lottedfs.cn/prod/prd-img/73/08/73/00/00/02/20000730873_1.jpg
乐天专售,1002832,20000602350,$80,MITTE,MITTE,MITTE_RUFFLE BACK OPEN BLOUSE 上衣 PINK,http://static.lottedfs.cn/prod/prd-img/54/08/73/00/00/02/20000730854_1.jpg
乐天专售,1002832,20000602349,$80,MITTE,MITTE,MITTE_RUFFLE BACK OPEN BLOUSE 上衣 BLUE,http://static.lottedfs.cn/prod/prd-img/52/08/73/00/00/02/20000730852_1.jpg
乐天专售,1002832,20000602346,$80,MITTE,MITTE,MITTE_RUFFLE BACK OPEN BLOUSE 上衣 WHITE,http://static.lottedfs.cn/prod/prd-img/49/08/73/00/00/02/20000730849_1.jpg
乐天专售,1002832,20000602339,$112,MITTE,MITTE,MITTE_SCARF PLEATS TUNIC ONE PIECE 连衣裙 WINE,http://static.lottedfs.cn/prod/prd-img/40/08/73/00/00/02/20000730840_1.jpg
乐天专售,1002832,20000602337,$112,MITTE,MITTE,MITTE_SCARF PLEATS TUNIC ONE PIECE 连衣裙 IVORY,http://static.lottedfs.cn/prod/prd-img/38/08/73/00/00/02/20000730838_1.jpg
乐天专售,1002832,20000602334,$119,MITTE,MITTE,MITTE_LACE BLOCK ONE PIECE 连衣裙 WHITE,http://static.lottedfs.cn/prod/prd-img/29/08/73/00/00/02/20000730829_1.jpg
乐天专售,1002832,20000602330,$136,MITTE,MITTE,MITTE_OVER FIT STRAP OPEN JACKET 外套 IVORY,http://static.lottedfs.cn/prod/prd-img/23/08/73/00/00/02/20000730823_1.jpg
乐天专售,1002832,20000602328,$136,MITTE,MITTE,MITTE_OVER FIT STRAP OPEN JACKET 外套 BEIGE,http://static.lottedfs.cn/prod/prd-img/20/08/73/00/00/02/20000730820_1.jpg
乐天专售,1002832,20000602325,$152,MITTE,MITTE,MITTE_EMBROIDERY DOUBLE JACKET 外套 BLACK,http://static.lottedfs.cn/prod/prd-img/16/08/73/00/00/02/20000730816_1.jpg
乐天专售,1002832,20000602309,$167,MITTE,MITTE,MITTE_STRIPE OVERFIT DOUBLE JACKET 外套 NAVY,http://static.lottedfs.cn/prod/prd-img/77/07/73/00/00/02/20000730777_1.jpg
乐天专售,1002832,20000602306,$167,MITTE,MITTE,MITTE_BACK PLEATS OPEN JACKET 外套 BLACK,http://static.lottedfs.cn/prod/prd-img/70/07/73/00/00/02/20000730770_1.jpg
乐天专售,1002832,20000602304,$182,MITTE,MITTE,MITTE_UNBALANCE BELTED OPEN JACKET 外套 BROWN,http://static.lottedfs.cn/prod/prd-img/68/07/73/00/00/02/20000730768_1.jpg
乐天专售,1002832,20000602301,$190,MITTE,MITTE,MITTE_UNBALANCE BELTED OPEN JACKET 外套 BEIGE,http://static.lottedfs.cn/prod/prd-img/62/07/73/00/00/02/20000730762_1.jpg
乐天专售,1002832,20000602296,$225,MITTE,MITTE,MITTE_WIDE LAPEL DOUBLE TRENCH COAT 外套 DEEPPINK,http://static.lottedfs.cn/prod/prd-img/50/07/73/00/00/02/20000730750_1.jpg
乐天专售,1002832,20000602290,$225,MITTE,MITTE,MITTE_WIDE LAPEL DOUBLE TRENCH COAT 外套 KHAKI,http://static.lottedfs.cn/prod/prd-img/35/07/73/00/00/02/20000730735_1.jpg
乐天专售,1002832,20000602282,$241,MITTE,MITTE,MITTE_ROOSE FIT FLARE TRENCH COAT 外套 CHARCOAL,http://static.lottedfs.cn/prod/prd-img/27/07/73/00/00/02/20000730727_1.jpg
