tag,brand_No,product_No,us_price,brand_name_chn,brand_name_eng,product_name,img_url
赠品,1002326,20000555866,$21,丝翎,SLIMWALK,SLIMWALK LONG STRONG COMPRESSION STOCKINGS FOR NIGHT TIME 夜间压力袜 ML,http://static.lottedfs.cn/prod/prd-img/18/43/65/00/00/02/20000654318_1.jpg
赠品,1002326,20000556077,$25,丝翎,SLIMWALK,SLIM WALK MEDICAL SHORT COMPRESSION STOCKINGS SM 压力短袜,http://static.lottedfs.cn/prod/prd-img/59/47/65/00/00/02/20000654759_1.jpg
赠品,1002326,20000555862,$21,丝翎,SLIMWALK,SLIMWALK LONG STRONG COMPRESSION STOCKINGS FOR NIGHT TIME 夜间压力袜 SM,http://static.lottedfs.cn/prod/prd-img/95/42/65/00/00/02/20000654295_1.jpg
赠品,1002326,20000556073,$25,丝翎,SLIMWALK,SLIMWALK MEDICAL SHORT COMPRESSION STOCKINGS 压力袜 ML,http://static.lottedfs.cn/prod/prd-img/55/47/65/00/00/02/20000654755_1.jpg
赠品,1002326,20000620932,$23,丝翎,SLIMWALK,SLIMWALK SUPER LONG COMPRESSION STOCKINGS FOR NIGHT SM 压力袜（夜间用）,http://static.lottedfs.cn/prod/prd-img/41/32/76/00/00/02/20000763241_1.jpg
免税独家 赠品,1002326,20000556090,$64,丝翎,SLIMWALK,SLIMWALK COOL AIR+SPORTS+MEDICAL ML,http://static.lottedfs.cn/prod/prd-img/13/48/65/00/00/02/20000654813_1.jpg
赠品,1002326,20000556083,$20,丝翎,SLIMWALK,SLIMWALK NIGHT TIME COOL AIR COMPRESSION STOCKINGS 夜间压力袜 SM,http://static.lottedfs.cn/prod/prd-img/73/47/65/00/00/02/20000654773_1.jpg
赠品,1002326,20000556066,$27,丝翎,SLIMWALK,SLIMWALK ALL SEASONS STRETCHING LONG COMPRESSION STOCKINGS 压力袜 SM,http://static.lottedfs.cn/prod/prd-img/40/47/65/00/00/02/20000654740_1.jpg
赠品,1002326,20000555915,$19,丝翎,SLIMWALK,SLIMWALK MOISTURE SHORT COMPRESSION STOCKINGS FOR NIGHT TIME 夜间压力袜 ML,http://static.lottedfs.cn/prod/prd-img/07/44/65/00/00/02/20000654407_1.jpg
赠品,1002326,20000623123,$23,丝翎,SLIMWALK,SLIMWALK NIGHT TIME SUPER LONG COMPRESSION STOCKINGS 夜间压力袜 ML,http://static.lottedfs.cn/prod/prd-img/10/67/76/00/00/02/20000766710_1.jpg
赠品,1002326,20000557647,$22,丝翎,SLIMWALK,SLIMWALK FOR SPORT HIPUP LEGGINGS 运动提臀紧身裤 SM,http://static.lottedfs.cn/prod/prd-img/07/78/65/00/00/02/20000657807_1.jpg
赠品,1002326,20000556080,$20,丝翎,SLIMWALK,SLIMWALK NIGHT TIME COOL AIR COMPRESSION STOCKINGS 夜间压力袜 ML,http://static.lottedfs.cn/prod/prd-img/66/47/65/00/00/02/20000654766_1.jpg
赠品,1002326,20000555903,$19,丝翎,SLIMWALK,SLIMWALK MOISTURE SHORT COMPRESSION STOCKINGS FOR NIGHT TIME 夜间压力袜 SM,http://static.lottedfs.cn/prod/prd-img/80/43/65/00/00/02/20000654380_1.jpg
赠品,1002326,20000555900,$22,丝翎,SLIMWALK,SLIMWALK MOISTURE LONG COMPRESSION STOCKINGS FOR NIGHT TIME 夜间压力袜 ML,http://static.lottedfs.cn/prod/prd-img/77/43/65/00/00/02/20000654377_1.jpg
赠品,1002326,20000555896,$22,丝翎,SLIMWALK,SLIMWALK MOISTURE LONG COMPRESSION STOCKINGS FOR NIGHT TIME 夜间压力袜 SM,http://static.lottedfs.cn/prod/prd-img/73/43/65/00/00/02/20000654373_1.jpg
赠品,1002326,20000555873,$15,丝翎,SLIMWALK,SLIMWALK PELVIS CORRECTING COMPRESSION STOCKINGS 压力袜 BEIGE SM,http://static.lottedfs.cn/prod/prd-img/28/43/65/00/00/02/20000654328_1.jpg
乐天专售 免税独家 赠品,1002326,20000623258,$47,丝翎,SLIMWALK,SLIMWALK MEDICAL SHORT COMPRESSION STOCKINGS 压力袜 MLx2,http://static.lottedfs.cn/prod/prd-img/92/68/76/00/00/02/20000766892_1.jpg
赠品,1002326,20000556084,$22,丝翎,SLIMWALK,SLIMWALK SPORTS HIPUP COMPRESSION LEGGINGS 压力袜 ML,http://static.lottedfs.cn/prod/prd-img/74/47/65/00/00/02/20000654774_1.jpg
赠品,1002326,20000555888,$15,丝翎,SLIMWALK,SLIMWALK PELVIS CORRECTING COMPRESSION STOCKINGS 压力袜 BEIGE ML,http://static.lottedfs.cn/prod/prd-img/56/43/65/00/00/02/20000654356_1.jpg
赠品,1002326,20000555860,$12,丝翎,SLIMWALK,SLIMWALK PATTERNED COMPRESSION PANTY HOSE 压力袜 BLACK ML,http://static.lottedfs.cn/prod/prd-img/93/42/65/00/00/02/20000654293_1.jpg
赠品,1002326,20000555858,$15,丝翎,SLIMWALK,SLIMWALK THERMAL COMPRESSION TIGHTS 压力袜 ML,http://static.lottedfs.cn/prod/prd-img/91/42/65/00/00/02/20000654291_1.jpg
免税独家 赠品,1002326,20000623190,$47,丝翎,SLIMWALK,SLIM WALK MEDICAL SHORT COMPRESSION STOCKINGS 压力袜 SMx2,http://static.lottedfs.cn/prod/prd-img/96/67/76/00/00/02/20000766796_1.jpg
免税独家 赠品,1002326,20000557656,$64,丝翎,SLIMWALK,SLIMWALK COOL AIR+SPORTS+MEDICAL SM,http://static.lottedfs.cn/prod/prd-img/19/78/65/00/00/02/20000657819_1.jpg
免税独家 赠品,1002326,20000557652,$73,丝翎,SLIMWALK,SLIMWALK MOISTURE SHORT COMPRESSION STOCKINGS FOR NIGHT TIME 夜间压力袜 ML*4,http://static.lottedfs.cn/prod/prd-img/15/78/65/00/00/02/20000657815_1.jpg
赠品,1002326,20000555851,$17,丝翎,SLIMWALK,SLIMWALK COMPRESSION LEGGINGS 压力袜 ML,http://static.lottedfs.cn/prod/prd-img/75/42/65/00/00/02/20000654275_1.jpg
赠品,1002326,20000555842,$17,丝翎,SLIMWALK,SLIMWALK COMPRESSION LEGGINGS 压力袜 SM,http://static.lottedfs.cn/prod/prd-img/58/42/65/00/00/02/20000654258_1.jpg
赠品,1002326,20000555586,$12,丝翎,SLIMWALK,SLIMWALK COMPRESSION PATTERNED PANTYHOSE BLACK SM 瘦腿丝袜,http://static.lottedfs.cn/prod/prd-img/78/36/65/00/00/02/20000653678_1.jpg
赠品,1002326,20000555856,$15,丝翎,SLIMWALK,SLIMWALK THERMAL COMPRESSION TIGHTS 压力袜 SM,http://static.lottedfs.cn/prod/prd-img/86/42/65/00/00/02/20000654286_1.jpg
