tag,brand_No,product_No,us_price,brand_name_chn,brand_name_eng,product_name,img_url
,19742,20000613628,$33,SNIFF,SNIFF,BACK ZIP UP PADDING SUIT 宠物狗服饰 MOSS GREEN,http://static.lottedfs.cn/prod/prd-img/78/20/75/00/00/02/20000752078_1.jpg
,19742,20000435531,$9,SNIFF,SNIFF,SNIFF WHITE MUSK DAILY FRAGRANCE,http://static.lottedfs.cn/prod/prd-img/61/49/46/00/00/02/20000464961_2.jpg
,19742,20000604281,$15,SNIFF,SNIFF,STRIPE BOATNECK T SHIRT 宠物服饰 RED,http://static.lottedfs.cn/prod/prd-img/64/51/73/00/00/02/20000735164_1.jpg
,19742,20000543852,$24,SNIFF,SNIFF,SNIFF FROG RAIN COAT 宠物雨衣,http://static.lottedfs.cn/prod/prd-img/03/35/63/00/00/02/20000633503_1.jpg
,19742,20000613630,$33,SNIFF,SNIFF,BACK ZIP UP PADDING SUIT 宠物狗服饰 ORANGE,http://static.lottedfs.cn/prod/prd-img/81/20/75/00/00/02/20000752081_1.jpg
,19742,20000604301,$15,SNIFF,SNIFF,STRIPE BOATNECK T SHIRTS 宠物服饰 GREEN,http://static.lottedfs.cn/prod/prd-img/84/51/73/00/00/02/20000735184_1.jpg
,19742,20000613632,$30,SNIFF,SNIFF,ECO DOWN PADDING VEST 宠物狗服饰 BLUE,http://static.lottedfs.cn/prod/prd-img/86/20/75/00/00/02/20000752086_1.jpg
,19742,20000613626,$33,SNIFF,SNIFF,VELVET ECO DOWN VEST 宠物服饰 YELLOW,http://static.lottedfs.cn/prod/prd-img/75/20/75/00/00/02/20000752075_1.jpg
,19742,20000613623,$33,SNIFF,SNIFF,VELVET ECO DOWN VEST 宠物服饰 LIGHT BLUE,http://static.lottedfs.cn/prod/prd-img/70/20/75/00/00/02/20000752070_1.jpg
,19742,20000613621,$38,SNIFF,SNIFF,CHECK ECO DOWN VEST 宠物服饰 XL,http://static.lottedfs.cn/prod/prd-img/62/20/75/00/00/02/20000752062_1.jpg
,19742,20000613618,$36,SNIFF,SNIFF,CHECK ECO DOWN VEST 宠物服饰,http://static.lottedfs.cn/prod/prd-img/59/20/75/00/00/02/20000752059_1.jpg
,19742,20000605545,$22,SNIFF,SNIFF,PEBBLE BROTHERS RIB ALL IN ONE 宠物服饰 YELLOW,http://static.lottedfs.cn/prod/prd-img/07/74/73/00/00/02/20000737407_1.jpg
,19742,20000604303,$17,SNIFF,SNIFF,STRIPE BOATNECK T SHIRTS 宠物服饰 GREEN XL,http://static.lottedfs.cn/prod/prd-img/88/51/73/00/00/02/20000735188_1.jpg
,19742,20000543854,$25,SNIFF,SNIFF,SNIFF FROG RAIN COAT 宠物雨衣 XL,http://static.lottedfs.cn/prod/prd-img/07/35/63/00/00/02/20000633507_1.jpg
,19742,20000543711,$19,SNIFF,SNIFF,SNIFF SAILOR COLLAR ONE PIECE 宠物服饰,http://static.lottedfs.cn/prod/prd-img/61/32/63/00/00/02/20000633261_1.jpg
,19742,20000616017,$31,SNIFF,SNIFF,ECO DOWN PADDED VEST 宠物服饰 GREEN XL,http://static.lottedfs.cn/prod/prd-img/28/65/75/00/00/02/20000756528_1.jpg
,19742,20000613629,$35,SNIFF,SNIFF,BACK ZIP UP PADDING SUIT 宠物狗服饰 MOSS GREEN XL,http://static.lottedfs.cn/prod/prd-img/80/20/75/00/00/02/20000752080_1.jpg
,19742,20000605477,$22,SNIFF,SNIFF,PEBBLE BROTHERS RIB ALL IN ONE 宠物服饰 BLUE,http://static.lottedfs.cn/prod/prd-img/08/72/73/00/00/02/20000737208_1.jpg
,19742,20000605476,$23,SNIFF,SNIFF,PEBBLE BROTHERS RIB ALL IN ONE 宠物服饰 RED XL,http://static.lottedfs.cn/prod/prd-img/06/72/73/00/00/02/20000737206_1.jpg
,19742,20000605447,$25,SNIFF,SNIFF,WARM UP RUNNING JACKET 宠物服饰,http://static.lottedfs.cn/prod/prd-img/24/71/73/00/00/02/20000737124_1.jpg
,19742,20000604366,$20,SNIFF,SNIFF,NEON VELOUR HOODED T SHIRT 宠物服饰 PINK,http://static.lottedfs.cn/prod/prd-img/84/52/73/00/00/02/20000735284_1.jpg
,19742,20000604332,$27,SNIFF,SNIFF,EXTREME WARM SUIT 宠物服饰 SMALL SIZE,http://static.lottedfs.cn/prod/prd-img/38/52/73/00/00/02/20000735238_1.jpg
,19742,20000555477,$19,SNIFF,SNIFF,SNIFF BOTANICAL PRINT SHIRT RED XL 宠物服饰,http://static.lottedfs.cn/prod/prd-img/65/34/65/00/00/02/20000653465_1.jpg
,19742,20000555468,$17,SNIFF,SNIFF,SNIFF BOTANICAL PRINT SHIRT YELLOW 宠物服饰,http://static.lottedfs.cn/prod/prd-img/54/34/65/00/00/02/20000653454_1.jpg
,19742,20000555466,$19,SNIFF,SNIFF,SNIFF TIGER PRINT SHIRT XL 宠物服饰,http://static.lottedfs.cn/prod/prd-img/49/34/65/00/00/02/20000653449_1.jpg
,19742,20000543828,$19,SNIFF,SNIFF,SNIFF FLORAL ROMPER 宠物服饰 PINK,http://static.lottedfs.cn/prod/prd-img/66/34/63/00/00/02/20000633466_1.jpg
,19742,20000616013,$30,SNIFF,SNIFF,ECO DOWN PADDED VEST 宠物服饰 GREEN,http://static.lottedfs.cn/prod/prd-img/23/65/75/00/00/02/20000756523_1.jpg
,19742,20000613633,$31,SNIFF,SNIFF,ECO DOWN PADDING VEST 宠物狗服饰 BLUE XL,http://static.lottedfs.cn/prod/prd-img/88/20/75/00/00/02/20000752088_1.jpg
,19742,20000613631,$35,SNIFF,SNIFF,BACK ZIP UP PADDING SUIT 宠物狗服饰 ORANGE XL,http://static.lottedfs.cn/prod/prd-img/84/20/75/00/00/02/20000752084_1.jpg
,19742,20000613627,$35,SNIFF,SNIFF,VELVET ECO DOWN PADDING VEST 宠物狗服饰 YELLOW XL,http://static.lottedfs.cn/prod/prd-img/76/20/75/00/00/02/20000752076_1.jpg
,19742,20000613625,$35,SNIFF,SNIFF,VELVET ECO DOWN VEST 宠物服饰 LIGHT BLUE XL,http://static.lottedfs.cn/prod/prd-img/72/20/75/00/00/02/20000752072_1.jpg
,19742,20000605577,$61,SNIFF,SNIFF,URBAN UTILITY COVERALLS 宠物服饰 KHAKI M,http://static.lottedfs.cn/prod/prd-img/05/75/73/00/00/02/20000737505_1.jpg
,19742,20000605575,$56,SNIFF,SNIFF,URBAN UTILITY COVERALLS 宠物服饰 KHAKI S,http://static.lottedfs.cn/prod/prd-img/02/75/73/00/00/02/20000737502_1.jpg
,19742,20000605574,$61,SNIFF,SNIFF,URBAN UTILITY COVERALLS 宠物服饰 BEIGE M,http://static.lottedfs.cn/prod/prd-img/00/75/73/00/00/02/20000737500_1.jpg
,19742,20000605569,$56,SNIFF,SNIFF,URBAN UTILITY COVERALLS 宠物服饰 BEIGE S,http://static.lottedfs.cn/prod/prd-img/76/74/73/00/00/02/20000737476_1.jpg
,19742,20000605567,$23,SNIFF,SNIFF,PEBBLE BROTHERS RIB ALL IN ONE 宠物服饰 YELLOW XL,http://static.lottedfs.cn/prod/prd-img/73/74/73/00/00/02/20000737473_1.jpg
,19742,20000605480,$23,SNIFF,SNIFF,PEBBLE BROTHERS RIB ALL IN ONE 宠物服饰 BLUE XL,http://static.lottedfs.cn/prod/prd-img/15/72/73/00/00/02/20000737215_1.jpg
,19742,20000605458,$22,SNIFF,SNIFF,PEBBLE BROTHERS RIB ALL IN ONE 宠物服饰 RED,http://static.lottedfs.cn/prod/prd-img/63/71/73/00/00/02/20000737163_1.jpg
,19742,20000605452,$26,SNIFF,SNIFF,WARM UP RUNNING JACKET 宠物服饰 BLACK,http://static.lottedfs.cn/prod/prd-img/37/71/73/00/00/02/20000737137_1.jpg
,19742,20000604369,$22,SNIFF,SNIFF,NEON VELOUR HOODED T SHIRT 宠物服饰 PINK XL,http://static.lottedfs.cn/prod/prd-img/89/52/73/00/00/02/20000735289_1.jpg
,19742,20000604362,$22,SNIFF,SNIFF,NEON VELOUR HOODED T SHIRT 宠物服饰 YELLOW XL,http://static.lottedfs.cn/prod/prd-img/80/52/73/00/00/02/20000735280_1.jpg
,19742,20000604344,$22,SNIFF,SNIFF,NEON VELOUR HOODED T SHIRT 宠物服饰 APPLE GREEN XL,http://static.lottedfs.cn/prod/prd-img/55/52/73/00/00/02/20000735255_1.jpg
,19742,20000604341,$20,SNIFF,SNIFF,NEON VELOUR HOODED T SHIRT 宠物服饰 APPLE GREEN,http://static.lottedfs.cn/prod/prd-img/52/52/73/00/00/02/20000735252_1.jpg
,19742,20000604336,$30,SNIFF,SNIFF,EXTREME WARM SUIT 宠物服饰 MEDIUM SIZE,http://static.lottedfs.cn/prod/prd-img/45/52/73/00/00/02/20000735245_1.jpg
,19742,20000604307,$25,SNIFF,SNIFF,EXTREME WARM T SHIRT MEDIUM SIZE 宠物服饰,http://static.lottedfs.cn/prod/prd-img/94/51/73/00/00/02/20000735194_1.jpg
,19742,20000604306,$23,SNIFF,SNIFF,EXTREME WARM T SHIRT SMALL SIZE 宠物服饰,http://static.lottedfs.cn/prod/prd-img/92/51/73/00/00/02/20000735192_1.jpg
,19742,20000604294,$17,SNIFF,SNIFF,STRIPE BOATNECK T SHIRT 宠物服饰 RED XL,http://static.lottedfs.cn/prod/prd-img/77/51/73/00/00/02/20000735177_1.jpg
,19742,20000555472,$17,SNIFF,SNIFF,SNIFF BOTANICAL PRINT SHIRT RED 宠物服饰,http://static.lottedfs.cn/prod/prd-img/60/34/65/00/00/02/20000653460_1.jpg
,19742,20000555459,$17,SNIFF,SNIFF,SNIFF TIGER PRINT SHIRT 宠物服饰,http://static.lottedfs.cn/prod/prd-img/29/34/65/00/00/02/20000653429_1.jpg
,19742,20000543850,$21,SNIFF,SNIFF,SNIFF FLORAL ROMPER 宠物服饰 GREEN XL,http://static.lottedfs.cn/prod/prd-img/98/34/63/00/00/02/20000633498_1.jpg
,19742,20000543845,$19,SNIFF,SNIFF,SNIFF FLORAL ROMPER 宠物服饰 GREEN,http://static.lottedfs.cn/prod/prd-img/93/34/63/00/00/02/20000633493_1.jpg
,19742,20000543840,$21,SNIFF,SNIFF,SNIFF FLORAL ROMPER 宠物服饰 PINK XL,http://static.lottedfs.cn/prod/prd-img/85/34/63/00/00/02/20000633485_1.jpg
,19742,20000543715,$20,SNIFF,SNIFF,SNIFF SAILOR COLLAR ONE PIECE 宠物服饰 XL,http://static.lottedfs.cn/prod/prd-img/67/32/63/00/00/02/20000633267_1.jpg
,19742,20000436298,$11,SNIFF,SNIFF,SNIFF WHITE MUSK CONDITIONING SHAMPOO  宠物用洗发水,http://static.lottedfs.cn/prod/prd-img/49/62/46/00/00/02/20000466249_2.jpg
,19742,20000435527,$20,SNIFF,SNIFF,LINEN OVERALLS NAVY 宠物服饰,http://static.lottedfs.cn/prod/prd-img/56/49/46/00/00/02/20000464956_2.jpg
,19742,20000435525,$20,SNIFF,SNIFF,LINEN OVERALLS RED 宠物服饰,http://static.lottedfs.cn/prod/prd-img/52/49/46/00/00/02/20000464952_2.jpg
,19742,20000373292,$34,SNIFF,SNIFF,BITTER BOY COTTON SLING BAG STRIPE S 宠物服饰,http://static.lottedfs.cn/prod/prd-img/53/45/38/00/00/02/20000384553_2.jpg
,19742,20000370548,$34,SNIFF,SNIFF,BITTER BOY COTTON SLING BAG GRAY S 宠物包,http://static.lottedfs.cn/prod/prd-img/39/11/38/00/00/02/20000381139_2.jpg
,19742,20000604357,$20,SNIFF,SNIFF,NEON VELOUR HOODED T SHIRT 宠物服饰 YELLOW,http://static.lottedfs.cn/prod/prd-img/71/52/73/00/00/02/20000735271_1.jpg
