tag,brand_No,product_No,us_price,brand_name_chn,brand_name_eng,product_name,img_url
畅销,17328,10002044843,$22,自然乐园,NATURE REPUBLIC,REAL NATURE MASK SHEET RANDOMLY SHIPPED 30片+30片 随机发送,http://static.lottedfs.cn/prod/prd-img/43/48/04/02/00/01/10002044843_4.JPG
畅销,17328,10002176287,$7,自然乐园,NATURE REPUBLIC,ARGAN ESSENTIAL DEEP CARE HAIR PACK  发膜 200ml,http://static.lottedfs.cn/prod/prd-img/87/62/17/02/00/01/10002176287_4.jpg
畅销,17328,10001407393,$10,自然乐园,NATURE REPUBLIC,芦荟舒缓保湿凝胶 300ml*3,http://static.lottedfs.cn/prod/prd-img/93/73/40/01/00/01/10001407393_07.jpg
免税独家,17328,20000620948,$10,自然乐园,NATURE REPUBLIC,SUPER AQUA MAX COMBINATION WATERY CREAM 面霜 (混合性用),http://static.lottedfs.cn/prod/prd-img/76/32/76/00/00/02/20000763276_1.jpg
,17328,20000526147,$9,自然乐园,NATURE REPUBLIC,ARGAN ESSENTIAL DEEP CARE HAIR ESSENCE 护发精华,http://static.lottedfs.cn/prod/prd-img/52/25/60/00/00/02/20000602552_1.jpg
免税独家,17328,20000620944,$10,自然乐园,NATURE REPUBLIC,SUPER AQUA MAX MOISTURE WATERY CREAM 面霜 (干性用),http://static.lottedfs.cn/prod/prd-img/65/32/76/00/00/02/20000763265_1.jpg
,17328,10002124896,$11,自然乐园,NATURE REPUBLIC,SUPER AQUA MAX WATERY EMULSION 乳液 150ml,http://static.lottedfs.cn/prod/prd-img/96/48/12/02/00/01/10002124896_01.jpg
畅销,17328,20000553003,$12,自然乐园,NATURE REPUBLIC,BLACK BEAN ANTI HAIR LOSS SHAMPOO 洗发水,http://static.lottedfs.cn/prod/prd-img/09/90/64/00/00/02/20000649009_1.jpg
畅销,17328,10001995935,$13,自然乐园,NATURE REPUBLIC,SOOTHING&MOISTURE ALOE VERA 92 SOOTHING GEL MIST  芦荟喷雾 3个 150ml,http://static.lottedfs.cn/prod/prd-img/35/59/99/01/00/01/10001995935_01.jpg
畅销,17328,20000605626,$68,自然乐园,NATURE REPUBLIC,GINSENG ROYAL SILK 24K GOLD AMPOULE AND WATERY CREAM PROMOTION SET 安瓶面霜套装,http://static.lottedfs.cn/prod/prd-img/78/76/73/00/00/02/20000737678_1.jpg
畅销,17328,10001874402,$15,自然乐园,NATURE REPUBLIC,HAND AND NATURE HAND CREAM 护手霜 3+3,http://static.lottedfs.cn/prod/prd-img/02/44/87/01/00/01/10001874402_1.jpg
,17328,20000539775,$9,自然乐园,NATURE REPUBLIC,REAL COMFORTING MASK SHEET_HYALURONIC ACID 面膜 10+10,http://static.lottedfs.cn/prod/prd-img/88/67/62/00/00/02/20000626788_1.jpg
畅销,17328,10002176092,$11,自然乐园,NATURE REPUBLIC,FOREST GARDEN CHAMOMILE CLEANSING OIL 卸妆油 200ml,http://static.lottedfs.cn/prod/prd-img/92/60/17/02/00/01/10002176092_03.jpg
,17328,20000539779,$9,自然乐园,NATURE REPUBLIC,REAL COMFORTING MASK SHEET_VITAMIN C 面膜 10+10,http://static.lottedfs.cn/prod/prd-img/98/67/62/00/00/02/20000626798_1.jpg
免税独家,17328,20000620950,$10,自然乐园,NATURE REPUBLIC,SUPER AQUA MAX FRESH WATERY CREAM 面霜 (油性用),http://static.lottedfs.cn/prod/prd-img/78/32/76/00/00/02/20000763278_1.jpg
,17328,20000390638,$8,自然乐园,NATURE REPUBLIC,MOIST ANGEL LIP BALM 润唇膏 01 PEACH TINT BALM,http://static.lottedfs.cn/prod/prd-img/00/60/40/00/00/02/20000406000_1.jpg
畅销,17328,10001796695,$10,自然乐园,NATURE REPUBLIC,SOOTHING&MOISTURE ALOE VERA CLEANSING GEL FOAM  洁面乳 150ml 3个,http://static.lottedfs.cn/prod/prd-img/95/66/79/01/00/01/10001796695_01.jpg
,17328,20000526781,$6,自然乐园,NATURE REPUBLIC,SNAIL SOLUTION MASK SHEET 面膜 (10片),http://static.lottedfs.cn/prod/prd-img/83/33/60/00/00/02/20000603383_1.jpg
,17328,20000526746,$17,自然乐园,NATURE REPUBLIC,SUPER AQUA MAX EX WATERY CREAM 面霜,http://static.lottedfs.cn/prod/prd-img/25/33/60/00/00/02/20000603325_1.jpg
,17328,20000539795,$9,自然乐园,NATURE REPUBLIC,REAL COMFORTING MASK SHEET_COLLAGEN 面膜 10+10,http://static.lottedfs.cn/prod/prd-img/23/68/62/00/00/02/20000626823_1.jpg
,17328,20000468161,$12,自然乐园,NATURE REPUBLIC,CALIFORNIA ALOE DAILY SUN BLOCK SPF50+PA++++ DR  防晒霜 1+1,http://static.lottedfs.cn/prod/prd-img/43/36/51/00/00/02/20000513643_1.jpg
,17328,20000391273,$26,自然乐园,NATURE REPUBLIC,SNAIL SOLUTION CREAM 蜗牛面霜,http://static.lottedfs.cn/prod/prd-img/35/66/40/00/00/02/20000406635_1.jpg
,17328,20000390727,$9,自然乐园,NATURE REPUBLIC,REAL SQUEEZE ALOE VERA AIR MIST 喷雾,http://static.lottedfs.cn/prod/prd-img/89/60/40/00/00/02/20000406089_1.jpg
,17328,10002276965,$8,自然乐园,NATURE REPUBLIC,BOTANICAL HYPER LINER 眼线液笔,http://static.lottedfs.cn/prod/prd-img/65/69/27/02/00/01/10002276965_01.jpg
,17328,10001738230,$20,自然乐园,NATURE REPUBLIC,SOOTHING AND MOISTURE ALOE VERA 92 SOOTHING GEL 芦荟舒缓保湿凝胶 300ml 6EA,http://static.lottedfs.cn/prod/prd-img/30/82/73/01/00/01/10001738230_01.jpg
,17328,20000612640,$8,自然乐园,NATURE REPUBLIC,BY FLOWER AUTO EYE BROW 眉笔 03 ASH MOCHA 3支,http://static.lottedfs.cn/prod/prd-img/69/99/74/00/00/02/20000749969_1.jpg
,17328,10002086362,$13,自然乐园,NATURE REPUBLIC,SOOTHING&MOISTURE ALOE VERA 90 TONER 化妆水 2个 160ml,http://static.lottedfs.cn/prod/prd-img/62/63/08/02/00/01/10002086362_01.jpg
免税独家,17328,20000614307,$110,自然乐园,NATURE REPUBLIC,[免稅专售] GINSENG ROYAL SILK 3 PIECES SET + GINSENG ROYAL SILK 24K GOLD AMPOULE 护肤3件套+24K安瓶,http://static.lottedfs.cn/prod/prd-img/80/33/75/00/00/02/20000753380_1.jpg
畅销,17328,20000558143,$15,自然乐园,NATURE REPUBLIC,CALIFORNIA ALOE FRESH POWDERY SUN STICK 防晒棒 SPF50+PA++++,http://static.lottedfs.cn/prod/prd-img/48/86/65/00/00/02/20000658648_1.jpg
,17328,10002188375,$8,自然乐园,NATURE REPUBLIC,CALIFORNIA ALOE VERA COOLING EYE SERUM 眼部精华 15ml,http://static.lottedfs.cn/prod/prd-img/75/83/18/02/00/01/10002188375_01.jpg
,17328,10002127277,$19,自然乐园,NATURE REPUBLIC,AFRICA BIRD ALL IN ONE FRESH CONTROLLER  150ml,http://static.lottedfs.cn/prod/prd-img/77/72/12/02/00/01/10002127277_01.jpg
,17328,10002086363,$14,自然乐园,NATURE REPUBLIC,SOOTHING&MOISTURE ALOE VERA SKINCARE SET   基础2件套装,http://static.lottedfs.cn/prod/prd-img/63/63/08/02/00/01/10002086363_04.jpg
,17328,10002086360,$13,自然乐园,NATURE REPUBLIC,SOOTHING&MOISTURE ALOE VERA 80 EMULSION 乳液 160ml 2个,http://static.lottedfs.cn/prod/prd-img/60/63/08/02/00/01/10002086360_01.jpg
免税独家 新品,17328,20000637345,$15,自然乐园,NATURE REPUBLIC,[免税专享] SOOTHING GEL MASK SHEET 面膜 10+10,http://static.lottedfs.cn/prod/prd-img/85/68/78/00/00/02/20000786885_1.jpg
免税独家,17328,20000573705,$15,自然乐园,NATURE REPUBLIC,[DUTY FREE EXCLUSIVE] SNAIL SOLUTION FOAM CLEANSER TRIO SET 洗面奶,http://static.lottedfs.cn/prod/prd-img/19/07/68/00/00/02/20000680719_1.jpg
畅销,17328,20000526643,$9,自然乐园,NATURE REPUBLIC,ARGAN ESSENTIAL DEEP CARE SHAMPOO 洗发水,http://static.lottedfs.cn/prod/prd-img/14/32/60/00/00/02/20000603214_1.jpg
,17328,10001890814,$12,自然乐园,NATURE REPUBLIC,SHEA BUTTER STEAM CREAM 面霜 MOIST 100ml,http://static.lottedfs.cn/prod/prd-img/14/08/89/01/00/01/10001890814_4.jpg
,17328,20000539787,$9,自然乐园,NATURE REPUBLIC,REAL COMFORTING MASK SHEET_PANTHENOL 面膜 10+10,http://static.lottedfs.cn/prod/prd-img/12/68/62/00/00/02/20000626812_1.jpg
,17328,20000468133,$12,自然乐园,NATURE REPUBLIC,CALIFORNIA ALOE PERFECT SUN BLOCK SPF50+PA++++ 防晒霜 150ml,http://static.lottedfs.cn/prod/prd-img/98/35/51/00/00/02/20000513598_1.jpg
畅销,17328,10002127275,$19,自然乐园,NATURE REPUBLIC,AFRICA BIRD ALL IN ONE MOISTURIZER  150ml,http://static.lottedfs.cn/prod/prd-img/75/72/12/02/00/01/10002127275_01.jpg
,17328,10001871923,$19,自然乐园,NATURE REPUBLIC,蜗牛保湿弹力BB霜 SPF30 PA++ 40ml,http://static.lottedfs.cn/prod/prd-img/23/19/87/01/00/01/10001871923_01.jpg
,17328,20000553004,$10,自然乐园,NATURE REPUBLIC,BLACK BEAN ANTI HAIR LOSS TREATMENT,http://static.lottedfs.cn/prod/prd-img/10/90/64/00/00/02/20000649010_1.jpg
,17328,20000390640,$8,自然乐园,NATURE REPUBLIC,MOIST ANGEL LIP BALM 润唇膏 03 ORANGE TINT BALM,http://static.lottedfs.cn/prod/prd-img/02/60/40/00/00/02/20000406002_1.jpg
,17328,20000390377,$7,自然乐园,NATURE REPUBLIC,SUPER AQUA MAX SOFT PEELING GEL 去角质凝胶,http://static.lottedfs.cn/prod/prd-img/39/57/40/00/00/02/20000405739_1.jpg
,17328,10001890822,$12,自然乐园,NATURE REPUBLIC,SHEA BUTTER STEAM CREAM 面霜 ULTRA 100ml,http://static.lottedfs.cn/prod/prd-img/22/08/89/01/00/01/10001890822_4.jpg
,17328,20000539785,$9,自然乐园,NATURE REPUBLIC,REAL COMFORTING MASK SHEET_TEA TREE 面膜 10+10,http://static.lottedfs.cn/prod/prd-img/10/68/62/00/00/02/20000626810_1.jpg
,17328,10002151232,$12,自然乐园,NATURE REPUBLIC,JEJU SPARKLING CLEANSING WATER 卸妆水,http://static.lottedfs.cn/prod/prd-img/32/12/15/02/00/01/10002151232_5.jpg
畅销,17328,10001838285,$10,自然乐园,NATURE REPUBLIC,SOOTHING AND MOISTURE ALOE VERA FOAM CLEANSER 洁面乳 150ml*3,http://static.lottedfs.cn/prod/prd-img/85/82/83/01/00/01/10001838285_03.jpg
,17328,20000612376,$8,自然乐园,NATURE REPUBLIC,BY FLOWER AUTO EYE BROW 眉笔 02 PECAN BROWN 3支,http://static.lottedfs.cn/prod/prd-img/61/94/74/00/00/02/20000749461_1.jpg
,17328,20000592281,$31,自然乐园,NATURE REPUBLIC,SUPAER AQUA MAS WATERY 3 PIECES PROMOTION SET 基础护肤套装,http://static.lottedfs.cn/prod/prd-img/13/05/71/00/00/02/20000710513_1.jpg
,17328,20000526644,$9,自然乐园,NATURE REPUBLIC,ARGAN ESSENTIAL DEEP CARE CONDITIONER 护发素,http://static.lottedfs.cn/prod/prd-img/15/32/60/00/00/02/20000603215_1.jpg
,17328,20000391016,$15,自然乐园,NATURE REPUBLIC,GINSENG ROYAL SILK FOAM CLEANSER 洁面乳,http://static.lottedfs.cn/prod/prd-img/78/63/40/00/00/02/20000406378_1.jpg
,17328,20000390422,$12,自然乐园,NATURE REPUBLIC,NATURE ORIGIN COLLAGEN BB CREAM BB霜 02 NATURAL BEIGE SPF25PA++,http://static.lottedfs.cn/prod/prd-img/84/57/40/00/00/02/20000405784_1.jpg
,17328,20000390250,$12,自然乐园,NATURE REPUBLIC,SUPER AQUA MAX WATERY ESSENCE 精华,http://static.lottedfs.cn/prod/prd-img/12/56/40/00/00/02/20000405612_1.jpg
畅销,17328,10002179954,$14,自然乐园,NATURE REPUBLIC,CALIFORNIA ALOE VERA HANDCREAM 护手霜 50ml*3,http://static.lottedfs.cn/prod/prd-img/54/99/17/02/00/01/10002179954_02.jpg
畅销,17328,10001410717,$27,自然乐园,NATURE REPUBLIC,自然乐园营养滋润足膜 (10片) 13g*10片,http://static.lottedfs.cn/prod/prd-img/17/07/41/01/00/01/10001410717_04.jpg
,17328,20000612641,$8,自然乐园,NATURE REPUBLIC,BY FLOWER AUTO EYEBROW 眉笔 04 MOON GRAY 3支,http://static.lottedfs.cn/prod/prd-img/70/99/74/00/00/02/20000749970_1.jpg
免税独家,17328,20000555155,$22,自然乐园,NATURE REPUBLIC,[免税专售] ALL DAY COLOR MATTE LIP STICK KIT EDITION 口红套装,http://static.lottedfs.cn/prod/prd-img/67/29/65/00/00/02/20000652967_1.jpg
免税独家,17328,20000555145,$5,自然乐园,NATURE REPUBLIC,[免税专售] (MINI) PROVENCE INTENSIVE AMPLE FOUNDATION 迷你粉底液 P21 ROSY VANILLA,http://static.lottedfs.cn/prod/prd-img/52/29/65/00/00/02/20000652952_1.jpg
,17328,20000553007,$6,自然乐园,NATURE REPUBLIC,BY FLOWER BLUSHER 腮红 03 GRAPEFRUIT COTTON CANDY,http://static.lottedfs.cn/prod/prd-img/13/90/64/00/00/02/20000649013_1.jpg
,17328,20000553005,$6,自然乐园,NATURE REPUBLIC,BY FLOWER BLUSHER 腮红 01 DEAR PINK,http://static.lottedfs.cn/prod/prd-img/11/90/64/00/00/02/20000649011_1.jpg
,17328,20000468238,$12,自然乐园,NATURE REPUBLIC,CALIFORNIA ALOE WATERPROOF SUN BLOCK SPF50+ PA++++ DR 防晒霜 60ml,http://static.lottedfs.cn/prod/prd-img/68/38/51/00/00/02/20000513868_1.jpg
,17328,20000390639,$8,自然乐园,NATURE REPUBLIC,MOIST ANGEL LIP BALM 润唇膏 02 CRANBERRY TINT BALM,http://static.lottedfs.cn/prod/prd-img/01/60/40/00/00/02/20000406001_1.jpg
,17328,10002197483,$51,自然乐园,NATURE REPUBLIC,GINSENG ROYAL SILK EYE CREAM 眼霜 25ml,http://static.lottedfs.cn/prod/prd-img/83/74/19/02/00/01/10002197483_01.jpg
,17328,10002194791,$19,自然乐园,NATURE REPUBLIC,COLLAGEN DREAM 70 CREAM 面霜 50ml,http://static.lottedfs.cn/prod/prd-img/91/47/19/02/00/01/10002194791_01.jpg
,17328,10002153481,$8,自然乐园,NATURE REPUBLIC,REAL SQUEEZE ALOE VERA SLEEPING PACK 睡眠面膜 160ml,http://static.lottedfs.cn/prod/prd-img/81/34/15/02/00/01/10002153481_01.jpg
,17328,10002077790,$25,自然乐园,NATURE REPUBLIC,SNAIL SOLUTION EYE CREAM 眼霜 30ml,http://static.lottedfs.cn/prod/prd-img/90/77/07/02/00/01/10002077790_04.jpg
,17328,10001890821,$12,自然乐园,NATURE REPUBLIC,SHEA BUTTER STEAM CREAM 面霜 FRESH 100ml,http://static.lottedfs.cn/prod/prd-img/21/08/89/01/00/01/10001890821_4.jpg
,17328,10001407385,$8,自然乐园,NATURE REPUBLIC,COLLAGEN VITAMIN C CAPSULE FOAM CLEANSER  自然乐园 胶原蛋白VC颗粒洗面乳,http://static.lottedfs.cn/prod/prd-img/85/73/40/01/00/01/10001407385_06.jpg
畅销,17328,20000487650,$18,自然乐园,NATURE REPUBLIC,[DUTY FREE EXCLUSIVE]ALL DAY COLOR VELVET LIP PENCIL KIT 口红套装,http://static.lottedfs.cn/prod/prd-img/57/40/54/00/00/02/20000544057_1.jpg
,17328,20000407440,$19,自然乐园,NATURE REPUBLIC,CELL POWER EMULSION 乳液,http://static.lottedfs.cn/prod/prd-img/77/47/42/00/00/02/20000424777_1.jpg
,17328,20000407439,$19,自然乐园,NATURE REPUBLIC,CELL POWER ESSENTIAL SKIN 护肤水,http://static.lottedfs.cn/prod/prd-img/76/47/42/00/00/02/20000424776_1.jpg
,17328,20000390421,$12,自然乐园,NATURE REPUBLIC,NATURE ORIGIN COLLAGEN BB CREAM BB霜 01 LIGHT BEIGE SPF25PA++,http://static.lottedfs.cn/prod/prd-img/83/57/40/00/00/02/20000405783_1.jpg
,17328,10003108038,$110,自然乐园,NATURE REPUBLIC,[DUTY FREE EXCLUSIVE] GINSENG ROYAL SILK 3 PIECES PROMOTION SET 基础护肤三件套,http://static.lottedfs.cn/prod/prd-img/38/80/10/03/00/01/10003108038_01.jpg
,17328,10002188373,$15,自然乐园,NATURE REPUBLIC,BLACKHEAD CLEAR 3 STEP NOSE PACK 鼻部面膜,http://static.lottedfs.cn/prod/prd-img/73/83/18/02/00/01/10002188373_01.jpg
,17328,10002153479,$13,自然乐园,NATURE REPUBLIC,REAL SQUEEZE ALOE VERA ESSENCE 芦荟精华素 50ml,http://static.lottedfs.cn/prod/prd-img/79/34/15/02/00/01/10002153479_01.jpg
,17328,10002153475,$12,自然乐园,NATURE REPUBLIC,REAL SQUEEZE ALOE VERA EMULSION 芦荟乳液 150ml,http://static.lottedfs.cn/prod/prd-img/75/34/15/02/00/01/10002153475_01.jpg
,17328,10002099185,$25,自然乐园,NATURE REPUBLIC,SNAIL SOLUTION ESSENCE 精华素 40ml,http://static.lottedfs.cn/prod/prd-img/85/91/09/02/00/01/10002099185_01.jpg
,17328,10002077789,$19,自然乐园,NATURE REPUBLIC,SNAIL SOLUTION SKIN BOOSTER  120ml,http://static.lottedfs.cn/prod/prd-img/89/77/07/02/00/01/10002077789_01.jpg
,17328,10001942565,$17,自然乐园,NATURE REPUBLIC,SNAIL SOLUTION MASK 面膜 套装 20g*30,http://static.lottedfs.cn/prod/prd-img/65/25/94/01/00/01/10001942565_01.jpg
畅销,17328,10001407395,$23,自然乐园,NATURE REPUBLIC,HAND & NATURE MOISTURE HAND MASK  手膜10片,http://static.lottedfs.cn/prod/prd-img/95/73/40/01/00/01/10001407395_04.jpg
,17328,20000612644,$8,自然乐园,NATURE REPUBLIC,BY FLOWER AUTO EYE BROW 眉笔 01 ALMOND BROWN 3支,http://static.lottedfs.cn/prod/prd-img/75/99/74/00/00/02/20000749975_1.jpg
,17328,20000587738,$64,自然乐园,NATURE REPUBLIC,SNAIL SOLUTION 3 PIECES PROMOTION SET 护肤3件企划套装,http://static.lottedfs.cn/prod/prd-img/38/30/70/00/00/02/20000703038_1.jpg
免税独家,17328,20000573708,$31,自然乐园,NATURE REPUBLIC,[DUTY FREE EXCLUSIVE] SNAIL SOLUTION FOAM CLEANSER TRIO SET 洗面奶 2+1,http://static.lottedfs.cn/prod/prd-img/26/07/68/00/00/02/20000680726_1.jpg
,17328,20000528503,$8,自然乐园,NATURE REPUBLIC,BAMBOO CHARCOAL NOSE AND T ZONE PACK 鼻头贴,http://static.lottedfs.cn/prod/prd-img/07/55/60/00/00/02/20000605507_1.jpg
,17328,20000526148,$7,自然乐园,NATURE REPUBLIC,SOOTHING AND MOISTURE ALOE VERA ICE SOOTHING GEL 喷雾,http://static.lottedfs.cn/prod/prd-img/53/25/60/00/00/02/20000602553_1.jpg
,17328,20000512207,$29,自然乐园,NATURE REPUBLIC,HYA INTENSE ROSE AMPOULE SERUM 安瓶精华 50ml,http://static.lottedfs.cn/prod/prd-img/62/27/58/00/00/02/20000582762_1.jpg
,17328,20000468167,$27,自然乐园,NATURE REPUBLIC,CELL POWER EYE CREAM 眼霜 30ml,http://static.lottedfs.cn/prod/prd-img/53/36/51/00/00/02/20000513653_2.jpg
,17328,20000407438,$9,自然乐园,NATURE REPUBLIC,HERB BLENDING MIST 喷雾,http://static.lottedfs.cn/prod/prd-img/75/47/42/00/00/02/20000424775_1.jpg
,17328,20000390431,$43,自然乐园,NATURE REPUBLIC,GINSENG ROYAL SILK ESSENCE 精华,http://static.lottedfs.cn/prod/prd-img/93/57/40/00/00/02/20000405793_1.jpg
,17328,20000390208,$70,自然乐园,NATURE REPUBLIC,AQUA COLLAGEN SOLUTION MARINE HYDROGEL MASK 面膜,http://static.lottedfs.cn/prod/prd-img/70/55/40/00/00/02/20000405570_2.jpg
,17328,10002194796,$11,自然乐园,NATURE REPUBLIC,NATURE ORIGIN CC BLUR CC霜 45g,http://static.lottedfs.cn/prod/prd-img/96/47/19/02/00/01/10002194796_01.jpg
,17328,10002194795,$16,自然乐园,NATURE REPUBLIC,COLLAGEN DREAM 70 EMULSION 乳液 150ml,http://static.lottedfs.cn/prod/prd-img/95/47/19/02/00/01/10002194795_01.jpg
,17328,10002194793,$11,自然乐园,NATURE REPUBLIC,ORIGIN CC TINTED CC霜 45g,http://static.lottedfs.cn/prod/prd-img/93/47/19/02/00/01/10002194793_01.jpg
,17328,10002191340,$29,自然乐园,NATURE REPUBLIC,GINSENG ROYAL SILK EMULSION 乳液 120ml,http://static.lottedfs.cn/prod/prd-img/40/13/19/02/00/01/10002191340_04.jpg
,17328,10002153482,$12,自然乐园,NATURE REPUBLIC,REAL SQUEEZE ALOE VERA TONER 芦荟护肤水 150ml,http://static.lottedfs.cn/prod/prd-img/82/34/15/02/00/01/10002153482_01.jpg
,17328,10002124894,$11,自然乐园,NATURE REPUBLIC,SUPER AQUA MAX WATERY TONER 化妆水 150ml,http://static.lottedfs.cn/prod/prd-img/94/48/12/02/00/01/10002124894_01.jpg
,17328,10002077785,$19,自然乐园,NATURE REPUBLIC,SNAIL SOLUTION EMULSION 乳液 120ml,http://static.lottedfs.cn/prod/prd-img/85/77/07/02/00/01/10002077785_01.jpg
,17328,10001737909,$19,自然乐园,NATURE REPUBLIC,AQUA COLLAGEN SOLUTION MARINE HYDROGEL EYE PATCH SET  眼膜套装,http://static.lottedfs.cn/prod/prd-img/09/79/73/01/00/01/10001737909_01.jpg
免税独家,17328,20000581311,$38,自然乐园,NATURE REPUBLIC,AROUND THE NATURE PEARL CREAM 面霜 30ml*6ea,http://static.lottedfs.cn/prod/prd-img/33/21/69/00/00/02/20000692133_1.jpg
,17328,20000581306,$15,自然乐园,NATURE REPUBLIC,CAPTURE MIRACLE HIBISCUS TOTAL CARE AMPOULE MASK SHEET 面膜 10片,http://static.lottedfs.cn/prod/prd-img/20/21/69/00/00/02/20000692120_1.jpg
,17328,20000581304,$15,自然乐园,NATURE REPUBLIC,CAPTURE MIRACLE AZULENE MOISTURIZING AMPOULE MASK SHEET 面膜 10片,http://static.lottedfs.cn/prod/prd-img/18/21/69/00/00/02/20000692118_1.jpg
,17328,20000581302,$15,自然乐园,NATURE REPUBLIC,CAPTURE MIRACLE TEA TREE PORE CARE AMPOULE MASK SHEET 面膜 10片,http://static.lottedfs.cn/prod/prd-img/11/21/69/00/00/02/20000692111_1.jpg
免税独家,17328,20000581298,$23,自然乐园,NATURE REPUBLIC,[免税版]FILLAYERING WRINKLE UP AMPOULE MASK SHEET 面膜 10片 (1+1),http://static.lottedfs.cn/prod/prd-img/02/21/69/00/00/02/20000692102_1.jpg
免税独家,17328,20000564881,$39,自然乐园,NATURE REPUBLIC,[免税专享] FILLAYERING WRINKLE UP AMPOULE 安瓶精华 (1+1),http://static.lottedfs.cn/prod/prd-img/19/92/66/00/00/02/20000669219_1.jpg
免税独家,17328,20000555153,$5,自然乐园,NATURE REPUBLIC,[免税专售] (MINI) PROVENCE INTENSIVE AMPLE FOUNDATION 迷你粉底液 Y23 WARM BEIGE,http://static.lottedfs.cn/prod/prd-img/65/29/65/00/00/02/20000652965_1.jpg
免税独家,17328,20000555150,$5,自然乐园,NATURE REPUBLIC,[免税专售] (MINI) PROVENCE INTENSIVE AMPLE FOUNDATION 迷你粉底液 Y21 PURE VANILLA,http://static.lottedfs.cn/prod/prd-img/60/29/65/00/00/02/20000652960_1.jpg
,17328,20000553006,$6,自然乐园,NATURE REPUBLIC,BY FLOWER BLUSHER 腮红 02 ORANGE PEAR,http://static.lottedfs.cn/prod/prd-img/12/90/64/00/00/02/20000649012_1.jpg
,17328,20000547614,$23,自然乐园,NATURE REPUBLIC,SNAIL SOLUTION HYDROGEL EYE PATCH 眼膜 10片,http://static.lottedfs.cn/prod/prd-img/70/94/63/00/00/02/20000639470_1.jpg
,17328,20000526675,$27,自然乐园,NATURE REPUBLIC,CELL POWER DAY CREAM 面霜,http://static.lottedfs.cn/prod/prd-img/48/32/60/00/00/02/20000603248_1.jpg
,17328,20000526656,$8,自然乐园,NATURE REPUBLIC,MULTIPLE 3D ALL IN ONE BROW 眉笔 01 PEANUT LATTE,http://static.lottedfs.cn/prod/prd-img/27/32/60/00/00/02/20000603227_1.jpg
,17328,20000526145,$27,自然乐园,NATURE REPUBLIC,GINSENG ROYAL SILK GOLD 2 STEP HYDROGEL MASK 面膜,http://static.lottedfs.cn/prod/prd-img/50/25/60/00/00/02/20000602550_2.jpg
,17328,20000512211,$29,自然乐园,NATURE REPUBLIC,HYA INTENSE ROSE CREAM PROMOTION SET 面霜企划套装,http://static.lottedfs.cn/prod/prd-img/67/27/58/00/00/02/20000582767_1.jpg
免税独家,17328,20000487634,$14,自然乐园,NATURE REPUBLIC,[DUTY FREE EXCLUSIVE] AROUND THE NATURE PEARL CREAM 面霜,http://static.lottedfs.cn/prod/prd-img/41/40/54/00/00/02/20000544041_1.jpg
,17328,20000487632,$22,自然乐园,NATURE REPUBLIC,AROUND THE NATURE MASK SHEET 面膜 30片+ 30片,http://static.lottedfs.cn/prod/prd-img/39/40/54/00/00/02/20000544039_1.jpg
,17328,20000457038,$27,自然乐园,NATURE REPUBLIC,CELL POWER NIGHT CREAM 晚霜,http://static.lottedfs.cn/prod/prd-img/00/84/49/00/00/02/20000498400_1.jpg
,17328,20000407441,$27,自然乐园,NATURE REPUBLIC,CELL POWER ESSENCE 精华液,http://static.lottedfs.cn/prod/prd-img/78/47/42/00/00/02/20000424778_1.jpg
,17328,20000407436,$21,自然乐园,NATURE REPUBLIC,HERB BLENDING CREAM 面霜 50ml,http://static.lottedfs.cn/prod/prd-img/73/47/42/00/00/02/20000424773_1.jpg
,17328,20000407434,$17,自然乐园,NATURE REPUBLIC,HERB BLENDING EMULSION 乳液 150ml,http://static.lottedfs.cn/prod/prd-img/71/47/42/00/00/02/20000424771_1.jpg
,17328,20000407433,$17,自然乐园,NATURE REPUBLIC,HERB BLENDING TONER 化妆水150ml,http://static.lottedfs.cn/prod/prd-img/70/47/42/00/00/02/20000424770_1.jpg
,17328,20000390698,$8,自然乐园,NATURE REPUBLIC,JEJU SPARKLING FOAM CLEANSER 洁面乳,http://static.lottedfs.cn/prod/prd-img/60/60/40/00/00/02/20000406060_1.jpg
,17328,20000390103,$23,自然乐园,NATURE REPUBLIC,SNAIL SOUTION AMPOULE 蜗牛安瓶,http://static.lottedfs.cn/prod/prd-img/65/54/40/00/00/02/20000405465_1.jpg
,17328,10003152320,$51,自然乐园,NATURE REPUBLIC,GINSENG ROYAL SILK GOLD MASSAGER 按摩仪,http://static.lottedfs.cn/prod/prd-img/20/23/15/03/00/01/10003152320_01.jpg
,17328,10002270921,$19,自然乐园,NATURE REPUBLIC,SNAIL SOLUTION BB CREAM  BB霜,http://static.lottedfs.cn/prod/prd-img/22/09/27/02/00/01/10002270922_01.jpg
,17328,10002262878,$93,自然乐园,NATURE REPUBLIC,GINSENG ROYAL SILK AMPOULE 安瓶 4个,http://static.lottedfs.cn/prod/prd-img/78/28/26/02/00/01/10002262878_12.jpg
,17328,10002250409,$17,自然乐园,NATURE REPUBLIC,BOTANICAL GREEN TEA DUAL CONCEALER 遮瑕膏遮瑕液2件套装,http://static.lottedfs.cn/prod/prd-img/09/04/25/02/00/01/10002250409_01.jpg
,17328,10002221336,$32,自然乐园,NATURE REPUBLIC,COLLAGEN DREAM SET  2种入企划套装,http://static.lottedfs.cn/prod/prd-img/36/13/22/02/00/01/10002221336_02.jpg
,17328,10002194804,$11,自然乐园,NATURE REPUBLIC,ORIGIN CC BRIGHTENING CC霜 45g,http://static.lottedfs.cn/prod/prd-img/04/48/19/02/00/01/10002194804_01.jpg
,17328,10002194798,$16,自然乐园,NATURE REPUBLIC,COLLAGEN DREAM 90 SKIN BOOSTER 化妆水 150ml,http://static.lottedfs.cn/prod/prd-img/98/47/19/02/00/01/10002194798_01.jpg
,17328,10002194792,$19,自然乐园,NATURE REPUBLIC,COLLAGEN DREAM EYE CREAM 眼霜 25ml,http://static.lottedfs.cn/prod/prd-img/92/47/19/02/00/01/10002194792_01.jpg
,17328,10002191338,$29,自然乐园,NATURE REPUBLIC,GINSENG ROYAL SILK TONER 护肤水 120ml,http://static.lottedfs.cn/prod/prd-img/38/13/19/02/00/01/10002191338_04.jpg
,17328,10002188372,$31,自然乐园,NATURE REPUBLIC,REAL SQUEEZE ALOE VERA PELLING 足膜 25g 10片,http://static.lottedfs.cn/prod/prd-img/72/83/18/02/00/01/10002188372_01.jpg
,17328,10002153484,$13,自然乐园,NATURE REPUBLIC,REAL SQUEEZE ALOE VERA CREAM 芦荟润肤霜 50ml,http://static.lottedfs.cn/prod/prd-img/84/34/15/02/00/01/10002153484_01.jpg
,17328,10002099186,$39,自然乐园,NATURE REPUBLIC,SANIL SOULTION SET   套装,http://static.lottedfs.cn/prod/prd-img/86/91/09/02/00/01/10002099186_11.jpg
,17328,10002086359,$77,自然乐园,NATURE REPUBLIC,Snail Solution Hydro Gel Mask 面膜10片 2+1,http://static.lottedfs.cn/prod/prd-img/59/63/08/02/00/01/10002086359_1.jpg
,17328,10001949968,$19,自然乐园,NATURE REPUBLIC,AQUA COLLAGEN SOLUTION MARINE HYDROGEL LIP PATCH SET  唇膜套装,http://static.lottedfs.cn/prod/prd-img/68/99/94/01/00/01/10001949968_01.jpg
,17328,10001796691,$19,自然乐园,NATURE REPUBLIC,ARGAN 20 REAL SQUEEZE AMPOULE 安瓶 25ml,http://static.lottedfs.cn/prod/prd-img/91/66/79/01/00/01/10001796691_1.jpg
