tag,brand_No,product_No,us_price,brand_name_chn,brand_name_eng,product_name,img_url
畅销,10290,20000580887,$110,蔻驰,COACH,CROSSGRAIN LEATHER SMALL WALLET 短款钱包 BLACK,http://static.lottedfs.cn/prod/prd-img/58/14/69/00/00/02/20000691458_1.jpg
促销 畅销,10290,20000466136,$165,蔻驰,COACH,PATCHWORK SIGNATURE SMALL ZIP AROUND WALLET B4 RUST 短款钱包,http://static.lottedfs.cn/prod/prd-img/69/01/51/00/00/02/20000510169_1.jpg
促销 畅销,10290,20000597291,$95,蔻驰,COACH,SMALL WRISTLET/GD/PEACOCK 收纳包,http://static.lottedfs.cn/prod/prd-img/25/96/71/00/00/02/20000719625_1.jpg
促销 畅销,10290,20000467278,$240,蔻驰,COACH,POLISHED PEBBLE POP UP MESSENGER LI MIDNIGHT NAVY 包,http://static.lottedfs.cn/prod/prd-img/22/20/51/00/00/02/20000512022_1.JPG
畅销,10290,20000589903,$200,蔻驰,COACH,SLIM ACCORDION ZIP B4/TAN CHALK 长款钱包,http://static.lottedfs.cn/prod/prd-img/35/67/70/00/00/02/20000706735_1.jpg
畅销,10290,20000466169,$110,蔻驰,COACH,CROSSGRAIN LEATHER SMALL WALLET NAVY 短款钱包,http://static.lottedfs.cn/prod/prd-img/02/02/51/00/00/02/20000510202_1.jpg
畅销,10290,20000637988,$200,蔻驰,COACH,SLIM ACCORDION ZIP 拉链长款钱包 B4/TAN RUST,http://static.lottedfs.cn/prod/prd-img/26/79/78/00/00/02/20000787926_1.jpg
畅销,10290,20000624964,$110,蔻驰,COACH,SMALL WALLET 短款钱包 GM/STONE BLUE,http://static.lottedfs.cn/prod/prd-img/18/94/76/00/00/02/20000769418_1.jpg
,10290,20000624696,$110,蔻驰,COACH,SMALLWALLET/B4/TAN DEEP RED 短款钱包,http://static.lottedfs.cn/prod/prd-img/45/89/76/00/00/02/20000768945_1.jpg
畅销,10290,20000589897,$250,蔻驰,COACH,CHARCOAL BLACK  腰带  38MM,http://static.lottedfs.cn/prod/prd-img/29/67/70/00/00/02/20000706729_1.jpg
促销 畅销,10290,20000534118,$410,蔻驰,COACH,COATED CANVAS SIGNATURE PATCHWORK CAMERA BAG GM/TAN BEECHWOOD MULTI 斜挎包,http://static.lottedfs.cn/prod/prd-img/89/55/61/00/00/02/20000615589_1.JPG
促销 畅销,10290,20000487162,$410,蔻驰,COACH,POLISHED PEBBLE CAMPUS BACKPACK 23 背包 LI/JASPER,http://static.lottedfs.cn/prod/prd-img/25/33/54/00/00/02/20000543325_1.jpg
促销 畅销,10290,20000466086,$550,蔻驰,COACH,HUDSON 5 BAG FEAT CROSSGRAIN BLACK 公文包,http://static.lottedfs.cn/prod/prd-img/19/01/51/00/00/02/20000510119_1.jpg
畅销,10290,20000637997,$290,蔻驰,COACH,TABBY CROSSBODY B4/BLACK 斜挎包,http://static.lottedfs.cn/prod/prd-img/35/79/78/00/00/02/20000787935_1.jpg
畅销,10290,20000637961,$290,蔻驰,COACH,COATED CANVAS SIGNATURES SUTTON CROSSBODY 斜挎包 B4/TAN RUST,http://static.lottedfs.cn/prod/prd-img/99/78/78/00/00/02/20000787899_1.jpg
畅销,10290,20000637940,$465,蔻驰,COACH,PARKER SHOULDER BAG B4/RUST 单肩包,http://static.lottedfs.cn/prod/prd-img/78/78/78/00/00/02/20000787878_1.jpg
畅销,10290,20000624967,$200,蔻驰,COACH,SLIM ACCORDION ZIP 长款钱包 GD/BLACK,http://static.lottedfs.cn/prod/prd-img/21/94/76/00/00/02/20000769421_1.jpg
畅销,10290,20000624611,$315,蔻驰,COACH,CAMERABAG16 斜挎包 V5/RED DEEP RED,http://static.lottedfs.cn/prod/prd-img/55/88/76/00/00/02/20000768855_1.jpg
畅销,10290,20000624606,$500,蔻驰,COACH,MELODYBACKPACK 双肩包 V5/BLACK,http://static.lottedfs.cn/prod/prd-img/50/88/76/00/00/02/20000768850_1.jpg
,10290,20000589956,$200,蔻驰,COACH,TABBY SMALL WALLET/B4/BLACK 短款钱包,http://static.lottedfs.cn/prod/prd-img/88/67/70/00/00/02/20000706788_1.jpg
促销 畅销,10290,20000580884,$90,蔻驰,COACH,MINI ID SKINNY 卡包 GM/RED APPLE,http://static.lottedfs.cn/prod/prd-img/55/14/69/00/00/02/20000691455_1.jpg
畅销,10290,20000580869,$290,蔻驰,COACH,POLISHED PEBBLE LEATHER SUTTON CROSSBODY 斜挎包 GD/BLACK,http://static.lottedfs.cn/prod/prd-img/40/14/69/00/00/02/20000691440_1.jpg
畅销,10290,20000580833,$315,蔻驰,COACH,POLISHED PEBBLE LEATHER CAMERA BAG 单肩包 LI BLACK,http://static.lottedfs.cn/prod/prd-img/04/14/69/00/00/02/20000691404_5.JPG
促销 畅销,10290,20000520839,$650,蔻驰,COACH,SMOOTH GRAIN LEATHER DREAMER 手提包 LI/BLACK,http://static.lottedfs.cn/prod/prd-img/26/41/59/00/00/02/20000594126_1.jpg
,10290,20000520833,$350,蔻驰,COACH,POLISHED PEBBLE LEATHER CHARLIE 28 CARRYALL 单肩包  LI BLACK,http://static.lottedfs.cn/prod/prd-img/20/41/59/00/00/02/20000594120_1.jpg
促销 畅销,10290,20000511469,$410,蔻驰,COACH,QUILTED LEATHER CAMERA BAG LI/JASPER 斜挎包,http://static.lottedfs.cn/prod/prd-img/12/17/58/00/00/02/20000581712_1.jpg
促销,10290,20000487194,$290,蔻驰,COACH,CRYSTAL EMBELLISHMENT SLIM PHONE CROSSBODY DK/BLACK 斜挎包,http://static.lottedfs.cn/prod/prd-img/57/33/54/00/00/02/20000543357_1.jpg
新品,10290,20000637986,$550,蔻驰,COACH,TABBY SHOULDER BAG 单肩包 B4/BLACK,http://static.lottedfs.cn/prod/prd-img/24/79/78/00/00/02/20000787924_1.jpg
新品,10290,20000637953,$110,蔻驰,COACH,COLORBLOCK COATED CANVAS SIGNATURE SMALL WALLET 短款钱包 B4 TAN BLACK,http://static.lottedfs.cn/prod/prd-img/91/78/78/00/00/02/20000787891_1.JPG
畅销,10290,20000637937,$590,蔻驰,COACH,PARKER SHOULDER BAG B4/BLACK MULTI 单肩包,http://static.lottedfs.cn/prod/prd-img/75/78/78/00/00/02/20000787875_1.jpg
畅销,10290,20000630519,$315,蔻驰,COACH,CAMERABAG/GM/MARINE 斜挎包,http://static.lottedfs.cn/prod/prd-img/81/71/77/00/00/02/20000777181_1.jpg
畅销,10290,20000625077,$500,蔻驰,COACH,DREAMER 21 手提包 B4/TAN MULTI,http://static.lottedfs.cn/prod/prd-img/82/95/76/00/00/02/20000769582_1.jpg
,10290,20000625056,$200,蔻驰,COACH,TABBY SMALL WALLET 短款钱包 B4/TAN BLACK,http://static.lottedfs.cn/prod/prd-img/52/95/76/00/00/02/20000769552_1.jpg
畅销,10290,20000624960,$500,蔻驰,COACH,CHARLIE BUCKET BAG 单肩包 B4/TAN RUST,http://static.lottedfs.cn/prod/prd-img/13/94/76/00/00/02/20000769413_1.jpg
畅销,10290,20000624936,$350,蔻驰,COACH,DREAMER CONVERTIBLE CROSSBODY 斜挎包 B4/TAN DEEP RED,http://static.lottedfs.cn/prod/prd-img/81/93/76/00/00/02/20000769381_1.jpg
畅销,10290,20000624713,$315,蔻驰,COACH,PARKER18SHOULDERBAG/B4/TAN DUSTY PINK 单肩包,http://static.lottedfs.cn/prod/prd-img/80/89/76/00/00/02/20000768980_1.jpg
畅销,10290,20000624705,$200,蔻驰,COACH,SOFTWALLET/B4/TAN BLACK 长款钱包,http://static.lottedfs.cn/prod/prd-img/62/89/76/00/00/02/20000768962_1.jpg
畅销,10290,20000624631,$500,蔻驰,COACH,KATSADDLEBAG20 斜挎包 B4/BLACK,http://static.lottedfs.cn/prod/prd-img/75/88/76/00/00/02/20000768875_1.jpg
畅销,10290,20000624604,$550,蔻驰,COACH,MELODYSHOULDERBAG 单肩包 V5/BLACK,http://static.lottedfs.cn/prod/prd-img/48/88/76/00/00/02/20000768848_1.jpg
,10290,20000624600,$110,蔻驰,COACH,SMALLWALLET 短款钱包 GM/METALLIC MIDNIGHT NAVY,http://static.lottedfs.cn/prod/prd-img/44/88/76/00/00/02/20000768844_1.jpg
促销 畅销,10290,20000597290,$70,蔻驰,COACH,FLAT CARD CASE/GM/PEACOCK MULTI 卡包,http://static.lottedfs.cn/prod/prd-img/24/96/71/00/00/02/20000719624_1.jpg
促销,10290,20000589955,$200,蔻驰,COACH,KAFFE CHINTZ OBLONG/PURPLE/PINK 丝巾,http://static.lottedfs.cn/prod/prd-img/87/67/70/00/00/02/20000706787_1.jpg
,10290,20000589940,$200,蔻驰,COACH,SLIM WALLET IN BLOCKED SIGNATURE CHARCOAL SIGNATURE MULTI 短款钱包,http://static.lottedfs.cn/prod/prd-img/72/67/70/00/00/02/20000706772_1.jpg
促销,10290,20000589929,$95,蔻驰,COACH,FLAT CARD CASE OVERSIZED RETRO LOGO IN LEATHER TRUE BLUE 卡包,http://static.lottedfs.cn/prod/prd-img/61/67/70/00/00/02/20000706761_1.jpg
促销 畅销,10290,20000589888,$95,蔻驰,COACH,SMALL WRISTLET V5/TAN TRUE PINK 手拿包,http://static.lottedfs.cn/prod/prd-img/20/67/70/00/00/02/20000706720_1.jpg
,10290,20000589886,$95,蔻驰,COACH,SMALL WRISTLET B4/TAN BLACK 手拿包,http://static.lottedfs.cn/prod/prd-img/18/67/70/00/00/02/20000706718_1.jpg
新品,10290,20000589883,$95,蔻驰,COACH,POLISHED PEBBLE SMALL WRISTLET 收纳包 BLACK,http://static.lottedfs.cn/prod/prd-img/15/67/70/00/00/02/20000706715_1.jpg
促销,10290,20000580916,$465,蔻驰,COACH,CHARLIE CARRYALL 手提包 B4/TAN CHALK,http://static.lottedfs.cn/prod/prd-img/87/14/69/00/00/02/20000691487_1.jpg
畅销,10290,20000580901,$500,蔻驰,COACH,EVIE BACKPACK 双肩包 B4/TAN RUST,http://static.lottedfs.cn/prod/prd-img/72/14/69/00/00/02/20000691472_1.jpg
,10290,20000580897,$350,蔻驰,COACH,TRAVEL WALLET IN SIGNATURE KHAKI 长款钱包,http://static.lottedfs.cn/prod/prd-img/68/14/69/00/00/02/20000691468_1.JPG
促销,10290,20000580883,$90,蔻驰,COACH,MINI ID SKINNY 卡包 GM/TRUE PINK,http://static.lottedfs.cn/prod/prd-img/54/14/69/00/00/02/20000691454_1.jpg
畅销,10290,20000580875,$250,蔻驰,COACH,38MM CLASSIC PLAQUE CUT TO SIZE REVERSIBLE SIGNATURE CROSSGRAIN BELT BLACK BLACK 腰带,http://static.lottedfs.cn/prod/prd-img/46/14/69/00/00/02/20000691446_1.jpg
促销 畅销,10290,20000580861,$650,蔻驰,COACH,COATED CANVAS SIGNATURE WITH EXOTIC DREAMER B4/TAN BLACK MULTI 手提包,http://static.lottedfs.cn/prod/prd-img/32/14/69/00/00/02/20000691432_1.jpg
,10290,20000580853,$95,蔻驰,COACH,COLORBLOCK COATED CANVAS SIGNATURE SMALL WRISTLET 手拿包 B4/TAN RUST,http://static.lottedfs.cn/prod/prd-img/24/14/69/00/00/02/20000691424_1.jpg
,10290,20000580848,$110,蔻驰,COACH,COLORBLOCK COATED CANVAS SIGNATURE SMALL WALLET 短款钱包 B4 TAN CHALK,http://static.lottedfs.cn/prod/prd-img/19/14/69/00/00/02/20000691419_1.jpg
促销 畅销,10290,20000574058,$550,蔻驰,COACH,PARKER TOP HANDLE 32 手提包 B4/BLACK,http://static.lottedfs.cn/prod/prd-img/65/11/68/00/00/02/20000681165_1.jpg
促销,10290,20000565668,$260,蔻驰,COACH,LARGE WRISTLET V5/CHARCOAL MULTI 收纳包,http://static.lottedfs.cn/prod/prd-img/20/09/67/00/00/02/20000670920_1.jpg
促销,10290,20000556021,$200,蔻驰,COACH,COLORBLOCK COATED CANAVAS SIGNATURE SOFT WALLET B4/TAN INK LIGHT PEACH 长款钱包,http://static.lottedfs.cn/prod/prd-img/07/46/65/00/00/02/20000654607_1.jpg
促销,10290,20000555982,$290,蔻驰,COACH,POLISHED PEBBLE LEATHER SUTTON CROSSBODY GD/BRIGHT CHERRY 斜挎包,http://static.lottedfs.cn/prod/prd-img/68/45/65/00/00/02/20000654568_1.jpg
,10290,20000555977,$70,蔻驰,COACH,COLORBLOCK COATED CANVAS SIGNATURE FLAT CARD CASE B4/TAN CHALK 卡包,http://static.lottedfs.cn/prod/prd-img/63/45/65/00/00/02/20000654563_1.jpg
畅销,10290,20000549090,$750,蔻驰,COACH,BLEECKER BACKPACK OLDARK SADDLE 背包,http://static.lottedfs.cn/prod/prd-img/53/24/64/00/00/02/20000642453_1.jpg
促销 畅销,10290,20000549076,$550,蔻驰,COACH,COLORBLOCK EXOTIC LANE SATCHEL V5/IVORY MULTI 手提包,http://static.lottedfs.cn/prod/prd-img/39/24/64/00/00/02/20000642439_1.jpg
促销,10290,20000549075,$500,蔻驰,COACH,POLISHED PEBBLE LEATHER LANE SATCHEL GD/BLACK 手提包,http://static.lottedfs.cn/prod/prd-img/38/24/64/00/00/02/20000642438_1.jpg
促销 畅销,10290,20000549070,$650,蔻驰,COACH,COATED CANVAS SIGNATURE WAVE PATCHWORK DREAMER B4/TAN MULTI 手提包,http://static.lottedfs.cn/prod/prd-img/33/24/64/00/00/02/20000642433_1.jpg
,10290,20000534375,$90,蔻驰,COACH,CROSSGRAIN MINI ID SKINNY NAVY 卡包,http://static.lottedfs.cn/prod/prd-img/82/93/48/00/00/02/20000489382_1.jpg
促销,10290,20000534114,$700,蔻驰,COACH,GLOVETAN FRAME BAG B4/BLACK 手提包,http://static.lottedfs.cn/prod/prd-img/85/55/61/00/00/02/20000615585_1.jpg
促销,10290,20000523649,$200,蔻驰,COACH,SMALL FOLDOVER WALLET B4/OXBLOOD 短款钱包,http://static.lottedfs.cn/prod/prd-img/56/86/59/00/00/02/20000598656_1.jpg
促销,10290,20000523626,$350,蔻驰,COACH,OMBRE PRINT MULTI SIGNATURE LEATHER CAMERA BAG SV/BLUE MULTICOLOR 斜挎包,http://static.lottedfs.cn/prod/prd-img/33/86/59/00/00/02/20000598633_1.jpg
促销,10290,20000523622,$350,蔻驰,COACH,OMBRE PRINT MULTI CAMERA BAG 斜挎包 GM/MULTICOLOR,http://static.lottedfs.cn/prod/prd-img/29/86/59/00/00/02/20000598629_1.JPG
促销 畅销,10290,20000521612,$105,蔻驰,COACH,GRAINED LEATHER CARD HOLDER 卡包 B4/OXBLOOD,http://static.lottedfs.cn/prod/prd-img/66/53/59/00/00/02/20000595366_1.jpg
,10290,20000520968,$165,蔻驰,COACH,25mm SCULPTED C REVERSIBLE BELT B4/BLACK 1941 SADDLE 腰带,http://static.lottedfs.cn/prod/prd-img/55/42/59/00/00/02/20000594255_1.jpg
促销,10290,20000520951,$200,蔻驰,COACH,OMBRE QUILTING SMALL ZIP AROUND 短款钱包 GM/BLACK MULTI,http://static.lottedfs.cn/prod/prd-img/38/42/59/00/00/02/20000594238_1.jpg
促销 畅销,10290,20000520931,$410,蔻驰,COACH,POLISHED PEBBLED LEATHER PRAIRIE SATCHEL 手提包 NAVY,http://static.lottedfs.cn/prod/prd-img/18/42/59/00/00/02/20000594218_1.jpg
促销 畅销,10290,20000520930,$410,蔻驰,COACH,POLISHED PEBBLED LEATHER PRAIRIE SATCHEL BLACK 手提包,http://static.lottedfs.cn/prod/prd-img/17/42/59/00/00/02/20000594217_1.jpg
促销,10290,20000520840,$650,蔻驰,COACH,SMOOTH GRAIN LEATHER DREAMER LI/BEECHWOOD 手提包,http://static.lottedfs.cn/prod/prd-img/27/41/59/00/00/02/20000594127_1.jpg
促销 畅销,10290,20000511496,$465,蔻驰,COACH,EXCL CNY POLISHED PEBBLE LEATHER CHARLIE CARRYALL GD/JASPER 手提包,http://static.lottedfs.cn/prod/prd-img/39/17/58/00/00/02/20000581739_1.jpg
促销,10290,20000511495,$240,蔻驰,COACH,POLISHED PEBBLE XBODY CLUTCH LI/JASPER 斜挎包,http://static.lottedfs.cn/prod/prd-img/38/17/58/00/00/02/20000581738_1.jpg
促销 畅销,10290,20000506223,$465,蔻驰,COACH,SMOOTH GRAIN LEATHER DREAMER 21 GD/BLACK 手提包,http://static.lottedfs.cn/prod/prd-img/51/42/57/00/00/02/20000574251_6.jpg
促销,10290,20000497507,$465,蔻驰,COACH,METALLIC INTERIOR CHARLIE CARRYALL GM/DARK BERRY 手提包,http://static.lottedfs.cn/prod/prd-img/23/11/56/00/00/02/20000561123_1.jpg
促销 畅销,10290,20000497506,$410,蔻驰,COACH,METALLIC TRAIL CROSSBODY GM/PLATINUM 斜挎包,http://static.lottedfs.cn/prod/prd-img/22/11/56/00/00/02/20000561122_1.jpg
促销 畅销,10290,20000487195,$410,蔻驰,COACH,REFINED CALF LEATHER GRACE 20 BAG 手提包 LI/JASPER,http://static.lottedfs.cn/prod/prd-img/58/33/54/00/00/02/20000543358_1.JPG
促销 畅销,10290,20000484242,$650,蔻驰,COACH,HUDSON 5 BAG IN SIGNATURE LEATHER 公文包 QBBHP,http://static.lottedfs.cn/prod/prd-img/41/85/53/00/00/02/20000538541_1.JPG
促销,10290,20000483137,$700,蔻驰,COACH,TATTOO DREAMER B4/EVERGREEN 手提包,http://static.lottedfs.cn/prod/prd-img/33/68/53/00/00/02/20000536833_1.jpg
促销 畅销,10290,20000483125,$165,蔻驰,COACH,EMBOSSED CROC SMALL WALLET LI/MIDNIGHT NAVY 短款钱包,http://static.lottedfs.cn/prod/prd-img/21/68/53/00/00/02/20000536821_1.jpg
促销,10290,20000476766,$240,蔻驰,COACH,POLISHED PEBBLE POP UP MESSENGER 斜挎包 DK/HEATHER GREY,http://static.lottedfs.cn/prod/prd-img/56/69/52/00/00/02/20000526956_1.JPG
,10290,20000476758,$95,蔻驰,COACH,POLISHED PEBBLE SMALL WRISTLET 手包 NAVY,http://static.lottedfs.cn/prod/prd-img/48/69/52/00/00/02/20000526948_1.jpg
促销 畅销,10290,20000476748,$650,蔻驰,COACH,SMOOTH GRAIN LEATHER DREAMER 手提包 LI/1941 SADDLE,http://static.lottedfs.cn/prod/prd-img/38/69/52/00/00/02/20000526938_1.jpg
促销 畅销,10290,20000476747,$650,蔻驰,COACH,SMOOTH GRAIN LEATHER DREAMER 手提包 LI/BLACK,http://static.lottedfs.cn/prod/prd-img/37/69/52/00/00/02/20000526937_1.jpg
促销,10290,20000467319,$410,蔻驰,COACH,SHOULDER BAG 单肩包,http://static.lottedfs.cn/prod/prd-img/63/20/51/00/00/02/20000512063_1.jpg
促销,10290,20000467301,$900,蔻驰,COACH,GLOVETANNED PEBBLE LEATHER ROGUE BAG 单肩包 BP 1941 SADDLE WINE,http://static.lottedfs.cn/prod/prd-img/45/20/51/00/00/02/20000512045_1.JPG
促销 畅销,10290,20000467228,$165,蔻驰,COACH,BORDER RIVETS SMALL ZIP AROUND WALLET 短款钱包 B4 OXBLOOD,http://static.lottedfs.cn/prod/prd-img/72/19/51/00/00/02/20000511972_1.jpg
促销 畅销,10290,20000466157,$410,蔻驰,COACH,GLOVETANNED LTHR DINKY CROSSBODY  斜挎包,http://static.lottedfs.cn/prod/prd-img/90/01/51/00/00/02/20000510190_1.jpg
促销 畅销,10290,20000456392,$105,蔻驰,COACH,CROSSGRAIN BUSINESS CARD CASE LI NAVY 卡包,http://static.lottedfs.cn/prod/prd-img/15/75/49/00/00/02/20000497515_1.jpg
促销 畅销,10290,20000456391,$105,蔻驰,COACH,CROSSGRAIN BUSINESS CARD CASE LI BLACK 卡包,http://static.lottedfs.cn/prod/prd-img/14/75/49/00/00/02/20000497514_1.jpg
促销,10290,20000450369,$200,蔻驰,COACH,CROSSGRAIN MESSENGER CROSSBODY LI BEECHWOOD 斜挎包,http://static.lottedfs.cn/prod/prd-img/88/93/48/00/00/02/20000489388_1.jpg
促销,10290,20000426620,$240,蔻驰,COACH,COACH X KEITH HARING LEATHER SEQUINS TURNLOCK WRISTLET 30 收纳包  ICE BLUE,http://static.lottedfs.cn/prod/prd-img/51/00/45/00/00/02/20000450051_2.jpg
促销 畅销,10290,20000418996,$410,蔻驰,COACH,WALLET SIGNATURE CROSSGRAIN 旅行钱包,http://static.lottedfs.cn/prod/prd-img/46/95/43/00/00/02/20000439546_1.jpg
畅销,10290,20000411085,$290,蔻驰,COACH,CROSSGRAIN LEATHER ACCORDION ZIP  长款钱包,http://static.lottedfs.cn/prod/prd-img/77/93/42/00/00/02/20000429377_1.jpg
新品,10290,20000637990,$315,蔻驰,COACH,RILEY BELT BAG 腰包 B4/BLACK,http://static.lottedfs.cn/prod/prd-img/28/79/78/00/00/02/20000787928_1.jpg
新品,10290,20000637980,$410,蔻驰,COACH,SIGNATURE ACADEMY CROSSBODY 斜挎包 JI/KHAKI,http://static.lottedfs.cn/prod/prd-img/18/79/78/00/00/02/20000787918_1.jpg
新品,10290,20000637958,$240,蔻驰,COACH,BELT BAG 腰包 B4/TAN CHALK,http://static.lottedfs.cn/prod/prd-img/96/78/78/00/00/02/20000787896_1.jpg
新品,10290,20000637957,$240,蔻驰,COACH,COATED CANVAS SIGNATURE BELT BAG 腰包 B4/TAN RUST,http://static.lottedfs.cn/prod/prd-img/95/78/78/00/00/02/20000787895_1.jpg
新品,10290,20000637954,$350,蔻驰,COACH,COATED CANVAS SIGNATURE CHARLIE 28 CARRYALL 手提包 B4 RUST,http://static.lottedfs.cn/prod/prd-img/92/78/78/00/00/02/20000787892_1.JPG
新品,10290,20000637943,$465,蔻驰,COACH,COATED CANVAS SIGNATURE CHARLIE CARRYALL 手提包 RUST,http://static.lottedfs.cn/prod/prd-img/81/78/78/00/00/02/20000787881_1.jpg
畅销,10290,20000637941,$410,蔻驰,COACH,PARKER18SHOULDERBAG 单肩包 B4/RUST,http://static.lottedfs.cn/prod/prd-img/79/78/78/00/00/02/20000787879_1.jpg
新品,10290,20000637935,$410,蔻驰,COACH,BORDER RIVETS PARKER 18 SHOULDER BAG 单肩包 B4 BLACK,http://static.lottedfs.cn/prod/prd-img/73/78/78/00/00/02/20000787873_1.JPG
,10290,20000630536,$700,蔻驰,COACH,DUFFLE24/OL/BLACK BROWN 斜挎包,http://static.lottedfs.cn/prod/prd-img/98/71/77/00/00/02/20000777198_1.jpg
,10290,20000630535,$200,蔻驰,COACH,HYBRID10/BLACK/RED 收纳包,http://static.lottedfs.cn/prod/prd-img/97/71/77/00/00/02/20000777197_1.jpg
,10290,20000630534,$550,蔻驰,COACH,FIELDTOTE40/B4/RED BLACK MULTI 手提包兼斜挎包,http://static.lottedfs.cn/prod/prd-img/96/71/77/00/00/02/20000777196_1.jpg
畅销,10290,20000630533,$410,蔻驰,COACH,KATCAMERABAG/B4/DEEP RED MULTI 斜挎包,http://static.lottedfs.cn/prod/prd-img/95/71/77/00/00/02/20000777195_1.jpg
,10290,20000630532,$465,蔻驰,COACH,PARKERTOPHANDLE/B4/TAN RED APPLE 手提包,http://static.lottedfs.cn/prod/prd-img/94/71/77/00/00/02/20000777194_1.jpg
,10290,20000630531,$500,蔻驰,COACH,TROUPETOTE16/B4/TAN RED APPLE 手提包,http://static.lottedfs.cn/prod/prd-img/93/71/77/00/00/02/20000777193_1.jpg
,10290,20000630527,$500,蔻驰,COACH,FIELDTOTE/V5/RED DEEP RED 手提包,http://static.lottedfs.cn/prod/prd-img/89/71/77/00/00/02/20000777189_1.jpg
畅销,10290,20000630525,$465,蔻驰,COACH,TABBYCHAINCROSSBODY/B4/BLACK 单肩包,http://static.lottedfs.cn/prod/prd-img/87/71/77/00/00/02/20000777187_1.jpg
,10290,20000630524,$650,蔻驰,COACH,TABBYSHOULDERBAG26/B4/DEEP RED 单肩包,http://static.lottedfs.cn/prod/prd-img/86/71/77/00/00/02/20000777186_1.jpg
,10290,20000630521,$90,蔻驰,COACH,MINIIDSKINNY/GM/MARINE 卡包,http://static.lottedfs.cn/prod/prd-img/83/71/77/00/00/02/20000777183_1.jpg
,10290,20000630520,$290,蔻驰,COACH,SUTTONCROSSBODY/GM/MARINE 斜挎包,http://static.lottedfs.cn/prod/prd-img/82/71/77/00/00/02/20000777182_1.jpg
,10290,20000630090,$95,蔻驰,COACH,CARD CASE IN SIG JAQUARD EMBROIDERED C/MIDNIGHT/HEATHER GREY 卡包,http://static.lottedfs.cn/prod/prd-img/10/66/77/00/00/02/20000776610_1.JPG
,10290,20000630089,$250,蔻驰,COACH,38MM/BLACK/SADDLE 腰带,http://static.lottedfs.cn/prod/prd-img/09/66/77/00/00/02/20000776609_1.JPG
,10290,20000630085,$250,蔻驰,COACH,38MM/BLACK/MIDNIGHT 腰带,http://static.lottedfs.cn/prod/prd-img/04/66/77/00/00/02/20000776604_1.JPG
,10290,20000630084,$200,蔻驰,COACH,DOUBLE BILLFOLD IN SIGNATURE JACQUARD/MIDNIGHT/HEATHER GREY 短款钱包,http://static.lottedfs.cn/prod/prd-img/03/66/77/00/00/02/20000776603_1.JPG
畅销,10290,20000630081,$200,蔻驰,COACH,SLIM ACCORDION ZIP/B4/TAN DUSTY PINK 长款钱包,http://static.lottedfs.cn/prod/prd-img/00/66/77/00/00/02/20000776600_1.JPG
,10290,20000625142,$290,蔻驰,COACH,SIGNATURE PVC ACCORDION WALLET 长款钱包 CHARCOAL,http://static.lottedfs.cn/prod/prd-img/98/67/70/00/00/02/20000706798_1.jpg
,10290,20000625078,$240,蔻驰,COACH,3IN1 WALLET 短款钱包 CHARCOAL/SPORT BLUE,http://static.lottedfs.cn/prod/prd-img/83/95/76/00/00/02/20000769583_1.jpg
,10290,20000625054,$70,蔻驰,COACH,SKIING REXY BAG CHARM 挂饰 BK/MULTI,http://static.lottedfs.cn/prod/prd-img/50/95/76/00/00/02/20000769550_1.jpg
,10290,20000625051,$95,蔻驰,COACH,SMALL CARD CASE 卡包 SADDLE/SPORT BLUE,http://static.lottedfs.cn/prod/prd-img/44/95/76/00/00/02/20000769544_1.jpg
畅销,10290,20000625049,$95,蔻驰,COACH,SMALL CARD CASE 卡包 SILVER/BLACK,http://static.lottedfs.cn/prod/prd-img/42/95/76/00/00/02/20000769542_1.jpg
畅销,10290,20000625047,$550,蔻驰,COACH,TABBY SHOULDER BAG 单肩包 B4/TAN BLACK,http://static.lottedfs.cn/prod/prd-img/38/95/76/00/00/02/20000769538_1.jpg
,10290,20000625045,$290,蔻驰,COACH,TABBY CROSSBODY 斜挎包 B4/BLACK/BLACK,http://static.lottedfs.cn/prod/prd-img/34/95/76/00/00/02/20000769534_1.jpg
,10290,20000625040,$200,蔻驰,COACH,TABBY SMALL WALLET 短款钱包 B4/MULTI,http://static.lottedfs.cn/prod/prd-img/27/95/76/00/00/02/20000769527_1.jpg
,10290,20000625038,$95,蔻驰,COACH,CARD CASE IN SIG JAQUARD EMBROIDERED C 卡包 HEATHER GREY/BLUE OMBRE,http://static.lottedfs.cn/prod/prd-img/25/95/76/00/00/02/20000769525_1.jpg
,10290,20000625034,$95,蔻驰,COACH,CARD CASE IN SIG JAQUARD EMBROIDERED C 卡包 BLACK/CHALK,http://static.lottedfs.cn/prod/prd-img/21/95/76/00/00/02/20000769521_1.jpg
畅销,10290,20000625022,$510,蔻驰,COACH,TABBY SHOULDER BAG 26 单肩包 B4/DEEP RED,http://static.lottedfs.cn/prod/prd-img/02/95/76/00/00/02/20000769502_1.jpg
畅销,10290,20000625018,$650,蔻驰,COACH,TABBY SHOULDER BAG 单肩包 B4/DEEP RED,http://static.lottedfs.cn/prod/prd-img/98/94/76/00/00/02/20000769498_1.jpg
,10290,20000625011,$650,蔻驰,COACH,TABBY SHOULDER BAG 26 单肩包 V5/1941 SADDLE,http://static.lottedfs.cn/prod/prd-img/88/94/76/00/00/02/20000769488_1.jpg
,10290,20000625008,$650,蔻驰,COACH,TABBY SHOULDER BAG 26 单肩包 B4/BLACK,http://static.lottedfs.cn/prod/prd-img/80/94/76/00/00/02/20000769480_1.jpg
,10290,20000625006,$470,蔻驰,COACH,TABBY SHOULDER BAG 26 单肩包 TAN BLACK,http://static.lottedfs.cn/prod/prd-img/77/94/76/00/00/02/20000769477_1.jpg
,10290,20000625003,$510,蔻驰,COACH,TABBY SHOULDER BAG 26 单肩包 V5/1941 SADDLE,http://static.lottedfs.cn/prod/prd-img/72/94/76/00/00/02/20000769472_1.jpg
,10290,20000625000,$410,蔻驰,COACH,PACER CROSS BODY 斜挎包 JI/HEATHER GREY,http://static.lottedfs.cn/prod/prd-img/68/94/76/00/00/02/20000769468_1.jpg
,10290,20000624988,$410,蔻驰,COACH,PACER CROSS BODY 斜挎包 JI/BLACK,http://static.lottedfs.cn/prod/prd-img/52/94/76/00/00/02/20000769452_1.jpg
,10290,20000624986,$550,蔻驰,COACH,PACER MESSENGER 斜挎包 JI/SPORT BLUE,http://static.lottedfs.cn/prod/prd-img/50/94/76/00/00/02/20000769450_1.jpg
,10290,20000624982,$550,蔻驰,COACH,PACER BACKPACK 双肩包 JI/SPORT BLUE,http://static.lottedfs.cn/prod/prd-img/43/94/76/00/00/02/20000769443_1.jpg
,10290,20000624979,$550,蔻驰,COACH,PACER BACKPACK 双肩包 JI/HEATHER GREY,http://static.lottedfs.cn/prod/prd-img/40/94/76/00/00/02/20000769440_1.jpg
,10290,20000624976,$200,蔻驰,COACH,TABBY SMALL WALLET 短款钱包 GD/DEEP RED,http://static.lottedfs.cn/prod/prd-img/35/94/76/00/00/02/20000769435_1.jpg
,10290,20000624948,$465,蔻驰,COACH,PARKER TOP HANDLE 手提包 B4/TAN METALLIC CLAY,http://static.lottedfs.cn/prod/prd-img/99/93/76/00/00/02/20000769399_1.jpg
,10290,20000624943,$465,蔻驰,COACH,PARKER SHOULDER BAG 单肩包 B4/TAN MULTI,http://static.lottedfs.cn/prod/prd-img/91/93/76/00/00/02/20000769391_1.jpg
,10290,20000624940,$550,蔻驰,COACH,PACER BACKPACK 双肩包 JI/CHARCOAL,http://static.lottedfs.cn/prod/prd-img/85/93/76/00/00/02/20000769385_1.jpg
,10290,20000624938,$350,蔻驰,COACH,DREAMER CONVERTIBLE CROSSBODY 斜挎包 V5/TAN DUSTY PINK,http://static.lottedfs.cn/prod/prd-img/83/93/76/00/00/02/20000769383_1.jpg
,10290,20000624934,$95,蔻驰,COACH,SMALL WRISTLET 收纳包 B4/IVORY MULTI,http://static.lottedfs.cn/prod/prd-img/79/93/76/00/00/02/20000769379_1.jpg
,10290,20000624931,$90,蔻驰,COACH,MINI ID SKINNY 卡包 GM/METALLIC CLAY,http://static.lottedfs.cn/prod/prd-img/73/93/76/00/00/02/20000769373_1.jpg
,10290,20000624930,$90,蔻驰,COACH,MINI ID SKINNY 卡包 GM/METALLIC MIDNIGHT NAVY,http://static.lottedfs.cn/prod/prd-img/72/93/76/00/00/02/20000769372_1.jpg
,10290,20000624914,$110,蔻驰,COACH,SMALL ZIP AROUND 短款钱包 B4/IVORY MULTI,http://static.lottedfs.cn/prod/prd-img/49/93/76/00/00/02/20000769349_1.jpg
,10290,20000624912,$110,蔻驰,COACH,LARGE FLAT CARD CASE 卡包 B4/MULTI,http://static.lottedfs.cn/prod/prd-img/47/93/76/00/00/02/20000769347_1.jpg
,10290,20000624909,$70,蔻驰,COACH,FLAT CARD CASE 卡包 B4/METALLIC MULTI,http://static.lottedfs.cn/prod/prd-img/43/93/76/00/00/02/20000769343_1.jpg
,10290,20000624907,$110,蔻驰,COACH,L ZIP CARD CASE 卡包 SADDLE/SPORT BLUE,http://static.lottedfs.cn/prod/prd-img/40/93/76/00/00/02/20000769340_1.jpg
,10290,20000624906,$110,蔻驰,COACH,L ZIP CARD CASE 卡包 GREY/SILVER,http://static.lottedfs.cn/prod/prd-img/39/93/76/00/00/02/20000769339_1.jpg
,10290,20000624902,$315,蔻驰,COACH,RIVINGTON CROSS BODY 收纳包 SADDLE/SPORT BLUE,http://static.lottedfs.cn/prod/prd-img/34/93/76/00/00/02/20000769334_1.jpg
