tag,brand_No,product_No,us_price,brand_name_chn,brand_name_eng,product_name,img_url
,18084,20000596592,$319,rouge&lounge,rouge&lounge,ORA FIGO LARGE TOTE BAG 手提包,http://static.lottedfs.cn/prod/prd-img/22/83/71/00/00/02/20000718322_1.png
,18084,20000596590,$287,rouge&lounge,rouge&lounge,UMBERTO ATENA MEDIUM SHOULDER BAG 单肩包,http://static.lottedfs.cn/prod/prd-img/20/83/71/00/00/02/20000718320_1.png
,18084,20000596589,$287,rouge&lounge,rouge&lounge,UMBERTO ATENA MEDIUM SHOULDER BAG 单肩包,http://static.lottedfs.cn/prod/prd-img/19/83/71/00/00/02/20000718319_1.png
,18084,20000596588,$265,rouge&lounge,rouge&lounge,UMBERTO ECLIPSE MEDIUM SHOULDER BAG 单肩包,http://static.lottedfs.cn/prod/prd-img/18/83/71/00/00/02/20000718318_1.png
,18084,20000596587,$322,rouge&lounge,rouge&lounge,BEATRICE GRANADA SMALL SHOULDER BAG 单肩包,http://static.lottedfs.cn/prod/prd-img/17/83/71/00/00/02/20000718317_1.png
,18084,20000594869,$202,rouge&lounge,rouge&lounge,ATENA MOBILE PHONE CASE 手机壳 LIGHT GREEN,http://static.lottedfs.cn/prod/prd-img/48/48/71/00/00/02/20000714848_1.png
,18084,20000594572,$97,rouge&lounge,rouge&lounge,O RING FLAT CARD CASE 卡包,http://static.lottedfs.cn/prod/prd-img/95/41/71/00/00/02/20000714195_1.jpg
畅销,18084,20000593670,$165,rouge&lounge,rouge&lounge,ATENA DEEP GREEN SMARTPHONE CASE 手机壳,http://static.lottedfs.cn/prod/prd-img/90/26/71/00/00/02/20000712690_1.png
,18084,20000593402,$165,rouge&lounge,rouge&lounge,ATHENA MULTI PHONE CASE 手机壳,http://static.lottedfs.cn/prod/prd-img/01/23/71/00/00/02/20000712301_1.jpg
,18084,20000591499,$110,rouge&lounge,rouge&lounge,ATENA NEO SIMPLE SMALL 短款钱包,http://static.lottedfs.cn/prod/prd-img/66/92/70/00/00/02/20000709266_1.png
,18084,20000591491,$97,rouge&lounge,rouge&lounge,FLAT CARD CASE (O RING) 卡包,http://static.lottedfs.cn/prod/prd-img/58/92/70/00/00/02/20000709258_1.jpg
,18084,20000591269,$214,rouge&lounge,rouge&lounge,BRIOSO ATENA MINI SHOULDER BAG 单肩包,http://static.lottedfs.cn/prod/prd-img/88/88/70/00/00/02/20000708888_1.png
,18084,20000591267,$187,rouge&lounge,rouge&lounge,BRIOSO DEEP CROCO MINI SHOULDER BAG 单肩包,http://static.lottedfs.cn/prod/prd-img/86/88/70/00/00/02/20000708886_1.png
,18084,20000591265,$230,rouge&lounge,rouge&lounge,BRIOSO ATENA SMALL SHOULDER BAG 单肩包,http://static.lottedfs.cn/prod/prd-img/84/88/70/00/00/02/20000708884_1.png
,18084,20000591263,$324,rouge&lounge,rouge&lounge,PIENO ATENA SMALL HANDBAG 手提包,http://static.lottedfs.cn/prod/prd-img/82/88/70/00/00/02/20000708882_1.png
,18084,20000591262,$294,rouge&lounge,rouge&lounge,PIENO ATENA SMALL HANDBAG 手提包,http://static.lottedfs.cn/prod/prd-img/81/88/70/00/00/02/20000708881_1.png
,18084,20000591260,$319,rouge&lounge,rouge&lounge,ORA FIGO LARGE TOTE BAG 手提包,http://static.lottedfs.cn/prod/prd-img/79/88/70/00/00/02/20000708879_1.png
,18084,20000591253,$294,rouge&lounge,rouge&lounge,AERIS MILETUS LAMB MEDIUM HANDBAG 手提包,http://static.lottedfs.cn/prod/prd-img/72/88/70/00/00/02/20000708872_1.png
,18084,20000591248,$337,rouge&lounge,rouge&lounge,AERIS MILETUS LAMB LARGE HANDBAG 手提包,http://static.lottedfs.cn/prod/prd-img/67/88/70/00/00/02/20000708867_1.png
,18084,20000591244,$337,rouge&lounge,rouge&lounge,AERIS MILETUS LAMB LARGE HANDBAG 手提包,http://static.lottedfs.cn/prod/prd-img/63/88/70/00/00/02/20000708863_1.png
,18084,20000591242,$319,rouge&lounge,rouge&lounge,LUNA CASH SMALL HANDBAG 手提包,http://static.lottedfs.cn/prod/prd-img/61/88/70/00/00/02/20000708861_1.png
,18084,20000590742,$202,rouge&lounge,rouge&lounge,AMARE ATHENA MINI CROSSBODY BAG 斜挎包,http://static.lottedfs.cn/prod/prd-img/58/77/70/00/00/02/20000707758_1.png
,18084,20000590740,$420,rouge&lounge,rouge&lounge,CARIS ATHENA LARGE HAND BAG 手提包,http://static.lottedfs.cn/prod/prd-img/56/77/70/00/00/02/20000707756_1.png
,18084,20000590739,$324,rouge&lounge,rouge&lounge,PEONY PATCH WORK LAMB BLACK SMALL TOTE BAG 手提包,http://static.lottedfs.cn/prod/prd-img/55/77/70/00/00/02/20000707755_1.png
,18084,20000590738,$324,rouge&lounge,rouge&lounge,PEONY FIGO BLACK SMALL TOTE BAG 手提包,http://static.lottedfs.cn/prod/prd-img/54/77/70/00/00/02/20000707754_1.png
,18084,20000590737,$284,rouge&lounge,rouge&lounge,PEONY FIGO GREY SMALL TOTE BAG 手提包,http://static.lottedfs.cn/prod/prd-img/53/77/70/00/00/02/20000707753_1.png
,18084,20000590736,$244,rouge&lounge,rouge&lounge,TRAMONTO DEEP CROCO MINI ONE HANDLE BAG 单肩包,http://static.lottedfs.cn/prod/prd-img/52/77/70/00/00/02/20000707752_1.png
,18084,20000590728,$263,rouge&lounge,rouge&lounge,TRAMONTO ATHENA MINI ONE HANDLE BAG 单肩包,http://static.lottedfs.cn/prod/prd-img/23/77/70/00/00/02/20000707723_1.png
,18084,20000590726,$265,rouge&lounge,rouge&lounge,LUNA BUFFALO EMBO SMALL TOTE BAG 手提包,http://static.lottedfs.cn/prod/prd-img/21/77/70/00/00/02/20000707721_1.png
,18084,20000590725,$265,rouge&lounge,rouge&lounge,LUNA GOAT EMBO SMALL TOTE BAG 手提包,http://static.lottedfs.cn/prod/prd-img/20/77/70/00/00/02/20000707720_1.png
,18084,20000590723,$367,rouge&lounge,rouge&lounge,LUNA CASH GREEN MEDIUM TOTE BAG 手提包,http://static.lottedfs.cn/prod/prd-img/15/77/70/00/00/02/20000707715_1.png
,18084,20000589347,$203,rouge&lounge,rouge&lounge,TRAMONTO DEEP CROCO MEDIUM HANDBAG 手提包,http://static.lottedfs.cn/prod/prd-img/49/56/70/00/00/02/20000705649_1.png
,18084,20000589339,$203,rouge&lounge,rouge&lounge,TRAMONTO DEEP CROCO MEDIUM ONE HANDLE BAG 手提包,http://static.lottedfs.cn/prod/prd-img/26/56/70/00/00/02/20000705626_1.png
,18084,20000589334,$365,rouge&lounge,rouge&lounge,NEO NOMAD ATENA SMALL HANDBAG 手提包,http://static.lottedfs.cn/prod/prd-img/12/56/70/00/00/02/20000705612_1.png
畅销,18084,20000588208,$281,rouge&lounge,rouge&lounge,BEATRICE LIZARD SMALL TOTE BAG 手提包,http://static.lottedfs.cn/prod/prd-img/97/36/70/00/00/02/20000703697_1.png
,18084,20000587919,$73,rouge&lounge,rouge&lounge,MULTI SMART KEY HOLDER 钥匙包,http://static.lottedfs.cn/prod/prd-img/94/32/70/00/00/02/20000703294_1.png
,18084,20000587918,$73,rouge&lounge,rouge&lounge,STUD BLACK SMART KEY HOLDER 钥匙包,http://static.lottedfs.cn/prod/prd-img/93/32/70/00/00/02/20000703293_1.png
,18084,20000587917,$96,rouge&lounge,rouge&lounge,GOAT EMBOSSED SMALL WALLET 短款钱包,http://static.lottedfs.cn/prod/prd-img/92/32/70/00/00/02/20000703292_1.png
,18084,20000587916,$96,rouge&lounge,rouge&lounge,GOAT EMBOSSED SMALL WALLET 短款钱包,http://static.lottedfs.cn/prod/prd-img/91/32/70/00/00/02/20000703291_1.png
,18084,20000587915,$128,rouge&lounge,rouge&lounge,FIGO SMALL WALLET 短款钱包,http://static.lottedfs.cn/prod/prd-img/90/32/70/00/00/02/20000703290_1.png
,18084,20000587914,$146,rouge&lounge,rouge&lounge,GOAT EMBOSSED MEDIUM WALLET 中款钱包,http://static.lottedfs.cn/prod/prd-img/89/32/70/00/00/02/20000703289_1.png
,18084,20000587913,$123,rouge&lounge,rouge&lounge,GOAT EMBOSSED MEDIUM WALLET 中款钱包,http://static.lottedfs.cn/prod/prd-img/88/32/70/00/00/02/20000703288_1.png
,18084,20000587912,$123,rouge&lounge,rouge&lounge,GOAT EMBOSSED MEDIUM WALLET 中款钱包,http://static.lottedfs.cn/prod/prd-img/87/32/70/00/00/02/20000703287_1.png
,18084,20000587911,$159,rouge&lounge,rouge&lounge,GOAT EMBOSSED LARGE WALLET 长款钱包,http://static.lottedfs.cn/prod/prd-img/86/32/70/00/00/02/20000703286_1.png
,18084,20000587910,$134,rouge&lounge,rouge&lounge,GOAT EMBOSSED LARGE WALLET 长款钱包,http://static.lottedfs.cn/prod/prd-img/85/32/70/00/00/02/20000703285_1.png
,18084,20000587909,$134,rouge&lounge,rouge&lounge,GOAT EMBOSSED LARGE WALLET 长款钱包,http://static.lottedfs.cn/prod/prd-img/84/32/70/00/00/02/20000703284_1.png
,18084,20000587908,$97,rouge&lounge,rouge&lounge,BLACK CARD CASE 卡包,http://static.lottedfs.cn/prod/prd-img/83/32/70/00/00/02/20000703283_1.png
,18084,20000587907,$85,rouge&lounge,rouge&lounge,SILVER CARD CASE 卡包,http://static.lottedfs.cn/prod/prd-img/82/32/70/00/00/02/20000703282_1.png
,18084,20000587509,$202,rouge&lounge,rouge&lounge,ATHENA MULTI HANDPHONE CASE 多功能手机壳,http://static.lottedfs.cn/prod/prd-img/21/26/70/00/00/02/20000702621_1.png
,18084,20000581874,$112,rouge&lounge,rouge&lounge,NEO SLIM SMALL CHAIN GOAT EMBOSSED IVORY 短款钱包,http://static.lottedfs.cn/prod/prd-img/92/32/69/00/00/02/20000693292_1.png
,18084,20000581063,$110,rouge&lounge,rouge&lounge,ATHENA MULTI NEO SIMPLE WALLET 短款钱包,http://static.lottedfs.cn/prod/prd-img/98/16/69/00/00/02/20000691698_1.jpg
,18084,20000581062,$104,rouge&lounge,rouge&lounge,FLAT LARGE CARD CASE 卡包,http://static.lottedfs.cn/prod/prd-img/95/16/69/00/00/02/20000691695_6.png
,18084,20000580962,$177,rouge&lounge,rouge&lounge,MAZIA LIPOSO BLACK MEDIUM SHOPPER BAG 单肩包,http://static.lottedfs.cn/prod/prd-img/33/15/69/00/00/02/20000691533_1.png
,18084,20000580961,$211,rouge&lounge,rouge&lounge,EVA LIPOSO BLACK MEDIUM BACKPACK 背包,http://static.lottedfs.cn/prod/prd-img/32/15/69/00/00/02/20000691532_1.png
,18084,20000580047,$177,rouge&lounge,rouge&lounge,AMARE DEEP CROCO SMALL CROSSBODY BAG 斜挎包,http://static.lottedfs.cn/prod/prd-img/94/01/69/00/00/02/20000690194_1.png
,18084,20000576626,$373,rouge&lounge,rouge&lounge,EVA DOME SCRATCH LAMB MEDIUM BACKPACK 背包,http://static.lottedfs.cn/prod/prd-img/72/52/68/00/00/02/20000685272_1.png
,18084,20000576624,$373,rouge&lounge,rouge&lounge,EVA DOME SCRATCH LAMB MEDIUM BACKPACK 背包,http://static.lottedfs.cn/prod/prd-img/69/52/68/00/00/02/20000685269_1.png
,18084,20000576622,$369,rouge&lounge,rouge&lounge,ATTIVO DOME SCRATCH LAMB MEDIUM BACKPACK 背包,http://static.lottedfs.cn/prod/prd-img/67/52/68/00/00/02/20000685267_1.png
,18084,20000576621,$369,rouge&lounge,rouge&lounge,ATTIVO DOME SCRATCH LAMB MEDIUM BACKPACK 背包,http://static.lottedfs.cn/prod/prd-img/66/52/68/00/00/02/20000685266_1.png
,18084,20000576618,$373,rouge&lounge,rouge&lounge,INTERVALLO SQUARE SCRATCH LAMB LARGE TOTE BAG 手提包,http://static.lottedfs.cn/prod/prd-img/62/52/68/00/00/02/20000685262_1.png
,18084,20000576000,$367,rouge&lounge,rouge&lounge,CAPRI FIGO BLUE LARGE TOTE BAG 手提包,http://static.lottedfs.cn/prod/prd-img/90/42/68/00/00/02/20000684290_1.png
,18084,20000575999,$165,rouge&lounge,rouge&lounge,CASPIER LIGHT BEIGE LONG WALLET 长款钱包,http://static.lottedfs.cn/prod/prd-img/89/42/68/00/00/02/20000684289_1.png
,18084,20000574452,$153,rouge&lounge,rouge&lounge,REAL SNAKE MODERN WALLET 短款钱包,http://static.lottedfs.cn/prod/prd-img/51/20/68/00/00/02/20000682051_1.jpg
,18084,20000563731,$176,rouge&lounge,rouge&lounge,FIGO STUD QUILTING BLACK SMARTPHONE CASE 手机壳,http://static.lottedfs.cn/prod/prd-img/70/74/66/00/00/02/20000667470_1.png
,18084,20000563725,$176,rouge&lounge,rouge&lounge,REAL SNAKE WHITE SMARTPHONE CASE 手机壳,http://static.lottedfs.cn/prod/prd-img/59/74/66/00/00/02/20000667459_1.png
,18084,20000563721,$137,rouge&lounge,rouge&lounge,FIGO STUD QUILTING BLACK CARD CASE 卡包,http://static.lottedfs.cn/prod/prd-img/55/74/66/00/00/02/20000667455_1.png
,18084,20000563712,$420,rouge&lounge,rouge&lounge,CHARIS ATENA GREEN LARGE TOTE BAG 手提包,http://static.lottedfs.cn/prod/prd-img/43/74/66/00/00/02/20000667443_1.png
,18084,20000563711,$526,rouge&lounge,rouge&lounge,CHARIS REAL SNAKE LARGE TOTE BAG 手提包,http://static.lottedfs.cn/prod/prd-img/42/74/66/00/00/02/20000667442_1.png
,18084,20000561449,$176,rouge&lounge,rouge&lounge,ATENA WHITE MOBILE PHONE CASE 手机壳,http://static.lottedfs.cn/prod/prd-img/80/35/66/00/00/02/20000663580_1.png
,18084,20000561446,$137,rouge&lounge,rouge&lounge,ATENA WHITE CARD CASE 卡包,http://static.lottedfs.cn/prod/prd-img/77/35/66/00/00/02/20000663577_1.png
,18084,20000561443,$137,rouge&lounge,rouge&lounge,LUMIERE BLUE CARD CASE 卡包,http://static.lottedfs.cn/prod/prd-img/72/35/66/00/00/02/20000663572_1.png
,18084,20000561438,$214,rouge&lounge,rouge&lounge,BRIOSO DEEP CROAKER NAVY MINI SHOULDER BAG 单肩包,http://static.lottedfs.cn/prod/prd-img/65/35/66/00/00/02/20000663565_1.png
,18084,20000559875,$91,rouge&lounge,rouge&lounge,ATENA DOT CARD WALLET 卡包,http://static.lottedfs.cn/prod/prd-img/00/18/66/00/00/02/20000661800_1.jpg
,18084,20000559712,$300,rouge&lounge,rouge&lounge,RICORDO DEEP CROCO BLACK SMALL TOTE BAG 手提包,http://static.lottedfs.cn/prod/prd-img/65/15/66/00/00/02/20000661565_1.png
,18084,20000559677,$230,rouge&lounge,rouge&lounge,BRIOSO CASPIE LIGHT BEIGE SMALL SHOULDER BAG 单肩包,http://static.lottedfs.cn/prod/prd-img/30/14/66/00/00/02/20000661430_1.png
,18084,20000557372,$383,rouge&lounge,rouge&lounge,BEATRICE GRANADA MATTE BEIGE MEDIUM TOTE BAG 手提包,http://static.lottedfs.cn/prod/prd-img/48/72/65/00/00/02/20000657248_1.png
,18084,20000557368,$322,rouge&lounge,rouge&lounge,BEATRICE GRANADA BEIGE SMALL TOTE BAG 手提包,http://static.lottedfs.cn/prod/prd-img/40/72/65/00/00/02/20000657240_1.png
,18084,20000554847,$395,rouge&lounge,rouge&lounge,DIO ATENA MEDIUM HANDBAG 手提包,http://static.lottedfs.cn/prod/prd-img/27/23/65/00/00/02/20000652327_1.png
,18084,20000548005,$121,rouge&lounge,rouge&lounge,BANDERAS LONG WALLET 长款钱包,http://static.lottedfs.cn/prod/prd-img/95/00/64/00/00/02/20000640095_1.png
,18084,20000547736,$155,rouge&lounge,rouge&lounge,SECRET 18 LARGE LONG WALLET 长款钱包,http://static.lottedfs.cn/prod/prd-img/85/96/63/00/00/02/20000639685_1.png
,18084,20000547732,$134,rouge&lounge,rouge&lounge,NEO SIMPLE LARGE LONG WALLET 长款钱包,http://static.lottedfs.cn/prod/prd-img/75/96/63/00/00/02/20000639675_1.png
,18084,20000547731,$121,rouge&lounge,rouge&lounge,ATENA LONG WALLET 长款钱包,http://static.lottedfs.cn/prod/prd-img/74/96/63/00/00/02/20000639674_1.png
,18084,20000547633,$104,rouge&lounge,rouge&lounge,ATENA LARGE FLAT CARD CASE 卡包,http://static.lottedfs.cn/prod/prd-img/10/95/63/00/00/02/20000639510_1.png
,18084,20000547631,$195,rouge&lounge,rouge&lounge,REAL SNAKE MOBILE PHONE CASE 手机壳,http://static.lottedfs.cn/prod/prd-img/08/95/63/00/00/02/20000639508_1.png
,18084,20000546491,$91,rouge&lounge,rouge&lounge,COCOLUX SPORTS SMALL WALLET 短款钱包,http://static.lottedfs.cn/prod/prd-img/90/75/63/00/00/02/20000637590_1.png
,18084,20000546488,$198,rouge&lounge,rouge&lounge,REAL SNAKE MEDIUM LONG WALLET 长款钱包,http://static.lottedfs.cn/prod/prd-img/85/75/63/00/00/02/20000637585_1.png
,18084,20000546481,$121,rouge&lounge,rouge&lounge,BUFFALO METEOR LONG WALLET 长款钱包,http://static.lottedfs.cn/prod/prd-img/73/75/63/00/00/02/20000637573_1.png
,18084,20000544230,$273,rouge&lounge,rouge&lounge,LINEA COCO SPORTS LUXE MEDIUM TOTE BAG 手提包,http://static.lottedfs.cn/prod/prd-img/43/40/63/00/00/02/20000634043_1.png
,18084,20000542490,$191,rouge&lounge,rouge&lounge,AMARE GRANADA SMALL CROSSBODY BAG 斜挎包,http://static.lottedfs.cn/prod/prd-img/22/15/63/00/00/02/20000631522_1.png
,18084,20000542467,$364,rouge&lounge,rouge&lounge,SPIRITO KOKO RODERICK SMALL TOTE BAG 手提包,http://static.lottedfs.cn/prod/prd-img/83/14/63/00/00/02/20000631483_1.png
,18084,20000542459,$262,rouge&lounge,rouge&lounge,RICORDO SHIMA  SMALL TOTE BAG 手提包,http://static.lottedfs.cn/prod/prd-img/75/14/63/00/00/02/20000631475_1.png
,18084,20000542452,$249,rouge&lounge,rouge&lounge,RICORDO BUFFALO MIDI CLUTCH 手拿包,http://static.lottedfs.cn/prod/prd-img/67/14/63/00/00/02/20000631467_1.png
,18084,20000542441,$411,rouge&lounge,rouge&lounge,LINA REAL SNAKE LARGE TOTE BAG 手提包,http://static.lottedfs.cn/prod/prd-img/55/14/63/00/00/02/20000631455_1.png
畅销,18084,20000542438,$373,rouge&lounge,rouge&lounge,LINA IKARO LARGE TOTE BAG 手提包,http://static.lottedfs.cn/prod/prd-img/52/14/63/00/00/02/20000631452_1.png
,18084,20000542431,$367,rouge&lounge,rouge&lounge,CAPRI REAL SNAKE SMALL TOTE BAG 手提包,http://static.lottedfs.cn/prod/prd-img/45/14/63/00/00/02/20000631445_1.png
,18084,20000542430,$314,rouge&lounge,rouge&lounge,CAPRI DEFENDANT SMALL TOTE BAG 手提包,http://static.lottedfs.cn/prod/prd-img/44/14/63/00/00/02/20000631444_1.png
,18084,20000542429,$287,rouge&lounge,rouge&lounge,CAPRI MESH DENIM  SMALL TOTE BAG 手提包,http://static.lottedfs.cn/prod/prd-img/43/14/63/00/00/02/20000631443_1.png
,18084,20000540623,$176,rouge&lounge,rouge&lounge,LIBERTA FIGO SMALL CROSSBODY BAG 斜挎包,http://static.lottedfs.cn/prod/prd-img/98/83/62/00/00/02/20000628398_1.png
,18084,20000537964,$265,rouge&lounge,rouge&lounge,DIO COCOLUX MINI TOTE BAG 迷你手提包,http://static.lottedfs.cn/prod/prd-img/75/31/62/00/00/02/20000623175_1.png
,18084,20000536945,$265,rouge&lounge,rouge&lounge,UNICO ATENA MEDIUM CROSSBODY BAG 斜挎包,http://static.lottedfs.cn/prod/prd-img/96/10/62/00/00/02/20000621096_1.png
,18084,20000535013,$96,rouge&lounge,rouge&lounge,EPI LARGE WALLET 长款钱包,http://static.lottedfs.cn/prod/prd-img/39/72/61/00/00/02/20000617239_1.png
,18084,20000535009,$104,rouge&lounge,rouge&lounge,CASPIER WALLET 短款钱包,http://static.lottedfs.cn/prod/prd-img/35/72/61/00/00/02/20000617235_1.jpg
,18084,20000535004,$101,rouge&lounge,rouge&lounge,CORONA SMALL WALLET 短款钱包,http://static.lottedfs.cn/prod/prd-img/30/72/61/00/00/02/20000617230_1.jpg
,18084,20000535001,$116,rouge&lounge,rouge&lounge,JEFFREY MEDIUM WALLET 中款钱包,http://static.lottedfs.cn/prod/prd-img/27/72/61/00/00/02/20000617227_1.jpg
,18084,20000534998,$91,rouge&lounge,rouge&lounge,COCO LUX SMALL WALLET 短款钱包,http://static.lottedfs.cn/prod/prd-img/24/72/61/00/00/02/20000617224_1.png
,18084,20000534995,$91,rouge&lounge,rouge&lounge,COCO LUX SMALL WALLET 短款钱包,http://static.lottedfs.cn/prod/prd-img/20/72/61/00/00/02/20000617220_1.png
,18084,20000534990,$191,rouge&lounge,rouge&lounge,SECRET 19 MEDIUM LONG WALLET 长款钱包,http://static.lottedfs.cn/prod/prd-img/13/72/61/00/00/02/20000617213_1.png
,18084,20000534981,$506,rouge&lounge,rouge&lounge,INTERVALLO REAL SNAKE MEDIUM TOTE BAG 手提包,http://static.lottedfs.cn/prod/prd-img/04/72/61/00/00/02/20000617204_1.png
,18084,20000534963,$383,rouge&lounge,rouge&lounge,BEATRICE GRANADA MEDIUM TOTE BAG 手提包,http://static.lottedfs.cn/prod/prd-img/86/71/61/00/00/02/20000617186_1.png
,18084,20000534954,$322,rouge&lounge,rouge&lounge,BEATRICE COCOLUX SMALL TOTE BAG 手提包,http://static.lottedfs.cn/prod/prd-img/70/71/61/00/00/02/20000617170_1.png
,18084,20000534950,$151,rouge&lounge,rouge&lounge,LIBERTA BANDERAS SMALL CROSSBODY BAG 斜挎包,http://static.lottedfs.cn/prod/prd-img/66/71/61/00/00/02/20000617166_1.png
,18084,20000532912,$324,rouge&lounge,rouge&lounge,PIONIERE ATENA SMALL TOTE BAG 手提包,http://static.lottedfs.cn/prod/prd-img/74/36/61/00/00/02/20000613674_1.jpg
,18084,20000532906,$324,rouge&lounge,rouge&lounge,PIONIERE ATENA SMALL TOTE BAG 手提包,http://static.lottedfs.cn/prod/prd-img/59/36/61/00/00/02/20000613659_1.jpg
,18084,20000532900,$392,rouge&lounge,rouge&lounge,EVA SQUARE ATENA SMALL BACKPACK 背包,http://static.lottedfs.cn/prod/prd-img/48/36/61/00/00/02/20000613648_1.jpg
,18084,20000532898,$383,rouge&lounge,rouge&lounge,BACIO ATENA SMALL TOTE BAG 手提包,http://static.lottedfs.cn/prod/prd-img/46/36/61/00/00/02/20000613646_1.jpg
,18084,20000532742,$324,rouge&lounge,rouge&lounge,STRETCH LAMB PIONIERE SMALL HANDBAG 手提包,http://static.lottedfs.cn/prod/prd-img/82/32/61/00/00/02/20000613282_1.jpg
,18084,20000532740,$365,rouge&lounge,rouge&lounge,NEO NOMAD ATHENA SMALL HANDBAG 手提包,http://static.lottedfs.cn/prod/prd-img/80/32/61/00/00/02/20000613280_1.png
,18084,20000531979,$183,rouge&lounge,rouge&lounge,ATENA SLIM XLARGE POUCH 手拿包,http://static.lottedfs.cn/prod/prd-img/92/16/61/00/00/02/20000611692_1.png
,18084,20000531425,$322,rouge&lounge,rouge&lounge,NOMAD MINI HANDBAG 手提包,http://static.lottedfs.cn/prod/prd-img/55/07/61/00/00/02/20000610755_1.jpg
,18084,20000529161,$104,rouge&lounge,rouge&lounge,CASPIER SMALL HALF WALLET 短款钱包,http://static.lottedfs.cn/prod/prd-img/15/70/60/00/00/02/20000607015_1.png
,18084,20000528476,$265,rouge&lounge,rouge&lounge,UNICO MEDIUM CROSSBODY BAG 斜挎包,http://static.lottedfs.cn/prod/prd-img/65/54/60/00/00/02/20000605465_1.jpg
,18084,20000525972,$465,rouge&lounge,rouge&lounge,BIANCO SALVATOR STRETCH LAMB MEDIUM HANDBAG 手提包,http://static.lottedfs.cn/prod/prd-img/21/23/60/00/00/02/20000602321_1.png
,18084,20000525723,$426,rouge&lounge,rouge&lounge,INTERVALLO LARGE HANDBAG 手提包,http://static.lottedfs.cn/prod/prd-img/88/17/60/00/00/02/20000601788_1.jpg
,18084,20000525721,$137,rouge&lounge,rouge&lounge,OSTRICH LARGE WALLET 长款钱包,http://static.lottedfs.cn/prod/prd-img/86/17/60/00/00/02/20000601786_1.png
,18084,20000520530,$121,rouge&lounge,rouge&lounge,OSTRICH SMALL WALLET 短款钱包,http://static.lottedfs.cn/prod/prd-img/26/35/59/00/00/02/20000593526_1.jpg
,18084,20000520529,$58,rouge&lounge,rouge&lounge,SPANGLE STAR CHARM 挂饰,http://static.lottedfs.cn/prod/prd-img/25/35/59/00/00/02/20000593525_1.png
,18084,20000514681,$134,rouge&lounge,rouge&lounge,NEO SIMPLE ATENA WALLET 长款钱包,http://static.lottedfs.cn/prod/prd-img/90/69/58/00/00/02/20000586990_1.jpg
,18084,20000501651,$284,rouge&lounge,rouge&lounge,BIANCO GENUINE LEATHER TOTE BAG 手提包,http://static.lottedfs.cn/prod/prd-img/33/74/56/00/00/02/20000567433_1.png
,18084,20000500596,$336,rouge&lounge,rouge&lounge,PIENO ATENA SMALL ONE HANDLE 手提包,http://static.lottedfs.cn/prod/prd-img/27/57/56/00/00/02/20000565727_1.png
,18084,20000500595,$336,rouge&lounge,rouge&lounge,PIENO ATENA SMALL ONE HANDLE 手提包,http://static.lottedfs.cn/prod/prd-img/26/57/56/00/00/02/20000565726_1.png
,18084,20000500594,$385,rouge&lounge,rouge&lounge,EMILIO STRETCH LAMB SMALL SHOULDER BAG 单肩包,http://static.lottedfs.cn/prod/prd-img/25/57/56/00/00/02/20000565725_1.png
,18084,20000500591,$353,rouge&lounge,rouge&lounge,CAPRI GAIA MEDIUM SHOULDER BAG 单肩包,http://static.lottedfs.cn/prod/prd-img/22/57/56/00/00/02/20000565722_1.png
,18084,20000500589,$383,rouge&lounge,rouge&lounge,BACIO ATENA MEDIUM CROSSBODY BAG 斜挎包,http://static.lottedfs.cn/prod/prd-img/20/57/56/00/00/02/20000565720_1.png
,18084,20000494643,$97,rouge&lounge,rouge&lounge,O RING FLAT CARD CASE  卡包,http://static.lottedfs.cn/prod/prd-img/03/63/55/00/00/02/20000556303_1.jpg
,18084,20000484168,$322,rouge&lounge,rouge&lounge,NOMAD SQUARE DOT MINI HANDBAG 手提包,http://static.lottedfs.cn/prod/prd-img/13/84/53/00/00/02/20000538413_1.jpg
,18084,20000479240,$134,rouge&lounge,rouge&lounge,NEO SIMPLE ATENA MULTI LARGE WALLET 长款钱包,http://static.lottedfs.cn/prod/prd-img/86/04/53/00/00/02/20000530486_1.jpg
,18084,20000434847,$395,rouge&lounge,rouge&lounge,DIO MEDIUM HAND BAG  手提包,http://static.lottedfs.cn/prod/prd-img/88/33/46/00/00/02/20000463388_8.jpg
,18084,20000425415,$134,rouge&lounge,rouge&lounge,DEEP CROCO NEO SIMPLE LONG WALLET  长款钱包,http://static.lottedfs.cn/prod/prd-img/51/84/44/00/00/02/20000448451_6.jpg
,18084,20000424213,$426,rouge&lounge,rouge&lounge,EVA ATENA MEDIUM BACKPACK 背包,http://static.lottedfs.cn/prod/prd-img/96/66/44/00/00/02/20000446696_7.jpg
,18084,20000424204,$244,rouge&lounge,rouge&lounge,LIBERTA LAMB CLUTCH 手包,http://static.lottedfs.cn/prod/prd-img/87/66/44/00/00/02/20000446687_6.jpg
,18084,20000414570,$116,rouge&lounge,rouge&lounge,JEFFEEY DETACHABLE HALF WALLET 短款钱包,http://static.lottedfs.cn/prod/prd-img/29/38/43/00/00/02/20000433829_6.jpg
畅销,18084,20000413929,$88,rouge&lounge,rouge&lounge,DEEP CROCO WASHING SMALL HALF WALLET 男士短款钱包,http://static.lottedfs.cn/prod/prd-img/23/30/43/00/00/02/20000433023_6.jpg
畅销,18084,20000371204,$88,rouge&lounge,rouge&lounge,DEEP CROCO SMALL HALF WALLET 短款钱包,http://static.lottedfs.cn/prod/prd-img/05/18/38/00/00/02/20000381805_1.jpg
,18084,10003211335,$426,rouge&lounge,rouge&lounge,DIO L COCO LUXE BLACK  手提包,http://static.lottedfs.cn/prod/prd-img/35/13/21/03/00/01/10003211335_1.jpg
,18084,20000591251,$294,rouge&lounge,rouge&lounge,AERIS MILETUS LAMB MEDIUM HANDBAG 手提包,http://static.lottedfs.cn/prod/prd-img/70/88/70/00/00/02/20000708870_1.png
