tag,brand_No,product_No,us_price,brand_name_chn,brand_name_eng,product_name,img_url
,19939,20000609984,$182,ROSA.K,ROSA.K,CABAS MONOGRAM TOTE M_CAMEL RTSFBV688CM 手提包,http://static.lottedfs.cn/prod/prd-img/85/49/74/00/00/02/20000744985_1.jpg
,19939,20000605514,$169,ROSA.K,ROSA.K,CABAS MONOGRAM TOTE S_CAMEL RTSFBV689CM 手提包,http://static.lottedfs.cn/prod/prd-img/31/73/73/00/00/02/20000737331_1.jpg
,19939,20000605510,$203,ROSA.K,ROSA.K,CABAS MONOGRAM TOTE N/S_CAMEL RTSFBV687CM 手提包,http://static.lottedfs.cn/prod/prd-img/18/73/73/00/00/02/20000737318_1.jpg
新品,19939,20000636445,$121,ROSA.K,ROSA.K,CABAS MONOGRAM TOTE XS_RED RTSFBV684RD 手提包,http://static.lottedfs.cn/prod/prd-img/43/57/78/00/00/02/20000785743_2.jpg
,19939,20000628790,$203,ROSA.K,ROSA.K,DOMINO BUCKET BAG CAMEL RSSFBC673CM 手提包,http://static.lottedfs.cn/prod/prd-img/44/49/77/00/00/02/20000774944_1.jpg
,19939,20000611572,$169,ROSA.K,ROSA.K,CABAS MONOGRAM TOTE S_SKYBLUE RTSFBV689SU 手提包,http://static.lottedfs.cn/prod/prd-img/47/81/74/00/00/02/20000748147_1.jpg
,19939,20000495400,$113,ROSA.K,ROSA.K,POOKEY SMILE_MIRROR DARK SILVER RMRSBY102MK 单肩包,http://static.lottedfs.cn/prod/prd-img/32/75/55/00/00/02/20000557532_2.jpg
,19939,20000637780,$121,ROSA.K,ROSA.K,CABAS MONOGRAM TOTE XS_BLACK RTSFBV684BK 手提包,http://static.lottedfs.cn/prod/prd-img/95/76/78/00/00/02/20000787695_2.jpg
,19939,20000637779,$121,ROSA.K,ROSA.K,CABAS MONOGRAM TOTE XS_YELLOW RTSFBV684YL 手提包,http://static.lottedfs.cn/prod/prd-img/94/76/78/00/00/02/20000787694_2.jpg
,19939,20000628806,$209,ROSA.K,ROSA.K,ROLLY MINI SADDLE SECRET BLACK RSSFBC581SK 斜挎包,http://static.lottedfs.cn/prod/prd-img/65/49/77/00/00/02/20000774965_1.jpg
,19939,20000628799,$169,ROSA.K,ROSA.K,DOMINO CROSSBODY BAG CAMEL RRSFBC674CM 斜挎包,http://static.lottedfs.cn/prod/prd-img/57/49/77/00/00/02/20000774957_1.jpg
,19939,20000612280,$189,ROSA.K,ROSA.K,JUDE MONOGRAM CROSS BAG CAMEL RRSFBV695CM 斜挎包,http://static.lottedfs.cn/prod/prd-img/13/93/74/00/00/02/20000749313_1.jpg
,19939,20000612259,$121,ROSA.K,ROSA.K,CABAS MONOGRAM CLUTCH BLACK RCSFBV694BK 手包,http://static.lottedfs.cn/prod/prd-img/86/92/74/00/00/02/20000749286_1.jpg
,19939,20000605478,$154,ROSA.K,ROSA.K,NEW MONEYBAG TOTE S URBAN_CAMEL RTSSBC555CM 手提包,http://static.lottedfs.cn/prod/prd-img/10/72/73/00/00/02/20000737210_1.jpg
,19939,20000605439,$154,ROSA.K,ROSA.K,NEW MONEYBAG TOTE S URBAN_LIGHT GRAY RTSSBC555LG 手提包,http://static.lottedfs.cn/prod/prd-img/90/70/73/00/00/02/20000737090_1.jpg
,19939,20000591538,$95,ROSA.K,ROSA.K,MERCI CANVAS TOTE BAG_YELLOW RTSFBF686YL 手提包,http://static.lottedfs.cn/prod/prd-img/10/93/70/00/00/02/20000709310_1.jpg
,19939,20000424305,$280,ROSA.K,ROSA.K,PRAHA MINI HOCKNY_GREEN RSPFBC114GR 手提包,http://static.lottedfs.cn/prod/prd-img/26/68/44/00/00/02/20000446826_1.jpg
,19939,20000637809,$223,ROSA.K,ROSA.K,OH MY Q FLAP CROSSBODY_MAROON RRSFBC024RM 斜挎包,http://static.lottedfs.cn/prod/prd-img/30/77/78/00/00/02/20000787730_1.jpg
,19939,20000637801,$223,ROSA.K,ROSA.K,OH MY Q FLAP CROSSBODY_BLACK RRSFBC024BK 斜挎包,http://static.lottedfs.cn/prod/prd-img/15/77/78/00/00/02/20000787715_1.jpg
,19939,20000637797,$135,ROSA.K,ROSA.K,CABAS TOTE XS_BLACK RTSFBC683BK 手提包,http://static.lottedfs.cn/prod/prd-img/11/77/78/00/00/02/20000787711_2.jpg
,19939,20000628793,$169,ROSA.K,ROSA.K,DOMINO CROSSBODY BAG BLACK RRSFBC674BK 斜挎包,http://static.lottedfs.cn/prod/prd-img/47/49/77/00/00/02/20000774947_1.jpg
,19939,20000628787,$203,ROSA.K,ROSA.K,DOMINO BUCKET BAG BLACK RSSFBC673BK 手提包,http://static.lottedfs.cn/prod/prd-img/41/49/77/00/00/02/20000774941_1.jpg
,19939,20000628781,$223,ROSA.K,ROSA.K,DOMINO TOTE M CAMEL RTSFBC672CM 手提包,http://static.lottedfs.cn/prod/prd-img/34/49/77/00/00/02/20000774934_1.jpg
,19939,20000628778,$223,ROSA.K,ROSA.K,DOMINO TOTE M BLACK RTSFBC672BK 手提包,http://static.lottedfs.cn/prod/prd-img/30/49/77/00/00/02/20000774930_1.jpg
,19939,20000628775,$244,ROSA.K,ROSA.K,DOMINO TOTE N/S CAMEL RTSFBC671CM 手提包,http://static.lottedfs.cn/prod/prd-img/27/49/77/00/00/02/20000774927_1.jpg
,19939,20000628769,$244,ROSA.K,ROSA.K,DOMINO TOTE N/S BLACK RTSFBC671BK 手提包,http://static.lottedfs.cn/prod/prd-img/18/49/77/00/00/02/20000774918_1.jpg
,19939,20000628762,$196,ROSA.K,ROSA.K,JOUR FLAP CROSS PINK BEIGE RRSFBC681KE 斜挎包,http://static.lottedfs.cn/prod/prd-img/06/49/77/00/00/02/20000774906_1.jpg
,19939,20000628758,$196,ROSA.K,ROSA.K,JOUR FLAP CROSS RED RRSFBC681RD 斜挎包,http://static.lottedfs.cn/prod/prd-img/98/48/77/00/00/02/20000774898_1.jpg
,19939,20000628576,$196,ROSA.K,ROSA.K,JOUR FLAP CROSS BLACK RRSFBC681BK 斜挎包,http://static.lottedfs.cn/prod/prd-img/62/46/77/00/00/02/20000774662_1.jpg
,19939,20000628574,$203,ROSA.K,ROSA.K,POOKEY IRENE BLACK RMRSBC111BK_A 手提包,http://static.lottedfs.cn/prod/prd-img/60/46/77/00/00/02/20000774660_1.jpg
,19939,20000620541,$209,ROSA.K,ROSA.K,ROLLY MINI SADDLE 斜挎包 CAMEL RSSFBC581CM,http://static.lottedfs.cn/prod/prd-img/76/24/76/00/00/02/20000762476_1.jpg
,19939,20000620518,$223,ROSA.K,ROSA.K,AMI FLAP SHOULDER 单肩包 MULTI RSSFBC023MI,http://static.lottedfs.cn/prod/prd-img/43/24/76/00/00/02/20000762443_1.jpg
,19939,20000620489,$251,ROSA.K,ROSA.K,AMI FLAP TOTE S 手提包 CAMEL,http://static.lottedfs.cn/prod/prd-img/05/24/76/00/00/02/20000762405_1.jpg
,19939,20000620486,$251,ROSA.K,ROSA.K,AMI FLAP TOTE S 手提包 BLACK,http://static.lottedfs.cn/prod/prd-img/02/24/76/00/00/02/20000762402_1.jpg
,19939,20000620485,$271,ROSA.K,ROSA.K,ARMY FLAP TOTE M 手提包 DARK GRAY,http://static.lottedfs.cn/prod/prd-img/01/24/76/00/00/02/20000762401_1.jpg
,19939,20000620435,$271,ROSA.K,ROSA.K,AMI FLAP TOTE M 手提包 CAMEL,http://static.lottedfs.cn/prod/prd-img/12/23/76/00/00/02/20000762312_1.jpg
,19939,20000620427,$271,ROSA.K,ROSA.K,AMI FLAP TOTE M 手提包 BLACK,http://static.lottedfs.cn/prod/prd-img/96/22/76/00/00/02/20000762296_1.jpg
,19939,20000612818,$223,ROSA.K,ROSA.K,AMI FLAP SHOULDER_RED RSSFBC022RD 单肩包,http://static.lottedfs.cn/prod/prd-img/53/04/75/00/00/02/20000750453_1.jpg
,19939,20000612817,$223,ROSA.K,ROSA.K,AMI FLAP SHOULDER_CAMEL RSSFBC021CM 单肩包,http://static.lottedfs.cn/prod/prd-img/52/04/75/00/00/02/20000750452_1.jpg
,19939,20000612816,$223,ROSA.K,ROSA.K,AMI FLAP SHOULDER_BLACK RSSFBC021BK 单肩包,http://static.lottedfs.cn/prod/prd-img/51/04/75/00/00/02/20000750451_1.jpg
,19939,20000612814,$203,ROSA.K,ROSA.K,AMI MONOGRAM FLAP TOTE S CAMEL RTSFBV693CM 手提包,http://static.lottedfs.cn/prod/prd-img/49/04/75/00/00/02/20000750449_1.jpg
,19939,20000612788,$203,ROSA.K,ROSA.K,AMI MONOGRAM FLAP TOTE S BLACK RTSFBV693BK 手提包,http://static.lottedfs.cn/prod/prd-img/03/04/75/00/00/02/20000750403_1.jpg
,19939,20000612650,$189,ROSA.K,ROSA.K,AMI MONOGRAM FLAP SHOULDER BLACK RSSFBV691BK 单肩包,http://static.lottedfs.cn/prod/prd-img/95/99/74/00/00/02/20000749995_1.jpg
,19939,20000612284,$189,ROSA.K,ROSA.K,JUDE MONOGRAM CROSS BAG RED RRSFBV695RD 斜挎包,http://static.lottedfs.cn/prod/prd-img/17/93/74/00/00/02/20000749317_1.jpg
,19939,20000612270,$121,ROSA.K,ROSA.K,CABAS MONOGRAM CLUTCH GREEN RCSFBV694GR  手包,http://static.lottedfs.cn/prod/prd-img/97/92/74/00/00/02/20000749297_1.jpg
,19939,20000612264,$121,ROSA.K,ROSA.K,CABAS MONOGRAM CLUTCH YELLOW RCSFBV694YL 手包,http://static.lottedfs.cn/prod/prd-img/91/92/74/00/00/02/20000749291_1.jpg
,19939,20000612254,$121,ROSA.K,ROSA.K,CABAS MONOGRAM CLUTCH CAMEL RCSFBV694CM 手包,http://static.lottedfs.cn/prod/prd-img/81/92/74/00/00/02/20000749281_1.jpg
,19939,20000612251,$189,ROSA.K,ROSA.K,AMI MONOGRAM FLAP SHOULDER RED RSSFBV691RD 单肩包,http://static.lottedfs.cn/prod/prd-img/69/92/74/00/00/02/20000749269_1.jpg
,19939,20000609979,$182,ROSA.K,ROSA.K,CABAS MONOGRAM TOTE M_SKY BLUE RTSFBV688SU 手提包,http://static.lottedfs.cn/prod/prd-img/65/49/74/00/00/02/20000744965_1.jpg
,19939,20000605505,$154,ROSA.K,ROSA.K,NEW MONEYBAG TOTE S CLASSIC_BLACK RTSSBC556BK 手提包,http://static.lottedfs.cn/prod/prd-img/95/72/73/00/00/02/20000737295_1.jpg
,19939,20000605498,$154,ROSA.K,ROSA.K,NEW MONEYBAG TOTE S CLASSIC_REAL LRED RTSSBC556RR 手提包,http://static.lottedfs.cn/prod/prd-img/51/72/73/00/00/02/20000737251_1.jpg
,19939,20000605430,$154,ROSA.K,ROSA.K,NEW MONEY BAG TOTE S_DARK NAVY RTSSBC554DN 手提包,http://static.lottedfs.cn/prod/prd-img/57/70/73/00/00/02/20000737057_1.jpg
,19939,20000591534,$95,ROSA.K,ROSA.K,MERCI CANVAS TOTE BAG_RED RTSFBF686RD 手提包,http://static.lottedfs.cn/prod/prd-img/06/93/70/00/00/02/20000709306_1.jpg
,19939,20000591111,$154,ROSA.K,ROSA.K,MONEYBAG TOTE S CLASSIC_IVORY RTSSBC556IV 手提包,http://static.lottedfs.cn/prod/prd-img/39/86/70/00/00/02/20000708639_1.jpg
,19939,20000591105,$154,ROSA.K,ROSA.K,MONEYBAG TOTE S URBAN_LIGHT PINK RTSSBC555LP 手提包,http://static.lottedfs.cn/prod/prd-img/36/86/70/00/00/02/20000708636_1.jpg
,19939,20000580135,$259,ROSA.K,ROSA.K,MONEY BAG TOTE M BLACK RTSSBC564BK 手提包,http://static.lottedfs.cn/prod/prd-img/97/02/69/00/00/02/20000690297_1.jpg
,19939,20000580123,$178,ROSA.K,ROSA.K,ROXANNE DRAWSTRING_BLACK RSRFBC571BK 手提包,http://static.lottedfs.cn/prod/prd-img/85/02/69/00/00/02/20000690285_1.jpg
,19939,20000496450,$209,ROSA.K,ROSA.K,ROLLY MINI SADDLE_WINE RSRFBC581WN 单肩包,http://static.lottedfs.cn/prod/prd-img/12/91/55/00/00/02/20000559112_2.jpg
,19939,20000496448,$209,ROSA.K,ROSA.K,ROLLY MINI SADDLE_BLACK RSRFBC581BK 单肩包,http://static.lottedfs.cn/prod/prd-img/10/91/55/00/00/02/20000559110_2.jpg
,19939,20000496432,$178,ROSA.K,ROSA.K,ROXANNE DRAW STRING_RED(RSRFBC571RD 单肩包,http://static.lottedfs.cn/prod/prd-img/92/90/55/00/00/02/20000559092_2.jpg
,19939,20000496426,$178,ROSA.K,ROSA.K,ROXANNE DRAW STRING_BROWN (RSRFBC571BR) 单肩包,http://static.lottedfs.cn/prod/prd-img/82/90/55/00/00/02/20000559082_2.jpg
,19939,20000496357,$237,ROSA.K,ROSA.K,MY RIBBON MINI SHOULDER BAG_PINK BEIGE (RSRFBC162KE) 单肩包,http://static.lottedfs.cn/prod/prd-img/95/89/55/00/00/02/20000558995_9.jpg
,19939,20000496349,$159,ROSA.K,ROSA.K,HARNESS FLAP CROSSBODY S_RRRFBC179DW   单肩包  DOLCE WINE,http://static.lottedfs.cn/prod/prd-img/81/89/55/00/00/02/20000558981_2.jpg
,19939,20000495398,$113,ROSA.K,ROSA.K,POOKEY SMILE_MIRROR CHAMPAGNE GOLD RMRSBY102MC 单肩包,http://static.lottedfs.cn/prod/prd-img/30/75/55/00/00/02/20000557530_2.jpg
,19939,20000495397,$113,ROSA.K,ROSA.K,POOKEY SMILE_MIRROR GOLD RMRSBY102MD 单肩包,http://static.lottedfs.cn/prod/prd-img/29/75/55/00/00/02/20000557529_2.jpg
,19939,20000495390,$113,ROSA.K,ROSA.K,POOKEY SMILE_MIRROR SILVER RMRSBY102MS 单肩包,http://static.lottedfs.cn/prod/prd-img/18/75/55/00/00/02/20000557518_2.jpg
,19939,20000425745,$237,ROSA.K,ROSA.K,MY RIBBON MINI SHOULDER BAG RSQSBC162BK 单肩包 BLACK,http://static.lottedfs.cn/prod/prd-img/33/89/44/00/00/02/20000448933_8.jpg
,19939,20000424612,$237,ROSA.K,ROSA.K,MY RIBBON MINI SHOULDERBAG RSQSBC162RD  单肩包 RED,http://static.lottedfs.cn/prod/prd-img/73/72/44/00/00/02/20000447273_9.jpg
,19939,20000424505,$159,ROSA.K,ROSA.K,HARNESS FLAP CROSS S_BLACK  RSQFBC179BK 单肩包,http://static.lottedfs.cn/prod/prd-img/32/71/44/00/00/02/20000447132_1.jpg
,19939,20000424227,$190,ROSA.K,ROSA.K,POOKY HOCKNEY_RSPFBC105GR 手提包 GREEN,http://static.lottedfs.cn/prod/prd-img/10/67/44/00/00/02/20000446710_8.jpg
,19939,20000424220,$172,ROSA.K,ROSA.K,POOKEY GLOSSY IVIZA BLACK   手提包,http://static.lottedfs.cn/prod/prd-img/03/67/44/00/00/02/20000446703_9.jpg
,19939,20000424194,$237,ROSA.K,ROSA.K,MY RIBBON MINI SHOULDER BAG RSQFBC162CM  单肩包 CARMEL,http://static.lottedfs.cn/prod/prd-img/77/66/44/00/00/02/20000446677_9.jpg
,19939,10003199258,$172,ROSA.K,ROSA.K,POOKEY GLOSSY RSPFBC101XD  单肩包  BORDO RED,http://static.lottedfs.cn/prod/prd-img/58/92/19/03/00/01/10003199258_1.jpg
