tag,brand_No,product_No,us_price,brand_name_chn,brand_name_eng,product_name,img_url
赠品,1002787,20000599792,$24,INGLOT,INGLOT,INGLOT FREEDOM SYSTEM HD SCULPTING POWDER 修容粉 505号,http://static.lottedfs.cn/prod/prd-img/90/54/72/00/00/02/20000725490_1.jpg
赠品,1002787,20000599780,$21,INGLOT,INGLOT,INGLOT AMC LIP PENCIL MATTE MATT WITH SHARPENER 口红笔,http://static.lottedfs.cn/prod/prd-img/73/54/72/00/00/02/20000725473_1.jpg
赠品,1002787,20000599746,$24,INGLOT,INGLOT,INGLOT LIPSTICK MATTE 口红,http://static.lottedfs.cn/prod/prd-img/32/53/72/00/00/02/20000725332_2.jpg
乐天专售 赠品,1002787,20000600681,$57,INGLOT,INGLOT,"INGLOT RAINBOW EYE SHADOW SET 眼影盘 [123,124,131]",http://static.lottedfs.cn/prod/prd-img/73/70/72/00/00/02/20000727073_1.jpg
乐天专售 赠品,1002787,20000621459,$40,INGLOT,INGLOT,INGLOT FREEDOM SYSTEM HD SCULPTING POWDER 修容粉 505 DUO,http://static.lottedfs.cn/prod/prd-img/44/43/76/00/00/02/20000764344_1.jpg
赠品,1002787,20000600701,$71,INGLOT,INGLOT,"INGLOT PERFECT EYES KIT: PIGMENT 123, DURALINE, GLITTER APPLICATOR 45S 眼部彩妆套装",http://static.lottedfs.cn/prod/prd-img/21/71/72/00/00/02/20000727121_1.jpg
赠品,1002787,20000600700,$71,INGLOT,INGLOT,"INGLOT PERFECT EYES KIT: PIGMENT 86, DURALINE, GLITTER APPLICATOR 45S 眼部彩妆套装",http://static.lottedfs.cn/prod/prd-img/20/71/72/00/00/02/20000727120_1.jpg
赠品,1002787,20000600699,$71,INGLOT,INGLOT,"INGLOT PERFECT EYES KIT: PIGMENT 50, DURALINE, GLITTER APPLICATOR 45S 眼部彩妆套装",http://static.lottedfs.cn/prod/prd-img/19/71/72/00/00/02/20000727119_1.jpg
赠品,1002787,20000600688,$84,INGLOT,INGLOT,"INGLOT AMC PURE PIGMENT TRIO 眼影套装 [50,86,123]",http://static.lottedfs.cn/prod/prd-img/87/70/72/00/00/02/20000727087_1.jpg
乐天专售 赠品,1002787,20000600677,$53,INGLOT,INGLOT,"INGLOT EYESHADOW MATTE SET 眼影盘 [295,303,319]",http://static.lottedfs.cn/prod/prd-img/69/70/72/00/00/02/20000727069_1.jpg
赠品,1002787,20000600670,$10,INGLOT,INGLOT,INGLOT FREEDOM SYSTEM PALETTE EYE SHADOW 眼影空盘 [3] SQUARE / MIRROR,http://static.lottedfs.cn/prod/prd-img/58/70/72/00/00/02/20000727058_1.jpg
赠品,1002787,20000600663,$9,INGLOT,INGLOT,INGLOT FREEDOM SYSTEM PALETTE EYE SHADOW 眼影空盘 [2] SQUARE / MIRROR,http://static.lottedfs.cn/prod/prd-img/50/70/72/00/00/02/20000727050_1.jpg
赠品,1002787,20000600657,$19,INGLOT,INGLOT,INGLOT DURALINE,http://static.lottedfs.cn/prod/prd-img/45/70/72/00/00/02/20000727045_1.jpg
乐天专售 赠品,1002787,20000600132,$62,INGLOT,INGLOT,"INGLOT AMC LIP PENCIL MATTE WITH SHARPENER SET 口红笔套装 [19,20,21]",http://static.lottedfs.cn/prod/prd-img/46/63/72/00/00/02/20000726346_3.jpg
乐天专售 赠品,1002787,20000600129,$48,INGLOT,INGLOT,"INGLOT LIPSTICK MATTE SET 口红套装 B [409,445]",http://static.lottedfs.cn/prod/prd-img/42/63/72/00/00/02/20000726342_3.jpg
乐天专售 赠品,1002787,20000600123,$48,INGLOT,INGLOT,"INGLOT LIPSTICK MATTE SET 口红套装 A [405,429]",http://static.lottedfs.cn/prod/prd-img/35/63/72/00/00/02/20000726335_3.jpg
赠品,1002787,20000600117,$16,INGLOT,INGLOT,INGLOT FREEDOM SYSTEM PALETTE BLUSH[1] BRUSH/MIRROR,http://static.lottedfs.cn/prod/prd-img/26/63/72/00/00/02/20000726326_1.jpg
赠品,1002787,20000600097,$7,INGLOT,INGLOT,INGLOT FREEDOM SYSTEM PALETTE EYE SHADOW [1]SQUARE/MIRROR,http://static.lottedfs.cn/prod/prd-img/91/62/72/00/00/02/20000726291_1.jpg
赠品,1002787,20000599884,$28,INGLOT,INGLOT,INGLOT AMC PURE PIGMENT EYE SHADOW 眼影,http://static.lottedfs.cn/prod/prd-img/91/57/72/00/00/02/20000725791_1.jpg
赠品,1002787,20000599869,$41,INGLOT,INGLOT,INGLOT HD PERFECT COVER UP FOUNDATION 粉底液,http://static.lottedfs.cn/prod/prd-img/20/57/72/00/00/02/20000725720_1.jpg
赠品,1002787,20000599862,$34,INGLOT,INGLOT,INGLOT SOFT SPARKLER FEB HIGHLIGHTER 高光 53号,http://static.lottedfs.cn/prod/prd-img/05/57/72/00/00/02/20000725705_1.jpg
赠品,1002787,20000599842,$29,INGLOT,INGLOT,INGLOT INTENSE SPARKLER FEB HIGHLIGHTER 高光 14号,http://static.lottedfs.cn/prod/prd-img/12/56/72/00/00/02/20000725612_1.jpg
赠品,1002787,20000599820,$19,INGLOT,INGLOT,INGLOT FREEDOM SYSTEM EYESHADOW RAINBOW 眼影替换装,http://static.lottedfs.cn/prod/prd-img/39/55/72/00/00/02/20000725539_1.jpg
赠品,1002787,20000599808,$18,INGLOT,INGLOT,INGLOT FREEDOM SYSTEM EYESHADOW MATTE NF 眼影替换装,http://static.lottedfs.cn/prod/prd-img/23/55/72/00/00/02/20000725523_1.jpg
赠品,1002787,20000596716,$28,INGLOT,INGLOT,INGLOT HD LIP TINT MATTE 染唇液,http://static.lottedfs.cn/prod/prd-img/40/85/71/00/00/02/20000718540_1.jpg
赠品,1002787,20000599856,$30,INGLOT,INGLOT,INGLOT MEDIUM SPARKLER FEB HIGHLIGHTER 高光 31号,http://static.lottedfs.cn/prod/prd-img/91/56/72/00/00/02/20000725691_1.jpg
